date,ceo,company,positive_articles,neutral_articles,negative_articles,total,neg_pct,theme,alias
2026-03-07,Monica Tibbits-Nutt,Massachusetts Bay Transportation Authority,9,31,13,53,24.5,,Monica Tibbits-Nutt Massachusetts Bay Transportation Authority
2026-03-07,Phillip Eng,Massachusetts Bay Transportation Authority,9,36,5,50,10.0,,Phillip Eng Massachusetts Bay Transportation Authority
2026-03-07,Ryan Coholan,Massachusetts Bay Transportation Authority,12,32,7,51,13.7,,Ryan Coholan Massachusetts Bay Transportation Authority
2026-03-07,Randy Clarke,Washington Metropolitan Area Transit Authority,21,30,9,60,15.0,,Randy Clarke Washington Metropolitan Area Transit Authority
2026-03-07,Janno Lieber,MTA,6,39,15,60,25.0,,Janno Lieber MTA
2026-03-07,Nora Leerhsen,Chicago Transit Authority,14,18,14,46,30.4,,Nora Leerhsen Chicago Transit Authority
