date,company,title,url,position,snippet,sentiment,controlled
2025-11-07,MTA,MTA: Home,https://www.mta.info/,1,Metro-North Railroad Metro-North Railroad · Harlem. On or Close · Wassaic. On or Close · Hudson. On or Close · New Haven. Some Delays · Danbury. On or Close.,positive,True
2025-11-07,MTA,Maryland Transit Administration,https://www.mta.maryland.gov/,2,Routes & Schedules · Real Time · Service Alerts (5) · Human Trafficking GET HELP · Customer Service Promise · Help Stop Fraud in State Government. The Maryland ...,positive,True
2025-11-07,MTA,Metropolitan Transportation Authority,https://en.wikipedia.org/wiki/Metropolitan_Transportation_Authority,3,"The Metropolitan Transportation Authority (MTA) provides local and express bus, subway, and commuter rail service in Greater New York, and operates multiple ...",neutral,False
2025-11-07,MTA,Massachusetts Teachers Association,https://www.massteacher.org/,4,"The Massachusetts Teachers Association is a member-driven organization, governed by democratic principles, that accepts and supports the interdependence of ...",neutral,False
2025-11-07,MTA,Metropolitan Transportation Authority Careers - MTA,https://careers.mta.org/,5,"The MTA family includes professionals in a variety of positions, from bus and train operators to engineers, accountants, and policy experts. We offer tremendous ...",positive,True
2025-11-07,MTA,"MTA Flint | Mass Transportation Authority in Flint, MIMTA Flint",https://www.mtaflint.org/,6,14 fixed routes throughout the City of Flint with routes and schedules. Regional Routes Direct round-trip connection to places outside of Genesee County.,positive,True
2025-11-07,DC Metro,WMATA: Home,https://www.wmata.com/,1,Rail · Bus · MetroAccess · Elevators and Escalators · Upcoming Track Work · Service Plans & Reports · Status and Alerts · Bikes · Parking ...,positive,True
2025-11-07,DC Metro,"Navigating Washington, DC's Metro System",https://washington.org/navigating-dc-metro,2,"Find out everything you need to know to ride DC's world-class Metrorail system, get a Metro map, check operating hours, ride fares and more.",neutral,False
2025-11-07,DC Metro,Washington Metro,https://en.wikipedia.org/wiki/Washington_Metro,3,a rapid transit system serving the Washington metropolitan area of the United States. It is administered by the Washington Metropolitan Area Transit Authority ...,neutral,False
2025-11-07,DC Metro,Washington Metro • WMATA (@metroforward),https://www.instagram.com/metroforward/?hl=en,4,Official feed of Metro/WMATA Tag us during your trip #wmata · Knowing how to use public transit is most def the flex you think it is! · Check out this ...,positive,True
2025-11-07,OMNY,OMNY,https://omny.info/,1,One secure account to manage your travel · Reload your OMNY card · Track progress toward your 7-day fare cap · Manage your travel cards · Contact customer ...,positive,True
2025-11-07,OMNY,Tap and ride to pay your fare,https://www.mta.info/fares-tolls/subway-bus/tap-and-ride,2,"You can buy or reload an OMNY Card at vending machines in any subway station. As a limited-time introductory offer, you can buy a new reloadable card for $1.",positive,True
2025-11-07,OMNY,Enterprise podcasting made simple with Omny Studio,https://omnystudio.com/,3,"Omny Studio is a powerful audio management solution for podcasting, offering podcast hosting, radio capture, publishing, editing, monetization, and analytics.",positive,True
2025-11-07,OMNY,OMNY,https://en.wikipedia.org/wiki/OMNY,4,"OMNY is a contactless fare payment system, currently being implemented for use on public transit in the New York metropolitan area. OMNY can currently be ...",neutral,False
2025-11-07,OMNY,OMNY Health: EHR Data and Analytics,https://omnyhealth.com/,5,OMNY Health™ is a healthcare ecosystem creating partnerships that drive patient care by harnessing real-world data & EHR data and analytics.,positive,True
2025-11-07,OMNY,Omny and metrocard options for tourists in New York City,https://www.facebook.com/groups/newyorktraveltipsadviceandinspiration/posts/1771406497074532/,6,"OMNY is the system the NY Metro uses and allows you to pre-register your credit card and just tap and go with your card or phone, up to 4 times ...",positive,True
2025-11-07,Metrorail,Metrorail,https://www.miamidade.gov/global/transportation/metrorail.page,1,"The Metrorail system is a 25-mile dual track that provides service to Miami International Airport (MIA) and runs from Kendall through South Miami, Coral Gables ...",neutral,False
2025-11-07,Metrorail,Metrorail,https://www.wmata.com/service/rail/,2,"Metrorail provides safe, clean, reliable transit service for more than 600,000 customers a day throughout the Washington, DC area. The system is the second ...",positive,True
2025-11-07,Metrorail,"METRORail | Red Line | Purple Line | Houston, Texas - METRO",https://www.ridemetro.org/riding-metro/transit-services/metrorail,3,"METRORail is Houston's light-rail network, offering convenient access to many popular destinations in and around downtown Houston. These include the Texas ...",neutral,False
2025-11-07,Metrorail,WMATA: Home,https://www.wmata.com/,4,Rail · Bus · MetroAccess · Elevators and Escalators · Upcoming Track Work · Service Plans & Reports · Status and Alerts · Bikes · Parking ...,positive,True
2025-11-07,Metrorail,"Metro | Bus, Rail, Subway, Bike & Micro in Los Angeles",https://www.metro.net/,5,"Explore Los Angeles by public transit. Start with Metro schedules, maps, arrival times, parking info, trip planning, stations, and fares.",neutral,False
2025-11-07,Metrorail,Metrorail Stations - Miami-Dade County,https://www.miamidade.gov/transportation-publicworks/metrorail-stations.asp,6,"The 22 accessible Metrorail stations are about one-mile apart, providing easy access for bus riders, pedestrians, and passengers being dropped off and ...",neutral,False
2025-11-07,Metrorail,CapMetro Rail,https://www.capmetro.org/rail,7,"Rail's 32-mile route is designed to take you to and from your destination, connecting downtown to North Austin to Leander.",neutral,False
2025-11-07,Metrorail,Metrorail (Miami-Dade County),https://en.wikipedia.org/wiki/Metrorail_(Miami-Dade_County),8,"Opened in 1984, it is Florida's only rapid transit metro system, and is currently composed of two lines of 23 stations on 24.4 miles (39.3 km) of standard gauge ...",neutral,False
2025-11-07,MBTA,MBTA - Massachusetts Bay Transportation Authority,https://www.mbta.com/,1,"Public transit in the Greater Boston region. Routes, schedules, trip planner, fares, service alerts, real-time updates, and general information.",positive,True
2025-11-07,MBTA,Massachusetts Bay Transportation Authority (MBTA),https://www.mass.gov/orgs/massachusetts-bay-transportation-authority,2,"The MBTA provides subway, bus, Commuter Rail, ferry, and paratransit service to eastern Massachusetts and parts of Rhode Island.",neutral,False
2025-11-07,MBTA,Sorted by Job Title ascending | MBTA Careers,https://www.governmentjobs.com/careers/mbta,3,The Safety Audit Coordinator plays a critical role in supporting the MBTA's Safety Management by analyzing safety-related data from across ...,neutral,False
2025-11-07,MBTA,Massachusetts Bay Transportation Authority,https://en.wikipedia.org/wiki/Massachusetts_Bay_Transportation_Authority,4,"The Massachusetts Bay Transportation Authority is the public agency responsible for operating most public transportation services in Greater Boston, ...",neutral,False
2025-11-07,The L,"Chicago ""L""",https://en.wikipedia.org/wiki/Chicago_%22L%22,1,"It is the fourth-largest rapid transit system in the United States in terms of total route length, at 102.8 miles (165.4 km) long as of 2014.",neutral,False
2025-11-07,The L,How-To Guide: Riding the 'L' (Trains),https://www.transitchicago.com/howto/riding-the-train/,2,"CTA's train system is known as the 'L' (a now-official name originally short for ""elevated""). Trains serve over 140 stations located ...",positive,True
2025-11-07,The L,the L - Apps on Google Play,https://play.google.com/store/apps/details?id=com.thel.global&hl=en_US,3,"The L (formely Rela) The world's most popular diverse female community, join us with 12 million girls.",positive,True
2025-11-07,The L,Chicago ''L''.org - The Chicago rapid transit internet resource,https://www.chicago-l.org/,4,"Chicago ""L"".org is the internet's largest resource for information on Chicago's rapid transit system, including historic tours, mishaps, and FAQs.",neutral,False
2025-11-07,The L,Maps,https://www.transitchicago.com/maps/,5,"CTA offers a system map with bus and rail lines, a separate 'L' system map, and regional maps including CTA and Metra rail lines.",positive,True
2025-11-07,The L,The Chicago L,https://www.architecture.org/online-resources/buildings-of-chicago/the-chicago-l,6,"The Chicago L is a network of elevated trains and subways, mostly elevated or at grade, and is the only US city with elevated downtown trains. It has 8 lines, ...",positive,False
2025-11-07,The L,"OK, Let's settle it... L vs El? : r/AskChicago",https://www.reddit.com/r/AskChicago/comments/1lw2dwc/ok_lets_settle_it_l_vs_el/,7,But I think it is actually both L and El and they are used interchangeably by Chicagoans as the tracks are both ELevated and go around the Loop ...,positive,False
2025-11-07,The L,the L Denver | Reinventing Classics from the Ground Up,https://www.theldenver.com/,8,"We are on Broadway. We make good cocktails without the pretense & aprons. If you don't like us, we still like you. Our Menu. Your Fun.",positive,True
2025-11-07,Boston T,Subway | Schedules & Maps,https://www.mbta.com/schedules/subway,1,"Schedule information for MBTA subway lines in Greater Boston, including real-time updates and arrival predictions.",positive,True
2025-11-07,Boston T,MBTA - Massachusetts Bay Transportation Authority,https://www.mbta.com/,2,"Public transit in the Greater Boston region. Routes, schedules, trip planner, fares, service alerts, real-time updates, and general information.",positive,True
2025-11-07,Boston T,MBTA subway,https://en.wikipedia.org/wiki/MBTA_subway,3,"The Massachusetts Bay Transportation Authority (MBTA) operates rapid transit (heavy rail), light rail, and bus rapid transit services in the Boston ...",neutral,False
2025-11-07,Boston T,Maps,https://www.mbta.com/maps,4,"Official website of the MBTA -- schedules, maps, and fare information for Greater Boston's public transportation system, including subway, commuter rail, ...",positive,True
2025-11-07,Boston T,Tips for riding the T? : r/boston,https://www.reddit.com/r/boston/comments/1eghkxe/tips_for_riding_the_t/,5,Move all the way into the train! Don't just get on and grab the pole by the door. Other people getting on after you then have to shove their way through you.,neutral,False
2025-11-07,Boston T,Boston T Subway Map & Routing - App Store - Apple,https://apps.apple.com/us/app/boston-t-subway-map-routing/id1195886256,6,Boston T Subway Map is the navigation app that makes travelling by MBTA transit in Boston simple,positive,True
2025-11-07,Boston T,Boston 'T',https://www.mapway.com/apps/boston-t-subway-map/,7,"The Mapway app provides a clear, updated map, train times, route planning, and step-by-step guides for the Boston 'T' subway system.",neutral,False
2025-11-07,Washington Metropolitan Area Transit Authority,WMATA: Home,https://www.wmata.com/,1,Rail · Bus · MetroAccess · Elevators and Escalators · Upcoming Track Work · Service Plans & Reports · Status and Alerts · Bikes · Parking ...,positive,True
2025-11-07,Washington Metropolitan Area Transit Authority,Washington Metropolitan Area Transit Authority,https://en.wikipedia.org/wiki/Washington_Metropolitan_Area_Transit_Authority,2,"Commonly referred to as Metro, is a tri-jurisdictional public transit agency that operates transit services in the Washington, DC metropolitan area.",neutral,False
2025-11-07,Washington Metropolitan Area Transit Authority,Washington Metropolitan Area Transit Authority,https://washington.org/find-dc-listings/washington-metropolitan-area-transit-authority,3,"Metrorail and Metrobus are the safest, cleanest and most efficient ways to get around Washington. Five rail lines and extensive bus service connect Washington, ...",neutral,False
2025-11-07,Washington Metropolitan Area Transit Authority,WMATA - Washington Metropolitan Area Transit Authority,https://www.montgomerycountymd.gov/dot-dir/agencies/wmata.html,4,"WMATA operates regional rapid rail and bus services throughout the Washington Metropolitan area, including Montgomery County. WMATA services provide the ...",neutral,False
2025-11-07,Washington Metropolitan Area Transit Authority,Washington Metropolitan Area Transit Authority (WMATA),https://www.linkedin.com/company/wmata,5,"Locations · Primary. 600 5th Street, NW. Washington, DC 20001, US. Get directions · 3500 Pennsy Dr. Hyattsville, Maryland, US. Get directions. Employees at ...",positive,True
2025-11-07,Washington Metropolitan Area Transit Authority,Welcome to the Washington Metropolitan Area Transit ...,https://www.wmatc.gov/,6,"WMATC regulates private sector motor carriers in the Washington area, issues operating authority, and sets rates for taxicabs between compact signatory states.",positive,False
2025-11-07,Boston T,Subway | Schedules & Maps,https://www.mbta.com/schedules/subway,1,"Schedule information for MBTA subway lines in Greater Boston, including real-time updates and arrival predictions.",positive,True
2025-11-07,Boston T,MBTA - Massachusetts Bay Transportation Authority,https://www.mbta.com/,2,"Public transit in the Greater Boston region. Routes, schedules, trip planner, fares, service alerts, real-time updates, and general information.",positive,True
2025-11-07,Boston T,MBTA subway,https://en.wikipedia.org/wiki/MBTA_subway,3,"The Massachusetts Bay Transportation Authority (MBTA) operates rapid transit (heavy rail), light rail, and bus rapid transit services in the Boston ...",neutral,False
2025-11-07,Boston T,Maps,https://www.mbta.com/maps,4,"Official website of the MBTA -- schedules, maps, and fare information for Greater Boston's public transportation system, including subway, commuter rail, ...",positive,True
2025-11-07,Boston T,Tips for riding the T? : r/boston,https://www.reddit.com/r/boston/comments/1eghkxe/tips_for_riding_the_t/,5,Move all the way into the train! Don't just get on and grab the pole by the door. Other people getting on after you then have to shove their way through you.,neutral,False
2025-11-07,Boston T,Boston T Subway Map & Routing - App Store - Apple,https://apps.apple.com/us/app/boston-t-subway-map-routing/id1195886256,6,Boston T Subway Map is the navigation app that makes travelling by MBTA transit in Boston simple,positive,True
2025-11-07,Boston T,Boston 'T',https://www.mapway.com/apps/boston-t-subway-map/,7,Boston's subway system “The T” is the quickest way to get around the city and the Mapway app is the best guide to using it. The Mapway app includes our ...,neutral,False
2025-11-07,The T,MBTA - Massachusetts Bay Transportation Authority,https://www.mbta.com/,1,"Public transit in the Greater Boston region. Routes, schedules, trip planner, fares, service alerts, real-time updates, and general information.",positive,True
2025-11-07,The T,Home - Trinity Metro - Tarrant County public transit service.,https://ridetrinitymetro.org/,2,Trinity Metro's vision is to provide transit services that make Fort Worth more livable and support continued economic growth.,neutral,False
2025-11-07,The T,Massachusetts Bay Transportation Authority,https://en.wikipedia.org/wiki/Massachusetts_Bay_Transportation_Authority,3,"The Massachusetts Bay Transportation Authority (abbreviated MBTA and known colloquially as ""the T"") is the public agency responsible for operating most public ...",neutral,False
2025-11-07,The T,Alaska Thunderfuck - The T (feat. Adore Delano) [Official],https://www.youtube.com/watch?v=9Xw5VkCpxRg,4,"Poundcake, the full length sophomore album from Alaska Thunderfuck is now available on iTunes!",positive,False
2025-11-07,The T,Massachusetts Bay Transportation Authority (MBTA),https://www.mass.gov/orgs/massachusetts-bay-transportation-authority,5,"The Massachusetts Bay Transportation Authority, more commonly known as the T, is one of the oldest public transit systems in the United States.",neutral,False
2025-11-07,The T,Transit - Parking and Transportation | The University of ...,https://parking.utk.edu/transit/,6,"The University of Tennessee's transit system, “The T,” provides our students, staff, faculty, and visitors a safe, convenient, and efficient campus-wide ...",neutral,False
2025-11-07,NYC Subway,Maps,https://www.mta.info/maps,1,"Downloadable maps for New York transit, including subways, buses, and the Staten Island Railway, plus the Long Island Rail Road, Metro-North Railroad, ...",positive,True
2025-11-07,NYC Subway,New York City Subway,https://en.wikipedia.org/wiki/New_York_City_Subway,2,"The New York City Subway is a rapid transit system in New York City, serving four of the city's five boroughs: Manhattan, Brooklyn, Queens, and the Bronx.",neutral,False
2025-11-07,NYC Subway,"NYC subway trains suspended, rerouted during rush hour",https://pix11.com/news/transit/multiple-nyc-subway-lines-impacted-during-rush-hour-after-person-hit-by-a-train/,3,"Nos. 4, 5, and 6 trains are continuing to run with delays in both directions after they were temporarily suspended between 49 St-Grand Concourse ...",negative,False
2025-11-07,NYC Subway,MTA: Home,https://www.mta.info/,4,"Subway; Bus; Rail. Your favorite subway, bus and rail services will appear here ... Getting to NYC-area stadiums and arenas on transit · See All. More ...",positive,True
2025-11-07,NYC Subway,nycsubway.org,https://www.nycsubway.org/,5,nycsubway.org is not affiliated with any transit agency or provider. Not mobile.,positive,True
2025-11-07,NYC Subway,New York Subway MTA Map NYC - Apps on Google Play,https://play.google.com/store/apps/details?id=uk.co.mxdata.newyorksub&hl=en_US,6,"Features: Officially licensed maps of the New York Subway system from MTA. Covers all 5 NYC boroughs - Manhattan, Brooklyn, Queens, Bronx and Staten Island.",positive,True
2025-11-07,NYC Subway,HOW to use the NYC Subway (Everything YOU NEED to know)!,https://www.youtube.com/watch?v=jRjcoBgRWfI,7,I'm Sarah your local NYC guide and today I'm going to be giving you everything you need to know about using the subway.,neutral,False
2025-11-07,Massachusetts Bay Transportation Authority,MBTA - Massachusetts Bay Transportation Authority,https://www.mbta.com/,1,"Public transit in the Greater Boston region. Routes, schedules, trip planner, fares, service alerts, real-time updates, and general information.",positive,True
2025-11-07,Massachusetts Bay Transportation Authority,Massachusetts Bay Transportation Authority (MBTA),https://www.mass.gov/orgs/massachusetts-bay-transportation-authority,2,"The MBTA provides subway, bus, Commuter Rail, ferry, and paratransit service to eastern Massachusetts and parts of Rhode Island.",neutral,False
2025-11-07,Massachusetts Bay Transportation Authority,Massachusetts Bay Transportation Authority,https://en.wikipedia.org/wiki/Massachusetts_Bay_Transportation_Authority,3,"The public agency responsible for operating most public transportation services in Greater Boston, Massachusetts.",neutral,False
2025-11-07,Massachusetts Bay Transportation Authority,Sorted by Job Title ascending | MBTA Careers,https://www.governmentjobs.com/careers/mbta,4,The Safety Audit Coordinator plays a critical role in supporting the MBTA's Safety Management by analyzing safety-related data from across ...,neutral,False
2025-11-07,Massachusetts Bay Transportation Authority,MBTA,https://www.linkedin.com/company/mbta,5,"The Massachusetts Bay Transportation Authority, often referred to as the MBTA or simply The T, is the public operator of most bus, subway, commuter rail and ...",positive,True
2025-11-07,Massachusetts Bay Transportation Authority,MBTA - Massachusetts Bay Transportation Authority,https://www.mbta.com/,1,"Public transit in the Greater Boston region. Routes, schedules, trip planner, fares, service alerts, real-time updates, and general information.",positive,True
2025-11-07,Massachusetts Bay Transportation Authority,Massachusetts Bay Transportation Authority (MBTA),https://www.mass.gov/orgs/massachusetts-bay-transportation-authority,2,"The MBTA provides subway, bus, Commuter Rail, ferry, and paratransit service to eastern Massachusetts and parts of Rhode Island.",neutral,False
2025-11-07,Massachusetts Bay Transportation Authority,Massachusetts Bay Transportation Authority,https://en.wikipedia.org/wiki/Massachusetts_Bay_Transportation_Authority,3,"The public agency responsible for operating most public transportation services in Greater Boston, Massachusetts.",neutral,False
2025-11-07,Massachusetts Bay Transportation Authority,Sorted by Job Title ascending | MBTA Careers,https://www.governmentjobs.com/careers/mbta,4,The Safety Audit Coordinator plays a critical role in supporting the MBTA's Safety Management by analyzing safety-related data from across ...,neutral,False
2025-11-07,Massachusetts Bay Transportation Authority,MBTA,https://www.linkedin.com/company/mbta,5,"The Massachusetts Bay Transportation Authority, often referred to as the MBTA or simply The T, is the public operator of most bus, subway, commuter rail and ...",positive,True
2025-11-07,Massachusetts Bay Transportation Authority,MBTA - Massachusetts Bay Transportation Authority,https://www.mbta.com/,1,"Public transit in the Greater Boston region. Routes, schedules, trip planner, fares, service alerts, real-time updates, and general information.",positive,True
2025-11-07,Massachusetts Bay Transportation Authority,Massachusetts Bay Transportation Authority (MBTA),https://www.mass.gov/orgs/massachusetts-bay-transportation-authority,2,"The MBTA provides subway, bus, Commuter Rail, ferry, and paratransit service to eastern Massachusetts and parts of Rhode Island.",neutral,False
2025-11-07,Massachusetts Bay Transportation Authority,Massachusetts Bay Transportation Authority,https://en.wikipedia.org/wiki/Massachusetts_Bay_Transportation_Authority,3,"The public agency responsible for operating most public transportation services in Greater Boston, Massachusetts.",neutral,False
2025-11-07,Massachusetts Bay Transportation Authority,Sorted by Job Title ascending | MBTA Careers,https://www.governmentjobs.com/careers/mbta,4,The Safety Audit Coordinator plays a critical role in supporting the MBTA's Safety Management by analyzing safety-related data from across ...,neutral,False
2025-11-07,Massachusetts Bay Transportation Authority,MBTA,https://www.linkedin.com/company/mbta,5,"The Massachusetts Bay Transportation Authority, often referred to as the MBTA or simply The T, is the public operator of most bus, subway, commuter rail and ...",positive,True
2025-11-07,The T,MBTA - Massachusetts Bay Transportation Authority,https://www.mbta.com/,1,"Public transit in the Greater Boston region. Routes, schedules, trip planner, fares, service alerts, real-time updates, and general information.",positive,True
2025-11-07,The T,Massachusetts Bay Transportation Authority,https://en.wikipedia.org/wiki/Massachusetts_Bay_Transportation_Authority,2,"The Massachusetts Bay Transportation Authority (abbreviated MBTA and known colloquially as ""the T"") is the public agency responsible for operating most public ...",neutral,False
2025-11-07,The T,Home - Trinity Metro - Tarrant County public transit service.,https://ridetrinitymetro.org/,3,"Ride the bus, routes, tickets, trip planner, stops, alerts, ride the train, Texrail schedules, train stations, tickets, Trinity Railway Express alerts.",neutral,False
2025-11-07,The T,Massachusetts Bay Transportation Authority (MBTA),https://www.mass.gov/orgs/massachusetts-bay-transportation-authority,4,"The Massachusetts Bay Transportation Authority, more commonly known as the T, is one of the oldest public transit systems in the United States.",neutral,False
2025-11-07,The T,Harm Reduction,https://www.thetstl.com/,5,"The T is a holistic harm reduction program, bridging fatal gaps in care for people at risk for overdose due to Trauma-Related Drug Use.",positive,True
2025-11-07,Chicago Transit Authority,Chicago Transit Authority - CTA Buses & Train Service - 1-888 ...,https://www.transitchicago.com/,1,"Information about CTA bus and train service in and around Chicago. Find maps, schedules, service alerts, plan a trip, jobs, news and more!",positive,True
2025-11-07,Chicago Transit Authority,Chicago Transit Authority (album),https://en.wikipedia.org/wiki/Chicago_Transit_Authority_(album),2,"Chicago Transit Authority is the debut studio album by the American rock band Chicago, known at the time of release as Chicago Transit Authority.",neutral,False
2025-11-07,Chicago Transit Authority,Chicago Transit Authority (CTA) - Travel Information,https://www.chicago.gov/city/en/depts/other/provdrs/cta.html,3,The CTA operates the nation's second largest public transportation system and covers the City of Chicago and 40 surrounding suburbs.,neutral,False
2025-11-07,Chicago Transit Authority,Chicago Transit Authority,https://www.facebook.com/thecta/,4,Chicago Transit Authority. 50334 likes · 8759 talking about this. Welcome to the official CTA Facebook page. Serving Chicago & 35 surrounding suburbs....,positive,True
2025-11-07,Boston T,Subway | Schedules & Maps,https://www.mbta.com/schedules/subway,1,"Schedule information for MBTA subway lines in Greater Boston, including real-time updates and arrival predictions.",positive,True
2025-11-07,Boston T,MBTA - Massachusetts Bay Transportation Authority,https://www.mbta.com/,2,"Public transit in the Greater Boston region. Routes, schedules, trip planner, fares, service alerts, real-time updates, and general information.",positive,True
