date,ceo,company,title,url,position,snippet,sentiment,controlled
2025-12-03,Monica Tibbits-Nutt,MBTA,Transportation Sec. Monica Tibbits-Nutt Stepping Down ...,https://mass.streetsblog.org/2025/10/16/rearranging-the-cabinet-transportation-sec-monica-tibbits-nutt-stepping-down-replaced-by-mbta-gm-phillip-eng,2,Secretary of Transportation Monica Tibbits-Nutt is leaving the Healey administration. Governor Maura Healey announced this morning in a ...,neutral,False
2025-12-03,Monica Tibbits-Nutt,MBTA,Governor Healey Appoints MBTA General Manager Phil ...,https://www.mass.gov/news/governor-healey-appoints-mbta-general-manager-phil-eng-as-interim-transportation-secretary,3,... (MBTA) General Manager Phillip Eng as Interim Transportation Secretary. Monica Tibbits-Nutt has made the decision to step down from her ...,neutral,False
2025-12-03,Monica Tibbits-Nutt,MBTA,Massachusetts Transportation Sec. Monica Tibbits-Nutt ...,https://www.cbsnews.com/boston/news/monica-tibbits-nutt-phil-eng-massdot/,4,Transportation Sec. Monica Tibbits-Nutt is out and MBTA GM Phil Eng was promoted in a MassDOT shakeup.,neutral,False
2025-12-03,Monica Tibbits-Nutt,MBTA,Monica Tibbits-Nutt parting ways with Massachusetts ...,https://www.wcvb.com/article/monica-tibbits-nutt-parting-ways-with-massachusetts-department-of-transportation/69054926,5,Maura Healey said Tibbits-Nutt made the decision to step down from her positions as secretary of the Department of Transportation and CEO of ...,neutral,False
2025-12-03,Monica Tibbits-Nutt,MBTA,Tibbits-Nutt is out as transportation secretary. T chief Eng ...,https://www.wbur.org/news/2025/10/16/tibbits-nutt-transportation-secretary-massachusetts-eng,6,"... Monica Tibbits-Nutt overseeing the state's transit agency. In a press release, Healey said Tibbits-Nutt ""has made the decision to step down ...",neutral,False
2025-12-03,Monica Tibbits-Nutt,MBTA,MassFiscal Responds to Departure of Transportation ...,https://www.massfiscal.org/massfiscal-responds-departure-monica-tibbits-nutt,7,Tibbits-Nutt Exit is “Long Overdue”. The Massachusetts Fiscal Alliance today responded to news that Secretary of Transportation Monica ...,neutral,False
2025-12-03,Monica Tibbits-Nutt,MBTA,Tibbits-Nutt out at MassDOT; T's Eng takes over,https://www.axios.com/local/boston/2025/10/16/tibbits-nutt-out-at-massdot-ts-eng-takes-over,8,Monica Tibbits-Nutt's time as Gov. Maura Healey's MassDOT secretary is over and the governor is putting the MBTA's Phil Eng in charge of the ...,neutral,False
2025-12-03,Monica Tibbits-Nutt,MBTA,"Tibbits-Nutt out, Eng elevated in abrupt shakeup at MassDOT",https://commonwealthbeacon.org/transportation/tibbits-nutt-out-eng-elevated-in-abrupt-shakeup-at-massdot/,9,"Transportation Secretary Monica Tibbits-Nutt suddenly resigned Thursday, prompting the governor to ask the head of the MBTA and the state's ...",negative,False
2025-12-03,Nora Leerhsen,Chicago Transit Authority,"Nora Leerhsen - Acting President, Chicago Transit Authority",https://www.linkedin.com/in/nora-leerhsen-1ba38847,1,"Acting President, Chicago Transit Authority · Experience: Chicago Transit Authority · Education: University of Wisconsin Law School · Location: Greater ...",positive,True
2025-12-03,Nora Leerhsen,Chicago Transit Authority,Nora Leerhsen,https://en.wikipedia.org/wiki/Nora_Leerhsen,2,"Nora Leerhsen is an American lawyer and executive who has served as the Acting President of the Chicago Transit Authority (CTA) since February 2025, replacing ...",neutral,False
2025-12-03,Nora Leerhsen,Chicago Transit Authority,Team | Chicago Transit Authority | BondLink,https://www.ctabonds.com/chicago-transit-authority-il/about/our-team/i6552,3,"nleerhsen@transitchicago.com. Nora Leerhsen is acting president of the Chicago Transit Authority (CTA), one of the nation's largest public transit agencies ...",positive,True
2025-12-03,Nora Leerhsen,Chicago Transit Authority,CTA Governance/Administration,https://www.transitchicago.com/governance/,4,"CTA's day-to-day operations are directed by Nora Leerhsen, Acting President of the CTA. CTA generates revenue from both farebox collections and non-farebox ...",positive,True
2025-12-03,Nora Leerhsen,Chicago Transit Authority,Statement from CTA Acting President Nora Leerhsen,https://www.transitchicago.com/statement-from-cta-acting-president-nora-leerhsen/,5,"Early this morning, the Illinois State Legislature passed a bill that provides a transformational level of funding for the Chicago Transit ...",positive,True
2025-12-03,Nora Leerhsen,Chicago Transit Authority,Longtime CTA chief of staff Nora Leerhsen to take over as ...,https://www.cbsnews.com/chicago/news/nora-leerhsen-acting-cta-president/,6,Chief of staff Nora Leerhsen will take over as acting president of the transit agency when current President Dorval Carter Jr. retires at the end of the month.,neutral,False
2025-12-03,Nora Leerhsen,Chicago Transit Authority,A Conversation with Nora Leerhsen,https://transitunplugged.com/transit-unplugged-podcast/the-unmatched-power-of-transit-a-conversation-with-nora-leerhsen/,7,"In this Super September episode of Transit Unplugged, host Paul Comfort heads to Chicago to sit down with Nora Leerhsen, Acting President of the ...",neutral,False
2025-12-03,Nora Leerhsen,Chicago Transit Authority,Chicago Transit Authority,https://www.facebook.com/thecta/posts/a-message-from-cta-acting-president-nora-leerhsen-no-service-cuts-no-layoffs-in-/1241644654664217/,8,"A message from CTA Acting President Nora Leerhsen: ""No service cuts. No layoffs. In fact, CTA will grow."" Being able to share that news on ...",positive,True
2025-12-03,Randy Clarke,DC Metro,Leadership,https://www.wmata.com/about/leadership/,1,Randy Clarke joined the Washington Metropolitan Area Transit Authority (WMATA) as General Manager and CEO in July 2022.,positive,True
2025-12-03,Randy Clarke,DC Metro,Randy Clarke,https://en.wikipedia.org/wiki/Randy_Clarke,2,Randy Clarke (born 1976 or 1977) is a Canadian-American transit executive who has served as the general manager and CEO of Washington Metropolitan Area ...,neutral,False
2025-12-03,Randy Clarke,DC Metro,Randy Clarke - WMATA General Manager and CEO,https://www.linkedin.com/in/randy-clarke-74bb8a69,3,WMATA General Manager and CEO · Experience: Washington Metropolitan Area Transit Authority (WMATA) · Education: University of Southern Maine · Location: ...,positive,True
2025-12-03,Randy Clarke,DC Metro,Randy Clarke (@wmatagm),https://www.instagram.com/wmatagm/?hl=en,4,"On Friday, D.C. Mayor Muriel Bowser and Metro General Manager Randy Clarke along with city and transit agency staff members took a ride on the newly renamed ...",positive,True
2025-12-03,Randy Clarke,DC Metro,DC's Metro Made a Comeback. Meet the Man Behind It.,https://washingtonian.com/2024/11/14/dcs-metro-made-a-comeback-meet-the-man-behind-it/,5,"Better service. Happier riders. Under Randy Clarke, Metro has bounced back from a pandemic slump—winning him plaudits and fans.",neutral,False
2025-12-03,Randy Clarke,DC Metro,Here's a wild idea: Randy Clarke for D.C. mayor,https://www.axios.com/local/washington-dc/2025/10/30/randy-clarke-metro-dc-mayor-muriel-bowser-election,6,Metro's reformer could be the technocratic mayor D.C. needs ... Randy Clarke fixed Metro. Maybe he can fix D.C. next? Why it matters ...,neutral,False
2025-12-03,Randy Clarke,DC Metro,How to Save DC's Metro - by Santi Ruiz,https://www.statecraft.pub/p/how-to-save-dcs-metro,7,"Today we talked to Randy Clarke, the head of DC's Metro system, WMATA. If you're a transit nerd, you probably know about Clarke — he's ...",positive,False
2025-12-03,Randy Clarke,DC Metro,Randy Clarke's impressive leadership in DC is leading to ...,https://www.reddit.com/r/transit/comments/1cm267s/randy_clarkes_impressive_leadership_in_dc_is/,8,"Randy Clarke's impressive leadership in DC is leading to real results, with Washington Metro having a 22% ridership increase over last year.",positive,False
2025-12-03,Randy Clarke,DC Metro,Randy Clarke,https://www.govtech.com/top-25/randy-clarke,9,"Clarke is a veteran of helming massive urban transit systems. He previously served as transit chief for Capital Metro in Austin, Texas.",neutral,False
