date,ceo,company,title,url,position,snippet,sentiment,controlled
2025-12-03,Phillip Eng,Massachusetts Bay Transportation Authority,"Healey names Eng, MBTA general manager, interim ...",https://whdh.com/news/healey-names-eng-mbta-general-manager-interim-transportation-secretary/,9,BOSTON (WHDH) - Governor Maura Healey has named the Massachusetts Bay Transportation Authority (MBTA) General Manager Philip Eng the Interim ...,neutral,False
2025-12-03,Phillip Eng,The T,Phillip Eng | People,https://www.mbta.com/people/phillip-eng,1,Phillip Eng is the General Manager and CEO of the Massachusetts Bay Transportation Authority (MBTA). A Civil Engineer with nearly 40 years of transportation ...,positive,True
2025-12-03,Phillip Eng,The T,Phillip Eng,https://en.wikipedia.org/wiki/Phillip_Eng,2,Phillip Eng (born 1961 or 1962) is an American civil engineer and transit executive currently serving as interim Secretary of Massachusetts Department of ...,neutral,False
2025-12-03,Phillip Eng,The T,Governor Healey Appoints MBTA General Manager Phil ...,https://www.mass.gov/news/governor-healey-appoints-mbta-general-manager-phil-eng-as-interim-transportation-secretary,3,Governor Healey Appoints MBTA General Manager Phil Eng as Interim Transportation Secretary. Highway Administrator Jonathan Gulliver promoted to ...,neutral,False
2025-12-03,Phillip Eng,The T,To a T: How Phillip Eng got Boston's subway system back ...,https://www.csmonitor.com/Business/2025/1115/boston-mbta-phillip-eng,4,"Mr. Eng, who was appointed the state's interim Transportation Secretary in October, says it's about a laser-focus on one goal: improving the ...",neutral,False
2025-12-03,Phillip Eng,The T,MBTA General Manager Phil Eng to become Interim ...,https://www.reddit.com/r/mbta/comments/1o888wf/breaking_news_mbta_general_manager_phil_eng_to/,5,"Eng is interim secretary and is remaining as the GM of the T currently. We should still expect some significant changes IMO, but the T isn't ...",neutral,False
2025-12-03,Phillip Eng,The T,"Phillip Eng - Transportation Services, Operations ...",https://www.linkedin.com/in/phillip-eng-875928240,6,"Lead The LiRo Group in the pursuit and delivery of Engineering, Transportation and Infrastructure projects both public and private.",positive,True
2025-12-03,Phillip Eng,The T,Boston transit riders dream of new train lines. MBTA's ...,https://www.masslive.com/boston/2025/11/boston-transit-riders-dream-of-new-train-lines-mbtas-phillip-eng-has-other-priorities.html,7,"Phillip Eng, MBTA chief and interim transportation secretary, is focused on building redundancy to prevent delays when T trains break down ...",positive,False
2025-12-03,Phillip Eng,The T,Tibbits-Nutt is out as transportation secretary. T chief Eng ...,https://www.wbur.org/news/2025/10/16/tibbits-nutt-transportation-secretary-massachusetts-eng,8,"Maura Healey has named MBTA Chief Phil Eng interim transportation secretary, she announced Thursday, ending the embattled tenure of Monica ...",neutral,False
2025-12-03,Phillip Eng,The T,"For Phillip Eng, Public Service Suits Him to a 'T'",https://www.sampan.org/post/for-phillip-eng-public-service-suits-him-to-a-t,9,"In sum, Eng appears as the capable and friendly face of the T – so friendly that perpetually disgruntled Bostonians are able to overlook ...",neutral,False
2025-12-03,Ryan Coholan,MBTA,Ryan Coholan - Chief Operating Officer at MBTA,https://www.linkedin.com/in/ryan-coholan-139014ab,1,"Chief Operating Officer at MBTA working in the transportation/trucking/railroad industry. Skilled in Budgeting, Operations Management,",positive,True
2025-12-03,Ryan Coholan,MBTA,Ryan Coholan - Massachusetts Bay Transportation Authority ...,https://cthrupayroll.mass.gov/?os=shmmfp&ref=app#!/year/2024/full_time_employees%2Cothers/pay1%2Cpay2%2Cpay3%2Cpay4/explore%2F0-0-0%2Ftrans_no%2F17915261%2F0%2Fdepartment_division,2,"Ryan Coholan - Massachusetts Bay Transportation Authority (MBT) - Chief Operating Officer. Total Pay $299,085 Annual Rate $303,850 Paid Thru December 14, 2024",positive,False
2025-12-03,Ryan Coholan,MBTA,Conversation with MBTA's COO Ryan Coholan,https://transitunplugged.com/transit-unplugged-podcast/ryan-coholan-mbta/,3,"Host Paul Comfort sits down with Ryan Coholan, the Chief Operating Officer of the Massachusetts Bay Transportation Authority (MBTA or The T) in Boston.",neutral,False
2025-12-03,Ryan Coholan,MBTA,"December 05, 2023, 10:30 AM",https://mbtaadvisoryboard.org/wp-content/uploads/2024/04/MinutesMBTAAB-12-05-23APPROVED.pdf,4,"Ryan Coholan, the Chief Operating Officer (COO) of the MBTA to address the Board. Coholan is responsible for the operation of all MBTA modes. He was appointed ...",positive,True
2025-12-03,Ryan Coholan,MBTA,Ryan Coholan | Chief Operating Officer,https://muraena.ai/profile/ryan_coholan_9f8b904a,5,"Currently overseeing operations at the MBTA, he has a proven track record of managing large-scale projects and enhancing operational efficiency. With a strong ...",neutral,False
2025-12-03,Ryan Coholan,MBTA,"Today, COO Ryan Coholan joined State Senator ...",https://www.instagram.com/p/DPWzqsCEoZw/?hl=en,6,"Today, COO Ryan Coholan joined State Senator @barryfinegoldma, station at mbta.com/news #MBTA #PublicTransportation station at mbta.com/news # ...",positive,True
2025-12-03,Ryan Coholan,MBTA,Ryan Coholan - Chief Operating Officer at Massachusetts ...,https://www.zoominfo.com/p/Ryan-Coholan/11957181347,7,"Ryan D. Coholan is the Chief Operating Officer at the Massachusetts Bay Transportation Authority, bringing extensive leadership to transportation services.",neutral,False
2025-12-03,Ryan Coholan,MBTA,Ryan Coholan Archives,https://www.globalrailwayreview.com/content_author/ryan-coholan/,8,"Ryan Coholan, Chief Railroad Officer at the Massachusetts Bay Transportation Authority (MBTA), discusses the benefits of introducing new technologies across the ...",neutral,False
2025-12-03,Janno Lieber,NYC Subway,Janno Lieber,https://en.wikipedia.org/wiki/Janno_Lieber,1,"John Nathan ""Janno"" Lieber (born September 19, 1961) is the head of the Metropolitan Transportation Authority (MTA) in New York.",neutral,False
2025-12-03,Janno Lieber,NYC Subway,Janno Lieber,https://www.mta.info/transparency/leadership/executive-leadership/janno-lieber,2,"Lieber has been serving as MTA Acting Chair and CEO since July 2021 and is the Authority's 15th Chairperson since it was founded in 1968. In this position, ...",positive,True
2025-12-03,Janno Lieber,NYC Subway,MTA boss Janno Lieber brags about balancing MTA's budget,https://nypost.com/2025/12/02/us-news/mta-boss-janno-lieber-brags-about-balancing-mtas-budget-as-he-ignores-fare-hikes-1-5b-in-casino-cash/,3,Transit boss Janno Lieber patted himself on the back Tuesday for balancing the MTA's budget -- conveniently ignoring fare hikes and a $1.5 ...,neutral,False
2025-12-03,Janno Lieber,NYC Subway,Janno Lieber - Chair & CEO at New York Metropolitan ...,https://www.linkedin.com/in/janno-lieber-32b487158,4,"Chair & CEO at New York Metropolitan Transportation Authority · An accomplished executive working at the intersection of government, real estate and law.",positive,True
2025-12-03,Janno Lieber,NYC Subway,"Janno Lieber on Free Buses, the State of the MTA, & The ...",https://nyeditorialboard.substack.com/p/janno-lieber-on-free-buses-the-state,5,"Janno Lieber, Chair and CEO of the Metropolitan Transportation Authority (MTA), which runs the New York City subways and buses, ...",positive,False
2025-12-03,Janno Lieber,NYC Subway,MTA boss Lieber expects Mayor-elect Mamdani to move ...,https://www.amny.com/nyc-transit/lieber-mamdani-bus-lane-network-construction/,6,"MTA Chair and CEO Janno Lieber said Tuesday that he expects Mayor-elect Zohran Mamdani's incoming administration to ""move quickly"" on ...",neutral,False
2025-12-03,Janno Lieber,NYC Subway,MTA chief vows fare evasion crackdown on NYC buses ...,https://gothamist.com/news/mta-chief-vows-fare-evasion-crackdown-on-nyc-buses-once-metrocard-retires,7,MTA Chair Janno Lieber said requiring all riders to pay with OMNY will make it easier to check who has actually paid.,neutral,False
2025-12-03,Janno Lieber,NYC Subway,"“The Highway of Fare Evasion”, Janno Lieber, Chair and ...",https://www.facebook.com/nycsubwaylife/posts/the-highway-of-fare-evasion-janno-lieber-chair-and-ceo-of-the-metropolitan-trans/825850787105788/,8,"“The Highway of Fare Evasion”, Janno Lieber, Chair and CEO of the Metropolitan Transportation Authority (MTA). #NYCSubway #NYC #NewYorkCity.",positive,True
2025-12-03,Janno Lieber,MTA,Janno Lieber,https://www.mta.info/transparency/leadership/executive-leadership/janno-lieber,1,John (“Janno”) Lieber was confirmed as Chair and CEO of the Metropolitan Transportation Authority (MTA) in January 2022.,positive,True
2025-12-03,Janno Lieber,MTA,Janno Lieber,https://en.wikipedia.org/wiki/Janno_Lieber,2,"John Nathan ""Janno"" Lieber (born September 19, 1961) is the head of the Metropolitan Transportation Authority (MTA) in New York.",neutral,False
2025-12-03,Janno Lieber,MTA,Janno Lieber - Chair & CEO at New York Metropolitan ...,https://www.linkedin.com/in/janno-lieber-32b487158,3,"Chair & CEO at New York Metropolitan Transportation Authority · An accomplished executive working at the intersection of government, real estate and law.",positive,True
2025-12-03,Janno Lieber,MTA,MTA boss Lieber expects Mayor-elect Mamdani to move ...,https://www.amny.com/nyc-transit/lieber-mamdani-bus-lane-network-construction/,4,MTA Chair and CEO Janno Lieber said Tuesday that he expects Mayor-elect Zohran Mamdani's incoming administration to “move quickly” on ...,neutral,False
2025-12-03,Janno Lieber,MTA,MTA head Janno Lieber has a wish list for 2026. Here's his ...,https://www.cbsnews.com/newyork/news/mta-janno-lieber-nyc-bus-fares-bus-lanes-fare-evasion/,5,"In a wide-ranging speech on the state of the MTA on Tuesday, Chairman Janno Lieber revealed his wish list for 2026.",positive,False
2025-12-03,Janno Lieber,MTA,"Janno Lieber on Free Buses, the State of the MTA, & The ...",https://nyeditorialboard.substack.com/p/janno-lieber-on-free-buses-the-state,6,"Janno Lieber, Chair and CEO of the Metropolitan Transportation Authority (MTA), which runs the New York City subways and buses, ...",positive,False
2025-12-03,Janno Lieber,MTA,MTA Executive Leadership,https://www.mta.info/transparency/leadership/executive-leadership,7,"MTA Executive Leadership. Janno Lieber. Chair and CEO · Bill Amarosa Jr. Executive Vice President, Subways · Quemuel Arroyo. Chief Accessibility Officer.",positive,True
2025-12-03,Janno Lieber,MTA,Statement from MTA Chair and CEO Janno Lieber,https://www.mta.info/press-release/statement-mta-chair-and-ceo-janno-lieber-regarding-legal-filing-continue-benefits-of,8,"Statement from MTA Chair and CEO Janno Lieber Regarding Legal Filing to Continue Benefits of Congestion Relief Program. MTA. Updated Feb 19, 2025 1:00 p.m.. “ ...",positive,True
2025-12-03,Nora Leerhsen,The L,Statement from CTA Acting President Nora Leerhsen,https://www.transitchicago.com/statement-from-cta-acting-president-nora-leerhsen/,1,"As a result of this bill, CTA will be fully funded. This funding means that there will be no layoffs or service cuts. With these funds, we will ...",positive,True
2025-12-03,Nora Leerhsen,The L,Nora Leerhsen,https://en.wikipedia.org/wiki/Nora_Leerhsen,2,"Nora Leerhsen is an American lawyer and executive who has served as the Acting President of the Chicago Transit Authority (CTA) since February 2025, replacing ...",neutral,False
2025-12-03,Nora Leerhsen,The L,A Conversation with Nora Leerhsen,https://transitunplugged.com/transit-unplugged-podcast/the-unmatched-power-of-transit-a-conversation-with-nora-leerhsen/,3,"In this Super September episode of Transit Unplugged, host Paul Comfort heads to Chicago to sit down with Nora Leerhsen, Acting President of the ...",neutral,False
2025-12-03,Nora Leerhsen,The L,Chicago Transit Authority,https://www.facebook.com/thecta/posts/a-message-from-cta-acting-president-nora-leerhsen-no-service-cuts-no-layoffs-in-/1241644654664217/,4,CTA Acting President Nora Leerhsen previously said additional money also could allow trains to run every six minutes and overnight service to ...,positive,True
2025-12-03,Nora Leerhsen,The L,CTA Governance/Administration,https://www.transitchicago.com/governance/,5,"CTA's day-to-day operations are directed by Nora Leerhsen, Acting President of the CTA. CTA generates revenue from both farebox collections and non-farebox ...",positive,True
2025-12-03,Nora Leerhsen,The L,"As 1st woman to lead agency, CTA's acting president ...",https://www.youtube.com/watch?v=JkPaY8gOl8Q,6,The CTA has a new acting president Nora lerson the first woman to lead the agency after a six-year stint as former President dorville Carter's Chief of Staff.,neutral,False
2025-12-03,Nora Leerhsen,The L,"Nora Leerhsen - Acting President, Chicago Transit Authority",https://www.linkedin.com/in/nora-leerhsen-1ba38847,7,"Acting President, Chicago Transit Authority · Experience: Chicago Transit Authority · Education: University of Wisconsin Law School · Location: Greater ...",positive,True
2025-12-03,Nora Leerhsen,The L,A message from CTA Acting President Nora ...,https://www.instagram.com/p/DQptDYpjJEh/,8,"CTA Acting President Nora Leerhsen was also out this morning, thanking employees for their dedication to our riders. more. View all 12 comments.",positive,True
2025-12-03,Nora Leerhsen,The L,Team | Chicago Transit Authority | BondLink,https://www.ctabonds.com/chicago-transit-authority-il/about/our-team/i6552,9,"Nora Leerhsen is acting president of the Chicago Transit Authority (CTA), one of the nation's largest public transit agencies.",positive,True
2025-12-03,Nora Leerhsen,The L,"Acting CTA President Pledges Outreach, Engagement as ...",https://news.wttw.com/2025/02/12/acting-cta-president-pledges-outreach-engagement-agency-works-tackle-budget-gap-and-draw,10,"Nora Leerhsen, who has worked at the CTA for more than 10 years, took over as its leader on Feb. 1. At Wednesday's meeting of the agency's ...",positive,False
2025-12-03,Ryan Coholan,Boston T,Ryan Coholan - Chief Operating Officer at MBTA,https://www.linkedin.com/in/ryan-coholan-139014ab,1,Experienced Chief Operating Officer with a demonstrated history of working in the transportation/trucking/railroad industry.,positive,True
2025-12-03,Ryan Coholan,Boston T,Conversation with MBTA's COO Ryan Coholan,https://transitunplugged.com/transit-unplugged-podcast/ryan-coholan-mbta/,2,"With nearly 30 years of transit experience, Ryan talks about running one of America's largest transit systems and shares stories of MBTA's ...",neutral,False
2025-12-03,Ryan Coholan,Boston T,Ryan Coholan | Chief Operating Officer,https://muraena.ai/profile/ryan_coholan_9f8b904a,3,"Currently overseeing operations at the MBTA, he has a proven track record of managing large-scale projects and enhancing operational efficiency. With a strong ...",neutral,False
2025-12-03,Ryan Coholan,Boston T,"Today, COO Ryan Coholan joined State Senator ...",https://www.instagram.com/p/DPWzqsCEoZw/?hl=en,4,"Today, COO Ryan Coholan joined State Senator @barryfinegoldma, State Representative Dave Robertson, Town of Wilmington officials, @mbta_cr, and ...",positive,True
2025-12-03,Ryan Coholan,Boston T,Ryan Coholan - Massachusetts Bay Transportation Authority ...,https://cthrupayroll.mass.gov/?os=shmmfp&ref=app#!/year/2024/full_time_employees%2Cothers/pay1%2Cpay2%2Cpay3%2Cpay4/explore%2F0-0-0%2Ftrans_no%2F17915261%2F0%2Fdepartment_division,5,Ryan Coholan - Massachusetts Bay Transportation Authority (MBT) ... MBTA Exec Main Fund. Other Pay. $0. Department. Massachusetts Bay Transportation ...,positive,False
2025-12-03,Ryan Coholan,Boston T,"December 05, 2023, 10:30 AM",https://mbtaadvisoryboard.org/wp-content/uploads/2024/04/MinutesMBTAAB-12-05-23APPROVED.pdf,6,"C. MBTA Chief Operating Officer Ryan Coholan: The Chair introduced Ryan. Coholan, the Chief Operating Officer (COO) of the MBTA to address the Board.",neutral,False
2025-12-03,Ryan Coholan,Boston T,Most of MBTA Green Line to Shut Down for 15 Days in ...,https://www.bu.edu/articles/2025/mbta-green-line-shut-down/,7,"Ryan Coholan, MBTA chief operating officer. The closure will allow the T to quickly replace the wooden trough in the tunnel holding overhead ...",neutral,False
2025-12-03,Phillip Eng,MBTA,Phillip Eng | People,https://www.mbta.com/people/phillip-eng,1,Phillip Eng is the General Manager and CEO of the Massachusetts Bay Transportation Authority (MBTA). A Civil Engineer with nearly 40 years of transportation ...,positive,True
2025-12-03,Phillip Eng,MBTA,Phillip Eng,https://en.wikipedia.org/wiki/Phillip_Eng,2,Phillip Eng (born 1961 or 1962) is an American civil engineer and transit executive currently serving as interim Secretary of Massachusetts Department of ...,neutral,False
2025-12-03,Phillip Eng,MBTA,Governor Healey Appoints MBTA General Manager Phil ...,https://www.mass.gov/news/governor-healey-appoints-mbta-general-manager-phil-eng-as-interim-transportation-secretary,3,Highway Administrator Jonathan Gulliver promoted to Undersecretary of Transportation; Interim Secretary and GM Eng to hold media ...,neutral,False
2025-12-03,Phillip Eng,MBTA,To a T: How Phillip Eng got Boston's subway system back ...,https://www.csmonitor.com/Business/2025/1115/boston-mbta-phillip-eng,4,Many now see America's oldest subway system as a model for repairing the country's crumbling transportation infrastructure – a huge ...,neutral,False
2025-12-03,Phillip Eng,MBTA,MBTA's Phillip Eng Named Interim MassDOT Secretary,https://aashtojournal.transportation.org/mbtas-phillip-eng-named-interim-massdot-secretary/,5,Massachusetts Governor Maura Healey (D) has appointed Phillip Eng (above at left) – general manager of the Massachusetts Bay Transportation ...,neutral,False
2025-12-03,Phillip Eng,MBTA,"Phillip Eng - Transportation Services, Operations ...",https://www.linkedin.com/in/phillip-eng-875928240,6,"Transportation Services, Operations, Engineering and Infrastructure · Experience: Massachusetts Bay Transportation Authority - MBTA · Education: The Cooper ...",positive,True
2025-12-03,Phillip Eng,MBTA,Leadership at The MBTA,https://www.mbta.com/leadership,7,The MBTA is overseen by the Massachusetts Bay Transportation Authority Board of Directors. Phillip Eng is the Interim MassDOT Secretary and MBTA General Manager ...,positive,True
2025-12-03,Phillip Eng,MBTA,Boston transit riders dream of new train lines. MBTA's ...,https://www.masslive.com/boston/2025/11/boston-transit-riders-dream-of-new-train-lines-mbtas-phillip-eng-has-other-priorities.html,8,"Phillip Eng, MBTA chief and interim transportation secretary, is focused on building redundancy to prevent delays when T trains break down ...",positive,False
2025-12-03,Phillip Eng,MBTA,Phil Eng bashing : r/mbta,https://www.reddit.com/r/mbta/comments/1mk4gvl/phil_eng_bashing/,9,"195 votes, 62 comments. It seems Iike the people who have no clue what they're talking about when they blame Eng for every issue in the last ...",neutral,False
2025-12-03,Ryan Coholan,Massachusetts Bay Transportation Authority,Ryan Coholan - Chief Operating Officer at MBTA,https://www.linkedin.com/in/ryan-coholan-139014ab,1,"Experienced Chief Operating Officer with a demonstrated history of working in the transportation/trucking/railroad industry. Skilled in Budgeting, Operations ...",positive,True
2025-12-03,Ryan Coholan,Massachusetts Bay Transportation Authority,Conversation with MBTA's COO Ryan Coholan,https://transitunplugged.com/transit-unplugged-podcast/ryan-coholan-mbta/,2,"Host Paul Comfort sits down with Ryan Coholan, the Chief Operating Officer of the Massachusetts Bay Transportation Authority (MBTA or The T) in Boston.",neutral,False
2025-12-03,Ryan Coholan,Massachusetts Bay Transportation Authority,Ryan Coholan - Massachusetts Bay Transportation Authority ...,https://cthrupayroll.mass.gov/?os=shmmfp&ref=app#!/year/2024/full_time_employees%2Cothers/pay1%2Cpay2%2Cpay3%2Cpay4/explore%2F0-0-0%2Ftrans_no%2F17915261%2F0%2Fdepartment_division,3,"Pay Check · Coholan · Ryan · MBTA Exec Main Fund · $299,084.71 · $299,084.71 $299,084.71. « ‹ 1; ›; ». Payroll Details. Total Pay. $ 299,085. Base Pay. $299,085.",positive,False
2025-12-03,Ryan Coholan,Massachusetts Bay Transportation Authority,Ryan Coholan - Chief Operating Officer at Massachusetts ...,https://www.zoominfo.com/p/Ryan-Coholan/11957181347,4,"Ryan D. Coholan is the Chief Operating Officer at the Massachusetts Bay Transportation Authority, bringing extensive leadership to transportation services.",neutral,False
2025-12-03,Ryan Coholan,Massachusetts Bay Transportation Authority,Ryan Coholan | Chief Operating Officer,https://muraena.ai/profile/ryan_coholan_9f8b904a,5,"Currently overseeing operations at the MBTA, he has a proven track record of managing large-scale projects and enhancing operational efficiency. With a strong ...",neutral,False
2025-12-03,Ryan Coholan,Massachusetts Bay Transportation Authority,Cultivating Culture at the MBTA with COO Ryan Coholan,https://www.youtube.com/watch?v=TeJpfw-wfCA,6,"On this episode, Chief Operating Officer Ryan Coholan joins us to discuss his unique approach to leading Operations at the MBTA.",neutral,False
2025-12-03,Ryan Coholan,Massachusetts Bay Transportation Authority,"Today, COO Ryan Coholan joined State Senator Barry ...",https://www.facebook.com/TheMBTA/videos/north-wilmington-official-ribbon-cutting-october-3-2025/834133079271535/,7,"Today, COO Ryan Coholan joined State Senator Barry Finegold, State Representative Dave Robertson, Wilmington, MA Town Hall, MBTA Commuter ...",positive,True
2025-12-03,Ryan Coholan,Massachusetts Bay Transportation Authority,"December 05, 2023, 10:30 AM",https://mbtaadvisoryboard.org/wp-content/uploads/2024/04/MinutesMBTAAB-12-05-23APPROVED.pdf,8,Coholan is responsible for the operation of all MBTA modes. He was appointed. COO by General Manager Philip Eng in September 2023. Mr. Coholan introduced his ...,neutral,False
2025-12-03,Ryan Coholan,Massachusetts Bay Transportation Authority,"Today, COO Ryan Coholan joined State Senator ...",https://www.instagram.com/p/DPWzqsCEoZw/?hl=en,9,North Wilmington station reopened for passenger service earlier this year on June 30. Learn more about this celebration and the station at mbta.,positive,True
2025-12-03,Ryan Coholan,Massachusetts Bay Transportation Authority,Ryan Coholan Archives,https://www.globalrailwayreview.com/content_author/ryan-coholan/,10,"Ryan Coholan, Chief Railroad Officer at the Massachusetts Bay Transportation Authority (MBTA), discusses the benefits of introducing new technologies across the ...",neutral,False
2025-12-03,Phillip Eng,Boston T,Phillip Eng,https://en.wikipedia.org/wiki/Phillip_Eng,1,Phillip Eng (born 1961 or 1962) is an American civil engineer and transit executive currently serving as interim Secretary of Massachusetts Department of ...,neutral,False
2025-12-03,Phillip Eng,Boston T,Phillip Eng | People,https://www.mbta.com/people/phillip-eng,2,Phillip Eng is the General Manager and CEO of the Massachusetts Bay Transportation Authority (MBTA). A Civil Engineer with nearly 40 years of transportation ...,positive,True
2025-12-03,Phillip Eng,Boston T,"Phillip Eng - Transportation Services, Operations ...",https://www.linkedin.com/in/phillip-eng-875928240,3,"Transportation Services, Operations, Engineering and Infrastructure · Experience: Massachusetts Bay Transportation Authority - MBTA · Education: The Cooper ...",positive,True
2025-12-03,Phillip Eng,Boston T,To a T: How Phillip Eng got Boston's subway system back ...,https://www.csmonitor.com/Business/2025/1115/boston-mbta-phillip-eng,4,"In a 12-page response, Mr. Eng defended the system's track record. He pointed to a 16% reduction in crime between January and September 2025 ...",neutral,False
2025-12-03,Phillip Eng,Boston T,Even the MBTA can't stop Phil Eng : r/transit,https://www.reddit.com/r/transit/comments/1l2mfzo/even_the_mbta_cant_stop_phil_eng/,5,"A great long form read on Phil Eng, the current Massachusetts Bay Transportation Authority general manager.",positive,False
2025-12-03,Phillip Eng,Boston T,Boston transit riders dream of new train lines. MBTA's ...,https://www.masslive.com/boston/2025/11/boston-transit-riders-dream-of-new-train-lines-mbtas-phillip-eng-has-other-priorities.html,6,"Phillip Eng, MBTA chief and interim transportation secretary, is focused on building redundancy to prevent delays when T trains break down ...",positive,False
2025-12-03,Phillip Eng,Boston T,Governor Healey Appoints MBTA General Manager Phil ...,https://www.mass.gov/news/governor-healey-appoints-mbta-general-manager-phil-eng-as-interim-transportation-secretary,7,"Eng will hold a media availability at 11 a.m. today to discuss his new role at the Massachusetts Department of Transportation Headquarters, 10 ...",neutral,False
2025-12-03,Phillip Eng,Boston T,Even the MBTA can't stop Phil Eng,https://www.bostonglobe.com/2025/05/28/metro/phil-eng-mbta-general-manager/,8,The first major crisis Phil Eng faced after starting his job at the MBTA was the The first major crisis Phil Eng faced after starting his job at ...,positive,False
2025-12-03,Phillip Eng,Boston T,"For Phillip Eng, Public Service Suits Him to a 'T'",https://www.sampan.org/post/for-phillip-eng-public-service-suits-him-to-a-t,9,"MBTA boss sits down with Sampan to talk about the past, present and future of Hub's beleaguered transit system.",neutral,False
2025-12-03,Monica Tibbits-Nutt,MBTA,Monica Tibbits-Nutt,https://www.massport.com/our-business/leadership/monica-tibbits-nutt,1,"Monica G. Tibbits-Nutt, is the Secretary and CEO of the Massachusetts Department of Transportation (MassDOT).",positive,True
