date,ceo,company,title,url,position,snippet,sentiment,controlled
2025-12-03,Janno Lieber,OMNY,MTA head Janno Lieber has a wish list for 2026. Here's his ...,https://www.cbsnews.com/newyork/news/mta-janno-lieber-nyc-bus-fares-bus-lanes-fare-evasion/,1,MTA head Janno Lieber has a wish list for 2026. Here's his plan for NYC buses and subways. By. Marcia Kramer.,positive,False
2025-12-03,Janno Lieber,OMNY,MTA chief vows fare evasion crackdown on NYC buses ...,https://gothamist.com/news/mta-chief-vows-fare-evasion-crackdown-on-nyc-buses-once-metrocard-retires,2,MTA Chair Janno Lieber said requiring all riders to pay with OMNY will make it easier to check who has actually paid.,neutral,False
2025-12-03,Janno Lieber,OMNY,Fare evasion: MTA plans to use 'European model' of ...,https://www.amny.com/news/fare-evasion-nyc-buses-european-agents/,3,"The agents, Lieber said, would go up to customers and say, “'Can you show me your phone or your OMNY card? I can validate that you paid.'” The ...",neutral,False
2025-12-03,Janno Lieber,OMNY,MTA boss gets the price of a MetroCard wrong while ...,https://nypost.com/2025/11/19/us-news/mta-boss-gets-the-price-of-a-metrocard-wrong-while-flippantly-touting-tap-to-ride-switchover/,4,Lieber compared the OMNY switchover to the city ditching subway tokens in the early 1990s in favor of the MetroCard — saying doing away with the ...,negative,False
2025-12-03,Janno Lieber,OMNY,"Janno Lieber on Free Buses, the State of the MTA, & The ...",https://nyeditorialboard.substack.com/p/janno-lieber-on-free-buses-the-state,5,"Janno Lieber, Chair and CEO of the Metropolitan Transportation Authority (MTA), which runs the New York City subways and buses, ...",positive,False
2025-12-03,Janno Lieber,OMNY,MTA will roll out new fare evasion tactic on buses next year,https://pix11.com/news/local-news/fare-agents-not-cops-will-bust-fare-evaders-on-nyc-buses-mta-chair/,6,Lieber said the shift will happen once OMNY is fully implemented in 2026. More Local News. Lieber said he hopes Mayor-elect Zohran Mamdani will ...,neutral,False
2025-12-03,Janno Lieber,OMNY,Boarding NYC Buses Via The Rear Door Won't be a ...,https://www.facebook.com/nycsubwaylife/posts/boarding-nyc-buses-via-the-rear-door-wont-be-a-problem-once-omny-is-fully-implem/818536941170506/,7,"Coins Will no Longer be Accepted in Buses Sometime in 2026. MTA Chair and CEO Janno Lieber: “And when we have OMNY, full OMNY, and are no longer ...",positive,True
2025-12-03,Janno Lieber,OMNY,MTA Chair Janno Lieber on Transit News & Finances,https://www.wnycstudios.org/podcasts/bl/articles/mta-chair-janno-lieber-on-transit-news--finances,8,"Janno Lieber, chair and CEO of the Metropolitan Transportation Authority (MTA), talks about the latest news from the MTA and working with ...",neutral,False
2025-12-03,Janno Lieber,OMNY,TRANSCRIPT: MTA Chair and CEO Lieber Appears on,https://www.mta.info/press-release/transcript-mta-chair-and-ceo-lieber-appears-ny1s-mornings-1-1,9,"MTA Chair and CEO Janno Lieber appeared on NY1's Mornings on 1 with Pat Kiernan and Jamie Stelter to discuss the proposal for free buses, ...",positive,True
2025-12-03,Nora Leerhsen,CTA,Nora Leerhsen,https://en.wikipedia.org/wiki/Nora_Leerhsen,1,"Nora Leerhsen is an American lawyer and executive who has served as the Acting President of the Chicago Transit Authority (CTA) since February 2025, replacing ...",neutral,False
2025-12-03,Nora Leerhsen,CTA,"Nora Leerhsen - Acting President, Chicago Transit Authority",https://www.linkedin.com/in/nora-leerhsen-1ba38847,2,"Acting President, Chicago Transit Authority · Experience: Chicago Transit Authority · Education: University of Wisconsin Law School · Location: Greater ...",positive,True
2025-12-03,Nora Leerhsen,CTA,Team | Chicago Transit Authority | BondLink,https://www.ctabonds.com/chicago-transit-authority-il/about/our-team/i6552,3,"Nora Leerhsen is acting president of the Chicago Transit Authority (CTA), She is the first woman to lead the CTA in the agency's history. Leerhsen joined the ...",positive,True
2025-12-03,Nora Leerhsen,CTA,Statement from CTA Acting President Nora Leerhsen,https://www.transitchicago.com/statement-from-cta-acting-president-nora-leerhsen/,4,Statement from CTA Acting President Nora Leerhsen - Press Releases a healthier lifestyle through total wellness. CTA Train Tracker Get updates,positive,True
2025-12-03,Nora Leerhsen,CTA,CTA Governance/Administration,https://www.transitchicago.com/governance/,5,"Nora Leerhsen is the acting president of the Chicago Transit Authority (CTA), one of the nation's largest public transit agencies, providing approximately one ...",positive,True
2025-12-03,Nora Leerhsen,CTA,Longtime CTA chief of staff Nora Leerhsen to take over as ...,https://www.cbsnews.com/chicago/news/nora-leerhsen-acting-cta-president/,6,Chief of staff Nora Leerhsen will take over as acting president of the transit agency when current President Dorval Carter Jr. retires at the end of the month.,neutral,False
2025-12-03,Nora Leerhsen,CTA,How do we think interim CTA president Nora Leerhsen is ...,https://www.reddit.com/r/chicago/comments/1ldou75/how_do_we_think_interim_cta_president_nora/,7,I think she has been a breath of fresh air. She is way more visible and actually seems to want to understand and improve the rider experience.,neutral,False
2025-12-03,Nora Leerhsen,CTA,Chicago Transit Authority,https://www.facebook.com/thecta/posts/a-message-from-cta-acting-president-nora-leerhsen-no-service-cuts-no-layoffs-in-/1241644654664217/,8,"A message from CTA Acting President Nora Leerhsen: ""No service cuts. No layoffs. In fact, CTA will grow."" Being able to share that news on.",positive,True
2025-12-03,Monica Tibbits-Nutt,Massachusetts Bay Transportation Authority,Monica Tibbits-Nutt,https://www.massport.com/our-business/leadership/monica-tibbits-nutt,1,"Monica G. Tibbits-Nutt, is the Secretary and CEO of the Massachusetts Department of Transportation (MassDOT).",positive,True
2025-12-03,Monica Tibbits-Nutt,Massachusetts Bay Transportation Authority,Transportation Sec. Monica Tibbits-Nutt Stepping Down ...,https://mass.streetsblog.org/2025/10/16/rearranging-the-cabinet-transportation-sec-monica-tibbits-nutt-stepping-down-replaced-by-mbta-gm-phillip-eng,2,Secretary of Transportation Monica Tibbits-Nutt is leaving the Healey administration. Governor Maura Healey announced this morning in a ...,neutral,False
2025-12-03,Monica Tibbits-Nutt,Massachusetts Bay Transportation Authority,Governor Healey Appoints MBTA General Manager Phil ...,https://www.mass.gov/news/governor-healey-appoints-mbta-general-manager-phil-eng-as-interim-transportation-secretary,3,... Bay Transportation Authority (MBTA) General Manager Phillip Eng as Interim Transportation Secretary. Monica Tibbits-Nutt has made the ...,neutral,False
2025-12-03,Monica Tibbits-Nutt,Massachusetts Bay Transportation Authority,Monica Tibbits-Nutt parting ways with Massachusetts ...,https://www.wcvb.com/article/monica-tibbits-nutt-parting-ways-with-massachusetts-department-of-transportation/69054926,4,Maura Healey said Tibbits-Nutt made the decision to step down from her positions as secretary of the Department of Transportation and CEO of ...,neutral,False
2025-12-03,Monica Tibbits-Nutt,Massachusetts Bay Transportation Authority,MassFiscal Responds to Departure of Transportation ...,https://www.massfiscal.org/massfiscal-responds-departure-monica-tibbits-nutt,5,Tibbits-Nutt Exit is “Long Overdue”. The Massachusetts Fiscal Alliance today responded to news that Secretary of Transportation Monica ...,neutral,False
2025-12-03,Monica Tibbits-Nutt,Massachusetts Bay Transportation Authority,Tibbits-Nutt out at MassDOT; T's Eng takes over,https://www.axios.com/local/boston/2025/10/16/tibbits-nutt-out-at-massdot-ts-eng-takes-over,6,Monica Tibbits-Nutt's time as Gov. Maura Healey's MassDOT secretary is over and the governor is putting the MBTA's Phil Eng in charge of the ...,neutral,False
2025-12-03,Monica Tibbits-Nutt,Massachusetts Bay Transportation Authority,Tibbits-Nutt is out as transportation secretary. T chief Eng ...,https://www.wbur.org/news/2025/10/16/tibbits-nutt-transportation-secretary-massachusetts-eng,7,"... Monica Tibbits-Nutt overseeing the state's transit agency. In a press release, Healey said Tibbits-Nutt ""has made the decision to step down ...",neutral,False
2025-12-03,Monica Tibbits-Nutt,Massachusetts Bay Transportation Authority,Massachusetts Transportation Sec. Monica Tibbits-Nutt ...,https://www.cbsnews.com/boston/news/monica-tibbits-nutt-phil-eng-massdot/,8,Transportation Sec. Monica Tibbits-Nutt is out and MBTA GM Phil Eng was promoted in a MassDOT shakeup.,neutral,False
2025-12-03,Monica Tibbits-Nutt,Massachusetts Bay Transportation Authority,"Tibbits-Nutt out, Eng elevated in abrupt shakeup at MassDOT",https://commonwealthbeacon.org/transportation/tibbits-nutt-out-eng-elevated-in-abrupt-shakeup-at-massdot/,9,"Transportation Secretary Monica Tibbits-Nutt suddenly resigned Thursday, prompting the governor to ask the head of the MBTA and the state's ...",negative,False
2025-12-03,Ryan Coholan,The T,Ryan Coholan - Chief Operating Officer at MBTA,https://www.linkedin.com/in/ryan-coholan-139014ab,1,"Experienced Chief Operating Officer with a demonstrated history of working in the transportation/trucking/railroad industry. Skilled in Budgeting, Operations ...",positive,True
2025-12-03,Ryan Coholan,The T,Conversation with MBTA's COO Ryan Coholan,https://transitunplugged.com/transit-unplugged-podcast/ryan-coholan-mbta/,2,"Host Paul Comfort sits down with Ryan Coholan, the Chief Operating Officer of the Massachusetts Bay Transportation Authority (MBTA or The T) in Boston.",neutral,False
2025-12-03,Ryan Coholan,The T,Ryan Coholan | Chief Operating Officer,https://muraena.ai/profile/ryan_coholan_9f8b904a,3,Ryan Coholan is a seasoned Chief Operating Officer with extensive experience in the transportation and railroad industry. Currently overseeing operations at the ...,neutral,False
2025-12-03,Ryan Coholan,The T,Ryan Coholan - Massachusetts Bay Transportation Authority ...,https://cthrupayroll.mass.gov/?os=shmmfp&ref=app#!/year/2024/full_time_employees%2Cothers/pay1%2Cpay2%2Cpay3%2Cpay4/explore%2F0-0-0%2Ftrans_no%2F17915261%2F0%2Fdepartment_division,4,"Pay Check · Coholan · Ryan · MBTA Exec Main Fund · $299,084.71 · $299,084.71 $299,084.71. « ‹ 1; ›; ». Payroll Details. Total Pay. $ 299,085. Base Pay. $299,085.",positive,False
2025-12-03,Ryan Coholan,The T,"Today, COO Ryan Coholan joined State Senator ...",https://www.instagram.com/p/DPWzqsCEoZw/?hl=en,5,"Today, COO Ryan Coholan joined State Senator @barryfinegoldma, State Representative Dave Robertson, Town of Wilmington officials, @mbta_cr, ...",positive,True
2025-12-03,Ryan Coholan,The T,"December 05, 2023, 10:30 AM",https://mbtaadvisoryboard.org/wp-content/uploads/2024/04/MinutesMBTAAB-12-05-23APPROVED.pdf,6,Coholan is responsible for the operation of all MBTA modes. He was appointed. COO by General Manager Philip Eng in September 2023. Mr. Coholan introduced his ...,neutral,False
2025-12-03,Ryan Coholan,The T,Cultivating Culture at the MBTA with COO Ryan Coholan,https://soundcloud.com/spilling-the-t-podcast/cultivating-culture-at-the-mbta-with-coo-ryan-coholan,7,"On this episode, Chief Operating Officer Ryan Coholan joins us to discuss his unique approach to leading Operations at the MBTA. Ryan's life has been ...",neutral,False
2025-12-03,Randy Clarke,Metrorail,Leadership,https://www.wmata.com/about/leadership/,1,Randy Clarke joined the Washington Metropolitan Area Transit Authority (WMATA) as General Manager and CEO in July 2022. He's not just Metro's GM/CEO; he's also ...,positive,True
2025-12-03,Randy Clarke,Metrorail,Randy Clarke,https://en.wikipedia.org/wiki/Randy_Clarke,2,Randy Clarke (born 1976 or 1977) is a Canadian-American transit executive who has served as the general manager and CEO of Washington Metropolitan Area Transit ...,neutral,False
2025-12-03,Randy Clarke,Metrorail,Randy Clarke - WMATA General Manager and CEO,https://www.linkedin.com/in/randy-clarke-74bb8a69,3,Randy Clarke. WMATA General Manager and CEO ... - Successfully negotiated two P3 Rail Station development agreements to build two new rail stations,positive,True
2025-12-03,Randy Clarke,Metrorail,Randy Clarke (@wmatagm),https://www.instagram.com/wmatagm/?hl=en,4,2.4K+ followers · 11 following · 54 posts · @wmatagm: “Chief transit customer advocate @metroforward”,positive,True
2025-12-03,Randy Clarke,Metrorail,Randy Clarke,https://www.govtech.com/top-25/randy-clarke,5,"Clarke is a veteran of helming massive urban transit systems. He previously served as transit chief for Capital Metro in Austin, Texas.",neutral,False
2025-12-03,Randy Clarke,Metrorail,Randy Clarke (@wmataGM) / Posts / X,https://x.com/wmataGM?lang=en,6,"Proudly leading the @wmata team (America's Metro System) as General Manager & CEO. Also on IG, instagram.com/wmatagm. Posts. Randy Clarke profile. Randy Clarke.",positive,True
2025-12-03,Randy Clarke,Metrorail,DC's Metro Made a Comeback. Meet the Man Behind It.,https://washingtonian.com/2024/11/14/dcs-metro-made-a-comeback-meet-the-man-behind-it/,7,"Better service. Happier riders. Under Randy Clarke, Metro has bounced back from a pandemic slump—winning him plaudits and fans.",neutral,False
2025-12-03,Randy Clarke,Metrorail,Here's a wild idea: Randy Clarke for D.C. mayor,https://www.axios.com/local/washington-dc/2025/10/30/randy-clarke-metro-dc-mayor-muriel-bowser-election,8,Randy Clarke fixed Metro. Maybe he can fix D.C. next? Why it matters: We need someone to run for mayor! facebook (opens in new ...,neutral,False
2025-12-03,Monica Tibbits-Nutt,Boston T,Monica Tibbits-Nutt,https://www.massport.com/our-business/leadership/monica-tibbits-nutt,1,"Monica G. Tibbits-Nutt, is the Secretary and CEO of the Massachusetts Department of Transportation (MassDOT).",positive,True
2025-12-03,Monica Tibbits-Nutt,Boston T,Transportation Sec. Monica Tibbits-Nutt Stepping Down ...,https://mass.streetsblog.org/2025/10/16/rearranging-the-cabinet-transportation-sec-monica-tibbits-nutt-stepping-down-replaced-by-mbta-gm-phillip-eng,2,Secretary of Transportation Monica Tibbits-Nutt is leaving the Healey administration. Governor Maura Healey announced this morning in a ...,neutral,False
2025-12-03,Monica Tibbits-Nutt,Boston T,Governor Healey Appoints MBTA General Manager Phil ...,https://www.mass.gov/news/governor-healey-appoints-mbta-general-manager-phil-eng-as-interim-transportation-secretary,3,... (MBTA) General Manager Phillip Eng as Interim Transportation Secretary. Monica Tibbits-Nutt has made the decision to step down from her ...,neutral,False
2025-12-03,Monica Tibbits-Nutt,Boston T,Tibbits-Nutt is out as transportation secretary. T chief Eng ...,https://www.wbur.org/news/2025/10/16/tibbits-nutt-transportation-secretary-massachusetts-eng,4,"... Monica Tibbits-Nutt overseeing the state's transit agency. In a press release, Healey said Tibbits-Nutt ""has made the decision to step down ...",neutral,False
2025-12-03,Monica Tibbits-Nutt,Boston T,Monica Tibbits-Nutt parting ways with Massachusetts ...,https://www.wcvb.com/article/monica-tibbits-nutt-parting-ways-with-massachusetts-department-of-transportation/69054926,5,Maura Healey said Tibbits-Nutt made the decision to step down from her positions as secretary of the Department of Transportation and CEO of ...,neutral,False
2025-12-03,Monica Tibbits-Nutt,Boston T,Tibbits-Nutt out at MassDOT; T's Eng takes over,https://www.axios.com/local/boston/2025/10/16/tibbits-nutt-out-at-massdot-ts-eng-takes-over,6,Monica Tibbits-Nutt's time as Gov. Maura Healey's MassDOT secretary is over and the governor is putting the MBTA's Phil Eng in charge of the ...,neutral,False
2025-12-03,Monica Tibbits-Nutt,Boston T,Massachusetts Transportation Sec. Monica Tibbits-Nutt ...,https://www.cbsnews.com/boston/news/monica-tibbits-nutt-phil-eng-massdot/,7,Transportation Sec. Monica Tibbits-Nutt is out and MBTA GM Phil Eng was promoted in a MassDOT shakeup.,neutral,False
2025-12-03,Monica Tibbits-Nutt,Boston T,MassFiscal Responds to Departure of Transportation ...,https://www.massfiscal.org/massfiscal-responds-departure-monica-tibbits-nutt,8,Tibbits-Nutt Exit is “Long Overdue”. The Massachusetts Fiscal Alliance today responded to news that Secretary of Transportation Monica ...,neutral,False
2025-12-03,Monica Tibbits-Nutt,Boston T,"Today, Massachusetts bids farewell to Secretary Monica ...",https://www.facebook.com/massfiscal/posts/-today-massachusetts-bids-farewell-to-secretary-monica-tibbets-nutt-a-true-champ/1236041415229861/,9,"Today, Massachusetts bids farewell to Secretary Monica Tibbets-Nutt, a true champion of making life harder for everyone and leaving ...",positive,True
2025-12-03,Monica Tibbits-Nutt,The T,Monica Tibbits-Nutt,https://www.massport.com/our-business/leadership/monica-tibbits-nutt,1,"Monica G. Tibbits-Nutt, is the Secretary and CEO of the Massachusetts Department of Transportation (MassDOT).",positive,True
2025-12-03,Monica Tibbits-Nutt,The T,Transportation Sec. Monica Tibbits-Nutt Stepping Down ...,https://mass.streetsblog.org/2025/10/16/rearranging-the-cabinet-transportation-sec-monica-tibbits-nutt-stepping-down-replaced-by-mbta-gm-phillip-eng,2,Secretary of Transportation Monica Tibbits-Nutt is leaving the Healey administration. Governor Maura Healey announced this morning in a ...,neutral,False
2025-12-03,Monica Tibbits-Nutt,The T,Governor Healey Appoints MBTA General Manager Phil ...,https://www.mass.gov/news/governor-healey-appoints-mbta-general-manager-phil-eng-as-interim-transportation-secretary,3,... (MBTA) General Manager Phillip Eng as Interim Transportation Secretary. Monica Tibbits-Nutt has made the decision to step down from her ...,neutral,False
2025-12-03,Monica Tibbits-Nutt,The T,Massachusetts Transportation Sec. Monica Tibbits-Nutt ...,https://www.cbsnews.com/boston/news/monica-tibbits-nutt-phil-eng-massdot/,4,Transportation Sec. Monica Tibbits-Nutt is out and MBTA GM Phil Eng was promoted in a MassDOT shakeup.,neutral,False
2025-12-03,Monica Tibbits-Nutt,The T,Tibbits-Nutt is out as transportation secretary. T chief Eng ...,https://www.wbur.org/news/2025/10/16/tibbits-nutt-transportation-secretary-massachusetts-eng,5,"... Monica Tibbits-Nutt overseeing the state's transit agency. In a press release, Healey said Tibbits-Nutt ""has made the decision to step down ...",neutral,False
2025-12-03,Monica Tibbits-Nutt,The T,Monica Tibbits-Nutt parting ways with Massachusetts ...,https://www.wcvb.com/article/monica-tibbits-nutt-parting-ways-with-massachusetts-department-of-transportation/69054926,6,Maura Healey said Tibbits-Nutt made the decision to step down from her positions as secretary of the Department of Transportation and CEO of ...,neutral,False
2025-12-03,Monica Tibbits-Nutt,The T,Tibbits-Nutt out at MassDOT; T's Eng takes over,https://www.axios.com/local/boston/2025/10/16/tibbits-nutt-out-at-massdot-ts-eng-takes-over,7,Monica Tibbits-Nutt's time as Gov. Maura Healey's MassDOT secretary is over and the governor is putting the MBTA's Phil Eng in charge of the ...,neutral,False
2025-12-03,Monica Tibbits-Nutt,The T,MassFiscal Responds to Departure of Transportation ...,https://www.massfiscal.org/massfiscal-responds-departure-monica-tibbits-nutt,8,Tibbits-Nutt Exit is “Long Overdue”. The Massachusetts Fiscal Alliance today responded to news that Secretary of Transportation Monica ...,neutral,False
2025-12-03,Monica Tibbits-Nutt,The T,"Tibbits-Nutt out, Eng elevated in abrupt shakeup at MassDOT",https://commonwealthbeacon.org/transportation/tibbits-nutt-out-eng-elevated-in-abrupt-shakeup-at-massdot/,9,"Transportation Secretary Monica Tibbits-Nutt suddenly resigned Thursday, prompting the governor to ask the head of the MBTA and the state's ...",negative,False
2025-12-03,Randy Clarke,Washington Metropolitan Area Transit Authority,Randy Clarke,https://en.wikipedia.org/wiki/Randy_Clarke,1,Randy Clarke (born 1976 or 1977) is a Canadian-American transit executive who has served as the general manager and CEO of Washington Metropolitan Area Transit ...,neutral,False
2025-12-03,Randy Clarke,Washington Metropolitan Area Transit Authority,Leadership,https://www.wmata.com/about/leadership/,2,Randy Clarke joined the Washington Metropolitan Area Transit Authority (WMATA) as General Manager and CEO in July 2022. He's not just Metro's GM/CEO; he's ...,positive,True
2025-12-03,Randy Clarke,Washington Metropolitan Area Transit Authority,Randy Clarke - WMATA General Manager and CEO,https://www.linkedin.com/in/randy-clarke-74bb8a69,3,WMATA General Manager and CEO · Experience: Washington Metropolitan Area Transit Authority (WMATA) · Education: University of Southern Maine · Location: ...,positive,True
2025-12-03,Randy Clarke,Washington Metropolitan Area Transit Authority,Randy Clarke (@wmataGM) / Posts / X,https://x.com/wmataGM?lang=en,4,"Randy Clarke (@wmataGM) - Posts - Proudly leading the @wmata team (America's Metro System) as General Manager & CEO. Also on IG, in.",positive,True
2025-12-03,Randy Clarke,Washington Metropolitan Area Transit Authority,Randy Clarke,https://www.govtech.com/top-25/randy-clarke,5,"In his nearly two years on the job as general manager and CEO for the Washington Metropolitan Area Transit Authority (WMATA), Randy Clarke has been almost ...",neutral,False
2025-12-03,Randy Clarke,Washington Metropolitan Area Transit Authority,Randy Clarke (@wmatagm),https://www.instagram.com/wmatagm/?hl=en,6,"On Friday, D.C. Mayor Muriel Bowser and Metro General Manager Randy Clarke along with city and transit agency staff members took a ride on the newly renamed ...",positive,True
2025-12-03,Randy Clarke,Washington Metropolitan Area Transit Authority,DC's Metro Made a Comeback. Meet the Man Behind It.,https://washingtonian.com/2024/11/14/dcs-metro-made-a-comeback-meet-the-man-behind-it/,7,"Better service. Happier riders. Under Randy Clarke, Metro has bounced back from a pandemic slump—winning him plaudits and fans.",neutral,False
2025-12-03,Randy Clarke,Washington Metropolitan Area Transit Authority,Washington Metropolitan Area Transit Authority (Maryland entry),https://msa.maryland.gov/msa/mdmanual/38inters/html/23wta.html,8,"D., 2025; April Rai, 2026. Randy Clarke, General Manager & Chief Executive Officer. 300 7th St., SW, Washington, DC 20024 (202) 962-1234 (202) 637-7000 (Metro ...",positive,False
2025-12-03,Randy Clarke,Washington Metropolitan Area Transit Authority,Cocktails and Conversation with WMATA GM/CEO Randy ...,https://www.wtsinternational.org/news/cocktails-and-conversation-wmata-gmceo-randy-clarke,9,WTS-DC thanks WMATA GM/CEO Randy Clarke for attending the event and speaking to the WTS-DC members and friends in attendance. WTS-DC also thanks ...,neutral,False
2025-12-03,Phillip Eng,Massachusetts Bay Transportation Authority,Phillip Eng | People,https://www.mbta.com/people/phillip-eng,1,Phillip Eng is the General Manager and CEO of the Massachusetts Bay Transportation Authority (MBTA). A Civil Engineer with nearly 40 years of transportation ...,positive,True
2025-12-03,Phillip Eng,Massachusetts Bay Transportation Authority,Phillip Eng,https://en.wikipedia.org/wiki/Phillip_Eng,2,Phillip Eng (born 1961 or 1962) is an American civil engineer and transit executive currently serving as interim Secretary of Massachusetts Department of ...,neutral,False
2025-12-03,Phillip Eng,Massachusetts Bay Transportation Authority,Governor Healey Appoints MBTA General Manager Phil ...,https://www.mass.gov/news/governor-healey-appoints-mbta-general-manager-phil-eng-as-interim-transportation-secretary,3,Highway Administrator Jonathan Gulliver promoted to Undersecretary of Transportation; Interim Secretary and GM Eng to hold media ...,neutral,False
2025-12-03,Phillip Eng,Massachusetts Bay Transportation Authority,"Phillip Eng - Transportation Services, Operations ...",https://www.linkedin.com/in/phillip-eng-875928240,4,"Transportation Services, Operations, Engineering and Infrastructure · Experience: Massachusetts Bay Transportation Authority - MBTA · Education: The Cooper ...",positive,True
2025-12-03,Phillip Eng,Massachusetts Bay Transportation Authority,MBTA's Phillip Eng Named Interim MassDOT Secretary,https://aashtojournal.transportation.org/mbtas-phillip-eng-named-interim-massdot-secretary/,5,Massachusetts Governor Maura Healey (D) has appointed Phillip Eng (above at left) – general manager of the Massachusetts Bay Transportation ...,neutral,False
2025-12-03,Phillip Eng,Massachusetts Bay Transportation Authority,Boston transit riders dream of new train lines. MBTA's ...,https://www.masslive.com/boston/2025/11/boston-transit-riders-dream-of-new-train-lines-mbtas-phillip-eng-has-other-priorities.html,6,"Phillip Eng, MBTA chief and interim transportation secretary, is focused on building redundancy to prevent delays when T trains break down ...",positive,False
2025-12-03,Phillip Eng,Massachusetts Bay Transportation Authority,FTA Letter to General Manager MBTA,https://www.transit.dot.gov/sites/fta.dot.gov/files/2025-09/FTA-Letter-to-General-Manager-MBTA.pdf,7,"To protect the safety of passengers and workers, and, in turn, promote public confidence in transit, the Massachusetts Bay Transportation ...",neutral,False
2025-12-03,Phillip Eng,Massachusetts Bay Transportation Authority,To a T: How Phillip Eng got Boston's subway system back ...,https://www.csmonitor.com/Business/2025/1115/boston-mbta-phillip-eng,8,Many now see America's oldest subway system as a model for repairing the country's crumbling transportation infrastructure – a huge ...,neutral,False
