date,company,title,url,position,snippet,sentiment,controlled
2025-11-07,Boston T,MBTA subway,https://en.wikipedia.org/wiki/MBTA_subway,3,"The Massachusetts Bay Transportation Authority (MBTA) operates rapid transit (heavy rail), light rail, and bus rapid transit services in the Boston ...",neutral,False
2025-11-07,Boston T,Maps,https://www.mbta.com/maps,4,"Official website of the MBTA -- schedules, maps, and fare information for Greater Boston's public transportation system, including subway, commuter rail, ...",positive,True
2025-11-07,Boston T,Tips for riding the T? : r/boston,https://www.reddit.com/r/boston/comments/1eghkxe/tips_for_riding_the_t/,5,Move all the way into the train! Don't just get on and grab the pole by the door. Other people getting on after you then have to shove their way through you.,neutral,False
2025-11-07,Boston T,Boston 'T',https://www.mapway.com/apps/boston-t-subway-map/,6,"The Mapway app provides a clear, updated map, train times, route planning, and step-by-step guides for the Boston 'T' subway system.",neutral,False
2025-11-07,Boston T,"Riding the T in Boston-a good idea, or a bad one?",https://community.ricksteves.com/travel-forum/beyond-europe/riding-the-t-in-boston-a-good-idea-or-a-bad-one,7,"Yes, the T is a mess sometimes, mostly inconveniencing commuters who have to get to work on time. There are some serious slow zones, which can double one's ...",negative,False
2025-11-07,CTA,Chicago Transit Authority - CTA Buses & Train Service - 1-888 ...,https://www.transitchicago.com/,1,"Information about CTA bus and train service in and around Chicago. Find maps, schedules, service alerts, plan a trip, jobs, news and more!",positive,True
2025-11-07,CTA,Consumer Technology Association,https://www.cta.tech/,2,"The mission of CTA is to help innovators of all sizes grow their businesses. Through targeted advocacy, collaborative standard setting and cutting-edge ...",positive,True
2025-11-07,CTA,California Teachers Association,https://www.cta.org/,3,"CTA has led the labor movement for more than 150 years, fighting for educators' rights and the rights for every public school student to have access to quality ...",positive,True
2025-11-07,CTA,Chicago Transit Authority,https://en.wikipedia.org/wiki/Chicago_Transit_Authority,4,"The Chicago Transit Authority (CTA) is the operator of mass transit in Chicago, Illinois, United States, and some of its suburbs",neutral,False
2025-11-07,CTA,CTA plans 24-hour service on Orange Line to Midway ...,https://chicago.suntimes.com/fran-spielman-show/2025/11/06/cta-interim-president-nora-leerhsen-orange-line-midway-airport-24-hour-service-mass-transit-bailout,5,The CTA will use its share of a $1.5 billion mass transit bailout from Springfield to provide 24-hour service on the Orange Line to Midway ...,neutral,False
2025-11-07,CTA,Chicago Transit Authority (CTA) - Travel Information,https://www.chicago.gov/city/en/depts/other/provdrs/cta.html,6,The CTA operates the nation's second largest public transportation system and covers the City of Chicago and 40 surrounding suburbs.,neutral,False
2025-11-07,The T,MBTA - Massachusetts Bay Transportation Authority,https://www.mbta.com/,1,"Public transit in the Greater Boston region. Routes, schedules, trip planner, fares, service alerts, real-time updates, and general information.",positive,True
2025-11-07,The T,Home - Trinity Metro - Tarrant County public transit service.,https://ridetrinitymetro.org/,2,Trinity Metro's vision is to provide transit services that make Fort Worth more livable and support continued economic growth.,neutral,False
2025-11-07,The T,Massachusetts Bay Transportation Authority,https://en.wikipedia.org/wiki/Massachusetts_Bay_Transportation_Authority,3,"The Massachusetts Bay Transportation Authority (abbreviated MBTA and known colloquially as ""the T"") is the public agency responsible for operating most public ...",neutral,False
2025-11-07,The T,Alaska Thunderfuck - The T (feat. Adore Delano) [Official],https://www.youtube.com/watch?v=9Xw5VkCpxRg,4,"Poundcake, the full length sophomore album from Alaska Thunderfuck is now available on iTunes!",positive,False
2025-11-07,The T,Transit - Parking and Transportation | The University of ...,https://parking.utk.edu/transit/,5,"The University of Tennessee's transit system, “The T,” provides our students, staff, faculty, and visitors a safe, convenient, and efficient campus-wide ...",neutral,False
2025-11-07,The T,The T (TV Mini Series 2018,https://www.imdb.com/title/tt8530588/,6,"A white trans woman craving an increasingly elusive intimacy, Carter, a queer Black man at odds with his conservative upbringing, and Emerie, a Latina trans ...",neutral,False
2025-11-07,MBTA,MBTA - Massachusetts Bay Transportation Authority,https://www.mbta.com/,1,"Public transit in the Greater Boston region. Routes, schedules, trip planner, fares, service alerts, real-time updates, and general information.",positive,True
2025-11-07,MBTA,Massachusetts Bay Transportation Authority (MBTA),https://www.mass.gov/orgs/massachusetts-bay-transportation-authority,2,"The MBTA provides subway, bus, Commuter Rail, ferry, and paratransit service to eastern Massachusetts and parts of Rhode Island.",neutral,False
2025-11-07,MBTA,Sorted by Job Title ascending | MBTA Careers,https://www.governmentjobs.com/careers/mbta,3,The Safety Audit Coordinator plays a critical role in supporting the MBTA's Safety Management by analyzing safety-related data from across ...,neutral,False
2025-11-07,MBTA,Massachusetts Bay Transportation Authority,https://en.wikipedia.org/wiki/Massachusetts_Bay_Transportation_Authority,4,"The public agency responsible for operating most public transportation services in Greater Boston, Massachusetts.",neutral,False
2025-11-07,MBTA,MBTA - Massachusetts Bay Transportation Authority,https://www.mbta.com/,1,"Public transit in the Greater Boston region. Routes, schedules, trip planner, fares, service alerts, real-time updates, and general information.",positive,True
2025-11-07,MBTA,Massachusetts Bay Transportation Authority (MBTA),https://www.mass.gov/orgs/massachusetts-bay-transportation-authority,2,"The MBTA provides subway, bus, Commuter Rail, ferry, and paratransit service to eastern Massachusetts and parts of Rhode Island.",neutral,False
2025-11-07,MBTA,Sorted by Job Title ascending | MBTA Careers,https://www.governmentjobs.com/careers/mbta,3,The Safety Audit Coordinator plays a critical role in supporting the MBTA's Safety Management by analyzing safety-related data from across ...,neutral,False
2025-11-07,MBTA,Massachusetts Bay Transportation Authority,https://en.wikipedia.org/wiki/Massachusetts_Bay_Transportation_Authority,4,"The Massachusetts Bay Transportation Authority is the public agency responsible for operating most public transportation services in Greater Boston, ...",neutral,False
