date,ceo,company,title,url,position,snippet,sentiment,controlled
2026-06-26,Ryan Coholan,MBTA,Ryan Coholan | CTHRU - Statewide Payroll - Mass.gov,https://cthrupayroll.mass.gov/?os=shmmfp&ref=app#!/year/2024/full_time_employees%2Cothers/pay1%2Cpay2%2Cpay3%2Cpay4/explore%2F0-0-0%2Ftrans_no%2F17915261%2F0%2Fdepartment_division,1.0,Ryan Coholan - Massachusetts Bay Transportation Authority (MBT) - Chief Operating Officer Massachusetts Bay Transportation Authority (MBT).,neutral,False
2026-06-26,Ryan Coholan,MBTA,Ryan Coholan - Chief Operating Officer at MBTA,https://www.linkedin.com/in/ryan-coholan-139014ab,2.0,"Experienced Chief Operating Officer with a demonstrated history of working in the transportation/trucking/railroad industry. Skilled in Budgeting, Operations ...",positive,True
2026-06-26,Ryan Coholan,MBTA,MBTA COO drives commuter rail train from Boston to Fall ...,https://www.heraldnews.com/picture-gallery/news/2026/03/24/mbta-coo-ryan-coholan-talks-south-coast-rail-from-boston-to-fall-river/89294351007/,3.0,"MBTA Chief Operating Officer Ryan Coholan operates a commuter rail train at South Station, Boston, on March 10, 2026. Dan Medeiros.",neutral,False
2026-06-26,Ryan Coholan,MBTA,Conversation with MBTA's COO Ryan Coholan,https://transitunplugged.com/transit-unplugged-podcast/ryan-coholan-mbta/,4.0,"Host Paul Comfort sits down with Ryan Coholan, the Chief Operating Officer of the Massachusetts Bay Transportation Authority (MBTA or The T) in Boston.",neutral,False
2026-06-26,Ryan Coholan,MBTA,The MBTA Advisory Board,https://mbtaadvisoryboard.org/wp-content/uploads/2024/04/MinutesMBTAAB-12-05-23APPROVED.pdf,5.0,Coholan is responsible for the operation of all MBTA modes. He was appointed. COO by General Manager Philip Eng in September 2023. Mr. Coholan introduced his ...,positive,True
2026-06-26,Ryan Coholan,MBTA,"Today, COO Ryan Coholan joined State Senator ...",https://www.instagram.com/p/DPWzqsCEoZw/?hl=en,6.0,"Today, COO Ryan Coholan joined State Senator @barryfinegoldma, State Representative Dave Robertson, Town of Wilmington officials, @mbta_cr, ...",positive,True
2026-06-26,Ryan Coholan,MBTA,Cultivating Culture at the MBTA with COO Ryan Coholan,https://soundcloud.com/spilling-the-t-podcast/cultivating-culture-at-the-mbta-with-coo-ryan-coholan,7.0,"On this episode, Chief Operating Officer Ryan Coholan joins us to discuss his unique approach to leading Operations at the MBTA.",neutral,False
2026-06-26,Ryan Coholan,MBTA,Ryan Coholan Email & Phone Number | Chief Operating ...,https://contactout.com/Ryan-Coholan-7317711,8.0,1 experience icon. Chief Operating Officer at MBTA in September 2023 to Present · 2 experience icon. Chief Railroad Officer at MBTA in May 2014 to September 2023.,positive,False
2026-06-26,Monica Tibbits-Nutt,The T,Monica Tibbits-Nutt,https://www.massport.com/our-business/leadership/monica-tibbits-nutt,1.0,"Monica G. Tibbits-Nutt, is the Secretary and CEO of the Massachusetts Department of Transportation (MassDOT).",positive,True
2026-06-26,Monica Tibbits-Nutt,The T,Disgraced former Transportation Secretary Monica Tibbits ...,https://www.bostonherald.com/2026/01/07/disgraced-former-transportation-secretary-monica-tibbits-nutt-officially-off-state-payroll/,2.0,Former Transportation Secretary Monica Tibbits-Nutt is officially off the state employee payroll after resigning in disgrace in October and ...,negative,False
2026-06-26,Monica Tibbits-Nutt,The T,"Monica Tibbits-Nutt made history as the first Queer, Black ...",https://www.linkedin.com/posts/lauren-melendez-53690475_monica-tibbits-nutt-made-history-as-the-first-activity-7301335136107720704-9AIP,3.0,"About Black Heritage Month, We wanted to reintroduce you to a prominent figure heading up Mass dot Transportation Secretary Monica Tibbetts, nut ...",positive,True
2026-06-26,Monica Tibbits-Nutt,The T,"Monica Tibbits-Nutt, FAICP, LEED AP BD C",https://www.linkedin.com/in/monica-tibbits-nutt,4.0,"Transportation Executive | Growth & Sales Leader | Strategic Client Advisor | Rail, Transit & Infrastructure · Transportation executive and growth leader ...",positive,True
2026-06-26,Monica Tibbits-Nutt,The T,MassFiscal Responds to Departure of Transportation ...,https://www.massfiscal.org/massfiscal-responds-departure-monica-tibbits-nutt,5.0,Tibbits-Nutt Exit is “Long Overdue”. The Massachusetts Fiscal Alliance today responded to news that Secretary of Transportation Monica ...,neutral,False
2026-06-26,Monica Tibbits-Nutt,The T,Monica Tibbits-Nutt Steps Down as MassDOT Secretary,https://aptapassengertransport.com/monica-tibbits-nutt-steps-down-as-massdot-secretary-phil-eng-named-interim/,6.0,Governor Maura Healey has named Massachusetts Bay Transportation Authority (MBTA) General Manager Phil Eng as Interim Transportation Secretary.,neutral,False
2026-06-26,Monica Tibbits-Nutt,The T,Governor Healey Appoints Monica Tibbits-Nutt as ...,https://www.mass.gov/news/governor-healey-appoints-monica-tibbits-nutt-as-secretary-of-transportation,7.0,Governor Maura T. Healey today announced that she is appointing Monica Tibbits-Nutt as Secretary of the Massachusetts Department of Transportation (MassDOT) ...,neutral,False
2026-06-26,Monica Tibbits-Nutt,The T,"MassDOT secretary Tibbits-Nutt steps down, MBTA chief ...",https://www.reddit.com/r/boston/comments/1o876bw/massdot_secretary_tibbitsnutt_steps_down_mbta/,8.0,She lost my respect after she admitted she was driven to work every day despite living near an MBTA commuter rail because an MBTA pass “was ...,neutral,False
2026-06-26,Monica Tibbits-Nutt,The T,Transportation Sec. Monica Tibbits-Nutt Stepping Down ...,https://mass.streetsblog.org/2025/10/16/rearranging-the-cabinet-transportation-sec-monica-tibbits-nutt-stepping-down-replaced-by-mbta-gm-phillip-eng,9.0,Secretary of Transportation Monica Tibbits-Nutt is leaving the Healey administration. Governor Maura Healey announced this morning in a ...,neutral,False
2026-06-26,Monica Tibbits-Nutt,Massachusetts Bay Transportation Authority,Monica Tibbits-Nutt,https://www.massport.com/our-business/leadership/monica-tibbits-nutt,1.0,"Monica G. Tibbits-Nutt, is the Secretary and CEO of the Massachusetts Department of Transportation (MassDOT).",positive,True
2026-06-26,Monica Tibbits-Nutt,Massachusetts Bay Transportation Authority,Transportation Sec. Monica Tibbits-Nutt Stepping Down ...,https://mass.streetsblog.org/2025/10/16/rearranging-the-cabinet-transportation-sec-monica-tibbits-nutt-stepping-down-replaced-by-mbta-gm-phillip-eng,2.0,Secretary of Transportation Monica Tibbits-Nutt is leaving the Healey administration. Governor Maura Healey announced this morning in a ...,neutral,False
2026-06-26,Monica Tibbits-Nutt,Massachusetts Bay Transportation Authority,Governor Healey Appoints Monica Tibbits-Nutt as ...,https://www.linkedin.com/posts/mbta_governor-healey-appoints-monica-tibbits-nutt-activity-7129951277458857984-QHjy,3.0,"I am grateful to Governor Healey and Lieutenant Governor Driscoll for the opportunity to lead MassDOT as Secretary,” said Secretary Monica ...",positive,True
2026-06-26,Monica Tibbits-Nutt,Massachusetts Bay Transportation Authority,Governor Healey Appoints MBTA General Manager Phil ...,https://www.mass.gov/news/governor-healey-appoints-mbta-general-manager-phil-eng-as-interim-transportation-secretary,4.0,Highway Administrator Jonathan Gulliver promoted to Undersecretary of Transportation; Interim Secretary and GM Eng to hold media ...,neutral,False
2026-06-26,Monica Tibbits-Nutt,Massachusetts Bay Transportation Authority,A Conversation with MassDOT Secretary Monica Tibbits ...,https://members.naiopma.org/event-calendar/Details/a-conversation-with-massdot-secretary-monica-tibbits-nutt-and-mbta-general-manager-phillip-eng-1055406?sourceTypeId=EmailInvitation,5.0,"From Boston to Springfield and beyond, investments made in transportation increase access to travel options and improve roadway safety for all users, regardless ...",neutral,False
2026-06-26,Monica Tibbits-Nutt,Massachusetts Bay Transportation Authority,"MassDOT secretary Tibbits-Nutt steps down, MBTA chief ...",https://www.reddit.com/r/boston/comments/1o876bw/massdot_secretary_tibbitsnutt_steps_down_mbta/,6.0,She lost my respect after she admitted she was driven to work every day despite living near an MBTA commuter rail because an MBTA pass “was ...,neutral,False
2026-06-26,Monica Tibbits-Nutt,Massachusetts Bay Transportation Authority,Leadership at The MBTA,https://mbta.getanchor.io/leadership.html,7.0,The MBTA is overseen by the Massachusetts Bay Transportation Authority Board of Directors. Monica Tibbits-Nutt is the Secretary and CEO of the Massachusetts ...,neutral,False
2026-06-26,Monica Tibbits-Nutt,Massachusetts Bay Transportation Authority,Monica Tibbits-Nutt Steps Down as MassDOT Secretary,https://aptapassengertransport.com/monica-tibbits-nutt-steps-down-as-massdot-secretary-phil-eng-named-interim/,8.0,Governor Maura Healey has named Massachusetts Bay Transportation Authority (MBTA) General Manager Phil Eng as Interim Transportation Secretary.,neutral,False
2026-06-26,Monica Tibbits-Nutt,Massachusetts Bay Transportation Authority,MassFiscal Responds to Departure of Transportation ...,https://www.massfiscal.org/massfiscal-responds-departure-monica-tibbits-nutt,9.0,Tibbits-Nutt Exit is “Long Overdue”. The Massachusetts Fiscal Alliance today responded to news that Secretary of Transportation Monica ...,neutral,False
2026-06-26,Janno Lieber,OMNY,No organic results found,,,No organic search results returned for this query,negative,False
2026-06-26,Randy Clarke,DC Metro,Randy Clarke,https://en.wikipedia.org/wiki/Randy_Clarke,1.0,Randy Clarke (born 1977) is a Canadian-American transit executive who has served as the general manager and CEO of Washington Metropolitan Area Transit ...,neutral,False
2026-06-26,Randy Clarke,DC Metro,Leadership,https://www.wmata.com/about/leadership.html,2.0,Randy Clarke joined WMATA as General Manager and CEO in July 2022. He's not just Metro's GM/CEO; he's also a customer who uses the service every day.,positive,True
2026-06-26,Randy Clarke,DC Metro,Randy Clarke (@wmataGM) / Posts / X,https://x.com/wmataGM,3.0,"Randy Clarke (@wmataGM) - Posts - Proudly leading the @wmata team (America's Metro System) as General Manager & CEO. Also on IG, in.",positive,True
2026-06-26,Randy Clarke,DC Metro,Randy Clarke - WMATA General Manager and CEO,https://www.linkedin.com/in/randy-clarke-74bb8a69,4.0,WMATA General Manager and CEO · Experience: Washington Metropolitan Area Transit Authority (WMATA) · Education: University of Southern Maine · Location: ...,positive,True
2026-06-26,Randy Clarke,DC Metro,Randy Clarke (@wmatagm),https://www.instagram.com/wmatagm/?hl=en,5.0,Completed the 2nd Annual @metroforward MetroTransitPD Recruit General Manager run on the National Mall. These recruits graduate this month joining our great ...,positive,True
2026-06-26,Randy Clarke,DC Metro,Randy Clarke - GovTech,https://www.govtech.com/top-25/randy-clarke,6.0,"Clarke is a veteran of helming massive urban transit systems. He previously served as transit chief for Capital Metro in Austin, Texas.",neutral,False
2026-06-26,Randy Clarke,DC Metro,WMATA's Board of Directors Selects Randy Clarke as its ...,https://www.wmata.com/news/metro-board-announces-new-gm-randy-clarke.html,7.0,Clarke has served as President and CEO of CapMetro since March 2018 and led the successful effort of securing one of the country's largest ...,positive,True
2026-06-26,Randy Clarke,DC Metro,A Conversation with WMATA General Manager and CEO ...,https://web.mcccmd.com/events/eventdetail.aspx?eventid=779,8.0,"Mr. Clarke joined WMATA in July 2022 after serving more than four years as President and CEO of Capital Metro in Austin, Texas. Prior to his work in Austin ...",neutral,False
2026-06-26,Randy Clarke,DC Metro,WMATA GM Randy Clarke says any major future ...,https://www.reddit.com/r/washingtondc/comments/1pnm53u/wmata_gm_randy_clarke_says_any_major_future/,9.0,"WMATA GM Randy Clarke says any major future expansions of Metro probably won't look like the Metro of today, specifically mentions light metro ...",neutral,False
2026-06-26,Janno Lieber,MTA,Janno Lieber,https://en.wikipedia.org/wiki/Janno_Lieber,1.0,"John Nathan ""Janno"" Lieber (born September 19, 1961) is the head of the Metropolitan Transportation Authority (MTA) in New York.",neutral,False
2026-06-26,Janno Lieber,MTA,Janno Lieber,https://www.mta.info/transparency/leadership/executive-leadership/janno-lieber,2.0,John (“Janno”) Lieber was confirmed as Chair and CEO of the Metropolitan Transportation Authority (MTA) in January 2022.,positive,True
2026-06-26,Janno Lieber,MTA,Janno Lieber - Chair & CEO at New York Metropolitan ...,https://www.linkedin.com/in/janno-lieber-32b487158,3.0,"Chair & CEO at New York Metropolitan Transportation Authority · An accomplished executive working at the intersection of government, real estate and law.",positive,True
2026-06-26,Janno Lieber,MTA,"Janno Lieber on Free Buses, the State of the MTA, & The ...",https://nyeditorialboard.substack.com/p/janno-lieber-on-free-buses-the-state,4.0,"Janno Lieber, Chair and CEO of the Metropolitan Transportation Authority (MTA), which runs the New York City subways and buses, ...",positive,False
2026-06-26,Janno Lieber,MTA,Opinions on MTA CEO Janno Lieber,https://www.reddit.com/r/nycrail/comments/1qninf7/whats_your_thoughts_and_opinions_on_mta_ceo_janno/,5.0,Janno is the most competent leader the MTA has had in generations. He truly cares about the system and regularly rides it (which a surprising ...,neutral,False
2026-06-26,Janno Lieber,MTA,"Janno Lieber, Chair & CEO of the Metropolitan ...",https://skyscraper.org/featured/2025/,6.0,"Lieber has tackled and delivered many of the city's most complex transit projects - from 2017 as head of MTA Construction & Development agency, and since 2021 ...",neutral,False
2026-06-26,Janno Lieber,MTA,INTERVIEW: MTA Chair Janno Lieber Talks to Streetsblog ...,https://nyc.streetsblog.org/2026/01/21/interview-mta-chair-janno-lieber-talks-to-streetsblog-to-mark-four-years-at-the-top,7.0,"On Tuesday, Janno Lieber started his fifth year as the MTA's permanent Chairman and CEO — the longest stretch that a single person has held the ...",neutral,False
2026-06-26,Janno Lieber,MTA,5 things to know about Janno Lieber,https://www.cityandstateny.com/policy/2021/07/5-things-know-about-janno-lieber/184164/,8.0,Lieber has led the MTA's capital construction for four years · He oversaw the rebuilding of the World Trade Center complex · Former bosses include ...,neutral,False
2026-06-26,Monica Tibbits-Nutt,MBTA,Monica Tibbits-Nutt,https://www.massport.com/our-business/leadership/monica-tibbits-nutt,1.0,"Monica G. Tibbits-Nutt, is the Secretary and CEO of the Massachusetts Department of Transportation (MassDOT).",positive,True
2026-06-26,Monica Tibbits-Nutt,MBTA,Transportation Sec. Monica Tibbits-Nutt Stepping Down ...,https://mass.streetsblog.org/2025/10/16/rearranging-the-cabinet-transportation-sec-monica-tibbits-nutt-stepping-down-replaced-by-mbta-gm-phillip-eng,2.0,Secretary of Transportation Monica Tibbits-Nutt is leaving the Healey administration. Governor Maura Healey announced this morning in a ...,neutral,False
2026-06-26,Monica Tibbits-Nutt,MBTA,"Monica Tibbits-Nutt, FAICP, LEED AP BD C",https://www.linkedin.com/in/monica-tibbits-nutt,3.0,"Transportation Executive | Growth & Sales Leader | Strategic Client Advisor | Rail, Transit & Infrastructure · Transportation executive and growth leader ...",positive,True
2026-06-26,Monica Tibbits-Nutt,MBTA,MassFiscal Responds to Departure of Transportation ...,https://www.massfiscal.org/massfiscal-responds-departure-monica-tibbits-nutt,4.0,Tibbits-Nutt Exit is “Long Overdue”. The Massachusetts Fiscal Alliance today responded to news that Secretary of Transportation Monica ...,neutral,False
2026-06-26,Monica Tibbits-Nutt,MBTA,Monica Tibbits-Nutt Steps Down as MassDOT Secretary,https://aptapassengertransport.com/monica-tibbits-nutt-steps-down-as-massdot-secretary-phil-eng-named-interim/,5.0,Governor Maura Healey has named Massachusetts Bay Transportation Authority (MBTA) General Manager Phil Eng as Interim Transportation Secretary.,neutral,False
2026-06-26,Monica Tibbits-Nutt,MBTA,A Conversation with MassDOT Secretary Monica Tibbits ...,https://members.naiopma.org/event-calendar/Details/a-conversation-with-massdot-secretary-monica-tibbits-nutt-and-mbta-general-manager-phillip-eng-1055406?sourceTypeId=EmailInvitation,6.0,"From Boston to Springfield and beyond, investments made in transportation increase access to travel options and improve roadway safety for all users, regardless ...",neutral,False
2026-06-26,Monica Tibbits-Nutt,MBTA,"MassDOT secretary Tibbits-Nutt steps down, MBTA chief ...",https://www.reddit.com/r/boston/comments/1o876bw/massdot_secretary_tibbitsnutt_steps_down_mbta/,7.0,She lost my respect after she admitted she was driven to work every day despite living near an MBTA commuter rail because an MBTA pass “was ...,neutral,False
2026-06-26,Monica Tibbits-Nutt,MBTA,Governor Healey Appoints MBTA General Manager Phil ...,https://www.mass.gov/news/governor-healey-appoints-mbta-general-manager-phil-eng-as-interim-transportation-secretary,8.0,Highway Administrator Jonathan Gulliver promoted to Undersecretary of Transportation; Interim Secretary and GM Eng to hold media ...,neutral,False
2026-06-26,Monica Tibbits-Nutt,MBTA,"Monica Tibbits-Nutt made history as the first Queer, Black ...",https://www.linkedin.com/posts/lauren-melendez-53690475_monica-tibbits-nutt-made-history-as-the-first-activity-7301335136107720704-9AIP,9.0,"About Black Heritage Month, We wanted to reintroduce you to a prominent figure heading up Mass dot Transportation Secretary Monica Tibbetts, nut ...",positive,True
2026-06-26,Ryan Coholan,Massachusetts Bay Transportation Authority,No organic results found,,,No organic search results returned for this query,negative,False
2026-06-26,Nora Leerhsen,Chicago Transit Authority,CTA Governance/Administration,https://www.transitchicago.com/governance/,1.0,"Nora joined the CTA in 2014 and is an 11-year public transit veteran. She is the first woman to lead the CTA in the agency's history. Under Nora's leadership, ...",positive,True
2026-06-26,Nora Leerhsen,Chicago Transit Authority,Nora Leerhsen,https://en.wikipedia.org/wiki/Nora_Leerhsen,2.0,"Nora Leerhsen is an American lawyer and executive who has served as the Acting President of the Chicago Transit Authority (CTA) since February 2025, replacing ...",neutral,False
2026-06-26,Nora Leerhsen,Chicago Transit Authority,"Nora Leerhsen - Acting President, Chicago Transit Authority",https://www.linkedin.com/in/nora-leerhsen-1ba38847,3.0,"Acting President, Chicago Transit Authority · Experience: Chicago Transit Authority · Education: University of Wisconsin Law School · Location: Greater ...",positive,True
2026-06-26,Nora Leerhsen,Chicago Transit Authority,Team | Chicago Transit Authority,https://www.ctabonds.com/chicago-transit-authority-il/about/our-team/i6552,4.0,"Nora Leerhsen is acting president of the Chicago Transit Authority (CTA), one of the nation's largest public transit agencies.",positive,True
2026-06-26,Nora Leerhsen,Chicago Transit Authority,"Nora Leerhsen, Acting President, Chicago Transit Authority",https://www.cityclub-chicago.org/video/5742/nora-leerhsen-acting-president-chicago-t,5.0,I first met acting pres CTA president Nora lerson at the University of Chicago 20 years ago when she was a master student.,positive,False
2026-06-26,Nora Leerhsen,Chicago Transit Authority,Acting CTA chief lays out priorities after dodging fiscal cliff,https://www.chicagotribune.com/2026/02/02/acting-cta-chief-lays-out-priorities-after-dodging-fiscal-cliff/,6.0,"When she was named acting president of the Chicago Transit Authority, Nora Leerhsen made a call to the agency's first female train operator.",neutral,False
2026-06-26,Nora Leerhsen,Chicago Transit Authority,"Nora Leerhsen, Acting President, Chicago Transit Authority",https://www.cityclub-chicago.org/event/2/5742/nora-leerhsen-acting-president-chicago-transit-authority,7.0,"Nora Leerhsen, Acting President, Chicago Transit Authority. Thursday, Jan 22, 2026. Doors Open at 11:30 am / Event Begins at 12:00 pm ...",positive,False
2026-06-26,Nora Leerhsen,Chicago Transit Authority,"Meet CTA's Acting President, Nora Leerhsen ...",https://www.instagram.com/p/DFn5eJFTiIU/,8.0,"Meet CTA's Acting President, Nora Leerhsen! Acting President Leerhsen, a 10-year transit veteran, is the first woman to lead the organization.",positive,True
2026-06-26,Phillip Eng,MBTA,Phillip Eng | People,https://www.mbta.com/people/phillip-eng,1.0,Phillip Eng is the General Manager and CEO of the Massachusetts Bay Transportation Authority (MBTA). A Civil Engineer with nearly 40 years of transportation ...,positive,True
2026-06-26,Phillip Eng,MBTA,Phillip Eng,https://en.wikipedia.org/wiki/Phillip_Eng,2.0,Phillip Eng (born 1961 or 1962) is an American civil engineer and transit executive serving as interim secretary of Massachusetts Department of ...,neutral,False
2026-06-26,Phillip Eng,MBTA,Governor Healey Appoints MBTA General Manager Phil ...,https://www.mass.gov/news/governor-healey-appoints-mbta-general-manager-phil-eng-as-interim-transportation-secretary,3.0,Boston — Governor Maura Healey announced today that she has named Massachusetts Bay Transportation Authority (MBTA) General Manager Phillip Eng ...,neutral,False
2026-06-26,Phillip Eng,MBTA,"Phillip Eng - Transportation Services, Operations ...",https://www.linkedin.com/in/phillip-eng-875928240,4.0,"Transportation Services, Operations, Engineering and Infrastructure · Experience: MassDOT and MBTA · Education: The Cooper Union for the Advancement of ...",positive,True
2026-06-26,Phillip Eng,MBTA,MBTA's Phillip Eng Named Interim MassDOT Secretary,https://aashtojournal.transportation.org/mbtas-phillip-eng-named-interim-massdot-secretary/,5.0,Massachusetts Governor Maura Healey (D) has appointed Phillip Eng (above at left) – general manager of the Massachusetts Bay Transportation ...,neutral,False
2026-06-26,Phillip Eng,MBTA,The MBTA has made incredible strides. Did Phillip Eng fix ...,https://www.reddit.com/r/mbta/comments/1pokx9x/the_mbta_has_made_incredible_strides_did_phillip/,6.0,"165 votes, 33 comments. Reliability and passenger satisfaction are up on the MBTA. WBZ-TV's David Wade took a ride on the Orange Line with T ...",neutral,False
2026-06-26,Phillip Eng,MBTA,Did Phillip Eng fix the MBTA? Reliability and passenger ...,https://www.cbsnews.com/boston/news/mbta-general-manager-phillip-eng/,7.0,"I'll take it!'"" Eng said. Phillip Eng MBTA General Manager Phillip Eng on the Orange Line. CBS Boston.",neutral,False
2026-06-26,Phillip Eng,MBTA,Phil Eng earns rave reviews for simultaneous MBTA ...,https://commonwealthbeacon.org/transportation/interim-or-indefinite-no-end-in-sight-to-phil-engs-double-duty/,8.0,The Healey administration seems content to have Phil Eng continue to work as both T general manager and interim transportation secretary for ...,neutral,False
2026-06-26,Phillip Eng,MBTA,Phillip Eng,https://www.massport.com/our-business/leadership/phillip-eng,9.0,Phillip Eng leads Massachusetts' transportation network as Interim Secretary of Transportation and General Manager of the MBTA.,positive,True
2026-06-26,Randy Clarke,Metrorail,No organic results found,,,No organic search results returned for this query,negative,False
2026-06-26,Phillip Eng,Massachusetts Bay Transportation Authority,No organic results found,,,No organic search results returned for this query,negative,False
2026-06-26,Ryan Coholan,Boston T,No organic results found,,,No organic search results returned for this query,negative,False
2026-06-26,Nora Leerhsen,CTA,Nora Lighting - Illuminating the Future®,https://noralighting.com/,1.0,"Nora Lighting is a leading manufacturer of LED luminaires for residential, commercial, and institutional applications.",neutral,False
2026-06-26,Nora Leerhsen,CTA,Nora Fatehi,https://en.wikipedia.org/wiki/Nora_Fatehi,2.0,"Nora Fatehi (born Naura Fathi; 6 February 1992) is a Canadian singer, dancer and actress based in India. She primarily works in Hindi film and also appeared in ...",neutral,False
2026-06-26,Nora Leerhsen,CTA,NORA,https://open.spotify.com/artist/2pH0QIWh7UyhPZHit7eCQG,3.0,Artist Playlists · Chaotic Hardcore/Mathcore · Early 2000s Hardcore · NJHC (New Jersey Hardcore) · 2000s (Actual) Metalcore · Early Metalcore (1989 - 2002) ...,neutral,False
2026-06-26,Nora Leerhsen,CTA,"Nora - Baby Name Meaning, Origin and Popularity",https://www.thebump.com/b/nora-baby-name,4.0,"Nora is a feminine name that has several origins. Considered a shortened form of Honora, Nora assumes the meaning of ""honor"" from the Latin Honorius.",positive,False
2026-06-26,Nora Leerhsen,CTA,Nora (2000),https://www.imdb.com/title/tt0158033/,5.0,"Dublin, 1904, James Joyce chats up Nora Barnacle, a hotel maid recently come from Galway. She enchants him with her frank, uninhibited manner, and before long, ...",neutral,False
2026-06-26,Nora Leerhsen,CTA,Nora Fatehi (@norafatehi) • Instagram photos and videos,https://www.instagram.com/norafatehi/?hl=en,6.0,"47M followers · 667 following · 2930 posts · @norafatehi: “Performer, Actress, Singer, Self taught dancer ❤️”",positive,True
2026-06-26,Nora Leerhsen,CTA,Nora – The Movie,https://norathemovie.com/,7.0,"Nora's real-world story is a journey of vulnerability, intimacy, and the desire to understand one's place in the world with all of its complex humanness.",neutral,False
2026-06-26,Monica Tibbits-Nutt,Boston T,Monica Tibbits-Nutt,https://www.massport.com/our-business/leadership/monica-tibbits-nutt,1.0,"Monica G. Tibbits-Nutt, is the Secretary and CEO of the Massachusetts Department of Transportation (MassDOT).",positive,True
