date,ceo,company,title,url,position,snippet,sentiment,controlled
2026-05-22,Monica Tibbits-Nutt,The T,Monica Tibbits-Nutt,https://www.massport.com/our-business/leadership/monica-tibbits-nutt,1,"Monica G. Tibbits-Nutt, is the Secretary and CEO of the Massachusetts Department of Transportation (MassDOT).",positive,True
2026-05-22,Monica Tibbits-Nutt,The T,Transportation Sec. Monica Tibbits-Nutt Stepping Down ...,https://mass.streetsblog.org/2025/10/16/rearranging-the-cabinet-transportation-sec-monica-tibbits-nutt-stepping-down-replaced-by-mbta-gm-phillip-eng,2,Secretary of Transportation Monica Tibbits-Nutt is leaving the Healey administration. Governor Maura Healey announced this morning in a ...,neutral,False
2026-05-22,Monica Tibbits-Nutt,The T,Disgraced former Transportation Secretary Monica Tibbits ...,https://www.bostonherald.com/2026/01/07/disgraced-former-transportation-secretary-monica-tibbits-nutt-officially-off-state-payroll/,3,Former Transportation Secretary Monica Tibbits-Nutt is officially off the state employee payroll after resigning in disgrace in October and ...,negative,False
2026-05-22,Monica Tibbits-Nutt,The T,"Monica Tibbits-Nutt made history as the first Queer, Black ...",https://www.linkedin.com/posts/lauren-melendez-53690475_monica-tibbits-nutt-made-history-as-the-first-activity-7301335136107720704-9AIP,4,"Monica Tibbits-Nutt made history as the first Queer, Black woman to be named Secretary of Transportation for the Commonwealth.",positive,True
2026-05-22,Monica Tibbits-Nutt,The T,"Monica Tibbits-Nutt, FAICP, LEED AP BD C - Jacobs",https://www.linkedin.com/in/monica-tibbits-nutt,5,"Monica Tibbits-Nutt, FAICP, LEED AP BD C. Jacobs The Ohio State University. Greater Boston. 3K followers 500+ connections.",positive,True
2026-05-22,Monica Tibbits-Nutt,The T,MassFiscal Responds to Departure of Transportation ...,https://www.massfiscal.org/massfiscal-responds-departure-monica-tibbits-nutt,6,Tibbits-Nutt Exit is “Long Overdue”. The Massachusetts Fiscal Alliance today responded to news that Secretary of Transportation Monica ...,neutral,False
2026-05-22,Monica Tibbits-Nutt,The T,Monica Tibbits-Nutt Steps Down as MassDOT Secretary,https://aptapassengertransport.com/monica-tibbits-nutt-steps-down-as-massdot-secretary-phil-eng-named-interim/,7,Tibbits-Nutt will continue as an advisor through Dec. 31 to ensure an efficient transition. Governor Healey appointed Phil Eng as MBTA general ...,neutral,False
2026-05-22,Monica Tibbits-Nutt,The T,"MassDOT secretary Tibbits-Nutt steps down, MBTA chief ...",https://www.reddit.com/r/boston/comments/1o876bw/massdot_secretary_tibbitsnutt_steps_down_mbta/,8,"MassDOT secretary Tibbits-Nutt steps down, MBTA chief Eng announced as interim replacement ... Archived post. New comments cannot be posted and ...",neutral,False
2026-05-22,Monica Tibbits-Nutt,The T,Tibbits-Nutt is out as transportation secretary. T chief Eng ...,https://www.wbur.org/news/2025/10/16/tibbits-nutt-transportation-secretary-massachusetts-eng,9,"... Monica Tibbits-Nutt overseeing the state's transit agency. In a press release, Healey said Tibbits-Nutt ""has made the decision to step down ...",neutral,False
2026-05-22,Randy Clarke,DC Metro,Randy Clarke,https://en.wikipedia.org/wiki/Randy_Clarke,1,Randy Clarke (born 1977) is a Canadian-American transit executive who has served as the general manager and CEO of Washington Metropolitan Area Transit ...,neutral,False
2026-05-22,Randy Clarke,DC Metro,Leadership,https://www.wmata.com/about/leadership.html,2,Randy Clarke joined WMATA as General Manager and CEO in July 2022. He's not just Metro's GM/CEO; he's also a customer who uses the service every day.,positive,True
2026-05-22,Randy Clarke,DC Metro,Randy Clarke (@wmataGM) / Posts / X,https://x.com/wmataGM,3,"WMATA General Manager Randy Clarke joined Dream City for a wide-ranging conversation about how he helped turn D.C.'s Metro system around, what America gets w...",positive,True
2026-05-22,Randy Clarke,DC Metro,Randy Clarke - WMATA General Manager and CEO,https://www.linkedin.com/in/randy-clarke-74bb8a69,4,WMATA General Manager and CEO · Experience: Washington Metropolitan Area Transit Authority (WMATA) · Education: University of Southern Maine · Location: ...,positive,True
2026-05-22,Randy Clarke,DC Metro,Randy Clarke (@wmatagm),https://www.instagram.com/wmatagm/?hl=en,5,Completed the 2nd Annual @metroforward MetroTransitPD Recruit General Manager run on the National Mall. These recruits graduate this month joining our great ...,positive,True
2026-05-22,Randy Clarke,DC Metro,WMATA's Board of Directors Selects Randy Clarke as its ...,https://www.wmata.com/news/metro-board-announces-new-gm-randy-clarke.html?alerts-widget-next-train-all=C03,6,“I am honored to be selected as the next GM/CEO of Metro and want to thank the WMATA Board for their confidence in me to help lead this amazing ...,positive,True
2026-05-22,Randy Clarke,DC Metro,WMATA GM Randy Clarke says any major future ...,https://www.reddit.com/r/washingtondc/comments/1pnm53u/wmata_gm_randy_clarke_says_any_major_future/,7,"WMATA GM Randy Clarke says any major future expansions of Metro probably won't look like the Metro of today, specifically mentions light metro ...",neutral,False
2026-05-22,Randy Clarke,DC Metro,Here's a wild idea: Randy Clarke for D.C. mayor,https://www.axios.com/local/washington-dc/2025/10/30/randy-clarke-metro-dc-mayor-muriel-bowser-election,8,Randy Clarke fixed Metro. Maybe he can fix D.C. next? Why it matters: We need someone to run for mayor! email (opens in new window).,neutral,False
2026-05-22,Randy Clarke,DC Metro,Leadership,https://wmata.com/about/leadership/?alerts-widget-next-train-all=N07,9,"Randy Clarke, General Manager and CEO. GM Randy Clarke. Randy Clarke joined the Washington Metropolitan Area Transit Authority (WMATA) as General Manager ...",positive,True
2026-05-22,Ryan Coholan,MBTA,Ryan Coholan - Chief Operating Officer at MBTA,https://www.linkedin.com/in/ryan-coholan-139014ab,1,"Experienced Chief Operating Officer with a demonstrated history of working in the transportation/trucking/railroad industry. Skilled in Budgeting, Operations ...",positive,True
2026-05-22,Ryan Coholan,MBTA,Ryan Coholan - Massachusetts Bay Transportation Authority ...,https://cthrupayroll.mass.gov/?os=shmmfp&ref=app#!/year/2024/full_time_employees%2Cothers/pay1%2Cpay2%2Cpay3%2Cpay4/explore%2F0-0-0%2Ftrans_no%2F17915261%2F0%2Fdepartment_division,2,Ryan Coholan - Massachusetts Bay Transportation Authority (MBT) - Chief Operating Officer Massachusetts Bay Transportation Authority (MBT).,positive,False
2026-05-22,Ryan Coholan,MBTA,MBTA COO drives commuter rail train from Boston to Fall ...,https://www.heraldnews.com/picture-gallery/news/2026/03/24/mbta-coo-ryan-coholan-talks-south-coast-rail-from-boston-to-fall-river/89294351007/,3,"MBTA Chief Operating Officer Ryan Coholan operates a commuter rail train at South Station, Boston, on March 10, 2026. Dan Medeiros.",neutral,False
2026-05-22,Ryan Coholan,MBTA,Conversation with MBTA's COO Ryan Coholan,https://transitunplugged.com/transit-unplugged-podcast/ryan-coholan-mbta/,4,"With nearly 30 years of transit experience, Ryan talks about running one of America's largest transit systems and shares stories of MBTA's ...",neutral,False
2026-05-22,Ryan Coholan,MBTA,CCMRRCAM praises MBTA's Ryan Coholan for innovative ...,https://www.facebook.com/ccmrrcam/posts/when-it-comes-to-making-a-meaningful-difference-about-how-the-mbta-serves-the-ci/1285749126448679/,5,"Simply put, Ryan Coholan has been the lead innovator, manager and cheerleader for rail service in the Commonwealth. Countless organizations ( ...",positive,True
2026-05-22,Ryan Coholan,MBTA,"Today, COO Ryan Coholan joined State Senator ...",https://www.instagram.com/p/DPWzqsCEoZw/,6,"May 12, 2026 ⏰ 2:00 – 4:00 PM MBTA Boardroom, 10 Park Plaza, Boston + Virtual option available. This public meeting will focus on the MBTA's ...",positive,True
2026-05-22,Ryan Coholan,MBTA,Ryan Coholan's Post - Chief Operating Officer at MBTA,https://www.linkedin.com/posts/ryan-coholan-139014ab_ive-been-blessed-to-be-part-of-the-turnaround-activity-7453149688158973952-Me6l,7,"I also managed to take time away! During Marathon Monday! First time in years. Ryan Coholan, we will always appreciate how you break down the ...",positive,True
2026-05-22,Ryan Coholan,MBTA,The MBTA Advisory Board,https://mbtaadvisoryboard.org/wp-content/uploads/2024/04/MinutesMBTAAB-12-05-23APPROVED.pdf,8,Coholan is responsible for the operation of all MBTA modes. He was appointed. COO by General Manager Philip Eng in September 2023. Mr. Coholan introduced his ...,positive,True
2026-05-22,Randy Clarke,Metrorail,RANDY Definition & Meaning,https://www.merriam-webster.com/dictionary/randy,1,"1. chiefly Scotland : having a coarse manner 2. lustful, lecherous randiness noun randy 2 of 2 noun plural randies chiefly Scotland : a scolding or dissolute ...",neutral,False
2026-05-22,Randy Clarke,Metrorail,Randy,https://open.spotify.com/artist/1Qote9MpqMZluWzYGifZUg,2,Listen to Randy on Spotify. Artist · 1.6M monthly listeners.,neutral,False
2026-05-22,Randy Clarke,Metrorail,Randy,https://en.wikipedia.org/wiki/Randy,3,"Randy is a primarily masculine given name. It is popular in the United States and Canada. It was originally derived from the names Randall, Randolph, and ...",neutral,False
2026-05-22,Randy Clarke,Metrorail,randy,https://en.wiktionary.org/wiki/randy,4,"Adjective · (UK, informal) Sexually aroused; full of sexual lust. · If you're feeling randy, give me a call and I'll come round and give you some hot lovin'.",neutral,False
2026-05-22,Randy Clarke,Metrorail,Randy (@randy) • Instagram photos and videos,https://www.instagram.com/randy/,5,"Music Video of the Year. @thebreakbombproject went all in — wrote it, produced it, directed it, and won it. 8 minutes of greatness. Go watch. @youtube @ ...",positive,True
2026-05-22,Randy Clarke,Metrorail,RANDY Definition & Meaning,https://www.dictionary.com/browse/randy,6,"adjective · informal. sexually excited or aroused. sexually eager or lustful · lacking any sense of propriety or restraint; reckless. ""Collins English ...",neutral,False
2026-05-22,Randy Clarke,Metrorail,The origin of “randy”,https://grammarphobia.com/blog/2006/12/the-origin-of-randy.html,7,"The adjective “randy” originally meant rude, disorderly, or aggressive, and dates back to the late 17th century in Scotland.",neutral,False
2026-05-22,Randy Clarke,Washington Metropolitan Area Transit Authority,RANDY Definition & Meaning,https://www.merriam-webster.com/dictionary/randy,1,"1. chiefly Scotland : having a coarse manner 2. lustful, lecherous randiness noun randy 2 of 2 noun plural randies chiefly Scotland : a scolding or dissolute ...",neutral,False
2026-05-22,Randy Clarke,Washington Metropolitan Area Transit Authority,Randy,https://open.spotify.com/artist/1Qote9MpqMZluWzYGifZUg,2,Listen to Randy on Spotify. Artist · 1.6M monthly listeners.,neutral,False
2026-05-22,Randy Clarke,Washington Metropolitan Area Transit Authority,Randy,https://en.wikipedia.org/wiki/Randy,3,"Randy is a primarily masculine given name. It is popular in the United States and Canada. It was originally derived from the names Randall, Randolph, and ...",neutral,False
2026-05-22,Randy Clarke,Washington Metropolitan Area Transit Authority,randy,https://en.wiktionary.org/wiki/randy,4,"Adjective · (UK, informal) Sexually aroused; full of sexual lust. · If you're feeling randy, give me a call and I'll come round and give you some hot lovin'.",neutral,False
2026-05-22,Randy Clarke,Washington Metropolitan Area Transit Authority,Randy (@randy) • Instagram photos and videos,https://www.instagram.com/randy/,5,"Music Video of the Year. @thebreakbombproject went all in — wrote it, produced it, directed it, and won it. 8 minutes of greatness. Go watch. @youtube @ ...",positive,True
2026-05-22,Randy Clarke,Washington Metropolitan Area Transit Authority,RANDY Definition & Meaning,https://www.dictionary.com/browse/randy,6,"adjective · informal. sexually excited or aroused. sexually eager or lustful · lacking any sense of propriety or restraint; reckless. ""Collins English ...",neutral,False
2026-05-22,Randy Clarke,Washington Metropolitan Area Transit Authority,The origin of “randy”,https://grammarphobia.com/blog/2006/12/the-origin-of-randy.html,7,"The adjective “randy” originally meant rude, disorderly, or aggressive, and dates back to the late 17th century in Scotland.",neutral,False
2026-05-22,Janno Lieber,MTA,Janno Lieber,https://en.wikipedia.org/wiki/Janno_Lieber,1,"John Nathan ""Janno"" Lieber (born September 19, 1961) is the head of the Metropolitan Transportation Authority (MTA) in New York.",neutral,False
2026-05-22,Janno Lieber,MTA,Janno Lieber,https://www.mta.info/transparency/leadership/executive-leadership/janno-lieber,2,John (“Janno”) Lieber was confirmed as Chair and CEO of the Metropolitan Transportation Authority (MTA) in January 2022.,positive,True
2026-05-22,Janno Lieber,MTA,Janno Lieber - Chair & CEO at New York Metropolitan ...,https://www.linkedin.com/in/janno-lieber-32b487158,3,"Chair & CEO at New York Metropolitan Transportation Authority · An accomplished executive working at the intersection of government, real estate and law.",positive,True
2026-05-22,Janno Lieber,MTA,"Janno Lieber on Free Buses, the State of the MTA, & The ...",https://nyeditorialboard.substack.com/p/janno-lieber-on-free-buses-the-state,4,"Janno Lieber, Chair and CEO of the Metropolitan Transportation Authority (MTA), which runs the New York City subways and buses, ...",positive,False
2026-05-22,Janno Lieber,MTA,"Janno Lieber, Chair & CEO of the Metropolitan ...",https://skyscraper.org/featured/2025/,5,"Lieber has tackled and delivered many of the city's most complex transit projects - from 2017 as head of MTA Construction & Development agency, and since 2021 ...",neutral,False
2026-05-22,Janno Lieber,MTA,MTA Chair And CEO Janno Lieber Discusses Transit Service ...,https://www.youtube.com/watch?v=e1ELBnGC3Xc,6,TRANSIT UPDATE ❄️: Metropolitan Transportation Authority Chair and CEO Janno Lieber joins FOX Weather to discuss changes to transit services ...,neutral,False
2026-05-22,Janno Lieber,MTA,MTA Executive Leadership,https://www.mta.info/transparency/leadership/executive-leadership,7,"MTA Executive Leadership. Janno Lieber. Chair and CEO · Bill Amarosa Jr. Executive Vice President, Subways · Quemuel Arroyo. Chief Accessibility Officer.",positive,True
2026-05-22,Janno Lieber,MTA,INTERVIEW: MTA Chair Janno Lieber Talks to Streetsblog to ...,https://nyc.streetsblog.org/2026/01/21/interview-mta-chair-janno-lieber-talks-to-streetsblog-to-mark-four-years-at-the-top,8,"On Tuesday, Janno Lieber started his fifth year as the MTA's permanent Chairman and CEO — the longest stretch that a single person has held the ...",neutral,False
2026-05-22,Janno Lieber,MTA,"Today, MTA Chair and CEO Janno Lieber, MTA New York ...",https://www.facebook.com/mta/posts/today-mta-chair-and-ceo-janno-lieber-mta-new-york-city-transit-president-demetri/1295307629300719/,9,"Today, MTA Chair and CEO Janno Lieber, MTA New York City Transit President Demetrius Crichlow, and MTA Construction & Development President ...",positive,True
2026-05-22,Ryan Coholan,The T,channel Ryan's World,https://www.youtube.com/channel/UChGJGhZ9SOOHvBB0Y4DOO_w,1,"Share your videos with friends, family, and the world.",neutral,False
2026-05-22,Ryan Coholan,The T,Ryan Trahan,https://www.youtube.com/@ryan,2,Popular videos · I Tried Every Seat on the Most Expensive Airline · I Spent 100 Days in the Metaverse · I Spent 100 Days in Realistic Minecraft. 47M views. 4 ...,neutral,False
2026-05-22,Ryan Coholan,The T,Ryan's World,https://ryans.world/,3,The best in children's entertainment period · Latest Content · LegoLand · Transformers · Mattel: Jurassic World Toys · Mark Rober & Crunch Labs · The Ninja ...,neutral,False
2026-05-22,Ryan Coholan,The T,Ryan's World,https://en.wikipedia.org/wiki/Ryan%27s_World,4,Ryan's World (formerly Ryan ToysReview) is a YouTube channel for children featuring Ryan Kaji along with his family.,neutral,False
2026-05-22,Ryan Coholan,The T,Ryan's World (TV Series 2017–2024),https://www.imdb.com/title/tt12987338/,5,"Ryan's World is a children's YouTube channel featuring Ryan Kaji along with his mother, father, and twin sisters.",neutral,False
2026-05-22,Ryan Coholan,The T,Ryan's World (@ryansworld) • Instagram photos and videos,https://www.instagram.com/ryansworld/?hl=en,6,176K followers · 43 following · 908 posts · @ryansworld: “This account is managed by Ryan's Mommy and Daddy or Ryan's parents. www.ryansfanfest.com”,positive,True
2026-05-22,Ryan Coholan,The T,Ryan's World,https://www.youtube.com/@RyansWorld,7,"Ryan loves doing lots of fun things like pretend play, science experiments, music videos, skits, challenges, DIY arts and crafts and more!",neutral,False
2026-05-22,Ryan Coholan,Massachusetts Bay Transportation Authority,Ryan Coholan - Chief Operating Officer at MBTA,https://www.linkedin.com/in/ryan-coholan-139014ab,1,"Experienced Chief Operating Officer with a demonstrated history of working in the transportation/trucking/railroad industry. Skilled in Budgeting, Operations ...",positive,True
2026-05-22,Ryan Coholan,Massachusetts Bay Transportation Authority,Ryan Coholan - Massachusetts Bay Transportation Authority ...,https://cthrupayroll.mass.gov/?os=shmmfp&ref=app#!/year/2024/full_time_employees%2Cothers/pay1%2Cpay2%2Cpay3%2Cpay4/explore%2F0-0-0%2Ftrans_no%2F17915261%2F0%2Fdepartment_division,2,"Pay Check · Coholan · Ryan · MBTA Exec Main Fund · $299,084.71 · $299,084.71 $299,084.71. « ‹ 1; ›; ». Payroll Details. Total Pay. $ 299,085. Base Pay. $299,085.",positive,False
2026-05-22,Ryan Coholan,Massachusetts Bay Transportation Authority,MBTA COO drives commuter rail train from Boston to Fall ...,https://www.heraldnews.com/picture-gallery/news/2026/03/24/mbta-coo-ryan-coholan-talks-south-coast-rail-from-boston-to-fall-river/89294351007/,3,"MBTA Chief Operating Officer Ryan Coholan and a Keolis employee walk past a commuter rail train at South Station, Boston, on March 10, 2026.",neutral,False
2026-05-22,Ryan Coholan,Massachusetts Bay Transportation Authority,Did you know? Single track operations keeps riders moving ...,https://www.facebook.com/TheMBTA/videos/single-track-operations-with-coo-ryan-coholan/907055678496912/,4,"Hello, my name is Ryan Coholan. I'm the Chief Operating Officer for the MBTA. Tonight, we're down at Wollaston station on the Red Line Braintree ...",positive,True
2026-05-22,Ryan Coholan,Massachusetts Bay Transportation Authority,Ryan Coholan - Chief Operating Officer at Massachusetts ...,https://www.zoominfo.com/p/Ryan-Coholan/11957181347,5,"Coholan is a Chief Operating Officer at Massachusetts Bay Transportation Authority. Coholan directs, plans, and supervises operations for a significant commuter ...",neutral,False
2026-05-22,Ryan Coholan,Massachusetts Bay Transportation Authority,Conversation with MBTA's COO Ryan Coholan,https://transitunplugged.com/transit-unplugged-podcast/ryan-coholan-mbta/,6,"Host Paul Comfort sits down with Ryan Coholan, the Chief Operating Officer of the Massachusetts Bay Transportation Authority (MBTA or The T) in Boston.",neutral,False
2026-05-22,Ryan Coholan,Massachusetts Bay Transportation Authority,The MBTA Advisory Board,https://mbtaadvisoryboard.org/wp-content/uploads/2024/04/MinutesMBTAAB-12-05-23APPROVED.pdf,7,Coholan is responsible for the operation of all MBTA modes. He was appointed. COO by General Manager Philip Eng in September 2023. Mr. Coholan introduced his ...,neutral,False
2026-05-22,Ryan Coholan,Massachusetts Bay Transportation Authority,"Today, COO Ryan Coholan joined State Senator ...",https://www.instagram.com/p/DPWzqsCEoZw/,8,"Today, COO Ryan Coholan joined State Senator @barryfinegoldma ... The Massachusetts Bay Transportation Authority, or MBTA, announced ...",positive,True
2026-05-22,Ryan Coholan,Massachusetts Bay Transportation Authority,Approval – Request for Rewrite of CAP related to Finding 3 ...,https://www.transit.dot.gov/sites/fta.dot.gov/files/2023-10/Approval-Request-for-Rewrite-of-CAP-related-to-Finding-3-of-Special-Directive-22-12-Operating-Conditions-and-Policies-Procedures-and-Training.pdf,9,"the Massachusetts Bay Transportation Authority (MBTA) to submit a revised corrective action ... Ryan Coholan, Chief Operating Officer, MBTA. Timothy Lesniak ...",positive,False
2026-05-22,Ryan Coholan,Massachusetts Bay Transportation Authority,MBTA Chief Operating Officer Ryan Coholan said weekend ...,https://www.facebook.com/TheTelegram/posts/mbta-chief-operating-officer-ryan-coholan-said-weekend-ridership-is-nearly-back-/1478045264329620/,10,"The new head of the MBTA says riders can expect ""meaningful"" changes and progress soon on the T. Read more: https://cbsn.ws/3ngJeRs.",positive,True
2026-05-22,Nora Leerhsen,Chicago Transit Authority,"Nora Leerhsen - Acting President, Chicago Transit Authority",https://www.linkedin.com/in/nora-leerhsen-1ba38847,1,"Acting President, Chicago Transit Authority · Experience: Chicago Transit Authority · Education: University of Wisconsin Law School · Location: Greater ...",positive,True
2026-05-22,Nora Leerhsen,Chicago Transit Authority,CTA Governance/Administration,https://www.transitchicago.com/governance/,2,"Nora Leerhsen is the acting president of the Chicago Transit Authority (CTA), one of the nation's largest public transit agencies, providing approximately one ...",positive,True
2026-05-22,Nora Leerhsen,Chicago Transit Authority,Nora Leerhsen,https://en.wikipedia.org/wiki/Nora_Leerhsen,3,"Nora Leerhsen is an American lawyer and executive who has served as the Acting President of the Chicago Transit Authority (CTA) since February 2025, replacing ...",neutral,False
2026-05-22,Nora Leerhsen,Chicago Transit Authority,Team | Chicago Transit Authority,https://www.ctabonds.com/chicago-transit-authority-il/about/our-team/i6552,4,"nleerhsen@transitchicago.com. Nora Leerhsen is acting president of the Chicago Transit Authority (CTA), one of the nation's largest public transit agencies ...",positive,True
2026-05-22,Nora Leerhsen,Chicago Transit Authority,Acting CTA chief lays out priorities after dodging fiscal cliff,https://www.chicagotribune.com/2026/02/02/acting-cta-chief-lays-out-priorities-after-dodging-fiscal-cliff/,5,"When she was named acting president of the Chicago Transit Authority, Nora Leerhsen made a call to the agency's first female train operator.",neutral,False
2026-05-22,Nora Leerhsen,Chicago Transit Authority,A message from CTA Acting President Nora Leerhsen: On ...,https://www.facebook.com/thecta/posts/a-message-from-cta-acting-president-nora-leerhsenon-transit-employee-appreciatio/1351237193704962/,6,"A message from CTA Acting President Nora Leerhsen: On Transit Employee Appreciation Day, I traveled throughout the system to visit the Harlem ...",positive,True
2026-05-22,Nora Leerhsen,Chicago Transit Authority,Moving Experiences podcast - News,https://www.transitchicago.com/podcast/,7,"CTA Acting President Nora Leerhsen serves as host, but occasionally, guest hosts will be welcomed to moderate special episodes. This podcast will feature CTA ...",positive,True
2026-05-22,Nora Leerhsen,Chicago Transit Authority,"Meet CTA's Acting President, Nora Leerhsen!",https://www.instagram.com/p/DFn5eJFTiIU/?hl=en,8,"Acting President Leerhsen, a 10-year transit veteran, is the first woman to lead the organization. This morning's commute brought her to the Green Line.",positive,True
2026-05-22,Nora Leerhsen,Chicago Transit Authority,How do we think interim CTA president Nora Leerhsen is ...,https://www.reddit.com/r/chicago/comments/1ldou75/how_do_we_think_interim_cta_president_nora/,9,"While I know she worked under Dorval Carter, I think she has been a breath of fresh air. She is way more visible and actually seems to want to understand ...",neutral,False
2026-05-22,Phillip Eng,MBTA,Philips - United States | Philips,https://www.usa.philips.com/?srsltid=AfmBOooMGw4rnU2iuWun8h8W6-xxUwfxnPPWgFgPp602jQPrtdnvlQ3l,1,"Learn more about Philips and how we help improve people's lives through meaningful innovation in the areas of Healthcare, Consumer Lifestyle and Lighting.",positive,False
2026-05-22,Phillip Eng,MBTA,Phillip Phillips (@PhillipPhillips),https://www.facebook.com/PhillipPhillips/,2,MUSICIAN/BAND · 381 talking about this · New single “Homesick” out now! ⬇️ https://stem.ffm.to/homesickphillip.,positive,True
2026-05-22,Phillip Eng,MBTA,"Prince Philip, Duke of Edinburgh","https://en.wikipedia.org/wiki/Prince_Philip,_Duke_of_Edinburgh",3,"Prince Philip, Duke of Edinburgh was the husband of Queen Elizabeth II and served as consort of the British monarch from her accession on 6 February 1952 ...",neutral,False
2026-05-22,Phillip Eng,MBTA,Phillip Phillips (@phillphill) • Instagram photos and videos,https://www.instagram.com/phillphill/?hl=en,4,New single “Homesick” out now! ⬇️ · 16 years since I've called you my girlfriend. Still are and always will be. · 4 days since Home (Phillip's Version) became ...,positive,True
2026-05-22,Phillip Eng,MBTA,Phillip Phillips,https://open.spotify.com/artist/6p5JxpTc7USNnBnLzctyd4,5,"Singles and EPs · Homesick · Gone, Gone, Gone (Phillip's Version) · Home (Phillip's Version) · Dancing With Your Shadows (Demo Version) · So Will I · Before I ...",neutral,False
2026-05-22,Phillip Eng,MBTA,Phillip Phillips,https://www.phillipphillips.com/,6,Phillip Phillips. Open Menu Close Menu. Music · Video · Tour · Store · Phillip Phillips.,neutral,False
2026-05-22,Phillip Eng,MBTA,Phillip Phillips,https://www.youtube.com/channel/UCZYewi2Ya8JledgJImmXIWg,7,"Share your videos with friends, family, and the world.",neutral,False
