date,company,title,url,position,snippet,sentiment,controlled
2026-07-17,Boston T,MBTA - Massachusetts Bay Transportation Authority,https://www.mbta.com/,1,"Public transit in the Greater Boston region. Routes, schedules, trip ... Boston Visitor's Guide to The T. Subway Beginner's Guide. Bus Beginner's Guide ...",positive,True
2026-07-17,Boston T,MBTA subway,https://en.wikipedia.org/wiki/MBTA_subway,2,"The Massachusetts Bay Transportation Authority (MBTA) operates rapid transit (heavy rail), light rail, and bus rapid transit services in the Boston ...",neutral,False
2026-07-17,Boston T,"Navigating Boston | Travel Advisories, MBTA, Parking",https://www.meetboston.com/plan/getting-around/,3,"Take the ""T"" Boston's public transportation system. It offers subway, bus, trolley, and ferry services to nearly every corner of Greater Boston ...",neutral,False
2026-07-17,Boston T,Boston 'T',https://www.mapway.com/apps/boston-t-subway-map/,4,Boston's subway system “The T” is the quickest way to get around the city and the Mapway app is the best guide to using it.,neutral,False
2026-07-17,Boston T,"Boston Subway - The ""T"" - Boston Public Transportation",https://www.boston-discovery-guide.com/boston-subway.html,5,"Boston's subway system - locally we call it the ""T"" - is the easiest and cheapest way to get around the city, aside from walking.",neutral,False
2026-07-17,Boston T,MBTA - Massachusetts Bay Transportation Authority,https://www.mbta.com/,1,"Public transit in the Greater Boston region. Routes, schedules, trip ... Boston Visitor's Guide to The T. Subway Beginner's Guide. Bus Beginner's Guide ...",positive,True
2026-07-17,Boston T,MBTA subway,https://en.wikipedia.org/wiki/MBTA_subway,2,"The Massachusetts Bay Transportation Authority (MBTA) operates rapid transit (heavy rail), light rail, and bus rapid transit services in the Boston ...",neutral,False
2026-07-17,Boston T,"Navigating Boston | Travel Advisories, MBTA, Parking",https://www.meetboston.com/plan/getting-around/,3,"Take the ""T"" Boston's public transportation system. It offers subway, bus, trolley, and ferry services to nearly every corner of Greater Boston ...",neutral,False
2026-07-17,Boston T,Boston 'T',https://www.mapway.com/apps/boston-t-subway-map/,4,Boston's subway system “The T” is the quickest way to get around the city and the Mapway app is the best guide to using it.,neutral,False
2026-07-17,Boston T,"Boston Subway - The ""T"" - Boston Public Transportation",https://www.boston-discovery-guide.com/boston-subway.html,5,"Boston's subway system - locally we call it the ""T"" - is the easiest and cheapest way to get around the city, aside from walking.",neutral,False
2026-07-17,Boston T,MBTA - Massachusetts Bay Transportation Authority,https://www.mbta.com/,1,"Public transit in the Greater Boston region. Routes, schedules, trip ... Boston Visitor's Guide to The T. Subway Beginner's Guide. Bus Beginner's Guide ...",positive,True
2026-07-17,Boston T,MBTA subway,https://en.wikipedia.org/wiki/MBTA_subway,2,"The Massachusetts Bay Transportation Authority (MBTA) operates rapid transit (heavy rail), light rail, and bus rapid transit services in the Boston ...",neutral,False
2026-07-17,Boston T,"Navigating Boston | Travel Advisories, MBTA, Parking",https://www.meetboston.com/plan/getting-around/,3,"Take the ""T"" Boston's public transportation system. It offers subway, bus, trolley, and ferry services to nearly every corner of Greater Boston ...",neutral,False
2026-07-17,Boston T,Boston 'T',https://www.mapway.com/apps/boston-t-subway-map/,4,Boston's subway system “The T” is the quickest way to get around the city and the Mapway app is the best guide to using it.,neutral,False
2026-07-17,Boston T,"Boston Subway - The ""T"" - Boston Public Transportation",https://www.boston-discovery-guide.com/boston-subway.html,5,"Boston's subway system - locally we call it the ""T"" - is the easiest and cheapest way to get around the city, aside from walking.",neutral,False
2026-07-17,NYC Subway,MTA: Home,https://www.mta.info/,1,Back; New York City Transit · Bridges & Tunnels · Long Island Rail Road · Metro-North Railroad · Other agencies and departments. Contact us.,positive,True
2026-07-17,NYC Subway,New York City Subway,https://en.wikipedia.org/wiki/New_York_City_Subway,2,"The New York City Subway is a rapid transit system in New York City, serving four of the city's five boroughs: Manhattan, Brooklyn, Queens, and the Bronx.",neutral,False
2026-07-17,NYC Subway,nycsubway.org,https://nycsubway.org/,3,Early Rapid Transit in New York The First Subway. The New York Subway: Its Construction and Equipment (1904) Location: Queensborough Plaza Car: R,positive,True
2026-07-17,NYC Subway,New York City Subway,https://sab.org/wp-content/uploads/2020/01/Subway_Map_2018.pdf,4,"New York City Subway with bus and railroad. The subway operates 24 hours a day, but not all lines operate at all times. Call our Travel Information Center at ...",neutral,False
2026-07-17,NYC Subway,HOW to use the NYC Subway (Everything YOU NEED to know)!,https://www.youtube.com/watch?v=jRjcoBgRWfI&vl=en,5,"This video breaks down everything you need to know to navigate the subway system. Learn the basics of reading subway maps, understanding train ...",neutral,False
2026-07-17,NYC Subway,New York Subway MTA Map NYC - App Store,https://apps.apple.com/us/app/new-york-subway-mta-map-nyc/id369691844,6,This NYC subway map is free to download and will help you navigate around New York using the subway system.,positive,True
2026-07-17,OMNY,OMNY,https://omny.info/,1,"Earn free rides by tapping. Tap and ride for 7-Day Unlimited benefits! When you tap the same card or device for 12 individual trips within 7 days, you'll get ...",positive,True
2026-07-17,OMNY,OMNY,https://en.wikipedia.org/wiki/OMNY,2,"OMNY (/ˈɒmni/ OM-nee, short for One Metro New York) is a contactless fare-payment system that has been implemented for use on public transit in the New York ...",neutral,False
2026-07-17,OMNY,Reduced-Fare OMNY,https://www.mta.info/fares-tolls/subway-bus/reduced-fare/omny,3,"Reduced-Fare OMNY lets you tap for half-price fares on MTA buses, subways, Staten Island Railway, Roosevelt Island Tram, and Hudson Rail Link.",positive,True
2026-07-17,OMNY,Student OMNY Cards,https://www.schools.nyc.gov/school-life/transportation/student-omny-cards,4,"Student OMNY Cards are good for 4 free rides each day. You can tap a Student OMNY Card whenever you want to take up to 4 free trips every day of the week, any ...",neutral,False
2026-07-17,OMNY,r/OMNY,https://www.reddit.com/r/OMNY/,5,"All things related to the OMNY payment card system in the New York Metro. OMNY's system is extremely slow in processing taps, voids, and any ...",neutral,False
2026-07-17,OMNY,OMNY : le système pour les tickets de métro et de bus à ...,https://www.cnewyork.net/bons-plans/transports/omny/,6,"OMNY est le nouveau système de paiement mis en place par les transports à New York, métro et bus. Ce système a définitivement remplacé les actuelles cartes ...",neutral,False
2026-07-17,The L,How-To Guide: Riding the 'L' (Trains),https://www.transitchicago.com/howto/riding-the-train/,1,"CTA's train system is known as the 'L' (a now-official name originally short for ""elevated""). Trains serve over 140 stations located throughout the city and ...",positive,True
2026-07-17,The L,"Chicago ""L""",https://en.wikipedia.org/wiki/Chicago_%22L%22,2,"The Chicago ""L"" (short for ""elevated"") [4] is the rapid transit system serving the city of Chicago and some of its surrounding suburbs in the U.S. state of ...",neutral,False
2026-07-17,The L,The Chicago “L” is an American Treasure. : r/transit,https://www.reddit.com/r/transit/comments/1bt9yng/the_chicago_l_is_an_american_treasure/,3,"This is the LaSalle/Van Buren station in the Loop. It connects to the Brown, Pink, and Orange Lines. the 'L' is basically a hybrid commuter- ...",positive,False
2026-07-17,The L,"THE L STATION (@thelstation.chi) · Chicago, IL",https://www.instagram.com/thelstation.chi/?hl=en,4,Luxury Dining ✨Kitchen ・ $7 lemon drops & $7 lamb chops EVERY WEDNESDAY✨ ・ serving up elevated soul food right in downtown Chicago. from 11am - 9pm. Hours 11 ...,positive,True
2026-07-17,The L,The Chicago L,https://www.architecture.org/online-resources/buildings-of-chicago/the-chicago-l,5,The Chicago L began operating in 1892. This network of elevated trains and subways is how Chicagoans get around. But it's also an iconic symbol of the city.,positive,False
2026-07-17,The L,Experience Chicago on the L Train: A City Ride Guide,https://www.choosechicago.com/articles/tours-and-attractions/sightsee-on-the-chicago-l-train/,6,"Experience Chicago on the L train with skyline views, neighborhood rides, and iconic stops—this guide shows how to sightsee the city from the tracks.",positive,False
2026-07-17,The L,L Train (14 Street-Canarsie Local) Line Map,https://www.mta.info/maps/subway-line-maps/l-line,7,"L Train (14 Street-Canarsie Local) Line Map Updated Feb 18, 2025. This shows weekday service. Listed transfers are based on the weekday schedule and may vary.",positive,True
2026-07-17,MTA,MTA: Home - NYC,https://www.mta.info/,1,Quick links · Get real-time alerts · Book or manage a Paratransit trip · Check elevator and escalator status · Contact Lost and Found · Sign up for our ...,positive,True
2026-07-17,MTA,Maryland Transit Administration,https://www.mta.maryland.gov/,2,"Routes & Schedules. Download CharmPass and Transit App to Enjoy Convenient, Affordable and Stress-Free. Across the Baltimore Area",positive,True
2026-07-17,MTA,MTA (@MTA) / Posts / X,https://x.com/MTA?lang=en,3,"Check the status of your subway, bus, or rail line before traveling—use the MTA app, TrainTime app, or mta.info for information",positive,True
2026-07-17,MTA,Metropolitan Transportation Authority,https://en.wikipedia.org/wiki/Metropolitan_Transportation_Authority,4,"The MTA is the largest public transit authority in North America, serving 12 counties in Downstate New York, along with two counties in southwestern Connecticut",neutral,False
2026-07-17,MTA,MTA Flint,https://www.mtaflint.org/,5,14 fixed routes throughout the City of Flint with routes and schedules. Regional Routes Direct round-trip connection to places outside of Genesee County.,positive,True
2026-07-17,MTA,Metropolitan Transportation Authority Careers,https://careers.mta.org/,6,"The MTA family includes professionals in a variety of positions, from bus and train operators to engineers, accountants, and policy experts.",positive,True
2026-07-17,DC Metro,WMATA: Home,https://www.wmata.com/,1,"Metro is the Washington, DC region's public transportation system, offering bus and rail service across DC, Maryland, and Virginia. Find real-time arrivals, ...",positive,True
2026-07-17,DC Metro,Washington Metro,https://en.wikipedia.org/wiki/Washington_Metro,2,"The Washington Metro, often abbreviated as the Metro and formally the Metrorail, includes six lines, 98 stations, and 130 miles (210 km) of route.",neutral,False
2026-07-17,DC Metro,"Navigating Washington, DC's Metro System",https://washington.org/navigating-dc-metro,3,"Find out everything you need to know to ride DC's world-class Metrorail system, get a Metro map, check operating hours, ride fares and more.",neutral,False
2026-07-17,DC Metro,Washington Metro • WMATA (@metroforward),https://www.instagram.com/metroforward/?hl=en,4,"Official feed of Metro/WMATA 🚇🚍🚐. NOW AVAILABLE at DCMetrostore.com! stations, buses, and trains clean.",positive,True
2026-07-17,DC Metro,Metro Forward (@wmata) / Posts / X,https://x.com/wmata?lang=en,5,"Official feed of Metro. Location: Washington DC Website: http://wmata.com. Monitored 7a-8p, Mon-Fri & 8a-8p, Sat-Sun. Report emergencies to M️Police (202) 962- ...",positive,True
2026-07-17,DC Metro,DC Metro & Bus: WMATA Realtime - Apps on Google Play,https://play.google.com/store/apps/details?id=com.funforfones.android.dcmetro&hl=en_US,6,"DC Metro and Bus is the real-time WMATA transit app built exclusively for Washington DC, Northern Virginia, and Maryland commuters.",positive,True
2026-07-17,Washington Metropolitan Area Transit Authority,WMATA: Home,https://www.wmata.com/,1,"Metro is the Washington, DC region's public transportation system, offering bus and rail service across DC, Maryland, and Virginia. Find real-time arrivals, ...",positive,True
2026-07-17,Washington Metropolitan Area Transit Authority,Washington Metropolitan Area Transit Authority,https://en.wikipedia.org/wiki/Washington_Metropolitan_Area_Transit_Authority,2,"WMATA provides a rapid transit service under the Metrorail brand, fixed-route bus service under the Metrobus brand, and paratransit service under the ...",neutral,False
2026-07-17,Washington Metropolitan Area Transit Authority,Washington Metropolitan Area Transit Authority (WMATA),https://washington.org/find-dc-listings/washington-metropolitan-area-transit-authority,3,"With a network of six rail lines, 98 stations, 125 bus routes, and a door-to-door paratransit service, Metro is the second busiest transit system in the United ...",neutral,False
2026-07-17,Washington Metropolitan Area Transit Authority,Washington Metropolitan Area Transit Authority (WMATA),https://www.linkedin.com/company/wmata,4,"Provide safe and reliable public transportation Locations Primary 600 5th Street, NW Washington, DC 20001, US Get directions 3500 Pennsy Dr Hyattsville, ...",positive,True
2026-07-17,Washington Metropolitan Area Transit Authority,Welcome to the Washington Metropolitan Area Transit ...,https://wmatc.gov/,5,"Welcome to the Washington Metropolitan Area Transit Commission (WMATC) ... The Commission issues operating authority to van and bus operators and some sedan, SUVs ...",positive,False
2026-07-17,Washington Metropolitan Area Transit Authority,Metro Forward (@wmata) / Posts / X,https://x.com/wmata?lang=en,6,Metro is the best way to get around the region – whether you're headed to work or exploring all the summer activities the DMV has to offer.,positive,True
2026-07-17,Metrorail,"Metrorail Service: Schedules, Fares, and Stations",https://www.miamidade.gov/global/transportation/metrorail.page,1,"The Metrorail system is a 25-mile dual track that provides service to Miami International Airport (MIA) and runs from Kendall through South Miami, Coral Gables ...",neutral,False
2026-07-17,Metrorail,WMATA: Home,https://www.wmata.com/,2,"Metro is the Washington, DC region's public transportation system, offering bus and rail service across DC, Maryland, and Virginia. Find real-time arrivals, ...",positive,True
2026-07-17,Metrorail,"METRORail | Red Line | Green Line | Houston, Texas - METRO",https://www.ridemetro.org/riding-metro/transit-services/metrorail,3,"METRORail is Houston's light rail network, offering convenient access to many popular destinations in and around downtown Houston.",neutral,False
2026-07-17,Metrorail,"Metro | Bus, Rail, Subway, Bike & Micro in Los Angeles",https://www.metro.net/,4,"Explore Los Angeles by public transit. Start with Metro schedules, maps, arrival times, parking info, trip planning, stations, and fares.",neutral,False
2026-07-17,Metrorail,CapMetro Rail – Capital Metro – Austin Public Transit,http://www.capmetro.org/rail,5,"A train for commuters traveling between Leander and downtown. Whether you're traveling to work or Q2 Stadium, get there quickly and comfortably.",neutral,False
2026-07-17,Metrorail,Metrorail (Miami-Dade County),https://en.wikipedia.org/wiki/Metrorail_(Miami-Dade_County),6,Metrorail is a rapid transit system in Miami and Miami-Dade County … consists of two lines and 23 stations over 24.4 miles (39.3 km) of standard gauge track.,neutral,False
2026-07-17,Metrorail,"Navigating Washington, DC's Metro System",https://washington.org/navigating-dc-metro,7,"The Metrorail consists of six color-coded lines: Red, Blue, Orange, Yellow, Green and Silver. Fares during the day range from $2.25 to $6.75. fares range from ...",neutral,False
2026-07-17,Metrorail,Metrorail,https://www.miamiandbeaches.com/l/transportation/metrorail/3040,8,"Metrorail is Miami's quick and easy 25-mile elevated transportation system to get you to all parts of the urban core of Miami from 5:00am to midnight, seven ...",neutral,False
2026-07-17,Metrorail,Houston's Metro Rail System,https://www.visithoustontexas.com/travel-planning/getting-to-and-around-houston/metro-rail/,9,"With our METRORail system covering 23 miles of the city, you can save wear and tear on your car or avoid rental cars during your visit to Houston.",neutral,False
2026-07-17,MBTA,MBTA - Massachusetts Bay Transportation Authority,https://www.mbta.com/,1,"Public transit in the Greater Boston region. Routes, schedules, trip planner, fares, service alerts, real-time updates, and general information.",positive,True
2026-07-17,MBTA,Massachusetts Bay Transportation Authority,https://en.wikipedia.org/wiki/Massachusetts_Bay_Transportation_Authority,2,"The public agency responsible for operating most public transportation services in Greater Boston, Massachusetts.",neutral,False
2026-07-17,MBTA,Massachusetts Bay Transportation Authority (MBTA),https://www.mass.gov/orgs/massachusetts-bay-transportation-authority,3,"The MBTA provides subway, bus, Commuter Rail, ferry, and paratransit service to eastern Massachusetts and parts of Rhode Island.",neutral,False
2026-07-17,MBTA,Massachusetts Bay Transportation Authority - MBTA,https://www.facebook.com/TheMBTA/,4,"Projects include track and signal upgrades, #TAccess improvements, and infrastructure and MassDOT bridge work. Learn more about upcoming service changes in ...",positive,True
2026-07-17,MBTA,TransitMatters - Boston,https://transitmatters.org/,5,"TransitMatters advocates for fast, frequent, reliable and effective public transportation in Boston. We support plans and policies that improve transit",neutral,False
2026-07-17,MBTA,MBTA - Massachusetts Bay Transportation Authority,https://www.mbta.com/,1,"Public transit in the Greater Boston region. Routes, schedules, trip planner, fares, service alerts, real-time updates, and general information.",positive,True
2026-07-17,MBTA,Massachusetts Bay Transportation Authority,https://en.wikipedia.org/wiki/Massachusetts_Bay_Transportation_Authority,2,"The public agency responsible for operating most public transportation services in Greater Boston, Massachusetts.",neutral,False
2026-07-17,MBTA,Massachusetts Bay Transportation Authority (MBTA),https://www.mass.gov/orgs/massachusetts-bay-transportation-authority,3,"The MBTA provides subway, bus, Commuter Rail, ferry, and paratransit service to eastern Massachusetts and parts of Rhode Island.",neutral,False
2026-07-17,MBTA,Massachusetts Bay Transportation Authority - MBTA,https://www.facebook.com/TheMBTA/,4,"Projects include track and signal upgrades, #TAccess improvements, and infrastructure and MassDOT bridge work. Learn more about upcoming service changes in ...",positive,True
2026-07-17,MBTA,TransitMatters - Boston,https://transitmatters.org/,5,"TransitMatters advocates for fast, frequent, reliable and effective public transportation in Boston. We support plans and policies that improve transit",neutral,False
2026-07-17,MBTA,MBTA - Massachusetts Bay Transportation Authority,https://www.mbta.com/,1,"Public transit in the Greater Boston region. Routes, schedules, trip planner, fares, service alerts, real-time updates, and general information.",positive,True
2026-07-17,MBTA,Massachusetts Bay Transportation Authority,https://en.wikipedia.org/wiki/Massachusetts_Bay_Transportation_Authority,2,"The public agency responsible for operating most public transportation services in Greater Boston, Massachusetts.",neutral,False
2026-07-17,MBTA,Massachusetts Bay Transportation Authority (MBTA),https://www.mass.gov/orgs/massachusetts-bay-transportation-authority,3,"The MBTA provides subway, bus, Commuter Rail, ferry, and paratransit service to eastern Massachusetts and parts of Rhode Island.",neutral,False
2026-07-17,MBTA,Massachusetts Bay Transportation Authority - MBTA,https://www.facebook.com/TheMBTA/,4,"Projects include track and signal upgrades, #TAccess improvements, and infrastructure and MassDOT bridge work. Learn more about upcoming service changes in ...",positive,True
2026-07-17,MBTA,TransitMatters - Boston,https://transitmatters.org/,5,"TransitMatters advocates for fast, frequent, reliable and effective public transportation in Boston. We support plans and policies that improve transit",neutral,False
2026-07-17,CTA,Chicago Transit Authority - CTA Buses & Train Service - 1-888 ...,https://www.transitchicago.com/,1,"Information about CTA bus and train service in and around Chicago. Find maps, schedules, service alerts, plan a trip, jobs, news and more!",positive,True
2026-07-17,CTA,California Teachers Association,https://www.cta.org/,2,"California Teachers Association CTA has led the labor movement for more than 150 years, fighting for educators' rights and the rights for every public school ...",positive,True
2026-07-17,CTA,Select Route,https://www.ctabustracker.com/bustime/wireless/html/home.jsp,3,Welcome to CTA Bus Tracker … choose your route: 1 - Bronzeville/Union Station 2 - Hyde Park Express 3 - King Drive 4 - Cottage Grove X4 - Cottage Grove Express,positive,True
2026-07-17,CTA,Chicago Transit Authority (@chicagocta),https://www.instagram.com/chicagocta/,4,"Official account of the Chicago Transit Authority. As a public transit agency that provides 24-hour-a-day, 7-day-a-week service,",positive,True
2026-07-17,CTA,Chicago Transit Authority,https://en.wikipedia.org/wiki/Chicago_Transit_Authority,5,"The Chicago Transit Authority (CTA) is a public transit agency in Chicago, Illinois, United States. It operates the Chicago ""L"" rail system and CTA bus services ...",neutral,False
2026-07-17,CTA,r/cta,https://www.reddit.com/r/cta/,6,"r/cta: Unofficial forum for Chicago's public transportation system, welcome :)",neutral,False
2026-07-17,Massachusetts Bay Transportation Authority,MBTA - Massachusetts Bay Transportation Authority,https://www.mbta.com/,1,"Public transit in the Greater Boston region. Routes, schedules, trip planner, fares, service alerts, real-time updates, and general information.",positive,True
2026-07-17,Massachusetts Bay Transportation Authority,Massachusetts Bay Transportation Authority,https://en.wikipedia.org/wiki/Massachusetts_Bay_Transportation_Authority,2,"The public agency responsible for operating most public transportation services in Greater Boston, Massachusetts.",neutral,False
2026-07-17,Massachusetts Bay Transportation Authority,Massachusetts Bay Transportation Authority (MBTA),https://www.mass.gov/orgs/massachusetts-bay-transportation-authority,3,"The MBTA provides subway, bus, Commuter Rail, ferry, and paratransit service to eastern Massachusetts and parts of Rhode Island.",neutral,False
2026-07-17,Massachusetts Bay Transportation Authority,MBTA,https://www.linkedin.com/company/mbta,4,"The Massachusetts Bay Transportation Authority, is the public operator of most bus, subway, commuter rail and ferry systems in the greater Boston, ...",positive,True
2026-07-17,Massachusetts Bay Transportation Authority,Massachusetts Bay Transportation Authority - MBTA,https://www.facebook.com/TheMBTA/,5,"Projects include track and signal upgrades, #TAccess improvements, and infrastructure and MassDOT bridge work. 45 High St, Floor 5 Boston, MA 02110",positive,True
2026-07-17,Massachusetts Bay Transportation Authority,MASSACHUSETTS BAY TRANSPORTATION AUTHORITY,https://www.yelp.com/biz/massachusetts-bay-transportation-authority-boston,6,An alright transportation system. The prices are reasonable and the stations aren't too difficult to find or navigate through. The trains can be quite crowded ...,neutral,False
2026-07-17,The T,MBTA - Massachusetts Bay Transportation Authority,https://www.mbta.com/,1,"Public transit in the Greater Boston region. Routes, schedules, trip planner, fares, service alerts, real-time updates, and general information.",positive,True
2026-07-17,The T,Massachusetts Bay Transportation Authority,https://en.wikipedia.org/wiki/Massachusetts_Bay_Transportation_Authority,2,"The Massachusetts Bay Transportation Authority (abbreviated MBTA and known colloquially as ""the T"") is the public agency responsible for operating most public ...",neutral,False
2026-07-17,The T,T: An MBTA Musical,https://www.bostontheatrescene.com/shows-and-events/t-an-mbta-musical/,3,An MBTA Musical is Boston's best musical parody of the USA's oldest subway system. “T” is the journey of three struggling Bostonians whose lives have been ...,neutral,False
2026-07-17,The T,"The T (@thet_band) · Boston, MA",https://www.instagram.com/thet_band/,4,"The T (shirt) is back! Come vibe out with us at 10 Gilman St, Boston, MA 02131 at 4:30pm! Buy your tickets here … dance floor, Boston.",positive,True
2026-07-17,The T,T Line - Tacoma Dome – St Joseph,https://www.soundtransit.org/ride-with-us/routes-schedules/t-line,5,"Route map, schedule, service alerts, real-time arrivals and more information for Sound Transit route T Line. Tacoma Dome, 2026-07-16 St Joseph",neutral,False
2026-07-17,Massachusetts Bay Transportation Authority,MBTA - Massachusetts Bay Transportation Authority,https://www.mbta.com/,1,"Public transit in the Greater Boston region. Routes, schedules, trip planner, fares, service alerts, real-time updates, and general information.",positive,True
2026-07-17,Massachusetts Bay Transportation Authority,Massachusetts Bay Transportation Authority,https://en.wikipedia.org/wiki/Massachusetts_Bay_Transportation_Authority,2,"The public agency responsible for operating most public transportation services in Greater Boston, Massachusetts.",neutral,False
