date,ceo,company,title,url,position,snippet,sentiment,controlled
2026-05-02,Nora Leerhsen,The L,CTA Governance/Administration,https://www.transitchicago.com/governance/,1,"Nora Leerhsen is the acting president of the Chicago Transit Authority (CTA), one of the nation's largest public transit agencies, providing approximately one ...",positive,True
2026-05-02,Nora Leerhsen,The L,Nora Leerhsen,https://en.wikipedia.org/wiki/Nora_Leerhsen,2,"Nora Leerhsen is an American lawyer and executive who has served as the Acting President of the Chicago Transit Authority (CTA) since February 2025, replacing ...",neutral,False
2026-05-02,Nora Leerhsen,The L,"Nora Leerhsen - Acting President, Chicago Transit Authority",https://www.linkedin.com/in/nora-leerhsen-1ba38847,3,"Acting President, Chicago Transit Authority · Experience: Chicago Transit Authority · Education: University of Wisconsin Law School · Location: Greater ...",positive,True
2026-05-02,Nora Leerhsen,The L,Team | Chicago Transit Authority,https://www.ctabonds.com/chicago-transit-authority-il/about/our-team/i6552,4,"Nora Leerhsen is acting president of the Chicago Transit Authority (CTA), one of the nation's largest public transit agencies.",positive,True
2026-05-02,Nora Leerhsen,The L,Statement from CTA Acting President Nora Leerhsen,https://www.transitchicago.com/statement-from-cta-acting-president-nora-leerhsen/,5,"As a result of this bill, CTA will be fully funded. This funding means that there will be no layoffs or service cuts. With these funds, we will ...",positive,True
2026-05-02,Nora Leerhsen,The L,From CTA Acting President Nora Leerhsen: On Friday ...,https://www.facebook.com/thecta/posts/from-cta-acting-president-nora-leerhsen-on-friday-cta-held-a-ceremonial-groundbr/1384730190355662/,6,"From CTA Acting President Nora Leerhsen: On Friday, CTA held a ceremonial groundbreaking for the Red Line Extension project.",positive,True
2026-05-02,Nora Leerhsen,The L,A Conversation with Nora Leerhsen,https://transitunplugged.com/transit-unplugged-podcast/the-unmatched-power-of-transit-a-conversation-with-nora-leerhsen/,7,"A lawyer and former educator who rose through the ranks from compliance officer to chief of staff and now acting president, Nora shares her deep ...",neutral,False
2026-05-02,Nora Leerhsen,The L,Dorval Carter Jr. broke the CTA. Nora Leerhsen's on track ...,https://www.reddit.com/r/cta/comments/1mupp1s/dorval_carter_jr_broke_the_cta_nora_leerhsens_on/,8,Dorval Carter Jr. broke the CTA. Nora Leerhsen's on track to fix it – if we fund her work. - Streetsblog Chicago. We ...,negative,False
2026-05-02,Nora Leerhsen,The L,Red Line promise coming true | Community News,https://www.beverlyreview.net/news/community_news/article_69ef5a17-1c0d-4571-9e29-ecb3e88ab33f.html,9,"Nora Leerhsen, acting president of the Chicago Transit Authority, speaks to the audience on April 24 at the groundbreaking ...",positive,False
2026-05-02,Phillip Eng,The T,Phillip Eng | People,https://www.mbta.com/people/phillip-eng,1,Phillip Eng is the General Manager and CEO of the Massachusetts Bay Transportation Authority (MBTA). A Civil Engineer with nearly 40 years of transportation ...,positive,True
2026-05-02,Phillip Eng,The T,Phillip Eng,https://en.wikipedia.org/wiki/Phillip_Eng,2,Phillip Eng (born 1961 or 1962) is an American civil engineer and transit executive serving as interim secretary of Massachusetts Department of ...,neutral,False
2026-05-02,Phillip Eng,The T,Did Phillip Eng fix the MBTA? Reliability and passenger ...,https://www.cbsnews.com/boston/news/mbta-general-manager-phillip-eng/,3,"I'll take it!'"" Eng said. Phillip Eng MBTA General Manager Phillip Eng on the Orange Line. CBS Boston.",neutral,False
2026-05-02,Phillip Eng,The T,Phillip Eng - MassDOT and MBTA,https://www.linkedin.com/in/phillip-eng-875928240,4,Experience: MassDOT and MBTA · Education: The Cooper Union for the Advancement of Science and Art · Location: Boston · 500+ connections on LinkedIn.,positive,True
2026-05-02,Phillip Eng,The T,Governor Healey Appoints MBTA General Manager Phil ...,https://www.mass.gov/news/governor-healey-appoints-mbta-general-manager-phil-eng-as-interim-transportation-secretary,5,Boston — Governor Maura Healey announced today that she has named Massachusetts Bay Transportation Authority (MBTA) General Manager Phillip Eng ...,neutral,False
2026-05-02,Phillip Eng,The T,The MBTA has made incredible strides. Did Phillip Eng fix ...,https://www.reddit.com/r/mbta/comments/1pokx9x/the_mbta_has_made_incredible_strides_did_phillip/,6,"165 votes, 33 comments. Eng is great. He's done tremendous things. I don't think his influence can be overstated.",neutral,False
2026-05-02,Phillip Eng,The T,To a T: How Phillip Eng got Boston's subway system back ...,https://www.csmonitor.com/Business/2025/1115/boston-mbta-phillip-eng,7,Many now see America's oldest subway system as a model for repairing the country's crumbling transportation infrastructure – a huge ...,neutral,False
2026-05-02,Phillip Eng,The T,"With double duty at MassDOT and the T, Phil Eng is living ...",https://www.masslive.com/politics/2026/03/with-double-duty-at-massdot-and-the-t-phil-eng-is-living-out-a-leadership-experiment.html,8,"... 12:26 p.m.; | Published: Mar. 19, 2026, 5:55 a.m.. MBTA General Manager and Interim Transportation Secretary Phil Eng and Highway Administrator and ...",neutral,False
2026-05-02,Phillip Eng,The T,Phillip Eng,https://www.massport.com/our-business/leadership/phillip-eng,9,Phillip Eng leads Massachusetts' transportation network as Interim Secretary of Transportation and General Manager of the MBTA.,positive,True
2026-05-02,Randy Clarke,Washington Metropolitan Area Transit Authority,Leadership,https://www.wmata.com/about/leadership/,1,Randy Clarke joined the Washington Metropolitan Area Transit Authority (WMATA) as General Manager and CEO in July 2022.,positive,True
2026-05-02,Randy Clarke,Washington Metropolitan Area Transit Authority,Randy Clarke,https://en.wikipedia.org/wiki/Randy_Clarke,2,Randy Clarke (born 1977) is a Canadian-American transit executive who has served as the general manager and CEO of Washington Metropolitan Area Transit ...,neutral,False
2026-05-02,Randy Clarke,Washington Metropolitan Area Transit Authority,Randy Clarke - Washington Metropolitan Area Transit ...,https://www.linkedin.com/in/randy-clarke-74bb8a69,3,Experience: Washington Metropolitan Area Transit Authority (WMATA) · Education: University of Southern Maine · Location: United States · 500+ connections on ...,positive,True
2026-05-02,Randy Clarke,Washington Metropolitan Area Transit Authority,Randy Clarke (@wmataGM) / Posts / X,https://x.com/wmataGM?lang=en,4,"Randy Clarke (@wmataGM) - Posts - Proudly leading the @wmata team (America's Metro System) as General Manager & CEO. Also on IG, in.",positive,True
2026-05-02,Randy Clarke,Washington Metropolitan Area Transit Authority,Randy Clarke - GovTech,https://www.govtech.com/top-25/randy-clarke,5,"In his nearly two years on the job as general manager and CEO for the Washington Metropolitan Area Transit Authority (WMATA), Randy Clarke has been almost ...",neutral,False
2026-05-02,Randy Clarke,Washington Metropolitan Area Transit Authority,Randy Clarke (@wmatagm),https://www.instagram.com/wmatagm/,6,Completed the 2nd Annual @metroforward MetroTransitPD Recruit General Manager run on the National Mall. These recruits graduate this month joining our great ...,positive,True
2026-05-02,Randy Clarke,Washington Metropolitan Area Transit Authority,Team | WMATA Bonds | BondLink,https://www.wmatabonds.com/wmata-bonds-dc/about/our-team/i2812,7,Randy Clarke joined the Washington Metropolitan Area Transit Authority (WMATA) as General Manager and CEO in July 2022. He's not just Metro's GM/CEO; ...,positive,True
2026-05-02,Randy Clarke,Washington Metropolitan Area Transit Authority,Washington Metropolitan Area Transit Authority (Maryland entry),https://msa.maryland.gov/msa/mdmanual/38inters/html/23wta.html,8,"D., 2025; April Rai, 2026. Randy Clarke, General Manager & Chief Executive Officer. 300 7th St., SW, Washington, DC 20024 (202) 962-1234 (202) 637-7000 (Metro ...",positive,False
2026-05-02,Monica Tibbits-Nutt,Boston T,Monica (singer),https://en.wikipedia.org/wiki/Monica_(singer),1,"Monica Denise Arnold (formerly Brown; born October 24, 1980), best known mononymously as Monica, is an American singer, songwriter, and actress.",neutral,False
2026-05-02,Monica Tibbits-Nutt,Boston T,MONICA (@monicadenise) • Instagram photos and videos,https://www.instagram.com/monicadenise/,2,Where I'm Headed Determines How I'm Coming …. ♥️ #PassengerPrincess #PTMFSOMALG FOREVER the Inspiration 🕊️ #BabyGirl. I don't play about ...,positive,True
2026-05-02,Monica Tibbits-Nutt,Boston T,Monica,https://open.spotify.com/artist/6nzxy2wXs6tLgzEtqOkEi2,3,"She put together four straight Top Ten albums, including the chart-topping After the Storm (2003), and each one involved established and emergent Georgians as ...",neutral,False
2026-05-02,Monica Tibbits-Nutt,Boston T,Monica,https://music.apple.com/us/artist/monica/334240,4,"Like her peers Brandy and Aaliyah, Monica (born Monica Denise Arnold in 1980) was a former choir kid who blossomed into a bona fide R&B teen queen.",neutral,False
2026-05-02,Monica Tibbits-Nutt,Boston T,Monica,https://www.facebook.com/monica/,5,Monica. 7469126 likes · 38347 talking about this. https://linktr.ee/MonicaOfficial.,positive,True
2026-05-02,Monica Tibbits-Nutt,Boston T,Monica.com,https://www.monica.com/,6,"MONICA is a Grammy Award-winning Multi-platinum Artist, 25-million-plusselling singer, actress, philanthropist and entrepreneur.",neutral,False
2026-05-02,Monica Tibbits-Nutt,Boston T,Monica,https://music.youtube.com/channel/UCeiqCWKxJrtcGSDa3HMrUDw,7,"Monica Denise Arnold, best known mononymously as Monica, is an American singer, songwriter, and actress. Born and raised in College Park, Georgia, ...",neutral,False
2026-05-02,Ryan Coholan,Boston T,Ryan's World,https://www.youtube.com/channel/UChGJGhZ9SOOHvBB0Y4DOO_w,1,"Ryan loves doing lots of fun things like pretend play, science experiments, music videos, skits, challenges, DIY arts and crafts and more!",neutral,False
2026-05-02,Ryan Coholan,Boston T,Ryan's World,https://ryans.world/,2,The best in children's entertainment period · Latest Content · LegoLand · Transformers · Mattel: Jurassic World Toys · Mark Rober & Crunch Labs · The Ninja ...,neutral,False
2026-05-02,Ryan Coholan,Boston T,Ryan Trahan,https://www.youtube.com/@ryan,3,"Videos · Hi, Me in 10 Years · I Took the Longest Train Ride in America · I Tested Every Level of Airplane Food. 13M views. 1 month ago · I Tested 1 ...",neutral,False
2026-05-02,Ryan Coholan,Boston T,Ryan's World,https://en.wikipedia.org/wiki/Ryan%27s_World,4,Ryan's World (formerly Ryan ToysReview) is a YouTube channel for children featuring Ryan Kaji along with his family.,neutral,False
2026-05-02,Ryan Coholan,Boston T,Ryan's World the Movie: Titan Universe Adventure (2024),https://www.imdb.com/title/tt29898251/,5,"Ryan's twin sisters Emma and Kate get trapped in a comic book world. Ryan enters this realm to rescue them, facing adventures, battles, and mishaps.",positive,False
2026-05-02,Ryan Coholan,Boston T,Ryan's World (@ryansworld) • Instagram photos and videos,https://www.instagram.com/ryansworld/,6,Ryan's World The Movie is out now in Theaters! #ryansworld #kidsmovies. Robert Downey Jr. posted a personalized message to Ryan Thank you RDJ! Robert ...,positive,True
2026-05-02,Ryan Coholan,Boston T,RYAN'S SECRET GAMING ROOMS THAT YOU WOULD ...,https://www.youtube.com/watch?v=W4CKckBJb-M,7,Can you find all of Ryan's secret gaming rooms? Watch as the Kaji family showcases their super secret gaming rooms and bunkers!,neutral,False
2026-05-02,Ryan Coholan,The T,Ryan's World,https://www.youtube.com/channel/UChGJGhZ9SOOHvBB0Y4DOO_w,1,"Ryan loves doing lots of fun things like pretend play, science experiments, music videos, skits, challenges, DIY arts and crafts and more!",neutral,False
2026-05-02,Ryan Coholan,The T,Ryan's World,https://ryans.world/,2,The best in children's entertainment period · Latest Content · LegoLand · Transformers · Mattel: Jurassic World Toys · Mark Rober & Crunch Labs · The Ninja ...,neutral,False
2026-05-02,Ryan Coholan,The T,Ryan's World the Movie: Titan Universe Adventure (2024),https://www.imdb.com/title/tt29898251/,3,"Ryan's twin sisters Emma and Kate get trapped in a comic book world. Ryan enters this realm to rescue them, facing adventures, battles, and mishaps.",positive,False
2026-05-02,Ryan Coholan,The T,Ryan's World,https://en.wikipedia.org/wiki/Ryan%27s_World,4,Ryan's World (formerly Ryan ToysReview) is a YouTube channel for children featuring Ryan Kaji along with his family.,neutral,False
2026-05-02,Ryan Coholan,The T,Ryan's World: TOYS & GAMES,https://www.amazon.com/stores/RyansWorld/page/CBAADD39-15D2-4896-BF19-EE09FF164503,5,"Shop all Toys, Games and Puzzles from the creator of Ryan ToysReview.",neutral,False
2026-05-02,Ryan Coholan,The T,Ryan's World (@ryansworld) • Instagram photos and videos,https://www.instagram.com/ryansworld/,6,Ryan's World The Movie is out now in Theaters! #ryansworld #kidsmovies. Robert Downey Jr. posted a personalized message to Ryan Thank you RDJ! Robert ...,positive,True
2026-05-02,Ryan Coholan,The T,Ryan's Epic Sports Adventures & Workout FUN!,https://www.youtube.com/watch?v=IAEgcq3wYrY,7,"Ryan's Epic Sports Adventures & Workout FUN! | Play, Run, & Train with Ryan! 264K views · 1 year ago ...more ...",positive,False
2026-05-02,Ryan Coholan,MBTA,Ryan Coholan - Chief Operating Officer at MBTA,https://www.linkedin.com/in/ryan-coholan-139014ab,1,"Experienced Chief Operating Officer with a demonstrated history of working in the transportation/trucking/railroad industry. Skilled in Budgeting, Operations ...",positive,True
2026-05-02,Ryan Coholan,MBTA,MBTA COO drives commuter rail train from Boston to Fall ...,https://www.heraldnews.com/picture-gallery/news/2026/03/24/mbta-coo-ryan-coholan-talks-south-coast-rail-from-boston-to-fall-river/89294351007/,2,"MBTA Chief Operating Officer Ryan Coholan operates a commuter rail train at South Station, Boston, on March 10, 2026. Dan Medeiros.",neutral,False
2026-05-02,Ryan Coholan,MBTA,Ryan Coholan - Massachusetts Bay Transportation Authority ...,https://cthrupayroll.mass.gov/?os=shmmfp&ref=app#!/year/2024/full_time_employees%2Cothers/pay1%2Cpay2%2Cpay3%2Cpay4/explore%2F0-0-0%2Ftrans_no%2F17915261%2F0%2Fdepartment_division,3,Ryan Coholan - Massachusetts Bay Transportation Authority (MBT) - Chief Operating Officer Massachusetts Bay Transportation Authority (MBT).,positive,False
2026-05-02,Ryan Coholan,MBTA,Conversation with MBTA's COO Ryan Coholan,https://transitunplugged.com/transit-unplugged-podcast/ryan-coholan-mbta/,4,"With nearly 30 years of transit experience, Ryan talks about running one of America's largest transit systems and shares stories of MBTA's ...",neutral,False
2026-05-02,Ryan Coholan,MBTA,Cape Cod Model Railroad Club & Museum,https://www.facebook.com/ccmrrcam/posts/when-it-comes-to-making-a-meaningful-difference-about-how-the-mbta-serves-the-ci/1285749126448679/,5,"Simply put, Ryan Coholan has been the lead innovator, manager and cheerleader for rail service in the Commonwealth. Countless organizations ( ...",positive,True
2026-05-02,Ryan Coholan,MBTA,"Today, COO Ryan Coholan joined State Senator ...",https://www.instagram.com/p/DPWzqsCEoZw/?hl=en,6,"Today, COO Ryan Coholan joined State Senator @barryfinegoldma, State Representative Dave Robertson, Town of Wilmington officials, ...",positive,True
2026-05-02,Ryan Coholan,MBTA,The MBTA Advisory Board,https://mbtaadvisoryboard.org/wp-content/uploads/2024/04/MinutesMBTAAB-12-05-23APPROVED.pdf,7,Coholan is responsible for the operation of all MBTA modes. He was appointed. COO by General Manager Philip Eng in September 2023. Mr. Coholan introduced his ...,positive,True
2026-05-02,Ryan Coholan,MBTA,Cultivating Culture at the MBTA with COO Ryan Coholan,https://soundcloud.com/spilling-the-t-podcast/cultivating-culture-at-the-mbta-with-coo-ryan-coholan,8,"On this episode, Chief Operating Officer Ryan Coholan joins us to discuss his unique approach to leading Operations at the MBTA.",neutral,False
2026-05-02,Randy Clarke,DC Metro,Randy Clarke,https://en.wikipedia.org/wiki/Randy_Clarke,1,Randy Clarke (born 1977) is a Canadian-American transit executive who has served as the general manager and CEO of Washington Metropolitan Area Transit ...,neutral,False
2026-05-02,Randy Clarke,DC Metro,Leadership,https://www.wmata.com/about/leadership/,2,Randy Clarke joined the Washington Metropolitan Area Transit Authority (WMATA) as General Manager and CEO in July 2022.,positive,True
2026-05-02,Randy Clarke,DC Metro,Randy Clarke (@wmataGM) / Posts / X,https://x.com/wmataGM?lang=en,3,"Randy Clarke (@wmataGM) - Posts - Proudly leading the @wmata team (America's Metro System) as General Manager & CEO. Also on IG, in.",positive,True
2026-05-02,Randy Clarke,DC Metro,Randy Clarke - Washington Metropolitan Area Transit ...,https://www.linkedin.com/in/randy-clarke-74bb8a69,4,Experience: Washington Metropolitan Area Transit Authority (WMATA) · Education: University of Southern Maine · Location: United States · 500+ connections on ...,positive,True
2026-05-02,Randy Clarke,DC Metro,Randy Clarke (@wmatagm),https://www.instagram.com/wmatagm/,5,Completed the 2nd Annual @metroforward MetroTransitPD Recruit General Manager run on the National Mall. These recruits graduate this month joining our great ...,positive,True
2026-05-02,Randy Clarke,DC Metro,How to Save DC's Metro - by Santi Ruiz,https://www.statecraft.pub/p/how-to-save-dcs-metro,6,"Today we talked to Randy Clarke, the head of DC's Metro system, WMATA. If you're a transit nerd, you probably know about Clarke — he's ...",positive,False
2026-05-02,Randy Clarke,DC Metro,WMATA GM Randy Clarke says any major future ...,https://www.reddit.com/r/washingtondc/comments/1pnm53u/wmata_gm_randy_clarke_says_any_major_future/,7,"WMATA GM Randy Clarke says any major future expansions of Metro probably won't look like the Metro of today, specifically mentions light metro ...",neutral,False
2026-05-02,Randy Clarke,DC Metro,WMATA's Board of Directors Selects Randy Clarke as its ...,https://www.wmata.com/about/news/Metro-Board-announces-new-GM-Randy-Clarke.cfm,8,"Randy Clarke, the current President and CEO of Capital Metro (CapMetro) in Austin, TX, will begin his new position at WMATA late summer.",positive,True
2026-05-02,Randy Clarke,DC Metro,Here's a wild idea: Randy Clarke for D.C. mayor,https://www.axios.com/local/washington-dc/2025/10/30/randy-clarke-metro-dc-mayor-muriel-bowser-election,9,Randy Clarke fixed Metro. Maybe he can fix D.C. next? Why it matters: We need someone to run for mayor! email (opens in new window).,neutral,False
2026-05-02,Randy Clarke,DC Metro,"2023 Message from Randy Clarke, General Manager and ...",https://www.wmata.com/about/leadership/2023-Message.cfm,10,"2023 Message from Randy Clarke, General Manager and Chief Executive Officer. As we set our intentions for this new year, Metro closed the book on 2022 with ...",positive,True
2026-05-02,Janno Lieber,OMNY,Janno Gibbs,https://en.wikipedia.org/wiki/Janno_Gibbs,1,"Janno Ronaldo Ilagan Gibbs (born September 16, 1969) is a Filipino singer, songwriter, comedian and actor. He was a regular host of GMA Network television shows ...",neutral,False
2026-05-02,Janno Lieber,OMNY,JANNO,https://open.spotify.com/artist/7hpiHzP9aLLb5liDLxtwhM,2,Singles and EPs · JUNGS AUF NER BANK · Zweizwei Cypher · Neckbreaker · Get Down · Moon Rocks · HYPERAKTIV · GET THE FUCK UP · ALLES WAS WAR. Single • 2025 ...,neutral,False
2026-05-02,Janno Lieber,OMNY,JANNO,https://music.apple.com/us/artist/janno/1540884909,3,"Listen to music by JANNO on Apple Music. Find top songs and albums by JANNO including Neckbreaker, Get Down and more.",neutral,False
2026-05-02,Janno Lieber,OMNY,Janno Gibbs,https://www.youtube.com/playlist?list=PLTFmW0eINFNPYz0IJw1EqUTjtreptZkPf,4,"Janno Gibbs & Manilyn Reynes' version of ""MY JAGIYA"" | FULL VIDEO · The Gibbs' version of 'ONE DAY' I FULL VIDEO · Janno Gibbs sings 'CHANDELIER' I FULL VIDEO.",neutral,False
2026-05-02,Janno Lieber,OMNY,Janno Ilagan Gibbs (@jannolategibbs),https://www.instagram.com/jannolategibbs/,5,"445K followers · 1.2K+ following · 1288 posts · @jannolategibbs: “Artist, Political Angalist”",positive,True
2026-05-02,Janno Lieber,OMNY,Janno,https://en.wikipedia.org/wiki/Janno,6,"Janno is both a masculine given name and a surname predominantly found in Estonia. As a given name it can be a diminutive of Johannes, Juhan, Jan, Jaan, and ...",neutral,False
2026-05-02,Janno Lieber,OMNY,Janno Trump - musician/bassplayer,https://www.jannotrump.com/,7,Janno Trump is one of the most notable younger generation bassists in Estonia and a bandleader of the jazz-funk orchestra JT Conception.,neutral,False
2026-05-02,Janno Lieber,OMNY,Janno Gibbs (@jannogibbsofficial),https://www.facebook.com/jannogibbsofficial/,8,Janno Gibbs. 483608 likes · 89412 talking about this. My Official Facebook Page.,positive,True
2026-05-02,Janno Lieber,OMNY,Janno Lieber,https://www.mta.info/transparency/leadership/executive-leadership/janno-lieber,9,John (“Janno”) Lieber was confirmed as Chair and CEO of the Metropolitan Transportation Authority (MTA) in January 2022.,positive,True
2026-05-02,Phillip Eng,Boston T,Philips - United States | Philips,https://www.usa.philips.com/?srsltid=AfmBOoq_dmgvbMVswhc_SWeQ9R_1hKnMIKVXMYE4XltAg3Y5vJVF0D4J,1,"Learn more about Philips and how we help improve people's lives through meaningful innovation in the areas of Healthcare, Consumer Lifestyle and Lighting.",positive,False
2026-05-02,Phillip Eng,Boston T,"Prince Philip, Duke of Edinburgh","https://en.wikipedia.org/wiki/Prince_Philip,_Duke_of_Edinburgh",2,"Prince Philip, Duke of Edinburgh was the husband of Queen Elizabeth II and served as consort of the British monarch from her accession on 6 February 1952 ...",neutral,False
2026-05-02,Phillip Eng,Boston T,Phillip Phillips (@PhillipPhillips),https://www.facebook.com/PhillipPhillips/,3,Phillip Phillips. 989930 likes · 2364 talking about this. New single “Homesick” out now! ⬇️ https://stem.ffm.to/homesickphillip.,positive,True
2026-05-02,Phillip Eng,Boston T,Phillip Phillips (@phillphill) • Instagram photos and videos,https://www.instagram.com/phillphill/,4,"I've known @phillphill for about twelve years now. We've written countless songs together, shared endless jokes, and seen each other through some hard times and ...",positive,True
2026-05-02,Phillip Eng,Boston T,Phillip Phillips,https://open.spotify.com/artist/6p5JxpTc7USNnBnLzctyd4,5,"Singles and EPs · Homesick · Gone, Gone, Gone (Phillip's Version) · Home (Phillip's Version) · Dancing With Your Shadows (Demo Version) · So Will I · Before I ...",neutral,False
2026-05-02,Phillip Eng,Boston T,Phillip Phillips,https://www.phillipphillips.com/,6,Phillip Phillips. Open Menu Close Menu. Music · Video · Tour · Store · Phillip Phillips.,neutral,False
2026-05-02,Phillip Eng,Boston T,PHILLIP Definition & Meaning,https://www.dictionary.com/browse/phillip,7,"a male given name. Phillip British. / ˈfɪlɪp /. noun. Arthur. 1738–1814, English naval commander; captain general of the First Fleet, which carried ...",neutral,False
2026-05-02,Phillip Eng,Boston T,Philip vs Phillip : r/namenerds,https://www.reddit.com/r/namenerds/comments/rx4lcs/philip_vs_phillip/,8,Philip was the more common spelling in 2020 (655 babies vs 546) but Phillip has generally been the dominant spelling since 1950. Some argue ...,neutral,False
2026-05-02,Randy Clarke,Metrorail,RANDY Definition & Meaning,https://www.merriam-webster.com/dictionary/randy,1,"1 ... chiefly Scotland ... having a coarse manner ... 2 ... lustful, lecherous ... randiness noun ... randy ... 2 of 2 ... noun ... plural ... randies ... chiefly ...",neutral,False
2026-05-02,Randy Clarke,Metrorail,Randy,https://open.spotify.com/artist/1Qote9MpqMZluWzYGifZUg,2,Listen to Randy on Spotify. Artist · 1.4M monthly listeners.,neutral,False
2026-05-02,Randy Clarke,Metrorail,randy,https://en.wiktionary.org/wiki/randy,3,"Adjective · (British, informal) Sexually aroused; full of sexual lust. · If you're feeling randy, give me a call and I'll come round and give you some hot lovin ...",neutral,False
2026-05-02,Randy Clarke,Metrorail,Dolly Parton - Randy,https://www.youtube.com/watch?v=Kuq144yNYG4,4,"Provided to YouTube by RLG/Legacy Randy · Dolly Parton Jolene ℗ 1974 Sony Music Entertainment Released on: 1974-02-04 Composer, ...",neutral,False
2026-05-02,Randy Clarke,Metrorail,Randy,https://en.wikipedia.org/wiki/Randy,5,"Randy is a primarily masculine given name. It is popular in the United States and Canada. It was originally derived from the names Randall, Randolph, and ...",neutral,False
2026-05-02,Randy Clarke,Metrorail,Randy : r/JusticeMusic,https://www.reddit.com/r/JusticeMusic/comments/1bmg7pa/randy/,6,Randy. Discussion. Is the best song Justice has ever composed. Tell me why I'm right. Or change my mind. Upvote 17. Downvote 26 Go to comments,neutral,False
2026-05-02,Randy Clarke,Metrorail,RANDY Definition & Meaning,https://www.dictionary.com/browse/randy,7,RANDY definition: sexually aroused; lustful; lecherous. See examples of randy used in a sentence.,neutral,False
2026-05-02,Randy Clarke,Metrorail,The origin of “randy”,https://grammarphobia.com/blog/2006/12/the-origin-of-randy.html,8,"The adjective “randy” originally meant rude, disorderly, or aggressive, and dates back to the late 17th century in Scotland.",neutral,False
