date,company,title,url,position,snippet,sentiment,controlled
2026-03-19,Massachusetts Bay Transportation Authority,MBTA - Massachusetts Bay Transportation Authority,https://www.mbta.com/,1,"Public transit in the Greater Boston region. Routes, schedules, trip planner, fares, service alerts, real-time updates, and general information.",positive,True
2026-03-19,Massachusetts Bay Transportation Authority,Massachusetts Bay Transportation Authority,https://en.wikipedia.org/wiki/Massachusetts_Bay_Transportation_Authority,2,"The public agency responsible for operating most public transportation services in Greater Boston, Massachusetts.",neutral,False
2026-03-19,Massachusetts Bay Transportation Authority,Massachusetts Bay Transportation Authority (MBTA),https://www.mass.gov/orgs/massachusetts-bay-transportation-authority,3,"The MBTA provides subway, bus, Commuter Rail, ferry, and paratransit service to eastern Massachusetts and parts of Rhode Island.",neutral,False
2026-03-19,Massachusetts Bay Transportation Authority,Massachusetts Bay Transportation Authority - MBTA,https://www.facebook.com/TheMBTA/,4,Massachusetts Bay Transportation Authority - MBTA · Details · Links · Contact info. 󰢉. thembta + 3. 󰛪. (617) 222-3200. 󰘢. social@mbta.com. Photos. See all ...,positive,True
2026-03-19,Massachusetts Bay Transportation Authority,"MBTA (@thembta) · Boston, MA",https://www.instagram.com/thembta/,5,"The official Instagram of the Massachusetts Bay Transportation Authority. · Effective March 3, transit workers are now protected under MA law (H. · March is ...",positive,True
2026-03-19,Massachusetts Bay Transportation Authority,MBTA,https://www.youtube.com/mbtagm,6,"The official YouTube channel of the the Massachusetts Bay Transportation Authority. The MBTA, more commonly known as the T, provides subway, bus, Commuter Rail ...",neutral,False
2026-03-19,Massachusetts Bay Transportation Authority,Massachusetts Bay Transportation Authority Photos,https://www.yelp.com/biz/massachusetts-bay-transportation-authority-boston?start=80,7,An alright transportation system. The prices are reasonable and the stations aren't too difficult to find or navigate through.,neutral,False
2026-03-19,Massachusetts Bay Transportation Authority,MBTA - Massachusetts Bay Transportation Authority,https://www.mbta.com/,1,"Public transit in the Greater Boston region. Routes, schedules, trip planner, fares, service alerts, real-time updates, and general information.",positive,True
2026-03-19,Massachusetts Bay Transportation Authority,Massachusetts Bay Transportation Authority,https://en.wikipedia.org/wiki/Massachusetts_Bay_Transportation_Authority,2,"The public agency responsible for operating most public transportation services in Greater Boston, Massachusetts.",neutral,False
2026-03-19,Massachusetts Bay Transportation Authority,Massachusetts Bay Transportation Authority (MBTA),https://www.mass.gov/orgs/massachusetts-bay-transportation-authority,3,"The MBTA provides subway, bus, Commuter Rail, ferry, and paratransit service to eastern Massachusetts and parts of Rhode Island.",neutral,False
2026-03-19,Massachusetts Bay Transportation Authority,Massachusetts Bay Transportation Authority - MBTA,https://www.facebook.com/TheMBTA/,4,Massachusetts Bay Transportation Authority - MBTA · Details · Links · Contact info. 󰢉. thembta + 3. 󰛪. (617) 222-3200. 󰘢. social@mbta.com. Photos. See all ...,positive,True
2026-03-19,Massachusetts Bay Transportation Authority,"MBTA (@thembta) · Boston, MA",https://www.instagram.com/thembta/,5,"The official Instagram of the Massachusetts Bay Transportation Authority. · Effective March 3, transit workers are now protected under MA law (H. · March is ...",positive,True
2026-03-19,Massachusetts Bay Transportation Authority,MBTA,https://www.youtube.com/mbtagm,6,"The official YouTube channel of the the Massachusetts Bay Transportation Authority. The MBTA, more commonly known as the T, provides subway, bus, Commuter Rail ...",neutral,False
2026-03-19,Massachusetts Bay Transportation Authority,Massachusetts Bay Transportation Authority Photos,https://www.yelp.com/biz/massachusetts-bay-transportation-authority-boston?start=80,7,An alright transportation system. The prices are reasonable and the stations aren't too difficult to find or navigate through.,neutral,False
2026-03-19,Massachusetts Bay Transportation Authority,MBTA - Massachusetts Bay Transportation Authority,https://www.mbta.com/,1,"Public transit in the Greater Boston region. Routes, schedules, trip planner, fares, service alerts, real-time updates, and general information.",positive,True
2026-03-19,Massachusetts Bay Transportation Authority,Massachusetts Bay Transportation Authority,https://en.wikipedia.org/wiki/Massachusetts_Bay_Transportation_Authority,2,"The public agency responsible for operating most public transportation services in Greater Boston, Massachusetts.",neutral,False
2026-03-19,Massachusetts Bay Transportation Authority,Massachusetts Bay Transportation Authority (MBTA),https://www.mass.gov/orgs/massachusetts-bay-transportation-authority,3,"The MBTA provides subway, bus, Commuter Rail, ferry, and paratransit service to eastern Massachusetts and parts of Rhode Island.",neutral,False
2026-03-19,Massachusetts Bay Transportation Authority,Massachusetts Bay Transportation Authority - MBTA,https://www.facebook.com/TheMBTA/,4,Massachusetts Bay Transportation Authority - MBTA · Details · Links · Contact info. 󰢉. thembta + 3. 󰛪. (617) 222-3200. 󰘢. social@mbta.com. Photos. See all ...,positive,True
2026-03-19,Massachusetts Bay Transportation Authority,"MBTA (@thembta) · Boston, MA",https://www.instagram.com/thembta/,5,"The official Instagram of the Massachusetts Bay Transportation Authority. · Effective March 3, transit workers are now protected under MA law (H. · March is ...",positive,True
2026-03-19,Massachusetts Bay Transportation Authority,MBTA,https://www.youtube.com/mbtagm,6,"The official YouTube channel of the the Massachusetts Bay Transportation Authority. The MBTA, more commonly known as the T, provides subway, bus, Commuter Rail ...",neutral,False
2026-03-19,Massachusetts Bay Transportation Authority,Massachusetts Bay Transportation Authority Photos,https://www.yelp.com/biz/massachusetts-bay-transportation-authority-boston?start=80,7,An alright transportation system. The prices are reasonable and the stations aren't too difficult to find or navigate through.,neutral,False
2026-03-19,Metrorail,Metrorail,https://www.wmata.com/service/rail/,1,"Metrorail provides safe, clean, reliable transit service for more than 600,000 customers a day throughout the Washington, DC area. The system is the second ...",positive,True
2026-03-19,Metrorail,Metrorail,https://www.miamidade.gov/global/transportation/metrorail.page,2,"The Metrorail system is a 25-mile dual track that provides service to Miami International Airport (MIA) and runs from Kendall through South Miami, Coral Gables ...",neutral,False
2026-03-19,Metrorail,"METRORail | Red Line | Purple Line | Houston, Texas - METRO",https://www.ridemetro.org/riding-metro/transit-services/metrorail,3,"METRORail is Houston's light rail network, offering convenient access to many popular destinations in and around downtown Houston. These include the Texas ...",neutral,False
2026-03-19,Metrorail,CapMetro Rail – Capital Metro – Austin Public Transit,https://www.capmetro.org/rail,4,"A train for commuters traveling between Leander and downtown. Whether you're traveling to work or Q2 Stadium, get there quickly and comfortably.",neutral,False
2026-03-19,Metrorail,"Metro | Bus, Rail, Subway, Bike & Micro in Los Angeles",https://www.metro.net/,5,"Explore Los Angeles by public transit. Start with Metro schedules, maps, arrival times, parking info, trip planning, stations, and fares.",neutral,False
2026-03-19,Metrorail,Metrorail Stations - Miami-Dade County,https://www.miamidade.gov/transportation-publicworks/metrorail-stations.asp,6,"The 22 accessible Metrorail stations are about one-mile apart, providing easy access for bus riders, pedestrians, and passengers being dropped off and ...",neutral,False
2026-03-19,Metrorail,METRORail,https://en.wikipedia.org/wiki/METRORail,7,"METRORail ranks as the second most-traveled light rail system in the Southern United States and the 10th most-traveled light rail system in the United States, ...",neutral,False
2026-03-19,Metrorail,WMATA: Home,https://www.wmata.com/,8,Rail · Bus · MetroAccess · Elevators and Escalators · Upcoming Track Work · Service Plans & Reports · Status and Alerts · Bikes · Parking ...,positive,True
2026-03-19,Metrorail,Metrorail,https://www.miamiandbeaches.com/l/transportation/metrorail/3040,9,"Metrorail is Miami's quick and easy 25-mile elevated transportation system to get you to all parts of the urban core of Miami from 5:00am to midnight, seven ...",neutral,False
2026-03-19,NYC Subway,Maps,https://www.mta.info/maps,1,Geographic subway maps. Geographic subway map. The geographic New York City subway map. This map shows typical weekday ...,positive,True
2026-03-19,NYC Subway,New York City Subway,https://en.wikipedia.org/wiki/New_York_City_Subway,2,"The New York City Subway is a rapid transit system in New York City, serving four of the city's five boroughs: Manhattan, Brooklyn, Queens, and the Bronx.",neutral,False
2026-03-19,NYC Subway,MTA: Home,https://www.mta.info/,3,"Subway; Bus; Rail. Your favorite subway, bus and rail services will appear here ... Getting to NYC-area stadiums and arenas on transit · See All. More ...",positive,True
2026-03-19,NYC Subway,nycsubway.org,https://www.nycsubway.org/,4,nycsubway.org is not affiliated with any transit agency or provider. Not mobile.,positive,True
2026-03-19,NYC Subway,New York Subway MTA Map NYC - App Store - Apple,https://apps.apple.com/us/app/new-york-subway-mta-map-nyc/id369691844,5,This NYC subway map is free to download and will help you navigate around New York using the subway system.,positive,True
2026-03-19,NYC Subway,New York City Subway,https://sab.org/wp-content/uploads/2020/01/Subway_Map_2018.pdf,6,"New York City Subway with bus and railroad connections. Manhattan bound. N ... The subway operates 24 hours a day, but not all lines operate at all times ...",neutral,False
2026-03-19,NYC Subway,The NYC Subway : Our Top Tips for Beginners,https://newyorkpass.com/en/things-to-do/tips-for-nyc-subway,7,"How much does it cost? As of 2024, a single subway ride in New York City costs $2.90 USD. To access the train, you'll need to pay your fare using a MetroCard or ...",positive,False
2026-03-19,CTA,Chicago Transit Authority - CTA Buses & Train Service - 1-888 ...,https://www.transitchicago.com/,1,"Information about CTA bus and train service in and around Chicago. Find maps, schedules, service alerts, plan a trip, jobs, news and more!",positive,True
2026-03-19,CTA,California Teachers Association,https://www.cta.org/,2,"The 310000 members of CTA are passionate advocates for students and public education. Through our union, we make public education work for the public.",positive,True
2026-03-19,CTA,Select Route,https://www.ctabustracker.com/bustime/wireless/html/home.jsp,3,1 - Bronzeville/Union Station · 2 - Hyde Park Express · 3 - King Drive · 4 - Cottage Grove · X4 - Cottage Grove Express · N5 - South Shore Night Bus · 6 - ...,positive,True
2026-03-19,CTA,Chicago Transit Authority,https://en.wikipedia.org/wiki/Chicago_Transit_Authority,4,"The Chicago Transit Authority (CTA) is a public transit agency in Chicago, Illinois, United States. It operates the Chicago ""L"" rail system and CTA bus services ...",neutral,False
2026-03-19,CTA,r/cta,https://www.reddit.com/r/cta/,5,"r/cta: Unofficial forum for Chicago's public transportation system, welcome :)",neutral,False
2026-03-19,Chicago Transit Authority,Chicago Transit Authority - CTA Buses & Train Service - 1-888 ...,https://www.transitchicago.com/,1,"Information about CTA bus and train service in and around Chicago. Find maps, schedules, service alerts, plan a trip, jobs, news and more!",positive,True
2026-03-19,Chicago Transit Authority,Chicago Transit Authority,https://en.wikipedia.org/wiki/Chicago_Transit_Authority,2,"The Chicago Transit Authority (CTA) is a public transit agency in Chicago, Illinois, United States. It operates the Chicago ""L"" rail system and CTA bus services ...",neutral,False
2026-03-19,Chicago Transit Authority,Chicago Transit Authority (CTA) - Travel Information,https://www.chicago.gov/city/en/depts/other/provdrs/cta.html,3,The CTA operates the nation's second largest public transportation system and covers the City of Chicago and 40 surrounding suburbs.,neutral,False
2026-03-19,Chicago Transit Authority,Chicago Transit Authority (@thecta),https://www.facebook.com/thecta/,4,Chicago Transit Authority. 82323 likes · 3129 talking about this. Welcome to the official CTA Facebook page. Serving Chicago & 35 surrounding suburbs....,positive,True
2026-03-19,Chicago Transit Authority,Chicago Transit Authority (@chicagocta),https://www.instagram.com/chicagocta/,5,Official account of the Chicago Transit Authority Past & Present pics ℹ️ Info on news & updates. A message from CTA Acting President Nora Leerhsen: On Transit ...,positive,True
2026-03-19,DC Metro,WMATA: Home,https://www.wmata.com/,1,Metro Home. Washington Metropolitan Area Transit Authority. Open Mobile Menu. Manage Your SmarTrip Account · Get a SmarTrip Card · Service · Rail · Bus ...,positive,True
2026-03-19,DC Metro,Washington Metro,https://en.wikipedia.org/wiki/Washington_Metro,2,a rapid transit system serving the Washington metropolitan area of the United States. It is administered by the Washington Metropolitan Area Transit Authority ...,neutral,False
2026-03-19,DC Metro,Metro Forward (@wmata) / Posts / X,https://x.com/wmata,3,"Join us on Thursday at our Metro Headquarters at 4:30 p.m. located at 300 7th St, SW. Washington, DC across from L'Enfant Plaza station.. Metro Transit ...",positive,True
2026-03-19,DC Metro,Washington Metro • WMATA (@metroforward),https://www.instagram.com/metroforward/,4,Official feed of Metro/WMATA Tag us during your trip #wmata · We're pulling out all the stops to get back to normal service! · The cold never bothered us ...,positive,True
2026-03-19,OMNY,OMNY,https://omny.info/,1,One secure account to manage your travel · Reload your OMNY card · Track progress toward your 7-day fare cap · Manage your travel cards · Contact customer ...,positive,True
2026-03-19,OMNY,Reduced-Fare OMNY,https://www.mta.info/fares-tolls/subway-bus/reduced-fare/omny,2,"Reduced-Fare OMNY lets you tap for half-price fares on MTA buses, subways, Staten Island Railway, Roosevelt Island Tram, and Hudson Rail Link.",positive,True
2026-03-19,OMNY,Student OMNY Cards,https://www.schools.nyc.gov/school-life/transportation/student-omny-cards,3,"Student OMNY Cards are good for 4 free rides each day. You can tap a Student OMNY Card whenever you want to take up to 4 free trips every day of the week, any ...",neutral,False
2026-03-19,OMNY,OMNY,https://en.wikipedia.org/wiki/OMNY,4,"OMNY is a contactless fare payment system, that has been implemented for use on public transit in the New York metropolitan area. OMNY can currently be used ...",neutral,False
2026-03-19,MTA,MTA: Home - NYC,https://www.mta.info/,1,Quick links · Get real-time alerts · Book or manage a Paratransit trip · Check elevator and escalator status · Contact Lost and Found · Sign up for our ...,positive,True
2026-03-19,MTA,Maryland Transit Administration,https://www.mta.maryland.gov/,2,"Routes & Schedules, Real Time Information, Trip Planner, Service Alerts, Website Feedback Survey, MDOT MTA In the News",positive,True
2026-03-19,MTA,MTA (@MTA) / Posts / X,https://x.com/MTA,3,MTA (@MTA) - Posts - Download our apps (MTA and TrainTime) for real-time customer care: mta.info/apps | X (formerly Twitter),positive,True
2026-03-19,MTA,Metropolitan Transportation Authority Careers,https://careers.mta.org/,4,"The MTA family includes professionals in a variety of positions, from bus and train operators to engineers, accountants, and policy experts.",positive,True
2026-03-19,MTA,MTA (@mta) • Instagram photos and videos,https://www.instagram.com/mta/?hl=en,5,It's #WomensHistoryMonth! Throughout March we'll be highlighting the legacy ...,positive,True
2026-03-19,MTA,Home - MTA FlintMTA Flint,https://www.mtaflint.org/,6,14 fixed routes throughout the City of Flint with routes and schedules. Regional Routes Direct round-trip connection to places outside of Genesee County.,positive,True
2026-03-19,MTA,Metropolitan Transportation Authority,https://en.wikipedia.org/wiki/Metropolitan_Transportation_Authority,7,The Metropolitan Transportation Authority (MTA) is a public benefit corporation in New York State responsible for public transportation in the New York City ...,neutral,False
2026-03-19,The L,"Chicago ""L""",https://en.wikipedia.org/wiki/Chicago_%22L%22,1,"It is the fourth-largest rapid transit system in the United States in terms of total route length, at 102.8 miles (165.4 km) long as of 2014.",neutral,False
2026-03-19,The L,the L Denver | Reinventing Classics from the Ground Up,https://www.theldenver.com/,2,"We are on Broadway. We make good cocktails without the pretense & aprons. If you don't like us, we still like you. Our Menu. Your Fun.",positive,True
2026-03-19,The L,How-To Guide: Riding the 'L' (Trains),https://www.transitchicago.com/howto/riding-the-train/,3,"CTA's train system is known as the 'L' (a now-official name originally short for ""elevated""). Trains serve over 140 stations located ...",positive,True
2026-03-19,The L,The Chicago L,https://www.architecture.org/online-resources/buildings-of-chicago/the-chicago-l,4,The Chicago L began operating in 1892. This network of elevated trains and subways is how Chicagoans get around. But it's also an iconic symbol of the city.,positive,False
2026-03-19,The L,Chicago ''L''.org - The Chicago rapid transit internet resource,https://www.chicago-l.org/,5,"Comprehensive resource for information on the Chicago rapid transit system -- the 'L' -- including history, stations, rolling stock, maps, ...",neutral,False
2026-03-19,The L,Then and Now: A Brief History of the Chicago 'L',https://loopchicago.com/in-the-loop/then-and-now-a-brief-history-of-the-chicago-l/,6,"The first 'L' train (then Chicago and South Side Rapid Transit Railroad) was built in 1892, and its inaugural journey took place on June 6, spanning 3.6 miles ...",neutral,False
2026-03-19,The L,L Train (14 Street-Canarsie Local) Line Map,https://www.mta.info/maps/subway-line-maps/l-line,7,"L Train (14 Street-Canarsie Local) Line Map Updated Feb 18, 2025. This shows weekday service. Listed transfers are based on the weekday schedule and may vary.",positive,True
2026-03-19,The L,The Chicago “L” is an American Treasure. : r/transit,https://www.reddit.com/r/transit/comments/1bt9yng/the_chicago_l_is_an_american_treasure/,8,"This is the LaSalle/Van Buren station in the Loop. It connects to the Brown, Pink, and Orange Lines.",positive,False
2026-03-19,MBTA,MBTA - Massachusetts Bay Transportation Authority,https://www.mbta.com/,1,"Public transit in the Greater Boston region. Routes, schedules, trip planner, fares, service alerts, real-time updates, and general information.",positive,True
2026-03-19,MBTA,MBTA (@MBTA) / Posts / X,https://x.com/MBTA,2,Red Line Update: Delays of about 15 minutes due to a medical emergency at Charles/MGH. Trains are being asked to stand by at stations.,positive,True
2026-03-19,MBTA,Massachusetts Bay Transportation Authority (MBTA),https://www.mass.gov/orgs/massachusetts-bay-transportation-authority,3,"The MBTA provides subway, bus, Commuter Rail, ferry, and paratransit service to eastern Massachusetts and parts of Rhode Island.",neutral,False
2026-03-19,MBTA,MBTA - Massachusetts Bay Transportation Authority,https://www.mbta.com/,1,"Public transit in the Greater Boston region. Routes, schedules, trip planner, fares, service alerts, real-time updates, and general information.",positive,True
2026-03-19,MBTA,MBTA (@MBTA) / Posts / X,https://x.com/MBTA,2,Red Line Update: Delays of about 15 minutes due to a medical emergency at Charles/MGH. Trains are being asked to stand by at stations.,positive,True
2026-03-19,MBTA,Massachusetts Bay Transportation Authority (MBTA),https://www.mass.gov/orgs/massachusetts-bay-transportation-authority,3,"The MBTA provides subway, bus, Commuter Rail, ferry, and paratransit service to eastern Massachusetts and parts of Rhode Island.",neutral,False
2026-03-19,MBTA,MBTA - Massachusetts Bay Transportation Authority,https://www.mbta.com/,1,"Public transit in the Greater Boston region. Routes, schedules, trip planner, fares, service alerts, real-time updates, and general information.",positive,True
2026-03-19,MBTA,MBTA (@MBTA) / Posts / X,https://x.com/MBTA,2,Red Line Update: Delays of about 15 minutes due to a medical emergency at Charles/MGH. Trains are being asked to stand by at stations.,positive,True
2026-03-19,MBTA,Massachusetts Bay Transportation Authority (MBTA),https://www.mass.gov/orgs/massachusetts-bay-transportation-authority,3,"The MBTA provides subway, bus, Commuter Rail, ferry, and paratransit service to eastern Massachusetts and parts of Rhode Island.",neutral,False
2026-03-19,Boston T,Subway | Schedules & Maps,https://www.mbta.com/schedules/subway,1,"Schedule information for MBTA subway lines in Greater Boston, including real-time updates and arrival predictions.",positive,True
2026-03-19,Boston T,MBTA - Massachusetts Bay Transportation Authority,https://www.mbta.com/,2,"Public transit in the Greater Boston region. Routes, schedules, trip planner, fares, service alerts, real-time updates, and general information.",positive,True
2026-03-19,Boston T,MBTA subway,https://en.wikipedia.org/wiki/MBTA_subway,3,"The Massachusetts Bay Transportation Authority (MBTA) operates rapid transit (heavy rail), light rail, and bus rapid transit services in the Boston ...",neutral,False
2026-03-19,Boston T,"Navigating Boston | Travel Advisories, MBTA, Parking",https://www.meetboston.com/plan/getting-around/,4,"Boston's public transportation system is operated by the Massachusetts Bay Transportation Authority (MBTA), though locals simply call it the “T.",neutral,False
2026-03-19,Boston T,"Boston Subway - The ""T"" - Boston Public Transportation",https://www.boston-discovery-guide.com/boston-subway.html,5,"Boston's subway system - locally we call it the ""T"" - is the easiest and cheapest way to get around the city, aside from walking.",neutral,False
2026-03-19,Boston T,"MBTA (@thembta) · Boston, MA",https://www.instagram.com/thembta/,6,"49K Followers, 41 Following, 1967 Posts - MBTA (@thembta) on Instagram: ""The official Instagram of the Massachusetts Bay Transportation Authority.""",positive,True
2026-03-19,Boston T,Subway | Schedules & Maps,https://www.mbta.com/schedules/subway,1,"Schedule information for MBTA subway lines in Greater Boston, including real-time updates and arrival predictions.",positive,True
2026-03-19,Boston T,MBTA - Massachusetts Bay Transportation Authority,https://www.mbta.com/,2,"Public transit in the Greater Boston region. Routes, schedules, trip planner, fares, service alerts, real-time updates, and general information.",positive,True
2026-03-19,Boston T,MBTA subway,https://en.wikipedia.org/wiki/MBTA_subway,3,"The Massachusetts Bay Transportation Authority (MBTA) operates rapid transit (heavy rail), light rail, and bus rapid transit services in the Boston ...",neutral,False
2026-03-19,Boston T,"Navigating Boston | Travel Advisories, MBTA, Parking",https://www.meetboston.com/plan/getting-around/,4,"Boston's public transportation system is operated by the Massachusetts Bay Transportation Authority (MBTA), though locals simply call it the “T.",neutral,False
2026-03-19,Boston T,"Boston Subway - The ""T"" - Boston Public Transportation",https://www.boston-discovery-guide.com/boston-subway.html,5,"Boston's subway system - locally we call it the ""T"" - is the easiest and cheapest way to get around the city, aside from walking.",neutral,False
2026-03-19,Boston T,"MBTA (@thembta) · Boston, MA",https://www.instagram.com/thembta/,6,"49K Followers, 41 Following, 1967 Posts - MBTA (@thembta) on Instagram: ""The official Instagram of the Massachusetts Bay Transportation Authority.""",positive,True
2026-03-19,Boston T,Subway | Schedules & Maps,https://www.mbta.com/schedules/subway,1,"Schedule information for MBTA subway lines in Greater Boston, including real-time updates and arrival predictions.",positive,True
2026-03-19,Boston T,MBTA - Massachusetts Bay Transportation Authority,https://www.mbta.com/,2,"Public transit in the Greater Boston region. Routes, schedules, trip planner, fares, service alerts, real-time updates, and general information.",positive,True
2026-03-19,Boston T,MBTA subway,https://en.wikipedia.org/wiki/MBTA_subway,3,"The Massachusetts Bay Transportation Authority (MBTA) operates rapid transit (heavy rail), light rail, and bus rapid transit services in the Boston ...",neutral,False
2026-03-19,Boston T,"Navigating Boston | Travel Advisories, MBTA, Parking",https://www.meetboston.com/plan/getting-around/,4,"Boston's public transportation system is operated by the Massachusetts Bay Transportation Authority (MBTA), though locals simply call it the “T.",neutral,False
2026-03-19,Boston T,"Boston Subway - The ""T"" - Boston Public Transportation",https://www.boston-discovery-guide.com/boston-subway.html,5,"Boston's subway system - locally we call it the ""T"" - is the easiest and cheapest way to get around the city, aside from walking.",neutral,False
