date,ceo,company,title,url,position,snippet,sentiment,controlled
2026-06-09,Phillip Eng,Massachusetts Bay Transportation Authority,"Today, MassDOT Interim Secretary and MBTA General ...",https://www.facebook.com/TheMBTA/posts/today-massdot-interim-secretary-and-mbta-general-manager-phil-eng-joined-governo/1466736435493723/,6.0,"Today, MassDOT Interim Secretary and MBTA General Manager Phil Eng joined Governor Maura Healey , state and Town of Foxborough, MA officials ...",positive,True
2026-06-09,Phillip Eng,Massachusetts Bay Transportation Authority,Did Phillip Eng fix the MBTA? Reliability and passenger ...,https://www.cbsnews.com/boston/news/mbta-general-manager-phillip-eng/,7.0,"I'll take it!'"" Eng said. Phillip Eng MBTA General Manager Phillip Eng on the Orange Line. CBS Boston.",neutral,False
2026-06-09,Phillip Eng,Massachusetts Bay Transportation Authority,Leadership at The MBTA,https://www.mbta.com/leadership,8.0,The MBTA is overseen by the Massachusetts Bay Transportation Authority Board of Directors. Phillip Eng is the Interim MassDOT Secretary and MBTA General Manager ...,positive,True
2026-06-09,Phillip Eng,Massachusetts Bay Transportation Authority,FTA Letter to General Manager MBTA,https://www.transit.dot.gov/sites/fta.dot.gov/files/2025-09/FTA-Letter-to-General-Manager-MBTA.pdf,9.0,"To protect the safety of passengers and workers, and, in turn, promote public confidence in transit, the Massachusetts Bay Transportation ...",neutral,False
2026-06-09,Phillip Eng,Boston T,Phillip Eng | People,https://www.mbta.com/people/phillip-eng,1.0,Phillip Eng is the General Manager and CEO of the Massachusetts Bay Transportation Authority (MBTA). A Civil Engineer with nearly 40 years of transportation ...,positive,True
2026-06-09,Phillip Eng,Boston T,Phillip Eng,https://en.wikipedia.org/wiki/Phillip_Eng,2.0,Phillip Eng (born 1961 or 1962) is an American civil engineer and transit executive serving as interim secretary of Massachusetts Department of ...,neutral,False
2026-06-09,Phillip Eng,Boston T,Did Phillip Eng fix the MBTA? Reliability and passenger ...,https://www.cbsnews.com/boston/news/mbta-general-manager-phillip-eng/,3.0,"I'll take it!'"" Eng said. Phillip Eng MBTA General Manager Phillip Eng on the Orange Line. CBS Boston.",neutral,False
2026-06-09,Phillip Eng,Boston T,"Phillip Eng - Transportation Services, Operations ...",https://www.linkedin.com/in/phillip-eng-875928240,4.0,"Transportation Services, Operations, Engineering and Infrastructure · Experience: MassDOT and MBTA · Education: The Cooper Union for the Advancement of ...",positive,True
2026-06-09,Phillip Eng,Boston T,Governor Healey Appoints MBTA General Manager Phil ...,https://www.mass.gov/news/governor-healey-appoints-mbta-general-manager-phil-eng-as-interim-transportation-secretary,5.0,Highway Administrator Jonathan Gulliver promoted to Undersecretary of Transportation; Interim Secretary and GM Eng to hold media ...,neutral,False
2026-06-09,Phillip Eng,Boston T,Phil Eng earns rave reviews for simultaneous MBTA ...,https://commonwealthbeacon.org/transportation/interim-or-indefinite-no-end-in-sight-to-phil-engs-double-duty/,6.0,The Healey administration seems content to have Phil Eng continue to work as both T general manager and interim transportation secretary for ...,neutral,False
2026-06-09,Phillip Eng,Boston T,The MBTA has made incredible strides. Did Phillip Eng fix ...,https://www.reddit.com/r/mbta/comments/1pokx9x/the_mbta_has_made_incredible_strides_did_phillip/,7.0,"165 votes, 33 comments. Eng is great. He's done tremendous things. I don't think his influence can be overstated.",neutral,False
2026-06-09,Phillip Eng,Boston T,Phillip Eng,https://www.massport.com/our-business/leadership/phillip-eng,8.0,Phillip Eng leads Massachusetts' transportation network as Interim Secretary of Transportation and General Manager of the MBTA.,positive,True
2026-06-09,Phillip Eng,Boston T,To a T: How Phillip Eng got Boston's subway system back ...,https://www.csmonitor.com/Business/2025/1115/boston-mbta-phillip-eng,9.0,Many now see America's oldest subway system as a model for repairing the country's crumbling transportation infrastructure – a huge ...,neutral,False
2026-06-09,Nora Leerhsen,Chicago Transit Authority,No organic results found,,,No organic search results returned for this query,negative,False
