date,ceo,company,title,url,position,snippet,sentiment,controlled
2026-05-06,Ryan Coholan,The T,Ryan's World,https://www.youtube.com/channel/UChGJGhZ9SOOHvBB0Y4DOO_w,1,"Ryan loves doing lots of fun things like pretend play, science experiments, music videos, skits, challenges, DIY arts and crafts and more!",neutral,False
2026-05-06,Ryan Coholan,The T,Ryan Trahan,https://www.youtube.com/@ryan,2,"Videos · Hi, Me in 10,000 Years · I Took the Longest Train Ride in America · I Tested Every Level of Airplane Food. 13M views. 1 month ago · I Tested 1 ...",neutral,False
2026-05-06,Ryan Coholan,The T,Ryan's World,https://ryans.world/,3,The best in children's entertainment period · Latest Content · LegoLand · Transformers · Mattel: Jurassic World Toys · Mark Rober & Crunch Labs · The Ninja ...,neutral,False
2026-05-06,Ryan Coholan,The T,Ryan's World,https://en.wikipedia.org/wiki/Ryan%27s_World,4,Ryan's World (formerly Ryan ToysReview) is a YouTube channel for children featuring Ryan Kaji along with his family.,neutral,False
2026-05-06,Ryan Coholan,The T,Ryan's World (@ryansworld) • Instagram photos and videos,https://www.instagram.com/ryansworld/,5,Ryan's World The Movie is out now in Theaters! #ryansworld #kidsmovies. Robert Downey Jr. posted a personalized message to Ryan Thank you RDJ! Robert ...,positive,True
2026-05-06,Ryan Coholan,The T,Ryan's World (TV Series 2017–2024),https://www.imdb.com/title/tt12987338/,6,"Ryan's World is a children's YouTube channel featuring Ryan Kaji along with his mother, father, and twin sisters.",neutral,False
2026-05-06,Ryan Coholan,The T,RYAN,https://music.apple.com/us/artist/ryan/1728918810,7,"Listen to music by RYAN on Apple Music. Find top songs and albums by RYAN including FORGIVE ME (feat. RYAN), SUN. (feat. RYAN) and more.",neutral,False
2026-05-06,Ryan Coholan,Massachusetts Bay Transportation Authority,Ryan's World,https://www.youtube.com/channel/UChGJGhZ9SOOHvBB0Y4DOO_w,1,"Ryan loves doing lots of fun things like pretend play, science experiments, music videos, skits, challenges, DIY arts and crafts and more!",neutral,False
2026-05-06,Ryan Coholan,Massachusetts Bay Transportation Authority,Ryan Trahan,https://www.youtube.com/@ryan,2,"Videos · Hi, Me in 10,000 Years · I Took the Longest Train Ride in America · I Tested Every Level of Airplane Food. 13M views. 1 month ago · I Tested 1 ...",neutral,False
2026-05-06,Ryan Coholan,Massachusetts Bay Transportation Authority,Ryan's World,https://ryans.world/,3,The best in children's entertainment period · Latest Content · LegoLand · Transformers · Mattel: Jurassic World Toys · Mark Rober & Crunch Labs · The Ninja ...,neutral,False
2026-05-06,Ryan Coholan,Massachusetts Bay Transportation Authority,Tag with Ryan,https://tagwithryan.com/,4,,neutral,False
2026-05-06,Ryan Coholan,Massachusetts Bay Transportation Authority,Ryan's World,https://en.wikipedia.org/wiki/Ryan%27s_World,5,Ryan's World (formerly Ryan ToysReview) is a YouTube channel for children featuring Ryan Kaji along with his family.,neutral,False
2026-05-06,Ryan Coholan,Massachusetts Bay Transportation Authority,Ryan's World (@ryansworld) • Instagram photos and videos,https://www.instagram.com/ryansworld/,6,Ryan's World The Movie is out now in Theaters! #ryansworld #kidsmovies. Robert Downey Jr. posted a personalized message to Ryan Thank you RDJ! Robert ...,positive,True
2026-05-06,Ryan Coholan,Massachusetts Bay Transportation Authority,Ryan's World (TV Series 2017–2024),https://www.imdb.com/title/tt12987338/,7,"Ryan's World is a children's YouTube channel featuring Ryan Kaji along with his mother, father, and twin sisters.",neutral,False
2026-05-06,Nora Leerhsen,CTA,Nora Lighting - Illuminating the Future®,https://noralighting.com/,1,"Nora Lighting is a leading manufacturer of LED luminaires for residential, commercial, and institutional applications.",neutral,False
2026-05-06,Nora Leerhsen,CTA,NORA | Organ Transportation and Logistics,https://www.noratrans.com/,2,"NORA specializes in organ donation and tissue transportation nationwide, servicing clients through elite ground and air transportation, supported by a ...",neutral,False
2026-05-06,Nora Leerhsen,CTA,Nora (name),https://en.wikipedia.org/wiki/Nora_(name),3,"Nora or Norah is a feminine given name. It mainly originates as a short form of Honora (also Honoria), a common Anglo-Norman name, ultimately derived from the ...",neutral,False
2026-05-06,Nora Leerhsen,CTA,Nora (2025),https://www.imdb.com/title/tt15272328/,4,"A former musician settles in suburbia to raise her child. When her husband travels for work, she navigates single parenthood, a new home, and lingering musical ...",neutral,False
2026-05-06,Nora Leerhsen,CTA,"Nora - Baby Name Meaning, Origin and Popularity",https://www.thebump.com/b/nora-baby-name,5,"Nora is a feminine name that has several origins. Considered a shortened form of Honora, Nora assumes the meaning of ""honor"" from the Latin Honorius.",positive,False
2026-05-06,Nora Leerhsen,CTA,Nora,https://open.spotify.com/artist/2pH0QIWh7UyhPZHit7eCQG,6,Listen to NORA on Spotify. Artist · 3.7K monthly listeners.,neutral,False
2026-05-06,Nora Leerhsen,CTA,About NORA,https://noraweb.org/about-nora/,7,"NORA was authorized by Congress in 2000 to provide funding that enables the liquid fuel heating industry to provide more efficient, more reliable and lower ...",neutral,False
2026-05-06,Nora Leerhsen,CTA,NORA (@IAMNORAOFFICIAL),https://www.facebook.com/IAMNORAOFFICIAL/,8,"NORA, London. 1184 likes · 20 talking about this. B*tch pop anthems for soft girlies w/ sharp edges crush is out now ✭ welcome to the deluluverse.",positive,True
2026-05-06,Nora Leerhsen,Chicago Transit Authority,Nora Leerhsen - Chicago Transit Authority,https://www.linkedin.com/in/nora-leerhsen-1ba38847,1,Experience: Chicago Transit Authority · Education: University of Wisconsin Law School · Location: Greater Chicago Area · 500+ connections on LinkedIn.,positive,True
2026-05-06,Nora Leerhsen,Chicago Transit Authority,Nora Leerhsen,https://en.wikipedia.org/wiki/Nora_Leerhsen,2,"Nora Leerhsen is an American lawyer and executive who has served as the Acting President of the Chicago Transit Authority (CTA) since February 2025, replacing ...",neutral,False
2026-05-06,Nora Leerhsen,Chicago Transit Authority,CTA Governance/Administration,https://www.transitchicago.com/governance/,3,"Nora Leerhsen is the acting president of the Chicago Transit Authority (CTA), one of the nation's largest public transit agencies, providing approximately one ...",positive,True
2026-05-06,Nora Leerhsen,Chicago Transit Authority,Team | Chicago Transit Authority,https://www.ctabonds.com/chicago-transit-authority-il/about/our-team/i6552,4,"nleerhsen@transitchicago.com. Nora Leerhsen is acting president of the Chicago Transit Authority (CTA), one of the nation's largest public transit agencies ...",positive,True
2026-05-06,Nora Leerhsen,Chicago Transit Authority,Acting CTA chief lays out priorities after dodging fiscal cliff,https://www.chicagotribune.com/2026/02/02/acting-cta-chief-lays-out-priorities-after-dodging-fiscal-cliff/,5,"When she was named acting president of the Chicago Transit Authority, Nora Leerhsen made a call to the agency's first female train operator.",neutral,False
2026-05-06,Nora Leerhsen,Chicago Transit Authority,"Meet CTA's Acting President, Nora Leerhsen ...",https://www.facebook.com/thecta/posts/meet-ctas-acting-president-nora-leerhsen-acting-president-leerhsen-a-10-year-tra/1017363227092362/,6,"Acting President Leerhsen, a 10-year transit veteran, is the first woman to lead the organization. This morning's commute brought her to the Green Line.",positive,True
2026-05-06,Nora Leerhsen,Chicago Transit Authority,Statement from CTA Acting President Nora Leerhsen,https://www.transitchicago.com/statement-from-cta-acting-president-nora-leerhsen/,7,"Early this morning, the Illinois State Legislature passed a bill that provides a transformational level of funding for the Chicago Transit ...",positive,True
2026-05-06,Nora Leerhsen,Chicago Transit Authority,A Conversation with Nora Leerhsen,https://transitunplugged.com/transit-unplugged-podcast/the-unmatched-power-of-transit-a-conversation-with-nora-leerhsen/,8,"A lawyer and former educator who rose through the ranks from compliance officer to chief of staff and now acting president, Nora shares her deep ...",neutral,False
2026-05-06,Phillip Eng,Boston T,Philips - United States | Philips,https://www.usa.philips.com/?srsltid=AfmBOopXjkum0CJa_OtIcaM2ETXbFQymwTngJaCixxcZ3o6CmqUC2hgv,1,"Learn more about Philips and how we help improve people's lives through meaningful innovation in the areas of Healthcare, Consumer Lifestyle and Lighting.",positive,False
2026-05-06,Phillip Eng,Boston T,Phillip Phillips (@PhillipPhillips),https://www.facebook.com/PhillipPhillips/,2,Phillip Phillips. 989812 likes · 958 talking about this. New single “Homesick” out now! ⬇️ https://stem.ffm.to/homesickphillip.,positive,True
2026-05-06,Phillip Eng,Boston T,Phillip Phillips (@phillphill) • Instagram photos and videos,https://www.instagram.com/phillphill/,3,275K followers · 434 following · 1173 posts · @phillphill: “New single “Homesick” out now! ⬇️”,positive,True
2026-05-06,Phillip Eng,Boston T,Phillip Phillips,https://open.spotify.com/artist/6p5JxpTc7USNnBnLzctyd4,4,"Singles and EPs · Homesick · Gone, Gone, Gone (Phillip's Version) · Home (Phillip's Version) · Dancing With Your Shadows (Demo Version) · So Will I · Before I ...",neutral,False
2026-05-06,Phillip Eng,Boston T,Philip the Apostle,https://en.wikipedia.org/wiki/Philip_the_Apostle,5,Philip the Apostle was one of the Twelve Apostles of Jesus according to the New Testament. Later Christian traditions describe Philip as the apostle who ...,neutral,False
2026-05-06,Phillip Eng,Boston T,Phillip Phillips,https://www.phillipphillips.com/,6,Phillip Phillips. Open Menu Close Menu. Music · Video · Tour · Store · Phillip Phillips.,neutral,False
2026-05-06,Phillip Eng,Boston T,PHILLIP Definition & Meaning,https://www.dictionary.com/browse/phillip,7,"a male given name. Phillip British. / ˈfɪlɪp /. noun. Arthur. 1738–1814, English naval commander; captain general of the First Fleet, which carried ...",neutral,False
2026-05-06,Phillip Eng,Boston T,Phillip Phillips,https://www.youtube.com/channel/UCZYewi2Ya8JledgJImmXIWg,8,"Music Videos · Phillip Phillips - Home · Phillip Phillips - Gone, Gone, Gone · Phillip Phillips - Raging Fire. Phillip Phillips. 14M views. 12 years ago. CC ...",neutral,False
2026-05-06,Randy Clarke,DC Metro,Randy Clarke,https://en.wikipedia.org/wiki/Randy_Clarke,1,Randy Clarke (born 1977) is a Canadian-American transit executive who has served as the general manager and CEO of Washington Metropolitan Area Transit ...,neutral,False
2026-05-06,Randy Clarke,DC Metro,Leadership,https://www.wmata.com/about/leadership/,2,Randy Clarke joined the Washington Metropolitan Area Transit Authority (WMATA) as General Manager and CEO in July 2022.,positive,True
2026-05-06,Randy Clarke,DC Metro,Randy Clarke - Washington Metropolitan Area Transit ...,https://www.linkedin.com/in/randy-clarke-74bb8a69,3,Experience: Washington Metropolitan Area Transit Authority (WMATA) · Education: University of Southern Maine · Location: United States · 500+ connections on ...,positive,True
2026-05-06,Randy Clarke,DC Metro,Randy Clarke (@wmataGM) / Posts / X,https://x.com/wmataGM,4,"Randy Clarke (@wmataGM) - Posts - Proudly leading the @wmata team (America's Metro System) as General Manager & CEO. Also on IG, in.",positive,True
2026-05-06,Randy Clarke,DC Metro,How to Save DC's Metro,https://www.statecraft.pub/p/how-to-save-dcs-metro,5,"Today we talked to Randy Clarke, the head of DC's Metro system, WMATA. If you're a transit nerd, you probably know about Clarke — he's ...",positive,False
2026-05-06,Randy Clarke,DC Metro,Randy Clarke (@wmatagm),https://www.instagram.com/wmatagm/,6,Completed the 2nd Annual @metroforward MetroTransitPD Recruit General Manager run on the National Mall. These recruits graduate this month joining our great ...,positive,True
2026-05-06,Randy Clarke,DC Metro,WMATA GM Randy Clarke says any major future ...,https://www.reddit.com/r/washingtondc/comments/1pnm53u/wmata_gm_randy_clarke_says_any_major_future/,7,"WMATA GM Randy Clarke says any major future expansions of Metro probably won't look like the Metro of today, specifically mentions light metro ...",neutral,False
2026-05-06,Randy Clarke,DC Metro,Here's a wild idea: Randy Clarke for D.C. mayor,https://www.axios.com/local/washington-dc/2025/10/30/randy-clarke-metro-dc-mayor-muriel-bowser-election,8,Randy Clarke fixed Metro. Maybe he can fix D.C. next? Why it matters: We need someone to run for mayor! email (opens in new window).,neutral,False
2026-05-06,Randy Clarke,DC Metro,WMATA's Board of Directors Selects Randy Clarke as its ...,https://www.wmata.com/about/news/Metro-Board-announces-new-GM-Randy-Clarke.cfm,9,"Randy Clarke, the current President and CEO of Capital Metro (CapMetro) in Austin, TX, will begin his new position at WMATA late summer.",positive,True
2026-05-06,Randy Clarke,DC Metro,DC's Metro Made a Comeback. Meet the Man Behind It.,https://washingtonian.com/2024/11/14/dcs-metro-made-a-comeback-meet-the-man-behind-it/,10,"Better service. Happier riders. Under Randy Clarke, Metro has bounced back from a pandemic slump—winning him plaudits and fans.",neutral,False
2026-05-06,Monica Tibbits-Nutt,Boston T,"Monica - All-In-One AI Assistant | GPT-5.2, Claude 4.5, Gemini ...",https://monica.im/,1,"Monica is an all-in-one AI assistant powered by GPT-5.2, Claude 4.5, Gemini 3 Pro, Sora 2, and leading AI models. Access AI chat, smart search, ...",neutral,False
2026-05-06,Monica Tibbits-Nutt,Boston T,Monica (singer),https://en.wikipedia.org/wiki/Monica_(singer),2,"Monica Denise Arnold (formerly Brown; born October 24, 1980), best known mononymously as Monica, is an American singer, songwriter, and actress.",neutral,False
2026-05-06,Monica Tibbits-Nutt,Boston T,MONICA (@monicadenise) • Instagram photos and videos,https://www.instagram.com/monicadenise/,3,The Princess of R&B closed out New York Fashion Week in style. Grammy-winning artist Monica (@MonicaDenise) exclusively welcomed GRAZIA USA into her suite ahead ...,positive,True
2026-05-06,Monica Tibbits-Nutt,Boston T,Monica,https://open.spotify.com/artist/6nzxy2wXs6tLgzEtqOkEi2,4,"She put together four straight Top Ten albums, including the chart-topping After the Storm (2003), and each one involved established and emergent Georgians as ...",neutral,False
2026-05-06,Monica Tibbits-Nutt,Boston T,Monica,https://music.apple.com/us/artist/monica/334240,5,"Like her peers Brandy and Aaliyah, Monica (born Monica Denise Arnold in 1980) was a former choir kid who blossomed into a bona fide R&B teen queen.",neutral,False
2026-05-06,Monica Tibbits-Nutt,Boston T,Monica,https://www.facebook.com/monica/,6,Save YOURSELF • Sit With YOURSELF • @imopodcasts Learning to be accountable & self-access allows one to grow even during difficult times!,positive,True
2026-05-06,Monica Tibbits-Nutt,Boston T,Monica (2022),https://www.imdb.com/title/tt6337816/,7,"The intimate portrait of a woman who returns home to care for her dying mother. A delicate and nuanced story of a fractured family, the story explores ...",neutral,False
2026-05-06,Monica Tibbits-Nutt,Boston T,Monica.com,https://www.monica.com/,8,"MONICA is a Grammy Award-winning Multi-platinum Artist, 25-million-plusselling singer, actress, philanthropist and entrepreneur.",neutral,False
2026-05-06,Monica Tibbits-Nutt,MBTA,MONICA (@monicadenise) • Instagram photos and videos,https://www.instagram.com/monicadenise/,1,The Princess of R&B closed out New York Fashion Week in style. Grammy-winning artist Monica (@MonicaDenise) exclusively welcomed GRAZIA USA into her suite ahead ...,positive,True
2026-05-06,Monica Tibbits-Nutt,MBTA,Monica (singer),https://en.wikipedia.org/wiki/Monica_(singer),2,"Monica Denise Arnold (formerly Brown; born October 24, 1980), best known mononymously as Monica, is an American singer, songwriter, and actress.",neutral,False
2026-05-06,Monica Tibbits-Nutt,MBTA,"Monica - All-In-One AI Assistant | GPT-5.2, Claude 4.5, Gemini ...",https://monica.im/,3,"Monica is an all-in-one AI assistant powered by GPT-5.2, Claude 4.5, Gemini 3 Pro, Sora 2, and leading AI models. Access AI chat, smart search, ...",neutral,False
2026-05-06,Monica Tibbits-Nutt,MBTA,Monica,https://open.spotify.com/artist/6nzxy2wXs6tLgzEtqOkEi2,4,"She put together four straight Top Ten albums, including the chart-topping After the Storm (2003), and each one involved established and emergent Georgians as ...",neutral,False
2026-05-06,Monica Tibbits-Nutt,MBTA,Monica,https://www.facebook.com/monica/,5,Monica. 7468171 likes · 18683 talking about this. https://linktr.ee/MonicaOfficial.,positive,True
2026-05-06,Monica Tibbits-Nutt,MBTA,Monica,https://music.apple.com/us/artist/monica/334240,6,"Like her peers Brandy and Aaliyah, Monica (born Monica Denise Arnold in 1980) was a former choir kid who blossomed into a bona fide R&B teen queen.",neutral,False
2026-05-06,Monica Tibbits-Nutt,MBTA,Monica.com,https://www.monica.com/,7,"MONICA is a Grammy Award-winning Multi-platinum Artist, 25-million-plusselling singer, actress, philanthropist and entrepreneur.",neutral,False
2026-05-06,Monica Tibbits-Nutt,MBTA,monicaofficial,https://www.youtube.com/@Monica,8,"Monica Host VH1 True-Crime Series 'Infamy' When Fame Turns Deadly. Monica hosts a series exploring the dark side of the American Dream, chronicling untold ...",neutral,False
2026-05-06,Phillip Eng,The T,Philips - United States | Philips,https://www.usa.philips.com/?srsltid=AfmBOooMP_ZHJxea7TCpgcjfVWHyU1ZsGTZdNKrpHd2u62OXhsZmhIJ0,1,"Learn more about Philips and how we help improve people's lives through meaningful innovation in the areas of Healthcare, Consumer Lifestyle and Lighting.",positive,False
2026-05-06,Phillip Eng,The T,Phillip Phillips (@PhillipPhillips),https://www.facebook.com/PhillipPhillips/,2,Phillip Phillips. 989812 likes · 958 talking about this. New single “Homesick” out now! ⬇️ https://stem.ffm.to/homesickphillip.,positive,True
2026-05-06,Phillip Eng,The T,Phillip Phillips (@phillphill) • Instagram photos and videos,https://www.instagram.com/phillphill/,3,275K followers · 434 following · 1173 posts · @phillphill: “New single “Homesick” out now! ⬇️”,positive,True
2026-05-06,Phillip Eng,The T,Phillip Phillips,https://open.spotify.com/artist/6p5JxpTc7USNnBnLzctyd4,4,"Singles and EPs · Homesick · Gone, Gone, Gone (Phillip's Version) · Home (Phillip's Version) · Dancing With Your Shadows (Demo Version) · So Will I · Before I ...",neutral,False
2026-05-06,Phillip Eng,The T,Phillip Phillips,https://en.wikipedia.org/wiki/Phillip_Phillips,5,"Phillip LaDon Phillips Jr. (born September 20, 1990) is an American singer-songwriter who rose to fame after winning the eleventh season of American Idol in ...",neutral,False
2026-05-06,Phillip Eng,The T,Phillip Phillips,https://www.phillipphillips.com/,6,Phillip Phillips. Open Menu Close Menu. Music · Video · Tour · Store · Phillip Phillips.,neutral,False
2026-05-06,Phillip Eng,The T,PHILLIP Definition & Meaning,https://www.dictionary.com/browse/phillip,7,"a male given name. Phillip British. / ˈfɪlɪp /. noun. Arthur. 1738–1814, English naval commander; captain general of the First Fleet, which carried ...",neutral,False
2026-05-06,Phillip Eng,The T,Philip vs Phillip : r/namenerds,https://www.reddit.com/r/namenerds/comments/rx4lcs/philip_vs_phillip/,8,Some argue Phillip is a surname and Philip is a given name traditionally. Philip aligns more with international spellings. There are better ...,neutral,False
2026-05-06,Janno Lieber,NYC Subway,Janno Lieber,https://www.mta.info/transparency/leadership/executive-leadership/janno-lieber,1,"Lieber has been serving as MTA Acting Chair and CEO since July 2021 and is the Authority's 15th Chairperson since it was founded in 1968. In this position, ...",positive,True
2026-05-06,Janno Lieber,NYC Subway,Janno Lieber,https://en.wikipedia.org/wiki/Janno_Lieber,2,"John Nathan ""Janno"" Lieber (born September 19, 1961) is the head of the Metropolitan Transportation Authority (MTA) in New York.",neutral,False
2026-05-06,Janno Lieber,NYC Subway,Janno Lieber - Metropolitan Transportation Authority,https://www.linkedin.com/in/janno-lieber-32b487158,3,"An accomplished executive working at the intersection of government, real estate and law.… · Experience: Metropolitan Transportation Authority · Education: ...",positive,True
2026-05-06,Janno Lieber,NYC Subway,"Janno Lieber on Free Buses, the State of the MTA, & The ...",https://nyeditorialboard.substack.com/p/janno-lieber-on-free-buses-the-state,4,"Janno Lieber, Chair and CEO of the Metropolitan Transportation Authority (MTA), which runs the New York City subways and buses, ...",positive,False
2026-05-06,Janno Lieber,NYC Subway,What's your thoughts and opinions on MTA CEO Janno ...,https://www.reddit.com/r/nycrail/comments/1qninf7/whats_your_thoughts_and_opinions_on_mta_ceo_janno/,5,Janno is the most competent leader the MTA has had in generations. He truly cares about the system and regularly rides it (which a surprising ...,neutral,False
2026-05-06,Janno Lieber,NYC Subway,INTERVIEW: MTA Chair Janno Lieber Talks to Streetsblog ...,https://nyc.streetsblog.org/2026/01/21/interview-mta-chair-janno-lieber-talks-to-streetsblog-to-mark-four-years-at-the-top,6,"MTA chairman Janno Lieber sat down with Streetsblog for an in-depth interview about his tenure, congestion pricing, buses and more.",neutral,False
2026-05-06,Janno Lieber,NYC Subway,Fare evasion: MTA boss Lieber defends 'European' model ...,https://www.amny.com/news/fare-evasion-lieber-defends-european-model-enforcement/,7,MTA Chair and CEO Janno Lieber on Wednesday defended the agency's embrace of a new “European-model” of enforcement to crack down on bus fare ...,neutral,False
2026-05-06,Janno Lieber,NYC Subway,I recently sat down with MTA Chairman Janno Lieber ...,https://www.facebook.com/replalota/posts/i-recently-sat-down-with-mta-chairman-janno-lieber-with-chuck-schumer-in-the-roo/949463481374143/,8,"I rode the LIRR for over twenty years. Always had a seat. AM I had coffee, read my newspaper and had a short nap. PM I sat in the bar car ...",positive,True
2026-05-06,Phillip Eng,MBTA,Phillip Eng | People,https://www.mbta.com/people/phillip-eng,1,Phillip Eng is the General Manager and CEO of the Massachusetts Bay Transportation Authority (MBTA). A Civil Engineer with nearly 40 years of transportation ...,positive,True
2026-05-06,Phillip Eng,MBTA,Phillip Eng,https://en.wikipedia.org/wiki/Phillip_Eng,2,Phillip Eng (born 1961 or 1962) is an American civil engineer and transit executive serving as interim secretary of Massachusetts Department of ...,neutral,False
2026-05-06,Phillip Eng,MBTA,Leadership at The MBTA,https://www.mbta.com/leadership,3,The MBTA is overseen by the Massachusetts Bay Transportation Authority Board of Directors. Phillip Eng is the Interim MassDOT Secretary and MBTA General Manager ...,positive,True
2026-05-06,Phillip Eng,MBTA,Governor Healey Appoints MBTA General Manager Phil ...,https://www.mass.gov/news/governor-healey-appoints-mbta-general-manager-phil-eng-as-interim-transportation-secretary,4,Boston — Governor Maura Healey announced today that she has named Massachusetts Bay Transportation Authority (MBTA) General Manager Phillip Eng ...,neutral,False
2026-05-06,Phillip Eng,MBTA,Phillip Eng - MassDOT and MBTA,https://www.linkedin.com/in/phillip-eng-875928240,5,Experience: MassDOT and MBTA · Education: The Cooper Union for the Advancement of Science and Art · Location: Boston · 500+ connections on LinkedIn.,positive,True
2026-05-06,Phillip Eng,MBTA,Phillip Eng,https://www.massport.com/our-business/leadership/phillip-eng,6,Phillip Eng leads Massachusetts' transportation network as Interim Secretary of Transportation and General Manager of the MBTA.,positive,True
2026-05-06,Phillip Eng,MBTA,Did Phillip Eng fix the MBTA? Reliability and passenger ...,https://www.cbsnews.com/boston/news/mbta-general-manager-phillip-eng/,7,"I'll take it!'"" Eng said. Phillip Eng MBTA General Manager Phillip Eng on the Orange Line. CBS Boston.",neutral,False
2026-05-06,Phillip Eng,MBTA,The MBTA has made incredible strides. Did Phillip Eng fix ...,https://www.reddit.com/r/mbta/comments/1pokx9x/the_mbta_has_made_incredible_strides_did_phillip/,8,"165 votes, 33 comments. Eng is great. He's done tremendous things. I don't think his influence can be overstated.",neutral,False
2026-05-06,Phillip Eng,MBTA,Governor Healey Appoints MBTA General Manager Phil ...,https://www.mbta.com/news/2025-10-16/governor-healey-appoints-mbta-general-manager-phil-eng-interim-transportation,9,"Official website of the MBTA -- schedules, maps, and fare information for Greater Boston's public transportation system, including subway, ...",positive,True
2026-05-06,Nora Leerhsen,The L,Nora Lighting - Illuminating the Future®,https://noralighting.com/,1,"Nora Lighting is a leading manufacturer of LED luminaires for residential, commercial, and institutional applications.",neutral,False
2026-05-06,Nora Leerhsen,The L,NORA | Organ Transportation and Logistics,https://www.noratrans.com/,2,"NORA specializes in organ donation and tissue transportation nationwide, servicing clients through elite ground and air transportation, supported by a ...",neutral,False
2026-05-06,Nora Leerhsen,The L,Nora (name),https://en.wikipedia.org/wiki/Nora_(name),3,"Nora or Norah is a feminine given name. It mainly originates as a short form of Honora (also Honoria), a common Anglo-Norman name, ultimately derived from the ...",neutral,False
