date,ceo,company,title,url,position,snippet,sentiment,controlled
2026-04-08,Ryan Coholan,Massachusetts Bay Transportation Authority,Did you know? Single track operations keeps riders moving ...,https://www.facebook.com/TheMBTA/videos/single-track-operations-with-coo-ryan-coholan/907055678496912/,4,Did you know? Single track operations keeps riders moving and work progressing. Watch COO Ryan Coholan explain how trains safely navigate ...,positive,True
2026-04-08,Ryan Coholan,Massachusetts Bay Transportation Authority,Ryan Coholan - Chief Operating Officer at Massachusetts ...,https://www.zoominfo.com/p/Ryan-Coholan/11957181347,5,"Coholan is a Chief Operating Officer at Massachusetts Bay Transportation Authority. Coholan directs, plans, and supervises operations for a significant commuter ...",neutral,False
2026-04-08,Ryan Coholan,Massachusetts Bay Transportation Authority,Ryan Coholan Archives,https://www.globalrailwayreview.com/content_author/ryan-coholan/,6,"Ryan Coholan, Chief Railroad Officer at the Massachusetts Bay Transportation Authority (MBTA), discusses the benefits of introducing new technologies across the ...",neutral,False
2026-04-08,Ryan Coholan,Massachusetts Bay Transportation Authority,The MBTA Advisory Board,https://mbtaadvisoryboard.org/wp-content/uploads/2024/04/MinutesMBTAAB-12-05-23APPROVED.pdf,7,Coholan is responsible for the operation of all MBTA modes. He was appointed. COO by General Manager Philip Eng in September 2023. Mr. Coholan introduced his ...,neutral,False
2026-04-08,Ryan Coholan,Massachusetts Bay Transportation Authority,"Ryan Coholan, Chief Operations Officer for the MBTA ...",https://www.facebook.com/FRCMedia/videos/ryan-coholan-chief-operations-officer-for-the-mbta-discusses-the-success-of-the-/1247964494185964/,8,"Ryan Coholan, Chief Operations Officer for the MBTA, discusses the success of the Fall River/New Bedford commuter rail service over its first ...",positive,True
2026-04-08,Ryan Coholan,Massachusetts Bay Transportation Authority,Cultivating Culture at the MBTA with COO Ryan Coholan,https://www.youtube.com/watch?v=TeJpfw-wfCA,9,"On this episode, Chief Operating Officer Ryan Coholan joins us to discuss his unique approach to leading Operations at the MBTA.",neutral,False
2026-04-08,Ryan Coholan,Massachusetts Bay Transportation Authority,"Today, COO Ryan Coholan joined State Senator ...",https://www.instagram.com/p/DPWzqsCEoZw/,10,The Transportation Authority Board approved $1.5 million for quick upgrades to improve @sfmta_muni service. These upgrades will support ...,positive,True
2026-04-08,Randy Clarke,Washington Metropolitan Area Transit Authority,Leadership,https://www.wmata.com/about/leadership/,1,Randy Clarke joined the Washington Metropolitan Area Transit Authority (WMATA) as General Manager and CEO in July 2022. He's not just Metro's GM/CEO; ...,positive,True
2026-04-08,Randy Clarke,Washington Metropolitan Area Transit Authority,Randy Clarke,https://en.wikipedia.org/wiki/Randy_Clarke,2,Randy Clarke (born 1977) is a Canadian-American transit executive who has served as the general manager and CEO of Washington Metropolitan Area Transit ...,neutral,False
2026-04-08,Randy Clarke,Washington Metropolitan Area Transit Authority,Randy Clarke - Washington Metropolitan Area Transit ...,https://www.linkedin.com/in/randy-clarke-74bb8a69,3,Experience: Washington Metropolitan Area Transit Authority (WMATA) · Education: University of Southern Maine · Location: United States · 500+ connections on ...,positive,True
2026-04-08,Randy Clarke,Washington Metropolitan Area Transit Authority,Randy Clarke (@wmataGM) / Posts / X,https://x.com/wmataGM,4,"Randy Clarke (@wmataGM) - Posts - Proudly leading the @wmata team (America's Metro System) as General Manager & CEO. Also on IG, in.",positive,True
2026-04-08,Randy Clarke,Washington Metropolitan Area Transit Authority,Randy Clarke - GovTech,https://www.govtech.com/top-25/randy-clarke,5,"In his nearly two years on the job as general manager and CEO for the Washington Metropolitan Area Transit Authority (WMATA), Randy Clarke has been almost ...",neutral,False
2026-04-08,Randy Clarke,Washington Metropolitan Area Transit Authority,Randy Clarke (@wmatagm),https://www.instagram.com/wmatagm/,6,Completed the 2nd Annual @metroforward MetroTransitPD Recruit General Manager run on the National Mall. These recruits graduate this month joining our great ...,positive,True
2026-04-08,Randy Clarke,Washington Metropolitan Area Transit Authority,Washington Metropolitan Area Transit Authority (Maryland entry),https://msa.maryland.gov/msa/mdmanual/38inters/html/23wta.html,7,"D., 2025; April Rai, 2026. Randy Clarke, General Manager & Chief Executive Officer. 300 7th St., SW, Washington, DC 20024 (202) 962-1234 (202) 637-7000 (Metro ...",positive,False
2026-04-08,Randy Clarke,Washington Metropolitan Area Transit Authority,Team | WMATA Bonds | BondLink,https://www.wmatabonds.com/wmata-bonds-dc/about/our-team/i2812,8,Randy Clarke joined the Washington Metropolitan Area Transit Authority (WMATA) as General Manager and CEO in July 2022. He's not just Metro's GM/CEO; ...,positive,True
2026-04-08,Randy Clarke,Washington Metropolitan Area Transit Authority,Profile of Washington Metro general manager Randy Clarke,https://www.reddit.com/r/transit/comments/16fvnbl/profile_of_washington_metro_general_manager_randy/,9,"As a DC resident, I've been thrilled with Randy Clarke. It's so refreshing to have a WMATA GM who actually rides the system, understands the ...",neutral,False
2026-04-08,Ryan Coholan,The T,Ryan Coholan - MBTA,https://www.linkedin.com/in/ryan-coholan-139014ab,1,Experienced Chief Operating Officer with a demonstrated history of working in the… · Experience: MBTA · Education: Cornell University · Location: United ...,positive,True
2026-04-08,Ryan Coholan,The T,MBTA COO drives commuter rail train from Boston to Fall ...,https://www.heraldnews.com/picture-gallery/news/2026/03/24/mbta-coo-ryan-coholan-talks-south-coast-rail-from-boston-to-fall-river/89294351007/,2,"MBTA Chief Operating Officer Ryan Coholan operates a commuter rail train outside South Station, Boston, on March 10, 2026. Dan Medeiros.",neutral,False
2026-04-08,Ryan Coholan,The T,Ryan Coholan - Massachusetts Bay Transportation Authority ...,https://cthrupayroll.mass.gov/?os=shmmfp&ref=app#!/year/2024/full_time_employees%2Cothers/pay1%2Cpay2%2Cpay3%2Cpay4/explore%2F0-0-0%2Ftrans_no%2F17915261%2F0%2Fdepartment_division,3,"Pay Check · Coholan · Ryan · MBTA Exec Main Fund · $299,084.71 · $299,084.71 $299,084.71. « ‹ 1; ›; ». Payroll Details. Total Pay. $ 299,085. Base Pay. $299,085.",positive,False
2026-04-08,Ryan Coholan,The T,Cultivating Culture at the MBTA with COO Ryan Coholan,https://www.youtube.com/watch?v=TeJpfw-wfCA,4,"On this episode, Chief Operating Officer Ryan Coholan joins us to discuss his unique approach to leading Operations at the MBTA.",neutral,False
2026-04-08,Ryan Coholan,The T,The MBTA Advisory Board,https://mbtaadvisoryboard.org/wp-content/uploads/2024/04/MinutesMBTAAB-12-05-23APPROVED.pdf,5,Coholan is responsible for the operation of all MBTA modes. He was appointed. COO by General Manager Philip Eng in September 2023. Mr. Coholan introduced his ...,neutral,False
2026-04-08,Ryan Coholan,The T,"Today, COO Ryan Coholan joined State Senator ...",https://www.instagram.com/p/DPWzqsCEoZw/,6,"Today, COO Ryan Coholan joined State Senator @barryfinegoldma, State Representative Dave Robertson, Town of Wilmington officials, ...",positive,True
2026-04-08,Ryan Coholan,The T,Ryan Coholan Archives,https://www.globalrailwayreview.com/content_author/ryan-coholan/,7,"Ryan Coholan, Chief Railroad Officer at the Massachusetts Bay Transportation Authority (MBTA) ... T: +44 (0)1959 563311. F: +44 (0)1959 563123. Company ...",neutral,False
2026-04-08,Nora Leerhsen,CTA,Nora Leerhsen,https://en.wikipedia.org/wiki/Nora_Leerhsen,1,"Nora Leerhsen is an American lawyer and executive who has served as the Acting President of the Chicago Transit Authority (CTA) since February 2025, replacing ...",neutral,False
2026-04-08,Nora Leerhsen,CTA,Team | Chicago Transit Authority,https://www.ctabonds.com/chicago-transit-authority-il/about/our-team/i6552,2,"Leerhsen joined the CTA in 2014 and has served in various roles prior to becoming chief of staff in 2018, including senior advisor to the chief of staff/chief ...",positive,True
2026-04-08,Nora Leerhsen,CTA,Nora Leerhsen - Chicago Transit Authority,https://www.linkedin.com/in/nora-leerhsen-1ba38847,3,Experience: Chicago Transit Authority · Education: University of Wisconsin Law School · Location: Greater Chicago Area · 500+ connections on LinkedIn.,positive,True
2026-04-08,Nora Leerhsen,CTA,CTA Governance/Administration,https://www.transitchicago.com/governance/,4,"Nora Leerhsen is the acting president of the Chicago Transit Authority (CTA), one of the nation's largest public transit agencies, providing approximately one ...",positive,True
2026-04-08,Nora Leerhsen,CTA,A Conversation with Nora Leerhsen,https://transitunplugged.com/transit-unplugged-podcast/the-unmatched-power-of-transit-a-conversation-with-nora-leerhsen/,5,"A lawyer and former educator who rose through the ranks from compliance officer to chief of staff and now acting president, Nora shares her deep ...",neutral,False
2026-04-08,Nora Leerhsen,CTA,Statement from CTA Acting President Nora Leerhsen,https://www.transitchicago.com/statement-from-cta-acting-president-nora-leerhsen/,6,"Early this morning, the Illinois State Legislature passed a bill that provides a transformational level of funding for the Chicago Transit ...",positive,True
2026-04-08,Nora Leerhsen,CTA,How do we think interim CTA president Nora Leerhsen is ...,https://www.reddit.com/r/chicago/comments/1ldou75/how_do_we_think_interim_cta_president_nora/,7,I think she has been a breath of fresh air. She is way more visible and actually seems to want to understand and improve the rider experience.,neutral,False
2026-04-08,Ryan Coholan,MBTA,Ryan Coholan - MBTA,https://www.linkedin.com/in/ryan-coholan-139014ab,1,Experienced Chief Operating Officer with a demonstrated history of working in the… · Experience: MBTA · Education: Cornell University · Location: United ...,positive,True
2026-04-08,Ryan Coholan,MBTA,Ryan Coholan - Massachusetts Bay Transportation Authority ...,https://cthrupayroll.mass.gov/?os=shmmfp&ref=app#!/year/2024/full_time_employees%2Cothers/pay1%2Cpay2%2Cpay3%2Cpay4/explore%2F0-0-0%2Ftrans_no%2F17915261%2F0%2Fdepartment_division,2,Ryan Coholan - Massachusetts Bay Transportation Authority (MBT) - Chief Operating Officer Massachusetts Bay Transportation Authority (MBT).,positive,False
2026-04-08,Ryan Coholan,MBTA,MBTA COO drives commuter rail train from Boston to Fall ...,https://www.heraldnews.com/picture-gallery/news/2026/03/24/mbta-coo-ryan-coholan-talks-south-coast-rail-from-boston-to-fall-river/89294351007/,3,"MBTA Chief Operating Officer Ryan Coholan and a Keolis employee walk past a commuter rail train at South Station, Boston, on March 10, 2026.",neutral,False
2026-04-08,Ryan Coholan,MBTA,Conversation with MBTA's COO Ryan Coholan,https://transitunplugged.com/transit-unplugged-podcast/ryan-coholan-mbta/,4,"Host Paul Comfort sits down with Ryan Coholan, the Chief Operating Officer of the Massachusetts Bay Transportation Authority (MBTA or The T) in Boston.",neutral,False
2026-04-08,Ryan Coholan,MBTA,The MBTA Advisory Board,https://mbtaadvisoryboard.org/wp-content/uploads/2024/04/MinutesMBTAAB-12-05-23APPROVED.pdf,5,Coholan is responsible for the operation of all MBTA modes. He was appointed. COO by General Manager Philip Eng in September 2023. Mr. Coholan introduced his ...,positive,True
2026-04-08,Ryan Coholan,MBTA,"Today, COO Ryan Coholan joined State Senator ...",https://www.instagram.com/p/DPWzqsCEoZw/,6,"Today, COO Ryan Coholan joined State Senator @barryfinegoldma, State Representative Dave Robertson, Town of Wilmington officials, ...",positive,True
2026-04-08,Ryan Coholan,MBTA,Ryan Coholan - Chief Operating Officer at Massachusetts ...,https://www.zoominfo.com/p/Ryan-Coholan/11957181347,7,"Coholan is a Chief Operating Officer at Massachusetts Bay Transportation Authority. Coholan directs, plans, and supervises operations for a significant commuter ...",neutral,False
2026-04-08,Ryan Coholan,MBTA,Cape Cod Model Railroad Club & Museum,https://www.facebook.com/ccmrrcam/posts/when-it-comes-to-making-a-meaningful-difference-about-how-the-mbta-serves-the-ci/1285749126448679/,8,"Simply put, Ryan Coholan has been the lead innovator, manager and cheerleader for rail service in the Commonwealth. Countless organizations ( ...",positive,True
2026-04-08,Janno Lieber,OMNY,TRANSCRIPT: MTA Chair and CEO Lieber Appears on,https://www.mta.info/press-release/transcript-mta-chair-and-ceo-lieber-appears-point-marcia-kramer-0,1,"MTA Chair and CEO Janno Lieber: Hey, listen, I'm not a magician, but ... Let me tell you, the pre-tax benefit is now applicable on OMNY.",positive,True
2026-04-08,Janno Lieber,OMNY,"Janno Lieber on Free Buses, the State of the MTA, & The ...",https://nyeditorialboard.substack.com/p/janno-lieber-on-free-buses-the-state,2,"Janno Lieber, Chair and CEO of the Metropolitan Transportation Authority (MTA), which runs the New York City subways and buses, ...",positive,False
2026-04-08,Janno Lieber,OMNY,MTA head Janno Lieber has a wish list for 2026. Here's his ...,https://www.cbsnews.com/newyork/news/mta-janno-lieber-nyc-bus-fares-bus-lanes-fare-evasion/,3,MTA head Janno Lieber has a wish list for 2026. Here's his plan for NYC buses and subways. By. Marcia Kramer.,positive,False
2026-04-08,Janno Lieber,OMNY,What's your thoughts and opinions on MTA CEO Janno ...,https://www.reddit.com/r/nycrail/comments/1qninf7/whats_your_thoughts_and_opinions_on_mta_ceo_janno/,4,"41 votes, 81 comments. Two things are true: Janno is the most competent leader the MTA has had in generations.",neutral,False
2026-04-08,Janno Lieber,OMNY,Indeed news organizations regularly request Chair Lieber's ...,https://x.com/timmintonNY/status/2039748114404302941,5,"Indeed news organizations regularly request Chair Lieber's MetroCard and OMNY usage, which is provided to reporters like @ClaytonGuse.",positive,True
2026-04-08,Janno Lieber,OMNY,Reduced Fare OMNY | MTA Chair & CEO Janno Lieber ...,https://www.flickr.com/photos/mtaphotos/54202380238/,6,"MTA Chair & CEO Janno Lieber announces the release of Reduced Fare OMNY cards on Friday, Dec 13, 2024 at the Stone Street Customer Service ...",neutral,False
2026-04-08,Janno Lieber,OMNY,"Transcript: Mayor Adams, Chancellor Banks, MTA Chair & ...",https://www.nyc.gov/mayors-office/news/2024/07/transcript-mayor-adams-chancellor-banks-mta-chair-ceo-lieber-launch-expanded-student-omny-cards,7,"I'm Janno Lieber, the chair and CEO of the MTA. I'm thrilled to be here back at a place that's a second home for many of us at MTA, Transit Tech ...",neutral,False
2026-04-08,Janno Lieber,OMNY,MTA CEO Janno Lieber unveils his bus and subway wish list ...,https://www.youtube.com/watch?v=OhGDR1keDmM,8,"Lieber wants to makes fares less expensive for poor people, crack down further on fare evasion, and create more bus lanes.",positive,False
2026-04-08,Janno Lieber,OMNY,MTA boss gets the price of a MetroCard wrong while ...,https://nypost.com/2025/11/19/us-news/mta-boss-gets-the-price-of-a-metrocard-wrong-while-flippantly-touting-tap-to-ride-switchover/,9,Lieber compared the OMNY switchover to the city ditching subway tokens in the early 1990s in favor of the MetroCard — saying doing away with the ...,negative,False
2026-04-08,Monica Tibbits-Nutt,The T,Monica Tibbits-Nutt,https://www.massport.com/our-business/leadership/monica-tibbits-nutt,1,"Monica G. Tibbits-Nutt, is the Secretary and CEO of the Massachusetts Department of Transportation (MassDOT).",positive,True
2026-04-08,Monica Tibbits-Nutt,The T,Transportation Sec. Monica Tibbits-Nutt Stepping Down ...,https://mass.streetsblog.org/2025/10/16/rearranging-the-cabinet-transportation-sec-monica-tibbits-nutt-stepping-down-replaced-by-mbta-gm-phillip-eng,2,Secretary of Transportation Monica Tibbits-Nutt is leaving the Healey administration. Governor Maura Healey announced this morning in a ...,neutral,False
2026-04-08,Monica Tibbits-Nutt,The T,Tibbits-Nutt is out as transportation secretary. T chief Eng ...,https://www.wbur.org/news/2025/10/16/tibbits-nutt-transportation-secretary-massachusetts-eng,3,"... Monica Tibbits-Nutt overseeing the state's transit agency. In a press release, Healey said Tibbits-Nutt ""has made the decision to step down ...",neutral,False
2026-04-08,Monica Tibbits-Nutt,The T,Disgraced former Transportation Secretary Monica Tibbits ...,https://www.bostonherald.com/2026/01/07/disgraced-former-transportation-secretary-monica-tibbits-nutt-officially-off-state-payroll/,4,Former Transportation Secretary Monica Tibbits-Nutt is officially off the state employee payroll after resigning in disgrace in October and ...,negative,False
2026-04-08,Monica Tibbits-Nutt,The T,MassFiscal Responds to Departure of Transportation ...,https://www.massfiscal.org/massfiscal-responds-departure-monica-tibbits-nutt,5,Tibbits-Nutt Exit is “Long Overdue”. The Massachusetts Fiscal Alliance today responded to news that Secretary of Transportation Monica ...,neutral,False
2026-04-08,Monica Tibbits-Nutt,The T,Monica Tibbits-Nutt parting ways with Massachusetts ...,https://www.wcvb.com/article/monica-tibbits-nutt-parting-ways-with-massachusetts-department-of-transportation/69054926,6,Maura Healey said Tibbits-Nutt made the decision to step down from her positions as secretary of the Department of Transportation and CEO of ...,neutral,False
2026-04-08,Monica Tibbits-Nutt,The T,Massachusetts Transportation Sec. Monica Tibbits-Nutt ...,https://www.cbsnews.com/boston/news/monica-tibbits-nutt-phil-eng-massdot/,7,Transportation Sec. Monica Tibbits-Nutt is out and MBTA GM Phil Eng was promoted in a MassDOT shakeup.,neutral,False
2026-04-08,Monica Tibbits-Nutt,The T,"Tibbits-Nutt out, Eng elevated in abrupt shakeup at MassDOT",https://commonwealthbeacon.org/transportation/tibbits-nutt-out-eng-elevated-in-abrupt-shakeup-at-massdot/,8,"Transportation Secretary Monica Tibbits-Nutt suddenly resigned Thursday, prompting the governor to ask the head of the MBTA and the state's ...",negative,False
2026-04-08,Monica Tibbits-Nutt,The T,A conversation with MassDOT Secretary Monica Tibbits-Nutt,https://www.youtube.com/watch?v=ZA9Igu9nDSo,9,Monica Tippets and not is secretary and CEO of the Massachusetts Department of Transportation and it's got to be one of the hardest jobs in the state government.,neutral,False
2026-04-08,Phillip Eng,MBTA,Phillip Eng | People,https://www.mbta.com/people/phillip-eng,1,Phillip Eng is the General Manager and CEO of the Massachusetts Bay Transportation Authority (MBTA). A Civil Engineer with nearly 40 years of transportation ...,positive,True
2026-04-08,Phillip Eng,MBTA,Phillip Eng,https://en.wikipedia.org/wiki/Phillip_Eng,2,Phillip Eng (born 1961 or 1962) is an American civil engineer and transit executive serving as interim secretary of Massachusetts Department of ...,neutral,False
2026-04-08,Phillip Eng,MBTA,Governor Healey Appoints MBTA General Manager Phil ...,https://www.mass.gov/news/governor-healey-appoints-mbta-general-manager-phil-eng-as-interim-transportation-secretary,3,Boston — Governor Maura Healey announced today that she has named Massachusetts Bay Transportation Authority (MBTA) General Manager Phillip Eng ...,neutral,False
2026-04-08,Phillip Eng,MBTA,"Phillip Eng - Transportation Services, Operations, ...",https://www.linkedin.com/in/phillip-eng-875928240,4,"Transportation Services, Operations, Engineering and Infrastructure · Experience: MassDOT and MBTA · Education: The Cooper Union for the Advancement of ...",positive,True
2026-04-08,Phillip Eng,MBTA,Did Phillip Eng fix the MBTA? Reliability and passenger ...,https://www.cbsnews.com/boston/news/mbta-general-manager-phillip-eng/,5,"I'll take it!'"" Eng said. Phillip Eng MBTA General Manager Phillip Eng on the Orange Line. CBS Boston.",neutral,False
2026-04-08,Phillip Eng,MBTA,Leadership at The MBTA,https://www.mbta.com/leadership,6,The MBTA is overseen by the Massachusetts Bay Transportation Authority Board of Directors. Phillip Eng is the Interim MassDOT Secretary and MBTA General Manager ...,positive,True
2026-04-08,Phillip Eng,MBTA,Phillip Eng,https://www.massport.com/our-business/leadership/phillip-eng,7,Phillip Eng leads Massachusetts' transportation network as Interim Secretary of Transportation and General Manager of the MBTA.,positive,True
2026-04-08,Phillip Eng,MBTA,Governor Healey Appoints MBTA General Manager Phil ...,https://www.mbta.com/news/2025-10-16/governor-healey-appoints-mbta-general-manager-phil-eng-interim-transportation,8,Governor Maura Healey announced today that she has named Massachusetts Bay Transportation Authority (MBTA) General Manager Phillip Eng as ...,positive,True
2026-04-08,Phillip Eng,MBTA,The MBTA has made incredible strides. Did Phillip Eng fix ...,https://www.reddit.com/r/mbta/comments/1pokx9x/the_mbta_has_made_incredible_strides_did_phillip/,9,"165 votes, 33 comments. Eng is great. He's done tremendous things. I don't think his influence can be overstated.",neutral,False
2026-04-08,Phillip Eng,The T,Phillip Eng | People,https://www.mbta.com/people/phillip-eng,1,Phillip Eng is the General Manager and CEO of the Massachusetts Bay Transportation Authority (MBTA). A Civil Engineer with nearly 40 years of transportation ...,positive,True
2026-04-08,Phillip Eng,The T,Phillip Eng,https://en.wikipedia.org/wiki/Phillip_Eng,2,Phillip Eng (born 1961 or 1962) is an American civil engineer and transit executive serving as interim secretary of Massachusetts Department of ...,neutral,False
2026-04-08,Phillip Eng,The T,Did Phillip Eng fix the MBTA? Reliability and passenger ...,https://www.cbsnews.com/boston/news/mbta-general-manager-phillip-eng/,3,"It appeared to be silk, and it was designed with MBTA trains and a T map. It was hand painted by a woman at a marketplace in London, where Eng ...",neutral,False
2026-04-08,Phillip Eng,The T,"Phillip Eng - Transportation Services, Operations, ...",https://www.linkedin.com/in/phillip-eng-875928240,4,"Lead The LiRo Group in the pursuit and delivery of Engineering, Transportation and Infrastructure projects both public and private.",positive,True
2026-04-08,Phillip Eng,The T,The MBTA has made incredible strides. Did Phillip Eng fix ...,https://www.reddit.com/r/mbta/comments/1pokx9x/the_mbta_has_made_incredible_strides_did_phillip/,5,BREAKING NEWS | MBTA General Manager Phil Eng to become Interim Secretary of Transportation at MassDOT after Tibbits-Nutts step down today. r/ ...,neutral,False
2026-04-08,Phillip Eng,The T,Phil Eng earns rave reviews for simultaneous MBTA ...,https://commonwealthbeacon.org/transportation/interim-or-indefinite-no-end-in-sight-to-phil-engs-double-duty/,6,"He just has one condition: Eng wants to keep his job at the T, even if he were to drop the “interim” title from the transportation secretary ...",neutral,False
2026-04-08,Phillip Eng,The T,To a T: How Phillip Eng got Boston's subway system back ...,https://www.csmonitor.com/Business/2025/1115/boston-mbta-phillip-eng,7,"In a 12-page response, Mr. Eng defended the system's track record. He pointed to a 16% reduction in crime between January and September 2025 ...",neutral,False
2026-04-08,Phillip Eng,The T,Governor Healey Appoints MBTA General Manager Phil ...,https://www.mass.gov/news/governor-healey-appoints-mbta-general-manager-phil-eng-as-interim-transportation-secretary,8,Governor Healey Appoints MBTA General Manager Phil Eng as Interim Transportation Secretary. Highway Administrator Jonathan Gulliver promoted to ...,neutral,False
2026-04-08,Phillip Eng,The T,"With double duty at MassDOT and the T, Phil Eng is living ...",https://www.masslive.com/politics/2026/03/with-double-duty-at-massdot-and-the-t-phil-eng-is-living-out-a-leadership-experiment.html,9,"Eng, 64, is living out a leadership experiment at the state Department of Transportation: overseeing both the transit system and serving as the ...",neutral,False
2026-04-08,Monica Tibbits-Nutt,MBTA,Transportation Sec. Monica Tibbits-Nutt Stepping Down ...,https://mass.streetsblog.org/2025/10/16/rearranging-the-cabinet-transportation-sec-monica-tibbits-nutt-stepping-down-replaced-by-mbta-gm-phillip-eng,1,Secretary of Transportation Monica Tibbits-Nutt is leaving the Healey administration. Governor Maura Healey announced this morning in a ...,neutral,False
2026-04-08,Monica Tibbits-Nutt,MBTA,Monica Tibbits-Nutt,https://www.massport.com/our-business/leadership/monica-tibbits-nutt,2,"Monica G. Tibbits-Nutt, is the Secretary and CEO of the Massachusetts Department of Transportation (MassDOT).",positive,True
2026-04-08,Monica Tibbits-Nutt,MBTA,Tibbits-Nutt is out as transportation secretary. T chief Eng ...,https://www.wbur.org/news/2025/10/16/tibbits-nutt-transportation-secretary-massachusetts-eng,3,"... Monica Tibbits-Nutt overseeing the state's transit agency. In a press release, Healey said Tibbits-Nutt ""has made the decision to step down ...",neutral,False
2026-04-08,Monica Tibbits-Nutt,MBTA,MassFiscal Responds to Departure of Transportation ...,https://www.massfiscal.org/massfiscal-responds-departure-monica-tibbits-nutt,4,Tibbits-Nutt Exit is “Long Overdue”. The Massachusetts Fiscal Alliance today responded to news that Secretary of Transportation Monica ...,neutral,False
2026-04-08,Monica Tibbits-Nutt,MBTA,Monica Tibbits-Nutt parting ways with Massachusetts ...,https://www.wcvb.com/article/monica-tibbits-nutt-parting-ways-with-massachusetts-department-of-transportation/69054926,5,Maura Healey said Tibbits-Nutt made the decision to step down from her positions as secretary of the Department of Transportation and CEO of ...,neutral,False
