date,ceo,company,title,url,position,snippet,sentiment,controlled
2026-05-29,Monica Tibbits-Nutt,MBTA,Transportation Sec. Monica Tibbits-Nutt Stepping Down ...,https://mass.streetsblog.org/2025/10/16/rearranging-the-cabinet-transportation-sec-monica-tibbits-nutt-stepping-down-replaced-by-mbta-gm-phillip-eng,2,Secretary of Transportation Monica Tibbits-Nutt is leaving the Healey administration. Governor Maura Healey announced this morning in a ...,neutral,False
2026-05-29,Monica Tibbits-Nutt,MBTA,MassFiscal Responds to Departure of Transportation ...,https://www.massfiscal.org/massfiscal-responds-departure-monica-tibbits-nutt,3,Tibbits-Nutt Exit is “Long Overdue”. The Massachusetts Fiscal Alliance today responded to news that Secretary of Transportation Monica ...,neutral,False
2026-05-29,Monica Tibbits-Nutt,MBTA,A Conversation with MassDOT Secretary Monica Tibbits ...,https://members.naiopma.org/event-calendar/Details/a-conversation-with-massdot-secretary-monica-tibbits-nutt-and-mbta-general-manager-phillip-eng-1055406?sourceTypeId=EmailInvitation,4,Join NAIOP for an exciting conversation with Massachusetts Secretary of Transportation Monica Tibbits-Nutt and Massachusetts Bay Transit Authority General ...,neutral,False
2026-05-29,Monica Tibbits-Nutt,MBTA,Monica Tibbits-Nutt Steps Down as MassDOT Secretary,https://aptapassengertransport.com/monica-tibbits-nutt-steps-down-as-massdot-secretary-phil-eng-named-interim/,5,Tibbits-Nutt will continue as an advisor through Dec. 31 to ensure an efficient transition. Governor Healey appointed Phil Eng as MBTA general ...,neutral,False
2026-05-29,Monica Tibbits-Nutt,MBTA,Governor Healey Appoints Monica Tibbits-Nutt as ...,https://www.linkedin.com/posts/mbta_governor-healey-appoints-monica-tibbits-nutt-activity-7129951277458857984-QHjy,6,Governor Healey announced the official appointment of Monica Tibbits-Nutt to Secretary of Transportation and member of the MBTA Board of Directors.,positive,True
2026-05-29,Monica Tibbits-Nutt,MBTA,"MassDOT secretary Tibbits-Nutt steps down, MBTA chief ...",https://www.reddit.com/r/boston/comments/1o876bw/massdot_secretary_tibbitsnutt_steps_down_mbta/,7,"Massachusetts Department of Transportation secretary Monica Tibbits-Nutt will step down from her position, Governor Maura Healey announced ...",neutral,False
2026-05-29,Monica Tibbits-Nutt,MBTA,Governor Healey Appoints MBTA General Manager Phil ...,https://www.mass.gov/news/governor-healey-appoints-mbta-general-manager-phil-eng-as-interim-transportation-secretary,8,... (MBTA) General Manager Phillip Eng as Interim Transportation Secretary. Monica Tibbits-Nutt has made the decision to step down from her ...,neutral,False
2026-05-29,Monica Tibbits-Nutt,MBTA,Pols & Politics: Healey Tweaks Tibbits-Nutt,https://www.bostonherald.com/2026/01/25/pols-politics-healey-tweaks-tibbits-nutt/,9,"You may not have noticed it, but Gov. Maura Healey seemed to throw a subtle jab at former state Transportation Secretary Monica Tibbits-Nutt ...",neutral,False
2026-05-29,Phillip Eng,Massachusetts Bay Transportation Authority,Phillip Eng | People,https://www.mbta.com/people/phillip-eng,1,Phillip Eng is the General Manager and CEO of the Massachusetts Bay Transportation Authority (MBTA). A Civil Engineer with nearly 40 years of transportation ...,positive,True
2026-05-29,Phillip Eng,Massachusetts Bay Transportation Authority,Phillip Eng,https://en.wikipedia.org/wiki/Phillip_Eng,2,Phillip Eng (born 1961 or 1962) is an American civil engineer and transit executive serving as interim secretary of Massachusetts Department of ...,neutral,False
2026-05-29,Phillip Eng,Massachusetts Bay Transportation Authority,Governor Healey Appoints MBTA General Manager Phil ...,https://www.mass.gov/news/governor-healey-appoints-mbta-general-manager-phil-eng-as-interim-transportation-secretary,3,Highway Administrator Jonathan Gulliver promoted to Undersecretary of Transportation; Interim Secretary and GM Eng to hold media ...,neutral,False
2026-05-29,Phillip Eng,Massachusetts Bay Transportation Authority,MBTA's Phillip Eng Named Interim MassDOT Secretary,https://aashtojournal.transportation.org/mbtas-phillip-eng-named-interim-massdot-secretary/,4,Massachusetts Governor Maura Healey (D) has appointed Phillip Eng (above at left) – general manager of the Massachusetts Bay Transportation ...,neutral,False
2026-05-29,Phillip Eng,Massachusetts Bay Transportation Authority,Phillip Eng - MassDOT and MBTA,https://www.linkedin.com/in/phillip-eng-875928240,5,Experience: MassDOT and MBTA · Education: The Cooper Union for the Advancement of Science and Art · Location: Boston · 500+ connections on LinkedIn.,positive,True
2026-05-29,Phillip Eng,Massachusetts Bay Transportation Authority,Phil Eng earns rave reviews for simultaneous MBTA ...,https://commonwealthbeacon.org/transportation/interim-or-indefinite-no-end-in-sight-to-phil-engs-double-duty/,6,The Healey administration seems content to have Phil Eng continue to work as both T general manager and interim transportation secretary for ...,neutral,False
2026-05-29,Phillip Eng,Massachusetts Bay Transportation Authority,Leadership at The MBTA,https://www.mbta.com/leadership,7,The MBTA is overseen by the Massachusetts Bay Transportation Authority Board of Directors. Phillip Eng is the Interim MassDOT Secretary and MBTA General Manager ...,positive,True
2026-05-29,Phillip Eng,Massachusetts Bay Transportation Authority,Did Phillip Eng fix the MBTA? Reliability and passenger ...,https://www.cbsnews.com/boston/news/mbta-general-manager-phillip-eng/,8,"Phillip Eng, the New Yorker who came out of retirement to fix the MBTA is getting rave reviews.",neutral,False
2026-05-29,Phillip Eng,Massachusetts Bay Transportation Authority,The MBTA has made incredible strides. Did Phillip Eng fix ...,https://www.reddit.com/r/mbta/comments/1pokx9x/the_mbta_has_made_incredible_strides_did_phillip/,9,"165 votes, 33 comments. Eng is great. He's done tremendous things. I don't think his influence can be overstated.",neutral,False
2026-05-29,Janno Lieber,OMNY,MTA chief vows fare evasion crackdown on NYC buses ...,https://gothamist.com/news/mta-chief-vows-fare-evasion-crackdown-on-nyc-buses-once-metrocard-retires,1,MTA Chair Janno Lieber said requiring all riders to pay with OMNY will make it easier to check who has actually paid.,neutral,False
2026-05-29,Janno Lieber,OMNY,MTA Chair Janno Lieber says the MTA will be stepping up fare ...,https://www.instagram.com/reel/DVzI3DoknWn/,2,MTA Chair Janno Lieber says the MTA will be stepping up fare evasion measures for buses. ... OMNY card. However you pay and they'll be able to ...,positive,True
2026-05-29,Janno Lieber,OMNY,"Janno Lieber on Free Buses, the State of the MTA, & The ...",https://nyeditorialboard.substack.com/p/janno-lieber-on-free-buses-the-state,3,"Janno Lieber, Chair and CEO of the Metropolitan Transportation Authority (MTA), which runs the New York City subways and buses, ...",positive,False
2026-05-29,Janno Lieber,OMNY,Fare evasion: MTA boss Lieber defends 'European' model ...,https://www.amny.com/news/fare-evasion-lieber-defends-european-model-enforcement/,4,MTA Chair and CEO Janno Lieber on Wednesday defended the agency's embrace of a new “European-model” of enforcement to crack down on bus fare ...,neutral,False
2026-05-29,Janno Lieber,OMNY,Janno Lieber,https://www.mta.info/transparency/leadership/executive-leadership/janno-lieber,5,"Lieber has been serving as MTA Acting Chair and CEO since July 2021 and is the Authority's 15th Chairperson since it was founded in 1968. In this position, ...",positive,True
2026-05-29,Janno Lieber,OMNY,Reduced Fare OMNY | MTA Chair & CEO Janno Lieber ...,https://www.flickr.com/photos/mtaphotos/54202380213/,6,"MTA Chair & CEO Janno Lieber announces the release of Reduced Fare OMNY cards on Friday, Dec 13, 2024 at the Stone Street Customer Service ...",neutral,False
2026-05-29,Janno Lieber,OMNY,MTA Chair Janno Lieber says he's open to free bus service,https://www.youtube.com/watch?v=gdvucgaZlvY,7,"Gov. Kathy Hochul's MTA bail-out plan still has some bumps to overcome, but MTA Chair Janno Lieber says he's open to free bus service.",positive,False
2026-05-29,Janno Lieber,OMNY,Janno Lieber - Chair & CEO at New York Metropolitan ...,https://www.linkedin.com/in/janno-lieber-32b487158,8,"Chair & CEO at New York Metropolitan Transportation Authority · An accomplished executive working at the intersection of government, real estate and law.",positive,True
