date,company,title,url,position,snippet,sentiment,controlled
2026-06-13,MTA,MTA: Home - NYC,https://www.mta.info/,1,"Plan a trip, see saved trips, you haven't saved any trips yet. Plan a trip or go to Schedules and save it for quick access in the future.",positive,True
2026-06-13,MTA,Maryland Transit Administration,https://www.mta.maryland.gov/,2,"Routes & Schedules, Real Time Information, Trip Planner, Service Alerts, Website Feedback Survey, MDOT MTA In the News",positive,True
2026-06-13,MTA,MTA (@MTA) / Posts / X,https://x.com/MTA,3,Now you can get real-time subway and bus information without even opening the app. You can create widgets for upcoming arrivals to your favorite stations or ...,positive,True
2026-06-13,MTA,MTA Flint,https://www.mtaflint.org/,4,14 fixed routes throughout the City of Flint with routes and schedules. Regional Routes Direct round-trip connection to places outside of Genesee County.,positive,True
2026-06-13,MTA,Metropolitan Transportation Authority Careers,https://careers.mta.org/,5,"The MTA family includes professionals in a variety of positions, from bus and train operators to engineers, accountants, and policy experts.",positive,True
2026-06-13,The L,"Chicago ""L""",https://en.wikipedia.org/wiki/Chicago_%22L%22,1,"The ""L"" provides 24-hour service on the Red and Blue Lines, making Chicago, New York City, London and Copenhagen the only four cities in the world to offer 24- ...",neutral,False
2026-06-13,The L,How-To Guide: Riding the 'L' (Trains),https://www.transitchicago.com/howto/riding-the-train/,2,"CTA's train system is known as the 'L' (a now-official name originally short for ""elevated""). Trains serve over 140 stations located throughout the city and ...",positive,True
2026-06-13,The L,the L Denver | Reinventing Classics from the Ground Up,https://www.theldenver.com/,3,"We are on Broadway. We make good cocktails without the pretense & aprons. If you don't like us, we still like you. Our Menu. Your Fun.",positive,True
2026-06-13,The L,"THE L STATION (@thelstation.chi) · Chicago, IL",https://www.instagram.com/thelstation.chi/?hl=en,4,36K followers · 307 posts · Chicago Luxury Dining ✨Kitchen closes 1 hour before closing time ✨Hours are available on our website.,positive,True
2026-06-13,The L,The Chicago L,https://www.architecture.org/online-resources/buildings-of-chicago/the-chicago-l,5,The Chicago L began operating in 1892. This network of elevated trains and subways is how Chicagoans get around. But it's also an iconic symbol of the city.,positive,False
2026-06-13,The L,The Chicago “L” is an American Treasure. : r/transit,https://www.reddit.com/r/transit/comments/1bt9yng/the_chicago_l_is_an_american_treasure/,6,"This is the LaSalle/Van Buren station in the Loop. It connects to the Brown, Pink, and Orange Lines.",positive,False
2026-06-13,The L,THE L - Updated June 2026 - 52 Photos & 52 Reviews,https://www.yelp.com/biz/the-l-denver,7,"The L is an unpretentious neighborhood bar on Broadway with beautiful floral murals and great cocktails. Friendly, talented bartenders are willing to serve you ...",positive,False
2026-06-13,The L,Experience Chicago on the L Train: A City Ride Guide,https://www.choosechicago.com/articles/tours-and-attractions/sightsee-on-the-chicago-l-train/,8,"Experience Chicago on the L train with skyline views, neighborhood rides, and iconic stops—this guide shows how to sightsee the city from the tracks.",positive,False
2026-06-13,Washington Metropolitan Area Transit Authority,WMATA: Home,https://www.wmata.com/,1,"Metro is the Washington, DC region's public transportation system, offering bus and rail service across DC, Maryland, and Virginia. Find real-time arrivals, ...",positive,True
2026-06-13,Washington Metropolitan Area Transit Authority,Washington Metropolitan Area Transit Authority,https://en.wikipedia.org/wiki/Washington_Metropolitan_Area_Transit_Authority,2,"WMATA provides a rapid transit service under the Metrorail brand, fixed-route bus service under the Metrobus brand, and paratransit service under the ...",neutral,False
2026-06-13,Washington Metropolitan Area Transit Authority,Washington Metropolitan Area Transit Authority (WMATA),https://www.linkedin.com/company/wmata,3,"Locations · Primary. 600 5th Street, NW. Washington, DC 20001, US. Get directions · 3500 Pennsy Dr. Hyattsville, Maryland, US. Get directions. Employees at ...",positive,True
2026-06-13,Washington Metropolitan Area Transit Authority,Washington Metropolitan Area Transit Authority (WMATA),https://washington.org/find-dc-listings/washington-metropolitan-area-transit-authority,4,"The Washington Metropolitan Area Transit Authority (WMATA), known as Metro, is the region's leading public transportation provider, serving a population of ...",neutral,False
2026-06-13,Washington Metropolitan Area Transit Authority,Welcome to the Washington Metropolitan Area Transit ...,https://www.wmatc.gov/,5,The Washington Metropolitan Area Transit Commission (WMATC) was established in 1960 pursuant to the Washington Metropolitan Area Transit Regulation Compact.,positive,False
2026-06-13,Washington Metropolitan Area Transit Authority,Metro Forward (@wmata) / Posts / X,https://x.com/wmata?lang=en,6,"ATTN BUS CUSTOMERS Starting tonight at 10 p.m., several routes will be on detour due to road closures in support of this weekend's @freedom250 @UFC event.",positive,True
2026-06-13,Washington Metropolitan Area Transit Authority,wmata | US Department of Transportation,https://www.transportation.gov/tags/wmata,7,WASHINGTON – The U.S. Department of Transportation's Federal Transit Administration (FTA) today announced approval of the Washington Metropolitan Area Transit ...,neutral,False
2026-06-13,OMNY,OMNY,https://omny.info/,1,"Tap and ride for 7-Day Unlimited benefits! When you tap the same card or device for 12 individual trips within 7 days, you'll get unlimited free rides for the ...",positive,True
2026-06-13,OMNY,r/OMNY,https://www.reddit.com/r/OMNY/,2,r/OMNY: All things related to the OMNY payment card system in the New York Metro.,neutral,False
2026-06-13,OMNY,Student OMNY Cards,https://www.schools.nyc.gov/school-life/transportation/student-omny-cards,3,"Student OMNY Cards are good for 4 free rides each day. You can tap a Student OMNY Card whenever you want to take up to 4 free trips every day of the week, any ...",neutral,False
2026-06-13,OMNY,OMNY,https://en.wikipedia.org/wiki/OMNY,4,"OMNY (/ˈɒmni/ OM-nee, short for One Metro New York) is a contactless fare-payment system that has been implemented for use on public transit in the New York ...",neutral,False
2026-06-13,OMNY,OMNY for Access-A-Ride,https://www.mta.info/accessibility/access-a-ride/omny,5,Access-A-Ride (AAR) has introduced an optional cashless way to pay your fare with the AAR OMNY ID Card. Cash will remain a payment option.,positive,True
2026-06-13,NYC Subway,MTA: Home,https://www.mta.info/,1,Back; New York City Transit · Bridges & Tunnels · Long Island Rail Road · Metro-North Railroad · Other agencies and departments. Contact us.,positive,True
2026-06-13,NYC Subway,New York City Subway,https://en.wikipedia.org/wiki/New_York_City_Subway,2,"The New York City Subway is a rapid transit system in New York City, serving four of the city's five boroughs: Manhattan, Brooklyn, Queens, and the Bronx.",neutral,False
2026-06-13,NYC Subway,nycsubway.org,https://nycsubway.org/,3,Early Rapid Transit in New York The First Subway. The New York Subway: Its Construction and Equipment (1904) Location: Queensborough Plaza Car: R,positive,True
2026-06-13,NYC Subway,New York Subway MTA Map NYC - App Store,https://apps.apple.com/us/app/new-york-subway-mta-map-nyc/id369691844,4,New York Subway uses the official MTA subway map and includes a helpful transit route planner. NYC subway map is free to download,positive,True
2026-06-13,NYC Subway,New York City Subway,https://sab.org/wp-content/uploads/2020/01/Subway_Map_2018.pdf,5,"New York City Subway with bus and railroad. The subway operates 24 hours a day, but not all lines operate at all times. Call our Travel Information Center at ...",neutral,False
2026-06-13,NYC Subway,How to Use the NYC Subway - CityRover Walks NY,https://cityroverwalks.com/how-to-use-nyc-subway-guide/,6,"This is the only subway guide you'll need to plan your trip to NYC. Learn how to navigate the subway, how to use the OMNY payment system, buy a Metrocard, ...",neutral,False
2026-06-13,Metrorail,"METRORail | Red Line | Purple Line | Houston, Texas - METRO",https://www.ridemetro.org/riding-metro/transit-services/metrorail,1,"METRORail is Houston's light-rail network, offering convenient access to many popular destinations in and around downtown Houston.",neutral,False
2026-06-13,Metrorail,"Metrorail Service: Schedules, Fares, and Stations",https://www.miamidade.gov/global/transportation/metrorail.page,2,"The Metrorail system is a 25-mile dual track that provides service to Miami International Airport (MIA) and runs from Kendall through South Miami, Coral Gables ...",neutral,False
2026-06-13,Metrorail,WMATA: Home,https://www.wmata.com/,3,"Metro is the Washington, DC region's public transportation system, offering bus and rail service across DC, Maryland, and Virginia. Find real-time arrivals, ...",positive,True
2026-06-13,Metrorail,CapMetro Rail – Capital Metro – Austin Public Transit,https://www.capmetro.org/rail,4,"A train for commuters traveling between Leander and downtown. Whether you're traveling to work or Q2 Stadium, get there quickly and comfortably.",neutral,False
2026-06-13,Metrorail,"Metro | Bus, Rail, Subway, Bike & Micro in Los Angeles",https://www.metro.net/,5,"Explore Los Angeles by public transit. Start with Metro schedules, maps, arrival times, parking info, trip planning, stations, and fares.",neutral,False
2026-06-13,Metrorail,"Navigating Washington, DC's Metro System",https://washington.org/navigating-dc-metro,6,"The Metrorail consists of six color-coded lines: Red, Blue, Orange, Yellow, Green and Silver. The lines are connected to each other via transfer stations and ...",neutral,False
2026-06-13,Metrorail,Metrorail (Miami-Dade County),https://en.wikipedia.org/wiki/Metrorail_(Miami-Dade_County),7,"Metrorail is a rapid transit system in Miami and Miami-Dade County in the U.S. state of Florida. It is operated by Miami-Dade Transit (MDT), a departmental ...",neutral,False
2026-06-13,Metrorail,Metrorail | Miami & Miami Beach,https://www.miamiandbeaches.com/l/transportation/metrorail/3040,8,"Metrorail is Miami's quick and easy 25-mile elevated transportation system to get you to all parts of the urban core of Miami from 5:00am to midnight, seven ...",neutral,False
2026-06-13,Metrorail,Houston's Metro Rail System,https://www.visithoustontexas.com/travel-planning/getting-to-and-around-houston/metro-rail/,9,"With our METRORail system covering 23 miles of the city, you can save wear and tear on your car or avoid rental cars during your visit to Houston.",neutral,False
2026-06-13,Chicago Transit Authority,Chicago Transit Authority - CTA Buses & Train Service - 1-888 ...,https://www.transitchicago.com/,1,"Information about CTA bus and train service in and around Chicago. Find maps, schedules, service alerts, plan a trip, jobs, news and more!",positive,True
2026-06-13,Chicago Transit Authority,Chicago Transit Authority (CTA) - Travel Information,https://www.chicago.gov/city/en/depts/other/provdrs/cta.html,2,The CTA operates the nation's second largest public transportation system and covers the City of Chicago and 40 surrounding suburbs.,neutral,False
2026-06-13,Chicago Transit Authority,Chicago Transit Authority,https://en.wikipedia.org/wiki/Chicago_Transit_Authority,3,"The Chicago Transit Authority (CTA) is a public transit agency in Chicago, Illinois, United States. It operates the Chicago ""L"" rail system and CTA bus services ...",neutral,False
2026-06-13,Chicago Transit Authority,Chicago Transit Authority (@thecta),https://www.facebook.com/thecta/,4,Welcome to the official CTA Facebook page. Serving Chicago & 35 surrounding suburbs. Mondays: 7:00 AM – 10:00 AM First Wednesday of each month: 3:00 PM – 6:00 ...,positive,True
2026-06-13,Chicago Transit Authority,Chicago Transit Authority (@chicagocta),https://www.instagram.com/chicagocta/,5,"Official account of the Chicago Transit Authority. Info on news & updates. Lawrence, Argyle, Berwyn and Bryn Mawr stations friendly 20 bus routes across ...",positive,True
2026-06-13,MBTA,MBTA - Massachusetts Bay Transportation Authority,https://www.mbta.com/,1,"Public transit in the Greater Boston region. Routes, schedules, trip planner, fares, service alerts, real-time updates, and general information.",positive,True
2026-06-13,MBTA,Massachusetts Bay Transportation Authority (MBTA),https://www.mass.gov/orgs/massachusetts-bay-transportation-authority,2,"The MBTA provides subway, bus, Commuter Rail, ferry, and paratransit service to eastern Massachusetts and parts of Rhode Island.",neutral,False
2026-06-13,MBTA,Massachusetts Bay Transportation Authority - MBTA,https://www.facebook.com/TheMBTA/,3,"As we welcome the world to Boston, we're here to transport visitors to all their destinations. Take the T to Boston World Cup 2026 Host City matches, ...",positive,True
2026-06-13,MBTA,Massachusetts Bay Transportation Authority,https://en.wikipedia.org/wiki/Massachusetts_Bay_Transportation_Authority,4,"The public agency responsible for operating most public transportation services in Greater Boston, Massachusetts.",neutral,False
2026-06-13,MBTA,MBTA - Massachusetts Bay Transportation Authority,https://www.mbta.com/,1,"Public transit in the Greater Boston region. Routes, schedules, trip planner, fares, service alerts, real-time updates, and general information.",positive,True
2026-06-13,MBTA,Massachusetts Bay Transportation Authority (MBTA),https://www.mass.gov/orgs/massachusetts-bay-transportation-authority,2,"The MBTA provides subway, bus, Commuter Rail, ferry, and paratransit service to eastern Massachusetts and parts of Rhode Island.",neutral,False
2026-06-13,MBTA,Massachusetts Bay Transportation Authority - MBTA,https://www.facebook.com/TheMBTA/,3,"As we welcome the world to Boston, we're here to transport visitors to all their destinations. Take the T to Boston World Cup 2026 Host City matches, ...",positive,True
2026-06-13,MBTA,Massachusetts Bay Transportation Authority,https://en.wikipedia.org/wiki/Massachusetts_Bay_Transportation_Authority,4,"The public agency responsible for operating most public transportation services in Greater Boston, Massachusetts.",neutral,False
2026-06-13,MBTA,MBTA - Massachusetts Bay Transportation Authority,https://www.mbta.com/,1,"Public transit in the Greater Boston region. Routes, schedules, trip planner, fares, service alerts, real-time updates, and general information.",positive,True
2026-06-13,MBTA,Massachusetts Bay Transportation Authority (MBTA),https://www.mass.gov/orgs/massachusetts-bay-transportation-authority,2,"The MBTA provides subway, bus, Commuter Rail, ferry, and paratransit service to eastern Massachusetts and parts of Rhode Island.",neutral,False
2026-06-13,MBTA,Massachusetts Bay Transportation Authority - MBTA,https://www.facebook.com/TheMBTA/,3,"As we welcome the world to Boston, we're here to transport visitors to all their destinations. Take the T to Boston World Cup 2026 Host City matches, ...",positive,True
2026-06-13,MBTA,Massachusetts Bay Transportation Authority,https://en.wikipedia.org/wiki/Massachusetts_Bay_Transportation_Authority,4,"The public agency responsible for operating most public transportation services in Greater Boston, Massachusetts.",neutral,False
2026-06-13,CTA,Chicago Transit Authority - CTA Buses & Train Service - 1-888 ...,https://www.transitchicago.com/,1,"Information about CTA bus and train service in and around Chicago. Find maps, schedules, service alerts, plan a trip, jobs, news and more!",positive,True
2026-06-13,CTA,California Teachers Association,https://www.cta.org/,2,"The 310000 members of CTA are passionate advocates for students and public education. Through our union, we make public education work for the public.",positive,True
2026-06-13,CTA,Select Route,https://www.ctabustracker.com/bustime/wireless/html/home.jsp,3,1 - Bronzeville/Union Station · 2 - Hyde Park Express · 3 - King Drive · 4 - Cottage Grove · X4 - Cottage Grove Express · N5 - South Shore Night Bus · 6 - ...,positive,True
2026-06-13,CTA,Chicago Transit Authority,https://en.wikipedia.org/wiki/Chicago_Transit_Authority,4,"The Chicago Transit Authority (CTA) is a public transit agency in Chicago, Illinois, United States. It operates the Chicago ""L"" rail system and CTA bus services ...",neutral,False
2026-06-13,CTA,r/cta,https://www.reddit.com/r/cta/,5,"r/cta: Unofficial forum for Chicago's public transportation system, welcome :)",neutral,False
2026-06-13,Boston T,MBTA - Massachusetts Bay Transportation Authority,https://www.mbta.com/,1,"Public transit in the Greater Boston region. Routes, schedules, trip planner, fares, service alerts, real-time updates, and general information.",positive,True
2026-06-13,Boston T,MBTA subway,https://en.wikipedia.org/wiki/MBTA_subway,2,"The Massachusetts Bay Transportation Authority (MBTA) operates rapid transit (heavy rail), light rail, and bus rapid transit services in the Boston ...",neutral,False
2026-06-13,Boston T,"Navigating Boston | Travel Advisories, MBTA, Parking",https://www.meetboston.com/plan/getting-around/,3,"Take the ""T"". Boston's public transportation system is operated by the Massachusetts Bay Transportation Authority (MBTA), though locals simply ...",neutral,False
2026-06-13,Boston T,"MBTA (@thembta) · Boston, MA",https://www.instagram.com/thembta/?hl=en,4,51K followers · 2K+ posts · The official Instagram of the Massachusetts Bay Transportation Authority.,positive,True
2026-06-13,Boston T,MBTA - Massachusetts Bay Transportation Authority,https://www.mbta.com/,1,"Public transit in the Greater Boston region. Routes, schedules, trip planner, fares, service alerts, real-time updates, and general information.",positive,True
2026-06-13,Boston T,MBTA subway,https://en.wikipedia.org/wiki/MBTA_subway,2,"The Massachusetts Bay Transportation Authority (MBTA) operates rapid transit (heavy rail), light rail, and bus rapid transit services in the Boston ...",neutral,False
2026-06-13,Boston T,"Navigating Boston | Travel Advisories, MBTA, Parking",https://www.meetboston.com/plan/getting-around/,3,"Take the ""T"". Boston's public transportation system is operated by the Massachusetts Bay Transportation Authority (MBTA), though locals simply ...",neutral,False
2026-06-13,Boston T,"MBTA (@thembta) · Boston, MA",https://www.instagram.com/thembta/?hl=en,4,51K followers · 2K+ posts · The official Instagram of the Massachusetts Bay Transportation Authority.,positive,True
2026-06-13,Boston T,MBTA - Massachusetts Bay Transportation Authority,https://www.mbta.com/,1,"Public transit in the Greater Boston region. Routes, schedules, trip planner, fares, service alerts, real-time updates, and general information.",positive,True
2026-06-13,Boston T,MBTA subway,https://en.wikipedia.org/wiki/MBTA_subway,2,"The Massachusetts Bay Transportation Authority (MBTA) operates rapid transit (heavy rail), light rail, and bus rapid transit services in the Boston ...",neutral,False
2026-06-13,Boston T,"Navigating Boston | Travel Advisories, MBTA, Parking",https://www.meetboston.com/plan/getting-around/,3,"Take the ""T"". Boston's public transportation system is operated by the Massachusetts Bay Transportation Authority (MBTA), though locals simply ...",neutral,False
2026-06-13,Boston T,"MBTA (@thembta) · Boston, MA",https://www.instagram.com/thembta/?hl=en,4,51K followers · 2K+ posts · The official Instagram of the Massachusetts Bay Transportation Authority.,positive,True
2026-06-13,DC Metro,WMATA: Home,https://www.wmata.com/,1,"Metro is the Washington, DC region's public transportation system, offering bus and rail service across DC, Maryland, and Virginia. Find real-time arrivals, ...",positive,True
2026-06-13,DC Metro,Washington Metro,https://en.wikipedia.org/wiki/Washington_Metro,2,a rapid transit system serving the Washington metropolitan area of the United States. It is administered by the Washington Metropolitan Area Transit Authority ...,neutral,False
2026-06-13,DC Metro,Washington Metro • WMATA (@metroforward),https://www.instagram.com/metroforward/?hl=en,3,86K followers · 2K+ posts · Official feed of Metro/WMATA Tag us during your trip #wmata.,positive,True
2026-06-13,DC Metro,Metro Forward (@wmata) / Posts / X,https://x.com/wmata?lang=en,4,"Metro Forward (@wmata) - Posts - Official feed of Metro. Monitored 7a-8p, Mon-Fri & 8a-8p, Sat-Sun. Report emergencies to M️Police (2.",positive,True
2026-06-13,DC Metro,DC Metro & Bus: WMATA Realtime - Apps on Google Play,https://play.google.com/store/apps/details?id=com.funforfones.android.dcmetro&hl=en_US,5,"DC Metro and Bus is the real-time WMATA transit app built exclusively for Washington DC, Northern Virginia, and Maryland commuters.",positive,True
2026-06-13,The T,MBTA - Massachusetts Bay Transportation Authority,https://www.mbta.com/,1,"Public transit in the Greater Boston region. Routes, schedules, trip planner, fares, service alerts, real-time updates, and general information.",positive,True
2026-06-13,The T,T Third Street,https://www.sfmta.com/routes/t-third-street,2,"Southbound to Sunnydale: From Chinatown Station, exit Central Subway, continue on 4th St, left on Channel, right on 3rd St to Bayshore Blvd to the terminal.",neutral,False
2026-06-13,The T,T Line - Tacoma Dome – St Joseph,https://www.soundtransit.org/ride-with-us/routes-schedules/t-line,3,"Route map, schedule, service alerts, real-time arrivals and more information for Sound Transit route T Line.",neutral,False
2026-06-13,The T,"Boston Subway - The ""T"" - Boston Public Transportation",https://www.boston-discovery-guide.com/boston-subway.html,4,"Boston's subway system - locally we call it the ""T"" - is the easiest and cheapest way to get around the city, aside from walking.",neutral,False
2026-06-13,The T,What does the “T” stand for on the subway? : r/boston,https://www.reddit.com/r/boston/comments/1plapkg/what_does_the_t_stand_for_on_the_subway/,5,The letter T inside the circle is an established international symbol for transit or transportation. You will find it in a number of nations.,neutral,False
2026-06-13,The T,"MBTA (@thembta) · Boston, MA",https://www.instagram.com/thembta/?hl=en,6,The official Instagram of the Massachusetts Bay Transportation Authority. ~1 hour on all subway lines and eight frequent bus routes on Fridays and Saturdays,positive,True
2026-06-13,The T,T: An MBTA Musical,https://www.bostontheatrescene.com/shows-and-events/t-an-mbta-musical/,7,An MBTA Musical is Boston's best musical parody of the USA's oldest subway system. “T” is the journey of three struggling Bostonians whose lives have been ...,neutral,False
2026-06-13,The T,MBTA - Massachusetts Bay Transportation Authority,https://www.mbta.com/,1,"Public transit in the Greater Boston region. Routes, schedules, trip planner, fares, service alerts, real-time updates, and general information.",positive,True
2026-06-13,The T,T Third Street,https://www.sfmta.com/routes/t-third-street,2,"Southbound to Sunnydale: From Chinatown Station, exit Central Subway, continue on 4th St, left on Channel, right on 3rd St to Bayshore Blvd to the terminal.",neutral,False
2026-06-13,The T,T Line - Tacoma Dome – St Joseph,https://www.soundtransit.org/ride-with-us/routes-schedules/t-line,3,"Route map, schedule, service alerts, real-time arrivals and more information for Sound Transit route T Line.",neutral,False
2026-06-13,The T,"Boston Subway - The ""T"" - Boston Public Transportation",https://www.boston-discovery-guide.com/boston-subway.html,4,"Boston's subway system - locally we call it the ""T"" - is the easiest and cheapest way to get around the city, aside from walking.",neutral,False
2026-06-13,The T,What does the “T” stand for on the subway? : r/boston,https://www.reddit.com/r/boston/comments/1plapkg/what_does_the_t_stand_for_on_the_subway/,5,The letter T inside the circle is an established international symbol for transit or transportation. You will find it in a number of nations.,neutral,False
2026-06-13,The T,"MBTA (@thembta) · Boston, MA",https://www.instagram.com/thembta/?hl=en,6,51K followers · 2K+ posts · The official Instagram of the Massachusetts Bay Transportation Authority.,positive,True
2026-06-13,Massachusetts Bay Transportation Authority,MBTA - Massachusetts Bay Transportation Authority,https://www.mbta.com/,1,"Public transit in the Greater Boston region. Routes, schedules, trip planner, fares, service alerts, real-time updates, and general information.",positive,True
2026-06-13,Massachusetts Bay Transportation Authority,Massachusetts Bay Transportation Authority,https://en.wikipedia.org/wiki/Massachusetts_Bay_Transportation_Authority,2,"The public agency responsible for operating most public transportation services in Greater Boston, Massachusetts.",neutral,False
2026-06-13,Massachusetts Bay Transportation Authority,Massachusetts Bay Transportation Authority (MBTA),https://www.mass.gov/orgs/massachusetts-bay-transportation-authority,3,"The MBTA provides subway, bus, Commuter Rail, ferry, and paratransit service to eastern Massachusetts and parts of Rhode Island.",neutral,False
2026-06-13,Massachusetts Bay Transportation Authority,MBTA,https://www.linkedin.com/company/mbta,4,"The Massachusetts Bay Transportation Authority, often referred to as the MBTA or simply The T, is the public operator of most bus, subway, commuter rail and ...",positive,True
