date,company,title,url,position,snippet,sentiment,controlled
2026-06-01,OMNY,r/OMNY,https://www.reddit.com/r/OMNY/,1,r/OMNY: All things related to the OMNY payment card system in the New York Metro.,neutral,False
2026-06-01,OMNY,Student OMNY Cards,https://www.schools.nyc.gov/school-life/transportation/student-omny-cards,2,"Student OMNY Cards are good for 4 free rides each day. You can tap a Student OMNY Card whenever you want to take up to 4 free trips every day of the week, any ...",neutral,False
2026-06-01,OMNY,OMNY,https://en.wikipedia.org/wiki/OMNY,3,"OMNY (/ˈɒmni/ OM-nee, short for One Metro New York) is a contactless fare-payment system that has been implemented for use on public transit in the New York ...",neutral,False
2026-06-01,OMNY,OMNY for Access-A-Ride,https://www.mta.info/accessibility/access-a-ride/omny,4,Access-A-Ride (AAR) has introduced an optional cashless way to pay your fare with the AAR OMNY ID Card. Cash will remain a payment option.,positive,True
2026-06-01,The L,"Chicago ""L""",https://en.wikipedia.org/wiki/Chicago_%22L%22,1,"The ""L"" provides 24-hour service on the Red and Blue Lines, making Chicago, New York City, London and Copenhagen the only four cities in the world to offer 24- ...",neutral,False
2026-06-01,The L,How-To Guide: Riding the 'L' (Trains),https://www.transitchicago.com/howto/riding-the-train/,2,"CTA's train system is known as the 'L' (a now-official name originally short for ""elevated""). Trains serve over 140 stations located ...",positive,True
2026-06-01,The L,the L Denver | Reinventing Classics from the Ground Up,https://www.theldenver.com/,3,"We are on Broadway. We make good cocktails without the pretense & aprons. If you don't like us, we still like you. Our Menu. Your Fun.",positive,True
2026-06-01,The L,The Chicago L,https://www.architecture.org/online-resources/buildings-of-chicago/the-chicago-l,4,The Chicago L began operating in 1892. This network of elevated trains and subways is how Chicagoans get around. But it's also an iconic symbol of the city.,positive,False
2026-06-01,The L,L Train (14 Street-Canarsie Local) Line Map,https://www.mta.info/maps/subway-line-maps/l-line,5,"L Train (14 Street-Canarsie Local) Line Map Updated Feb 18, 2025. This shows weekday service. Listed transfers are based on the weekday schedule and may vary.",positive,True
2026-06-01,The L,Experience Chicago on the L Train: A City Ride Guide,https://www.choosechicago.com/articles/tours-and-attractions/sightsee-on-the-chicago-l-train/,6,"Experience Chicago on the L train with skyline views, neighborhood rides, and iconic stops—this guide shows how to sightsee the city from the tracks.",positive,False
2026-06-01,The L,Chicago ''L''.org - The Chicago rapid transit internet resource,https://www.chicago-l.org/,7,"Comprehensive resource for information on the Chicago rapid transit system -- the 'L' -- including history, stations, rolling stock, maps, current news, ...",neutral,False
2026-06-01,The L,Do people ACTUALLY call the “L” the “L” religiously?,https://www.reddit.com/r/chicago/comments/wx6dnf/do_people_actually_call_the_l_the_l_religiously/,8,"I feel like more ppl (specifically younger ppl) simply refer to it as the CTA or red line, blue line, etc. I feel like the whole “true chicagoans call ...",neutral,False
2026-06-01,CTA,California Teachers Association,https://www.cta.org/,1,"CTA has led the labor movement for more than 150 years, fighting for educators' rights and the rights for every public school student to have access to quality ...",positive,True
2026-06-01,CTA,Select Route,https://www.ctabustracker.com/bustime/wireless/html/home.jsp,2,1 - Bronzeville/Union Station · 2 - Hyde Park Express · 3 - King Drive · 4 - Cottage Grove · X4 - Cottage Grove Express · N5 - South Shore Night Bus · 6 - ...,positive,True
2026-06-01,CTA,Chicago Transit Authority,https://en.wikipedia.org/wiki/Chicago_Transit_Authority,3,"The Chicago Transit Authority (CTA) is a public transit agency in Chicago, Illinois, United States. It operates the Chicago ""L"" rail system and CTA bus services ...",neutral,False
2026-06-01,CTA,r/cta,https://www.reddit.com/r/cta/,4,"r/cta: Unofficial forum for Chicago's public transportation system, welcome :)",neutral,False
2026-06-01,CTA,Chicago Transit Authority (@thecta),https://www.facebook.com/thecta/,5,Chicago Transit Authority. 85095 likes · 3072 talking about this. Welcome to the official CTA Facebook page. Serving Chicago & 35 surrounding suburbs....,positive,True
2026-06-01,DC Metro,"Navigating Washington, DC's Metro System",https://washington.org/navigating-dc-metro,1,"Find out everything you need to know to ride DC's world-class Metrorail system, get a Metro map, check operating hours, ride fares and more.",neutral,False
2026-06-01,DC Metro,Washington Metro,https://en.wikipedia.org/wiki/Washington_Metro,2,a rapid transit system serving the Washington metropolitan area of the United States. It is administered by the Washington Metropolitan Area Transit Authority ...,neutral,False
2026-06-01,DC Metro,Metro Forward (@wmata) / Posts / X,https://x.com/wmata?lang=en,3,"Metro Forward (@wmata) - Posts - Official feed of Metro. Monitored 7a-8p, Mon-Fri & 8a-8p, Sat-Sun. Report emergencies to M️Police (2.",positive,True
2026-06-01,DC Metro,Washington Metro • WMATA (@metroforward),https://www.instagram.com/metroforward/,4,Official feed of Metro/WMATA Tag us during your trip #wmata. Follow. Message. Accounts you might like. baltimorecity.events's profile picture.,positive,True
2026-06-01,Metrorail,Metrorail,https://www.miamidade.gov/global/transportation/metrorail.page,1,"The Metrorail system is a 25-mile dual track that provides service to Miami International Airport (MIA) and runs from Kendall through South Miami, Coral Gables ...",neutral,False
2026-06-01,Metrorail,"METRORail | Red Line | Purple Line | Houston, Texas - METRO",https://www.ridemetro.org/riding-metro/transit-services/metrorail,2,"METRORail is Houston's light-rail network, offering convenient access to many popular destinations in and around downtown Houston.",neutral,False
2026-06-01,Metrorail,WMATA: Home,https://www.wmata.com/,3,"Metro is the Washington, DC region's public transportation system, offering bus and rail service across DC, Maryland, and Virginia. Find real-time arrivals, ...",positive,True
2026-06-01,Metrorail,CapMetro Rail – Capital Metro – Austin Public Transit,https://www.capmetro.org/rail,4,"A train for commuters traveling between Leander and downtown. Whether you're traveling to work or Q2 Stadium, get there quickly and comfortably.",neutral,False
2026-06-01,Metrorail,"Navigating Washington, DC's Metro System",https://washington.org/navigating-dc-metro,5,"The Metrorail consists of six color-coded lines: Red, Blue, Orange, Yellow, Green and Silver. The lines are connected to each other via transfer stations and ...",neutral,False
2026-06-01,Metrorail,Metrorail,https://www.miamiandbeaches.com/l/transportation/metrorail/3040,6,"Metrorail is Miami's quick and easy 25-mile elevated transportation system to get you to all parts of the urban core of Miami from 5:00am to midnight, seven ...",neutral,False
2026-06-01,Metrorail,"Metro | Bus, Rail, Subway, Bike & Micro in Los Angeles",https://www.metro.net/,7,"Explore Los Angeles by public transit. Start with Metro schedules, maps, arrival times, parking info, trip planning, stations, and fares.",neutral,False
2026-06-01,Metrorail,Metrorail (Miami-Dade County),https://en.wikipedia.org/wiki/Metrorail_(Miami-Dade_County),8,"Metrorail is a rapid transit system in Miami and Miami-Dade County in the U.S. state of Florida. It is operated by Miami-Dade Transit (MDT), a departmental ...",neutral,False
2026-06-01,Metrorail,Metrorail Stations,https://www.miamidade.gov/transportation-publicworks/metrorail-stations.asp,9,Metrorail Stations.,neutral,False
2026-06-01,Metrorail,Houston's Metro Rail System,https://www.visithoustontexas.com/travel-planning/getting-to-and-around-houston/metro-rail/,10,"With our METRORail system covering 23 miles of the city, you can save wear and tear on your car or avoid rental cars during your visit to Houston.",neutral,False
2026-06-01,MTA,Maryland Transit Administration,https://www.mta.maryland.gov/,1,"Routes & Schedules, Real Time Information, Trip Planner, Service Alerts, Website Feedback Survey, MDOT MTA In the News",positive,True
2026-06-01,MTA,MTA (@MTA) / Posts / X,https://x.com/MTA,2,"This summer, we're continuing our work to improve signals and stations on the G, which means there are more service changes coming. For more information ...",positive,True
2026-06-01,MTA,MTA Flint,https://www.mtaflint.org/,3,14 fixed routes throughout the City of Flint with routes and schedules. Regional Routes Direct round-trip connection to places outside of Genesee County.,positive,True
2026-06-01,MTA,Metropolitan Transportation Authority,https://en.wikipedia.org/wiki/Metropolitan_Transportation_Authority,4,The Metropolitan Transportation Authority (MTA) is a public benefit corporation in New York State responsible for public transportation in the New York City ...,neutral,False
2026-06-01,Chicago Transit Authority,Chicago Transit Authority,https://en.wikipedia.org/wiki/Chicago_Transit_Authority,1,"The Chicago Transit Authority (CTA) is a public transit agency in Chicago, Illinois, United States. It operates the Chicago ""L"" rail system and CTA bus services ...",neutral,False
2026-06-01,Chicago Transit Authority,Chicago Transit Authority - Album by Chicago,https://open.spotify.com/album/4DjSI3qiOKsUlZo4NsgYFq,2,Listen to Chicago Transit Authority on Spotify · album · Chicago · 1969 · 12 songs.,neutral,False
2026-06-01,Chicago Transit Authority,Chicago Transit Authority (CTA) - Travel Information,https://www.chicago.gov/city/en/depts/other/provdrs/cta.html,3,The CTA operates the nation's second largest public transportation system and covers the City of Chicago and 40 surrounding suburbs.,neutral,False
2026-06-01,Chicago Transit Authority,Chicago Transit Authority (@thecta),https://www.facebook.com/thecta/,4,Chicago Transit Authority. 85095 likes · 3072 talking about this. Welcome to the official CTA Facebook page. Serving Chicago & 35 surrounding suburbs....,positive,True
2026-06-01,MBTA,Massachusetts Bay Transportation Authority - MBTA,https://www.facebook.com/TheMBTA/,1,Massachusetts Bay Transportation Authority - MBTA · Details · Links · Contact info. 󰢉. thembta + 3. 󰛪. (617) 222-3200. 󰘢. social@mbta.com. Photos. See all ...,positive,True
2026-06-01,MBTA,Massachusetts Bay Transportation Authority,https://en.wikipedia.org/wiki/Massachusetts_Bay_Transportation_Authority,2,"The public agency responsible for operating most public transportation services in Greater Boston, Massachusetts.",neutral,False
2026-06-01,MBTA,Massachusetts Bay Transportation Authority,https://www.reddit.com/r/mbta/,3,"r/mbta: See MBTA news, policy discussion, service alerts, and a bit of everything in between for public transportation in Boston, Massachusetts and…",neutral,False
2026-06-01,MBTA,Massachusetts Bay Transportation Authority - MBTA,https://www.facebook.com/TheMBTA/,1,Massachusetts Bay Transportation Authority - MBTA · Details · Links · Contact info. 󰢉. thembta + 3. 󰛪. (617) 222-3200. 󰘢. social@mbta.com. Photos. See all ...,positive,True
2026-06-01,MBTA,Massachusetts Bay Transportation Authority,https://en.wikipedia.org/wiki/Massachusetts_Bay_Transportation_Authority,2,"The public agency responsible for operating most public transportation services in Greater Boston, Massachusetts.",neutral,False
2026-06-01,MBTA,Massachusetts Bay Transportation Authority,https://www.reddit.com/r/mbta/,3,"r/mbta: See MBTA news, policy discussion, service alerts, and a bit of everything in between for public transportation in Boston, Massachusetts and…",neutral,False
2026-06-01,MBTA,Massachusetts Bay Transportation Authority - MBTA,https://www.facebook.com/TheMBTA/,1,Massachusetts Bay Transportation Authority - MBTA · Details · Links · Contact info. 󰢉. thembta + 3. 󰛪. (617) 222-3200. 󰘢. social@mbta.com. Photos. See all ...,positive,True
2026-06-01,MBTA,Massachusetts Bay Transportation Authority,https://en.wikipedia.org/wiki/Massachusetts_Bay_Transportation_Authority,2,"The public agency responsible for operating most public transportation services in Greater Boston, Massachusetts.",neutral,False
2026-06-01,MBTA,Massachusetts Bay Transportation Authority,https://www.reddit.com/r/mbta/,3,"r/mbta: See MBTA news, policy discussion, service alerts, and a bit of everything in between for public transportation in Boston, Massachusetts and…",neutral,False
2026-06-01,Washington Metropolitan Area Transit Authority,Washington Metropolitan Area Transit Authority,https://en.wikipedia.org/wiki/Washington_Metropolitan_Area_Transit_Authority,1,"WMATA provides a rapid transit service under the Metrorail brand, fixed-route bus service under the Metrobus brand, and paratransit service under the ...",neutral,False
2026-06-01,Washington Metropolitan Area Transit Authority,Washington Metropolitan Area Transit Authority (WMATA),https://washington.org/find-dc-listings/washington-metropolitan-area-transit-authority,2,"The Washington Metropolitan Area Transit Authority (WMATA), known as Metro, is the region's leading public transportation provider, serving a population of ...",neutral,False
2026-06-01,Washington Metropolitan Area Transit Authority,Washington Metropolitan Area Transit Authority (WMATA),https://www.linkedin.com/company/wmata,3,"Locations · Primary. 600 5th Street, NW. Washington, DC 20001, US. Get directions · 3500 Pennsy Dr. Hyattsville, Maryland, US. Get directions. Employees at ...",positive,True
2026-06-01,Washington Metropolitan Area Transit Authority,Metro Forward (@wmata) / Posts / X,https://x.com/wmata?lang=en,4,"Follow @mtpdnews for the latest news, recruitment updates, safety information, and behind-the-scenes content! ➡️ instagram.com/mtpdnews · Metro Transit ...",positive,True
2026-06-01,Washington Metropolitan Area Transit Authority,Welcome to the Washington Metropolitan Area Transit ...,https://www.wmatc.gov/,5,The Washington Metropolitan Area Transit Commission (WMATC) was established in 1960 pursuant to the Washington Metropolitan Area Transit Regulation Compact.,positive,False
2026-06-01,Washington Metropolitan Area Transit Authority,Washington Metropolitan Area Transit Authority (Metro),https://www.tripadvisor.com/Attraction_Review-g28970-d8481891-Reviews-Washington_Metropolitan_Area_Transit_Authority_Metro-Washington_DC_District_of_Col.html,6,"The Metro system in Washington DC is excellent. The stations are clean, large and easy to navigate. You can use your credit card to tap in and out which makes ...",neutral,False
2026-06-01,Boston T,MBTA subway,https://en.wikipedia.org/wiki/MBTA_subway,1,"The Massachusetts Bay Transportation Authority (MBTA) operates rapid transit (heavy rail), light rail, and bus rapid transit services in the Boston ...",neutral,False
2026-06-01,Boston T,"Navigating Boston | Travel Advisories, MBTA, Parking",https://www.meetboston.com/plan/getting-around/,2,"Boston's public transportation system is operated by the Massachusetts Bay Transportation Authority (MBTA), though locals simply call it the “T.",neutral,False
2026-06-01,Boston T,"MBTA (@thembta) · Boston, MA",https://www.instagram.com/thembta/?hl=en,3,"Filled with T-themed puzzles, coloring pages, games, and more, we want to encourage kids to use their minds, imagination, and public transit. #MBTA # ...",positive,True
2026-06-01,Boston T,"Boston Subway - The ""T"" - Boston Public Transportation",https://www.boston-discovery-guide.com/boston-subway.html,4,"Boston's subway system - locally we call it the ""T"" - is the easiest and cheapest way to get around the city, aside from walking.",neutral,False
2026-06-01,Boston T,MBTA subway,https://en.wikipedia.org/wiki/MBTA_subway,1,"The Massachusetts Bay Transportation Authority (MBTA) operates rapid transit (heavy rail), light rail, and bus rapid transit services in the Boston ...",neutral,False
2026-06-01,Boston T,"Navigating Boston | Travel Advisories, MBTA, Parking",https://www.meetboston.com/plan/getting-around/,2,"Boston's public transportation system is operated by the Massachusetts Bay Transportation Authority (MBTA), though locals simply call it the “T.",neutral,False
2026-06-01,Boston T,"MBTA (@thembta) · Boston, MA",https://www.instagram.com/thembta/?hl=en,3,"Filled with T-themed puzzles, coloring pages, games, and more, we want to encourage kids to use their minds, imagination, and public transit. #MBTA # ...",positive,True
2026-06-01,Boston T,"Boston Subway - The ""T"" - Boston Public Transportation",https://www.boston-discovery-guide.com/boston-subway.html,4,"Boston's subway system - locally we call it the ""T"" - is the easiest and cheapest way to get around the city, aside from walking.",neutral,False
2026-06-01,Boston T,MBTA subway,https://en.wikipedia.org/wiki/MBTA_subway,1,"The Massachusetts Bay Transportation Authority (MBTA) operates rapid transit (heavy rail), light rail, and bus rapid transit services in the Boston ...",neutral,False
2026-06-01,Boston T,"Navigating Boston | Travel Advisories, MBTA, Parking",https://www.meetboston.com/plan/getting-around/,2,"Boston's public transportation system is operated by the Massachusetts Bay Transportation Authority (MBTA), though locals simply call it the “T.",neutral,False
2026-06-01,Boston T,"MBTA (@thembta) · Boston, MA",https://www.instagram.com/thembta/?hl=en,3,"Filled with T-themed puzzles, coloring pages, games, and more, we want to encourage kids to use their minds, imagination, and public transit. #MBTA # ...",positive,True
2026-06-01,Boston T,"Boston Subway - The ""T"" - Boston Public Transportation",https://www.boston-discovery-guide.com/boston-subway.html,4,"Boston's subway system - locally we call it the ""T"" - is the easiest and cheapest way to get around the city, aside from walking.",neutral,False
2026-06-01,NYC Subway,New York City Subway,https://en.wikipedia.org/wiki/New_York_City_Subway,1,"The New York City Subway is a rapid transit system in New York City, serving four of the city's five boroughs: Manhattan, Brooklyn, Queens, and the Bronx.",neutral,False
2026-06-01,NYC Subway,nycsubway.org,https://nycsubway.org/,2,nycsubway.org is not affiliated with any transit agency or provider. Not mobile.,positive,True
2026-06-01,NYC Subway,New York Subway MTA Map NYC - App Store,https://apps.apple.com/us/app/new-york-subway-mta-map-nyc/id369691844,3,This NYC subway map is free to download and will help you navigate around New York using the subway system.,positive,True
2026-06-01,The T,The T (TV Mini Series 2018,https://www.imdb.com/title/tt8530588/,1,"A white trans woman craving an increasingly elusive intimacy, Carter, a queer Black man at odds with his conservative upbringing, and Emerie, a Latina trans ...",neutral,False
2026-06-01,The T,"Boston Subway - The ""T"" - Boston Public Transportation",https://www.boston-discovery-guide.com/boston-subway.html,2,"The T's five color-coded lines - Red, Green, Orange, Blue, and Silver - serve many (but not all) Boston neighborhoods plus parts of Cambridge, Somerville, ...",neutral,False
2026-06-01,The T,T Line - Tacoma Dome – St Joseph,https://www.soundtransit.org/ride-with-us/routes-schedules/t-line,3,"Route map, schedule, service alerts, real-time arrivals and more information for Sound Transit route T Line.",neutral,False
2026-06-01,The T,MBTA subway,https://en.wikipedia.org/wiki/MBTA_subway,4,"The Massachusetts Bay Transportation Authority (MBTA) operates rapid transit (heavy rail), light rail, and bus rapid transit services in the Boston ...",neutral,False
2026-06-01,The T,T Third Street: Schedules,https://www.sfmta.com/ar/routes/schedule/T,5,T Third Street: Schedules ; Saturday Service · Saturday Service ; Sunday Service · Sunday Service ; Weekday Service · Weekday Service.,neutral,False
2026-06-01,The T,The T (TV Mini Series 2018,https://www.imdb.com/title/tt8530588/,1,"A white trans woman craving an increasingly elusive intimacy, Carter, a queer Black man at odds with his conservative upbringing, and Emerie, a Latina trans ...",neutral,False
2026-06-01,The T,"Boston Subway - The ""T"" - Boston Public Transportation",https://www.boston-discovery-guide.com/boston-subway.html,2,"The T's five color-coded lines - Red, Green, Orange, Blue, and Silver - serve many (but not all) Boston neighborhoods plus parts of Cambridge, Somerville, ...",neutral,False
2026-06-01,The T,T Line - Tacoma Dome – St Joseph,https://www.soundtransit.org/ride-with-us/routes-schedules/t-line,3,"Route map, schedule, service alerts, real-time arrivals and more information for Sound Transit route T Line.",neutral,False
2026-06-01,The T,MBTA subway,https://en.wikipedia.org/wiki/MBTA_subway,4,"The Massachusetts Bay Transportation Authority (MBTA) operates rapid transit (heavy rail), light rail, and bus rapid transit services in the Boston ...",neutral,False
2026-06-01,The T,T Third Street: Schedules,https://www.sfmta.com/ar/routes/schedule/T,5,T Third Street: Schedules ; Saturday Service · Saturday Service ; Sunday Service · Sunday Service ; Weekday Service · Weekday Service.,neutral,False
2026-06-01,The T,The T (TV Mini Series 2018,https://www.imdb.com/title/tt8530588/,1,"A white trans woman craving an increasingly elusive intimacy, Carter, a queer Black man at odds with his conservative upbringing, and Emerie, a Latina trans ...",neutral,False
2026-06-01,The T,"Boston Subway - The ""T"" - Boston Public Transportation",https://www.boston-discovery-guide.com/boston-subway.html,2,"The T's five color-coded lines - Red, Green, Orange, Blue, and Silver - serve many (but not all) Boston neighborhoods plus parts of Cambridge, Somerville, ...",neutral,False
2026-06-01,The T,T Line - Tacoma Dome – St Joseph,https://www.soundtransit.org/ride-with-us/routes-schedules/t-line,3,"Route map, schedule, service alerts, real-time arrivals and more information for Sound Transit route T Line.",neutral,False
2026-06-01,The T,MBTA subway,https://en.wikipedia.org/wiki/MBTA_subway,4,"The Massachusetts Bay Transportation Authority (MBTA) operates rapid transit (heavy rail), light rail, and bus rapid transit services in the Boston ...",neutral,False
2026-06-01,The T,T Third Street: Schedules,https://www.sfmta.com/ar/routes/schedule/T,5,T Third Street: Schedules ; Saturday Service · Saturday Service ; Sunday Service · Sunday Service ; Weekday Service · Weekday Service.,neutral,False
2026-06-01,Massachusetts Bay Transportation Authority,Massachusetts,https://en.wikipedia.org/wiki/Massachusetts,1,"In 1630, the Massachusetts Bay Colony, taking its name from the Indigenous Massachusett people, also established settlements in Boston and Salem. In 1692, the ...",neutral,False
2026-06-01,Massachusetts Bay Transportation Authority,Mass.gov,https://www.mass.gov/,2,An official website of the Commonwealth of Massachusetts. Here's how you know Official websites use .mass.gov.,neutral,False
2026-06-01,Massachusetts Bay Transportation Authority,VisitMA: Things to Do in Massachusetts | Things to Do in Boston,https://www.visitma.com/,3,"Travel together. Explore a variety of activities for families from unique museums, to historic towns, to outdoor adventures, and more across Massachusetts.",neutral,False
2026-06-01,Massachusetts Bay Transportation Authority,Massachusetts Rankings | U.S. News Best States,https://www.usnews.com/news/best-states/massachusetts,4,Crime & Corrections. #5 · Economy. #11 · Education. #5 · Fiscal Stability. #36 · Health Care. #2 · Infrastructure. #39 · Natural Environment. #3 · Opportunity. #41.,positive,False
2026-06-01,Massachusetts Bay Transportation Authority,Secretary of the Commonwealth of Massachusetts,https://www.sec.state.ma.us/,5,"Ahead of Crypto Bill Vote, Galvin Urges Senate Banking Committee to Retain State Investor Protections · Galvin Fines Fidelity $1.25 Million Over Data Breach ...",neutral,False
2026-06-01,Massachusetts Bay Transportation Authority,"Massachusetts | Geography, History, Flag, Facts, Maps ...",https://www.britannica.com/place/Massachusetts,6,"Geographical and historical treatment of Massachusetts, constituent state (officially called a commonwealth) of the United States, located in the ...",neutral,False
2026-06-01,Massachusetts Bay Transportation Authority,Visit Massachusetts: Massachusetts Tourism Vacation Guide ...,https://www.visit-massachusetts.com/,7,Visit Massachusetts has the best travel and vacation guides when visiting Massachusetts. Check out our website before your next visit to Massachusetts.,neutral,False
2026-06-01,Massachusetts Bay Transportation Authority,Massachusetts - Home,https://www.facebook.com/pages/Massachusetts/112439102104396,8,"Massachusetts. 43K likes. Massachusetts, officially the Commonwealth of Massachusetts, is the most populous state in the New England region of the ...",positive,True
2026-06-01,Massachusetts Bay Transportation Authority,Massachusetts Pictures and Facts,https://kids.nationalgeographic.com/geography/states/article/massachusetts,9,"HISTORY. People started living in what's now called Massachusetts about 12,000 years ago, when retreating glaciers uncovered the land. Some artifacts have even ...",neutral,False
2026-06-01,Massachusetts Bay Transportation Authority,"Massachusetts, United States - Map & Guides",https://maps.apple.com/place?auid=8212481877439524881,10,"View details about Massachusetts, United States on Apple Maps. Address, driving directions, images, nearby attractions and more.",positive,False
