date,company,title,url,position,snippet,sentiment,controlled
2026-06-25,NYC Subway,MTA: Home,https://www.mta.info/,1,Back; New York City Transit · Bridges & Tunnels · Long Island Rail Road · Metro-North Railroad · Other agencies and departments. Contact us.,positive,True
2026-06-25,NYC Subway,New York City Subway,https://en.wikipedia.org/wiki/New_York_City_Subway,2,"The New York City Subway is a rapid transit system in New York City, serving four of the city's five boroughs: Manhattan, Brooklyn, Queens, and the Bronx.",neutral,False
2026-06-25,NYC Subway,nycsubway.org,https://nycsubway.org/,3,nycsubway.org is not affiliated with any transit agency or provider. Not mobile.,positive,True
2026-06-25,NYC Subway,New York City Subway,https://sab.org/wp-content/uploads/2020/01/Subway_Map_2018.pdf,4,"New York City Subway with bus and railroad connections. Manhattan bound. N ... The subway operates 24 hours a day, but not all lines operate at all times ...",neutral,False
2026-06-25,NYC Subway,New York Subway MTA Map NYC - App Store,https://apps.apple.com/us/app/new-york-subway-mta-map-nyc/id369691844,5,This NYC subway map is free to download and will help you navigate around New York using the subway system.,positive,True
2026-06-25,Boston T,MBTA - Massachusetts Bay Transportation Authority,https://www.mbta.com/,1,"Public transit in the Greater Boston region. Routes, schedules, trip planner, fares, service alerts, real-time updates, and general information.",positive,True
2026-06-25,Boston T,MBTA subway,https://en.wikipedia.org/wiki/MBTA_subway,2,"The Massachusetts Bay Transportation Authority (MBTA) operates rapid transit (heavy rail), light rail, and bus rapid transit services in the Boston ...",neutral,False
2026-06-25,Boston T,"Navigating Boston | Travel Advisories, MBTA, Parking",https://www.meetboston.com/plan/getting-around/,3,"Take the ""T"". Boston's public transportation system is operated by the Massachusetts Bay Transportation Authority (MBTA), though locals simply ...",neutral,False
2026-06-25,Boston T,"MBTA (@thembta) · Boston, MA",https://www.instagram.com/thembta/?hl=en,4,"The official Instagram of the Massachusetts Bay Transportation Authority. · As we welcome the world to Boston, we're here to transport visitors to all their ...",positive,True
2026-06-25,Boston T,MBTA - Massachusetts Bay Transportation Authority,https://www.mbta.com/,1,"Public transit in the Greater Boston region. Routes, schedules, trip planner, fares, service alerts, real-time updates, and general information.",positive,True
2026-06-25,Boston T,MBTA subway,https://en.wikipedia.org/wiki/MBTA_subway,2,"The Massachusetts Bay Transportation Authority (MBTA) operates rapid transit (heavy rail), light rail, and bus rapid transit services in the Boston ...",neutral,False
2026-06-25,Boston T,"Navigating Boston | Travel Advisories, MBTA, Parking",https://www.meetboston.com/plan/getting-around/,3,"Take the ""T"". Boston's public transportation system is operated by the Massachusetts Bay Transportation Authority (MBTA), though locals simply ...",neutral,False
2026-06-25,Boston T,"MBTA (@thembta) · Boston, MA",https://www.instagram.com/thembta/?hl=en,4,"The official Instagram of the Massachusetts Bay Transportation Authority. · As we welcome the world to Boston, we're here to transport visitors to all their ...",positive,True
2026-06-25,Boston T,MBTA - Massachusetts Bay Transportation Authority,https://www.mbta.com/,1,"Public transit in the Greater Boston region. Routes, schedules, trip planner, fares, service alerts, real-time updates, and general information.",positive,True
2026-06-25,Boston T,MBTA subway,https://en.wikipedia.org/wiki/MBTA_subway,2,"The Massachusetts Bay Transportation Authority (MBTA) operates rapid transit (heavy rail), light rail, and bus rapid transit services in the Boston ...",neutral,False
2026-06-25,Boston T,"Navigating Boston | Travel Advisories, MBTA, Parking",https://www.meetboston.com/plan/getting-around/,3,"Take the ""T"". Boston's public transportation system is operated by the Massachusetts Bay Transportation Authority (MBTA), though locals simply ...",neutral,False
2026-06-25,Boston T,"MBTA (@thembta) · Boston, MA",https://www.instagram.com/thembta/?hl=en,4,"The official Instagram of the Massachusetts Bay Transportation Authority. · As we welcome the world to Boston, we're here to transport visitors to all their ...",positive,True
2026-06-25,MBTA,MBTA - Massachusetts Bay Transportation Authority,https://www.mbta.com/,1,"Public transit in the Greater Boston region. Routes, schedules, trip planner, fares, service alerts, real-time updates, and general information.",positive,True
2026-06-25,MBTA,Massachusetts Bay Transportation Authority,https://en.wikipedia.org/wiki/Massachusetts_Bay_Transportation_Authority,2,"The public agency responsible for operating most public transportation services in Greater Boston, Massachusetts.",neutral,False
2026-06-25,MBTA,Massachusetts Bay Transportation Authority (MBTA),https://www.mass.gov/orgs/massachusetts-bay-transportation-authority,3,"The MBTA provides subway, bus, Commuter Rail, ferry, and paratransit service to eastern Massachusetts and parts of Rhode Island.",neutral,False
2026-06-25,MBTA,Massachusetts Bay Transportation Authority - MBTA,https://www.facebook.com/TheMBTA/,4,"As we welcome the world to Boston, we're here to transport visitors to all their destinations. Take the T to Boston World Cup 2026 Host City matches, ...",positive,True
2026-06-25,MBTA,TransitMatters - Boston,https://transitmatters.org/,5,"TransitMatters advocates for fast, frequent, reliable and effective public transportation in Boston. We support plans and policies that improve transit and ...",neutral,False
2026-06-25,MBTA,MBTA - Massachusetts Bay Transportation Authority,https://www.mbta.com/,1,"Public transit in the Greater Boston region. Routes, schedules, trip planner, fares, service alerts, real-time updates, and general information.",positive,True
2026-06-25,MBTA,Massachusetts Bay Transportation Authority,https://en.wikipedia.org/wiki/Massachusetts_Bay_Transportation_Authority,2,"The public agency responsible for operating most public transportation services in Greater Boston, Massachusetts.",neutral,False
2026-06-25,MBTA,Massachusetts Bay Transportation Authority (MBTA),https://www.mass.gov/orgs/massachusetts-bay-transportation-authority,3,"The MBTA provides subway, bus, Commuter Rail, ferry, and paratransit service to eastern Massachusetts and parts of Rhode Island.",neutral,False
2026-06-25,MBTA,Massachusetts Bay Transportation Authority - MBTA,https://www.facebook.com/TheMBTA/,4,"As we welcome the world to Boston, we're here to transport visitors to all their destinations. Take the T to Boston World Cup 2026 Host City matches, ...",positive,True
2026-06-25,MBTA,TransitMatters - Boston,https://transitmatters.org/,5,"TransitMatters advocates for fast, frequent, reliable and effective public transportation in Boston. We support plans and policies that improve transit and ...",neutral,False
2026-06-25,MBTA,MBTA - Massachusetts Bay Transportation Authority,https://www.mbta.com/,1,"Public transit in the Greater Boston region. Routes, schedules, trip planner, fares, service alerts, real-time updates, and general information.",positive,True
2026-06-25,MBTA,Massachusetts Bay Transportation Authority,https://en.wikipedia.org/wiki/Massachusetts_Bay_Transportation_Authority,2,"The public agency responsible for operating most public transportation services in Greater Boston, Massachusetts.",neutral,False
2026-06-25,MBTA,Massachusetts Bay Transportation Authority (MBTA),https://www.mass.gov/orgs/massachusetts-bay-transportation-authority,3,"The MBTA provides subway, bus, Commuter Rail, ferry, and paratransit service to eastern Massachusetts and parts of Rhode Island.",neutral,False
2026-06-25,MBTA,Massachusetts Bay Transportation Authority - MBTA,https://www.facebook.com/TheMBTA/,4,"As we welcome the world to Boston, we're here to transport visitors to all their destinations. Take the T to Boston World Cup 2026 Host City matches, ...",positive,True
2026-06-25,MBTA,TransitMatters - Boston,https://transitmatters.org/,5,"TransitMatters advocates for fast, frequent, reliable and effective public transportation in Boston. We support plans and policies that improve transit and ...",neutral,False
2026-06-25,Chicago Transit Authority,Chicago Transit Authority - CTA Buses & Train Service - 1-888 ...,https://www.transitchicago.com/,1,"Information about CTA bus and train service in and around Chicago. Find maps, schedules, service alerts, plan a trip, jobs, news and more!",positive,True
2026-06-25,Chicago Transit Authority,Chicago Transit Authority (CTA) - Travel Information,https://www.chicago.gov/city/en/depts/other/provdrs/cta.html,2,The CTA operates the nation's second largest public transportation system and covers the City of Chicago and 40 surrounding suburbs.,neutral,False
2026-06-25,Chicago Transit Authority,Chicago Transit Authority,https://en.wikipedia.org/wiki/Chicago_Transit_Authority,3,"The Chicago Transit Authority (CTA) is a public transit agency in Chicago, Illinois, United States. It operates the Chicago ""L"" rail system and CTA bus services ...",neutral,False
2026-06-25,Chicago Transit Authority,Chicago Transit Authority (@thecta),https://www.facebook.com/thecta/,4,Chicago Transit Authority. 85415 likes · 868 talking about this. Welcome to the official CTA Facebook page. Serving Chicago & 35 surrounding suburbs....,positive,True
2026-06-25,Chicago Transit Authority,Chicago Transit Authority (@chicagocta),https://www.instagram.com/chicagocta/,5,"As a public transit agency that provides 24-hour-a-day, 7-day-a-week service, we are always thinking about the needs of the people who operate and travel aboard ...",positive,True
2026-06-25,Chicago Transit Authority,Getting Around Chicago | Transit & Parking,https://www.choosechicago.com/plan-your-trip/getting-around/,6,"The nation's second-largest public transportation system, the Chicago Transit Authority (CTA), operates Chicago's eight 'L' train lines and 127 bus routes.",neutral,False
2026-06-25,The L,"Chicago ""L""",https://en.wikipedia.org/wiki/Chicago_%22L%22,1,"The ""L"" provides 24-hour service on the Red and Blue Lines, making Chicago, New York City, London and Copenhagen the only four cities in the world to offer 24- ...",neutral,False
2026-06-25,The L,How-To Guide: Riding the 'L' (Trains),https://www.transitchicago.com/howto/riding-the-train/,2,"CTA's train system is known as the 'L' (a now-official name originally short for ""elevated""). Trains serve over 140 stations located ...",positive,True
2026-06-25,The L,Maps,https://www.transitchicago.com/maps/,3,The CTA 'L' system diagram shows train routes only. Online version (PNG image); Downloadable version(Opens in a new window) (PDF version). Regional maps.,positive,True
2026-06-25,The L,"THE L STATION (@thelstation.chi) · Chicago, IL",https://www.instagram.com/thelstation.chi/?hl=en,4,Chicago Luxury Dining ✨Kitchen closes 1 hour before closing time ✨Hours are available on our website. @thelstation.chi is one of my favorite spots in the ...,positive,True
2026-06-25,The L,"The ""L"" : The Development of Chicago's Rapid Transit ...",https://www.amazon.com/Development-Chicagos-Transit-System-1888-1932/dp/0915348306,5,"Bruce G. Moffat traces Chicago's ""L"" rapid transit system from its 1888 incorporation through steam operations, electric conversion, suburban expansion, and ...",neutral,False
2026-06-25,The L,The Chicago L,https://www.architecture.org/online-resources/buildings-of-chicago/the-chicago-l,6,The Chicago L began operating in 1892. This network of elevated trains and subways is how Chicagoans get around. But it's also an iconic symbol of the city.,positive,False
2026-06-25,DC Metro,WMATA: Home,https://www.wmata.com/,1,"Metro is the Washington, DC region's public transportation system, offering bus and rail service across DC, Maryland, and Virginia. Find real-time arrivals, ...",positive,True
2026-06-25,DC Metro,"Navigating Washington, DC's Metro System",https://washington.org/navigating-dc-metro,2,"Find out everything you need to know to ride DC's world-class Metrorail system, get a Metro map, check operating hours, ride fares and more.",neutral,False
2026-06-25,DC Metro,Washington Metro,https://en.wikipedia.org/wiki/Washington_Metro,3,"The Washington Metro, often abbreviated as the Metro and formally the Metrorail, includes six lines, 98 stations, and 130 miles (210 km) of route.",neutral,False
2026-06-25,DC Metro,Washington Metro • WMATA (@metroforward),https://www.instagram.com/metroforward/?hl=en,4,"Official feed of Metro/WMATA 🚇🚍🚐. NOW AVAILABLE at DCMetrostore.com! stations, buses, and trains clean.",positive,True
2026-06-25,DC Metro,Metro Forward (@wmata) / Posts / X,https://x.com/wmata?lang=en,5,"Location: Washington DC Website: http://wmata.com. Official feed of Metro. Monitored 7a-8p, Mon-Fri & 8a-8p, Sat-Sun. Report emergencies to M️Police (202) 962- ...",positive,True
2026-06-25,Metrorail,"Metrorail Service: Schedules, Fares, and Stations",https://www.miamidade.gov/global/transportation/metrorail.page,1,"The Metrorail system is a 25-mile dual track that provides service to Miami International Airport (MIA) and runs from Kendall through South Miami, Coral Gables ...",neutral,False
2026-06-25,Metrorail,"METRORail | Red Line | Purple Line | Houston, Texas - METRO",https://www.ridemetro.org/riding-metro/transit-services/metrorail,2,"METRORail is Houston's light rail network, offering convenient access to many popular destinations in and around downtown Houston. These include the Texas ...",neutral,False
2026-06-25,Metrorail,WMATA: Home,https://www.wmata.com/,3,"Metro is the Washington, DC region's public transportation system, offering bus and rail service across DC, Maryland, and Virginia. Find real-time arrivals, ...",positive,True
2026-06-25,Metrorail,"Metro | Bus, Rail, Subway, Bike & Micro in Los Angeles",https://www.metro.net/,4,"Explore Los Angeles by public transit. Start with Metro schedules, maps, arrival times, parking info, trip planning, stations, and fares.",neutral,False
2026-06-25,Metrorail,"Navigating Washington, DC's Metro System",https://washington.org/navigating-dc-metro,5,"The Metrorail consists of six color-coded lines: Red, Blue, Orange, Yellow, Green and Silver. The lines are connected to each other via transfer stations and ...",neutral,False
2026-06-25,Metrorail,CapMetro Rail – Capital Metro – Austin Public Transit,https://www.capmetro.org/rail,6,"A train for commuters traveling between Leander and downtown. Whether you're traveling to work or Q2 Stadium, get there quickly and comfortably.",neutral,False
2026-06-25,Metrorail,Metrorail,https://www.miamiandbeaches.com/l/transportation/metrorail/3040,7,"Metrorail is Miami's quick and easy 25-mile elevated transportation system to get you to all parts of the urban core of Miami from 5:00am to midnight, seven ...",neutral,False
2026-06-25,Metrorail,Metrorail (Miami-Dade County),https://en.wikipedia.org/wiki/Metrorail_(Miami-Dade_County),8,"Metrorail is a rapid transit system in Miami and Miami-Dade County in the U.S. state of Florida. It is operated by Miami-Dade Transit (MDT), a departmental ...",neutral,False
2026-06-25,Metrorail,Houston's Metro Rail System,https://www.visithoustontexas.com/travel-planning/getting-to-and-around-houston/metro-rail/,9,"With our METRORail system covering 23 miles of the city, you can save wear and tear on your car or avoid rental cars during your visit to Houston.",neutral,False
2026-06-25,OMNY,OMNY,https://omny.info/,1,One secure account to manage your travel. Enjoy convenient features when you register for an OMNY account.,positive,True
2026-06-25,OMNY,OMNY,https://en.wikipedia.org/wiki/OMNY,2,OMNY is a contactless fare-payment system that has been implemented for use on public transit in the New York metropolitan area. OMNY can currently be used ...,neutral,False
2026-06-25,OMNY,Fair Fares & OMNY,https://www.nyc.gov/site/fairfares/OMNY/omny.page,3,"Yes. OMNY is the new payment method and will replace MetroCard. You will need to use OMNY to ride on NYC Transit subways and local, limited and Select Bus ...",positive,False
2026-06-25,OMNY,Reduced-Fare OMNY,https://www.mta.info/fares-tolls/subway-bus/reduced-fare/omny,4,"Reduced-Fare OMNY lets you tap for half-price fares on MTA buses, subways, Staten Island Railway, Roosevelt Island Tram, and Hudson Rail Link.",positive,True
2026-06-25,OMNY,r/OMNY,https://www.reddit.com/r/OMNY/,5,r/OMNY: All things related to the OMNY payment card system in the New York Metro.,neutral,False
2026-06-25,OMNY,OMNY! OMNY card vending machines make it easier than ...,https://www.facebook.com/mta/videos/omny-omny-card-vending-machines-make-it-easier-than-ever-to-tap-go-and-feature-a/3780942328861993/,6,"OMNY card vending machines make it easier than ever to tap & go, and feature a convenient fare calculator to make adding value a breeze.",positive,True
2026-06-25,MTA,MTA: Home - NYC,https://www.mta.info/,1,Quick links · Get real-time alerts · Book or manage a Paratransit trip · Check elevator and escalator status · Contact Lost and Found · Sign up for our ...,positive,True
2026-06-25,MTA,Maryland Transit Administration,https://www.mta.maryland.gov/,2,"Routes & Schedules, Real Time Information, Trip Planner, Service Alerts, Website Feedback Survey, MDOT MTA In the News",positive,True
2026-06-25,MTA,MTA (@MTA) / Posts / X,https://x.com/MTA,3,"Between the Knicks winning the NBA Finals, the World Cup, and NYC's usual summer fun, the city is buzzing—and the MTA is at the center of it all.",positive,True
2026-06-25,MTA,MTA Flint,https://www.mtaflint.org/,4,14 fixed routes throughout the City of Flint with routes and schedules. Regional Routes Direct round-trip connection to places outside of Genesee County.,positive,True
2026-06-25,MTA,Metropolitan Transportation Authority,https://en.wikipedia.org/wiki/Metropolitan_Transportation_Authority,5,The Metropolitan Transportation Authority (MTA) is a public benefit corporation in New York State responsible for public transportation in the New York City ...,neutral,False
2026-06-25,MTA,Metropolitan Transportation Authority Careers,https://careers.mta.org/,6,"The MTA family includes professionals in a variety of positions, from bus and train operators to engineers, accountants, and policy experts.",positive,True
2026-06-25,CTA,Chicago Transit Authority - CTA Buses & Train Service - 1-888 ...,https://www.transitchicago.com/,1,"Information about CTA bus and train service in and around Chicago. Find maps, schedules, service alerts, plan a trip, jobs, news and more!",positive,True
2026-06-25,CTA,California Teachers Association,https://www.cta.org/,2,"CTA has led the labor movement for more than 150 years, fighting for educators' rights and the rights for every public school student to have access to quality ...",positive,True
2026-06-25,CTA,Chicago Transit Authority (@thecta),https://www.facebook.com/thecta/,3,Chicago Transit Authority. 85416 likes · 868 talking about this. Welcome to the official CTA Facebook page. Serving Chicago & 35 surrounding suburbs....,positive,True
2026-06-25,CTA,Select Route,https://www.ctabustracker.com/bustime/wireless/html/home.jsp,4,1 - Bronzeville/Union Station · 2 - Hyde Park Express · 3 - King Drive · 4 - Cottage Grove · X4 - Cottage Grove Express · N5 - South Shore Night Bus · 6 - ...,positive,True
2026-06-25,CTA,Chicago Transit Authority,https://en.wikipedia.org/wiki/Chicago_Transit_Authority,5,"The Chicago Transit Authority (CTA) is a public transit agency in Chicago, Illinois, United States. It operates the Chicago ""L"" rail system and CTA bus services ...",neutral,False
2026-06-25,Massachusetts Bay Transportation Authority,MBTA - Massachusetts Bay Transportation Authority,https://www.mbta.com/,1,"Public transit in the Greater Boston region. Routes, schedules, trip planner, fares, service alerts, real-time updates, and general information.",positive,True
2026-06-25,Massachusetts Bay Transportation Authority,Massachusetts Bay Transportation Authority,https://en.wikipedia.org/wiki/Massachusetts_Bay_Transportation_Authority,2,"The public agency responsible for operating most public transportation services in Greater Boston, Massachusetts.",neutral,False
2026-06-25,Massachusetts Bay Transportation Authority,Massachusetts Bay Transportation Authority (MBTA),https://www.mass.gov/orgs/massachusetts-bay-transportation-authority,3,"The MBTA provides subway, bus, Commuter Rail, ferry, and paratransit service to eastern Massachusetts and parts of Rhode Island.",neutral,False
2026-06-25,Massachusetts Bay Transportation Authority,MBTA,https://www.linkedin.com/company/mbta,4,"The Massachusetts Bay Transportation Authority, often referred to as the MBTA or simply The T, is the public operator of most bus, subway, commuter rail and ...",positive,True
2026-06-25,Massachusetts Bay Transportation Authority,Massachusetts Bay Transportation Authority - MBTA,https://www.facebook.com/TheMBTA/,5,"As we welcome the world to Boston, we're here to transport visitors to all their destinations. Take the T to Boston World Cup 2026 Host City matches, ...",positive,True
2026-06-25,Massachusetts Bay Transportation Authority,MASSACHUSETTS BAY TRANSPORTATION AUTHORITY,https://www.yelp.com/biz/massachusetts-bay-transportation-authority-boston,6,An alright transportation system. The prices are reasonable and the stations aren't too difficult to find or navigate through. The trains can be quite crowded ...,neutral,False
2026-06-25,Massachusetts Bay Transportation Authority,Massachusetts Bay Transportation Authority (MBTA),https://climatebase.org/company/1137158/massachusetts-bay-transportation-authority-mbta,7,"The MBTA is the largest transit provider in New England, and the fifth largest in the country. The MBTA directly operates or contracts out for service using ...",neutral,False
2026-06-25,Washington Metropolitan Area Transit Authority,WMATA: Home,https://www.wmata.com/,1,"Metro is the Washington, DC region's public transportation system, offering bus and rail service across DC, Maryland, and Virginia. Find real-time arrivals, ...",positive,True
2026-06-25,Washington Metropolitan Area Transit Authority,Washington Metropolitan Area Transit Authority,https://en.wikipedia.org/wiki/Washington_Metropolitan_Area_Transit_Authority,2,"WMATA provides a rapid transit service under the Metrorail brand, fixed-route bus service under the Metrobus brand, and paratransit service under the ...",neutral,False
2026-06-25,Washington Metropolitan Area Transit Authority,Washington Metropolitan Area Transit Authority (WMATA),https://www.linkedin.com/company/wmata,3,"Provide safe and reliable public transportation Locations Primary 600 5th Street, NW Washington, DC 20001, US Get directions 3500 Pennsy Dr Hyattsville, ...",positive,True
2026-06-25,Washington Metropolitan Area Transit Authority,Washington Metropolitan Area Transit Authority (WMATA),https://washington.org/find-dc-listings/washington-metropolitan-area-transit-authority,4,"With a network of six rail lines, 98 stations, 125 bus routes, and a door-to-door paratransit service, Metro is the second busiest transit system in the United ...",neutral,False
2026-06-25,Washington Metropolitan Area Transit Authority,Welcome to the Washington Metropolitan Area Transit ...,https://wmatc.gov/,5,"The Commission issues operating authority to van and bus operators and some sedan, SUVs and limousine operators. (202) 737-4404",positive,False
2026-06-25,Washington Metropolitan Area Transit Authority,Metro Forward (@wmata) / Posts / X,https://x.com/wmata?lang=en,6,"Metro is the safest, fastest, most reliable away to get around. Download our Metro Pulse app here to plan your trip: We've improved map performance, navigation ...",positive,True
2026-06-25,Washington Metropolitan Area Transit Authority,Washington Metropolitan Area Transit Authority (Metro),https://www.tripadvisor.com/Attraction_Review-g28970-d8481891-Reviews-Washington_Metropolitan_Area_Transit_Authority_Metro-Washington_DC_District_of_Col.html,7,"The Metro system in Washington DC is excellent. The stations are clean, large and easy to navigate. You can use the Metro from Dulles airport to the city ...",neutral,False
2026-06-25,The T,MBTA - Massachusetts Bay Transportation Authority,https://www.mbta.com/,1,"Public transit in the Greater Boston region. Routes, schedules, trip planner, fares, service alerts, real-time updates, and general information.",positive,True
2026-06-25,The T,Massachusetts Bay Transportation Authority,https://en.wikipedia.org/wiki/Massachusetts_Bay_Transportation_Authority,2,"The Massachusetts Bay Transportation Authority (abbreviated MBTA and known colloquially as ""the T"") is the public agency responsible for operating most public ...",neutral,False
2026-06-25,The T,"Rapid Transit (the ""T"") | Wellesley, MA",https://www.wellesleyma.gov/1697/Rapid-Transit-the-T,3,"Catch the T at Woodland, and Waban stations. Use the ""Catch Connect"" micro-transit service to easily access these stations from Wellesley. The MBTA ...",neutral,False
2026-06-25,The T,T Third Street,https://www.sfmta.com/routes/t-third-street,4,"Extending the Muni Metro T Third Line to provide a direct transit link between the Bayshore and Mission Bay areas to SoMa, downtown and Chinatown. Pedestrians, ...",neutral,False
2026-06-25,The T,T: An MBTA Musical,https://www.bostontheatrescene.com/shows-and-events/t-an-mbta-musical/,5,T: An MBTA Musical is Boston's best musical parody of the USA's oldest subway system. · “T” is the journey of three struggling Bostonians whose lives have been ...,neutral,False
