date,company,title,url,position,snippet,sentiment,controlled
2026-05-03,Washington Metropolitan Area Transit Authority,WMATA: Home,https://www.wmata.com/,1,"Easy access to free, real-time information, customer service chat, and more. LEARN MORE · MetroPulse Mobile App · Home. TRANSIT INFORMATION; METROPULSE · BUS ...",positive,True
2026-05-03,Washington Metropolitan Area Transit Authority,Washington Metropolitan Area Transit Authority,https://en.wikipedia.org/wiki/Washington_Metropolitan_Area_Transit_Authority,2,"WMATA provides a rapid transit service under the Metrorail brand, fixed-route bus service under the Metrobus brand, and paratransit service under the ...",neutral,False
2026-05-03,Washington Metropolitan Area Transit Authority,Washington Metropolitan Area Transit Authority (WMATA),https://washington.org/find-dc-listings/washington-metropolitan-area-transit-authority,3,"The Washington Metropolitan Area Transit Authority (WMATA), known as Metro, is the region's leading public transportation provider, serving a population of ...",neutral,False
2026-05-03,Washington Metropolitan Area Transit Authority,What is undermining the recovery of D.C. transit,https://www.washingtonpost.com/opinions/2026/05/01/wmata-crisis-looms-amid-rising-labor-costs-declining-ridership/,4,The Washington Metropolitan Area Transit Authority has much to be proud of in recent years. Ridership has returned faster than expected ...,negative,False
2026-05-03,Washington Metropolitan Area Transit Authority,Washington Metropolitan Area Transit Authority (WMATA),https://www.linkedin.com/company/wmata,5,"Locations · Primary. 600 5th Street, NW. Washington, DC 20001, US. Get directions · 3500 Pennsy Dr. Hyattsville, Maryland, US. Get directions. Employees at ...",positive,True
2026-05-03,Washington Metropolitan Area Transit Authority,Washington Metropolitan Area Transit Authority (Metro),https://www.tripadvisor.com/Attraction_Review-g28970-d8481891-Reviews-Washington_Metropolitan_Area_Transit_Authority_Metro-Washington_DC_District_of_Col.html,6,"The Metro system in Washington DC is excellent. The stations are clean, large and easy to navigate. You can use your credit card to tap in and out which makes ...",neutral,False
2026-05-03,Washington Metropolitan Area Transit Authority,Welcome to the Washington Metropolitan Area Transit ...,https://www.wmatc.gov/,7,The Washington Metropolitan Area Transit Commission (WMATC) was established in 1960 pursuant to the Washington Metropolitan Area Transit Regulation Compact.,positive,False
2026-05-03,OMNY,OMNY,https://omny.info/,1,One secure account to manage your travel · Reload your OMNY card · Track progress toward your 7-day fare cap · Manage your travel cards · Contact customer ...,positive,True
2026-05-03,OMNY,Fair Fares & OMNY,https://www.nyc.gov/site/fairfares/OMNY/omny.page,2,"Yes. OMNY is the new payment method and will replace MetroCard. You will need to use OMNY to ride on NYC Transit subways and local, limited and Select Bus ...",positive,False
2026-05-03,OMNY,OMNY,https://en.wikipedia.org/wiki/OMNY,3,OMNY is a contactless fare-payment system that has been implemented for use on public transit in the New York metropolitan area. OMNY can currently be used ...,neutral,False
2026-05-03,OMNY,Tap and ride to pay your fare,https://www.mta.info/fares-tolls/subway-bus/tap-and-ride,4,"You can buy or reload an OMNY Card at vending machines in any subway station. As a limited-time introductory offer, you can buy a new reloadable card for $1.",positive,True
2026-05-03,OMNY,r/OMNY,https://www.reddit.com/r/OMNY/,5,r/OMNY: All things related to the OMNY payment card system in the New York Metro.,neutral,False
2026-05-03,CTA,Chicago Transit Authority - CTA Buses & Train Service - 1-888 ...,https://www.transitchicago.com/,1,"Information about CTA bus and train service in and around Chicago. Find maps, schedules, service alerts, plan a trip, jobs, news and more!",positive,True
2026-05-03,CTA,California Teachers Association,https://www.cta.org/,2,"CTA has led the labor movement for more than 150 years, fighting for educators' rights and the rights for every public school student to have access to quality ...",positive,True
2026-05-03,CTA,Select Route,https://www.ctabustracker.com/bustime/wireless/html/home.jsp,3,1 - Bronzeville/Union Station · 2 - Hyde Park Express · 3 - King Drive · 4 - Cottage Grove · X4 - Cottage Grove Express · N5 - South Shore Night Bus · 6 - ...,positive,True
2026-05-03,CTA,Chicago Transit Authority,https://en.wikipedia.org/wiki/Chicago_Transit_Authority,4,"The Chicago Transit Authority (CTA) is a public transit agency in Chicago, Illinois, United States. It operates the Chicago ""L"" rail system and CTA bus services ...",neutral,False
2026-05-03,CTA,r/cta,https://www.reddit.com/r/cta/,5,I know CTA usually lets trains hit a top speed of 45 mph on elevated tracks that are on steel structures (55 mph on elevated concrete structures). Going ...,neutral,False
2026-05-03,CTA,Chicago Transit Authority (@chicagocta),https://www.instagram.com/chicagocta/,6,Official account of the Chicago Transit Authority Past & Present pics ℹ️ Info on news & updates · More uniformed police officers are now on CTA platforms and ...,positive,True
2026-05-03,DC Metro,WMATA: Home,https://www.wmata.com/,1,Metro Home. Washington Metropolitan Area Transit Authority. Open Mobile Menu. Manage Your SmarTrip Account · Get a SmarTrip Card · Service · Rail · Bus ...,positive,True
2026-05-03,DC Metro,"Navigating Washington, DC's Metro System",https://washington.org/navigating-dc-metro,2,"Find out everything you need to know to ride DC's world-class Metrorail system, get a Metro map, check operating hours, ride fares and more.",neutral,False
2026-05-03,DC Metro,Washington Metro,https://en.wikipedia.org/wiki/Washington_Metro,3,a rapid transit system serving the Washington metropolitan area of the United States. It is administered by the Washington Metropolitan Area Transit Authority ...,neutral,False
2026-05-03,NYC Subway,New York City,https://en.wikipedia.org/wiki/New_York_City,1,"New York, often called New York City (NYC), is the most populous city in the United States. It is located at the southern tip of New York State on New York ...",neutral,False
2026-05-03,NYC Subway,Official Website of New York City Government - nyc.gov,https://www.nyc.gov/main,2,"On the homepage of nyc.gov, you can check today's statuses for parking, schools, and trash collection. You can also access popular services, news, ...",neutral,False
2026-05-03,NYC Subway,NYC Tourism + Conventions | Explore the Best Things to Do in ...,https://www.nyctourism.com/,3,"Experience the five boroughs of New York City with NYC Tourism. Find out what to do, where to go, where to stay, and what to eat in NYC from NYC's official ...",positive,False
2026-05-03,NYC Subway,r/nyc,https://www.reddit.com/r/nyc/,4,"r/nyc: r/nyc, the subreddit about New York City.",neutral,False
2026-05-03,NYC Subway,New York City Department of Parks & Recreation,https://www.nycgovparks.org/,5,"Join a Recreation Center. Achieve your fitness goals! Become a rec center member and get the best fitness deal in the city. Where to Swim, Bike, ...",neutral,False
2026-05-03,NYC Subway,Explore New York Attractions & Things To Do | Hotels & Events,https://www.iloveny.com/,6,"World-famous museums, shopping, shows and sports dazzle visitors while celebrity restaurants, food courts, trucks, and festivals present delicious diversity.",positive,False
2026-05-03,NYC Subway,NYC Open Data -,https://opendata.cityofnewyork.us/,7,Open Data is free public data published by New York City agencies and other partners. Attend a training class or sign up for the NYC Open Data mailing list.,neutral,False
2026-05-03,NYC Subway,The State of New York - Manhattan - NY.Gov,https://www.ny.gov/counties/new-york,8,"New York County is the most densely populated county in the United States, more dense than any individual American city.",neutral,False
2026-05-03,The L,THE Definition & Meaning,https://www.merriam-webster.com/dictionary/the,1,The meaning of THE is —used as a function word to indicate that a following noun or noun equivalent is definite or has been previously specified by context ...,neutral,False
2026-05-03,The L,The - Wikipedia,https://en.wikipedia.org/wiki/The,2,"The is a grammatical article in English, denoting nouns that are already or about to be mentioned, under discussion, implied or otherwise presumed familiar to ...",neutral,False
2026-05-03,The L,Pronunciation of the word 'the'. : r/ENGLISH,https://www.reddit.com/r/ENGLISH/comments/1dtdrdr/pronunciation_of_the_word_the/,3,"People have stopped using the long form of 'the' (sounds like thee) in front of words beginning with a vowel, such as 'thuh orchestra' instead of 'thee ...",neutral,False
2026-05-03,The L,THE Definition & Meaning,https://www.dictionary.com/browse/the,4,"definite article (used, especially before a noun, with a specifying or particularizing effect, as opposed to the indefinite or generalizing force of the ...",neutral,False
2026-05-03,The L,"the - Wiktionary, the free dictionary",https://en.wiktionary.org/wiki/the,5,the · Translingual · English · Crimean Gothic · Danish · Eastern Arrernte · Hadza · Interlingua ...,positive,False
2026-05-03,The L,The Atlantic,https://www.theatlantic.com/,6,"The Atlantic covers news, politics, culture, technology, health, and more, through its articles, podcasts, videos, and flagship magazine.",neutral,False
2026-05-03,The L,Times Higher Education (THE),https://www.timeshighereducation.com/,7,"Empowering Global Higher Education. From powerful, data-driven insights and strategic consultancy support to agenda-setting events and hiring solutions.",neutral,False
2026-05-03,MTA,MTA: Home - NYC,https://www.mta.info/,1,"Plan a trip, see saved trips, you haven't saved any trips yet. Plan a trip or go to Schedules and save it for quick access in the future.",positive,True
2026-05-03,MTA,Maryland Transit Administration,https://www.mta.maryland.gov/,2,Routes & Schedules · Real Time · Service Alerts (5) · Human Trafficking GET HELP · Customer Service Promise · Help Stop Fraud in State Government. The Maryland ...,positive,True
2026-05-03,MTA,Metropolitan Transportation Authority,https://en.wikipedia.org/wiki/Metropolitan_Transportation_Authority,3,The Metropolitan Transportation Authority (MTA) is a public benefit corporation in New York State responsible for public transportation in the New York City ...,neutral,False
2026-05-03,MTA,MTA (@mta) • Instagram photos and videos,https://www.instagram.com/mta/,4,Visit mta.info for service info. Download our apps (MTA and TrainTime) for real-time customer care. Take the Customers Count survey ⬇️ ...,positive,True
2026-05-03,MTA,Metropolitan Transportation Authority Careers,https://careers.mta.org/,5,"The MTA family includes professionals in a variety of positions, from bus and train operators to engineers, accountants, and policy experts.",positive,True
2026-05-03,MTA,Massachusetts Teachers Association | Massachusetts ...,https://www.massteacher.org/,6,"MTA provides high-quality professional development and union education for members and leaders. Through in-person and online training, tools, and resources, ...",neutral,False
2026-05-03,MTA,Home - MTA FlintMTA Flint,https://www.mtaflint.org/,7,14 fixed routes throughout the City of Flint with routes and schedules. Regional Routes Direct round-trip connection to places outside of Genesee County.,positive,True
2026-05-03,MBTA,MBTA - Massachusetts Bay Transportation Authority,https://www.mbta.com/,1,"Public transit in the Greater Boston region. Routes, schedules, trip planner, fares, service alerts, real-time updates, and general information.",positive,True
2026-05-03,MBTA,Massachusetts Bay Transportation Authority - MBTA,https://www.facebook.com/TheMBTA/,2,"Massachusetts Bay Transportation Authority - MBTA, Boston. 35545 likes · 1375 talking about this · 178 were here. The official Facebook Page of the...",positive,True
2026-05-03,MBTA,r/mbta,https://www.reddit.com/r/mbta/,3,"r/mbta: See MBTA news, policy discussion, service alerts, and a bit of everything in between for public transportation in Boston, Massachusetts and…",neutral,False
2026-05-03,MBTA,MBTA Go — Official - Apps on Google Play,https://play.google.com/store/apps/details?id=com.mbta.tid.mbta_app&hl=en_US,4,"Check live arrival times, get the latest estimates of when your bus or train will get to you, track your vehicle, check how many stops away your bus or train ...",positive,True
2026-05-03,MBTA,Massachusetts Bay Transportation Authority (MBTA),https://www.mass.gov/orgs/massachusetts-bay-transportation-authority,5,"The MBTA provides subway, bus, Commuter Rail, ferry, and paratransit service to eastern Massachusetts and parts of Rhode Island.",neutral,False
2026-05-03,MBTA,Massachusetts Bay Transportation Authority,https://en.wikipedia.org/wiki/Massachusetts_Bay_Transportation_Authority,6,"The public agency responsible for operating most public transportation services in Greater Boston, Massachusetts.",neutral,False
2026-05-03,MBTA,MBTA - Massachusetts Bay Transportation Authority,https://www.mbta.com/,1,"Public transit in the Greater Boston region. Routes, schedules, trip planner, fares, service alerts, real-time updates, and general information.",positive,True
2026-05-03,MBTA,Massachusetts Bay Transportation Authority - MBTA,https://www.facebook.com/TheMBTA/,2,"Massachusetts Bay Transportation Authority - MBTA, Boston. 35545 likes · 1375 talking about this · 178 were here. The official Facebook Page of the...",positive,True
2026-05-03,MBTA,r/mbta,https://www.reddit.com/r/mbta/,3,"r/mbta: See MBTA news, policy discussion, service alerts, and a bit of everything in between for public transportation in Boston, Massachusetts and…",neutral,False
2026-05-03,MBTA,MBTA Go — Official - Apps on Google Play,https://play.google.com/store/apps/details?id=com.mbta.tid.mbta_app&hl=en_US,4,"Check live arrival times, get the latest estimates of when your bus or train will get to you, track your vehicle, check how many stops away your bus or train ...",positive,True
2026-05-03,MBTA,Massachusetts Bay Transportation Authority (MBTA),https://www.mass.gov/orgs/massachusetts-bay-transportation-authority,5,"The MBTA provides subway, bus, Commuter Rail, ferry, and paratransit service to eastern Massachusetts and parts of Rhode Island.",neutral,False
2026-05-03,MBTA,Massachusetts Bay Transportation Authority,https://en.wikipedia.org/wiki/Massachusetts_Bay_Transportation_Authority,6,"The public agency responsible for operating most public transportation services in Greater Boston, Massachusetts.",neutral,False
2026-05-03,MBTA,MBTA - Massachusetts Bay Transportation Authority,https://www.mbta.com/,1,"Public transit in the Greater Boston region. Routes, schedules, trip planner, fares, service alerts, real-time updates, and general information.",positive,True
2026-05-03,MBTA,Massachusetts Bay Transportation Authority - MBTA,https://www.facebook.com/TheMBTA/,2,"Massachusetts Bay Transportation Authority - MBTA, Boston. 35545 likes · 1375 talking about this · 178 were here. The official Facebook Page of the...",positive,True
2026-05-03,MBTA,r/mbta,https://www.reddit.com/r/mbta/,3,"r/mbta: See MBTA news, policy discussion, service alerts, and a bit of everything in between for public transportation in Boston, Massachusetts and…",neutral,False
2026-05-03,MBTA,MBTA Go — Official - Apps on Google Play,https://play.google.com/store/apps/details?id=com.mbta.tid.mbta_app&hl=en_US,4,"Check live arrival times, get the latest estimates of when your bus or train will get to you, track your vehicle, check how many stops away your bus or train ...",positive,True
2026-05-03,MBTA,Massachusetts Bay Transportation Authority (MBTA),https://www.mass.gov/orgs/massachusetts-bay-transportation-authority,5,"The MBTA provides subway, bus, Commuter Rail, ferry, and paratransit service to eastern Massachusetts and parts of Rhode Island.",neutral,False
2026-05-03,MBTA,Massachusetts Bay Transportation Authority,https://en.wikipedia.org/wiki/Massachusetts_Bay_Transportation_Authority,6,"The public agency responsible for operating most public transportation services in Greater Boston, Massachusetts.",neutral,False
2026-05-03,Metrorail,Metrorail,https://www.miamidade.gov/global/transportation/metrorail.page,1,"The Metrorail system is a 25-mile dual track that provides service to Miami International Airport (MIA) and runs from Kendall through South Miami, Coral Gables ...",neutral,False
2026-05-03,Metrorail,Metrorail,https://www.wmata.com/service/rail/,2,"Metrorail provides safe, clean, reliable transit service for more than 600,000 customers a day throughout the Washington, DC area. The system is the second ...",positive,True
2026-05-03,Metrorail,"METRORail | Red Line | Purple Line | Houston, Texas - METRO",https://www.ridemetro.org/riding-metro/transit-services/metrorail,3,"METRORail is Houston's light rail network, offering convenient access to many popular destinations in and around downtown Houston. These include the Texas ...",neutral,False
2026-05-03,Metrorail,Metrorail (Miami-Dade County),https://en.wikipedia.org/wiki/Metrorail_(Miami-Dade_County),4,"Metrorail is a rapid transit system in Miami and Miami-Dade County in the U.S. state of Florida. It is operated by Miami-Dade Transit (MDT), a departmental ...",neutral,False
2026-05-03,Metrorail,"Metro | Bus, Rail, Subway, Bike & Micro in Los Angeles",https://www.metro.net/,5,"Explore Los Angeles by public transit. Start with Metro schedules, maps, arrival times, parking info, trip planning, stations, and fares.",neutral,False
2026-05-03,Metrorail,"Navigating Washington, DC's Metro System",https://washington.org/navigating-dc-metro,6,"The Metrorail consists of six color-coded lines: Red, Blue, Orange, Yellow, Green and Silver. The lines are connected to each other via transfer stations and ...",neutral,False
2026-05-03,Metrorail,Metrorail,https://www.miamiandbeaches.com/l/transportation/metrorail/3040,7,"Metrorail is Miami's quick and easy 25-mile elevated transportation system to get you to all parts of the urban core of Miami from 5:00am to midnight, seven ...",neutral,False
2026-05-03,Metrorail,WMATA: Home,https://www.wmata.com/,8,"Next bus, next train, log in, maps and times, text police, call police, trip planner, from (has autocomplete) map pin to (has autocomplete) map pin.",positive,True
2026-05-03,Metrorail,CapMetro Rail – Capital Metro – Austin Public Transit,https://www.capmetro.org/rail,9,"A train for commuters traveling between Leander and downtown. Whether you're traveling to work or Q2 Stadium, get there quickly and comfortably.",neutral,False
2026-05-03,Metrorail,Metrorail Stations - Miami-Dade County,https://www.miamidade.gov/transportation-publicworks/metrorail-stations.asp,10,"The 22 accessible Metrorail stations are about one-mile apart, providing easy access for bus riders, pedestrians, and passengers being dropped off and ...",neutral,False
2026-05-03,Boston T,MBTA - Massachusetts Bay Transportation Authority,https://www.mbta.com/,1,"Public transit in the Greater Boston region. Routes, schedules, trip planner, fares, service alerts, real-time updates, and general information.",positive,True
2026-05-03,Boston T,MBTA subway,https://en.wikipedia.org/wiki/MBTA_subway,2,"The Massachusetts Bay Transportation Authority (MBTA) operates rapid transit (heavy rail), light rail, and bus rapid transit services in the Boston ...",neutral,False
2026-05-03,Boston T,Boston T Subway Map & Routing - App Store - Apple,https://apps.apple.com/us/app/boston-t-subway-map-routing/id1195886256,3,Navigate the Boston T Subway with offline maps and live departures. Plan your trip today and travel easily. Boston T Subway Map is the navigation app that ...,positive,True
2026-05-03,Boston T,"Boston Subway - The ""T"" - Boston Public Transportation",https://www.boston-discovery-guide.com/boston-subway.html,4,"Boston's subway system - locally we call it the ""T"" - is the easiest and cheapest way to get around the city, aside from walking.",neutral,False
2026-05-03,Boston T,MBTA - Massachusetts Bay Transportation Authority,https://www.mbta.com/,1,"Public transit in the Greater Boston region. Routes, schedules, trip planner, fares, service alerts, real-time updates, and general information.",positive,True
2026-05-03,Boston T,MBTA subway,https://en.wikipedia.org/wiki/MBTA_subway,2,"The Massachusetts Bay Transportation Authority (MBTA) operates rapid transit (heavy rail), light rail, and bus rapid transit services in the Boston ...",neutral,False
2026-05-03,Boston T,Boston T Subway Map & Routing - App Store - Apple,https://apps.apple.com/us/app/boston-t-subway-map-routing/id1195886256,3,Navigate the Boston T Subway with offline maps and live departures. Plan your trip today and travel easily. Boston T Subway Map is the navigation app that ...,positive,True
2026-05-03,Boston T,"Boston Subway - The ""T"" - Boston Public Transportation",https://www.boston-discovery-guide.com/boston-subway.html,4,"Boston's subway system - locally we call it the ""T"" - is the easiest and cheapest way to get around the city, aside from walking.",neutral,False
2026-05-03,Boston T,MBTA - Massachusetts Bay Transportation Authority,https://www.mbta.com/,1,"Public transit in the Greater Boston region. Routes, schedules, trip planner, fares, service alerts, real-time updates, and general information.",positive,True
2026-05-03,Boston T,MBTA subway,https://en.wikipedia.org/wiki/MBTA_subway,2,"The Massachusetts Bay Transportation Authority (MBTA) operates rapid transit (heavy rail), light rail, and bus rapid transit services in the Boston ...",neutral,False
2026-05-03,Boston T,Boston T Subway Map & Routing - App Store - Apple,https://apps.apple.com/us/app/boston-t-subway-map-routing/id1195886256,3,Navigate the Boston T Subway with offline maps and live departures. Plan your trip today and travel easily. Boston T Subway Map is the navigation app that ...,positive,True
2026-05-03,Boston T,"Boston Subway - The ""T"" - Boston Public Transportation",https://www.boston-discovery-guide.com/boston-subway.html,4,"Boston's subway system - locally we call it the ""T"" - is the easiest and cheapest way to get around the city, aside from walking.",neutral,False
2026-05-03,The T,THE Definition & Meaning,https://www.merriam-webster.com/dictionary/the,1,The meaning of THE is —used as a function word to indicate that a following noun or noun equivalent is definite or has been previously specified by context ...,neutral,False
2026-05-03,The T,The - Wikipedia,https://en.wikipedia.org/wiki/The,2,"The is a grammatical article in English, denoting nouns that are already or about to be mentioned, under discussion, implied or otherwise presumed familiar to ...",neutral,False
2026-05-03,The T,Pronunciation of the word 'the'. : r/ENGLISH,https://www.reddit.com/r/ENGLISH/comments/1dtdrdr/pronunciation_of_the_word_the/,3,"People have stopped using the long form of 'the' (sounds like thee) in front of words beginning with a vowel, such as 'thuh orchestra' instead of 'thee ...",neutral,False
2026-05-03,The T,THE Definition & Meaning,https://www.dictionary.com/browse/the,4,"definite article (used, especially before a noun, with a specifying or particularizing effect, as opposed to the indefinite or generalizing force of the ...",neutral,False
2026-05-03,The T,"the - Wiktionary, the free dictionary",https://en.wiktionary.org/wiki/the,5,the · Translingual · English · Crimean Gothic · Danish · Eastern Arrernte · Hadza · Interlingua ...,positive,False
2026-05-03,The T,The Atlantic,https://www.theatlantic.com/,6,"The Atlantic covers news, politics, culture, technology, health, and more, through its articles, podcasts, videos, and flagship magazine.",neutral,False
2026-05-03,The T,How to Pronounce 'The' in English - Pronunciation Guide,https://www.tiktok.com/@antonioparlati/video/7078653970171923718,7,"If the next word starts with a consonant sound, we say ""the"" (pronounced /ðə/). For example, ""the sun"" or ""the cat."" ☀️ On the flip side, if the ...",neutral,False
2026-05-03,The T,THE Definition & Meaning,https://www.merriam-webster.com/dictionary/the,1,The meaning of THE is —used as a function word to indicate that a following noun or noun equivalent is definite or has been previously specified by context ...,neutral,False
2026-05-03,The T,The - Wikipedia,https://en.wikipedia.org/wiki/The,2,"The is a grammatical article in English, denoting nouns that are already or about to be mentioned, under discussion, implied or otherwise presumed familiar to ...",neutral,False
2026-05-03,The T,Pronunciation of the word 'the'. : r/ENGLISH,https://www.reddit.com/r/ENGLISH/comments/1dtdrdr/pronunciation_of_the_word_the/,3,"People have stopped using the long form of 'the' (sounds like thee) in front of words beginning with a vowel, such as 'thuh orchestra' instead of 'thee ...",neutral,False
2026-05-03,The T,THE Definition & Meaning,https://www.dictionary.com/browse/the,4,"definite article (used, especially before a noun, with a specifying or particularizing effect, as opposed to the indefinite or generalizing force of the ...",neutral,False
2026-05-03,The T,"the - Wiktionary, the free dictionary",https://en.wiktionary.org/wiki/the,5,the · Translingual · English · Crimean Gothic · Danish · Eastern Arrernte · Hadza · Interlingua ...,positive,False
2026-05-03,The T,The Atlantic,https://www.theatlantic.com/,6,"The Atlantic covers news, politics, culture, technology, health, and more, through its articles, podcasts, videos, and flagship magazine.",neutral,False
