date,ceo,company,title,url,position,snippet,sentiment,controlled
2026-05-29,Phillip Eng,Boston T,Phillip Eng | People,https://www.mbta.com/people/phillip-eng,1,Phillip Eng is the General Manager and CEO of the Massachusetts Bay Transportation Authority (MBTA). A Civil Engineer with nearly 40 years of transportation ...,positive,True
2026-05-29,Phillip Eng,Boston T,Phillip Eng,https://en.wikipedia.org/wiki/Phillip_Eng,2,Phillip Eng (born 1961 or 1962) is an American civil engineer and transit executive serving as interim secretary of Massachusetts Department of ...,neutral,False
2026-05-29,Phillip Eng,Boston T,Did Phillip Eng fix the MBTA? Reliability and passenger ...,https://www.cbsnews.com/boston/news/mbta-general-manager-phillip-eng/,3,"Phillip Eng, the New Yorker who came out of retirement to fix the MBTA is getting rave reviews.",neutral,False
2026-05-29,Phillip Eng,Boston T,Phillip Eng - MassDOT and MBTA,https://www.linkedin.com/in/phillip-eng-875928240,4,Experience: MassDOT and MBTA · Education: The Cooper Union for the Advancement of Science and Art · Location: Boston · 500+ connections on LinkedIn.,positive,True
2026-05-29,Phillip Eng,Boston T,Governor Healey Appoints MBTA General Manager Phil ...,https://www.mass.gov/news/governor-healey-appoints-mbta-general-manager-phil-eng-as-interim-transportation-secretary,5,Highway Administrator Jonathan Gulliver promoted to Undersecretary of Transportation; Interim Secretary and GM Eng to hold media ...,neutral,False
2026-05-29,Phillip Eng,Boston T,Phil Eng earns rave reviews for simultaneous MBTA ...,https://commonwealthbeacon.org/transportation/interim-or-indefinite-no-end-in-sight-to-phil-engs-double-duty/,6,The Healey administration seems content to have Phil Eng continue to work as both T general manager and interim transportation secretary for ...,neutral,False
2026-05-29,Phillip Eng,Boston T,The MBTA has made incredible strides. Did Phillip Eng fix ...,https://www.reddit.com/r/mbta/comments/1pokx9x/the_mbta_has_made_incredible_strides_did_phillip/,7,"165 votes, 33 comments. Eng is great. He's done tremendous things. I don't think his influence can be overstated.",neutral,False
2026-05-29,Phillip Eng,Boston T,Phillip Eng,https://www.massport.com/our-business/leadership/phillip-eng,8,Phillip Eng leads Massachusetts' transportation network as Interim Secretary of Transportation and General Manager of the MBTA.,positive,True
2026-05-29,Phillip Eng,Boston T,To a T: How Phillip Eng got Boston's subway system back ...,https://www.csmonitor.com/Business/2025/1115/boston-mbta-phillip-eng,9,Many now see America's oldest subway system as a model for repairing the country's crumbling transportation infrastructure – a huge ...,neutral,False
2026-05-29,Ryan Coholan,Massachusetts Bay Transportation Authority,Ryan Coholan - Chief Operating Officer at MBTA,https://www.linkedin.com/in/ryan-coholan-139014ab,1,Experienced Chief Operating Officer with a demonstrated history of working in the transportation/trucking/railroad industry.,positive,True
2026-05-29,Ryan Coholan,Massachusetts Bay Transportation Authority,Ryan Coholan - Massachusetts Bay Transportation Authority ...,https://cthrupayroll.mass.gov/?os=shmmfp&ref=app#!/year/2024/full_time_employees%2Cothers/pay1%2Cpay2%2Cpay3%2Cpay4/explore%2F0-0-0%2Ftrans_no%2F17915261%2F0%2Fdepartment_division,2,"Pay Check · Coholan · Ryan · MBTA Exec Main Fund · $299,084.71 · $299,084.71 $299,084.71. « ‹ 1; ›; ». Payroll Details. Total Pay. $ 299,085. Base Pay. $299,085.",positive,False
2026-05-29,Ryan Coholan,Massachusetts Bay Transportation Authority,Conversation with MBTA's COO Ryan Coholan,https://transitunplugged.com/transit-unplugged-podcast/ryan-coholan-mbta/,3,"Host Paul Comfort sits down with Ryan Coholan, the Chief Operating Officer of the Massachusetts Bay Transportation Authority (MBTA or The T) in Boston.",neutral,False
2026-05-29,Ryan Coholan,Massachusetts Bay Transportation Authority,Did you know? Single track operations keeps riders moving ...,https://www.facebook.com/TheMBTA/videos/single-track-operations-with-coo-ryan-coholan/907055678496912/,4,"Hello, my name is Ryan Coholan. I'm the Chief Operating Officer for the MBTA. Tonight, we're down at Wollaston station on the Red Line Braintree ...",positive,True
2026-05-29,Ryan Coholan,Massachusetts Bay Transportation Authority,Ryan Coholan - Chief Operating Officer at Massachusetts ...,https://www.zoominfo.com/p/Ryan-Coholan/11957181347,5,"Coholan is a Chief Operating Officer at Massachusetts Bay Transportation Authority. Coholan directs, plans, and supervises operations for a significant commuter ...",neutral,False
2026-05-29,Ryan Coholan,Massachusetts Bay Transportation Authority,MBTA COO Ryan Coholan talks South Coast Rail from ...,https://www.heraldnews.com/picture-gallery/news/2026/03/24/mbta-coo-ryan-coholan-talks-south-coast-rail-from-boston-to-fall-river/89294351007/,6,"MBTA Chief Operating Officer Ryan Coholan and a Keolis employee walk past a commuter rail train at South Station, Boston, on March 10, 2026.",neutral,False
2026-05-29,Ryan Coholan,Massachusetts Bay Transportation Authority,The MBTA Advisory Board,https://mbtaadvisoryboard.org/wp-content/uploads/2024/04/MinutesMBTAAB-12-05-23APPROVED.pdf,7,Coholan is responsible for the operation of all MBTA modes. He was appointed. COO by General Manager Philip Eng in September 2023. Mr. Coholan introduced his ...,neutral,False
2026-05-29,Ryan Coholan,Massachusetts Bay Transportation Authority,"Today, COO Ryan Coholan joined State Senator ...",https://www.instagram.com/p/DPWzqsCEoZw/,8,"Today, COO Ryan Coholan joined State Senator @barryfinegoldma ... The Massachusetts Bay Transportation Authority, or MBTA, announced ...",positive,True
2026-05-29,Ryan Coholan,Massachusetts Bay Transportation Authority,Approval – Request for Rewrite of CAP related to Finding 3 ...,https://www.transit.dot.gov/sites/fta.dot.gov/files/2023-10/Approval-Request-for-Rewrite-of-CAP-related-to-Finding-3-of-Special-Directive-22-12-Operating-Conditions-and-Policies-Procedures-and-Training.pdf,9,"the Massachusetts Bay Transportation Authority (MBTA) to submit a revised corrective action ... Ryan Coholan, Chief Operating Officer, MBTA. Timothy Lesniak ...",positive,False
2026-05-29,Ryan Coholan,Massachusetts Bay Transportation Authority,Cultivating Culture at the MBTA with COO Ryan Coholan,https://soundcloud.com/spilling-the-t-podcast/cultivating-culture-at-the-mbta-with-coo-ryan-coholan,10,"On this episode, Chief Operating Officer Ryan Coholan joins us to discuss his unique approach to leading Operations at the MBTA.",neutral,False
2026-05-29,Monica Tibbits-Nutt,The T,Monica Tibbits-Nutt,https://www.massport.com/our-business/leadership/monica-tibbits-nutt,1,"Monica G. Tibbits-Nutt, is the Secretary and CEO of the Massachusetts Department of Transportation (MassDOT).",positive,True
2026-05-29,Monica Tibbits-Nutt,The T,"Monica Tibbits-Nutt, FAICP, LEED AP BD C",https://www.linkedin.com/in/monica-tibbits-nutt,2,"Monica Tibbits-Nutt, FAICP, LEED AP BD C · Transportation Executive | Growth & Sales Leader | Strategic Client Advisor | Rail, Transit & Infrastructure · View ...",positive,True
2026-05-29,Monica Tibbits-Nutt,The T,Transportation Sec. Monica Tibbits-Nutt Stepping Down ...,https://mass.streetsblog.org/2025/10/16/rearranging-the-cabinet-transportation-sec-monica-tibbits-nutt-stepping-down-replaced-by-mbta-gm-phillip-eng,3,Secretary of Transportation Monica Tibbits-Nutt is leaving the Healey administration. Governor Maura Healey announced this morning in a ...,neutral,False
2026-05-29,Monica Tibbits-Nutt,The T,MassFiscal Responds to Departure of Transportation ...,https://www.massfiscal.org/massfiscal-responds-departure-monica-tibbits-nutt,4,Tibbits-Nutt Exit is “Long Overdue”. The Massachusetts Fiscal Alliance today responded to news that Secretary of Transportation Monica ...,neutral,False
2026-05-29,Monica Tibbits-Nutt,The T,Monica Tibbits-Nutt Steps Down as MassDOT Secretary,https://aptapassengertransport.com/monica-tibbits-nutt-steps-down-as-massdot-secretary-phil-eng-named-interim/,5,Tibbits-Nutt will continue as an advisor through Dec. 31 to ensure an efficient transition. Governor Healey appointed Phil Eng as MBTA general ...,neutral,False
2026-05-29,Monica Tibbits-Nutt,The T,"Monica Tibbits-Nutt made history as the first Queer, Black ...",https://www.linkedin.com/posts/lauren-melendez-53690475_monica-tibbits-nutt-made-history-as-the-first-activity-7301335136107720704-9AIP,6,"Monica Tibbits-Nutt made history as the first Queer, Black woman to be named Secretary of Transportation for the Commonwealth.",positive,True
2026-05-29,Monica Tibbits-Nutt,The T,Disgraced former Transportation Secretary Monica Tibbits ...,https://www.bostonherald.com/2026/01/07/disgraced-former-transportation-secretary-monica-tibbits-nutt-officially-off-state-payroll/,7,Former Transportation Secretary Monica Tibbits-Nutt is officially off the state employee payroll after resigning in disgrace in October and ...,negative,False
2026-05-29,Monica Tibbits-Nutt,The T,Massachusetts Governor Appoints Tibbits-Nutt as ...,https://acppubs.com/NEC/article/9F4D65EF-massachusetts-governor-appoints-tibbits-nutt-as-secretary-of-transportation,8,"BOSTON, MA — Governor Maura T. Healey announces that she is appointing Monica Tibbits-Nutt, AICP, LEED AP BD+C as Secretary of the Massachusetts Department ...",neutral,False
2026-05-29,Nora Leerhsen,CTA,Nora Leerhsen,https://en.wikipedia.org/wiki/Nora_Leerhsen,1,"Nora Leerhsen is an American lawyer and executive who has served as the Acting President of the Chicago Transit Authority (CTA) since February 2025, ...",neutral,False
2026-05-29,Nora Leerhsen,CTA,Nora Leerhsen - Chicago Transit Authority,https://www.linkedin.com/in/nora-leerhsen-1ba38847,2,Experience: Chicago Transit Authority · Education: University of Wisconsin Law School · Location: Greater Chicago Area · 500+ connections on LinkedIn.,positive,True
2026-05-29,Nora Leerhsen,CTA,CTA Governance/Administration,https://www.transitchicago.com/governance/,3,"Nora joined the CTA in 2014 and is an 11-year public transit veteran. She is the first woman to lead the CTA in the agency's history. Under Nora's leadership, ...",positive,True
2026-05-29,Nora Leerhsen,CTA,Team | Chicago Transit Authority,https://www.ctabonds.com/chicago-transit-authority-il/about/our-team/i6552,4,"Leerhsen joined the CTA in 2014 and has served in various roles prior to becoming chief of staff in 2018, including senior advisor to the chief of staff/chief ...",positive,True
2026-05-29,Nora Leerhsen,CTA,How do we think interim CTA president Nora Leerhsen is ...,https://www.reddit.com/r/chicago/comments/1ldou75/how_do_we_think_interim_cta_president_nora/,5,"While I know she worked under Dorval Carter, I think she has been a breath of fresh air. She is way more visible and actually seems to want to understand ...",neutral,False
2026-05-29,Nora Leerhsen,CTA,A message from CTA Acting President Nora Leerhsen: On ...,https://www.facebook.com/thecta/posts/a-message-from-cta-acting-president-nora-leerhsenon-transit-employee-appreciatio/1351237193704962/,6,"My message was simple: Thank you for your welcoming smiles. Thank you for making smart, safe decisions in sometimes challenging scenarios. Thank ...",positive,True
2026-05-29,Nora Leerhsen,CTA,Acting CTA chief makes her case for keeping the ...,https://chicago.suntimes.com/city-hall/2025/07/30/interim-cta-president-nora-leerhsen-permanent-post-dorval-carter,7,"Leerhsen is an attorney and former public school teacher who has spent the last decade at the CTA, including a stint as Carter's chief of staff.",neutral,False
2026-05-29,Nora Leerhsen,CTA,Chicago Mayor Brandon Johnson joined CTA Acting ...,https://www.instagram.com/p/DXcUlp1GsBE/,8,Chicago Mayor Brandon Johnson joined CTA Acting President Nora Leerhsen and a host of civic and community leaders to kick off the 2026 ...,positive,True
2026-05-29,Monica Tibbits-Nutt,Massachusetts Bay Transportation Authority,Monica Tibbits-Nutt,https://www.massport.com/our-business/leadership/monica-tibbits-nutt,1,"Monica G. Tibbits-Nutt, is the Secretary and CEO of the Massachusetts Department of Transportation (MassDOT).",positive,True
2026-05-29,Monica Tibbits-Nutt,Massachusetts Bay Transportation Authority,Transportation Sec. Monica Tibbits-Nutt Stepping Down ...,https://mass.streetsblog.org/2025/10/16/rearranging-the-cabinet-transportation-sec-monica-tibbits-nutt-stepping-down-replaced-by-mbta-gm-phillip-eng,2,Secretary of Transportation Monica Tibbits-Nutt is leaving the Healey administration. Governor Maura Healey announced this morning in a ...,neutral,False
2026-05-29,Monica Tibbits-Nutt,Massachusetts Bay Transportation Authority,Governor Healey Appoints MBTA General Manager Phil ...,https://www.mass.gov/news/governor-healey-appoints-mbta-general-manager-phil-eng-as-interim-transportation-secretary,3,... Bay Transportation Authority (MBTA) General Manager Phillip Eng as Interim Transportation Secretary. Monica Tibbits-Nutt has made the ...,neutral,False
2026-05-29,Monica Tibbits-Nutt,Massachusetts Bay Transportation Authority,A Conversation with MassDOT Secretary Monica Tibbits ...,https://members.naiopma.org/event-calendar/Details/a-conversation-with-massdot-secretary-monica-tibbits-nutt-and-mbta-general-manager-phillip-eng-1055406?sourceTypeId=EmailInvitation,4,Join NAIOP for an exciting conversation with Massachusetts Secretary of Transportation Monica Tibbits-Nutt and Massachusetts Bay Transit Authority ...,neutral,False
2026-05-29,Monica Tibbits-Nutt,Massachusetts Bay Transportation Authority,Governor Healey Appoints Monica Tibbits-Nutt as ...,https://www.linkedin.com/posts/mbta_governor-healey-appoints-monica-tibbits-nutt-activity-7129951277458857984-QHjy,5,Governor Healey announced the official appointment of Monica Tibbits-Nutt to Secretary of Transportation and member of the MBTA Board of Directors.,positive,True
2026-05-29,Monica Tibbits-Nutt,Massachusetts Bay Transportation Authority,"MassDOT secretary Tibbits-Nutt steps down, MBTA chief ...",https://www.reddit.com/r/boston/comments/1o876bw/massdot_secretary_tibbitsnutt_steps_down_mbta/,6,"MassDOT secretary Tibbits-Nutt steps down, MBTA chief Eng announced as interim replacement ... Archived post. New comments cannot be posted and ...",neutral,False
2026-05-29,Monica Tibbits-Nutt,Massachusetts Bay Transportation Authority,MassFiscal Responds to Departure of Transportation ...,https://www.massfiscal.org/massfiscal-responds-departure-monica-tibbits-nutt,7,Tibbits-Nutt Exit is “Long Overdue”. The Massachusetts Fiscal Alliance today responded to news that Secretary of Transportation Monica ...,neutral,False
2026-05-29,Monica Tibbits-Nutt,Massachusetts Bay Transportation Authority,Leadership at The MBTA,https://mbta.getanchor.io/leadership.html,8,The MBTA is overseen by the Massachusetts Bay Transportation Authority Board of Directors. Monica Tibbits-Nutt is the Secretary and CEO of the Massachusetts ...,neutral,False
2026-05-29,Monica Tibbits-Nutt,Massachusetts Bay Transportation Authority,Massachusetts Department of Transportation Secretary ...,https://www.facebook.com/Boston25News/posts/massachusetts-department-of-transportation-secretary-monica-tibbits-nutt-will-st/1277702777724719/,9,Massachusetts Department of Transportation Secretary Monica Tibbits-Nutt will step down from her position and MBTA General Manager Phillip ...,positive,True
2026-05-29,Ryan Coholan,MBTA,Ryan Coholan - Chief Operating Officer at MBTA,https://www.linkedin.com/in/ryan-coholan-139014ab,1,Experienced Chief Operating Officer with a demonstrated history of working in the transportation/trucking/railroad industry.,positive,True
2026-05-29,Ryan Coholan,MBTA,Ryan Coholan - Massachusetts Bay Transportation Authority ...,https://cthrupayroll.mass.gov/?os=shmmfp&ref=app#!/year/2024/full_time_employees%2Cothers/pay1%2Cpay2%2Cpay3%2Cpay4/explore%2F0-0-0%2Ftrans_no%2F17915261%2F0%2Fdepartment_division,2,Ryan Coholan - Massachusetts Bay Transportation Authority (MBT) - Chief Operating Officer Massachusetts Bay Transportation Authority (MBT).,positive,False
2026-05-29,Ryan Coholan,MBTA,CCMRRCAM praises MBTA's Ryan Coholan for innovative ...,https://www.facebook.com/ccmrrcam/posts/when-it-comes-to-making-a-meaningful-difference-about-how-the-mbta-serves-the-ci/1285749126448679/,3,"When it comes to making a meaningful difference about how the MBTA serves the citizens of the Commonwealth, the CCMRRCAM would like to point out that ...",positive,True
2026-05-29,Ryan Coholan,MBTA,Conversation with MBTA's COO Ryan Coholan,https://transitunplugged.com/transit-unplugged-podcast/ryan-coholan-mbta/,4,"Host Paul Comfort sits down with Ryan Coholan, the Chief Operating Officer of the Massachusetts Bay Transportation Authority (MBTA or The T) in Boston.",neutral,False
2026-05-29,Ryan Coholan,MBTA,MBTA COO Ryan Coholan talks South Coast Rail from ...,https://www.heraldnews.com/picture-gallery/news/2026/03/24/mbta-coo-ryan-coholan-talks-south-coast-rail-from-boston-to-fall-river/89294351007/,5,"MBTA Chief Operating Officer Ryan Coholan operates a commuter rail train at South Station, Boston, on March 10, 2026. Dan Medeiros.",neutral,False
2026-05-29,Ryan Coholan,MBTA,The MBTA Advisory Board,https://mbtaadvisoryboard.org/wp-content/uploads/2024/04/MinutesMBTAAB-12-05-23APPROVED.pdf,6,Coholan is responsible for the operation of all MBTA modes. He was appointed. COO by General Manager Philip Eng in September 2023. Mr. Coholan introduced his ...,positive,True
2026-05-29,Ryan Coholan,MBTA,"Today, COO Ryan Coholan joined State Senator ...",https://www.instagram.com/p/DPWzqsCEoZw/,7,"Today, COO Ryan Coholan joined State Senator ... mbta.com/news #MBTA #PublicTransportation #WilmingtonMA #TAccess #Accessibility ...",positive,True
2026-05-29,Ryan Coholan,MBTA,Cultivating Culture at the MBTA with COO Ryan Coholan,https://soundcloud.com/spilling-the-t-podcast/cultivating-culture-at-the-mbta-with-coo-ryan-coholan,8,"On this episode, Chief Operating Officer Ryan Coholan joins us to discuss his unique approach to leading Operations at the MBTA.",neutral,False
2026-05-29,Janno Lieber,MTA,Janno Lieber,https://en.wikipedia.org/wiki/Janno_Lieber,1,"John Nathan ""Janno"" Lieber (born September 19, 1961) is the head of the Metropolitan Transportation Authority (MTA) in New York.",neutral,False
2026-05-29,Janno Lieber,MTA,Janno Lieber,https://www.mta.info/transparency/leadership/executive-leadership/janno-lieber,2,John (“Janno”) Lieber was confirmed as Chair and CEO of the Metropolitan Transportation Authority (MTA) in January 2022.,positive,True
2026-05-29,Janno Lieber,MTA,Janno Lieber - Chair & CEO at New York Metropolitan ...,https://www.linkedin.com/in/janno-lieber-32b487158,3,"Chair & CEO at New York Metropolitan Transportation Authority · An accomplished executive working at the intersection of government, real estate and law.",positive,True
2026-05-29,Janno Lieber,MTA,"Janno Lieber on Free Buses, the State of the MTA, & The ...",https://nyeditorialboard.substack.com/p/janno-lieber-on-free-buses-the-state,4,"Janno Lieber, Chair and CEO of the Metropolitan Transportation Authority (MTA), which runs the New York City subways and buses, ...",positive,False
2026-05-29,Janno Lieber,MTA,What's your thoughts and opinions on MTA CEO Janno ...,https://www.reddit.com/r/nycrail/comments/1qninf7/whats_your_thoughts_and_opinions_on_mta_ceo_janno/,5,Janno is the most competent leader the MTA has had in generations. He truly cares about the system and regularly rides it (which a surprising ...,neutral,False
2026-05-29,Janno Lieber,MTA,AMA with Janno Lieber,https://www.youtube.com/watch?v=Towzv4JSSFE,6,I'm Jano Liieber i'm the MTA chair and CEO and today I'm answering questions that came to us on social media.,neutral,False
2026-05-29,Janno Lieber,MTA,"Janno Lieber, Chair & CEO of the Metropolitan ...",https://skyscraper.org/featured/2025/,7,"Lieber has tackled and delivered many of the city's most complex transit projects - from 2017 as head of MTA Construction & Development agency, and since 2021 ...",neutral,False
2026-05-29,Janno Lieber,MTA,INTERVIEW: MTA Chair Janno Lieber Talks to Streetsblog to ...,https://nyc.streetsblog.org/2026/01/21/interview-mta-chair-janno-lieber-talks-to-streetsblog-to-mark-four-years-at-the-top,8,"On Tuesday, Janno Lieber started his fifth year as the MTA's permanent Chairman and CEO — the longest stretch that a single person has held the ...",neutral,False
2026-05-29,Janno Lieber,MTA,"Today, MTA Chair and CEO Janno Lieber, MTA New York ...",https://www.facebook.com/mta/posts/today-mta-chair-and-ceo-janno-lieber-mta-new-york-city-transit-president-demetri/1295307629300719/,9,"Today, MTA Chair and CEO Janno Lieber, MTA New York City Transit President Demetrius Crichlow, and MTA Construction & Development President ...",positive,True
2026-05-29,Ryan Coholan,The T,Ryan Coholan - Chief Operating Officer at MBTA,https://www.linkedin.com/in/ryan-coholan-139014ab,1,"Experienced Chief Operating Officer with a demonstrated history of working in the transportation/trucking/railroad industry. Skilled in Budgeting, Operations ...",positive,True
2026-05-29,Ryan Coholan,The T,MBTA COO Ryan Coholan talks South Coast Rail from ...,https://www.heraldnews.com/picture-gallery/news/2026/03/24/mbta-coo-ryan-coholan-talks-south-coast-rail-from-boston-to-fall-river/89294351007/,2,"MBTA Chief Operating Officer Ryan Coholan operates a commuter rail train at South Station, Boston, on March 10, 2026. Dan Medeiros.",neutral,False
2026-05-29,Ryan Coholan,The T,Ryan Coholan - Massachusetts Bay Transportation Authority ...,https://cthrupayroll.mass.gov/?os=shmmfp&ref=app#!/year/2024/full_time_employees%2Cothers/pay1%2Cpay2%2Cpay3%2Cpay4/explore%2F0-0-0%2Ftrans_no%2F17915261%2F0%2Fdepartment_division,3,"Pay Check · Coholan · Ryan · MBTA Exec Main Fund · $299,084.71 · $299,084.71 $299,084.71. « ‹ 1; ›; ». Payroll Details. Total Pay. $ 299,085. Base Pay. $299,085.",positive,False
2026-05-29,Ryan Coholan,The T,CCMRRCAM praises MBTA's Ryan Coholan for innovative ...,https://www.facebook.com/ccmrrcam/posts/when-it-comes-to-making-a-meaningful-difference-about-how-the-mbta-serves-the-ci/1285749126448679/,4,"When it comes to making a meaningful difference about how the MBTA serves the citizens of the Commonwealth, the CCMRRCAM would like to point out that ...",positive,True
2026-05-29,Ryan Coholan,The T,Conversation with MBTA's COO Ryan Coholan,https://transitunplugged.com/transit-unplugged-podcast/ryan-coholan-mbta/,5,"Host Paul Comfort sits down with Ryan Coholan, the Chief Operating Officer of the Massachusetts Bay Transportation Authority (MBTA or The T) in Boston.",neutral,False
2026-05-29,Ryan Coholan,The T,The MBTA Advisory Board,https://mbtaadvisoryboard.org/wp-content/uploads/2024/04/MinutesMBTAAB-12-05-23APPROVED.pdf,6,Coholan is responsible for the operation of all MBTA modes. He was appointed. COO by General Manager Philip Eng in September 2023. Mr. Coholan introduced his ...,neutral,False
2026-05-29,Ryan Coholan,The T,Cultivating Culture at the MBTA with COO Ryan Coholan,https://soundcloud.com/spilling-the-t-podcast/cultivating-culture-at-the-mbta-with-coo-ryan-coholan,7,"On this episode, Chief Operating Officer Ryan Coholan joins us to discuss his unique approach to leading Operations at the MBTA.",neutral,False
2026-05-29,Ryan Coholan,The T,Ryan Coholan - Chief Operating Officer at Massachusetts ...,https://www.zoominfo.com/p/Ryan-Coholan/11957181347,8,"Coholan is a Chief Operating Officer at Massachusetts Bay Transportation Authority. Coholan directs, plans, and supervises operations for a significant commuter ...",neutral,False
2026-05-29,Ryan Coholan,The T,"Today, COO Ryan Coholan joined State Senator ...",https://www.instagram.com/p/DPWzqsCEoZw/,9,A Commuter Rail train pulling into North Wilmington station along a long concrete platform with a.,positive,True
2026-05-29,Phillip Eng,MBTA,Phillip Eng,https://en.wikipedia.org/wiki/Phillip_Eng,1,Phillip Eng (born 1961 or 1962) is an American civil engineer and transit executive serving as interim secretary of Massachusetts Department of ...,neutral,False
2026-05-29,Phillip Eng,MBTA,Phillip Eng | People,https://www.mbta.com/people/phillip-eng,2,Phillip Eng is the General Manager and CEO of the Massachusetts Bay Transportation Authority (MBTA). A Civil Engineer with nearly 40 years of transportation ...,positive,True
2026-05-29,Phillip Eng,MBTA,Governor Healey Appoints MBTA General Manager Phil ...,https://www.mass.gov/news/governor-healey-appoints-mbta-general-manager-phil-eng-as-interim-transportation-secretary,3,Highway Administrator Jonathan Gulliver promoted to Undersecretary of Transportation; Interim Secretary and GM Eng to hold media ...,neutral,False
2026-05-29,Phillip Eng,MBTA,MBTA's Phillip Eng Named Interim MassDOT Secretary,https://aashtojournal.transportation.org/mbtas-phillip-eng-named-interim-massdot-secretary/,4,Massachusetts Governor Maura Healey (D) has appointed Phillip Eng (above at left) – general manager of the Massachusetts Bay Transportation ...,neutral,False
2026-05-29,Phillip Eng,MBTA,Phillip Eng - MassDOT and MBTA,https://www.linkedin.com/in/phillip-eng-875928240,5,Experience: MassDOT and MBTA · Education: The Cooper Union for the Advancement of Science and Art · Location: Boston · 500+ connections on LinkedIn.,positive,True
2026-05-29,Phillip Eng,MBTA,The MBTA has made incredible strides. Did Phillip Eng fix ...,https://www.reddit.com/r/mbta/comments/1pokx9x/the_mbta_has_made_incredible_strides_did_phillip/,6,"165 votes, 33 comments. Eng is great. He's done tremendous things. I don't think his influence can be overstated.",neutral,False
