date,ceo,company,title,url,position,snippet,sentiment,controlled
2026-05-29,Phillip Eng,MBTA,Phil Eng earns rave reviews for simultaneous MBTA ...,https://commonwealthbeacon.org/transportation/interim-or-indefinite-no-end-in-sight-to-phil-engs-double-duty/,7,The Healey administration seems content to have Phil Eng continue to work as both T general manager and interim transportation secretary for ...,neutral,False
2026-05-29,Phillip Eng,MBTA,Phillip Eng,https://www.massport.com/our-business/leadership/phillip-eng,8,Phillip Eng leads Massachusetts' transportation network as Interim Secretary of Transportation and General Manager of the MBTA.,positive,True
2026-05-29,Phillip Eng,MBTA,Did Phillip Eng fix the MBTA? Reliability and passenger ...,https://www.cbsnews.com/boston/news/mbta-general-manager-phillip-eng/,9,"Phillip Eng, the New Yorker who came out of retirement to fix the MBTA is getting rave reviews.",neutral,False
2026-05-29,Randy Clarke,Washington Metropolitan Area Transit Authority,Randy Clarke,https://en.wikipedia.org/wiki/Randy_Clarke,1,Randy Clarke (born 1977) is a Canadian-American transit executive who has served as the general manager and CEO of Washington Metropolitan Area Transit ...,neutral,False
2026-05-29,Randy Clarke,Washington Metropolitan Area Transit Authority,Leadership,https://www.wmata.com/about/leadership.html,2,Randy Clarke joined WMATA as General Manager and CEO in July 2022. He's not just Metro's GM/CEO; he's also a customer who uses the service every day.,positive,True
2026-05-29,Randy Clarke,Washington Metropolitan Area Transit Authority,Randy Clarke (@wmatagm),https://www.instagram.com/wmatagm/?hl=en,3,"On Friday, D.C. Mayor Muriel Bowser and Metro General Manager Randy Clarke along with city and transit agency staff members took a ride on the newly renamed ...",positive,True
2026-05-29,Randy Clarke,Washington Metropolitan Area Transit Authority,Randy Clarke - WMATA General Manager and CEO,https://www.linkedin.com/in/randy-clarke-74bb8a69,4,WMATA General Manager and CEO · Experience: Washington Metropolitan Area Transit Authority (WMATA) · Education: University of Southern Maine · Location: ...,positive,True
2026-05-29,Randy Clarke,Washington Metropolitan Area Transit Authority,Randy Clarke (@wmataGM) / Posts / X,https://x.com/wmataGM,5,"Randy Clarke (@wmataGM) - Posts - Proudly leading the @wmata team (America's Metro System) as General Manager & CEO. Also on IG, in.",positive,True
2026-05-29,Randy Clarke,Washington Metropolitan Area Transit Authority,Randy Clarke - GovTech,https://www.govtech.com/top-25/randy-clarke,6,"In his nearly two years on the job as general manager and CEO for the Washington Metropolitan Area Transit Authority (WMATA), Randy Clarke has been almost ...",neutral,False
2026-05-29,Randy Clarke,Washington Metropolitan Area Transit Authority,Washington Metropolitan Area Transit Authority (Maryland entry),https://msa.maryland.gov/msa/mdmanual/38inters/html/23wta.html,7,"D., 2025; April Rai, 2026. Randy Clarke, General Manager & Chief Executive Officer. 300 7th St., SW, Washington, DC 20024 (202) 962-1234",positive,False
2026-05-29,Randy Clarke,Washington Metropolitan Area Transit Authority,Conversation and Cocktails with WMATA GM/CEO Randy ...,https://www.wtsinternational.org/news/conversation-and-cocktails-wmata-gmceo-randy-clarke,8,Mr. Clarke joined WMATA as GM/CEO in July 2022. He's not just Metro's GM/CEO; he's also a customer who uses the service every day.,neutral,False
2026-05-29,Randy Clarke,Washington Metropolitan Area Transit Authority,Team | WMATA Bonds | BondLink,https://www.wmatabonds.com/wmata-bonds-dc/about/our-team/i2812,9,Randy Clarke joined the Washington Metropolitan Area Transit Authority (WMATA) as General Manager and CEO in July 2022. He's not just Metro's GM/CEO; ...,positive,True
2026-05-29,Nora Leerhsen,The L,Nora Leerhsen - Chicago Transit Authority,https://www.linkedin.com/in/nora-leerhsen-1ba38847,1,Experience: Chicago Transit Authority · Education: University of Wisconsin Law School · Location: Greater Chicago Area · 500+ connections on LinkedIn.,positive,True
2026-05-29,Nora Leerhsen,The L,A message from CTA Acting President Nora Leerhsen: On ...,https://www.facebook.com/thecta/posts/a-message-from-cta-acting-president-nora-leerhsenon-transit-employee-appreciatio/1351237193704962/,2,"A message from CTA Acting President Nora Leerhsen: On Transit Employee Appreciation Day, I traveled throughout the system to visit the Harlem ...",positive,True
2026-05-29,Nora Leerhsen,The L,CTA Governance/Administration,https://www.transitchicago.com/governance/,3,"Nora Leerhsen is the acting president of the Chicago Transit Authority (CTA), one of the nation's largest public transit agencies, providing approximately one ...",positive,True
2026-05-29,Nora Leerhsen,The L,Team | Chicago Transit Authority,https://www.ctabonds.com/chicago-transit-authority-il/about/our-team/i6552,4,"Nora Leerhsen is acting president of the Chicago Transit Authority (CTA), one of the nation's largest public transit agencies.",positive,True
2026-05-29,Nora Leerhsen,The L,Nora Leerhsen,https://en.wikipedia.org/wiki/Nora_Leerhsen,5,"Nora Leerhsen is an American lawyer and executive who has served as the Acting President of the Chicago Transit Authority (CTA) since February 2025, ...",neutral,False
2026-05-29,Nora Leerhsen,The L,A Conversation with Nora Leerhsen,https://transitunplugged.com/transit-unplugged-podcast/the-unmatched-power-of-transit-a-conversation-with-nora-leerhsen/,6,"A lawyer and former educator who rose through the ranks from compliance officer to chief of staff and now acting president, Nora shares her deep ...",neutral,False
2026-05-29,Nora Leerhsen,The L,"Nora Leerhsen, Acting President, Chicago Transit Authority",https://www.cityclub-chicago.org/event/2/5742/nora-leerhsen-acting-president-chicago-transit-authority,7,"Nora Leerhsen, Acting President, Chicago Transit Authority. Thursday, Jan 22, 2026. Doors Open at 11:30 am / Event Begins at 12:00 pm ...",positive,False
2026-05-29,Nora Leerhsen,The L,Acting CTA chief Nora Leerhsen makes her case for ...,https://www.reddit.com/r/chicago/comments/1mdm7x4/acting_cta_chief_nora_leerhsen_makes_her_case_for/,8,"She has taken more than 450 rides on the CTA over the last year, and has visited each of the CTA's seven bus garages, nine rail terminals and ...",neutral,False
2026-05-29,Monica Tibbits-Nutt,Boston T,Monica Tibbits-Nutt,https://www.massport.com/our-business/leadership/monica-tibbits-nutt,1,"Monica G. Tibbits-Nutt, is the Secretary and CEO of the Massachusetts Department of Transportation (MassDOT).",positive,True
2026-05-29,Monica Tibbits-Nutt,Boston T,Governor Healey Appoints Monica Tibbits-Nutt as ...,https://www.mass.gov/news/governor-healey-appoints-monica-tibbits-nutt-as-secretary-of-transportation,2,Governor Maura T. Healey today announced that she is appointing Monica Tibbits-Nutt as Secretary of the Massachusetts Department of Transportation (MassDOT) ...,neutral,False
2026-05-29,Monica Tibbits-Nutt,Boston T,Transportation Sec. Monica Tibbits-Nutt Stepping Down ...,https://mass.streetsblog.org/2025/10/16/rearranging-the-cabinet-transportation-sec-monica-tibbits-nutt-stepping-down-replaced-by-mbta-gm-phillip-eng,3,Secretary of Transportation Monica Tibbits-Nutt is leaving the Healey administration. Governor Maura Healey announced this morning in a ...,neutral,False
2026-05-29,Monica Tibbits-Nutt,Boston T,"Monica Tibbits-Nutt, FAICP, LEED AP BD C",https://www.linkedin.com/in/monica-tibbits-nutt,4,"Monica Tibbits-Nutt, FAICP, LEED AP BD C. Transportation Executive | Growth & Sales Leader | Strategic Client Advisor | Rail, Transit & Infrastructure. Jacobs ...",positive,True
2026-05-29,Monica Tibbits-Nutt,Boston T,Disgraced former Transportation Secretary Monica Tibbits ...,https://www.bostonherald.com/2026/01/07/disgraced-former-transportation-secretary-monica-tibbits-nutt-officially-off-state-payroll/,5,Former Transportation Secretary Monica Tibbits-Nutt is officially off the state employee payroll after resigning in disgrace in October and ...,negative,False
2026-05-29,Monica Tibbits-Nutt,Boston T,"MassDOT secretary Tibbits-Nutt steps down, MBTA chief ...",https://www.reddit.com/r/boston/comments/1o876bw/massdot_secretary_tibbitsnutt_steps_down_mbta/,6,"Massachusetts Department of Transportation secretary Monica Tibbits-Nutt will step down from her position, Governor Maura Healey announced ...",neutral,False
2026-05-29,Monica Tibbits-Nutt,Boston T,A Conversation with MassDOT Secretary Monica Tibbits ...,https://members.naiopma.org/event-calendar/Details/a-conversation-with-massdot-secretary-monica-tibbits-nutt-and-mbta-general-manager-phillip-eng-1055406?sourceTypeId=EmailInvitation,7,Join NAIOP for an exciting conversation with Massachusetts Secretary of Transportation Monica Tibbits-Nutt and Massachusetts Bay Transit Authority General ...,neutral,False
2026-05-29,Monica Tibbits-Nutt,Boston T,"Monica Tibbits-Nutt made history as the first Queer, Black ...",https://www.linkedin.com/posts/lauren-melendez-53690475_monica-tibbits-nutt-made-history-as-the-first-activity-7301335136107720704-9AIP,8,"Monica Tibbits-Nutt made history as the first Queer, Black woman to be named Secretary of Transportation for the Commonwealth.",positive,True
2026-05-29,Monica Tibbits-Nutt,Boston T,MassFiscal Responds to Departure of Transportation ...,https://www.massfiscal.org/massfiscal-responds-departure-monica-tibbits-nutt,9,Tibbits-Nutt Exit is “Long Overdue”. The Massachusetts Fiscal Alliance today responded to news that Secretary of Transportation Monica ...,neutral,False
2026-05-29,Ryan Coholan,Boston T,Ryan Coholan - Chief Operating Officer at MBTA,https://www.linkedin.com/in/ryan-coholan-139014ab,1,"Experienced Chief Operating Officer with a demonstrated history of working in the transportation/trucking/railroad industry. Skilled in Budgeting, Operations ...",positive,True
2026-05-29,Ryan Coholan,Boston T,MBTA COO Ryan Coholan talks South Coast Rail from ...,https://www.heraldnews.com/picture-gallery/news/2026/03/24/mbta-coo-ryan-coholan-talks-south-coast-rail-from-boston-to-fall-river/89294351007/,2,"MBTA Chief Operating Officer Ryan Coholan operates a commuter rail train at South Station, Boston, on March 10, 2026. Dan Medeiros.",neutral,False
2026-05-29,Ryan Coholan,Boston T,Ryan Coholan - Massachusetts Bay Transportation Authority ...,https://cthrupayroll.mass.gov/?os=shmmfp&ref=app#!/year/2024/full_time_employees%2Cothers/pay1%2Cpay2%2Cpay3%2Cpay4/explore%2F0-0-0%2Ftrans_no%2F17915261%2F0%2Fdepartment_division,3,Ryan Coholan - Massachusetts Bay Transportation Authority (MBT) - Chief Operating Officer Massachusetts Bay Transportation Authority (MBT).,positive,False
2026-05-29,Ryan Coholan,Boston T,CCMRRCAM praises MBTA's Ryan Coholan for innovative ...,https://www.facebook.com/ccmrrcam/posts/when-it-comes-to-making-a-meaningful-difference-about-how-the-mbta-serves-the-ci/1285749126448679/,4,"When it comes to making a meaningful difference about how the MBTA serves the citizens of the Commonwealth, the CCMRRCAM would like to point out that ...",positive,True
2026-05-29,Ryan Coholan,Boston T,Conversation with MBTA's COO Ryan Coholan,https://transitunplugged.com/transit-unplugged-podcast/ryan-coholan-mbta/,5,"With nearly 30 years of transit experience, Ryan talks about running one of America's largest transit systems and shares stories of MBTA's ...",neutral,False
2026-05-29,Ryan Coholan,Boston T,The MBTA Advisory Board,https://mbtaadvisoryboard.org/wp-content/uploads/2024/04/MinutesMBTAAB-12-05-23APPROVED.pdf,6,"C. MBTA Chief Operating Officer Ryan Coholan: The Chair introduced Ryan. Coholan, the Chief Operating Officer (COO) of the MBTA to address the Board.",neutral,False
2026-05-29,Ryan Coholan,Boston T,Cultivating Culture at the MBTA with COO Ryan Coholan,https://soundcloud.com/spilling-the-t-podcast/cultivating-culture-at-the-mbta-with-coo-ryan-coholan,7,"On this episode, Chief Operating Officer Ryan Coholan joins us to discuss his unique approach to leading Operations at the MBTA.",neutral,False
2026-05-29,Ryan Coholan,Boston T,"Today, COO Ryan Coholan joined State Senator ...",https://www.instagram.com/p/DPWzqsCEoZw/,8,"Today, COO Ryan Coholan joined State Senator @barryfinegoldma, State ... NBC 10 BOSTON MBTA considering platform screen doors Crossrail ...",positive,True
2026-05-29,Ryan Coholan,Boston T,Ryan Coholan's Post - Chief Operating Officer at MBTA,https://www.linkedin.com/posts/ryan-coholan-139014ab_ive-been-blessed-to-be-part-of-the-turnaround-activity-7453149688158973952-Me6l,9,"I've been blessed to be part of the turnaround story that is the MBTA over the past 2 1/2 years. Early when I began this role as COO, ...",positive,True
2026-05-29,Randy Clarke,Metrorail,Leadership,https://www.wmata.com/about/leadership.html,1,Randy Clarke joined WMATA as General Manager and CEO in July 2022. He's not just Metro's GM/CEO; he's also a customer who uses the service every day.,positive,True
2026-05-29,Randy Clarke,Metrorail,Randy Clarke,https://en.wikipedia.org/wiki/Randy_Clarke,2,Randy Clarke (born 1977) is a Canadian-American transit executive who has served as the general manager and CEO of Washington Metropolitan Area Transit ...,neutral,False
2026-05-29,Randy Clarke,Metrorail,Randy Clarke (@wmatagm),https://www.instagram.com/wmatagm/?hl=en,3,Chief transit customer advocate @metroforward · oh hey @wmatagm We definitely weren't expecting a train delivery today… but the letter T has officially arrived ...,positive,True
2026-05-29,Randy Clarke,Metrorail,Randy Clarke (@wmataGM) / Posts / X,https://x.com/wmataGM,4,"Randy Clarke (@wmataGM) - Posts - Proudly leading the @wmata team (America's Metro System) as General Manager & CEO. Also on IG, in.",positive,True
2026-05-29,Randy Clarke,Metrorail,Transportation 2024: RANDY CLARKE,https://virginiabusiness.com/randy-clarke/,5,Clarke took leadership of WMATA in 2022 and since has been working to increase ridership and add fleets to the Metrorail and Metrobus.,neutral,False
2026-05-29,Randy Clarke,Metrorail,"WMATA CEO and General Manager Randy Clarke, gave ...",https://www.facebook.com/fox5dc/posts/wmata-ceo-and-general-manager-randy-clarke-gave-us-a-tour-of-one-of-metros-oldes/1285611933603364/,6,"WMATA CEO and General Manager Randy Clarke, gave us a tour of one of Metro's oldest train control rooms.",positive,True
2026-05-29,Randy Clarke,Metrorail,Exclusive: Metro CEO Randy Clarke's message to Trump,https://www.axios.com/local/washington-dc/2026/05/18/randy-clarke-metro-gold-line-rfk-stadium,7,"Randy Clarke sees Metro's future in the Gold Line: A zippy, dedicated bus route from Georgetown to the new Commanders stadium.",positive,False
2026-05-29,Randy Clarke,Metrorail,Washington Metropolitan Area Transit Authority (Maryland entry),https://2023mdmanual.msa.maryland.gov/msa/mdmanual/38inters/html/23wta.html,8,"Randy Clarke, General Manager & Chief Executive Officer. 300 7th St., SW, Washington, DC 20024 (202) 962-1234 (202) 637-7000 (Metro bus & rail information)",positive,False
2026-05-29,Janno Lieber,NYC Subway,JANNO,https://open.spotify.com/artist/7hpiHzP9aLLb5liDLxtwhM,1,Singles and EPs · JUNGS AUF NER BANK · Zweizwei Cypher · Neckbreaker · Get Down · Moon Rocks · HYPERAKTIV · GET THE FUCK UP · ALLES WAS WAR. Single • 2025 ...,neutral,False
2026-05-29,Janno Lieber,NYC Subway,Janno Gibbs,https://en.wikipedia.org/wiki/Janno_Gibbs,2,"Janno Ronaldo Ilagan Gibbs (born September 16, 1969) is a Filipino singer, songwriter, comedian and actor. He was a regular host of GMA Network television shows ...",neutral,False
2026-05-29,Janno Lieber,NYC Subway,JANNO OFICIAL,https://www.youtube.com/channel/UCgwHTUTD094EcF0Oews1-pQ,3,Cantautor Chileno / Ex Integrante de Operación Triunfo Chile / Artista de Chilevisión Música / Htv Music / SoundTrack Wena Profe en TVN / SoundTrack Amar a ...,neutral,False
2026-05-29,Janno Lieber,NYC Subway,Janno,https://music.apple.com/us/artist/janno/1584873866,4,"Listen to music by Janno on Apple Music. Find top songs and albums by Janno including ვერავინ ვერ წაიღოს Beria (feat. Janno), Amor Del Bueno (feat. Janno) and",neutral,False
2026-05-29,Janno Lieber,NYC Subway,Janno Ilagan Gibbs (@jannolategibbs),https://www.instagram.com/jannolategibbs/,5,"Artist, Political Angalist · Back at A-Institute, @jannolategibbs continues to prioritize self-care and skin · 1st time singing together Tonight 7pm on ...",positive,True
2026-05-29,Janno Lieber,NYC Subway,Janno,https://en.wikipedia.org/wiki/Janno,6,"Janno is both a masculine given name and a surname predominantly found in Estonia. As a given name it can be a diminutive of Johannes, Juhan, Jan, Jaan, and ...",neutral,False
2026-05-29,Janno Lieber,NYC Subway,Janno Trump - musician/bassplayer,https://www.jannotrump.com/,7,Janno Trump is one of the most notable younger generation bassists in Estonia and a bandleader of the jazz-funk orchestra JT Conception.,neutral,False
2026-05-29,Janno Lieber,NYC Subway,J A N N O,https://soundcloud.com/janoelcantante,8,"Play *J A N N O* on SoundCloud and discover followers on SoundCloud | Stream tracks, albums, playlists on desktop and mobile.",neutral,False
2026-05-29,Janno Lieber,NYC Subway,"Janno Gibbs - Songs, Events and Music Stats",https://www.viberate.com/artist/janno-gibbs/,9,"Janno Gibbs is recognized in the Philippines as the foremost authority on R&B and soul music. His powerful vocals, mellow melodies, and emotional lyrics all ...",neutral,False
2026-05-29,Nora Leerhsen,Chicago Transit Authority,Nora Leerhsen - Chicago Transit Authority,https://www.linkedin.com/in/nora-leerhsen-1ba38847,1,Experience: Chicago Transit Authority · Education: University of Wisconsin Law School · Location: Greater Chicago Area · 500+ connections on LinkedIn.,positive,True
2026-05-29,Nora Leerhsen,Chicago Transit Authority,Team | Chicago Transit Authority,https://www.ctabonds.com/chicago-transit-authority-il/about/our-team/i6552,2,"nleerhsen@transitchicago.com. Nora Leerhsen is acting president of the Chicago Transit Authority (CTA), one of the nation's largest public transit agencies ...",positive,True
2026-05-29,Nora Leerhsen,Chicago Transit Authority,CTA Governance/Administration,https://www.transitchicago.com/governance/,3,"Nora Leerhsen is the acting president of the Chicago Transit Authority (CTA), one of the nation's largest public transit agencies, providing approximately one ...",positive,True
2026-05-29,Nora Leerhsen,Chicago Transit Authority,Nora Leerhsen,https://en.wikipedia.org/wiki/Nora_Leerhsen,4,"Nora Leerhsen is an American lawyer and executive who has served as the Acting President of the Chicago Transit Authority (CTA) since February 2025, replacing ...",neutral,False
2026-05-29,Nora Leerhsen,Chicago Transit Authority,"Nora Leerhsen, Acting President, Chicago Transit Authority",https://www.cityclub-chicago.org/video/5742/nora-leerhsen-acting-president-chicago-t,5,I first met acting pres CTA president Nora lerson at the University of Chicago 20 years ago when she was a master student.,positive,False
2026-05-29,Nora Leerhsen,Chicago Transit Authority,"Nora Leerhsen, Acting President, Chicago Transit Authority",https://www.cityclub-chicago.org/event/2/5742/nora-leerhsen-acting-president-chicago-transit-authority,6,"Nora Leerhsen, Acting President, Chicago Transit Authority. Thursday, Jan 22, 2026. Doors Open at 11:30 am / Event Begins at 12:00 pm ...",positive,False
2026-05-29,Nora Leerhsen,Chicago Transit Authority,A message from CTA Acting President Nora Leerhsen: On ...,https://www.facebook.com/thecta/posts/a-message-from-cta-acting-president-nora-leerhsenon-transit-employee-appreciatio/1351237193704962/,7,"A message from CTA Acting President Nora Leerhsen: On Transit Employee Appreciation Day, I traveled throughout the system to visit the Harlem ...",positive,True
2026-05-29,Nora Leerhsen,Chicago Transit Authority,Acting CTA chief lays out priorities after dodging fiscal cliff,https://www.chicagotribune.com/2026/02/02/acting-cta-chief-lays-out-priorities-after-dodging-fiscal-cliff/,8,"When she was named acting president of the Chicago Transit Authority, Nora Leerhsen made a call to the agency's first female train operator.",neutral,False
2026-05-29,Nora Leerhsen,Chicago Transit Authority,How do we think interim CTA president Nora Leerhsen is ...,https://www.reddit.com/r/chicago/comments/1ldou75/how_do_we_think_interim_cta_president_nora/,9,"While I know she worked under Dorval Carter, I think she has been a breath of fresh air. She is way more visible and actually seems to want to understand ...",neutral,False
2026-05-29,Phillip Eng,The T,Phillip Eng,https://en.wikipedia.org/wiki/Phillip_Eng,1,Phillip Eng (born 1961 or 1962) is an American civil engineer and transit executive serving as interim secretary of Massachusetts Department of ...,neutral,False
2026-05-29,Phillip Eng,The T,Phillip Eng | People,https://www.mbta.com/people/phillip-eng,2,Phillip Eng is the General Manager and CEO of the Massachusetts Bay Transportation Authority (MBTA). A Civil Engineer with nearly 40 years of transportation ...,positive,True
2026-05-29,Phillip Eng,The T,Did Phillip Eng fix the MBTA? Reliability and passenger ...,https://www.cbsnews.com/boston/news/mbta-general-manager-phillip-eng/,3,"Phillip Eng, the New Yorker who came out of retirement to fix the MBTA is getting rave reviews.",neutral,False
2026-05-29,Phillip Eng,The T,Phillip Eng - MassDOT and MBTA,https://www.linkedin.com/in/phillip-eng-875928240,4,Experience: MassDOT and MBTA · Education: The Cooper Union for the Advancement of Science and Art · Location: Boston · 500+ connections on LinkedIn.,positive,True
2026-05-29,Phillip Eng,The T,Phil Eng earns rave reviews for simultaneous MBTA ...,https://commonwealthbeacon.org/transportation/interim-or-indefinite-no-end-in-sight-to-phil-engs-double-duty/,5,The Healey administration seems content to have Phil Eng continue to work as both T general manager and interim transportation secretary for ...,neutral,False
2026-05-29,Phillip Eng,The T,The MBTA has made incredible strides. Did Phillip Eng fix ...,https://www.reddit.com/r/mbta/comments/1pokx9x/the_mbta_has_made_incredible_strides_did_phillip/,6,"165 votes, 33 comments. Eng is great. He's done tremendous things. I don't think his influence can be overstated.",neutral,False
2026-05-29,Phillip Eng,The T,Governor Healey Appoints MBTA General Manager Phil ...,https://www.mass.gov/news/governor-healey-appoints-mbta-general-manager-phil-eng-as-interim-transportation-secretary,7,Highway Administrator Jonathan Gulliver promoted to Undersecretary of Transportation; Interim Secretary and GM Eng to hold media ...,neutral,False
2026-05-29,Phillip Eng,The T,To a T: How Phillip Eng got Boston's subway system back ...,https://www.csmonitor.com/Business/2025/1115/boston-mbta-phillip-eng,8,Many now see America's oldest subway system as a model for repairing the country's crumbling transportation infrastructure – a huge ...,neutral,False
2026-05-29,Phillip Eng,The T,MBTA's Phillip Eng Named Interim MassDOT Secretary,https://aashtojournal.transportation.org/mbtas-phillip-eng-named-interim-massdot-secretary/,9,"October 17, 2025. Massachusetts Governor Maura Healey (D) has appointed Phillip Eng (above at left) – general manager of the Massachusetts Bay ...",neutral,False
2026-05-29,Randy Clarke,DC Metro,RANDY Definition & Meaning,https://www.merriam-webster.com/dictionary/randy,1,"1. chiefly Scotland : having a coarse manner 2. lustful, lecherous randiness noun randy 2 of 2 noun plural randies chiefly Scotland : a scolding or dissolute ...",neutral,False
2026-05-29,Randy Clarke,DC Metro,Randy,https://open.spotify.com/artist/1Qote9MpqMZluWzYGifZUg,2,Listen to Randy on Spotify. Artist · 1.7M monthly listeners.,neutral,False
2026-05-29,Randy Clarke,DC Metro,Randy,https://en.wikipedia.org/wiki/Randy,3,"Randy is a primarily masculine given name. It is popular in the United States and Canada. It was originally derived from the names Randall, Randolph, and ...",neutral,False
2026-05-29,Randy Clarke,DC Metro,Randy,https://www.youtube.com/watch?v=Kuq144yNYG4,4,"Provided to YouTube by RLG/Legacy Randy · Dolly Parton Jolene ℗ 1974 Sony Music Entertainment Released on: 1974-02-04 Lyricist, ...",neutral,False
2026-05-29,Randy Clarke,DC Metro,Randy : r/JusticeMusic,https://www.reddit.com/r/JusticeMusic/comments/1bmg7pa/randy/,5,Randy. Discussion. Is the best song Justice has ever composed. Tell me why I'm right. Or change my mind. Upvote 17. Downvote 26 Go to comments,neutral,False
2026-05-29,Randy Clarke,DC Metro,RANDY Definition & Meaning,https://www.dictionary.com/browse/randy,6,RANDY definition: sexually aroused; lustful; lecherous. See examples of randy used in a sentence.,neutral,False
2026-05-29,Randy Clarke,DC Metro,randy,https://en.wiktionary.org/wiki/randy,7,"Adjective · (UK, informal) Sexually aroused; full of sexual lust. · If you're feeling randy, give me a call and I'll come round and give you some hot lovin'.",neutral,False
2026-05-29,Randy Clarke,DC Metro,Randy (@randy) • Instagram photos and videos,https://www.instagram.com/randy/,8,"Genuine, generous. It's hard to describe how amazing of a human @guyfieri is! Genuine, generous and caring are my 3 words that best fit.",positive,True
2026-05-29,Monica Tibbits-Nutt,MBTA,Monica Tibbits-Nutt,https://www.massport.com/our-business/leadership/monica-tibbits-nutt,1,"Monica G. Tibbits-Nutt, is the Secretary and CEO of the Massachusetts Department of Transportation (MassDOT).",positive,True
