date,ceo,company,title,url,position,snippet,sentiment,controlled
2026-04-03,Phillip Eng,The T,Phillip Eng | People,https://www.mbta.com/people/phillip-eng,1,Phillip Eng is the General Manager and CEO of the Massachusetts Bay Transportation Authority (MBTA). A Civil Engineer with nearly 40 years of transportation ...,positive,True
2026-04-03,Phillip Eng,The T,Phillip Eng,https://en.wikipedia.org/wiki/Phillip_Eng,2,Phillip Eng (born 1961 or 1962) is an American civil engineer and transit executive serving as interim secretary of Massachusetts Department of ...,neutral,False
2026-04-03,Phillip Eng,The T,Did Phillip Eng fix the MBTA? Reliability and passenger ...,https://www.cbsnews.com/boston/news/mbta-general-manager-phillip-eng/,3,"I'll take it!'"" Eng said. Phillip Eng MBTA General Manager Phillip Eng on the Orange Line. CBS Boston.",neutral,False
2026-04-03,Phillip Eng,The T,The MBTA has made incredible strides. Did Phillip Eng fix ...,https://www.reddit.com/r/mbta/comments/1pokx9x/the_mbta_has_made_incredible_strides_did_phillip/,4,"165 votes, 33 comments. Eng is great. He's done tremendous things. I don't think his influence can be overstated.",neutral,False
2026-04-03,Phillip Eng,The T,"Phillip Eng - Transportation Services, Operations, ...",https://www.linkedin.com/in/phillip-eng-875928240,5,"Transportation Services, Operations, Engineering and Infrastructure · Experience: MassDOT and MBTA · Education: The Cooper Union for the Advancement of ...",positive,True
2026-04-03,Phillip Eng,The T,Phil Eng earns rave reviews for simultaneous MBTA ...,https://commonwealthbeacon.org/transportation/interim-or-indefinite-no-end-in-sight-to-phil-engs-double-duty/,6,The Healey administration seems content to have Phil Eng continue to work as both T general manager and interim transportation secretary for ...,neutral,False
2026-04-03,Phillip Eng,The T,Governor Healey Appoints MBTA General Manager Phil ...,https://www.mass.gov/news/governor-healey-appoints-mbta-general-manager-phil-eng-as-interim-transportation-secretary,7,Boston — Governor Maura Healey announced today that she has named Massachusetts Bay Transportation Authority (MBTA) General Manager Phillip Eng ...,neutral,False
2026-04-03,Phillip Eng,The T,To a T: How Phillip Eng got Boston's subway system back ...,https://www.csmonitor.com/Business/2025/1115/boston-mbta-phillip-eng,8,Many now see America's oldest subway system as a model for repairing the country's crumbling transportation infrastructure – a huge ...,neutral,False
2026-04-03,Phillip Eng,The T,"For Phillip Eng, Public Service Suits Him to a 'T'",https://www.sampan.org/post/for-phillip-eng-public-service-suits-him-to-a-t,9,"But for many these days, it seems to be the friendly face of the Massachusetts Bay Transportation Authority's general manager, Phil Eng. Indeed, ...",neutral,False
2026-04-03,Phillip Eng,Boston T,Phillip Eng | People,https://www.mbta.com/people/phillip-eng,1,Phillip Eng is the General Manager and CEO of the Massachusetts Bay Transportation Authority (MBTA). A Civil Engineer with nearly 40 years of transportation ...,positive,True
2026-04-03,Phillip Eng,Boston T,Phillip Eng,https://en.wikipedia.org/wiki/Phillip_Eng,2,Phillip Eng (born 1961 or 1962) is an American civil engineer and transit executive serving as interim secretary of Massachusetts Department of ...,neutral,False
2026-04-03,Phillip Eng,Boston T,Did Phillip Eng fix the MBTA? Reliability and passenger ...,https://www.cbsnews.com/boston/news/mbta-general-manager-phillip-eng/,3,"I'll take it!'"" Eng said. Phillip Eng MBTA General Manager Phillip Eng on the Orange Line. CBS Boston.",neutral,False
2026-04-03,Phillip Eng,Boston T,Governor Healey Appoints MBTA General Manager Phil ...,https://www.mass.gov/news/governor-healey-appoints-mbta-general-manager-phil-eng-as-interim-transportation-secretary,4,Highway Administrator Jonathan Gulliver promoted to Undersecretary of Transportation; Interim Secretary and GM Eng to hold media ...,neutral,False
2026-04-03,Phillip Eng,Boston T,To a T: How Phillip Eng got Boston's subway system back ...,https://www.csmonitor.com/Business/2025/1115/boston-mbta-phillip-eng,5,Many now see America's oldest subway system as a model for repairing the country's crumbling transportation infrastructure – a huge ...,neutral,False
2026-04-03,Phillip Eng,Boston T,"Phillip Eng - Transportation Services, Operations, ...",https://www.linkedin.com/in/phillip-eng-875928240,6,"Transportation Services, Operations, Engineering and Infrastructure · Experience: MassDOT and MBTA · Education: The Cooper Union for the Advancement of ...",positive,True
2026-04-03,Phillip Eng,Boston T,The MBTA has made incredible strides. Did Phillip Eng fix ...,https://www.reddit.com/r/mbta/comments/1pokx9x/the_mbta_has_made_incredible_strides_did_phillip/,7,"165 votes, 33 comments. Eng is great. He's done tremendous things. I don't think his influence can be overstated.",neutral,False
2026-04-03,Phillip Eng,Boston T,Phil Eng earns rave reviews for simultaneous MBTA ...,https://commonwealthbeacon.org/transportation/interim-or-indefinite-no-end-in-sight-to-phil-engs-double-duty/,8,The Healey administration seems content to have Phil Eng continue to work as both T general manager and interim transportation secretary for ...,neutral,False
2026-04-03,Phillip Eng,Boston T,Here's how readers would grade Phillip Eng's first year at ...,https://www.boston.com/community/readers-say/this-is-the-grade-readers-gave-phillip-engs-first-year-at-the-mbta/,9,Phillip Eng's just finished his first year as general manager of the MBTA. See what grade Boston.com readers gave him.,neutral,False
2026-04-03,Randy Clarke,DC Metro,Randy Clarke,https://en.wikipedia.org/wiki/Randy_Clarke,1,Randy Clarke (born 1977) is a Canadian-American transit executive who has served as the general manager and CEO of Washington Metropolitan Area Transit ...,neutral,False
2026-04-03,Randy Clarke,DC Metro,Leadership,https://www.wmata.com/about/leadership/,2,Randy Clarke joined the Washington Metropolitan Area Transit Authority (WMATA) as General Manager and CEO in July 2022.,positive,True
2026-04-03,Randy Clarke,DC Metro,Randy Clarke - Washington Metropolitan Area Transit ...,https://www.linkedin.com/in/randy-clarke-74bb8a69,3,Experience: Washington Metropolitan Area Transit Authority (WMATA) · Education: University of Southern Maine · Location: United States · 500+ connections on ...,positive,True
2026-04-03,Randy Clarke,DC Metro,Randy Clarke (@wmataGM) / Posts / X,https://x.com/wmataGM,4,"Randy Clarke (@wmataGM) - Posts - Proudly leading the @wmata team (America's Metro System) as General Manager & CEO. Also on IG, in.",positive,True
2026-04-03,Randy Clarke,DC Metro,Randy Clarke (@wmatagm),https://www.instagram.com/wmatagm/,5,Completed the 2nd Annual @metroforward MetroTransitPD Recruit General Manager run on the National Mall. These recruits graduate this month joining our great ...,positive,True
2026-04-03,Randy Clarke,DC Metro,How to Save DC's Metro,https://www.statecraft.pub/p/how-to-save-dcs-metro,6,"Today we talked to Randy Clarke, the head of DC's Metro system, WMATA. If you're a transit nerd, you probably know about Clarke — he's ...",positive,False
2026-04-03,Randy Clarke,DC Metro,Here's a wild idea: Randy Clarke for D.C. mayor,https://www.axios.com/local/washington-dc/2025/10/30/randy-clarke-metro-dc-mayor-muriel-bowser-election,7,Randy Clarke fixed Metro. Maybe he can fix D.C. next? Why it matters: We need someone to run for mayor! email (opens in new window).,neutral,False
2026-04-03,Randy Clarke,DC Metro,Randy Clarke,https://www.govtech.com/top-25/randy-clarke,8,"In his nearly two years on the job as general manager and CEO for the Washington Metropolitan Area Transit Authority (WMATA), Randy Clarke has been almost ...",neutral,False
2026-04-03,Randy Clarke,DC Metro,Glad to meet with WMATA General Manager Randy Clarke ...,https://www.facebook.com/RepStenyHoyer/posts/glad-to-meet-with-wmata-general-manager-randy-clarke-and-my-fellow-members-in-th/1470441071118243/,9,Randy Clarke has been on the job for just over a year now as CEO of Washington Metropolitan Area Transit Authority (WMATA) in the nation's ...,positive,True
2026-04-03,Monica Tibbits-Nutt,Massachusetts Bay Transportation Authority,Monica Tibbits-Nutt,https://www.massport.com/our-business/leadership/monica-tibbits-nutt,1,"Monica G. Tibbits-Nutt, is the Secretary and CEO of the Massachusetts Department of Transportation (MassDOT).",positive,True
2026-04-03,Monica Tibbits-Nutt,Massachusetts Bay Transportation Authority,Transportation Sec. Monica Tibbits-Nutt Stepping Down ...,https://mass.streetsblog.org/2025/10/16/rearranging-the-cabinet-transportation-sec-monica-tibbits-nutt-stepping-down-replaced-by-mbta-gm-phillip-eng,2,Secretary of Transportation Monica Tibbits-Nutt is leaving the Healey administration. Governor Maura Healey announced this morning in a ...,neutral,False
2026-04-03,Monica Tibbits-Nutt,Massachusetts Bay Transportation Authority,MassFiscal Responds to Departure of Transportation ...,https://www.massfiscal.org/massfiscal-responds-departure-monica-tibbits-nutt,3,Tibbits-Nutt Exit is “Long Overdue”. The Massachusetts Fiscal Alliance today responded to news that Secretary of Transportation Monica ...,neutral,False
2026-04-03,Monica Tibbits-Nutt,Massachusetts Bay Transportation Authority,Monica Tibbits-Nutt parting ways with Massachusetts ...,https://www.wcvb.com/article/monica-tibbits-nutt-parting-ways-with-massachusetts-department-of-transportation/69054926,4,Maura Healey said Tibbits-Nutt made the decision to step down from her positions as secretary of the Department of Transportation and CEO of ...,neutral,False
2026-04-03,Monica Tibbits-Nutt,Massachusetts Bay Transportation Authority,Howie Carr: Monica Tibbits-Nutt didn't leave much of a ...,https://www.bostonherald.com/2025/10/18/howie-carr-monica-tibbits-nutt-didnt-leave-much-of-a-legacy-for-massdot/,5,"Gov. Maura Healey doesn't feel much like a nut. In fact, it appears she's allergic to at least one, namely, Monica Tibbits-Nutt, ...",neutral,False
2026-04-03,Monica Tibbits-Nutt,Massachusetts Bay Transportation Authority,"MassDOT Secretary Tibbits-Nutt stepping down, MBTA GM ...",https://www.boston25news.com/news/local/massdot-secretary-tibbits-nutt-stepping-down-mbta-gm-phillip-eng-named-interim-replacement/3ILCI5IQ3ZEFPMFKSVUGVV45JY/,6,BOSTON — Massachusetts Department of Transportation Secretary Monica Tibbits-Nutt will step down from her position and MBTA General Manager ...,neutral,False
2026-04-03,Monica Tibbits-Nutt,Massachusetts Bay Transportation Authority,Monica Tibbits-Nutt parting ways with Massachusetts ...,https://x.com/WCVB/status/1978825020173414637,7,WCVB-TV Boston (@WCVB). 4 likes 13 replies. Monica Tibbits-Nutt parting ways with Massachusetts Department of Transportation | Click on the ...,positive,True
2026-04-03,Monica Tibbits-Nutt,Massachusetts Bay Transportation Authority,"MassDOT secretary Tibbits-Nutt steps down, MBTA chief ...",https://www.reddit.com/r/boston/comments/1o876bw/massdot_secretary_tibbitsnutt_steps_down_mbta/,8,"Massachusetts Department of Transportation secretary Monica Tibbits-Nutt will step down from her position, Governor Maura Healey announced ...",neutral,False
2026-04-03,Monica Tibbits-Nutt,MBTA,Transportation Sec. Monica Tibbits-Nutt Stepping Down ...,https://mass.streetsblog.org/2025/10/16/rearranging-the-cabinet-transportation-sec-monica-tibbits-nutt-stepping-down-replaced-by-mbta-gm-phillip-eng,1,Secretary of Transportation Monica Tibbits-Nutt is leaving the Healey administration. Governor Maura Healey announced this morning in a ...,neutral,False
2026-04-03,Monica Tibbits-Nutt,MBTA,Monica Tibbits-Nutt,https://www.massport.com/our-business/leadership/monica-tibbits-nutt,2,"Monica G. Tibbits-Nutt, is the Secretary and CEO of the Massachusetts Department of Transportation (MassDOT).",positive,True
2026-04-03,Monica Tibbits-Nutt,MBTA,Tibbits-Nutt is out as transportation secretary. T chief Eng ...,https://www.wbur.org/news/2025/10/16/tibbits-nutt-transportation-secretary-massachusetts-eng,3,"... Monica Tibbits-Nutt overseeing the state's transit agency. In a press release, Healey said Tibbits-Nutt ""has made the decision to step down ...",neutral,False
2026-04-03,Monica Tibbits-Nutt,MBTA,Disgraced former Transportation Secretary Monica Tibbits ...,https://www.bostonherald.com/2026/01/07/disgraced-former-transportation-secretary-monica-tibbits-nutt-officially-off-state-payroll/,4,Former Transportation Secretary Monica Tibbits-Nutt is officially off the state employee payroll after resigning in disgrace in October and ...,negative,False
2026-04-03,Monica Tibbits-Nutt,MBTA,"MassDOT secretary Tibbits-Nutt steps down, MBTA chief ...",https://www.reddit.com/r/boston/comments/1o876bw/massdot_secretary_tibbitsnutt_steps_down_mbta/,5,"Massachusetts Department of Transportation secretary Monica Tibbits-Nutt will step down from her position, Governor Maura Healey announced ...",neutral,False
2026-04-03,Monica Tibbits-Nutt,MBTA,MassFiscal Responds to Departure of Transportation ...,https://www.massfiscal.org/massfiscal-responds-departure-monica-tibbits-nutt,6,Tibbits-Nutt Exit is “Long Overdue”. The Massachusetts Fiscal Alliance today responded to news that Secretary of Transportation Monica ...,neutral,False
2026-04-03,Monica Tibbits-Nutt,MBTA,Massachusetts Transportation Sec. Monica Tibbits-Nutt ...,https://www.cbsnews.com/boston/news/monica-tibbits-nutt-phil-eng-massdot/,7,Transportation Sec. Monica Tibbits-Nutt is out and MBTA GM Phil Eng was promoted in a MassDOT shakeup.,neutral,False
2026-04-03,Monica Tibbits-Nutt,MBTA,Monica Tibbits-Nutt parting ways with Massachusetts ...,https://www.wcvb.com/article/monica-tibbits-nutt-parting-ways-with-massachusetts-department-of-transportation/69054926,8,Maura Healey said Tibbits-Nutt made the decision to step down from her positions as secretary of the Department of Transportation and CEO of ...,neutral,False
2026-04-03,Monica Tibbits-Nutt,MBTA,"Tibbits-Nutt out, Eng elevated in abrupt shakeup at MassDOT",https://commonwealthbeacon.org/transportation/tibbits-nutt-out-eng-elevated-in-abrupt-shakeup-at-massdot/,9,"Transportation Secretary Monica Tibbits-Nutt suddenly resigned Thursday, prompting the governor to ask the head of the MBTA and the state's ...",negative,False
2026-04-03,Nora Leerhsen,The L,CTA Governance/Administration,https://www.transitchicago.com/governance/,1,"Nora Leerhsen is the acting president of the Chicago Transit Authority (CTA), one of the nation's largest public transit agencies, providing approximately one ...",positive,True
2026-04-03,Nora Leerhsen,The L,Nora Leerhsen,https://en.wikipedia.org/wiki/Nora_Leerhsen,2,"Nora Leerhsen is an American lawyer and executive who has served as the Acting President of the Chicago Transit Authority (CTA) since February 2025, replacing ...",neutral,False
2026-04-03,Nora Leerhsen,The L,A Conversation with Nora Leerhsen,https://transitunplugged.com/transit-unplugged-podcast/the-unmatched-power-of-transit-a-conversation-with-nora-leerhsen/,3,"A lawyer and former educator who rose through the ranks from compliance officer to chief of staff and now acting president, Nora shares her deep ...",neutral,False
2026-04-03,Nora Leerhsen,The L,"On Transit Employee Appreciation Day, I traveled ...",https://www.facebook.com/thecta/posts/a-message-from-cta-acting-president-nora-leerhsenon-transit-employee-appreciatio/1351237193704962/,4,"A message from CTA Acting President Nora Leerhsen: On Transit Employee Appreciation Day, I traveled throughout the system to visit the Harlem ...",positive,True
2026-04-03,Nora Leerhsen,The L,Acting CTA chief lays out priorities,https://www.chicagotribune.com/2026/02/02/acting-cta-chief-lays-out-priorities-after-dodging-fiscal-cliff/,5,"When she was named acting president of the Chicago Transit Authority, Nora Leerhsen made a call to the agency's first female train operator.",neutral,False
2026-04-03,Nora Leerhsen,The L,"As 1st woman to lead agency, CTA's acting president ...",https://www.youtube.com/watch?v=JkPaY8gOl8Q,6,The CTA has a new acting president Nora lerson the first woman to lead the agency after a six-year stint as former President dorville Carter's Chief of Staff.,neutral,False
2026-04-03,Nora Leerhsen,The L,Team | Chicago Transit Authority,https://www.ctabonds.com/chicago-transit-authority-il/about/our-team/i6552,7,"Nora Leerhsen is acting president of the Chicago Transit Authority (CTA), one of the nation's largest public transit agencies.",positive,True
2026-04-03,Nora Leerhsen,The L,Nora Leerhsen - Chicago Transit Authority,https://www.linkedin.com/in/nora-leerhsen-1ba38847,8,Experience: Chicago Transit Authority · Education: University of Wisconsin Law School · Location: Greater Chicago Area · 500+ connections on LinkedIn.,positive,True
2026-04-03,Nora Leerhsen,The L,Statement from CTA Acting President Nora Leerhsen,https://www.transitchicago.com/statement-from-cta-acting-president-nora-leerhsen/,9,"As a result of this bill, CTA will be fully funded. This funding means that there will be no layoffs or service cuts. With these funds, we will ...",positive,True
2026-04-03,Randy Clarke,Metrorail,Leadership,https://www.wmata.com/about/leadership/,1,Randy Clarke joined the Washington Metropolitan Area Transit Authority (WMATA) as General Manager and CEO in July 2022.,positive,True
2026-04-03,Randy Clarke,Metrorail,Randy Clarke,https://en.wikipedia.org/wiki/Randy_Clarke,2,Randy Clarke (born 1977) is a Canadian-American transit executive who has served as the general manager and CEO of Washington Metropolitan Area Transit ...,neutral,False
2026-04-03,Randy Clarke,Metrorail,Randy Clarke (@wmatagm),https://www.instagram.com/wmatagm/,3,Completed the 2nd Annual @metroforward MetroTransitPD Recruit General Manager run on the National Mall. These recruits graduate this month joining our great ...,positive,True
2026-04-03,Randy Clarke,Metrorail,Randy Clarke,https://www.govtech.com/top-25/randy-clarke,4,"Clarke is a veteran of helming massive urban transit systems. He previously served as transit chief for Capital Metro in Austin, Texas.",neutral,False
2026-04-03,Randy Clarke,Metrorail,Randy Clarke - Washington Metropolitan Area Transit ...,https://www.linkedin.com/in/randy-clarke-74bb8a69,5,Experience: Washington Metropolitan Area Transit Authority (WMATA) · Education: University of Southern Maine · Location: United States · 500+ connections on ...,positive,True
2026-04-03,Randy Clarke,Metrorail,Randy Clarke (@wmataGM) / Posts / X,https://x.com/wmataGM,6,"Randy Clarke (@wmataGM) - Posts - Proudly leading the @wmata team (America's Metro System) as General Manager & CEO. Also on IG, in.",positive,True
2026-04-03,Randy Clarke,Metrorail,Here's a wild idea: Randy Clarke for D.C. mayor,https://www.axios.com/local/washington-dc/2025/10/30/randy-clarke-metro-dc-mayor-muriel-bowser-election,7,Randy Clarke fixed Metro. Maybe he can fix D.C. next? Why it matters: We need someone to run for mayor! email (opens in new window).,neutral,False
2026-04-03,Randy Clarke,Metrorail,WMATA GM Randy Clarke says any major future ...,https://www.reddit.com/r/WMATA/comments/1pnm30z/wmata_gm_randy_clarke_says_any_major_future/,8,"WMATA GM Randy Clarke says any major future expansions of Metro probably won't look like the Metro of today, specifically mentions light metro ...",neutral,False
2026-04-03,Nora Leerhsen,CTA,Nora Leerhsen,https://en.wikipedia.org/wiki/Nora_Leerhsen,1,"Nora Leerhsen is an American lawyer and executive who has served as the Acting President of the Chicago Transit Authority (CTA) since February 2025, replacing ...",neutral,False
2026-04-03,Nora Leerhsen,CTA,Nora Leerhsen - Chicago Transit Authority,https://www.linkedin.com/in/nora-leerhsen-1ba38847,2,Experience: Chicago Transit Authority · Education: University of Wisconsin Law School · Location: Greater Chicago Area · 500+ connections on LinkedIn.,positive,True
2026-04-03,Nora Leerhsen,CTA,Team | Chicago Transit Authority,https://www.ctabonds.com/chicago-transit-authority-il/about/our-team/i6552,3,"Leerhsen joined the CTA in 2014 and has served in various roles prior to becoming chief of staff in 2018, including senior advisor to the chief of staff/chief ...",positive,True
2026-04-03,Nora Leerhsen,CTA,CTA Governance/Administration,https://www.transitchicago.com/governance/,4,"Nora Leerhsen is the acting president of the Chicago Transit Authority (CTA), one of the nation's largest public transit agencies, providing approximately one ...",positive,True
2026-04-03,Nora Leerhsen,CTA,Statement from CTA Acting President Nora Leerhsen,https://www.transitchicago.com/statement-from-cta-acting-president-nora-leerhsen/,5,"Early this morning, the Illinois State Legislature passed a bill that provides a transformational level of funding for the Chicago Transit ...",positive,True
2026-04-03,Nora Leerhsen,CTA,"On Transit Employee Appreciation Day, I traveled ...",https://www.facebook.com/thecta/posts/a-message-from-cta-acting-president-nora-leerhsenon-transit-employee-appreciatio/1351237193704962/,6,"A message from CTA Acting President Nora Leerhsen: On Transit Employee Appreciation Day, I traveled throughout the system to visit the Harlem ...",positive,True
2026-04-03,Nora Leerhsen,CTA,Acting CTA chief lays out priorities after dodging fiscal cliff,https://www.chicagotribune.com/2026/02/02/acting-cta-chief-lays-out-priorities-after-dodging-fiscal-cliff/,7,"Leerhsen, 43, has been at the CTA for more than a decade, starting as a legal intern before working her way up to chief of staff under former ...",neutral,False
2026-04-03,Nora Leerhsen,CTA,How do we think interim CTA president Nora Leerhsen is ...,https://www.reddit.com/r/chicago/comments/1ldou75/how_do_we_think_interim_cta_president_nora/,8,I think she has been a breath of fresh air. She is way more visible and actually seems to want to understand and improve the rider experience.,neutral,False
2026-04-03,Phillip Eng,MBTA,Phillip Eng | People,https://www.mbta.com/people/phillip-eng,1,Phillip Eng is the General Manager and CEO of the Massachusetts Bay Transportation Authority (MBTA). A Civil Engineer with nearly 40 years of transportation ...,positive,True
2026-04-03,Phillip Eng,MBTA,Phillip Eng,https://en.wikipedia.org/wiki/Phillip_Eng,2,Phillip Eng (born 1961 or 1962) is an American civil engineer and transit executive serving as interim secretary of Massachusetts Department of ...,neutral,False
2026-04-03,Phillip Eng,MBTA,Governor Healey Appoints MBTA General Manager Phil ...,https://www.mass.gov/news/governor-healey-appoints-mbta-general-manager-phil-eng-as-interim-transportation-secretary,3,Boston — Governor Maura Healey announced today that she has named Massachusetts Bay Transportation Authority (MBTA) General Manager Phillip Eng ...,neutral,False
2026-04-03,Phillip Eng,MBTA,"Phillip Eng - Transportation Services, Operations, ...",https://www.linkedin.com/in/phillip-eng-875928240,4,"Transportation Services, Operations, Engineering and Infrastructure · Experience: MassDOT and MBTA · Education: The Cooper Union for the Advancement of ...",positive,True
2026-04-03,Phillip Eng,MBTA,MBTA's Phillip Eng Named Interim MassDOT Secretary,https://aashtojournal.transportation.org/mbtas-phillip-eng-named-interim-massdot-secretary/,5,Massachusetts Governor Maura Healey (D) has appointed Phillip Eng (above at left) – general manager of the Massachusetts Bay Transportation ...,neutral,False
2026-04-03,Phillip Eng,MBTA,Did Phillip Eng fix the MBTA? Reliability and passenger ...,https://www.cbsnews.com/boston/news/mbta-general-manager-phillip-eng/,6,"I'll take it!'"" Eng said. Phillip Eng MBTA General Manager Phillip Eng on the Orange Line. CBS Boston.",neutral,False
2026-04-03,Phillip Eng,MBTA,The MBTA has made incredible strides. Did Phillip Eng fix ...,https://www.reddit.com/r/mbta/comments/1pokx9x/the_mbta_has_made_incredible_strides_did_phillip/,7,"165 votes, 33 comments. Eng is great. He's done tremendous things. I don't think his influence can be overstated.",neutral,False
2026-04-03,Phillip Eng,MBTA,Phil Eng earns rave reviews for simultaneous MBTA ...,https://commonwealthbeacon.org/transportation/interim-or-indefinite-no-end-in-sight-to-phil-engs-double-duty/,8,The Healey administration seems content to have Phil Eng continue to work as both T general manager and interim transportation secretary for ...,neutral,False
2026-04-03,Phillip Eng,MBTA,Leadership at The MBTA,https://www.mbta.com/leadership,9,The MBTA is overseen by the Massachusetts Bay Transportation Authority Board of Directors. Phillip Eng is the Interim MassDOT Secretary and MBTA General Manager ...,positive,True
2026-04-03,Ryan Coholan,The T,Ryan Coholan - MBTA,https://www.linkedin.com/in/ryan-coholan-139014ab,1,Experienced Chief Operating Officer with a demonstrated history of working in the… · Experience: MBTA · Education: Cornell University · Location: United ...,positive,True
2026-04-03,Ryan Coholan,The T,MBTA COO drives commuter rail train from Boston to Fall ...,https://www.heraldnews.com/picture-gallery/news/2026/03/24/mbta-coo-ryan-coholan-talks-south-coast-rail-from-boston-to-fall-river/89294351007/,2,"MBTA Chief Operating Officer Ryan Coholan operates a commuter rail train outside South Station, Boston, on March 10, 2026. Dan Medeiros.",neutral,False
2026-04-03,Ryan Coholan,The T,Ryan Coholan - Massachusetts Bay Transportation Authority ...,https://cthrupayroll.mass.gov/?os=shmmfp&ref=app#!/year/2024/full_time_employees%2Cothers/pay1%2Cpay2%2Cpay3%2Cpay4/explore%2F0-0-0%2Ftrans_no%2F17915261%2F0%2Fdepartment_division,3,"Pay Check · Coholan · Ryan · MBTA Exec Main Fund · $299,084.71 · $299,084.71 $299,084.71. « ‹ 1; ›; ». Payroll Details. Total Pay. $ 299,085. Base Pay. $299,085.",positive,False
