date,ceo,company,title,url,position,snippet,sentiment,controlled
2026-05-25,Nora Leerhsen,The L,A Conversation with Nora Leerhsen,https://transitunplugged.com/transit-unplugged-podcast/the-unmatched-power-of-transit-a-conversation-with-nora-leerhsen/,7,"A lawyer and former educator who rose through the ranks from compliance officer to chief of staff and now acting president, Nora shares her deep ...",neutral,False
2026-05-25,Nora Leerhsen,The L,What would you say to the CTA President Nora Leerhsen?,https://www.reddit.com/r/cta/comments/1thoza8/what_would_you_say_to_the_cta_president_nora/,8,I work near the CTA headquarters and often run into CTA President Nora Leerhsen on the sidewalk or getting off the train. I usually say hello and yesterday ...,neutral,False
2026-05-25,Janno Lieber,MTA,Janno Gibbs,https://en.wikipedia.org/wiki/Janno_Gibbs,1,"Janno Ronaldo Ilagan Gibbs (born September 16, 1969) is a Filipino singer, songwriter, comedian and actor. He was a regular host of GMA Network television shows ...",neutral,False
2026-05-25,Janno Lieber,MTA,JANNO,https://open.spotify.com/artist/7hpiHzP9aLLb5liDLxtwhM,2,Singles and EPs · JUNGS AUF NER BANK · Zweizwei Cypher · Neckbreaker · Get Down · Moon Rocks · HYPERAKTIV · GET THE FUCK UP · ALLES WAS WAR. Single • 2025 ...,neutral,False
2026-05-25,Janno Lieber,MTA,JANNO,https://music.apple.com/us/artist/janno/1540884909,3,"Listen to music by JANNO on Apple Music. Find top songs and albums by JANNO including Neckbreaker, Get Down and more.",neutral,False
2026-05-25,Janno Lieber,MTA,Janno-JannoDisney-Juguilon,https://www.youtube.com/@janno-jannodisney-juguilon2340,4,"What I love to do is to watch my best animated, action movies. I create my own crossover videos/spoofs, make MMD vids, and photoshop screencaps to make my ...",neutral,False
2026-05-25,Janno Lieber,MTA,Janno,https://en.wikipedia.org/wiki/Janno,5,"Janno is both a masculine given name and a surname predominantly found in Estonia. As a given name it can be a diminutive of Johannes, Juhan, Jan, Jaan, and ...",neutral,False
2026-05-25,Janno Lieber,MTA,Janno Ilagan Gibbs (@jannolategibbs),https://www.instagram.com/jannolategibbs/,6,"Artist, Political Angalist ... 'ChickBoy' A Vertical Mini Series.Now Streaming on @vmbvivamoviebox . Directed by JannoGibbs Starring RobbGuinto DjDurano ...",positive,True
2026-05-25,Janno Lieber,MTA,Janno Trump - musician/bassplayer,https://www.jannotrump.com/,7,Janno Trump is one of the most notable younger generation bassists in Estonia and a bandleader of the jazz-funk orchestra JT Conception.,neutral,False
2026-05-25,Janno Lieber,MTA,Janno Lieber,https://www.mta.info/transparency/leadership/executive-leadership/janno-lieber,8,John (“Janno”) Lieber was confirmed as Chair and CEO of the Metropolitan Transportation Authority (MTA) in January 2022.,positive,True
2026-05-25,Janno Lieber,MTA,Janno Gibbs,https://www.youtube.com/playlist?list=PLTFmW0eINFNPYz0IJw1EqUTjtreptZkPf,9,"Janno Gibbs & Manilyn Reynes' version of ""MY JAGIYA"" | FULL VIDEO · The Gibbs' version of 'ONE DAY' I FULL VIDEO · Janno Gibbs sings 'CHANDELIER' I FULL VIDEO.",neutral,False
2026-05-25,Janno Lieber,OMNY,MTA chief vows fare evasion crackdown on NYC buses ...,https://gothamist.com/news/mta-chief-vows-fare-evasion-crackdown-on-nyc-buses-once-metrocard-retires,1,MTA Chair Janno Lieber said requiring all riders to pay with OMNY will make it easier to check who has actually paid.,neutral,False
2026-05-25,Janno Lieber,OMNY,MTA Chair Janno Lieber says the MTA will be stepping up fare ...,https://www.instagram.com/reel/DVzI3DoknWn/,2,MTA Chair Janno Lieber says the MTA will be stepping up fare evasion measures for buses. ... OMNY card. However you pay and they'll be able to ...,positive,True
2026-05-25,Janno Lieber,OMNY,"Janno Lieber on Free Buses, the State of the MTA, & The ...",https://nyeditorialboard.substack.com/p/janno-lieber-on-free-buses-the-state,3,"Janno Lieber, Chair and CEO of the Metropolitan Transportation Authority (MTA), which runs the New York City subways and buses, ...",positive,False
2026-05-25,Janno Lieber,OMNY,Janno Lieber,https://www.mta.info/transparency/leadership/executive-leadership/janno-lieber,4,"Lieber has been serving as MTA Acting Chair and CEO since July 2021 and is the Authority's 15th Chairperson since it was founded in 1968. In this position, ...",positive,True
2026-05-25,Janno Lieber,OMNY,Reduced Fare OMNY | MTA Chair & CEO Janno Lieber ...,https://www.flickr.com/photos/mtaphotos/54201236297/,5,"MTA Chair & CEO Janno Lieber announces the release of Reduced Fare OMNY cards on Friday, Dec 13, 2024 at the Stone Street Customer Service ...",neutral,False
2026-05-25,Janno Lieber,OMNY,What's your thoughts and opinions on MTA CEO Janno ...,https://www.reddit.com/r/nycrail/comments/1qninf7/whats_your_thoughts_and_opinions_on_mta_ceo_janno/,6,"41 votes, 82 comments. Two things are true: Janno is the most competent leader the MTA has had in generations.",neutral,False
2026-05-25,Janno Lieber,OMNY,MTA CEO Janno Lieber unveils his bus and subway wish list ...,https://www.youtube.com/watch?v=OhGDR1keDmM,7,"Lieber wants to makes fares less expensive for poor people, crack down further on fare evasion, and create more bus lanes.",positive,False
2026-05-25,Janno Lieber,OMNY,MTA head Janno Lieber has a wish list for 2026. Here's his ...,https://www.cbsnews.com/newyork/news/mta-janno-lieber-nyc-bus-fares-bus-lanes-fare-evasion/,8,MTA head Janno Lieber has a wish list for 2026. Here's his plan for NYC buses and subways. By. Marcia Kramer.,positive,False
2026-05-25,Monica Tibbits-Nutt,MBTA,Monica (singer),https://en.wikipedia.org/wiki/Monica_(singer),1,"Monica Denise Arnold (formerly Brown; born October 24, 1980), best known mononymously as Monica, is an American singer, songwriter, and actress.",neutral,False
2026-05-25,Monica Tibbits-Nutt,MBTA,MONICA (@monicadenise) • Instagram photos and videos,https://www.instagram.com/monicadenise/?hl=en,2,Learning to Live in the Moment & Make Time has been one of life's greatest Lesson ♥️ LOVE YOUR FAMILY ….. That includes the one you created.,positive,True
2026-05-25,Monica Tibbits-Nutt,MBTA,Monica,https://www.facebook.com/monica/,3,Monica. 7464981 likes · 40995 talking about this. https://linktr.ee/MonicaOfficial.,positive,True
2026-05-25,Monica Tibbits-Nutt,MBTA,Monica,https://open.spotify.com/artist/6nzxy2wXs6tLgzEtqOkEi2,4,"She put together four straight Top Ten albums, including the chart-topping After the Storm (2003), and each one involved established and emergent Georgians as ...",neutral,False
2026-05-25,Monica Tibbits-Nutt,MBTA,Monica.com,https://www.monica.com/,5,"MONICA is a Grammy Award-winning Multi-platinum Artist, 25-million-plusselling singer, actress, philanthropist and entrepreneur.",neutral,False
2026-05-25,Monica Tibbits-Nutt,MBTA,monicaofficial,https://www.youtube.com/@Monica,6,"Monica Host VH1 True-Crime Series 'Infamy' When Fame Turns Deadly. Monica hosts a series exploring the dark side of the American Dream, chronicling untold ...",neutral,False
2026-05-25,Monica Tibbits-Nutt,MBTA,MONICA Definition & Meaning,https://www.dictionary.com/browse/monica,7,MONICA definition: a female given name. See examples of Monica used in a sentence.,neutral,False
2026-05-25,Monica Tibbits-Nutt,MBTA,Monica,https://music.apple.com/us/artist/monica/334240,8,"Like her peers Brandy and Aaliyah, Monica (born Monica Denise Arnold in 1980) was a former choir kid who blossomed into a bona fide R&B teen queen.",neutral,False
2026-05-25,Monica Tibbits-Nutt,MBTA,Monica (2022),https://www.imdb.com/title/tt6337816/,9,"When Monica (Trace Lysette), a transgender woman kicked out by her family as an adolescent, leaves her Midwestern home and heads to California to start a new ...",neutral,False
2026-05-25,Ryan Coholan,The T,Ryan's World,https://www.youtube.com/channel/UChGJGhZ9SOOHvBB0Y4DOO_w,1,"Ryan loves doing lots of fun things like pretend play, science experiments, music videos, skits, challenges, DIY arts and crafts and more!",neutral,False
2026-05-25,Ryan Coholan,The T,Ryan Trahan,https://www.youtube.com/@ryan,2,Popular videos · I Tried Every Seat on the Most Expensive Airline · I Spent 100 Days in the Metaverse · I Spent 100 Days in Realistic Minecraft. 47M views. 4 ...,neutral,False
2026-05-25,Ryan Coholan,The T,Ryan's World,https://ryans.world/,3,The best in children's entertainment period · Latest Content · LegoLand · Transformers · Mattel: Jurassic World Toys · Mark Rober & Crunch Labs · The Ninja ...,neutral,False
2026-05-25,Ryan Coholan,The T,Ryan's World,https://en.wikipedia.org/wiki/Ryan%27s_World,4,Ryan's World (formerly Ryan ToysReview) is a YouTube channel for children featuring Ryan Kaji along with his family.,neutral,False
2026-05-25,Ryan Coholan,The T,Ryan's World (TV Series 2017–2024),https://www.imdb.com/title/tt12987338/,5,"Ryan's World is a children's YouTube channel featuring Ryan Kaji along with his mother, father, and twin sisters.",neutral,False
2026-05-25,Ryan Coholan,The T,Ryan's World (@ryansworld) • Instagram photos and videos,https://www.instagram.com/ryansworld/?hl=en,6,Ryan's World The Movie is out now in Theaters! #ryansworld #kidsmovies. Robert Downey Jr. posted a personalized message to Ryan Thank you RDJ! Robert ...,positive,True
2026-05-25,Ryan Coholan,The T,Ryan,https://music.apple.com/us/artist/ryan/1415223338,7,"Listen to music by Ryan on Apple Music. Find top songs and albums by Ryan including Trippin' On U, From Afar (feat. Ryan) and more.",neutral,False
2026-05-25,Ryan Coholan,Massachusetts Bay Transportation Authority,Ryan's World,https://www.youtube.com/channel/UChGJGhZ9SOOHvBB0Y4DOO_w,1,"Ryan loves doing lots of fun things like pretend play, science experiments, music videos, skits, challenges, DIY arts and crafts and more!",neutral,False
2026-05-25,Ryan Coholan,Massachusetts Bay Transportation Authority,Ryan's World,https://ryans.world/,2,The best in children's entertainment period · Latest Content · LegoLand · Transformers · Mattel: Jurassic World Toys · Mark Rober & Crunch Labs · The Ninja ...,neutral,False
2026-05-25,Ryan Coholan,Massachusetts Bay Transportation Authority,Ryan's Epic Adventure Catching his Own Fish for Dinner!,https://www.youtube.com/watch?v=JOeA304mYdg,3,Kate's friend gave us a giant crab so I know they actually went crabbing yesterday and this is what they caught so it seems huge.,positive,False
2026-05-25,Ryan Coholan,Massachusetts Bay Transportation Authority,Ryan Trahan,https://www.youtube.com/@ryan,4,Popular videos · I Tried Every Seat on the Most Expensive Airline · I Spent 100 Days in the Metaverse · I Spent 100 Days in Realistic Minecraft. 47M views. 4 ...,neutral,False
2026-05-25,Ryan Coholan,Massachusetts Bay Transportation Authority,Ryan's YOU SPELL IT I BUY IT Challenge!,https://www.youtube.com/watch?v=udXHQmTGy1g,5,Find Body Parts Games for Kids with 1 hour Fun Board Games to Play!!!! Ryan's World · 72M views ; 10 YouTubers vs 1 Secret Traitor · New. 13M views.,positive,False
2026-05-25,Ryan Coholan,Massachusetts Bay Transportation Authority,Ryan VS Dad Play the LYING CHALLENGE!,https://www.youtube.com/watch?v=dmljERG1rms,6,They have five questions to figure out if the other person is lying or telling the truth.,negative,False
2026-05-25,Ryan Coholan,Massachusetts Bay Transportation Authority,Ryan's World,https://www.youtube.com/@RyansWorld,7,"Share your videos with friends, family, and the world.",neutral,False
2026-05-25,Ryan Coholan,Massachusetts Bay Transportation Authority,BEST of 2025 Recap of Games & Fun Challenges from Ryan's ...,https://www.youtube.com/watch?v=UQMPKD8hnMs,8,We had so much fun with you all. You guys are the best. To celebrate we wanted to share some of our favorite moments from the year of 2025.,positive,False
2026-05-25,Ryan Coholan,Massachusetts Bay Transportation Authority,Ryan's BEST McDonald's Pretend Play Food Toys & Cook ...,https://www.youtube.com/watch?v=W5vHx_WcZ38,9,Ryan's BEST McDonald's Pretend Play Food Toys & Cook with Food Toys.,positive,False
2026-05-25,Ryan Coholan,Massachusetts Bay Transportation Authority,"Hilarious Back to School Adventures with Ryan, Emma, & Kate!",https://www.youtube.com/watch?v=UvWHEHHWQIs,10,Go to channel Ryan's World · Ryan plays Bugs In Bed and more 1 hour fun games for kids! Ryan's World•31M views · 1:02:14. Go to channel Ryan's ...,positive,False
2026-05-25,Ryan Coholan,MBTA,Ryan Coholan - Chief Operating Officer at MBTA,https://www.linkedin.com/in/ryan-coholan-139014ab,1,"Experienced Chief Operating Officer with a demonstrated history of working in the transportation/trucking/railroad industry. Skilled in Budgeting, Operations ...",positive,True
2026-05-25,Ryan Coholan,MBTA,Ryan Coholan - Massachusetts Bay Transportation Authority ...,https://cthrupayroll.mass.gov/?os=shmmfp&ref=app#!/year/2024/full_time_employees%2Cothers/pay1%2Cpay2%2Cpay3%2Cpay4/explore%2F0-0-0%2Ftrans_no%2F17915261%2F0%2Fdepartment_division,2,Ryan Coholan - Massachusetts Bay Transportation Authority (MBT) - Chief Operating Officer Massachusetts Bay Transportation Authority (MBT).,positive,False
2026-05-25,Ryan Coholan,MBTA,MBTA COO drives commuter rail train from Boston to Fall ...,https://www.heraldnews.com/picture-gallery/news/2026/03/24/mbta-coo-ryan-coholan-talks-south-coast-rail-from-boston-to-fall-river/89294351007/,3,"MBTA Chief Operating Officer Ryan Coholan operates a commuter rail train at South Station, Boston, on March 10, 2026. Dan Medeiros.",neutral,False
2026-05-25,Ryan Coholan,MBTA,Conversation with MBTA's COO Ryan Coholan,https://transitunplugged.com/transit-unplugged-podcast/ryan-coholan-mbta/,4,"Host Paul Comfort sits down with Ryan Coholan, the Chief Operating Officer of the Massachusetts Bay Transportation Authority (MBTA or The T) in Boston.",neutral,False
2026-05-25,Ryan Coholan,MBTA,CCMRRCAM praises MBTA's Ryan Coholan for innovative ...,https://www.facebook.com/ccmrrcam/posts/when-it-comes-to-making-a-meaningful-difference-about-how-the-mbta-serves-the-ci/1285749126448679/,5,"Simply put, Ryan Coholan has been the lead innovator, manager and cheerleader for rail service in the Commonwealth. Countless organizations ( ...",positive,True
2026-05-25,Ryan Coholan,MBTA,The MBTA Advisory Board,https://mbtaadvisoryboard.org/wp-content/uploads/2024/04/MinutesMBTAAB-12-05-23APPROVED.pdf,6,Coholan is responsible for the operation of all MBTA modes. He was appointed. COO by General Manager Philip Eng in September 2023. Mr. Coholan introduced his ...,positive,True
2026-05-25,Ryan Coholan,MBTA,"Today, COO Ryan Coholan joined State Senator ...",https://www.instagram.com/p/DPWzqsCEoZw/,7,"Today, COO Ryan Coholan joined State Senator ... mbta.com/news #MBTA #PublicTransportation #WilmingtonMA #TAccess #Accessibility ...",positive,True
2026-05-25,Ryan Coholan,MBTA,Cultivating Culture at the MBTA with COO Ryan Coholan,https://soundcloud.com/spilling-the-t-podcast/cultivating-culture-at-the-mbta-with-coo-ryan-coholan,8,"On this episode, Chief Operating Officer Ryan Coholan joins us to discuss his unique approach to leading Operations at the MBTA.",neutral,False
2026-05-25,Janno Lieber,NYC Subway,Janno Gibbs,https://en.wikipedia.org/wiki/Janno_Gibbs,1,"Janno Ronaldo Ilagan Gibbs (born September 16, 1969) is a Filipino singer, songwriter, comedian and actor. He was a regular host of GMA Network television shows ...",neutral,False
2026-05-25,Janno Lieber,NYC Subway,JANNO,https://open.spotify.com/artist/7hpiHzP9aLLb5liDLxtwhM,2,Singles and EPs · JUNGS AUF NER BANK · Zweizwei Cypher · Neckbreaker · Get Down · Moon Rocks · HYPERAKTIV · GET THE FUCK UP · ALLES WAS WAR. Single • 2025 ...,neutral,False
2026-05-25,Janno Lieber,NYC Subway,JANNO,https://music.apple.com/us/artist/janno/1540884909,3,"Listen to music by JANNO on Apple Music. Find top songs and albums by JANNO including Neckbreaker, Get Down and more.",neutral,False
2026-05-25,Janno Lieber,NYC Subway,Janno-JannoDisney-Juguilon,https://www.youtube.com/@janno-jannodisney-juguilon2340,4,"What I love to do is to watch my best animated, action movies. I create my own crossover videos/spoofs, make MMD vids, and photoshop screencaps to make my ...",neutral,False
2026-05-25,Janno Lieber,NYC Subway,Janno,https://en.wikipedia.org/wiki/Janno,5,"Janno is both a masculine given name and a surname predominantly found in Estonia. As a given name it can be a diminutive of Johannes, Juhan, Jan, Jaan, and ...",neutral,False
2026-05-25,Janno Lieber,NYC Subway,Janno Ilagan Gibbs (@jannolategibbs),https://www.instagram.com/jannolategibbs/,6,"Artist, Political Angalist ... 'ChickBoy' A Vertical Mini Series.Now Streaming on @vmbvivamoviebox . Directed by JannoGibbs Starring RobbGuinto DjDurano ...",positive,True
2026-05-25,Janno Lieber,NYC Subway,Janno Trump - musician/bassplayer,https://www.jannotrump.com/,7,Janno Trump is one of the most notable younger generation bassists in Estonia and a bandleader of the jazz-funk orchestra JT Conception.,neutral,False
2026-05-25,Janno Lieber,NYC Subway,Janno Lieber,https://www.mta.info/transparency/leadership/executive-leadership/janno-lieber,8,John (“Janno”) Lieber was confirmed as Chair and CEO of the Metropolitan Transportation Authority (MTA) in January 2022.,positive,True
2026-05-25,Janno Lieber,NYC Subway,Janno Gibbs,https://www.youtube.com/playlist?list=PLTFmW0eINFNPYz0IJw1EqUTjtreptZkPf,9,"Janno Gibbs & Manilyn Reynes' version of ""MY JAGIYA"" | FULL VIDEO · The Gibbs' version of 'ONE DAY' I FULL VIDEO · Janno Gibbs sings 'CHANDELIER' I FULL VIDEO.",neutral,False
2026-05-25,Nora Leerhsen,CTA,Nora Lighting - Illuminating the Future®,https://noralighting.com/,1,"Nora Lighting is a leading manufacturer of LED luminaires for residential, commercial, and institutional applications.",neutral,False
2026-05-25,Nora Leerhsen,CTA,Nora (name),https://en.wikipedia.org/wiki/Nora_(name),2,"Nora or Norah is a feminine given name. It mainly originates as a short form of Honora (also Honoria), a common Anglo-Norman name, ultimately derived from the ...",neutral,False
2026-05-25,Nora Leerhsen,CTA,Nora (2025),https://www.imdb.com/title/tt15272328/,3,"A former musician settles in suburbia to raise her child. When her husband travels for work, she navigates single parenthood, a new home, and lingering musical ...",neutral,False
2026-05-25,Nora Leerhsen,CTA,About NORA,https://noraweb.org/about-nora/,4,"NORA was authorized by Congress in 2000 to provide funding that enables the liquid fuel heating industry to provide more efficient, more reliable and lower ...",neutral,False
2026-05-25,Nora Leerhsen,CTA,NORA,https://open.spotify.com/artist/2pH0QIWh7UyhPZHit7eCQG,5,Listen to NORA on Spotify. Artist · 3.3K monthly listeners.,neutral,False
2026-05-25,Nora Leerhsen,CTA,Nora | Italian Restaurant & Bar in Chicago | Nora,https://www.norarestaurant.com/,6,"We are located at 636 North Saint Clair Street, Chicago, IL, 60611, US and serve Streeterville, Magnificent Mile, River North, Downtown Chicago, Gold Coast, ...",neutral,False
2026-05-25,Nora Leerhsen,CTA,"Nora - Baby Name Meaning, Origin and Popularity",https://www.thebump.com/b/nora-baby-name,7,"Nora is a feminine name that has several origins. Considered a shortened form of Honora, Nora assumes the meaning of ""honor"" from the Latin Honorius.",positive,False
2026-05-25,Nora Leerhsen,CTA,NoRa Cafe | Home,https://www.noracafenc.com/,8,"North Raleigh's favorite meeting spot. Voted 2025 Best Local Coffee Shop of Wake County, NoRa is a warm, comfortable place to come.",neutral,False
2026-05-25,Phillip Eng,Massachusetts Bay Transportation Authority,Philips - United States | Philips,https://www.usa.philips.com/?srsltid=AfmBOoqDyRZ3VegbFt5jBFrRYdPQsgjljRrCWt9uODKitwsXUEF1KiXO,1,"Learn more about Philips and how we help improve people's lives through meaningful innovation in the areas of Healthcare, Consumer Lifestyle and Lighting.",positive,False
2026-05-25,Phillip Eng,Massachusetts Bay Transportation Authority,Phillip Phillips (@PhillipPhillips),https://www.facebook.com/PhillipPhillips/,2,MUSICIAN/BAND · 255 talking about this · New single “Homesick” out now! ⬇️ https://stem.ffm.to/homesickphillip.,positive,True
2026-05-25,Phillip Eng,Massachusetts Bay Transportation Authority,Phillip Phillips (@phillphill) • Instagram photos and videos,https://www.instagram.com/phillphill/?hl=en,3,"I've known @phillphill for about twelve years now. We've written countless songs together, shared endless jokes, and seen each other through some hard times and ...",positive,True
2026-05-25,Phillip Eng,Massachusetts Bay Transportation Authority,Philip the Apostle,https://en.wikipedia.org/wiki/Philip_the_Apostle,4,Philip the Apostle was one of the Twelve Apostles of Jesus according to the New Testament. Later Christian traditions describe Philip as the apostle who ...,neutral,False
2026-05-25,Phillip Eng,Massachusetts Bay Transportation Authority,Phillip Phillips,https://open.spotify.com/artist/6p5JxpTc7USNnBnLzctyd4,5,"Singles and EPs · Homesick · Gone, Gone, Gone (Phillip's Version) · Home (Phillip's Version) · Dancing With Your Shadows (Demo Version) · So Will I · Before I ...",neutral,False
2026-05-25,Phillip Eng,Massachusetts Bay Transportation Authority,Phillip Phillips,https://www.phillipphillips.com/,6,Phillip Phillips. Open Menu Close Menu. Music · Video · Tour · Store · Phillip Phillips.,neutral,False
2026-05-25,Phillip Eng,Massachusetts Bay Transportation Authority,Phillip Phillips,https://www.imdb.com/name/nm4922087/,7,"Phillip Phillips was born on 20 September 1990 in Albany, Georgia, USA. He is an actor, known for American Idol (2002), The Amazing Spider-Man 2 (2014) and ...",neutral,False
2026-05-25,Phillip Eng,Massachusetts Bay Transportation Authority,Phillip Phillips,https://www.youtube.com/channel/UCZYewi2Ya8JledgJImmXIWg,8,"Music Videos · Phillip Phillips - Home · Phillip Phillips - Gone, Gone, Gone · Phillip Phillips - Raging Fire. Phillip Phillips. 14M views. 12 years ago. CC ...",neutral,False
2026-05-25,Randy Clarke,Metrorail,RANDY Definition & Meaning,https://www.merriam-webster.com/dictionary/randy,1,"1. chiefly Scotland : having a coarse manner 2. lustful, lecherous randiness noun randy 2 of 2 noun plural randies chiefly Scotland : a scolding or dissolute ...",neutral,False
2026-05-25,Randy Clarke,Metrorail,Randy,https://open.spotify.com/artist/1Qote9MpqMZluWzYGifZUg,2,Listen to Randy on Spotify. Artist · 1.7M monthly listeners.,neutral,False
2026-05-25,Randy Clarke,Metrorail,Randy,https://en.wikipedia.org/wiki/Randy,3,"Randy is a primarily masculine given name. It is popular in the United States and Canada. It was originally derived from the names Randall, Randolph, and ...",neutral,False
2026-05-25,Randy Clarke,Metrorail,randy,https://en.wiktionary.org/wiki/randy,4,"Noun · An impudent beggar. · A boisterous, coarse, loose woman. · A virago. Translations.",neutral,False
2026-05-25,Randy Clarke,Metrorail,RANDY Definition & Meaning,https://www.dictionary.com/browse/randy,5,RANDY definition: sexually aroused; lustful; lecherous. See examples of randy used in a sentence.,neutral,False
2026-05-25,Randy Clarke,Metrorail,Randy (@randy) • Instagram photos and videos,https://www.instagram.com/randy/,6,"Genuine, generous. It's hard to describe how amazing of a human @guyfieri is! Genuine, generous and caring are my 3 words that best fit.",positive,True
2026-05-25,Randy Clarke,Metrorail,Randy - song and lyrics by Justice,https://open.spotify.com/track/5cOKKOFgMhjZaOT5qvnagi,7,"Recommended releases. Audio, Video, Disco. Album • 2011 · Helix. EP • 2013 · Randy (Radio Edit). Single • 2016 · Genie (feat. Mayer Hawthorne).",positive,False
2026-05-25,Randy Clarke,Metrorail,RANDY | definition in the Cambridge English Dictionary,https://dictionary.cambridge.org/us/dictionary/english/randy,8,feeling a lot of sexual desire. Synonym: horny (SEXUAL) informal. Related word: randiness (Definition of randy from the Cambridge Advanced Learner's Dictionary ...,neutral,False
