date,ceo,company,title,url,position,snippet,sentiment,controlled
2026-04-08,Monica Tibbits-Nutt,MBTA,Massachusetts Transportation Sec. Monica Tibbits-Nutt ...,https://www.cbsnews.com/boston/news/monica-tibbits-nutt-phil-eng-massdot/,6,Transportation Sec. Monica Tibbits-Nutt is out and MBTA GM Phil Eng was promoted in a MassDOT shakeup.,neutral,False
2026-04-08,Monica Tibbits-Nutt,MBTA,"MassDOT secretary Tibbits-Nutt steps down, MBTA chief ...",https://www.reddit.com/r/boston/comments/1o876bw/massdot_secretary_tibbitsnutt_steps_down_mbta/,7,"Massachusetts Department of Transportation secretary Monica Tibbits-Nutt will step down from her position, Governor Maura Healey announced ...",neutral,False
2026-04-08,Monica Tibbits-Nutt,MBTA,"Tibbits-Nutt out, Eng elevated in abrupt shakeup at MassDOT",https://commonwealthbeacon.org/transportation/tibbits-nutt-out-eng-elevated-in-abrupt-shakeup-at-massdot/,8,"Transportation Secretary Monica Tibbits-Nutt suddenly resigned Thursday, prompting the governor to ask the head of the MBTA and the state's ...",negative,False
2026-04-08,Monica Tibbits-Nutt,MBTA,Governor Healey Appoints MBTA General Manager Phil ...,https://www.mass.gov/news/governor-healey-appoints-mbta-general-manager-phil-eng-as-interim-transportation-secretary,9,... (MBTA) General Manager Phillip Eng as Interim Transportation Secretary. Monica Tibbits-Nutt has made the decision to step down from her ...,neutral,False
2026-04-08,Phillip Eng,Massachusetts Bay Transportation Authority,Phillip Eng | People,https://www.mbta.com/people/phillip-eng,1,Phillip Eng is the General Manager and CEO of the Massachusetts Bay Transportation Authority (MBTA). A Civil Engineer with nearly 40 years of transportation ...,positive,True
2026-04-08,Phillip Eng,Massachusetts Bay Transportation Authority,Phillip Eng,https://en.wikipedia.org/wiki/Phillip_Eng,2,Phillip Eng (born 1961 or 1962) is an American civil engineer and transit executive serving as interim secretary of Massachusetts Department of ...,neutral,False
2026-04-08,Phillip Eng,Massachusetts Bay Transportation Authority,"Phillip Eng - Transportation Services, Operations, ...",https://www.linkedin.com/in/phillip-eng-875928240,3,"Transportation Services, Operations, Engineering and Infrastructure · Experience: MassDOT and MBTA · Education: The Cooper Union for the Advancement of ...",positive,True
2026-04-08,Phillip Eng,Massachusetts Bay Transportation Authority,Governor Healey Appoints MBTA General Manager Phil ...,https://www.mass.gov/news/governor-healey-appoints-mbta-general-manager-phil-eng-as-interim-transportation-secretary,4,Highway Administrator Jonathan Gulliver promoted to Undersecretary of Transportation; Interim Secretary and GM Eng to hold media ...,neutral,False
2026-04-08,Phillip Eng,Massachusetts Bay Transportation Authority,MBTA's Phillip Eng Named Interim MassDOT Secretary,https://aashtojournal.transportation.org/mbtas-phillip-eng-named-interim-massdot-secretary/,5,Massachusetts Governor Maura Healey (D) has appointed Phillip Eng (above at left) – general manager of the Massachusetts Bay Transportation ...,neutral,False
2026-04-08,Phillip Eng,Massachusetts Bay Transportation Authority,Phillip Eng,https://www.massport.com/our-business/leadership/phillip-eng,6,Phillip Eng leads Massachusetts' transportation network as Interim Secretary of Transportation and General Manager of the MBTA.,positive,True
2026-04-08,Phillip Eng,Massachusetts Bay Transportation Authority,Did Phillip Eng fix the MBTA? Reliability and passenger ...,https://www.cbsnews.com/boston/news/mbta-general-manager-phillip-eng/,7,"I'll take it!'"" Eng said. Phillip Eng MBTA General Manager Phillip Eng on the Orange Line. CBS Boston.",neutral,False
2026-04-08,Phillip Eng,Massachusetts Bay Transportation Authority,To a T: How Phillip Eng got Boston's subway system back ...,https://www.csmonitor.com/Business/2025/1115/boston-mbta-phillip-eng,8,Many now see America's oldest subway system as a model for repairing the country's crumbling transportation infrastructure – a huge ...,neutral,False
2026-04-08,Phillip Eng,Massachusetts Bay Transportation Authority,Leadership at The MBTA,https://www.mbta.com/leadership,9,The MBTA is overseen by the Massachusetts Bay Transportation Authority Board of Directors. Phillip Eng is the Interim MassDOT Secretary and MBTA General Manager ...,positive,True
2026-04-08,Janno Lieber,NYC Subway,Janno Lieber,https://www.mta.info/transparency/leadership/executive-leadership/janno-lieber,1,"Lieber has been serving as MTA Acting Chair and CEO since July 2021 and is the Authority's 15th Chairperson since it was founded in 1968. In this position, ...",positive,True
2026-04-08,Janno Lieber,NYC Subway,Janno Lieber,https://en.wikipedia.org/wiki/Janno_Lieber,2,"John Nathan ""Janno"" Lieber (born September 19, 1961) is the head of the Metropolitan Transportation Authority (MTA) in New York.",neutral,False
2026-04-08,Janno Lieber,NYC Subway,Janno Lieber - Metropolitan Transportation Authority,https://www.linkedin.com/in/janno-lieber-32b487158,3,"An accomplished executive working at the intersection of government, real estate and law.… · Experience: Metropolitan Transportation Authority · Education: ...",positive,True
2026-04-08,Janno Lieber,NYC Subway,"Janno Lieber on Free Buses, the State of the MTA, & The ...",https://nyeditorialboard.substack.com/p/janno-lieber-on-free-buses-the-state,4,"Janno Lieber, Chair and CEO of the Metropolitan Transportation Authority (MTA), which runs the New York City subways and buses, ...",positive,False
2026-04-08,Janno Lieber,NYC Subway,What's your thoughts and opinions on MTA CEO Janno ...,https://www.reddit.com/r/nycrail/comments/1qninf7/whats_your_thoughts_and_opinions_on_mta_ceo_janno/,5,Janno is the most competent leader the MTA has had in generations. He truly cares about the system and regularly rides it (which a surprising ...,neutral,False
2026-04-08,Janno Lieber,NYC Subway,INTERVIEW: MTA Chair Janno Lieber Talks to Streetsblog ...,https://nyc.streetsblog.org/2026/01/21/interview-mta-chair-janno-lieber-talks-to-streetsblog-to-mark-four-years-at-the-top,6,"MTA chairman Janno Lieber sat down with Streetsblog for an in-depth interview about his tenure, congestion pricing, buses and more.",neutral,False
2026-04-08,Janno Lieber,NYC Subway,Statement from MTA Chair and CEO Janno Lieber on,https://www.mta.info/press-release/statement-mta-chair-and-ceo-janno-lieber-opinion-and-order-us-district-judge-lewis-j,7,"“We've said it all along, and Judge Liman's clear, detailed ruling leaves no doubt: congestion pricing is legal. It's here to stay.",positive,True
2026-04-08,Janno Lieber,NYC Subway,MTA chair Janno Lieber speaks on the commuter delays ...,https://www.instagram.com/reel/DVyn_WcDsMQ/,8,"""The overwhelming majority, almost 90% of New York City subway riders want the two-person train crew. They want the conductors on the trains.",positive,True
