date,ceo,company,title,url,position,snippet,sentiment,controlled
2026-06-09,Phillip Eng,The T,Governor Healey Appoints MBTA General Manager Phil ...,https://www.mass.gov/news/governor-healey-appoints-mbta-general-manager-phil-eng-as-interim-transportation-secretary,7.0,Highway Administrator Jonathan Gulliver promoted to Undersecretary of Transportation; Interim Secretary and GM Eng to hold media ...,neutral,False
2026-06-09,Phillip Eng,The T,MBTA's Phillip Eng Named Interim MassDOT Secretary,https://aashtojournal.transportation.org/mbtas-phillip-eng-named-interim-massdot-secretary/,8.0,"October 17, 2025. Massachusetts Governor Maura Healey (D) has appointed Phillip Eng (above at left) – general manager of the Massachusetts Bay ...",neutral,False
2026-06-09,Phillip Eng,The T,To a T: How Phillip Eng got Boston's subway system back ...,https://www.csmonitor.com/Business/2025/1115/boston-mbta-phillip-eng,9.0,Many now see America's oldest subway system as a model for repairing the country's crumbling transportation infrastructure – a huge ...,neutral,False
2026-06-09,Monica Tibbits-Nutt,The T,Monica Tibbits-Nutt,https://www.massport.com/our-business/leadership/monica-tibbits-nutt,1.0,"Monica G. Tibbits-Nutt, is the Secretary and CEO of the Massachusetts Department of Transportation (MassDOT).",positive,True
2026-06-09,Monica Tibbits-Nutt,The T,"Monica Tibbits-Nutt, FAICP, LEED AP BD C",https://www.linkedin.com/in/monica-tibbits-nutt,2.0,"Transportation Executive | Growth & Sales Leader | Strategic Client Advisor | Rail, Transit & Infrastructure · Transportation executive and growth leader ...",positive,True
2026-06-09,Monica Tibbits-Nutt,The T,MassFiscal Responds to Departure of Transportation ...,https://www.massfiscal.org/massfiscal-responds-departure-monica-tibbits-nutt,3.0,Tibbits-Nutt Exit is “Long Overdue”. The Massachusetts Fiscal Alliance today responded to news that Secretary of Transportation Monica ...,neutral,False
2026-06-09,Monica Tibbits-Nutt,The T,"Monica Tibbits-Nutt made history as the first Queer, Black ...",https://www.linkedin.com/posts/lauren-melendez-53690475_monica-tibbits-nutt-made-history-as-the-first-activity-7301335136107720704-9AIP,4.0,"About Black Heritage Month, We wanted to reintroduce you to a prominent figure heading up Mass dot Transportation Secretary Monica Tibbetts, nut ...",positive,True
2026-06-09,Monica Tibbits-Nutt,The T,Disgraced former Transportation Secretary Monica Tibbits ...,https://www.bostonherald.com/2026/01/07/disgraced-former-transportation-secretary-monica-tibbits-nutt-officially-off-state-payroll/,5.0,Former Transportation Secretary Monica Tibbits-Nutt is officially off the state employee payroll after resigning in disgrace in October and ...,negative,False
2026-06-09,Monica Tibbits-Nutt,The T,Monica Tibbits-Nutt Steps Down as MassDOT Secretary,https://aptapassengertransport.com/monica-tibbits-nutt-steps-down-as-massdot-secretary-phil-eng-named-interim/,6.0,Governor Maura Healey has named Massachusetts Bay Transportation Authority (MBTA) General Manager Phil Eng as Interim Transportation Secretary.,neutral,False
2026-06-09,Monica Tibbits-Nutt,The T,"MassDOT secretary Tibbits-Nutt steps down, MBTA chief ...",https://www.reddit.com/r/boston/comments/1o876bw/massdot_secretary_tibbitsnutt_steps_down_mbta/,7.0,She lost my respect after she admitted she was driven to work every day despite living near an MBTA commuter rail because an MBTA pass “was ...,neutral,False
2026-06-09,Monica Tibbits-Nutt,The T,Governor Healey Appoints Monica Tibbits-Nutt as ...,https://www.mass.gov/news/governor-healey-appoints-monica-tibbits-nutt-as-secretary-of-transportation,8.0,Governor Maura T. Healey today announced that she is appointing Monica Tibbits-Nutt as Secretary of the Massachusetts Department of Transportation (MassDOT) ...,neutral,False
2026-06-09,Ryan Coholan,The T,Ryan Coholan - Chief Operating Officer at MBTA,https://www.linkedin.com/in/ryan-coholan-139014ab,1.0,Experienced Chief Operating Officer with a demonstrated history of working in the transportation/trucking/railroad industry.,positive,True
2026-06-09,Ryan Coholan,The T,Ryan Coholan - Massachusetts Bay Transportation Authority ...,https://cthrupayroll.mass.gov/?os=shmmfp&ref=app#!/year/2024/full_time_employees%2Cothers/pay1%2Cpay2%2Cpay3%2Cpay4/explore%2F0-0-0%2Ftrans_no%2F17915261%2F0%2Fdepartment_division,2.0,"Ryan Coholan - Massachusetts Bay Transportation Authority (MBT) - Chief Operating Officer. Total Pay $299,085 Annual Rate $303,850",positive,False
2026-06-09,Ryan Coholan,The T,Conversation with MBTA's COO Ryan Coholan,https://transitunplugged.com/transit-unplugged-podcast/ryan-coholan-mbta/,3.0,"Host Paul Comfort sits down with Ryan Coholan, the Chief Operating Officer of the Massachusetts Bay Transportation Authority (MBTA or The T) in Boston.",neutral,False
2026-06-09,Ryan Coholan,The T,MBTA COO Ryan Coholan talks South Coast Rail from ...,https://www.heraldnews.com/picture-gallery/news/2026/03/24/mbta-coo-ryan-coholan-talks-south-coast-rail-from-boston-to-fall-river/89294351007/,4.0,"MBTA Chief Operating Officer Ryan Coholan operates a commuter rail train at South Station, Boston, on March 10, 2026. Dan Medeiros.",neutral,False
2026-06-09,Ryan Coholan,The T,CCMRRCAM praises MBTA's Ryan Coholan for innovative ...,https://www.facebook.com/ccmrrcam/posts/when-it-comes-to-making-a-meaningful-difference-about-how-the-mbta-serves-the-ci/1285749126448679/,5.0,"When it comes to making a meaningful difference about how the MBTA serves the citizens of the Commonwealth, the CCMRRCAM would like to point out that ...",positive,True
2026-06-09,Ryan Coholan,The T,Ryan Coholan - Chief Operating Officer at Massachusetts ...,https://www.zoominfo.com/p/Ryan-Coholan/11957181347,6.0,"Coholan is a Chief Operating Officer at Massachusetts Bay Transportation Authority. Coholan directs, plans, and supervises operations for a significant commuter ...",neutral,False
2026-06-09,Ryan Coholan,The T,The MBTA Advisory Board,https://mbtaadvisoryboard.org/wp-content/uploads/2024/04/MinutesMBTAAB-12-05-23APPROVED.pdf,7.0,"Ryan Coholan, the Chief Operating Officer (COO) of the MBTA to address the Board. Coholan is responsible for the operation of all MBTA modes. He was appointed ...",neutral,False
2026-06-09,Ryan Coholan,The T,Cultivating Culture at the MBTA with COO Ryan Coholan,https://soundcloud.com/spilling-the-t-podcast/cultivating-culture-at-the-mbta-with-coo-ryan-coholan,8.0,"On this episode, Chief Operating Officer Ryan Coholan joins us to discuss his unique approach to leading Operations at the MBTA.",neutral,False
2026-06-09,Randy Clarke,Metrorail,Leadership,https://www.wmata.com/about/leadership.html,1.0,Randy Clarke joined WMATA as General Manager and CEO in July 2022. He's not just Metro's GM/CEO; he's also a customer who uses the service every day.,positive,True
2026-06-09,Randy Clarke,Metrorail,Randy Clarke (@wmataGM) / Posts / X,https://x.com/wmataGM,2.0,"Proudly leading the @wmata team (America&#39;s Metro System) as General Manager &amp; CEO. rail rush hour since 2020, with over 71,500 customers entering the ...",positive,True
2026-06-09,Randy Clarke,Metrorail,Randy Clarke,https://en.wikipedia.org/wiki/Randy_Clarke,3.0,Randy Clarke (born 1977) is a Canadian-American transit executive who has served as the general manager and CEO of Washington Metropolitan Area Transit ...,neutral,False
2026-06-09,Randy Clarke,Metrorail,Randy Clarke (@wmatagm),https://www.instagram.com/wmatagm/?hl=en,4.0,Metro General Manager Randy Clarke. D74 Potomac Park route. Rhode Island Avenue Metro Stop. when you see our welcome bus and train!,positive,True
2026-06-09,Randy Clarke,Metrorail,A Conversation with WMATA General Manager and CEO ...,https://web.mcccmd.com/events/eventdetail.aspx?eventid=779,5.0,"Randy Clarke, General Manager and CEO of the Washington Metro Area Transit Authority (WMATA). Mr. Clarke joined WMATA in July 2022 after serving more than four ...",neutral,False
2026-06-09,Randy Clarke,Metrorail,Randy Clarke - GovTech,https://www.govtech.com/top-25/randy-clarke,6.0,"Clarke is a veteran of helming massive urban transit systems. He previously served as transit chief for Capital Metro in Austin, Texas.",neutral,False
2026-06-09,Randy Clarke,Metrorail,How to Save DC's Metro - by Santi Ruiz,https://www.statecraft.pub/p/how-to-save-dcs-metro,7.0,"Randy Clarke, the head of DC's Metro system, WMATA. we've reduced fare evasion on the rail side generally somewhere between 82–85% on the ...",positive,False
2026-06-09,Janno Lieber,MTA,Janno Lieber,https://en.wikipedia.org/wiki/Janno_Lieber,1.0,"John Nathan ""Janno"" Lieber (born September 19, 1961) is the head of the Metropolitan Transportation Authority (MTA) in New York.",neutral,False
2026-06-09,Janno Lieber,MTA,Janno Lieber,https://www.mta.info/transparency/leadership/executive-leadership/janno-lieber,2.0,John (“Janno”) Lieber was confirmed as Chair and CEO of the Metropolitan Transportation Authority (MTA) in January 2022.,positive,True
2026-06-09,Janno Lieber,MTA,Janno Lieber - Chair & CEO at New York Metropolitan ...,https://www.linkedin.com/in/janno-lieber-32b487158,3.0,"Chair & CEO at New York Metropolitan Transportation Authority · An accomplished executive working at the intersection of government, real estate and law.",positive,True
2026-06-09,Janno Lieber,MTA,What's your thoughts and opinions on MTA CEO Janno ...,https://www.reddit.com/r/nycrail/comments/1qninf7/whats_your_thoughts_and_opinions_on_mta_ceo_janno/,4.0,Janno is the most competent leader the MTA has had in generations. He truly cares about the system and regularly rides it (which a surprising ...,neutral,False
2026-06-09,Janno Lieber,MTA,"Janno Lieber on Free Buses, the State of the MTA, & The ...",https://nyeditorialboard.substack.com/p/janno-lieber-on-free-buses-the-state,5.0,"Janno Lieber, Chair and CEO of the Metropolitan Transportation Authority (MTA), which runs the New York City subways and buses, ...",positive,False
2026-06-09,Janno Lieber,MTA,"Janno Lieber, Chair & CEO of the Metropolitan ...",https://skyscraper.org/featured/2025/,6.0,"Lieber has tackled and delivered many of the city's most complex transit projects - from 2017 as head of MTA Construction & Development agency, and since 2021 ...",neutral,False
2026-06-09,Janno Lieber,MTA,INTERVIEW: MTA Chair Janno Lieber Talks to ...,https://nyc.streetsblog.org/2026/01/21/interview-mta-chair-janno-lieber-talks-to-streetsblog-to-mark-four-years-at-the-top,7.0,"The MTA chairman talked with Streetsblog about his tenure, congestion pricing, bus stops, Babe Ruth and more. Photo of Dave Colon.",neutral,False
2026-06-09,Janno Lieber,MTA,Statement from MTA Chair and CEO Janno Lieber on,https://www.mta.info/press-release/statement-mta-chair-and-ceo-janno-lieber-opinion-and-order-us-district-judge-lewis-j,8.0,"“We've said it all along, and Judge Liman's clear, detailed ruling leaves no doubt: congestion pricing is legal. It's here to stay.",positive,True
2026-06-09,Ryan Coholan,Boston T,Ryan Coholan - Chief Operating Officer at MBTA,https://www.linkedin.com/in/ryan-coholan-139014ab,1.0,Experienced Chief Operating Officer with a demonstrated history of working in the transportation/trucking/railroad industry.,positive,True
2026-06-09,Ryan Coholan,Boston T,Ryan Coholan - Massachusetts Bay Transportation Authority ...,https://cthrupayroll.mass.gov/?os=shmmfp&ref=app#!/year/2024/full_time_employees%2Cothers/pay1%2Cpay2%2Cpay3%2Cpay4/explore%2F0-0-0%2Ftrans_no%2F17915261%2F0%2Fdepartment_division,2.0,Ryan Coholan - Massachusetts Bay Transportation Authority (MBT) - Chief Operating Officer Massachusetts Bay Transportation Authority (MBT).,positive,False
2026-06-09,Ryan Coholan,Boston T,MBTA COO Ryan Coholan talks South Coast Rail from ...,https://www.heraldnews.com/picture-gallery/news/2026/03/24/mbta-coo-ryan-coholan-talks-south-coast-rail-from-boston-to-fall-river/89294351007/,3.0,"MBTA Chief Operating Officer Ryan Coholan operates a commuter rail train at South Station, Boston, on March 10, 2026. Dan Medeiros.",neutral,False
2026-06-09,Ryan Coholan,Boston T,Conversation with MBTA's COO Ryan Coholan,https://transitunplugged.com/transit-unplugged-podcast/ryan-coholan-mbta/,4.0,"With nearly 30 years of transit experience, Ryan talks about running one of America's largest transit systems and shares stories of MBTA's ...",neutral,False
2026-06-09,Ryan Coholan,Boston T,CCMRRCAM praises MBTA's Ryan Coholan for innovative ...,https://www.facebook.com/ccmrrcam/posts/when-it-comes-to-making-a-meaningful-difference-about-how-the-mbta-serves-the-ci/1285749126448679/,5.0,"When it comes to making a meaningful difference about how the MBTA serves the citizens of the Commonwealth, the CCMRRCAM would like to point out that ...",positive,True
2026-06-09,Ryan Coholan,Boston T,"Today, COO Ryan Coholan joined State Senator Barry ...",https://www.facebook.com/TheMBTA/videos/north-wilmington-official-ribbon-cutting-october-3-2025/834133079271535/,6.0,"Today, COO Ryan Coholan joined State Senator Barry Finegold, State Representative Dave Robertson, Wilmington, MA Town Hall, MBTA Commuter ...",positive,True
2026-06-09,Ryan Coholan,Boston T,The MBTA Advisory Board,https://mbtaadvisoryboard.org/wp-content/uploads/2024/04/MinutesMBTAAB-12-05-23APPROVED.pdf,7.0,"C. MBTA Chief Operating Officer Ryan Coholan: The Chair introduced Ryan. Coholan, the Chief Operating Officer (COO) of the MBTA to address the Board.",neutral,False
2026-06-09,Ryan Coholan,Boston T,Cultivating Culture at the MBTA with COO Ryan Coholan,https://soundcloud.com/spilling-the-t-podcast/cultivating-culture-at-the-mbta-with-coo-ryan-coholan,8.0,"On this episode, Chief Operating Officer Ryan Coholan joins us to discuss his unique approach to leading Operations at the MBTA.",neutral,False
2026-06-09,Ryan Coholan,Boston T,"Today, COO Ryan Coholan joined State Senator ...",https://www.instagram.com/p/DPWzqsCEoZw/,9.0,"Today, COO Ryan Coholan joined State Senator @barryfinegoldma, State Representative Dave Robertson, Town of Wilmington officials, @mbta_cr, ...",positive,True
2026-06-09,Monica Tibbits-Nutt,Massachusetts Bay Transportation Authority,Monica (singer),https://en.wikipedia.org/wiki/Monica_(singer),1.0,"Monica Denise Arnold (formerly Brown; born October 24, 1980), best known mononymously as Monica, is an American singer, songwriter, and actress.",neutral,False
2026-06-09,Monica Tibbits-Nutt,Massachusetts Bay Transportation Authority,Monica,https://open.spotify.com/artist/6nzxy2wXs6tLgzEtqOkEi2,2.0,"She put together four straight Top Ten albums, including the chart-topping After the Storm (2003), and each one involved established and emergent Georgians as ...",neutral,False
2026-06-09,Monica Tibbits-Nutt,Massachusetts Bay Transportation Authority,Monica,https://music.apple.com/us/artist/monica/334240,3.0,"Like her peers Brandy and Aaliyah, Monica (born Monica Denise Arnold in 1980) was a former choir kid who blossomed into a bona fide R&B teen queen.",neutral,False
2026-06-09,Monica Tibbits-Nutt,Massachusetts Bay Transportation Authority,Monica,https://www.facebook.com/monica/,4.0,"Learning to Live in the Moment & Make Time has been life's greatest Lesson to share true sisterhood and friendship the pleasure, your heart with safety, your ...",positive,True
2026-06-09,Monica Tibbits-Nutt,Massachusetts Bay Transportation Authority,Monica.com,https://www.monica.com/,5.0,"MONICA is a Grammy Award-winning Multi-platinum Artist, 25-million-plusselling singer, actress, philanthropist and entrepreneur.",neutral,False
2026-06-09,Monica Tibbits-Nutt,Massachusetts Bay Transportation Authority,Monica (2022),https://www.imdb.com/title/tt6337816/,6.0,"""Monica"" is a portrait of a woman who returns home to the Midwest for the first time in 20 years to confront the wounds of her past.",neutral,False
2026-06-09,Monica Tibbits-Nutt,Massachusetts Bay Transportation Authority,monicaofficial,https://www.youtube.com/@Monica,7.0,"Monica hosts a series exploring the dark side of the American Dream, chronicling untold true crime stories involving basketball players, rappers, models",neutral,False
2026-06-09,Monica Tibbits-Nutt,Massachusetts Bay Transportation Authority,MONICA Definition & Meaning,https://www.dictionary.com/browse/monica,8.0,MONICA definition: a female given name. See examples of Monica used in a sentence.,neutral,False
2026-06-09,Monica Tibbits-Nutt,Massachusetts Bay Transportation Authority,"Monica, Songs, Albums, Discography & Reviews",https://www.allmusic.com/artist/monica-mn0000490738,9.0,"Among the most successful and enduring R&B artists since 1995, the year she debuted with ""Don't Take It Personal.""",neutral,False
2026-06-09,Randy Clarke,DC Metro,Randy Clarke,https://en.wikipedia.org/wiki/Randy_Clarke,1.0,Randy Clarke (born 1977) is a Canadian-American transit executive who has served as the general manager and CEO of Washington Metropolitan Area Transit ...,neutral,False
2026-06-09,Randy Clarke,DC Metro,Leadership,https://www.wmata.com/about/leadership.html,2.0,Randy Clarke joined WMATA as General Manager and CEO in July 2022. He's not just Metro's GM/CEO; he's also a customer who uses the service every day.,positive,True
2026-06-09,Randy Clarke,DC Metro,Randy Clarke (@wmataGM) / Posts / X,https://x.com/wmataGM,3.0,"Randy Clarke (@wmataGM) - Posts - Proudly leading the @wmata team (America's Metro System) as General Manager & CEO. Also on IG, in.",positive,True
2026-06-09,Randy Clarke,DC Metro,Randy Clarke - WMATA General Manager and CEO,https://www.linkedin.com/in/randy-clarke-74bb8a69,4.0,WMATA General Manager and CEO · Experience: Washington Metropolitan Area Transit Authority (WMATA) · Education: University of Southern Maine · Location: ...,positive,True
2026-06-09,Randy Clarke,DC Metro,Randy Clarke - GovTech,https://www.govtech.com/top-25/randy-clarke,5.0,"In his nearly two years on the job as general manager and CEO for the Washington Metropolitan Area Transit Authority (WMATA), Randy Clarke has been almost ...",neutral,False
2026-06-09,Randy Clarke,DC Metro,How to Save DC's Metro - by Santi Ruiz,https://www.statecraft.pub/p/how-to-save-dcs-metro,6.0,"Today we talked to Randy Clarke, the head of DC's Metro system, WMATA. If you're a transit nerd, you probably know about Clarke — he's ...",positive,False
2026-06-09,Randy Clarke,DC Metro,Randy Clarke (@wmatagm),https://www.instagram.com/wmatagm/?hl=en,7.0,Completed the 2nd Annual @metroforward MetroTransitPD Recruit General Manager run on the National Mall. These recruits graduate this month joining our great ...,positive,True
2026-06-09,Randy Clarke,DC Metro,WMATA's Board of Directors Selects Randy Clarke as its ...,https://www.wmata.com/news/metro-board-announces-new-gm-randy-clarke.html,8.0,"Randy Clarke, the current President and CEO of Capital Metro (CapMetro) in Austin, TX, will begin his new position at WMATA late summer and was ...",positive,True
2026-06-09,Randy Clarke,DC Metro,A Conversation with WMATA General Manager and CEO ...,https://web.mcccmd.com/events/eventdetail.aspx?eventid=779,9.0,"Clarke joined WMATA in July 2022 after serving more than four years as President and CEO of Capital Metro in Austin, Texas. Prior to his work in Austin, Mr.",neutral,False
2026-06-09,Phillip Eng,MBTA,Phillip Eng | People,https://www.mbta.com/people/phillip-eng,1.0,Phillip Eng is the General Manager and CEO of the Massachusetts Bay Transportation Authority (MBTA). A Civil Engineer with nearly 40 years of transportation ...,positive,True
2026-06-09,Phillip Eng,MBTA,Phillip Eng,https://en.wikipedia.org/wiki/Phillip_Eng,2.0,Phillip Eng (born 1961 or 1962) is an American civil engineer and transit executive serving as interim secretary of Massachusetts Department of ...,neutral,False
2026-06-09,Phillip Eng,MBTA,Phil Eng earns rave reviews for simultaneous MBTA ...,https://commonwealthbeacon.org/transportation/interim-or-indefinite-no-end-in-sight-to-phil-engs-double-duty/,3.0,The Healey administration seems content to have Phil Eng continue to work as both T general manager and interim transportation secretary for ...,neutral,False
2026-06-09,Phillip Eng,MBTA,"Phillip Eng - Transportation Services, Operations ...",https://www.linkedin.com/in/phillip-eng-875928240,4.0,"Transportation Services, Operations, Engineering and Infrastructure · Experience: MassDOT and MBTA · Education: The Cooper Union for the Advancement of ...",positive,True
2026-06-09,Phillip Eng,MBTA,MBTA's Phillip Eng Named Interim MassDOT Secretary,https://aashtojournal.transportation.org/mbtas-phillip-eng-named-interim-massdot-secretary/,5.0,Massachusetts Governor Maura Healey (D) has appointed Phillip Eng (above at left) – general manager of the Massachusetts Bay Transportation ...,neutral,False
2026-06-09,Phillip Eng,MBTA,The MBTA has made incredible strides. Did Phillip Eng fix ...,https://www.reddit.com/r/mbta/comments/1pokx9x/the_mbta_has_made_incredible_strides_did_phillip/,6.0,"165 votes, 33 comments. Eng is great. He's done tremendous things. I don't think his influence can be overstated.",neutral,False
2026-06-09,Phillip Eng,MBTA,Governor Healey Appoints MBTA General Manager Phil ...,https://www.mass.gov/news/governor-healey-appoints-mbta-general-manager-phil-eng-as-interim-transportation-secretary,7.0,Highway Administrator Jonathan Gulliver promoted to Undersecretary of Transportation; Interim Secretary and GM Eng to hold media ...,neutral,False
2026-06-09,Phillip Eng,MBTA,Did Phillip Eng fix the MBTA? Reliability and passenger ...,https://www.cbsnews.com/boston/news/mbta-general-manager-phillip-eng/,8.0,"I'll take it!'"" Eng said. Phillip Eng MBTA General Manager Phillip Eng on the Orange Line. CBS Boston.",neutral,False
2026-06-09,Phillip Eng,MBTA,Phillip Eng,https://www.massport.com/our-business/leadership/phillip-eng,9.0,Phillip Eng leads Massachusetts' transportation network as Interim Secretary of Transportation and General Manager of the MBTA.,positive,True
2026-06-09,Monica Tibbits-Nutt,Boston T,Monica (singer),https://en.wikipedia.org/wiki/Monica_(singer),1.0,"Monica Denise Arnold (formerly Brown; born October 24, 1980), best known mononymously as Monica, is an American singer, songwriter, and actress.",neutral,False
2026-06-09,Monica Tibbits-Nutt,Boston T,MONICA (@monicadenise) • Instagram photos and videos,https://www.instagram.com/monicadenise/?hl=en,2.0,13M followers · 603 following · 257 posts · @monicadenise: “My @romelo @laiyah @sayblessyou ”,positive,True
2026-06-09,Monica Tibbits-Nutt,Boston T,Monica,https://open.spotify.com/artist/6nzxy2wXs6tLgzEtqOkEi2,3.0,"She put together four straight Top Ten albums, including the chart-topping After the Storm (2003), and each one involved established and emergent Georgians as ...",neutral,False
2026-06-09,Monica Tibbits-Nutt,Boston T,Monica,https://music.apple.com/us/artist/monica/334240,4.0,"Like her peers Brandy and Aaliyah, Monica (born Monica Denise Arnold in 1980) was a former choir kid who blossomed into a bona fide R&B teen queen.",neutral,False
2026-06-09,Monica Tibbits-Nutt,Boston T,Monica (2022),https://www.imdb.com/title/tt6337816/,5.0,"""Monica"" is a portrait of a woman who returns home to the Midwest for the first time in 20 years to confront the wounds of her past.",neutral,False
2026-06-09,Monica Tibbits-Nutt,Boston T,Monica,https://www.facebook.com/monica/,6.0,Monica. 7463179 likes · 5768 talking about this. https://linktr.ee/MonicaOfficial.,positive,True
2026-06-09,Monica Tibbits-Nutt,Boston T,MONICA Definition & Meaning,https://www.dictionary.com/browse/monica,7.0,MONICA definition: a female given name. See examples of Monica used in a sentence.,neutral,False
2026-06-09,Monica Tibbits-Nutt,Boston T,"Monica, Songs, Albums, Discography & Reviews",https://www.allmusic.com/artist/monica-mn0000490738,8.0,"Among the most successful and enduring R&B artists since 1995, the year she debuted with ""Don't Take It Personal.""",neutral,False
2026-06-09,Phillip Eng,Massachusetts Bay Transportation Authority,Phillip Eng | People,https://www.mbta.com/people/phillip-eng,1.0,Phillip Eng is the General Manager and CEO of the Massachusetts Bay Transportation Authority (MBTA). A Civil Engineer with nearly 40 years of transportation ...,positive,True
2026-06-09,Phillip Eng,Massachusetts Bay Transportation Authority,Phillip Eng,https://en.wikipedia.org/wiki/Phillip_Eng,2.0,Phillip Eng (born 1961 or 1962) is an American civil engineer and transit executive serving as interim secretary of Massachusetts Department of ...,neutral,False
2026-06-09,Phillip Eng,Massachusetts Bay Transportation Authority,Governor Healey Appoints MBTA General Manager Phil ...,https://www.mass.gov/news/governor-healey-appoints-mbta-general-manager-phil-eng-as-interim-transportation-secretary,3.0,Highway Administrator Jonathan Gulliver promoted to Undersecretary of Transportation; Interim Secretary and GM Eng to hold media ...,neutral,False
2026-06-09,Phillip Eng,Massachusetts Bay Transportation Authority,"Phillip Eng - Transportation Services, Operations ...",https://www.linkedin.com/in/phillip-eng-875928240,4.0,"Transportation Services, Operations, Engineering and Infrastructure · Experience: MassDOT and MBTA · Education: The Cooper Union for the Advancement of ...",positive,True
2026-06-09,Phillip Eng,Massachusetts Bay Transportation Authority,MBTA's Phillip Eng Named Interim MassDOT Secretary,https://aashtojournal.transportation.org/mbtas-phillip-eng-named-interim-massdot-secretary/,5.0,Massachusetts Governor Maura Healey (D) has appointed Phillip Eng (above at left) – general manager of the Massachusetts Bay Transportation ...,neutral,False
