date,company,title,url,position,snippet,sentiment,controlled
2026-02-24,DC Metro,WMATA: Home,https://www.wmata.com/,1,Metro Home. Washington Metropolitan Area Transit Authority. Open Mobile Menu. Manage Your SmarTrip Account · Get a SmarTrip Card · Service · Rail · Bus ...,positive,True
2026-02-24,DC Metro,Washington Metro,https://en.wikipedia.org/wiki/Washington_Metro,2,a rapid transit system serving the Washington metropolitan area of the United States. It is administered by the Washington Metropolitan Area Transit Authority ...,neutral,False
2026-02-24,DC Metro,Metro Forward (@wmata) / Posts / X,https://x.com/wmata,3,"Metro Bus, Rail, and Access are operating on a normal schedule today. We're ready to get you where you need to go. For real-time updates on your route, check @ ...",positive,True
2026-02-24,DC Metro,Washington Metropolitan Area Transit Authority (WMATA),https://washington.org/find-dc-listings/washington-metropolitan-area-transit-authority,4,"With a network of six rail lines, 98 stations, 125 bus routes, and a door-to-door paratransit service, Metro is the second busiest transit system in the United ...",neutral,False
2026-02-24,DC Metro,DC Metro and Bus - App Store,https://apps.apple.com/us/app/dc-metro-and-bus/id578496721,5,Washington DC Metro and Bus is the region's most popular dedicated DC transit app. Realtime rail and bus predictions and DC Metro map directly from WMATA.,positive,True
2026-02-24,OMNY,OMNY,https://omny.info/,1,"Tap an OMNY card. Want to pay with cash? Buy and load value on an OMNY card, then tap it at an OMNY reader to pay the fare and GO.",positive,True
2026-02-24,OMNY,Tap and ride to pay your fare,https://www.mta.info/fares-tolls/subway-bus/tap-and-ride,2,"You can buy or reload an OMNY Card at vending machines in any subway station. As a limited-time introductory offer, you can buy a new reloadable card for $1.",positive,True
2026-02-24,OMNY,Enterprise podcasting made simple with Omny Studio,https://omnystudio.com/,3,"The most advanced on-demand audio management and publishing platform. All the functionality you need, to go from on-air to online in seconds.",positive,True
2026-02-24,OMNY,OMNY,https://en.wikipedia.org/wiki/OMNY,4,"OMNY is a contactless fare payment system, that has been implemented for use on public transit in the New York metropolitan area. OMNY can currently be used ...",neutral,False
2026-02-24,OMNY,OMNY Health: EHR Data and Analytics,https://omnyhealth.com/,5,OMNY Health™ is a healthcare ecosystem creating partnerships that drive patient care by harnessing real-world data & EHR data and analytics.,positive,True
2026-02-24,OMNY,Entreprise Podcasting - Omny Studio,https://tritondigital.com/solutions/Omny%20Studio,6,"Omny Studio offers powerful podcasting tools for hosting, monetization, and audience analytics. Start your podcast journey smartly.",neutral,False
2026-02-24,CTA,Chicago Transit Authority - CTA Buses & Train Service - 1-888 ...,https://www.transitchicago.com/,1,"Information about CTA bus and train service in and around Chicago. Find maps, schedules, service alerts, plan a trip, jobs, news and more!",positive,True
2026-02-24,CTA,California Teachers Association,https://www.cta.org/,2,"CTA has led the labor movement for more than 150 years, fighting for educators' rights and the rights for every public school student to have access to quality ...",positive,True
2026-02-24,CTA,Select Route,https://www.ctabustracker.com/bustime/wireless/html/home.jsp,3,1 - Bronzeville/Union Station · 2 - Hyde Park Express · 3 - King Drive · 4 - Cottage Grove · X4 - Cottage Grove Express · N5 - South Shore Night Bus · 6 - ...,positive,True
2026-02-24,CTA,Call to action (marketing),https://en.wikipedia.org/wiki/Call_to_action_(marketing),4,Call to action (CTA) is a marketing term for any text designed to prompt an immediate response or encourage an immediate sale.,neutral,False
2026-02-24,CTA,r/cta,https://www.reddit.com/r/cta/,5,"r/cta: Unofficial forum for Chicago's public transportation system, welcome :)",neutral,False
2026-02-24,CTA,Chicago Transit Authority (@thecta),https://www.facebook.com/thecta/,6,Chicago Transit Authority. 81725 likes · 4666 talking about this. Welcome to the official CTA Facebook page. Serving Chicago & 35 surrounding suburbs....,positive,True
2026-02-24,MTA,MTA: Home - NYC,https://www.mta.info/,1,"Plan a trip, see saved trips, you haven't saved any trips yet. Plan a trip or go to Schedules and save it for quick access in the future.",positive,True
2026-02-24,MTA,Maryland Transit Administration,https://www.mta.maryland.gov/,2,Routes & Schedules · Real Time · Service Alerts (16) · Human Trafficking GET HELP · Customer Service Promise · Help Stop Fraud in State Government. The Maryland ...,positive,True
2026-02-24,MTA,MTA (@MTA) / Posts / X,https://x.com/MTA,3,MTA (@MTA) - Posts - Download our apps (MTA and TrainTime) for real-time customer care: mta.info/apps | X (formerly Twitter),positive,True
2026-02-24,MTA,Metropolitan Transportation Authority,https://en.wikipedia.org/wiki/Metropolitan_Transportation_Authority,4,"The Metropolitan Transportation Authority (MTA) provides local and express bus, subway, and commuter rail service in Greater New York, and operates multiple ...",neutral,False
2026-02-24,MTA,MTA (@mta) • Instagram photos and videos,https://www.instagram.com/mta/?hl=en,5,Visit mta.info for service info. Download our apps (MTA and TrainTime) for real-time care. @mtalirr @mtametronorth @mtanewsroom @mtaartsdesign ...,positive,True
2026-02-24,MTA,Massachusetts Teachers Association,https://www.massteacher.org/,6,"The Massachusetts Teachers Association is a member-driven organization, governed by democratic principles, that accepts and supports the interdependence of ...",neutral,False
2026-02-24,Boston T,Subway | Schedules & Maps,https://www.mbta.com/schedules/subway,1,"Schedule information for MBTA subway lines in Greater Boston, including real-time updates and arrival predictions.",positive,True
2026-02-24,Boston T,MBTA - Massachusetts Bay Transportation Authority,https://www.mbta.com/,2,"Public transit in the Greater Boston region. Routes, schedules, trip planner, fares, service alerts, real-time updates, and general information.",positive,True
2026-02-24,Boston T,MBTA (@MBTA) / Posts / X,https://x.com/MBTA?lang=en,3,The official Twitter feed of the Massachusetts Bay Transportation Authority (MBTA). Check out our partners @MBTA_CR and @MBTATransitPD. Emergency dial 911.,positive,True
2026-02-24,Boston T,Boston T Subway Map & Routing - App Store - Apple,https://apps.apple.com/us/app/boston-t-subway-map-routing/id1195886256,4,Boston T Subway Map is the navigation app that makes travelling by MBTA transit in Boston simple,positive,True
2026-02-24,Boston T,MBTA subway,https://en.wikipedia.org/wiki/MBTA_subway,5,"The Massachusetts Bay Transportation Authority (MBTA) operates rapid transit (heavy rail), light rail, and bus rapid transit services in the Boston ...",neutral,False
2026-02-24,Boston T,Tips for riding the T? : r/boston,https://www.reddit.com/r/boston/comments/1eghkxe/tips_for_riding_the_t/,6,Move all the way into the train! Don't just get on and grab the pole by the door. Other people getting on after you then have to shove their way through you.,neutral,False
2026-02-24,Boston T,Boston MBTA Shutdowns 2026,https://www.boston.gov/departments/transportation/boston-mbta-shutdowns-2026,7,"Fitchburg, Haverhill, Lowell, and Newbury/Rockport Commuter Rail Line service will be suspended between North Station and Swampscott and ...",neutral,False
2026-02-24,Metrorail,Metrorail,https://www.miamidade.gov/global/transportation/metrorail.page,1,"The Metrorail system is a 25-mile dual track that provides service to Miami International Airport (MIA) and runs from Kendall through South Miami, Coral Gables ...",neutral,False
2026-02-24,Metrorail,"METRORail | Red Line | Purple Line | Houston, Texas - METRO",https://www.ridemetro.org/riding-metro/transit-services/metrorail,2,"METRORail is Houston's light-rail network, offering convenient access to many popular destinations in and around downtown Houston.",neutral,False
2026-02-24,Metrorail,Metrorail,https://www.wmata.com/service/rail/,3,"Metrorail provides safe, clean, reliable transit service for more than 600,000 customers a day throughout the Washington, DC area. The system is the second ...",positive,True
2026-02-24,Metrorail,CapMetro Rail – Capital Metro – Austin Public Transit,https://www.capmetro.org/rail,4,"A train for commuters traveling between Leander and downtown. Whether you're traveling to work or Q2 Stadium, get there quickly and comfortably.",neutral,False
2026-02-24,Metrorail,Metrorail,https://www.miamiandbeaches.com/l/transportation/metrorail/3040,5,"Metrorail is Miami's quick and easy 25-mile elevated transportation system to get you to all parts of the urban core of Miami from 5:00am to midnight, seven ...",neutral,False
2026-02-24,Metrorail,"Metro | Bus, Rail, Subway, Bike & Micro in Los Angeles",http://www.metro.net/,6,"Explore Los Angeles by public transit. Start with Metro schedules, maps, arrival times, parking info, trip planning, stations, and fares.",neutral,False
2026-02-24,Metrorail,Metrorail Stations - Miami-Dade County,https://www.miamidade.gov/transportation-publicworks/metrorail-stations.asp,7,"The 22 accessible Metrorail stations are about one-mile apart, providing easy access for bus riders, pedestrians, and passengers being dropped off and ...",neutral,False
2026-02-24,Metrorail,METRORail,https://en.wikipedia.org/wiki/METRORail,8,"METRORail ranks as the second most-traveled light rail system in the Southern United States and the 10th most-traveled light rail system in the United States, ...",neutral,False
2026-02-24,Metrorail,WMATA: Home,https://www.wmata.com/,9,"Real-time bus and rail info, maps, chat, and more. Read more · NEXT BUS · NEXT TRAIN.",positive,True
2026-02-24,Boston T,Subway | Schedules & Maps,https://www.mbta.com/schedules/subway,1,"Schedule information for MBTA subway lines in Greater Boston, including real-time updates and arrival predictions.",positive,True
2026-02-24,Boston T,MBTA - Massachusetts Bay Transportation Authority,https://www.mbta.com/,2,"Public transit in the Greater Boston region. Routes, schedules, trip planner, fares, service alerts, real-time updates, and general information.",positive,True
2026-02-24,Boston T,MBTA (@MBTA) / Posts / X,https://x.com/MBTA?lang=en,3,The official Twitter feed of the Massachusetts Bay Transportation Authority (MBTA). Check out our partners @MBTA_CR and @MBTATransitPD. Emergency dial 911.,positive,True
2026-02-24,Boston T,Boston T Subway Map & Routing - App Store - Apple,https://apps.apple.com/us/app/boston-t-subway-map-routing/id1195886256,4,Boston T Subway Map is the navigation app that makes travelling by MBTA transit in Boston simple,positive,True
2026-02-24,Boston T,MBTA subway,https://en.wikipedia.org/wiki/MBTA_subway,5,"The Massachusetts Bay Transportation Authority (MBTA) operates rapid transit (heavy rail), light rail, and bus rapid transit services in the Boston ...",neutral,False
2026-02-24,Boston T,Tips for riding the T? : r/boston,https://www.reddit.com/r/boston/comments/1eghkxe/tips_for_riding_the_t/,6,Move all the way into the train! Don't just get on and grab the pole by the door. Other people getting on after you then have to shove their way through you.,neutral,False
2026-02-24,Boston T,Boston MBTA Shutdowns 2026,https://www.boston.gov/departments/transportation/boston-mbta-shutdowns-2026,7,"Fitchburg, Haverhill, Lowell, and Newbury/Rockport Commuter Rail Line service will be suspended between North Station and Swampscott and ...",neutral,False
2026-02-24,Boston T,Subway | Schedules & Maps,https://www.mbta.com/schedules/subway,1,"Schedule information for MBTA subway lines in Greater Boston, including real-time updates and arrival predictions.",positive,True
2026-02-24,Boston T,MBTA - Massachusetts Bay Transportation Authority,https://www.mbta.com/,2,"Public transit in the Greater Boston region. Routes, schedules, trip planner, fares, service alerts, real-time updates, and general information.",positive,True
2026-02-24,Boston T,MBTA (@MBTA) / Posts / X,https://x.com/MBTA?lang=en,3,The official Twitter feed of the Massachusetts Bay Transportation Authority (MBTA). Check out our partners @MBTA_CR and @MBTATransitPD. Emergency dial 911.,positive,True
2026-02-24,Boston T,Boston T Subway Map & Routing - App Store - Apple,https://apps.apple.com/us/app/boston-t-subway-map-routing/id1195886256,4,Boston T Subway Map is the navigation app that makes travelling by MBTA transit in Boston simple,positive,True
2026-02-24,Boston T,MBTA subway,https://en.wikipedia.org/wiki/MBTA_subway,5,"The Massachusetts Bay Transportation Authority (MBTA) operates rapid transit (heavy rail), light rail, and bus rapid transit services in the Boston ...",neutral,False
2026-02-24,Boston T,Tips for riding the T? : r/boston,https://www.reddit.com/r/boston/comments/1eghkxe/tips_for_riding_the_t/,6,Move all the way into the train! Don't just get on and grab the pole by the door. Other people getting on after you then have to shove their way through you.,neutral,False
2026-02-24,Boston T,Boston MBTA Shutdowns 2026,https://www.boston.gov/departments/transportation/boston-mbta-shutdowns-2026,7,"Fitchburg, Haverhill, Lowell, and Newbury/Rockport Commuter Rail Line service will be suspended between North Station and Swampscott and ...",neutral,False
2026-02-24,NYC Subway,MTA: Home,https://www.mta.info/,1,Back; New York City Transit · Bridges & Tunnels · Long Island Rail Road · Metro-North Railroad · Other agencies and departments. Contact us.,positive,True
2026-02-24,NYC Subway,nycsubway.org,https://www.nycsubway.org/,2,nycsubway.org is not affiliated with any transit agency or provider. Not mobile.,positive,True
2026-02-24,NYC Subway,New York City Subway,https://sab.org/wp-content/uploads/2020/01/Subway_Map_2018.pdf,3,"New York City Subway with bus and railroad connections. Manhattan bound. N ... The subway operates 24 hours a day, but not all lines operate at all times ...",neutral,False
2026-02-24,NYC Subway,New York City Subway,https://en.wikipedia.org/wiki/New_York_City_Subway,4,"The New York City Subway is a rapid transit system in New York City, serving four of the city's five boroughs: Manhattan, Brooklyn, Queens, and the Bronx.",neutral,False
2026-02-24,Chicago Transit Authority,Chicago Transit Authority - CTA Buses & Train Service - 1-888 ...,https://www.transitchicago.com/,1,"Information about CTA bus and train service in and around Chicago. Find maps, schedules, service alerts, plan a trip, jobs, news and more!",positive,True
2026-02-24,Chicago Transit Authority,Chicago Transit Authority (album),https://en.wikipedia.org/wiki/Chicago_Transit_Authority_(album),2,"The Chicago Transit Authority is the debut studio album by the American rock band Chicago, and the only album released under their original name Chicago Transit ...",neutral,False
2026-02-24,Chicago Transit Authority,Chicago Transit Authority (CTA) - Travel Information,https://www.chicago.gov/city/en/depts/other/provdrs/cta.html,3,The CTA operates the nation's second largest public transportation system and covers the City of Chicago and 40 surrounding suburbs.,neutral,False
2026-02-24,The T,MBTA - Massachusetts Bay Transportation Authority,https://www.mbta.com/,1,"Public transit in the Greater Boston region. Routes, schedules, trip planner, fares, service alerts, real-time updates, and general information.",positive,True
2026-02-24,The T,Massachusetts Bay Transportation Authority,https://en.wikipedia.org/wiki/Massachusetts_Bay_Transportation_Authority,2,"The Massachusetts Bay Transportation Authority (abbreviated MBTA and known colloquially as ""the T"") is the public agency responsible for operating most public ...",neutral,False
2026-02-24,The T,Alaska Thunderfuck - The T (feat. Adore Delano) [Official],https://www.youtube.com/watch?v=9Xw5VkCpxRg,3,"Poundcake, the full length sophomore album from Alaska Thunderfuck is now available on iTunes!",positive,False
2026-02-24,The T,Pittsburgh Regional Transit,https://www.rideprt.org/,4,"Plan your trip, true time, rider alerts, schedule finder. Menu Schedules Bus Rail Incline Service Updates Rider Info How to Ride Accessibility Park and Ride ...",neutral,False
2026-02-24,The T,Massachusetts Bay Transportation Authority (MBTA),https://www.mass.gov/orgs/massachusetts-bay-transportation-authority,5,"The Massachusetts Bay Transportation Authority, more commonly known as the T, is one of the oldest public transit systems in the United States.",neutral,False
2026-02-24,The T,Home - Trinity Metro - Tarrant County public transit service.,https://www.ridetrinitymetro.org/,6,Trinity Metro's vision is to provide transit services that make Fort Worth more livable and support continued economic growth.,neutral,False
2026-02-24,The T,"Boston Subway - The ""T"" - Boston Public Transportation",https://www.boston-discovery-guide.com/boston-subway.html,7,"Boston's subway system - locally we call it the ""T"" - is the easiest and cheapest way to get around the city, aside from walking.",neutral,False
2026-02-24,The T,MBTA - Massachusetts Bay Transportation Authority,https://www.mbta.com/,1,"Public transit in the Greater Boston region. Routes, schedules, trip planner, fares, service alerts, real-time updates, and general information.",positive,True
2026-02-24,The T,Massachusetts Bay Transportation Authority,https://en.wikipedia.org/wiki/Massachusetts_Bay_Transportation_Authority,2,"The Massachusetts Bay Transportation Authority (abbreviated MBTA and known colloquially as ""the T"") is the public agency responsible for operating most public ...",neutral,False
2026-02-24,The T,Alaska Thunderfuck - The T (feat. Adore Delano) [Official],https://www.youtube.com/watch?v=9Xw5VkCpxRg,3,"Poundcake, the full length sophomore album from Alaska Thunderfuck is now available on iTunes!",positive,False
2026-02-24,The T,Pittsburgh Regional Transit,https://www.rideprt.org/,4,"Plan your trip, true time, rider alerts, schedule finder. Menu Schedules Bus Rail Incline Service Updates Rider Info How to Ride Accessibility Park and Ride ...",neutral,False
2026-02-24,The T,Massachusetts Bay Transportation Authority (MBTA),https://www.mass.gov/orgs/massachusetts-bay-transportation-authority,5,"The Massachusetts Bay Transportation Authority, more commonly known as the T, is one of the oldest public transit systems in the United States.",neutral,False
2026-02-24,The T,Home - Trinity Metro - Tarrant County public transit service.,https://www.ridetrinitymetro.org/,6,Trinity Metro's vision is to provide transit services that make Fort Worth more livable and support continued economic growth.,neutral,False
2026-02-24,The T,"Boston Subway - The ""T"" - Boston Public Transportation",https://www.boston-discovery-guide.com/boston-subway.html,7,"Boston's subway system - locally we call it the ""T"" - is the easiest and cheapest way to get around the city, aside from walking.",neutral,False
2026-02-24,The T,MBTA - Massachusetts Bay Transportation Authority,https://www.mbta.com/,1,"Public transit in the Greater Boston region. Routes, schedules, trip planner, fares, service alerts, real-time updates, and general information.",positive,True
2026-02-24,The T,Massachusetts Bay Transportation Authority,https://en.wikipedia.org/wiki/Massachusetts_Bay_Transportation_Authority,2,"The Massachusetts Bay Transportation Authority (abbreviated MBTA and known colloquially as ""the T"") is the public agency responsible for operating most public ...",neutral,False
2026-02-24,The T,Alaska Thunderfuck - The T (feat. Adore Delano) [Official],https://www.youtube.com/watch?v=9Xw5VkCpxRg,3,"Poundcake, the full length sophomore album from Alaska Thunderfuck is now available on iTunes!",positive,False
2026-02-24,The T,Pittsburgh Regional Transit,https://www.rideprt.org/,4,"Plan your trip, true time, rider alerts, schedule finder. Menu Schedules Bus Rail Incline Service Updates Rider Info How to Ride Accessibility Park and Ride ...",neutral,False
2026-02-24,The T,Massachusetts Bay Transportation Authority (MBTA),https://www.mass.gov/orgs/massachusetts-bay-transportation-authority,5,"The Massachusetts Bay Transportation Authority, more commonly known as the T, is one of the oldest public transit systems in the United States.",neutral,False
2026-02-24,The T,Home - Trinity Metro - Tarrant County public transit service.,https://www.ridetrinitymetro.org/,6,Trinity Metro's vision is to provide transit services that make Fort Worth more livable and support continued economic growth.,neutral,False
2026-02-24,The T,"Boston Subway - The ""T"" - Boston Public Transportation",https://www.boston-discovery-guide.com/boston-subway.html,7,"Boston's subway system - locally we call it the ""T"" - is the easiest and cheapest way to get around the city, aside from walking.",neutral,False
2026-02-24,Massachusetts Bay Transportation Authority,MBTA - Massachusetts Bay Transportation Authority,https://www.mbta.com/,1,"Public transit in the Greater Boston region. Routes, schedules, trip planner, fares, service alerts, real-time updates, and general information.",positive,True
2026-02-24,Massachusetts Bay Transportation Authority,Massachusetts Bay Transportation Authority,https://en.wikipedia.org/wiki/Massachusetts_Bay_Transportation_Authority,2,"The public agency responsible for operating most public transportation services in Greater Boston, Massachusetts.",neutral,False
2026-02-24,Massachusetts Bay Transportation Authority,Massachusetts Bay Transportation Authority (MBTA),https://www.mass.gov/orgs/massachusetts-bay-transportation-authority,3,"The MBTA provides subway, bus, Commuter Rail, ferry, and paratransit service to eastern Massachusetts and parts of Rhode Island.",neutral,False
2026-02-24,Massachusetts Bay Transportation Authority,Massachusetts Bay Transportation Authority - MBTA,https://www.facebook.com/TheMBTA/,4,Massachusetts Bay Transportation Authority - MBTA · Details · Links · Contact info. 󰢉. thembta + 3. 󰛪. (617) 222-3200. 󰘢. social@mbta.com. Photos. See all ...,positive,True
2026-02-24,Massachusetts Bay Transportation Authority,Seriously dreading the delays that will come after this storm!,https://www.reddit.com/r/mbta/comments/1rct0go/seriously_dreading_the_delays_that_will_come/,5,"See MBTA news, policy discussion, service alerts, and a bit of everything in between for public transportation in Boston, Massachusetts and the ...",negative,False
2026-02-24,Massachusetts Bay Transportation Authority,MBTA,https://www.linkedin.com/company/mbta,6,"The Massachusetts Bay Transportation Authority, often referred to as the MBTA or simply The T, is the public operator of most bus, subway, commuter rail and ...",positive,True
2026-02-24,Massachusetts Bay Transportation Authority,Massachusetts Bay Transportation Authority - MBTA | Boston MA,https://www.facebook.com/TheMBTA/videos/,7,"The official Facebook Page of the Massachusetts Bay Transportation Authority. The MBTA, ... See more. 󱞴 Transit System.",positive,True
2026-02-24,Massachusetts Bay Transportation Authority,MBTA - Massachusetts Bay Transportation Authority,https://www.mbta.com/,1,"Public transit in the Greater Boston region. Routes, schedules, trip planner, fares, service alerts, real-time updates, and general information.",positive,True
2026-02-24,Massachusetts Bay Transportation Authority,Massachusetts Bay Transportation Authority,https://en.wikipedia.org/wiki/Massachusetts_Bay_Transportation_Authority,2,"The public agency responsible for operating most public transportation services in Greater Boston, Massachusetts.",neutral,False
2026-02-24,Massachusetts Bay Transportation Authority,Massachusetts Bay Transportation Authority (MBTA),https://www.mass.gov/orgs/massachusetts-bay-transportation-authority,3,"The MBTA provides subway, bus, Commuter Rail, ferry, and paratransit service to eastern Massachusetts and parts of Rhode Island.",neutral,False
2026-02-24,Massachusetts Bay Transportation Authority,Massachusetts Bay Transportation Authority - MBTA,https://www.facebook.com/TheMBTA/,4,Massachusetts Bay Transportation Authority - MBTA · Details · Links · Contact info. 󰢉. thembta + 3. 󰛪. (617) 222-3200. 󰘢. social@mbta.com. Photos. See all ...,positive,True
2026-02-24,Massachusetts Bay Transportation Authority,Seriously dreading the delays that will come after this storm!,https://www.reddit.com/r/mbta/comments/1rct0go/seriously_dreading_the_delays_that_will_come/,5,"See MBTA news, policy discussion, service alerts, and a bit of everything in between for public transportation in Boston, Massachusetts and the ...",negative,False
2026-02-24,Massachusetts Bay Transportation Authority,MBTA,https://www.linkedin.com/company/mbta,6,"The Massachusetts Bay Transportation Authority, often referred to as the MBTA or simply The T, is the public operator of most bus, subway, commuter rail and ...",positive,True
2026-02-24,Massachusetts Bay Transportation Authority,Massachusetts Bay Transportation Authority - MBTA | Boston MA,https://www.facebook.com/TheMBTA/videos/,7,"The official Facebook Page of the Massachusetts Bay Transportation Authority. The MBTA, ... See more. 󱞴 Transit System.",positive,True
2026-02-24,Massachusetts Bay Transportation Authority,MBTA - Massachusetts Bay Transportation Authority,https://www.mbta.com/,1,"Public transit in the Greater Boston region. Routes, schedules, trip planner, fares, service alerts, real-time updates, and general information.",positive,True
2026-02-24,Massachusetts Bay Transportation Authority,Massachusetts Bay Transportation Authority,https://en.wikipedia.org/wiki/Massachusetts_Bay_Transportation_Authority,2,"The public agency responsible for operating most public transportation services in Greater Boston, Massachusetts.",neutral,False
