date,ceo,company,title,url,position,snippet,sentiment,controlled
2026-05-02,Phillip Eng,MBTA,Philips - United States | Philips,https://www.usa.philips.com/?srsltid=AfmBOoqbNwhe9Os5yhHKri1H1Jyf8xh-jh73fr_uX7EGTednI10AYAcG,1,"Learn more about Philips and how we help improve people's lives through meaningful innovation in the areas of Healthcare, Consumer Lifestyle and Lighting.",positive,False
2026-05-02,Phillip Eng,MBTA,"Prince Philip, Duke of Edinburgh","https://en.wikipedia.org/wiki/Prince_Philip,_Duke_of_Edinburgh",2,"Prince Philip, Duke of Edinburgh was the husband of Queen Elizabeth II and served as consort of the British monarch from her accession on 6 February 1952 ...",neutral,False
2026-05-02,Phillip Eng,MBTA,Phillip Phillips (@PhillipPhillips),https://www.facebook.com/PhillipPhillips/,3,Phillip Phillips. 989930 likes · 2364 talking about this. New single “Homesick” out now! ⬇️ https://stem.ffm.to/homesickphillip.,positive,True
2026-05-02,Phillip Eng,MBTA,Phillip Phillips (@phillphill) • Instagram photos and videos,https://www.instagram.com/phillphill/,4,"I've known @phillphill for about twelve years now. We've written countless songs together, shared endless jokes, and seen each other through some hard times and ...",positive,True
2026-05-02,Phillip Eng,MBTA,Phillip Phillips,https://open.spotify.com/artist/6p5JxpTc7USNnBnLzctyd4,5,"Singles and EPs · Homesick · Gone, Gone, Gone (Phillip's Version) · Home (Phillip's Version) · Dancing With Your Shadows (Demo Version) · So Will I · Before I ...",neutral,False
2026-05-02,Phillip Eng,MBTA,Phillip Phillips,https://www.phillipphillips.com/,6,Phillip Phillips. Open Menu Close Menu. Music · Video · Tour · Store · Phillip Phillips.,neutral,False
2026-05-02,Phillip Eng,MBTA,PHILLIP Definition & Meaning,https://www.dictionary.com/browse/phillip,7,"a male given name. Phillip British. / ˈfɪlɪp /. noun. Arthur. 1738–1814, English naval commander; captain general of the First Fleet, which carried ...",neutral,False
2026-05-02,Phillip Eng,MBTA,Philip vs Phillip : r/namenerds,https://www.reddit.com/r/namenerds/comments/rx4lcs/philip_vs_phillip/,8,Philip was the more common spelling in 2020 (655 babies vs 546) but Phillip has generally been the dominant spelling since 1950. Some argue ...,neutral,False
2026-05-02,Monica Tibbits-Nutt,MBTA,Monica (singer),https://en.wikipedia.org/wiki/Monica_(singer),1,"Monica Denise Arnold (formerly Brown; born October 24, 1980), best known mononymously as Monica, is an American singer, songwriter, and actress.",neutral,False
2026-05-02,Monica Tibbits-Nutt,MBTA,MONICA (@monicadenise) • Instagram photos and videos,https://www.instagram.com/monicadenise/,2,Where I'm Headed Determines How I'm Coming …. ♥️ #PassengerPrincess #PTMFSOMALG FOREVER the Inspiration 🕊️ #BabyGirl. I don't play about ...,positive,True
2026-05-02,Monica Tibbits-Nutt,MBTA,Monica,https://open.spotify.com/artist/6nzxy2wXs6tLgzEtqOkEi2,3,"She put together four straight Top Ten albums, including the chart-topping After the Storm (2003), and each one involved established and emergent Georgians as ...",neutral,False
2026-05-02,Monica Tibbits-Nutt,MBTA,Monica,https://music.youtube.com/channel/UCeiqCWKxJrtcGSDa3HMrUDw,4,"Monica Denise Arnold, best known mononymously as Monica, is an American singer, songwriter, and actress. Born and raised in College Park, Georgia, ...",neutral,False
2026-05-02,Monica Tibbits-Nutt,MBTA,Monica,https://www.facebook.com/monica/,5,Monica. 7469126 likes · 38347 talking about this. https://linktr.ee/MonicaOfficial.,positive,True
2026-05-02,Monica Tibbits-Nutt,MBTA,Monica.com,https://www.monica.com/,6,"MONICA is a Grammy Award-winning Multi-platinum Artist, 25-million-plusselling singer, actress, philanthropist and entrepreneur.",neutral,False
2026-05-02,Janno Lieber,NYC Subway,Janno Gibbs,https://en.wikipedia.org/wiki/Janno_Gibbs,1,"Janno Ronaldo Ilagan Gibbs (born September 16, 1969) is a Filipino singer, songwriter, comedian and actor. He was a regular host of GMA Network television shows ...",neutral,False
2026-05-02,Janno Lieber,NYC Subway,JANNO,https://open.spotify.com/artist/7hpiHzP9aLLb5liDLxtwhM,2,Singles and EPs · JUNGS AUF NER BANK · Zweizwei Cypher · Neckbreaker · Get Down · Moon Rocks · HYPERAKTIV · GET THE FUCK UP · ALLES WAS WAR. Single • 2025 ...,neutral,False
2026-05-02,Janno Lieber,NYC Subway,JANNO,https://music.apple.com/us/artist/janno/1540884909,3,"Listen to music by JANNO on Apple Music. Find top songs and albums by JANNO including Neckbreaker, Get Down and more.",neutral,False
2026-05-02,Janno Lieber,NYC Subway,Janno Gibbs,https://www.youtube.com/playlist?list=PLTFmW0eINFNPYz0IJw1EqUTjtreptZkPf,4,"Janno Gibbs & Manilyn Reynes' version of ""MY JAGIYA"" | FULL VIDEO · The Gibbs' version of 'ONE DAY' I FULL VIDEO · Janno Gibbs sings 'CHANDELIER' I FULL VIDEO.",neutral,False
2026-05-02,Janno Lieber,NYC Subway,Janno Ilagan Gibbs (@jannolategibbs),https://www.instagram.com/jannolategibbs/,5,"445K followers · 1.2K+ following · 1288 posts · @jannolategibbs: “Artist, Political Angalist”",positive,True
2026-05-02,Janno Lieber,NYC Subway,Janno,https://en.wikipedia.org/wiki/Janno,6,"Janno is both a masculine given name and a surname predominantly found in Estonia. As a given name it can be a diminutive of Johannes, Juhan, Jan, Jaan, and ...",neutral,False
2026-05-02,Janno Lieber,NYC Subway,Janno Trump - musician/bassplayer,https://www.jannotrump.com/,7,Janno Trump is one of the most notable younger generation bassists in Estonia and a bandleader of the jazz-funk orchestra JT Conception.,neutral,False
2026-05-02,Janno Lieber,NYC Subway,Janno Gibbs (@jannogibbsofficial),https://www.facebook.com/jannogibbsofficial/,8,Janno Gibbs. 483608 likes · 89412 talking about this. My Official Facebook Page.,positive,True
2026-05-02,Janno Lieber,NYC Subway,Janno Lieber,https://www.mta.info/transparency/leadership/executive-leadership/janno-lieber,9,John (“Janno”) Lieber was confirmed as Chair and CEO of the Metropolitan Transportation Authority (MTA) in January 2022.,positive,True
2026-05-02,Monica Tibbits-Nutt,The T,Monica Tibbits-Nutt,https://www.massport.com/our-business/leadership/monica-tibbits-nutt,1,"Monica G. Tibbits-Nutt, is the Secretary and CEO of the Massachusetts Department of Transportation (MassDOT).",positive,True
2026-05-02,Monica Tibbits-Nutt,The T,Transportation Sec. Monica Tibbits-Nutt Stepping Down ...,https://mass.streetsblog.org/2025/10/16/rearranging-the-cabinet-transportation-sec-monica-tibbits-nutt-stepping-down-replaced-by-mbta-gm-phillip-eng,2,Secretary of Transportation Monica Tibbits-Nutt is leaving the Healey administration. Governor Maura Healey announced this morning in a ...,neutral,False
2026-05-02,Monica Tibbits-Nutt,The T,Disgraced former Transportation Secretary Monica Tibbits ...,https://www.bostonherald.com/2026/01/07/disgraced-former-transportation-secretary-monica-tibbits-nutt-officially-off-state-payroll/,3,Former Transportation Secretary Monica Tibbits-Nutt is officially off the state employee payroll after resigning in disgrace in October and ...,negative,False
2026-05-02,Monica Tibbits-Nutt,The T,MassFiscal Responds to Departure of Transportation ...,https://www.massfiscal.org/massfiscal-responds-departure-monica-tibbits-nutt,4,Tibbits-Nutt Exit is “Long Overdue”. The Massachusetts Fiscal Alliance today responded to news that Secretary of Transportation Monica ...,neutral,False
2026-05-02,Monica Tibbits-Nutt,The T,"Monica Tibbits-Nutt made history as the first Queer, Black ...",https://www.linkedin.com/posts/lauren-melendez-53690475_monica-tibbits-nutt-made-history-as-the-first-activity-7301335136107720704-9AIP,5,"Monica Tibbits-Nutt made history as the first Queer, Black woman to be named Secretary of Transportation for the Commonwealth.",positive,True
2026-05-02,Monica Tibbits-Nutt,The T,Tibbits-Nutt is out as transportation secretary. T chief Eng ...,https://www.wbur.org/news/2025/10/16/tibbits-nutt-transportation-secretary-massachusetts-eng,6,"Tibbits-Nutt's departure has been rumored in recent months, and her public profile has been lower than at the start of her appointment.",neutral,False
2026-05-02,Monica Tibbits-Nutt,The T,Governor Healey Appoints MBTA General Manager Phil ...,https://www.mass.gov/news/governor-healey-appoints-mbta-general-manager-phil-eng-as-interim-transportation-secretary,7,... (MBTA) General Manager Phillip Eng as Interim Transportation Secretary. Monica Tibbits-Nutt has made the decision to step down from her ...,neutral,False
2026-05-02,Monica Tibbits-Nutt,The T,Former state Transportation Secretary Monica Tibbits-Nutt ...,https://www.instagram.com/p/DTQXY_FDubj/,8,"624 likes, 195 comments - bostonherald on January 8, 2026: ""Former state Transportation Secretary Monica Tibbits-Nutt is officially off the ...",positive,True
2026-05-02,Monica Tibbits-Nutt,The T,"MassDOT secretary Tibbits-Nutt steps down, MBTA chief ...",https://www.reddit.com/r/boston/comments/1o876bw/massdot_secretary_tibbitsnutt_steps_down_mbta/,9,"Massachusetts Department of Transportation secretary Monica Tibbits-Nutt will step down from her position, Governor Maura Healey announced ...",neutral,False
2026-05-02,Nora Leerhsen,Chicago Transit Authority,Nora Leerhsen,https://en.wikipedia.org/wiki/Nora_Leerhsen,1,"Nora Leerhsen is an American lawyer and executive who has served as the Acting President of the Chicago Transit Authority (CTA) since February 2025, replacing ...",neutral,False
2026-05-02,Nora Leerhsen,Chicago Transit Authority,"Nora Leerhsen - Acting President, Chicago Transit Authority",https://www.linkedin.com/in/nora-leerhsen-1ba38847,2,"Acting President, Chicago Transit Authority · Experience: Chicago Transit Authority · Education: University of Wisconsin Law School · Location: Greater ...",positive,True
2026-05-02,Nora Leerhsen,Chicago Transit Authority,CTA Governance/Administration,https://www.transitchicago.com/governance/,3,"Nora Leerhsen is the acting president of the Chicago Transit Authority (CTA), one of the nation's largest public transit agencies, providing approximately one ...",positive,True
2026-05-02,Nora Leerhsen,Chicago Transit Authority,Team | Chicago Transit Authority,https://www.ctabonds.com/chicago-transit-authority-il/about/our-team/i6552,4,"nleerhsen@transitchicago.com. Nora Leerhsen is acting president of the Chicago Transit Authority (CTA), one of the nation's largest public transit agencies ...",positive,True
2026-05-02,Nora Leerhsen,Chicago Transit Authority,"Nora Leerhsen, Acting President, Chicago Transit Authority",https://www.cityclub-chicago.org/video/5742/nora-leerhsen-acting-president-chicago-t,5,I first met acting pres CTA president Nora lerson at the University of Chicago 20 years ago when she was a master student.,positive,False
2026-05-02,Nora Leerhsen,Chicago Transit Authority,Nora Leerhsen from Chicago Transit Authority shares ...,https://www.facebook.com/transitunpluggedmedia/videos/nora-leerhsen-from-chicago-transit-authority-shares-whats-behind-a-major-shift-i/997219749637127/,6,Nora Leerhsen from Chicago Transit Authority shares what's behind a major shift in transit safety The full conversation dives into how agencies ...,positive,True
2026-05-02,Nora Leerhsen,Chicago Transit Authority,Acting CTA chief lays out priorities after dodging fiscal cliff,https://www.chicagotribune.com/2026/02/02/acting-cta-chief-lays-out-priorities-after-dodging-fiscal-cliff/,7,"When she was named acting president of the Chicago Transit Authority, Nora Leerhsen made a call to the agency's first female train operator.",neutral,False
2026-05-02,Nora Leerhsen,Chicago Transit Authority,"Nora Leerhsen, Acting President, Chicago Transit Authority",https://vimeo.com/1157388624,8,"Nora Leerhsen, Acting President, Chicago Transit Authority. 3 months ago. Add to. Showcase Channel Group. City Club of Chicago. Follow.",positive,False
2026-05-02,Nora Leerhsen,Chicago Transit Authority,From CTA Acting President Nora Leerhsen: On ...,https://www.instagram.com/p/DXpjqSSFNd1/,9,Chicago Mayor Brandon Johnson joined CTA Acting President Nora Leerhsen and a host of civic and community leaders to kick off the 2026 ...,positive,True
2026-05-02,Phillip Eng,Massachusetts Bay Transportation Authority,Philips - United States | Philips,https://www.usa.philips.com/?srsltid=AfmBOoqNMbalNv2qvDapwje7IVC-eUo6a2gWfKoEoH8NrQh0RdRxI2-2,1,"Learn more about Philips and how we help improve people's lives through meaningful innovation in the areas of Healthcare, Consumer Lifestyle and Lighting.",positive,False
2026-05-02,Phillip Eng,Massachusetts Bay Transportation Authority,"Prince Philip, Duke of Edinburgh","https://en.wikipedia.org/wiki/Prince_Philip,_Duke_of_Edinburgh",2,"Prince Philip, Duke of Edinburgh was the husband of Queen Elizabeth II and served as consort of the British monarch from her accession on 6 February 1952 ...",neutral,False
2026-05-02,Phillip Eng,Massachusetts Bay Transportation Authority,Phillip Phillips (@PhillipPhillips),https://www.facebook.com/PhillipPhillips/,3,Phillip Phillips. 989930 likes · 2364 talking about this. New single “Homesick” out now! ⬇️ https://stem.ffm.to/homesickphillip.,positive,True
2026-05-02,Phillip Eng,Massachusetts Bay Transportation Authority,Phillip Phillips (@phillphill) • Instagram photos and videos,https://www.instagram.com/phillphill/,4,"I've known @phillphill for about twelve years now. We've written countless songs together, shared endless jokes, and seen each other through some hard times and ...",positive,True
2026-05-02,Phillip Eng,Massachusetts Bay Transportation Authority,Phillip Phillips,https://open.spotify.com/artist/6p5JxpTc7USNnBnLzctyd4,5,"Singles and EPs · Homesick · Gone, Gone, Gone (Phillip's Version) · Home (Phillip's Version) · Dancing With Your Shadows (Demo Version) · So Will I · Before I ...",neutral,False
2026-05-02,Phillip Eng,Massachusetts Bay Transportation Authority,Phillip Phillips,https://www.phillipphillips.com/,6,Phillip Phillips. Open Menu Close Menu. Music · Video · Tour · Store · Phillip Phillips.,neutral,False
2026-05-02,Phillip Eng,Massachusetts Bay Transportation Authority,PHILLIP Definition & Meaning,https://www.dictionary.com/browse/phillip,7,"a male given name. Phillip British. / ˈfɪlɪp /. noun. Arthur. 1738–1814, English naval commander; captain general of the First Fleet, which carried ...",neutral,False
2026-05-02,Phillip Eng,Massachusetts Bay Transportation Authority,Philip vs Phillip : r/namenerds,https://www.reddit.com/r/namenerds/comments/rx4lcs/philip_vs_phillip/,8,Philip was the more common spelling in 2020 (655 babies vs 546) but Phillip has generally been the dominant spelling since 1950. Some argue ...,neutral,False
2026-05-02,Monica Tibbits-Nutt,Massachusetts Bay Transportation Authority,Monica Tibbits-Nutt,https://www.massport.com/our-business/leadership/monica-tibbits-nutt,1,"Monica G. Tibbits-Nutt, is the Secretary and CEO of the Massachusetts Department of Transportation (MassDOT).",positive,True
2026-05-02,Monica Tibbits-Nutt,Massachusetts Bay Transportation Authority,Transportation Sec. Monica Tibbits-Nutt Stepping Down ...,https://mass.streetsblog.org/2025/10/16/rearranging-the-cabinet-transportation-sec-monica-tibbits-nutt-stepping-down-replaced-by-mbta-gm-phillip-eng,2,Secretary of Transportation Monica Tibbits-Nutt is leaving the Healey administration. Governor Maura Healey announced this morning in a ...,neutral,False
2026-05-02,Monica Tibbits-Nutt,Massachusetts Bay Transportation Authority,Governor Healey Appoints MBTA General Manager Phil ...,https://www.mass.gov/news/governor-healey-appoints-mbta-general-manager-phil-eng-as-interim-transportation-secretary,3,... Bay Transportation Authority (MBTA) General Manager Phillip Eng as Interim Transportation Secretary. Monica Tibbits-Nutt has made the ...,neutral,False
2026-05-02,Monica Tibbits-Nutt,Massachusetts Bay Transportation Authority,MassFiscal Responds to Departure of Transportation ...,https://www.massfiscal.org/massfiscal-responds-departure-monica-tibbits-nutt,4,Tibbits-Nutt Exit is “Long Overdue”. The Massachusetts Fiscal Alliance today responded to news that Secretary of Transportation Monica ...,neutral,False
2026-05-02,Monica Tibbits-Nutt,Massachusetts Bay Transportation Authority,Howie Carr: Monica Tibbits-Nutt didn't leave much of a ...,https://www.bostonherald.com/2025/10/18/howie-carr-monica-tibbits-nutt-didnt-leave-much-of-a-legacy-for-massdot/,5,"Gov. Maura Healey doesn't feel much like a nut. In fact, it appears she's allergic to at least one, namely, Monica Tibbits-Nutt, ...",neutral,False
2026-05-02,Monica Tibbits-Nutt,Massachusetts Bay Transportation Authority,"MassDOT shakeup: Secretary Tibbits-Nutt out, but keeps ...",https://www.facebook.com/massfiscal/posts/massdot-shakeup-secretary-tibbits-nutt-out-but-keeps-200k-paythe-executive-direc/1236654378501898/,6,"MassDOT shakeup: Secretary Tibbits-Nutt out, but keeps $200K pay The executive director of the Massachusetts Fiscal Alliance, ...",positive,True
2026-05-02,Monica Tibbits-Nutt,Massachusetts Bay Transportation Authority,Monica Tibbits-Nutt parting ways with Massachusetts ...,https://www.wcvb.com/article/monica-tibbits-nutt-parting-ways-with-massachusetts-department-of-transportation/69054926,7,Maura Healey said Tibbits-Nutt made the decision to step down from her positions as secretary of the Department of Transportation and CEO of ...,neutral,False
2026-05-02,Monica Tibbits-Nutt,Massachusetts Bay Transportation Authority,"Monica Tibbits-Nutt, FAICP, LEED AP BD C - Jacobs",https://www.linkedin.com/in/monica-tibbits-nutt,8,"Monica Tibbits-Nutt, FAICP, LEED AP BD C. Jacobs The Ohio State University. Greater Boston. 3K followers 500+ ...",positive,True
2026-05-02,Monica Tibbits-Nutt,Massachusetts Bay Transportation Authority,"MassDOT secretary Tibbits-Nutt steps down, MBTA chief ...",https://www.reddit.com/r/boston/comments/1o876bw/massdot_secretary_tibbitsnutt_steps_down_mbta/,9,"MassDOT secretary Tibbits-Nutt steps down, MBTA chief Eng announced as interim replacement ... Archived post. New comments cannot be posted and ...",neutral,False
2026-05-02,Nora Leerhsen,CTA,Nora Lighting - Illuminating the Future®,https://noralighting.com/,1,"Nora Lighting is a leading manufacturer of LED luminaires for residential, commercial, and institutional applications.",neutral,False
2026-05-02,Nora Leerhsen,CTA,NORA | Organ Transportation and Logistics,https://www.noratrans.com/,2,"NORA specializes in organ donation and tissue transportation nationwide, servicing clients through elite ground and air transportation, supported by a ...",neutral,False
2026-05-02,Nora Leerhsen,CTA,Nora (name),https://en.wikipedia.org/wiki/Nora_(name),3,"Nora or Norah is a feminine given name. It mainly originates as a short form of Honora (also Honoria), a common Anglo-Norman name, ultimately derived from the ...",neutral,False
2026-05-02,Nora Leerhsen,CTA,"Nora - Baby Name Meaning, Origin and Popularity",https://www.thebump.com/b/nora-baby-name,4,"Nora is a feminine name that has several origins. Considered a shortened form of Honora, Nora assumes the meaning of ""honor"" from the Latin Honorius.",positive,False
2026-05-02,Nora Leerhsen,CTA,Nora (2025),https://www.imdb.com/title/tt15272328/,5,"A former musician settles in suburbia to raise her child. When her husband travels for work, she navigates single parenthood, a new home, and lingering musical ...",neutral,False
2026-05-02,Nora Leerhsen,CTA,NORA (@IAMNORAOFFICIAL),https://www.facebook.com/IAMNORAOFFICIAL/,6,"NORA, London. 1184 likes · 20 talking about this. B*tch pop anthems for soft girlies w/ sharp edges crush is out now ✭ welcome to the deluluverse.",positive,True
2026-05-02,Nora Leerhsen,CTA,About NORA,https://noraweb.org/about-nora/,7,"NORA was authorized by Congress in 2000 to provide funding that enables the liquid fuel heating industry to provide more efficient, more reliable and lower ...",neutral,False
2026-05-02,Nora Leerhsen,CTA,Nora,https://open.spotify.com/artist/2pH0QIWh7UyhPZHit7eCQG,8,Artist Playlists · 2000s (Actual) Metalcore · NJHC (New Jersey Hardcore) · Early 2000s Hardcore · Chaotic Hardcore/Mathcore · Early Metalcore (1989 - 2002) ...,neutral,False
2026-05-02,Ryan Coholan,Massachusetts Bay Transportation Authority,Ryan's World,https://www.youtube.com/channel/UChGJGhZ9SOOHvBB0Y4DOO_w,1,"Ryan loves doing lots of fun things like pretend play, science experiments, music videos, skits, challenges, DIY arts and crafts and more!",neutral,False
2026-05-02,Ryan Coholan,Massachusetts Bay Transportation Authority,Ryan's World,https://ryans.world/,2,The best in children's entertainment period · Latest Content · LegoLand · Transformers · Mattel: Jurassic World Toys · Mark Rober & Crunch Labs · The Ninja ...,neutral,False
2026-05-02,Ryan Coholan,Massachusetts Bay Transportation Authority,Ryan Trahan,https://www.youtube.com/@ryan,3,"Videos · Hi, Me in 10 Years · I Took the Longest Train Ride in America · I Tested Every Level of Airplane Food. 13M views. 1 month ago · I Tested 1 ...",neutral,False
2026-05-02,Ryan Coholan,Massachusetts Bay Transportation Authority,Ryan's World the Movie: Titan Universe Adventure (2024),https://www.imdb.com/title/tt29898251/,4,"Ryan's twin sisters Emma and Kate get trapped in a comic book world. Ryan enters this realm to rescue them, facing adventures, battles, and mishaps.",positive,False
2026-05-02,Ryan Coholan,Massachusetts Bay Transportation Authority,Ryan's World,https://en.wikipedia.org/wiki/Ryan%27s_World,5,Ryan's World (formerly Ryan ToysReview) is a YouTube channel for children featuring Ryan Kaji along with his family.,neutral,False
2026-05-02,Ryan Coholan,Massachusetts Bay Transportation Authority,Ryan's World: TOYS & GAMES,https://www.amazon.com/stores/RyansWorld/page/CBAADD39-15D2-4896-BF19-EE09FF164503,6,"Shop all Toys, Games and Puzzles from the creator of Ryan ToysReview.",neutral,False
2026-05-02,Ryan Coholan,Massachusetts Bay Transportation Authority,Ryan's World (@ryansworld) • Instagram photos and videos,https://www.instagram.com/ryansworld/,7,Ryan's World The Movie is out now in Theaters! #ryansworld #kidsmovies. Robert Downey Jr. posted a personalized message to Ryan Thank you RDJ! Robert ...,positive,True
2026-05-02,Janno Lieber,MTA,Janno Gibbs,https://en.wikipedia.org/wiki/Janno_Gibbs,1,"Janno Ronaldo Ilagan Gibbs (born September 16, 1969) is a Filipino singer, songwriter, comedian and actor. He was a regular host of GMA Network television shows ...",neutral,False
2026-05-02,Janno Lieber,MTA,JANNO,https://open.spotify.com/artist/7hpiHzP9aLLb5liDLxtwhM,2,Singles and EPs · JUNGS AUF NER BANK · Zweizwei Cypher · Neckbreaker · Get Down · Moon Rocks · HYPERAKTIV · GET THE FUCK UP · ALLES WAS WAR. Single • 2025 ...,neutral,False
2026-05-02,Janno Lieber,MTA,JANNO,https://music.apple.com/us/artist/janno/1540884909,3,"Listen to music by JANNO on Apple Music. Find top songs and albums by JANNO including Neckbreaker, Get Down and more.",neutral,False
2026-05-02,Janno Lieber,MTA,Janno Gibbs,https://www.youtube.com/playlist?list=PLTFmW0eINFNPYz0IJw1EqUTjtreptZkPf,4,"Janno Gibbs & Manilyn Reynes' version of ""MY JAGIYA"" | FULL VIDEO · The Gibbs' version of 'ONE DAY' I FULL VIDEO · Janno Gibbs sings 'CHANDELIER' I FULL VIDEO.",neutral,False
2026-05-02,Janno Lieber,MTA,Janno Ilagan Gibbs (@jannolategibbs),https://www.instagram.com/jannolategibbs/,5,"445K followers · 1.2K+ following · 1288 posts · @jannolategibbs: “Artist, Political Angalist”",positive,True
2026-05-02,Janno Lieber,MTA,Janno,https://en.wikipedia.org/wiki/Janno,6,"Janno is both a masculine given name and a surname predominantly found in Estonia. As a given name it can be a diminutive of Johannes, Juhan, Jan, Jaan, and ...",neutral,False
2026-05-02,Janno Lieber,MTA,Janno Trump - musician/bassplayer,https://www.jannotrump.com/,7,Janno Trump is one of the most notable younger generation bassists in Estonia and a bandleader of the jazz-funk orchestra JT Conception.,neutral,False
2026-05-02,Janno Lieber,MTA,Janno Gibbs (@jannogibbsofficial),https://www.facebook.com/jannogibbsofficial/,8,Janno Gibbs. 483608 likes · 89412 talking about this. My Official Facebook Page.,positive,True
2026-05-02,Janno Lieber,MTA,Janno Lieber,https://www.mta.info/transparency/leadership/executive-leadership/janno-lieber,9,John (“Janno”) Lieber was confirmed as Chair and CEO of the Metropolitan Transportation Authority (MTA) in January 2022.,positive,True
