date,ceo,company,title,url,position,snippet,sentiment,controlled
2026-06-26,Monica Tibbits-Nutt,Boston T,Governor Healey Appoints Monica Tibbits-Nutt as ...,https://www.mass.gov/news/governor-healey-appoints-monica-tibbits-nutt-as-secretary-of-transportation,2.0,Governor Maura T. Healey today announced that she is appointing Monica Tibbits-Nutt as Secretary of the Massachusetts Department of Transportation (MassDOT) ...,neutral,False
2026-06-26,Monica Tibbits-Nutt,Boston T,"Monica Tibbits-Nutt, FAICP, LEED AP BD C",https://www.linkedin.com/in/monica-tibbits-nutt,3.0,"Transportation Executive | Growth & Sales Leader | Strategic Client Advisor | Rail, Transit & Infrastructure · Transportation executive and growth leader ...",positive,True
2026-06-26,Monica Tibbits-Nutt,Boston T,Disgraced former Transportation Secretary Monica Tibbits ...,https://www.bostonherald.com/2026/01/07/disgraced-former-transportation-secretary-monica-tibbits-nutt-officially-off-state-payroll/,4.0,Former Transportation Secretary Monica Tibbits-Nutt is officially off the state employee payroll after resigning in disgrace in October and ...,negative,False
2026-06-26,Monica Tibbits-Nutt,Boston T,"Monica Tibbits-Nutt made history as the first Queer, Black ...",https://www.linkedin.com/posts/lauren-melendez-53690475_monica-tibbits-nutt-made-history-as-the-first-activity-7301335136107720704-9AIP,5.0,"About Black Heritage Month, We wanted to reintroduce you to a prominent figure heading up Mass dot Transportation Secretary Monica Tibbetts, nut ...",positive,True
2026-06-26,Monica Tibbits-Nutt,Boston T,"MassDOT secretary Tibbits-Nutt steps down, MBTA chief ...",https://www.reddit.com/r/boston/comments/1o876bw/massdot_secretary_tibbitsnutt_steps_down_mbta/,6.0,She lost my respect after she admitted she was driven to work every day despite living near an MBTA commuter rail because an MBTA pass “was ...,neutral,False
2026-06-26,Monica Tibbits-Nutt,Boston T,Transportation Sec. Monica Tibbits-Nutt Stepping Down ...,https://mass.streetsblog.org/2025/10/16/rearranging-the-cabinet-transportation-sec-monica-tibbits-nutt-stepping-down-replaced-by-mbta-gm-phillip-eng,7.0,Secretary of Transportation Monica Tibbits-Nutt is leaving the Healey administration. Governor Maura Healey announced this morning in a ...,neutral,False
2026-06-26,Monica Tibbits-Nutt,Boston T,Massachusetts Secretary of Transportation Monica Tibbits ...,https://www.facebook.com/globe/posts/massachusetts-secretary-of-transportation-monica-tibbits-nutt-opts-to-drive-a-ma/861909972637952/,8.0,Massachusetts Secretary of Transportation Monica Tibbits-Nutt opts to drive a MassDOT-provided electric car to downtown Boston when the job ...,positive,True
2026-06-26,Monica Tibbits-Nutt,Boston T,MassFiscal Responds to Departure of Transportation ...,https://www.massfiscal.org/massfiscal-responds-departure-monica-tibbits-nutt,9.0,Tibbits-Nutt Exit is “Long Overdue”. The Massachusetts Fiscal Alliance today responded to news that Secretary of Transportation Monica ...,neutral,False
2026-06-26,Ryan Coholan,The T,No organic results found,,,No organic search results returned for this query,negative,False
2026-06-26,Nora Leerhsen,The L,No organic results found,,,No organic search results returned for this query,negative,False
2026-06-26,Phillip Eng,Boston T,No organic results found,,,No organic search results returned for this query,negative,False
2026-06-26,Phillip Eng,The T,No organic results found,,,No organic search results returned for this query,negative,False
2026-06-26,Randy Clarke,Washington Metropolitan Area Transit Authority,No organic results found,,,No organic search results returned for this query,negative,False
2026-06-26,Janno Lieber,NYC Subway,No organic results found,,,No organic search results returned for this query,negative,False
