date,ceo,company,title,url,position,snippet,sentiment,controlled
2026-05-22,Phillip Eng,MBTA,Phillip Phillips,https://www.imdb.com/name/nm4922087/,8,"Phillip Phillips was born on 20 September 1990 in Albany, Georgia, USA. He is an actor, known for American Idol (2002), The Amazing Spider-Man 2 (2014) and ...",neutral,False
2026-05-22,Phillip Eng,The T,Philips - United States | Philips,https://www.usa.philips.com/?srsltid=AfmBOoqwvwQMKdPjuVhaZw6CceKkidE9Jz_xobqncwC9DPLx6zV0LYy9,1,"Learn more about Philips and how we help improve people's lives through meaningful innovation in the areas of Healthcare, Consumer Lifestyle and Lighting.",positive,False
2026-05-22,Phillip Eng,The T,Phillip Phillips (@PhillipPhillips),https://www.facebook.com/PhillipPhillips/,2,MUSICIAN/BAND · 381 talking about this · New single “Homesick” out now! ⬇️ https://stem.ffm.to/homesickphillip.,positive,True
2026-05-22,Phillip Eng,The T,Phillip Phillips (@phillphill) • Instagram photos and videos,https://www.instagram.com/phillphill/?hl=en,3,New single “Homesick” out now! ⬇️ · 16 years since I've called you my girlfriend. Still are and always will be. · 4 days since Home (Phillip's Version) became ...,positive,True
2026-05-22,Phillip Eng,The T,Phillip Phillips,https://open.spotify.com/artist/6p5JxpTc7USNnBnLzctyd4,4,"Singles and EPs · Homesick · Gone, Gone, Gone (Phillip's Version) · Home (Phillip's Version) · Dancing With Your Shadows (Demo Version) · So Will I · Before I ...",neutral,False
2026-05-22,Phillip Eng,The T,Phillip Phillips,https://www.phillipphillips.com/,5,Phillip Phillips. Open Menu Close Menu. Music · Video · Tour · Store · Phillip Phillips.,neutral,False
2026-05-22,Phillip Eng,The T,Phillip Phillips,https://en.wikipedia.org/wiki/Phillip_Phillips,6,"Phillip LaDon Phillips Jr. (born September 20, 1990) is an American singer-songwriter who rose to fame after winning the eleventh season of American Idol in ...",neutral,False
2026-05-22,Phillip Eng,The T,Phillip Phillips,https://www.youtube.com/channel/UCZYewi2Ya8JledgJImmXIWg,7,"Share your videos with friends, family, and the world.",neutral,False
2026-05-22,Phillip Eng,The T,Phillip Phillips,https://www.imdb.com/name/nm4922087/,8,"Phillip Phillips was born on 20 September 1990 in Albany, Georgia, USA. He is an actor, known for American Idol (2002), The Amazing Spider-Man 2 (2014) and ...",neutral,False
2026-05-22,Ryan Coholan,Boston T,channel Ryan's World,https://www.youtube.com/channel/UChGJGhZ9SOOHvBB0Y4DOO_w,1,"Share your videos with friends, family, and the world.",neutral,False
2026-05-22,Ryan Coholan,Boston T,Ryan's World,https://ryans.world/,2,The best in children's entertainment period · Latest Content · LegoLand · Transformers · Mattel: Jurassic World Toys · Mark Rober & Crunch Labs · The Ninja ...,neutral,False
2026-05-22,Ryan Coholan,Boston T,Ryan Trahan,https://www.youtube.com/@ryan,3,Popular videos · I Tried Every Seat on the Most Expensive Airline · I Spent 100 Days in the Metaverse · I Spent 100 Days in Realistic Minecraft. 47M views. 4 ...,neutral,False
2026-05-22,Ryan Coholan,Boston T,Ryan's World,https://en.wikipedia.org/wiki/Ryan%27s_World,4,Ryan's World (formerly Ryan ToysReview) is a YouTube channel for children featuring Ryan Kaji along with his family.,neutral,False
2026-05-22,Ryan Coholan,Boston T,Ryan's World (TV Series 2017–2024),https://www.imdb.com/title/tt12987338/,5,"Ryan's World is a children's YouTube channel featuring Ryan Kaji along with his mother, father, and twin sisters.",neutral,False
2026-05-22,Ryan Coholan,Boston T,Ryan's World (@ryansworld) • Instagram photos and videos,https://www.instagram.com/ryansworld/?hl=en,6,176K followers · 43 following · 908 posts · @ryansworld: “This account is managed by Ryan's Mommy and Daddy or Ryan's parents. www.ryansfanfest.com”,positive,True
2026-05-22,Ryan Coholan,Boston T,Ryan's World,https://www.youtube.com/@RyansWorld,7,"Ryan loves doing lots of fun things like pretend play, science experiments, music videos, skits, challenges, DIY arts and crafts and more!",neutral,False
2026-05-22,Ryan Coholan,Boston T,Ryan,https://music.apple.com/us/artist/ryan/1415223338,8,"Listen to music by Ryan on Apple Music. Find top songs and albums by Ryan including Trippin' On U, From Afar (feat. Ryan) and more.",neutral,False
2026-05-22,Phillip Eng,Massachusetts Bay Transportation Authority,Phillip Eng | People,https://www.mbta.com/people/phillip-eng,1,Phillip Eng is the General Manager and CEO of the Massachusetts Bay Transportation Authority (MBTA). A Civil Engineer with nearly 40 years of transportation ...,positive,True
2026-05-22,Phillip Eng,Massachusetts Bay Transportation Authority,Phillip Eng,https://en.wikipedia.org/wiki/Phillip_Eng,2,Phillip Eng (born 1961 or 1962) is an American civil engineer and transit executive serving as interim secretary of Massachusetts Department of ...,neutral,False
2026-05-22,Phillip Eng,Massachusetts Bay Transportation Authority,Governor Healey Appoints MBTA General Manager Phil ...,https://www.mass.gov/news/governor-healey-appoints-mbta-general-manager-phil-eng-as-interim-transportation-secretary,3,Highway Administrator Jonathan Gulliver promoted to Undersecretary of Transportation; Interim Secretary and GM Eng to hold media ...,neutral,False
2026-05-22,Phillip Eng,Massachusetts Bay Transportation Authority,MBTA's Phillip Eng Named Interim MassDOT Secretary,https://aashtojournal.transportation.org/mbtas-phillip-eng-named-interim-massdot-secretary/,4,Massachusetts Governor Maura Healey (D) has appointed Phillip Eng (above at left) – general manager of the Massachusetts Bay Transportation ...,neutral,False
2026-05-22,Phillip Eng,Massachusetts Bay Transportation Authority,Phillip Eng - MassDOT and MBTA,https://www.linkedin.com/in/phillip-eng-875928240,5,Experience: MassDOT and MBTA · Education: The Cooper Union for the Advancement of Science and Art · Location: Boston · 500+ connections on LinkedIn.,positive,True
2026-05-22,Phillip Eng,Massachusetts Bay Transportation Authority,Did Phillip Eng fix the MBTA? Reliability and passenger ...,https://www.cbsnews.com/boston/news/mbta-general-manager-phillip-eng/,6,"Phillip Eng, the New Yorker who came out of retirement to fix the MBTA is getting rave reviews.",neutral,False
2026-05-22,Phillip Eng,Massachusetts Bay Transportation Authority,Phil Eng earns rave reviews for simultaneous MBTA ...,https://commonwealthbeacon.org/transportation/interim-or-indefinite-no-end-in-sight-to-phil-engs-double-duty/,7,The Healey administration seems content to have Phil Eng continue to work as both T general manager and interim transportation secretary for ...,neutral,False
2026-05-22,Phillip Eng,Massachusetts Bay Transportation Authority,Leadership at The MBTA,https://www.mbta.com/leadership,8,The MBTA is overseen by the Massachusetts Bay Transportation Authority Board of Directors. Phillip Eng is the Interim MassDOT Secretary and MBTA General Manager ...,positive,True
2026-05-22,Phillip Eng,Massachusetts Bay Transportation Authority,Even the MBTA can't stop Phil Eng : r/transit,https://www.reddit.com/r/transit/comments/1l2mfzo/even_the_mbta_cant_stop_phil_eng/,9,"A great long form read on Phil Eng, the current Massachusetts Bay Transportation Authority general manager.",positive,False
2026-05-22,Monica Tibbits-Nutt,Boston T,Monica (singer),https://en.wikipedia.org/wiki/Monica_(singer),1,"Monica Denise Arnold (formerly Brown; born October 24, 1980), best known mononymously as Monica, is an American singer, songwriter, and actress.",neutral,False
2026-05-22,Monica Tibbits-Nutt,Boston T,MONICA (@monicadenise) • Instagram photos and videos,https://www.instagram.com/monicadenise/?hl=en,2,monicadenise · HAPPY 40TH BIRTHDAY TO MY MONTEZ My Brother •My Confidant •My Protector • · Diamonds & Pearls aren't as Precious as My Girl… 43🕯️ · 43 🕯️ ...,positive,True
2026-05-22,Monica Tibbits-Nutt,Boston T,Monica,https://www.facebook.com/monica/,3,Monica. 7465473 likes · 21124 talking about this. https://linktr.ee/MonicaOfficial.,positive,True
2026-05-22,Monica Tibbits-Nutt,Boston T,Monica,https://open.spotify.com/artist/6nzxy2wXs6tLgzEtqOkEi2,4,"She put together four straight Top Ten albums, including the chart-topping After the Storm (2003), and each one involved established and emergent Georgians as ...",neutral,False
2026-05-22,Monica Tibbits-Nutt,Boston T,Monica.com,https://www.monica.com/,5,"MONICA is a Grammy Award-winning Multi-platinum Artist, 25-million-plusselling singer, actress, philanthropist and entrepreneur.",neutral,False
2026-05-22,Monica Tibbits-Nutt,Boston T,monicaofficial,https://www.youtube.com/@Monica,6,"Monica Host VH1 True-Crime Series 'Infamy' When Fame Turns Deadly. Monica hosts a series exploring the dark side of the American Dream, chronicling untold ...",neutral,False
2026-05-22,Monica Tibbits-Nutt,Boston T,Monica (2022),https://www.imdb.com/title/tt6337816/,7,"""Monica"" is a portrait of a woman who returns home to the Midwest for the first time in 20 years to confront the wounds of her past.",neutral,False
2026-05-22,Monica Tibbits-Nutt,Boston T,Monica,https://music.apple.com/us/artist/monica/334240,8,"Like her peers Brandy and Aaliyah, Monica (born Monica Denise Arnold in 1980) was a former choir kid who blossomed into a bona fide R&B teen queen.",neutral,False
2026-05-22,Monica Tibbits-Nutt,Boston T,MONICA Definition & Meaning,https://www.dictionary.com/browse/monica,9,MONICA definition: a female given name. See examples of Monica used in a sentence.,neutral,False
2026-05-22,Nora Leerhsen,The L,Nora Lighting - Illuminating the Future®,https://noralighting.com/,1,"Nora Lighting is a leading manufacturer of LED luminaires for residential, commercial, and institutional applications.",neutral,False
2026-05-22,Nora Leerhsen,The L,NORA | Organ Transportation and Logistics,https://www.noratrans.com/,2,"NORA specializes in organ donation and tissue transportation nationwide, servicing clients through elite ground and air transportation, supported by a ...",neutral,False
2026-05-22,Nora Leerhsen,The L,Nora (name),https://en.wikipedia.org/wiki/Nora_(name),3,"Nora or Norah is a feminine given name. It mainly originates as a short form of Honora (also Honoria), a common Anglo-Norman name, ultimately derived from the ...",neutral,False
2026-05-22,Nora Leerhsen,The L,Nora (2025),https://www.imdb.com/title/tt15272328/,4,"A former musician settles in suburbia to raise her child. When her husband travels for work, she navigates single parenthood, a new home, and lingering musical ...",neutral,False
2026-05-22,Nora Leerhsen,The L,About NORA,https://noraweb.org/about-nora/,5,"NORA was authorized by Congress in 2000 to provide funding that enables the liquid fuel heating industry to provide more efficient, more reliable and lower ...",neutral,False
2026-05-22,Nora Leerhsen,The L,Smart Nora,https://smartnora.com/?srsltid=AfmBOop0IzopcFIMbrLS4gDBkdBp51O1a17_de2XoLkw2EQI-BWBGHFO,6,"Smart Nora has provided an easily accessible, comfortable solution to address snoring and improve sleep quality for snorers and their partners. I have seen ...",positive,False
2026-05-22,Nora Leerhsen,The L,The Nora Project,https://thenoraproject.ngo/,7,We're on a mission to promote disability inclusion by empowering educators and engaging students & communities.,neutral,False
2026-05-22,Nora Leerhsen,The L,NORA,https://open.spotify.com/artist/2pH0QIWh7UyhPZHit7eCQG,8,Listen to NORA on Spotify. Artist · 3.3K monthly listeners.,neutral,False
2026-05-22,Janno Lieber,OMNY,MTA chief vows fare evasion crackdown on NYC buses ...,https://gothamist.com/news/mta-chief-vows-fare-evasion-crackdown-on-nyc-buses-once-metrocard-retires,1,MTA Chair Janno Lieber said requiring all riders to pay with OMNY will make it easier to check who has actually paid.,neutral,False
2026-05-22,Janno Lieber,OMNY,MTA Chair Janno Lieber says the MTA will be stepping up fare ...,https://www.instagram.com/reel/DVzI3DoknWn/,2,MTA Chair Janno Lieber says the MTA will be stepping up fare evasion measures for buses. ... OMNY card. However you pay and they'll be able to ...,positive,True
2026-05-22,Janno Lieber,OMNY,TRANSCRIPT: MTA Chair and CEO Lieber Appears on,https://www.mta.info/press-release/transcript-mta-chair-and-ceo-lieber-appears-point-marcia-kramer-0,3,"MTA Chair and CEO Janno Lieber: Hey, listen, I'm not a magician, but ... Let me tell you, the pre-tax benefit is now applicable on OMNY.",positive,True
2026-05-22,Janno Lieber,OMNY,"Janno Lieber on Free Buses, the State of the MTA, & The ...",https://nyeditorialboard.substack.com/p/janno-lieber-on-free-buses-the-state,4,"Janno Lieber, Chair and CEO of the Metropolitan Transportation Authority (MTA), which runs the New York City subways and buses, ...",positive,False
2026-05-22,Janno Lieber,OMNY,Reduced Fare OMNY | MTA Chair & CEO Janno Lieber ...,https://www.flickr.com/photos/mtaphotos/54202380213/,5,"MTA Chair & CEO Janno Lieber announces the release of Reduced Fare OMNY cards on Friday, Dec 13, 2024 at the Stone Street Customer Service ...",neutral,False
2026-05-22,Janno Lieber,OMNY,MTA CEO and chairman Janno Lieber has spoken up ...,https://www.instagram.com/p/DTNkfx4D3iI/,6,MTA CEO and chairman Janno Lieber has spoken up about safety concerns for the new subway fare gates after a 5-year-old child got their head ...,positive,True
2026-05-22,Janno Lieber,OMNY,Janno Lieber,https://en.wikipedia.org/wiki/Janno_Lieber,7,"John Nathan ""Janno"" Lieber (born September 19, 1961) is the head of the Metropolitan Transportation Authority (MTA) in New York.",neutral,False
2026-05-22,Janno Lieber,OMNY,MTA boss gets the price of a MetroCard wrong while ...,https://nypost.com/2025/11/19/us-news/mta-boss-gets-the-price-of-a-metrocard-wrong-while-flippantly-touting-tap-to-ride-switchover/,8,Lieber compared the OMNY switchover to the city ditching subway tokens in the early 1990s in favor of the MetroCard — saying doing away with the ...,negative,False
2026-05-22,Janno Lieber,NYC Subway,JANNO,https://open.spotify.com/artist/7hpiHzP9aLLb5liDLxtwhM,1,Singles and EPs · JUNGS AUF NER BANK · Zweizwei Cypher · Neckbreaker · Get Down · Moon Rocks · HYPERAKTIV · GET THE FUCK UP · ALLES WAS WAR. Single • 2025 ...,neutral,False
2026-05-22,Janno Lieber,NYC Subway,Janno Gibbs,https://en.wikipedia.org/wiki/Janno_Gibbs,2,"Janno Ronaldo Ilagan Gibbs (born September 16, 1969) is a Filipino singer, songwriter, comedian and actor. He was a regular host of GMA Network television shows ...",neutral,False
2026-05-22,Janno Lieber,NYC Subway,JANNO,https://music.apple.com/us/artist/janno/1540884909,3,"Listen to music by JANNO on Apple Music. Find top songs and albums by JANNO including Neckbreaker, Get Down and more.",neutral,False
2026-05-22,Janno Lieber,NYC Subway,Janno-JannoDisney-Juguilon,https://www.youtube.com/@janno-jannodisney-juguilon2340,4,"What I love to do is to watch my best animated, action movies. I create my own crossover videos/spoofs, make MMD vids, and photoshop screencaps to make my ...",neutral,False
2026-05-22,Janno Lieber,NYC Subway,Janno,https://en.wikipedia.org/wiki/Janno,5,"Janno is both a masculine given name and a surname predominantly found in Estonia. As a given name it can be a diminutive of Johannes, Juhan, Jan, Jaan, and ...",neutral,False
2026-05-22,Janno Lieber,NYC Subway,Janno Ilagan Gibbs (@jannolategibbs),https://www.instagram.com/jannolategibbs/,6,"Artist, Political Angalist ... 'ChickBoy' A Vertical Mini Series.Now Streaming on @vmbvivamoviebox . Directed by JannoGibbs Starring RobbGuinto DjDurano ...",positive,True
2026-05-22,Janno Lieber,NYC Subway,Janno Lieber,https://www.mta.info/transparency/leadership/executive-leadership/janno-lieber,7,John (“Janno”) Lieber was confirmed as Chair and CEO of the Metropolitan Transportation Authority (MTA) in January 2022.,positive,True
2026-05-22,Janno Lieber,NYC Subway,"Janno Gibbs - Songs, Events and Music Stats",https://www.viberate.com/artist/janno-gibbs/,8,"Janno Gibbs is recognized in the Philippines as the foremost authority on R&B and soul music. His powerful vocals, mellow melodies, and emotional lyrics all ...",neutral,False
2026-05-22,Janno Lieber,NYC Subway,Janno Trump - musician/bassplayer,https://www.jannotrump.com/,9,Janno Trump is one of the most notable younger generation bassists in Estonia and a bandleader of the jazz-funk orchestra JT Conception.,neutral,False
2026-05-22,Phillip Eng,Boston T,Philips - United States | Philips,https://www.usa.philips.com/?srsltid=AfmBOor-nFz7_hg2WezJMzgdT_b6E6xYk_kX_Llp2R6qQ0eYL29T6nBk,1,"Learn more about Philips and how we help improve people's lives through meaningful innovation in the areas of Healthcare, Consumer Lifestyle and Lighting.",positive,False
2026-05-22,Phillip Eng,Boston T,Phillip Phillips (@PhillipPhillips),https://www.facebook.com/PhillipPhillips/,2,MUSICIAN/BAND · 381 talking about this · New single “Homesick” out now! ⬇️ https://stem.ffm.to/homesickphillip.,positive,True
2026-05-22,Phillip Eng,Boston T,"Prince Philip, Duke of Edinburgh","https://en.wikipedia.org/wiki/Prince_Philip,_Duke_of_Edinburgh",3,"Prince Philip, Duke of Edinburgh was the husband of Queen Elizabeth II and served as consort of the British monarch from her accession on 6 February 1952 ...",neutral,False
2026-05-22,Phillip Eng,Boston T,Phillip Phillips (@phillphill) • Instagram photos and videos,https://www.instagram.com/phillphill/?hl=en,4,New single “Homesick” out now! ⬇️ · 16 years since I've called you my girlfriend. Still are and always will be. · 4 days since Home (Phillip's Version) became ...,positive,True
2026-05-22,Phillip Eng,Boston T,Phillip Phillips,https://open.spotify.com/artist/6p5JxpTc7USNnBnLzctyd4,5,"Singles and EPs · Homesick · Gone, Gone, Gone (Phillip's Version) · Home (Phillip's Version) · Dancing With Your Shadows (Demo Version) · So Will I · Before I ...",neutral,False
2026-05-22,Phillip Eng,Boston T,Phillip Phillips,https://www.phillipphillips.com/,6,Phillip Phillips. Open Menu Close Menu. Music · Video · Tour · Store · Phillip Phillips.,neutral,False
2026-05-22,Phillip Eng,Boston T,Philip or Phillip? : r/namenerds,https://www.reddit.com/r/namenerds/comments/dhl2mo/philip_or_phillip/,7,"So far I’m leaning towards Philip because of Prince Philip, Philip J. Fry, and Philip Defranco. Both spellings are equally popular. Do you think ...",neutral,False
2026-05-22,Phillip Eng,Boston T,Phillip Phillips,https://www.youtube.com/channel/UCZYewi2Ya8JledgJImmXIWg,8,"Share your videos with friends, family, and the world.",neutral,False
2026-05-22,Monica Tibbits-Nutt,MBTA,Monica Tibbits-Nutt,https://www.massport.com/our-business/leadership/monica-tibbits-nutt,1,"Monica G. Tibbits-Nutt, is the Secretary and CEO of the Massachusetts Department of Transportation (MassDOT).",positive,True
2026-05-22,Monica Tibbits-Nutt,MBTA,Transportation Sec. Monica Tibbits-Nutt Stepping Down ...,https://mass.streetsblog.org/2025/10/16/rearranging-the-cabinet-transportation-sec-monica-tibbits-nutt-stepping-down-replaced-by-mbta-gm-phillip-eng,2,Secretary of Transportation Monica Tibbits-Nutt is leaving the Healey administration. Governor Maura Healey announced this morning in a ...,neutral,False
2026-05-22,Monica Tibbits-Nutt,MBTA,Governor Healey Appoints MBTA General Manager Phil ...,https://www.mass.gov/news/governor-healey-appoints-mbta-general-manager-phil-eng-as-interim-transportation-secretary,3,... (MBTA) General Manager Phillip Eng as Interim Transportation Secretary. Monica Tibbits-Nutt has made the decision to step down from her ...,neutral,False
2026-05-22,Monica Tibbits-Nutt,MBTA,A Conversation with MassDOT Secretary Monica Tibbits ...,https://members.naiopma.org/event-calendar/Details/a-conversation-with-massdot-secretary-monica-tibbits-nutt-and-mbta-general-manager-phillip-eng-1055406?sourceTypeId=EmailInvitation,4,Join NAIOP for an exciting conversation with Massachusetts Secretary of Transportation Monica Tibbits-Nutt and Massachusetts Bay Transit Authority General ...,neutral,False
2026-05-22,Monica Tibbits-Nutt,MBTA,Monica Tibbits-Nutt Steps Down as MassDOT Secretary,https://aptapassengertransport.com/monica-tibbits-nutt-steps-down-as-massdot-secretary-phil-eng-named-interim/,5,Tibbits-Nutt will continue as an advisor through Dec. 31 to ensure an efficient transition. Governor Healey appointed Phil Eng as MBTA general ...,neutral,False
2026-05-22,Monica Tibbits-Nutt,MBTA,"Monica Tibbits-Nutt, FAICP, LEED AP BD C - Jacobs",https://www.linkedin.com/in/monica-tibbits-nutt,6,"Monica Tibbits-Nutt, FAICP, LEED AP BD C. Jacobs The Ohio State University. Greater Boston. 3K followers 500+ connections.",positive,True
2026-05-22,Monica Tibbits-Nutt,MBTA,"MassDOT secretary Tibbits-Nutt steps down, MBTA chief ...",https://www.reddit.com/r/boston/comments/1o876bw/massdot_secretary_tibbitsnutt_steps_down_mbta/,7,"MassDOT secretary Tibbits-Nutt steps down, MBTA chief Eng announced as interim replacement ... Archived post. New comments cannot be posted and ...",neutral,False
2026-05-22,Monica Tibbits-Nutt,MBTA,MassFiscal Responds to Departure of Transportation ...,https://www.massfiscal.org/massfiscal-responds-departure-monica-tibbits-nutt,8,Tibbits-Nutt Exit is “Long Overdue”. The Massachusetts Fiscal Alliance today responded to news that Secretary of Transportation Monica ...,neutral,False
2026-05-22,Monica Tibbits-Nutt,MBTA,Tibbits-Nutt is out as transportation secretary. T chief Eng ...,https://www.wbur.org/news/2025/10/16/tibbits-nutt-transportation-secretary-massachusetts-eng,9,"... Monica Tibbits-Nutt overseeing the state's transit agency. In a press release, Healey said Tibbits-Nutt ""has made the decision to step down ...",neutral,False
2026-05-22,Nora Leerhsen,CTA,Nora Lighting - Illuminating the Future®,https://noralighting.com/,1,"Nora Lighting is a leading manufacturer of LED luminaires for residential, commercial, and institutional applications.",neutral,False
2026-05-22,Nora Leerhsen,CTA,NORA | Organ Transportation and Logistics,https://www.noratrans.com/,2,"NORA specializes in organ donation and tissue transportation nationwide, servicing clients through elite ground and air transportation, supported by a ...",neutral,False
2026-05-22,Nora Leerhsen,CTA,Nora (name),https://en.wikipedia.org/wiki/Nora_(name),3,"Nora or Norah is a feminine given name. It mainly originates as a short form of Honora (also Honoria), a common Anglo-Norman name, ultimately derived from the ...",neutral,False
2026-05-22,Nora Leerhsen,CTA,Nora (2025),https://www.imdb.com/title/tt15272328/,4,"A former musician settles in suburbia to raise her child. When her husband travels for work, she navigates single parenthood, a new home, and lingering musical ...",neutral,False
2026-05-22,Nora Leerhsen,CTA,Nora – The Movie,https://norathemovie.com/,5,"Nora's real-world story is a journey of vulnerability, intimacy, and the desire to understand one's place in the world with all of its complex humanness.",neutral,False
2026-05-22,Nora Leerhsen,CTA,About NORA,https://noraweb.org/about-nora/,6,"NORA was authorized by Congress in 2000 to provide funding that enables the liquid fuel heating industry to provide more efficient, more reliable and lower ...",neutral,False
2026-05-22,Nora Leerhsen,CTA,Smart Nora,https://smartnora.com/?srsltid=AfmBOorQ8sQnhBDDNax-JWHCKyVk_S4t0xmw4fpIH06KRDE2dN4KWgPD,7,"Smart Nora has provided an easily accessible, comfortable solution to address snoring and improve sleep quality for snorers and their partners. I have seen ...",positive,False
2026-05-22,Nora Leerhsen,CTA,The Nora Project,https://thenoraproject.ngo/,8,We're on a mission to promote disability inclusion by empowering educators and engaging students & communities.,neutral,False
2026-05-22,Nora Leerhsen,CTA,"Nora - Baby Name Meaning, Origin and Popularity",https://www.thebump.com/b/nora-baby-name,9,"Nora is a feminine name that has several origins. Considered a shortened form of Honora, Nora assumes the meaning of ""honor"" from the Latin Honorius.",positive,False
2026-05-22,Monica Tibbits-Nutt,Massachusetts Bay Transportation Authority,Monica (singer),https://en.wikipedia.org/wiki/Monica_(singer),1,"Monica Denise Arnold (formerly Brown; born October 24, 1980), best known mononymously as Monica, is an American singer, songwriter, and actress.",neutral,False
2026-05-22,Monica Tibbits-Nutt,Massachusetts Bay Transportation Authority,MONICA (@monicadenise) • Instagram photos and videos,https://www.instagram.com/monicadenise/?hl=en,2,monicadenise · HAPPY 40TH BIRTHDAY TO MY MONTEZ My Brother •My Confidant •My Protector • · Diamonds & Pearls aren't as Precious as My Girl… 43🕯️ · 43 🕯️ ...,positive,True
2026-05-22,Monica Tibbits-Nutt,Massachusetts Bay Transportation Authority,Monica,https://www.facebook.com/monica/,3,"So Amazing…… My Love, Protector, Provider, Motivator & Greatest Inspiration.. You are the Joy & Peace My Heart has Never Known · May be an image of wedding.",positive,True
2026-05-22,Monica Tibbits-Nutt,Massachusetts Bay Transportation Authority,Monica,https://open.spotify.com/artist/6nzxy2wXs6tLgzEtqOkEi2,4,"She put together four straight Top Ten albums, including the chart-topping After the Storm (2003), and each one involved established and emergent Georgians as ...",neutral,False
2026-05-22,Monica Tibbits-Nutt,Massachusetts Bay Transportation Authority,Monica.com,https://www.monica.com/,5,"MONICA is a Grammy Award-winning Multi-platinum Artist, 25-million-plusselling singer, actress, philanthropist and entrepreneur.",neutral,False
2026-05-22,Monica Tibbits-Nutt,Massachusetts Bay Transportation Authority,Monica,https://music.apple.com/us/artist/monica/334240,6,"Like her peers Brandy and Aaliyah, Monica (born Monica Denise Arnold in 1980) was a former choir kid who blossomed into a bona fide R&B teen queen.",neutral,False
