date,ceo,company,title,url,position,snippet,sentiment,controlled
2026-04-08,Monica Tibbits-Nutt,Boston T,Monica Tibbits-Nutt,https://www.massport.com/our-business/leadership/monica-tibbits-nutt,1,"Monica G. Tibbits-Nutt, is the Secretary and CEO of the Massachusetts Department of Transportation (MassDOT).",positive,True
2026-04-08,Monica Tibbits-Nutt,Boston T,Tibbits-Nutt is out as transportation secretary. T chief Eng ...,https://www.wbur.org/news/2025/10/16/tibbits-nutt-transportation-secretary-massachusetts-eng,2,"... Monica Tibbits-Nutt overseeing the state's transit agency. In a press release, Healey said Tibbits-Nutt ""has made the decision to step down ...",neutral,False
2026-04-08,Monica Tibbits-Nutt,Boston T,Disgraced former Transportation Secretary Monica Tibbits ...,https://www.bostonherald.com/2026/01/07/disgraced-former-transportation-secretary-monica-tibbits-nutt-officially-off-state-payroll/,3,Former Transportation Secretary Monica Tibbits-Nutt is officially off the state employee payroll after resigning in disgrace in October and ...,negative,False
2026-04-08,Monica Tibbits-Nutt,Boston T,Transportation Sec. Monica Tibbits-Nutt Stepping Down ...,https://mass.streetsblog.org/2025/10/16/rearranging-the-cabinet-transportation-sec-monica-tibbits-nutt-stepping-down-replaced-by-mbta-gm-phillip-eng,4,Secretary of Transportation Monica Tibbits-Nutt is leaving the Healey administration. Governor Maura Healey announced this morning in a ...,neutral,False
2026-04-08,Monica Tibbits-Nutt,Boston T,"Today, Massachusetts bids farewell to Secretary Monica ...",https://www.facebook.com/massfiscal/posts/-today-massachusetts-bids-farewell-to-secretary-monica-tibbets-nutt-a-true-champ/1236041415229861/,5,"Today, Massachusetts bids farewell to Secretary Monica Tibbets-Nutt, a true champion of making life harder for everyone and leaving ...",positive,True
2026-04-08,Monica Tibbits-Nutt,Boston T,"MassDOT secretary Tibbits-Nutt steps down, MBTA chief ...",https://www.reddit.com/r/boston/comments/1o876bw/massdot_secretary_tibbitsnutt_steps_down_mbta/,6,"Massachusetts Department of Transportation secretary Monica Tibbits-Nutt will step down from her position, Governor Maura Healey announced ...",neutral,False
2026-04-08,Monica Tibbits-Nutt,Boston T,Tibbits-Nutt out at MassDOT; T's Eng takes over,https://www.axios.com/local/boston/2025/10/16/tibbits-nutt-out-at-massdot-ts-eng-takes-over,7,Monica Tibbits-Nutt's time as Gov. Maura Healey's MassDOT secretary is over and the governor is putting the MBTA's Phil Eng in charge of the ...,neutral,False
2026-04-08,Monica Tibbits-Nutt,Boston T,Monica Tibbits-Nutt parting ways with Massachusetts ...,https://www.wcvb.com/article/monica-tibbits-nutt-parting-ways-with-massachusetts-department-of-transportation/69054926,8,Maura Healey said Tibbits-Nutt made the decision to step down from her positions as secretary of the Department of Transportation and CEO of ...,neutral,False
2026-04-08,Monica Tibbits-Nutt,Boston T,MassFiscal Responds to Departure of Transportation ...,https://www.massfiscal.org/massfiscal-responds-departure-monica-tibbits-nutt,9,Tibbits-Nutt Exit is “Long Overdue”. The Massachusetts Fiscal Alliance today responded to news that Secretary of Transportation Monica ...,neutral,False
2026-04-08,Randy Clarke,DC Metro,Randy Clarke,https://en.wikipedia.org/wiki/Randy_Clarke,1,Randy Clarke (born 1977) is a Canadian-American transit executive who has served as the general manager and CEO of Washington Metropolitan Area Transit ...,neutral,False
2026-04-08,Randy Clarke,DC Metro,Leadership,https://www.wmata.com/about/leadership/,2,Randy Clarke joined the Washington Metropolitan Area Transit Authority (WMATA) as General Manager and CEO in July 2022. He's not just Metro's GM/CEO; ...,positive,True
2026-04-08,Randy Clarke,DC Metro,Randy Clarke (@wmataGM) / Posts / X,https://x.com/wmataGM,3,"Randy Clarke (@wmataGM) - Posts - Proudly leading the @wmata team (America's Metro System) as General Manager & CEO. Also on IG, in.",positive,True
2026-04-08,Randy Clarke,DC Metro,Randy Clarke (@wmatagm),https://www.instagram.com/wmatagm/,4,Completed the 2nd Annual @metroforward MetroTransitPD Recruit General Manager run on the National Mall. These recruits graduate this month joining our great ...,positive,True
2026-04-08,Randy Clarke,DC Metro,Randy Clarke - Washington Metropolitan Area Transit ...,https://www.linkedin.com/in/randy-clarke-74bb8a69,5,Experience: Washington Metropolitan Area Transit Authority (WMATA) · Education: University of Southern Maine · Location: United States · 500+ connections on ...,positive,True
2026-04-08,Randy Clarke,DC Metro,Here's a wild idea: Randy Clarke for D.C. mayor,https://www.axios.com/local/washington-dc/2025/10/30/randy-clarke-metro-dc-mayor-muriel-bowser-election,6,Randy Clarke fixed Metro. Maybe he can fix D.C. next? Why it matters: We need someone to run for mayor! email (opens in new window).,neutral,False
2026-04-08,Randy Clarke,DC Metro,WMATA GM Randy Clarke says any major future ...,https://www.reddit.com/r/washingtondc/comments/1pnm53u/wmata_gm_randy_clarke_says_any_major_future/,7,"WMATA GM Randy Clarke says any major future expansions of Metro probably won't look like the Metro of today, specifically mentions light metro ...",neutral,False
2026-04-08,Randy Clarke,DC Metro,DC's Metro Made a Comeback. Meet the Man Behind It.,https://washingtonian.com/2024/11/14/dcs-metro-made-a-comeback-meet-the-man-behind-it/,8,"Better service. Happier riders. Under Randy Clarke, Metro has bounced back from a pandemic slump—winning him plaudits and fans.",neutral,False
2026-04-08,Randy Clarke,DC Metro,"2023 Message from Randy Clarke, General Manager and ...",https://www.wmata.com/about/leadership/2023-Message.cfm,9,"2023 Message from Randy Clarke, General Manager and Chief Executive Officer. As we set our intentions for this new year, Metro closed the book on 2022 with ...",positive,True
2026-04-08,Janno Lieber,MTA,Janno Lieber,https://www.mta.info/transparency/leadership/executive-leadership/janno-lieber,1,John (“Janno”) Lieber was confirmed as Chair and CEO of the Metropolitan Transportation Authority (MTA) in January 2022.,positive,True
2026-04-08,Janno Lieber,MTA,Janno Lieber,https://en.wikipedia.org/wiki/Janno_Lieber,2,"John Nathan ""Janno"" Lieber (born September 19, 1961) is the head of the Metropolitan Transportation Authority (MTA) in New York.",neutral,False
2026-04-08,Janno Lieber,MTA,Janno Lieber - Metropolitan Transportation Authority,https://www.linkedin.com/in/janno-lieber-32b487158,3,"An accomplished executive working at the intersection of government, real estate and law.… · Experience: Metropolitan Transportation Authority · Education: ...",positive,True
2026-04-08,Janno Lieber,MTA,Statement from MTA Chair and CEO Janno Lieber on,https://www.mta.info/press-release/statement-mta-chair-and-ceo-janno-lieber-opinion-and-order-us-district-judge-lewis-j,4,"“We've said it all along, and Judge Liman's clear, detailed ruling leaves no doubt: congestion pricing is legal. It's here to stay. And it works ...",positive,True
2026-04-08,Janno Lieber,MTA,"Janno Lieber on Free Buses, the State of the MTA, & The ...",https://nyeditorialboard.substack.com/p/janno-lieber-on-free-buses-the-state,5,"Janno Lieber, Chair and CEO of the Metropolitan Transportation Authority (MTA), which runs the New York City subways and buses, ...",positive,False
2026-04-08,Janno Lieber,MTA,INTERVIEW: MTA Chair Janno Lieber Talks to Streetsblog ...,https://nyc.streetsblog.org/2026/01/21/interview-mta-chair-janno-lieber-talks-to-streetsblog-to-mark-four-years-at-the-top,6,"On Tuesday, Janno Lieber started his fifth year as the MTA's permanent Chairman and CEO — the longest stretch that a single person has held the ...",neutral,False
2026-04-08,Janno Lieber,MTA,MTA Executive Leadership,https://www.mta.info/transparency/leadership/executive-leadership,7,"MTA Executive Leadership. Janno Lieber. Chair and CEO · Bill Amarosa Jr. Executive Vice President, Subways · Quemuel Arroyo. Chief Accessibility Officer.",positive,True
2026-04-08,Janno Lieber,MTA,What's your thoughts and opinions on MTA CEO Janno ...,https://www.reddit.com/r/nycrail/comments/1qninf7/whats_your_thoughts_and_opinions_on_mta_ceo_janno/,8,Janno is the most competent leader the MTA has had in generations. He truly cares about the system and regularly rides it (which a surprising ...,neutral,False
2026-04-08,Janno Lieber,MTA,"Janno Lieber, Chair & CEO of the Metropolitan ...",https://skyscraper.org/featured/2025/,9,"Lieber has tackled and delivered many of the city's most complex transit projects - from 2017 as head of MTA Construction & Development agency, and since 2021 ...",neutral,False
2026-04-08,Nora Leerhsen,The L,Statement from CTA Acting President Nora Leerhsen,https://www.transitchicago.com/statement-from-cta-acting-president-nora-leerhsen/,1,"As a result of this bill, CTA will be fully funded. This funding means that there will be no layoffs or service cuts. With these funds, we will ...",positive,True
2026-04-08,Nora Leerhsen,The L,Nora Leerhsen,https://en.wikipedia.org/wiki/Nora_Leerhsen,2,"Nora Leerhsen is an American lawyer and executive who has served as the Acting President of the Chicago Transit Authority (CTA) since February 2025, replacing ...",neutral,False
2026-04-08,Nora Leerhsen,The L,A Conversation with Nora Leerhsen,https://transitunplugged.com/transit-unplugged-podcast/the-unmatched-power-of-transit-a-conversation-with-nora-leerhsen/,3,"A lawyer and former educator who rose through the ranks from compliance officer to chief of staff and now acting president, Nora shares her deep ...",neutral,False
2026-04-08,Nora Leerhsen,The L,CTA Governance/Administration,https://www.transitchicago.com/governance/,4,"Nora Leerhsen is the acting president of the Chicago Transit Authority (CTA), one of the nation's largest public transit agencies, providing approximately one ...",positive,True
2026-04-08,Nora Leerhsen,The L,Nora Leerhsen - Chicago Transit Authority,https://www.linkedin.com/in/nora-leerhsen-1ba38847,5,Experience: Chicago Transit Authority · Education: University of Wisconsin Law School · Location: Greater Chicago Area · 500+ connections on LinkedIn.,positive,True
2026-04-08,Nora Leerhsen,The L,Nora Leerhsen - Moving Experiences: Stories of the CTA,https://www.linkedin.com/posts/nora-leerhsen-1ba38847_moving-experiences-stories-of-the-cta-activity-7402114371671252992-pFWv,6,Any chance you'd want to interview the couple who got married on the CTA? We are coming up on our 10 year anniversary in October and thinking of ...,positive,True
2026-04-08,Nora Leerhsen,The L,"A message from CTA Acting President Nora Leerhsen: ""No ...",https://www.instagram.com/p/DQptDYpjJEh/,7,"1270 likes, 35 comments - chicagocta on November 4, 2025: ""A message from CTA Acting President Nora Leerhsen: ""No service cuts. No layoffs.",positive,True
2026-04-08,Nora Leerhsen,The L,Nora Leerhsen sat down with the Tribune after one year ...,https://www.facebook.com/chicagotribune/posts/nora-leerhsen-sat-down-with-the-tribune-after-one-year-on-the-job-as-acting-cta-/939183345131136/,8,Nora Leerhsen sat down with the Tribune after one year on the job as acting CTA president. Acting CTA chief lays out priorities after dodging ...,positive,True
2026-04-08,Randy Clarke,Metrorail,Randy Clarke,https://en.wikipedia.org/wiki/Randy_Clarke,1,Randy Clarke (born 1977) is a Canadian-American transit executive who has served as the general manager and CEO of Washington Metropolitan Area Transit ...,neutral,False
2026-04-08,Randy Clarke,Metrorail,Leadership,https://www.wmata.com/about/leadership/,2,Randy Clarke joined the Washington Metropolitan Area Transit Authority (WMATA) as General Manager and CEO in July 2022. He's not just Metro's GM/CEO; ...,positive,True
2026-04-08,Randy Clarke,Metrorail,Randy Clarke (@wmatagm),https://www.instagram.com/wmatagm/,3,2.8K+ followers · 10 following · 65 posts · @wmatagm: “Chief transit customer advocate @metroforward”,positive,True
2026-04-08,Randy Clarke,Metrorail,Randy Clarke - Washington Metropolitan Area Transit ...,https://www.linkedin.com/in/randy-clarke-74bb8a69,4,Experience: Washington Metropolitan Area Transit Authority (WMATA) · Education: University of Southern Maine · Location: United States · 500+ connections on ...,positive,True
2026-04-08,Randy Clarke,Metrorail,Randy Clarke - GovTech,https://www.govtech.com/top-25/randy-clarke,5,"Clarke is a veteran of helming massive urban transit systems. He previously served as transit chief for Capital Metro in Austin, Texas.",neutral,False
2026-04-08,Randy Clarke,Metrorail,WMATA GM Randy Clarke says any major future ...,https://www.reddit.com/r/WMATA/comments/1pnm30z/wmata_gm_randy_clarke_says_any_major_future/,6,"WMATA GM Randy Clarke says any major future expansions of Metro probably won't look like the Metro of today, specifically mentions light metro ...",neutral,False
2026-04-08,Randy Clarke,Metrorail,The legend of Randy Clarke grows: Winners and losers ...,https://www.axios.com/local/washington-dc/2026/01/29/randy-clarke-metro-dc-snow-plow-muriel-bowser,7,"Randy Clarke, the general manager of Metro, won D.C.'s snow day. Why it matters: Snow is a stress test for city leadership, and Metro shined ...",neutral,False
2026-04-08,Randy Clarke,Metrorail,Randy Clarke (@wmataGM) / Posts / X,https://x.com/wmataGM,8,"Randy Clarke (@wmataGM) - Posts - Proudly leading the @wmata team (America's Metro System) as General Manager & CEO. Also on IG, in.",positive,True
2026-04-08,Phillip Eng,Boston T,Phillip Eng | People,https://www.mbta.com/people/phillip-eng,1,Phillip Eng is the General Manager and CEO of the Massachusetts Bay Transportation Authority (MBTA). A Civil Engineer with nearly 40 years of transportation ...,positive,True
2026-04-08,Phillip Eng,Boston T,Phillip Eng,https://en.wikipedia.org/wiki/Phillip_Eng,2,Phillip Eng (born 1961 or 1962) is an American civil engineer and transit executive serving as interim secretary of Massachusetts Department of ...,neutral,False
2026-04-08,Phillip Eng,Boston T,Did Phillip Eng fix the MBTA? Reliability and passenger ...,https://www.cbsnews.com/boston/news/mbta-general-manager-phillip-eng/,3,"I'll take it!'"" Eng said. Phillip Eng MBTA General Manager Phillip Eng on the Orange Line. CBS Boston.",neutral,False
2026-04-08,Phillip Eng,Boston T,Governor Healey Appoints MBTA General Manager Phil ...,https://www.mass.gov/news/governor-healey-appoints-mbta-general-manager-phil-eng-as-interim-transportation-secretary,4,Highway Administrator Jonathan Gulliver promoted to Undersecretary of Transportation; Interim Secretary and GM Eng to hold media ...,neutral,False
2026-04-08,Phillip Eng,Boston T,"Phillip Eng - Transportation Services, Operations, ...",https://www.linkedin.com/in/phillip-eng-875928240,5,"Transportation Services, Operations, Engineering and Infrastructure · Experience: MassDOT and MBTA · Education: The Cooper Union for the Advancement of ...",positive,True
2026-04-08,Phillip Eng,Boston T,To a T: How Phillip Eng got Boston's subway system back ...,https://www.csmonitor.com/Business/2025/1115/boston-mbta-phillip-eng,6,Many now see America's oldest subway system as a model for repairing the country's crumbling transportation infrastructure – a huge ...,neutral,False
2026-04-08,Phillip Eng,Boston T,The MBTA has made incredible strides. Did Phillip Eng fix ...,https://www.reddit.com/r/mbta/comments/1pokx9x/the_mbta_has_made_incredible_strides_did_phillip/,7,"165 votes, 33 comments. Eng is great. He's done tremendous things. I don't think his influence can be overstated.",neutral,False
2026-04-08,Phillip Eng,Boston T,Phil Eng earns rave reviews for simultaneous MBTA ...,https://commonwealthbeacon.org/transportation/interim-or-indefinite-no-end-in-sight-to-phil-engs-double-duty/,8,The Healey administration seems content to have Phil Eng continue to work as both T general manager and interim transportation secretary for ...,neutral,False
2026-04-08,Phillip Eng,Boston T,"MBTA GM Phillip Eng on aging infrastructure, upgrade ...",https://www.nbcboston.com/news/local/mbta-phil-eng-upgrades-funding-fares/3890340/,9,"MBTA General Manager Phillip Eng sat down with NBC10 Boston to discuss much-needed upgrades on the T, plans for the World Cup this summer, ...",neutral,False
2026-04-08,Nora Leerhsen,Chicago Transit Authority,Nora Leerhsen - Chicago Transit Authority,https://www.linkedin.com/in/nora-leerhsen-1ba38847,1,Experience: Chicago Transit Authority · Education: University of Wisconsin Law School · Location: Greater Chicago Area · 500+ connections on LinkedIn.,positive,True
2026-04-08,Nora Leerhsen,Chicago Transit Authority,Nora Leerhsen,https://en.wikipedia.org/wiki/Nora_Leerhsen,2,"Nora Leerhsen is an American lawyer and executive who has served as the Acting President of the Chicago Transit Authority (CTA) since February 2025, replacing ...",neutral,False
2026-04-08,Nora Leerhsen,Chicago Transit Authority,Team | Chicago Transit Authority,https://www.ctabonds.com/chicago-transit-authority-il/about/our-team/i6552,3,"nleerhsen@transitchicago.com. Nora Leerhsen is acting president of the Chicago Transit Authority (CTA), one of the nation's largest public transit agencies ...",positive,True
2026-04-08,Nora Leerhsen,Chicago Transit Authority,CTA Governance/Administration,https://www.transitchicago.com/governance/,4,"Nora Leerhsen is the acting president of the Chicago Transit Authority (CTA), one of the nation's largest public transit agencies, providing approximately one ...",positive,True
2026-04-08,Nora Leerhsen,Chicago Transit Authority,Acting CTA chief lays out priorities after dodging fiscal cliff,https://www.chicagotribune.com/2026/02/02/acting-cta-chief-lays-out-priorities-after-dodging-fiscal-cliff/,5,"When she was named acting president of the Chicago Transit Authority, Nora Leerhsen made a call to the agency's first female train operator.",neutral,False
2026-04-08,Nora Leerhsen,Chicago Transit Authority,Chicago Transit Authority welcomes new acting president,https://govmarketnews.com/chicago-transit-authority-welcomes-new-acting-president/,6,"Leerhsen is the first woman to lead the authority in its 77-year history. She has been with the CTA since 2014, most recently as chief of staff.",positive,False
2026-04-08,Nora Leerhsen,Chicago Transit Authority,A Conversation with Nora Leerhsen,https://transitunplugged.com/transit-unplugged-podcast/the-unmatched-power-of-transit-a-conversation-with-nora-leerhsen/,7,"A lawyer and former educator who rose through the ranks from compliance officer to chief of staff and now acting president, Nora shares her deep ...",neutral,False
2026-04-08,Monica Tibbits-Nutt,Massachusetts Bay Transportation Authority,Monica Tibbits-Nutt,https://www.massport.com/our-business/leadership/monica-tibbits-nutt,1,"Monica G. Tibbits-Nutt, is the Secretary and CEO of the Massachusetts Department of Transportation (MassDOT).",positive,True
2026-04-08,Monica Tibbits-Nutt,Massachusetts Bay Transportation Authority,Governor Healey Appoints MBTA General Manager Phil ...,https://www.mass.gov/news/governor-healey-appoints-mbta-general-manager-phil-eng-as-interim-transportation-secretary,2,... Bay Transportation Authority (MBTA) General Manager Phillip Eng as Interim Transportation Secretary. Monica Tibbits-Nutt has made the ...,neutral,False
2026-04-08,Monica Tibbits-Nutt,Massachusetts Bay Transportation Authority,Transportation Sec. Monica Tibbits-Nutt Stepping Down ...,https://mass.streetsblog.org/2025/10/16/rearranging-the-cabinet-transportation-sec-monica-tibbits-nutt-stepping-down-replaced-by-mbta-gm-phillip-eng,3,Secretary of Transportation Monica Tibbits-Nutt is leaving the Healey administration. Governor Maura Healey announced this morning in a ...,neutral,False
2026-04-08,Monica Tibbits-Nutt,Massachusetts Bay Transportation Authority,Monica Tibbits-Nutt parting ways with Massachusetts ...,https://www.wcvb.com/article/monica-tibbits-nutt-parting-ways-with-massachusetts-department-of-transportation/69054926,4,Maura Healey said Tibbits-Nutt made the decision to step down from her positions as secretary of the Department of Transportation and CEO of ...,neutral,False
2026-04-08,Monica Tibbits-Nutt,Massachusetts Bay Transportation Authority,Howie Carr: Monica Tibbits-Nutt didn't leave much of a ...,https://www.bostonherald.com/2025/10/18/howie-carr-monica-tibbits-nutt-didnt-leave-much-of-a-legacy-for-massdot/,5,"Gov. Maura Healey doesn't feel much like a nut. In fact, it appears she's allergic to at least one, namely, Monica Tibbits-Nutt, ...",neutral,False
2026-04-08,Monica Tibbits-Nutt,Massachusetts Bay Transportation Authority,MassFiscal Responds to Departure of Transportation ...,https://www.massfiscal.org/massfiscal-responds-departure-monica-tibbits-nutt,6,Tibbits-Nutt Exit is “Long Overdue”. The Massachusetts Fiscal Alliance today responded to news that Secretary of Transportation Monica ...,neutral,False
2026-04-08,Monica Tibbits-Nutt,Massachusetts Bay Transportation Authority,Tibbits-Nutt is out as transportation secretary. T chief Eng ...,https://www.wbur.org/news/2025/10/16/tibbits-nutt-transportation-secretary-massachusetts-eng,7,"... Monica Tibbits-Nutt overseeing the state's transit agency. In a press release, Healey said Tibbits-Nutt ""has made the decision to step down ...",neutral,False
2026-04-08,Monica Tibbits-Nutt,Massachusetts Bay Transportation Authority,Former state Transportation Secretary Monica Tibbits-Nutt ...,https://www.instagram.com/p/DTQXY_FDubj/,8,... Transportation Secretary Monica Tibbits-Nutt is officially off the Massachusetts employee payroll after resigning in disgrace back in,positive,True
2026-04-08,Monica Tibbits-Nutt,Massachusetts Bay Transportation Authority,MassFiscal has been calling for Monica Tibbits-Nutt's ...,https://www.facebook.com/massfiscal/posts/massfiscal-has-been-calling-for-monica-tibbits-nutts-resignation-since-her-first/1235922248575111/,9,MassFiscal has been calling for Monica Tibbits-Nutt's resignation since her first scandal in 2024. Today's news is a step toward restoring.,positive,True
2026-04-08,Ryan Coholan,Boston T,Ryan Coholan - MBTA,https://www.linkedin.com/in/ryan-coholan-139014ab,1,Experienced Chief Operating Officer with a demonstrated history of working in the… · Experience: MBTA · Education: Cornell University · Location: United ...,positive,True
2026-04-08,Ryan Coholan,Boston T,MBTA COO drives commuter rail train from Boston to Fall ...,https://www.heraldnews.com/picture-gallery/news/2026/03/24/mbta-coo-ryan-coholan-talks-south-coast-rail-from-boston-to-fall-river/89294351007/,2,"MBTA Chief Operating Officer Ryan Coholan operates a commuter rail train outside South Station, Boston, on March 10, 2026. Dan Medeiros.",neutral,False
2026-04-08,Ryan Coholan,Boston T,"Today, COO Ryan Coholan joined State Senator ...",https://www.instagram.com/p/DPWzqsCEoZw/,3,"Today, COO Ryan Coholan joined State Senator @barryfinegoldma ... MBTA a reliable public transportation system for the people of Boston.",positive,True
2026-04-08,Ryan Coholan,Boston T,Cultivating Culture at the MBTA with COO Ryan Coholan,https://www.youtube.com/watch?v=TeJpfw-wfCA,4,"On this episode, Chief Operating Officer Ryan Coholan joins us to discuss his unique approach to leading Operations at the MBTA.",neutral,False
2026-04-08,Ryan Coholan,Boston T,Ryan Coholan - Massachusetts Bay Transportation Authority ...,https://cthrupayroll.mass.gov/?os=shmmfp&ref=app#!/year/2024/full_time_employees%2Cothers/pay1%2Cpay2%2Cpay3%2Cpay4/explore%2F0-0-0%2Ftrans_no%2F17915261%2F0%2Fdepartment_division,5,Ryan Coholan - Massachusetts Bay Transportation Authority (MBT) - Chief Operating Officer Massachusetts Bay Transportation Authority (MBT).,positive,False
2026-04-08,Ryan Coholan,Boston T,Ryan Coholan - Chief Operating Officer at Massachusetts ...,https://www.zoominfo.com/p/Ryan-Coholan/11957181347,6,"Coholan is a Chief Operating Officer at Massachusetts Bay Transportation Authority. Coholan directs, plans, and supervises operations for a significant commuter ...",neutral,False
2026-04-08,Ryan Coholan,Boston T,To put the blames on the Operators is not acceptable #GLX,https://www.reddit.com/r/mbta/comments/1fvz9p0/to_put_the_blames_on_the_operators_is_not/,7,"... Ryan Coholan, the MBTA's chief operating officer, said at a press conference. The MBTA never straight out said that the operator of the ...",negative,False
2026-04-08,Ryan Coholan,Massachusetts Bay Transportation Authority,Ryan Coholan - MBTA,https://www.linkedin.com/in/ryan-coholan-139014ab,1,Experienced Chief Operating Officer with a demonstrated history of working in the… · Experience: MBTA · Education: Cornell University · Location: United ...,positive,True
2026-04-08,Ryan Coholan,Massachusetts Bay Transportation Authority,Ryan Coholan - Massachusetts Bay Transportation Authority ...,https://cthrupayroll.mass.gov/?os=shmmfp&ref=app#!/year/2024/full_time_employees%2Cothers/pay1%2Cpay2%2Cpay3%2Cpay4/explore%2F0-0-0%2Ftrans_no%2F17915261%2F0%2Fdepartment_division,2,"Pay Check · Coholan · Ryan · MBTA Exec Main Fund · $299,084.71 · $299,084.71 $299,084.71. « ‹ 1; ›; ». Payroll Details. Total Pay. $ 299,085. Base Pay. $299,085.",positive,False
2026-04-08,Ryan Coholan,Massachusetts Bay Transportation Authority,MBTA COO drives commuter rail train from Boston to Fall ...,https://www.heraldnews.com/picture-gallery/news/2026/03/24/mbta-coo-ryan-coholan-talks-south-coast-rail-from-boston-to-fall-river/89294351007/,3,"MBTA Chief Operating Officer Ryan Coholan and a Keolis employee walk past a commuter rail train at South Station, Boston, on March 10, 2026.",neutral,False
