date,ceo,company,title,url,position,snippet,sentiment,controlled
2026-05-25,Monica Tibbits-Nutt,Boston T,Monica Tibbits-Nutt,https://www.massport.com/our-business/leadership/monica-tibbits-nutt,1,"Monica G. Tibbits-Nutt, is the Secretary and CEO of the Massachusetts Department of Transportation (MassDOT).",positive,True
2026-05-25,Monica Tibbits-Nutt,Boston T,Governor Healey Appoints Monica Tibbits-Nutt as ...,https://www.mass.gov/news/governor-healey-appoints-monica-tibbits-nutt-as-secretary-of-transportation,2,Governor Maura T. Healey today announced that she is appointing Monica Tibbits-Nutt as Secretary of the Massachusetts Department of Transportation (MassDOT) ...,neutral,False
2026-05-25,Monica Tibbits-Nutt,Boston T,Transportation Sec. Monica Tibbits-Nutt Stepping Down ...,https://mass.streetsblog.org/2025/10/16/rearranging-the-cabinet-transportation-sec-monica-tibbits-nutt-stepping-down-replaced-by-mbta-gm-phillip-eng,3,Secretary of Transportation Monica Tibbits-Nutt is leaving the Healey administration. Governor Maura Healey announced this morning in a ...,neutral,False
2026-05-25,Monica Tibbits-Nutt,Boston T,"Monica Tibbits-Nutt, FAICP, LEED AP BD C",https://www.linkedin.com/in/monica-tibbits-nutt,4,"Monica Tibbits-Nutt, FAICP, LEED AP BD C. Transportation Executive | Growth & Sales Leader | Strategic Client Advisor | Rail, Transit & Infrastructure. Jacobs ...",positive,True
2026-05-25,Monica Tibbits-Nutt,Boston T,Disgraced former Transportation Secretary Monica Tibbits ...,https://www.bostonherald.com/2026/01/07/disgraced-former-transportation-secretary-monica-tibbits-nutt-officially-off-state-payroll/,5,Former Transportation Secretary Monica Tibbits-Nutt is officially off the state employee payroll after resigning in disgrace in October and ...,negative,False
2026-05-25,Monica Tibbits-Nutt,Boston T,A Conversation with MassDOT Secretary Monica Tibbits ...,https://members.naiopma.org/event-calendar/Details/a-conversation-with-massdot-secretary-monica-tibbits-nutt-and-mbta-general-manager-phillip-eng-1055406?sourceTypeId=EmailInvitation,6,Join NAIOP for an exciting conversation with Massachusetts Secretary of Transportation Monica Tibbits-Nutt and Massachusetts Bay Transit Authority General ...,neutral,False
2026-05-25,Monica Tibbits-Nutt,Boston T,"MassDOT secretary Tibbits-Nutt steps down, MBTA chief ...",https://www.reddit.com/r/boston/comments/1o876bw/massdot_secretary_tibbitsnutt_steps_down_mbta/,7,"MassDOT secretary Tibbits-Nutt steps down, MBTA chief Eng announced as interim replacement ... Archived post. New comments cannot be posted and ...",neutral,False
2026-05-25,Monica Tibbits-Nutt,Boston T,"Monica Tibbits-Nutt made history as the first Queer, Black ...",https://www.linkedin.com/posts/lauren-melendez-53690475_monica-tibbits-nutt-made-history-as-the-first-activity-7301335136107720704-9AIP,8,"Monica Tibbits-Nutt made history as the first Queer, Black woman to be named Secretary of Transportation for the Commonwealth.",positive,True
2026-05-25,Monica Tibbits-Nutt,Boston T,Tibbits-Nutt is out as transportation secretary. T chief Eng ...,https://www.wbur.org/news/2025/10/16/tibbits-nutt-transportation-secretary-massachusetts-eng,9,"Tibbits-Nutt's departure has been rumored in recent months, and her public profile has been lower than at the start of her appointment.",neutral,False
2026-05-25,Monica Tibbits-Nutt,Massachusetts Bay Transportation Authority,Monica (singer),https://en.wikipedia.org/wiki/Monica_(singer),1,"Monica Denise Arnold (formerly Brown; born October 24, 1980), best known mononymously as Monica, is an American singer, songwriter, and actress.",neutral,False
2026-05-25,Monica Tibbits-Nutt,Massachusetts Bay Transportation Authority,MONICA (@monicadenise) • Instagram photos and videos,https://www.instagram.com/monicadenise/?hl=en,2,Learning to Live in the Moment & Make Time has been one of life's greatest Lesson ♥️ LOVE YOUR FAMILY ….. That includes the one you created.,positive,True
2026-05-25,Monica Tibbits-Nutt,Massachusetts Bay Transportation Authority,Monica,https://www.facebook.com/monica/,3,Monica. 7464981 likes · 40995 talking about this. https://linktr.ee/MonicaOfficial.,positive,True
2026-05-25,Monica Tibbits-Nutt,Massachusetts Bay Transportation Authority,Monica,https://open.spotify.com/artist/6nzxy2wXs6tLgzEtqOkEi2,4,"She put together four straight Top Ten albums, including the chart-topping After the Storm (2003), and each one involved established and emergent Georgians as ...",neutral,False
2026-05-25,Monica Tibbits-Nutt,Massachusetts Bay Transportation Authority,Monica.com,https://www.monica.com/,5,"MONICA is a Grammy Award-winning Multi-platinum Artist, 25-million-plusselling singer, actress, philanthropist and entrepreneur.",neutral,False
2026-05-25,Monica Tibbits-Nutt,Massachusetts Bay Transportation Authority,monicaofficial,https://www.youtube.com/@Monica,6,"Monica Host VH1 True-Crime Series 'Infamy' When Fame Turns Deadly. Monica hosts a series exploring the dark side of the American Dream, chronicling untold ...",neutral,False
2026-05-25,Monica Tibbits-Nutt,Massachusetts Bay Transportation Authority,MONICA Definition & Meaning,https://www.dictionary.com/browse/monica,7,MONICA definition: a female given name. See examples of Monica used in a sentence.,neutral,False
2026-05-25,Monica Tibbits-Nutt,Massachusetts Bay Transportation Authority,Monica,https://music.apple.com/us/artist/monica/334240,8,"Like her peers Brandy and Aaliyah, Monica (born Monica Denise Arnold in 1980) was a former choir kid who blossomed into a bona fide R&B teen queen.",neutral,False
2026-05-25,Monica Tibbits-Nutt,Massachusetts Bay Transportation Authority,Monica (2022),https://www.imdb.com/title/tt6337816/,9,"When Monica (Trace Lysette), a transgender woman kicked out by her family as an adolescent, leaves her Midwestern home and heads to California to start a new ...",neutral,False
2026-05-25,Phillip Eng,MBTA,Phillip Eng,https://en.wikipedia.org/wiki/Phillip_Eng,1,Phillip Eng (born 1961 or 1962) is an American civil engineer and transit executive serving as interim secretary of Massachusetts Department of ...,neutral,False
2026-05-25,Phillip Eng,MBTA,Phillip Eng | People,https://www.mbta.com/people/phillip-eng,2,Phillip Eng is the General Manager and CEO of the Massachusetts Bay Transportation Authority (MBTA). A Civil Engineer with nearly 40 years of transportation ...,positive,True
2026-05-25,Phillip Eng,MBTA,Governor Healey Appoints MBTA General Manager Phil ...,https://www.mass.gov/news/governor-healey-appoints-mbta-general-manager-phil-eng-as-interim-transportation-secretary,3,Highway Administrator Jonathan Gulliver promoted to Undersecretary of Transportation; Interim Secretary and GM Eng to hold media ...,neutral,False
2026-05-25,Phillip Eng,MBTA,MBTA's Phillip Eng Named Interim MassDOT Secretary,https://aashtojournal.transportation.org/mbtas-phillip-eng-named-interim-massdot-secretary/,4,Massachusetts Governor Maura Healey (D) has appointed Phillip Eng (above at left) – general manager of the Massachusetts Bay Transportation ...,neutral,False
2026-05-25,Phillip Eng,MBTA,"Phillip Eng - Transportation Services, Operations, ...",https://www.linkedin.com/in/phillip-eng-875928240,5,"Transportation Services, Operations, Engineering and Infrastructure · Experience: MassDOT and MBTA · Education: The Cooper Union for the Advancement of ...",positive,True
2026-05-25,Phillip Eng,MBTA,The MBTA has made incredible strides. Did Phillip Eng fix ...,https://www.reddit.com/r/mbta/comments/1pokx9x/the_mbta_has_made_incredible_strides_did_phillip/,6,"165 votes, 33 comments. Eng is great. He's done tremendous things. I don't think his influence can be overstated.",neutral,False
2026-05-25,Phillip Eng,MBTA,Phil Eng earns rave reviews for simultaneous MBTA ...,https://commonwealthbeacon.org/transportation/interim-or-indefinite-no-end-in-sight-to-phil-engs-double-duty/,7,The Healey administration seems content to have Phil Eng continue to work as both T general manager and interim transportation secretary for ...,neutral,False
2026-05-25,Phillip Eng,MBTA,Phillip Eng,https://www.massport.com/our-business/leadership/phillip-eng,8,Phillip Eng leads Massachusetts' transportation network as Interim Secretary of Transportation and General Manager of the MBTA.,positive,True
2026-05-25,Phillip Eng,MBTA,Did Phillip Eng fix the MBTA? Reliability and passenger ...,https://www.cbsnews.com/boston/news/mbta-general-manager-phillip-eng/,9,"I'll take it!'"" Eng said. Phillip Eng MBTA General Manager Phillip Eng on the Orange Line. CBS Boston.",neutral,False
2026-05-25,Randy Clarke,DC Metro,RANDY Definition & Meaning,https://www.merriam-webster.com/dictionary/randy,1,"1. chiefly Scotland : having a coarse manner 2. lustful, lecherous randiness noun randy 2 of 2 noun plural randies chiefly Scotland : a scolding or dissolute ...",neutral,False
2026-05-25,Randy Clarke,DC Metro,Randy,https://open.spotify.com/artist/1Qote9MpqMZluWzYGifZUg,2,Listen to Randy on Spotify. Artist · 1.7M monthly listeners.,neutral,False
2026-05-25,Randy Clarke,DC Metro,Randy,https://en.wikipedia.org/wiki/Randy,3,"Randy is a primarily masculine given name. It is popular in the United States and Canada. It was originally derived from the names Randall, Randolph, and ...",neutral,False
2026-05-25,Randy Clarke,DC Metro,randy,https://en.wiktionary.org/wiki/randy,4,"Noun · An impudent beggar. · A boisterous, coarse, loose woman. · A virago. Translations.",neutral,False
2026-05-25,Randy Clarke,DC Metro,RANDY definition in American English,https://www.collinsdictionary.com/us/dictionary/english/randy,5,randy in American English · 1. sexually aroused; lustful; lecherous · 2. chiefly Scot. rude and aggressive. noun · 3. chiefly Scot. a rude or coarse beggar.,neutral,False
2026-05-25,Randy Clarke,DC Metro,Randy - song and lyrics by Justice,https://open.spotify.com/track/5cOKKOFgMhjZaOT5qvnagi,6,"Recommended releases. Audio, Video, Disco. Album • 2011 · Helix. EP • 2013 · Randy (Radio Edit). Single • 2016 · Genie (feat. Mayer Hawthorne).",positive,False
2026-05-25,Randy Clarke,DC Metro,Randy : r/JusticeMusic,https://www.reddit.com/r/JusticeMusic/comments/1bmg7pa/randy/,7,Randy. Discussion. Is the best song Justice has ever composed. Tell me why I'm right. Or change my mind. Upvote 17. Downvote 26 Go to comments,neutral,False
2026-05-25,Randy Clarke,DC Metro,Randy (@randy) • Instagram photos and videos,https://www.instagram.com/randy/,8,"Genuine, generous. It's hard to describe how amazing of a human @guyfieri is! Genuine, generous and caring are my 3 words that best fit.",positive,True
2026-05-25,Nora Leerhsen,Chicago Transit Authority,"Nora Leerhsen - Acting President, Chicago Transit Authority",https://www.linkedin.com/in/nora-leerhsen-1ba38847,1,"Acting President, Chicago Transit Authority · Experience: Chicago Transit Authority · Education: University of Wisconsin Law School · Location: Greater ...",positive,True
2026-05-25,Nora Leerhsen,Chicago Transit Authority,CTA Governance/Administration,https://www.transitchicago.com/governance/,2,"Nora Leerhsen is the acting president of the Chicago Transit Authority (CTA), one of the nation's largest public transit agencies, providing approximately one ...",positive,True
2026-05-25,Nora Leerhsen,Chicago Transit Authority,Nora Leerhsen,https://en.wikipedia.org/wiki/Nora_Leerhsen,3,"Nora Leerhsen is an American lawyer and executive who has served as the Acting President of the Chicago Transit Authority (CTA) since February 2025, replacing ...",neutral,False
2026-05-25,Nora Leerhsen,Chicago Transit Authority,Team | Chicago Transit Authority,https://www.ctabonds.com/chicago-transit-authority-il/about/our-team/i6552,4,"nleerhsen@transitchicago.com. Nora Leerhsen is acting president of the Chicago Transit Authority (CTA), one of the nation's largest public transit agencies ...",positive,True
2026-05-25,Nora Leerhsen,Chicago Transit Authority,Acting CTA chief lays out priorities after dodging fiscal cliff,https://www.chicagotribune.com/2026/02/02/acting-cta-chief-lays-out-priorities-after-dodging-fiscal-cliff/,5,"When she was named acting president of the Chicago Transit Authority, Nora Leerhsen made a call to the agency's first female train operator.",neutral,False
2026-05-25,Nora Leerhsen,Chicago Transit Authority,A message from CTA Acting President Nora Leerhsen: On ...,https://www.facebook.com/thecta/posts/a-message-from-cta-acting-president-nora-leerhsenon-transit-employee-appreciatio/1351237193704962/,6,"A message from CTA Acting President Nora Leerhsen: On Transit Employee Appreciation Day, I traveled throughout the system to visit the Harlem ...",positive,True
2026-05-25,Nora Leerhsen,Chicago Transit Authority,Moving Experiences podcast - News,https://www.transitchicago.com/podcast/,7,"CTA Acting President Nora Leerhsen serves as host, but occasionally, guest hosts will be welcomed to moderate special episodes. This podcast will feature CTA ...",positive,True
2026-05-25,Nora Leerhsen,Chicago Transit Authority,How do we think interim CTA president Nora Leerhsen is ...,https://www.reddit.com/r/chicago/comments/1ldou75/how_do_we_think_interim_cta_president_nora/,8,"While I know she worked under Dorval Carter, I think she has been a breath of fresh air. She is way more visible and actually seems to want to understand ...",neutral,False
2026-05-25,Randy Clarke,Washington Metropolitan Area Transit Authority,RANDY Definition & Meaning,https://www.merriam-webster.com/dictionary/randy,1,"1. chiefly Scotland : having a coarse manner 2. lustful, lecherous randiness noun randy 2 of 2 noun plural randies chiefly Scotland : a scolding or dissolute ...",neutral,False
2026-05-25,Randy Clarke,Washington Metropolitan Area Transit Authority,Randy,https://open.spotify.com/artist/1Qote9MpqMZluWzYGifZUg,2,Listen to Randy on Spotify. Artist · 1.7M monthly listeners.,neutral,False
2026-05-25,Randy Clarke,Washington Metropolitan Area Transit Authority,Randy,https://en.wikipedia.org/wiki/Randy,3,"Randy is a primarily masculine given name. It is popular in the United States and Canada. It was originally derived from the names Randall, Randolph, and ...",neutral,False
2026-05-25,Randy Clarke,Washington Metropolitan Area Transit Authority,randy,https://en.wiktionary.org/wiki/randy,4,"Noun · An impudent beggar. · A boisterous, coarse, loose woman. · A virago. Translations.",neutral,False
2026-05-25,Randy Clarke,Washington Metropolitan Area Transit Authority,RANDY Definition & Meaning,https://www.dictionary.com/browse/randy,5,RANDY definition: sexually aroused; lustful; lecherous. See examples of randy used in a sentence.,neutral,False
2026-05-25,Randy Clarke,Washington Metropolitan Area Transit Authority,Randy - song and lyrics by Justice,https://open.spotify.com/track/5cOKKOFgMhjZaOT5qvnagi,6,"Recommended releases. Audio, Video, Disco. Album • 2011 · Helix. EP • 2013 · Randy (Radio Edit). Single • 2016 · Genie (feat. Mayer Hawthorne).",positive,False
2026-05-25,Randy Clarke,Washington Metropolitan Area Transit Authority,Randy : r/JusticeMusic,https://www.reddit.com/r/JusticeMusic/comments/1bmg7pa/randy/,7,Randy. Discussion. Is the best song Justice has ever composed. Tell me why I'm right. Or change my mind. Upvote 17. Downvote 26 Go to comments,neutral,False
2026-05-25,Randy Clarke,Washington Metropolitan Area Transit Authority,RANDY | definition in the Cambridge English Dictionary,https://dictionary.cambridge.org/us/dictionary/english/randy,8,feeling a lot of sexual desire. Synonym: horny (SEXUAL) informal. Related word: randiness (Definition of randy from the Cambridge Advanced Learner's Dictionary ...,neutral,False
2026-05-25,Phillip Eng,The T,Philips - United States | Philips,https://www.usa.philips.com/?srsltid=AfmBOooajyOjcWKzQCloOddq0Sc5hqr_Vg5QDzACiVfP9sCl9dXLF0b5,1,"Learn more about Philips and how we help improve people's lives through meaningful innovation in the areas of Healthcare, Consumer Lifestyle and Lighting.",positive,False
2026-05-25,Phillip Eng,The T,"Prince Philip, Duke of Edinburgh","https://en.wikipedia.org/wiki/Prince_Philip,_Duke_of_Edinburgh",2,"Prince Philip, Duke of Edinburgh was the husband of Queen Elizabeth II and served as consort of the British monarch from her accession on 6 February 1952 ...",neutral,False
2026-05-25,Phillip Eng,The T,Phillip Phillips (@PhillipPhillips),https://www.facebook.com/PhillipPhillips/,3,MUSICIAN/BAND · 255 talking about this · New single “Homesick” out now! ⬇️ https://stem.ffm.to/homesickphillip.,positive,True
2026-05-25,Phillip Eng,The T,Phillip Phillips (@phillphill) • Instagram photos and videos,https://www.instagram.com/phillphill/?hl=en,4,"I've known @phillphill for about twelve years now. We've written countless songs together, shared endless jokes, and seen each other through some hard times and ...",positive,True
2026-05-25,Phillip Eng,The T,Phillip Phillips,https://open.spotify.com/artist/6p5JxpTc7USNnBnLzctyd4,5,"Singles and EPs · Homesick · Gone, Gone, Gone (Phillip's Version) · Home (Phillip's Version) · Dancing With Your Shadows (Demo Version) · So Will I · Before I ...",neutral,False
2026-05-25,Phillip Eng,The T,Phillip Phillips,https://www.phillipphillips.com/,6,Phillip Phillips. Open Menu Close Menu. Music · Video · Tour · Store · Phillip Phillips.,neutral,False
2026-05-25,Phillip Eng,The T,PHILLIP Definition & Meaning,https://www.dictionary.com/browse/phillip,7,"a male given name. Phillip British. / ˈfɪlɪp /. noun. Arthur. 1738–1814, English naval commander; captain general of the First Fleet, which carried ...",neutral,False
2026-05-25,Phillip Eng,The T,Phillip Phillips,https://www.youtube.com/channel/UCZYewi2Ya8JledgJImmXIWg,8,"Music videos · Phillip Phillips - Homesick · Phillip Phillips - Gone, Gone, Gone · Phillip Phillips - Home. Phillip Phillips. 99M views. 13 years ago. CC ...",neutral,False
2026-05-25,Ryan Coholan,Boston T,Ryan's World,https://www.youtube.com/channel/UChGJGhZ9SOOHvBB0Y4DOO_w,1,"Ryan loves doing lots of fun things like pretend play, science experiments, music videos, skits, challenges, DIY arts and crafts and more!",neutral,False
2026-05-25,Ryan Coholan,Boston T,Ryan Trahan,https://www.youtube.com/@ryan,2,Popular videos · I Tried Every Seat on the Most Expensive Airline · I Spent 100 Days in the Metaverse · I Spent 100 Days in Realistic Minecraft. 47M views. 4 ...,neutral,False
2026-05-25,Ryan Coholan,Boston T,Ryan's World the Movie: Titan Universe Adventure (2024),https://www.imdb.com/title/tt29898251/,3,"Ryan's twin sisters Emma and Kate get trapped in a comic book world. Ryan enters this realm to rescue them, facing adventures, battles, and mishaps.",positive,False
2026-05-25,Ryan Coholan,Boston T,Ryan's World,https://ryans.world/,4,The best in children's entertainment period · Latest Content · LegoLand · Transformers · Mattel: Jurassic World Toys · Mark Rober & Crunch Labs · The Ninja ...,neutral,False
2026-05-25,Ryan Coholan,Boston T,Ryan's World,https://en.wikipedia.org/wiki/Ryan%27s_World,5,Ryan's World (formerly Ryan ToysReview) is a YouTube channel for children featuring Ryan Kaji along with his family.,neutral,False
2026-05-25,Ryan Coholan,Boston T,Ryan's World (@ryansworld) • Instagram photos and videos,https://www.instagram.com/ryansworld/?hl=en,6,Ryan's World The Movie is out now in Theaters! #ryansworld #kidsmovies. Robert Downey Jr. posted a personalized message to Ryan Thank you RDJ! Robert ...,positive,True
2026-05-25,Ryan Coholan,Boston T,Ryan,https://music.apple.com/us/artist/ryan/1415223338,7,"Listen to music by Ryan on Apple Music. Find top songs and albums by Ryan including Trippin' On U, From Afar (feat. Ryan) and more.",neutral,False
2026-05-25,Phillip Eng,Boston T,Philips - United States | Philips,https://www.usa.philips.com/?srsltid=AfmBOopR9I2cjKjFf2kCouKSV_2iX2wxMR8KiCYMyalH7ook0iP_imIg,1,"Learn more about Philips and how we help improve people's lives through meaningful innovation in the areas of Healthcare, Consumer Lifestyle and Lighting.",positive,False
2026-05-25,Phillip Eng,Boston T,"Prince Philip, Duke of Edinburgh","https://en.wikipedia.org/wiki/Prince_Philip,_Duke_of_Edinburgh",2,"Prince Philip, Duke of Edinburgh was the husband of Queen Elizabeth II and served as consort of the British monarch from her accession on 6 February 1952 ...",neutral,False
2026-05-25,Phillip Eng,Boston T,Phillip Phillips (@PhillipPhillips),https://www.facebook.com/PhillipPhillips/,3,MUSICIAN/BAND · 255 talking about this · New single “Homesick” out now! ⬇️ https://stem.ffm.to/homesickphillip.,positive,True
2026-05-25,Phillip Eng,Boston T,Phillip Phillips (@phillphill) • Instagram photos and videos,https://www.instagram.com/phillphill/?hl=en,4,"I've known @phillphill for about twelve years now. We've written countless songs together, shared endless jokes, and seen each other through some hard times and ...",positive,True
2026-05-25,Phillip Eng,Boston T,Phillip Phillips,https://open.spotify.com/artist/6p5JxpTc7USNnBnLzctyd4,5,"Singles and EPs · Homesick · Gone, Gone, Gone (Phillip's Version) · Home (Phillip's Version) · Dancing With Your Shadows (Demo Version) · So Will I · Before I ...",neutral,False
2026-05-25,Phillip Eng,Boston T,Phillip Phillips,https://www.phillipphillips.com/,6,Phillip Phillips. Open Menu Close Menu. Music · Video · Tour · Store · Phillip Phillips.,neutral,False
2026-05-25,Phillip Eng,Boston T,Phillip Phillips,https://www.imdb.com/name/nm4922087/,7,"Phillip Phillips was born on 20 September 1990 in Albany, Georgia, USA. He is an actor, known for American Idol (2002), The Amazing Spider-Man 2 (2014) and ...",neutral,False
2026-05-25,Phillip Eng,Boston T,Phillip Phillips,https://www.youtube.com/channel/UCZYewi2Ya8JledgJImmXIWg,8,"Music Videos · Phillip Phillips - Home · Phillip Phillips - Gone, Gone, Gone · Phillip Phillips - Raging Fire. Phillip Phillips. 14M views. 12 years ago. CC ...",neutral,False
2026-05-25,Monica Tibbits-Nutt,The T,Monica (singer),https://en.wikipedia.org/wiki/Monica_(singer),1,"Monica Denise Arnold (formerly Brown; born October 24, 1980), best known mononymously as Monica, is an American singer, songwriter, and actress.",neutral,False
2026-05-25,Monica Tibbits-Nutt,The T,MONICA (@monicadenise) • Instagram photos and videos,https://www.instagram.com/monicadenise/?hl=en,2,Learning to Live in the Moment & Make Time has been one of life's greatest Lesson ♥️ LOVE YOUR FAMILY ….. That includes the one you created.,positive,True
2026-05-25,Monica Tibbits-Nutt,The T,Monica,https://www.facebook.com/monica/,3,Monica. 7464981 likes · 40995 talking about this. https://linktr.ee/MonicaOfficial.,positive,True
2026-05-25,Monica Tibbits-Nutt,The T,Monica,https://open.spotify.com/artist/6nzxy2wXs6tLgzEtqOkEi2,4,"She put together four straight Top Ten albums, including the chart-topping After the Storm (2003), and each one involved established and emergent Georgians as ...",neutral,False
2026-05-25,Monica Tibbits-Nutt,The T,Monica.com,https://www.monica.com/,5,"MONICA is a Grammy Award-winning Multi-platinum Artist, 25-million-plusselling singer, actress, philanthropist and entrepreneur.",neutral,False
2026-05-25,Monica Tibbits-Nutt,The T,monicaofficial,https://www.youtube.com/@Monica,6,"Monica Host VH1 True-Crime Series 'Infamy' When Fame Turns Deadly. Monica hosts a series exploring the dark side of the American Dream, chronicling untold ...",neutral,False
2026-05-25,Monica Tibbits-Nutt,The T,MONICA Definition & Meaning,https://www.dictionary.com/browse/monica,7,MONICA definition: a female given name. See examples of Monica used in a sentence.,neutral,False
2026-05-25,Monica Tibbits-Nutt,The T,Monica,https://music.apple.com/us/artist/monica/334240,8,"Like her peers Brandy and Aaliyah, Monica (born Monica Denise Arnold in 1980) was a former choir kid who blossomed into a bona fide R&B teen queen.",neutral,False
2026-05-25,Nora Leerhsen,The L,A message from CTA Acting President Nora Leerhsen: On ...,https://www.facebook.com/thecta/posts/a-message-from-cta-acting-president-nora-leerhsenon-transit-employee-appreciatio/1351237193704962/,1,"A message from CTA Acting President Nora Leerhsen: On Transit Employee Appreciation Day, I traveled throughout the system to visit the Harlem ...",positive,True
2026-05-25,Nora Leerhsen,The L,CTA Governance/Administration,https://www.transitchicago.com/governance/,2,"Nora Leerhsen is the acting president of the Chicago Transit Authority (CTA), one of the nation's largest public transit agencies, providing approximately one ...",positive,True
2026-05-25,Nora Leerhsen,The L,"Nora Leerhsen - Acting President, Chicago Transit Authority",https://www.linkedin.com/in/nora-leerhsen-1ba38847,3,"Acting President, Chicago Transit Authority · Experience: Chicago Transit Authority · Education: University of Wisconsin Law School · Location: Greater ...",positive,True
2026-05-25,Nora Leerhsen,The L,"Nora Leerhsen, Acting President, Chicago Transit Authority",https://www.cityclub-chicago.org/event/2/5742/nora-leerhsen-acting-president-chicago-transit-authority,4,"Nora Leerhsen, Acting President, Chicago Transit Authority. Thursday, Jan 22, 2026. Doors Open at 11:30 am / Event Begins at 12:00 pm ...",positive,False
2026-05-25,Nora Leerhsen,The L,Team | Chicago Transit Authority,https://www.ctabonds.com/chicago-transit-authority-il/about/our-team/i6552,5,"Nora Leerhsen is acting president of the Chicago Transit Authority (CTA), one of the nation's largest public transit agencies.",positive,True
2026-05-25,Nora Leerhsen,The L,"Earlier today, CTA Acting President Nora Leerhsen joined ...",https://www.instagram.com/p/DJVBK5XNGQN/,6,CTA Acting President Nora Leerhsen joined Chicago Police Department officers at CTA's Adams and Wabash rail station during a Safety Outreach Mission.,positive,True
