date,ceo,company,title,url,position,snippet,sentiment,controlled
2026-06-09,Nora Leerhsen,CTA,Nora Leerhsen,https://en.wikipedia.org/wiki/Nora_Leerhsen,1.0,"Nora Leerhsen is an American lawyer and executive who has served as the Acting President of the Chicago Transit Authority (CTA) since February 2025, replacing ...",neutral,False
2026-06-09,Nora Leerhsen,CTA,"Nora Leerhsen - Acting President, Chicago Transit Authority",https://www.linkedin.com/in/nora-leerhsen-1ba38847,2.0,"Acting President, Chicago Transit Authority · Experience: Chicago Transit Authority · Education: University of Wisconsin Law School · Location: Greater ...",positive,True
2026-06-09,Nora Leerhsen,CTA,CTA Governance/Administration,https://www.transitchicago.com/governance/,3.0,Nora joined the CTA in 2014 and is an 11-year public transit veteran. She is the first woman to lead the CTA in the agency's history.,positive,True
2026-06-09,Nora Leerhsen,CTA,Team | Chicago Transit Authority,https://www.ctabonds.com/chicago-transit-authority-il/about/our-team/i6552,4.0,"Nora Leerhsen is acting president of the Chicago Transit Authority (CTA), She is the first woman to lead the CTA in the agency's history. Leerhsen joined the ...",positive,True
2026-06-09,Nora Leerhsen,CTA,Opinion: Make Nora Leerhsen the permanent CTA president,https://www.chicagotribune.com/2026/05/21/opinion-nora-leerhsen-cta-president/,5.0,"Under Nora Leerhsen's leadership the CTA has shown improvements in service reliability, ridership recovery, public engagement and rider ...",neutral,False
2026-06-09,Nora Leerhsen,CTA,How do we think interim CTA president Nora Leerhsen is ...,https://www.reddit.com/r/chicago/comments/1ldou75/how_do_we_think_interim_cta_president_nora/,6.0,"While I know she worked under Dorval Carter, I think she has been a breath of fresh air. She is way more visible and actually seems to want to understand ...",neutral,False
2026-06-09,Nora Leerhsen,CTA,Acting CTA chief makes her case for keeping the ...,https://chicago.suntimes.com/city-hall/2025/07/30/interim-cta-president-nora-leerhsen-permanent-post-dorval-carter,7.0,"Leerhsen is an attorney and former public school teacher who has spent the last decade at the CTA, including a stint as Carter's chief of staff.",neutral,False
2026-06-09,Nora Leerhsen,CTA,A message from CTA Acting President Nora Leerhsen: On ...,https://www.facebook.com/thecta/posts/a-message-from-cta-acting-president-nora-leerhsenon-transit-employee-appreciatio/1351237193704962/,8.0,"Last night, CTA Acting President Nora Leerhsen visited the Forest Park Blue Line terminal to meet and thank CTA workers on the night shift and ...",positive,True
2026-06-09,Nora Leerhsen,CTA,A Conversation with Nora Leerhsen,https://transitunplugged.com/transit-unplugged-podcast/the-unmatched-power-of-transit-a-conversation-with-nora-leerhsen/,9.0,"A lawyer and former educator who rose through the ranks from compliance officer to chief of staff and now acting president, Nora shares her deep ...",neutral,False
2026-06-09,Randy Clarke,Washington Metropolitan Area Transit Authority,Leadership,https://www.wmata.com/about/leadership.html,1.0,Randy Clarke joined WMATA as General Manager and CEO in July 2022. He's not just Metro's GM/CEO; he's also a customer who uses the service every day.,positive,True
2026-06-09,Randy Clarke,Washington Metropolitan Area Transit Authority,Randy Clarke,https://en.wikipedia.org/wiki/Randy_Clarke,2.0,Randy Clarke (born 1977) is a Canadian-American transit executive who has served as the general manager and CEO of Washington Metropolitan Area Transit ...,neutral,False
2026-06-09,Randy Clarke,Washington Metropolitan Area Transit Authority,Randy Clarke (@wmataGM) / Posts / X,https://x.com/wmataGM,3.0,Proudly leading the @wmata team as General Manager &amp; CEO. the most affordable way to get around the DMV.,positive,True
2026-06-09,Randy Clarke,Washington Metropolitan Area Transit Authority,Randy Clarke - WMATA General Manager and CEO,https://www.linkedin.com/in/randy-clarke-74bb8a69,4.0,Randy Clarke WMATA General Manager and CEO Washington Metropolitan Area Transit Authority (WMATA) Jul 2022 - Present 4 years Board Member,positive,True
2026-06-09,Randy Clarke,Washington Metropolitan Area Transit Authority,Randy Clarke - GovTech,https://www.govtech.com/top-25/randy-clarke,5.0,"Randy Clarke General Manager and CEO, Washington Metropolitan Area Transit Authority. Clarke is a veteran of helming massive urban transit systems.",neutral,False
2026-06-09,Randy Clarke,Washington Metropolitan Area Transit Authority,Glad to meet with WMATA General Manager Randy Clarke ...,https://www.facebook.com/RepStenyHoyer/posts/glad-to-meet-with-wmata-general-manager-randy-clarke-and-my-fellow-members-in-th/1470441071118243/,6.0,Public New Metro General Manager and CEO Randy Clarke is taking over as leader of the Washington Metropolitan Area Transit Authority Monday.,positive,True
2026-06-09,Randy Clarke,Washington Metropolitan Area Transit Authority,A Conversation with WMATA General Manager and CEO ...,https://web.mcccmd.com/events/eventdetail.aspx?eventid=779,7.0,"Randy Clarke, General Manager and CEO of the Washington Metro Area Transit Authority (WMATA). Mr. Clarke joined WMATA in July 2022. Metro in Austin, Texas.",neutral,False
2026-06-09,Randy Clarke,Washington Metropolitan Area Transit Authority,Washington Metropolitan Area Transit Authority (Maryland entry),https://msa.maryland.gov/msa/mdmanual/38inters/html/23wta.html,8.0,"Randy Clarke, General Manager & Chief Executive Officer 300 7th St., SW, Washington, DC 20024 (202) 962-1234 (202) 637-7000 (Metro bus & rail information) (202 ...",positive,False
2026-06-09,Randy Clarke,Washington Metropolitan Area Transit Authority,Randy Clarke (@wmatagm),https://www.instagram.com/wmatagm/?hl=en,9.0,Completed the 2nd Annual @metroforward MetroTransitPD Recruit General Manager run on the National Mall. These recruits graduate this month joining our great ...,positive,True
2026-06-09,Ryan Coholan,MBTA,Ryan Coholan - Chief Operating Officer at MBTA,https://www.linkedin.com/in/ryan-coholan-139014ab,1.0,Experienced Chief Operating Officer with a demonstrated history of working in the transportation/trucking/railroad industry.,positive,True
2026-06-09,Ryan Coholan,MBTA,Ryan Coholan - Massachusetts Bay Transportation Authority ...,https://cthrupayroll.mass.gov/?os=shmmfp&ref=app#!/year/2024/full_time_employees%2Cothers/pay1%2Cpay2%2Cpay3%2Cpay4/explore%2F0-0-0%2Ftrans_no%2F17915261%2F0%2Fdepartment_division,2.0,Ryan Coholan - Massachusetts Bay Transportation Authority (MBT) - Chief Operating Officer Massachusetts Bay Transportation Authority (MBT).,positive,False
2026-06-09,Ryan Coholan,MBTA,MBTA COO drives commuter rail train from Boston to Fall ...,https://www.heraldnews.com/picture-gallery/news/2026/03/24/mbta-coo-ryan-coholan-talks-south-coast-rail-from-boston-to-fall-river/89294351007/,3.0,"MBTA Chief Operating Officer Ryan Coholan operates a commuter rail train at South Station, Boston, on March 10, 2026. Dan Medeiros.",neutral,False
2026-06-09,Ryan Coholan,MBTA,CCMRRCAM praises MBTA's Ryan Coholan for innovative ...,https://www.facebook.com/ccmrrcam/posts/when-it-comes-to-making-a-meaningful-difference-about-how-the-mbta-serves-the-ci/1285749126448679/,4.0,"When it comes to making a meaningful difference about how the MBTA serves the citizens of the Commonwealth, the CCMRRCAM would like to point out that ...",positive,True
2026-06-09,Ryan Coholan,MBTA,The MBTA Advisory Board,https://mbtaadvisoryboard.org/wp-content/uploads/2024/04/MinutesMBTAAB-12-05-23APPROVED.pdf,5.0,Coholan is responsible for the operation of all MBTA modes. He was appointed. COO by General Manager Philip Eng in September 2023. Mr. Coholan introduced his ...,positive,True
2026-06-09,Ryan Coholan,MBTA,Ryan Coholan - Chief Operating Officer at Massachusetts ...,https://www.zoominfo.com/p/Ryan-Coholan/11957181347,6.0,"Coholan is a Chief Operating Officer at Massachusetts Bay Transportation Authority. Coholan directs, plans, and supervises operations for a significant commuter ...",neutral,False
2026-06-09,Ryan Coholan,MBTA,Conversation with MBTA's COO Ryan Coholan,https://transitunplugged.com/transit-unplugged-podcast/ryan-coholan-mbta/,7.0,"Host Paul Comfort sits down with Ryan Coholan, the Chief Operating Officer of the Massachusetts Bay Transportation Authority (MBTA or The T) in Boston.",neutral,False
2026-06-09,Ryan Coholan,MBTA,"Today, COO Ryan Coholan joined State Senator ...",https://www.instagram.com/p/DPWzqsCEoZw/,8.0,"Today, COO Ryan Coholan joined State Senator @barryfinegoldma, State Representative Dave Robertson, Town of Wilmington officials, @mbta_cr, ...",positive,True
2026-06-09,Monica Tibbits-Nutt,MBTA,Monica Tibbits-Nutt,https://www.massport.com/our-business/leadership/monica-tibbits-nutt,1.0,"Monica G. Tibbits-Nutt, is the Secretary and CEO of the Massachusetts Department of Transportation (MassDOT).",positive,True
2026-06-09,Monica Tibbits-Nutt,MBTA,"Monica Tibbits-Nutt, FAICP, LEED AP BD C",https://www.linkedin.com/in/monica-tibbits-nutt,2.0,"Transportation Executive | Growth & Sales Leader | Strategic Client Advisor | Rail, Transit & Infrastructure · Transportation executive and growth leader ...",positive,True
2026-06-09,Monica Tibbits-Nutt,MBTA,Transportation Sec. Monica Tibbits-Nutt Stepping Down ...,https://mass.streetsblog.org/2025/10/16/rearranging-the-cabinet-transportation-sec-monica-tibbits-nutt-stepping-down-replaced-by-mbta-gm-phillip-eng,3.0,Secretary of Transportation Monica Tibbits-Nutt is leaving the Healey administration. Governor Maura Healey announced this morning in a ...,neutral,False
2026-06-09,Monica Tibbits-Nutt,MBTA,Monica Tibbits-Nutt Steps Down as MassDOT Secretary,https://aptapassengertransport.com/monica-tibbits-nutt-steps-down-as-massdot-secretary-phil-eng-named-interim/,4.0,Governor Maura Healey has named Massachusetts Bay Transportation Authority (MBTA) General Manager Phil Eng as Interim Transportation Secretary.,neutral,False
2026-06-09,Monica Tibbits-Nutt,MBTA,A Conversation with MassDOT Secretary Monica Tibbits ...,https://members.naiopma.org/event-calendar/Details/a-conversation-with-massdot-secretary-monica-tibbits-nutt-and-mbta-general-manager-phillip-eng-1055406?sourceTypeId=EmailInvitation,5.0,"Description. A reliable, consistent transportation system is a critical piece of Massachusetts' future success. From Boston to Springfield and beyond, ...",neutral,False
2026-06-09,Monica Tibbits-Nutt,MBTA,MassFiscal Responds to Departure of Transportation ...,https://www.massfiscal.org/massfiscal-responds-departure-monica-tibbits-nutt,6.0,Tibbits-Nutt Exit is “Long Overdue”. The Massachusetts Fiscal Alliance today responded to news that Secretary of Transportation Monica ...,neutral,False
2026-06-09,Monica Tibbits-Nutt,MBTA,"MassDOT secretary Tibbits-Nutt steps down, MBTA chief ...",https://www.reddit.com/r/boston/comments/1o876bw/massdot_secretary_tibbitsnutt_steps_down_mbta/,7.0,She lost my respect after she admitted she was driven to work every day despite living near an MBTA commuter rail because an MBTA pass “was ...,neutral,False
2026-06-09,Monica Tibbits-Nutt,MBTA,Governor Healey Appoints MBTA General Manager Phil ...,https://www.mass.gov/news/governor-healey-appoints-mbta-general-manager-phil-eng-as-interim-transportation-secretary,8.0,Highway Administrator Jonathan Gulliver promoted to Undersecretary of Transportation; Interim Secretary and GM Eng to hold media ...,neutral,False
2026-06-09,Monica Tibbits-Nutt,MBTA,Tibbits-Nutt is out as transportation secretary. T chief Eng ...,https://www.wbur.org/news/2025/10/16/tibbits-nutt-transportation-secretary-massachusetts-eng,9.0,"Gov. Maura Healey has named MBTA Chief Phil Eng interim transportation secretary, she announced Thursday, ending the embattled tenure of ...",neutral,False
2026-06-09,Janno Lieber,NYC Subway,Janno Lieber,https://en.wikipedia.org/wiki/Janno_Lieber,1.0,"John Nathan ""Janno"" Lieber (born September 19, 1961) is the head of the Metropolitan Transportation Authority (MTA) in New York.",neutral,False
2026-06-09,Janno Lieber,NYC Subway,Janno Lieber,https://www.mta.info/transparency/leadership/executive-leadership/janno-lieber,2.0,"Lieber has been serving as MTA Acting Chair and CEO since July 2021 and is the Authority's 15th Chairperson since it was founded in 1968. In this position, ...",positive,True
2026-06-09,Janno Lieber,NYC Subway,Janno Lieber - Chair & CEO at New York Metropolitan ...,https://www.linkedin.com/in/janno-lieber-32b487158,3.0,"Chair & CEO at New York Metropolitan Transportation Authority · An accomplished executive working at the intersection of government, real estate and law.",positive,True
2026-06-09,Janno Lieber,NYC Subway,"Janno Lieber on Free Buses, the State of the MTA, & The ...",https://nyeditorialboard.substack.com/p/janno-lieber-on-free-buses-the-state,4.0,"Janno Lieber, Chair and CEO of the Metropolitan Transportation Authority (MTA), which runs the New York City subways and buses, ...",positive,False
2026-06-09,Janno Lieber,NYC Subway,What's your thoughts and opinions on MTA CEO Janno ...,https://www.reddit.com/r/nycrail/comments/1qninf7/whats_your_thoughts_and_opinions_on_mta_ceo_janno/,5.0,Janno is the most competent leader the MTA has had in generations. He truly cares about the system and regularly rides it (which a surprising ...,neutral,False
2026-06-09,Janno Lieber,NYC Subway,Full interview with MTA Chair & CEO Janno Lieber | The Point ...,https://www.youtube.com/watch?v=c6dZrDMDGP8,6.0,"Janno Lieber has either the best job in the world or the worst, depending on whether the trains are running on time in New York.",neutral,False
2026-06-09,Janno Lieber,NYC Subway,Statement from MTA Chair and CEO Janno Lieber on,https://www.mta.info/press-release/statement-mta-chair-and-ceo-janno-lieber-opinion-and-order-us-district-judge-lewis-j,7.0,"“We've said it all along, and Judge Liman's clear, detailed ruling leaves no doubt: congestion pricing is legal. It's here to stay.",positive,True
2026-06-09,Janno Lieber,NYC Subway,"Today, MTA Chair and CEO Janno Lieber, MTA New York ...",https://www.facebook.com/mta/posts/today-mta-chair-and-ceo-janno-lieber-mta-new-york-city-transit-president-demetri/1295307629300719/,8.0,"Today, MTA Chair and CEO Janno Lieber, MTA New York City Transit President Demetrius Crichlow, and MTA Construction & Development President ...",positive,True
2026-06-09,Janno Lieber,OMNY,MTA chief vows fare evasion crackdown on NYC buses ...,https://gothamist.com/news/mta-chief-vows-fare-evasion-crackdown-on-nyc-buses-once-metrocard-retires,1.0,MTA Chair Janno Lieber said requiring all riders to pay with OMNY will make it easier to check who has actually paid.,neutral,False
2026-06-09,Janno Lieber,OMNY,MTA Chair Janno Lieber says the MTA will be stepping up fare ...,https://www.instagram.com/reel/DVzI3DoknWn/,2.0,"MTA Chair Janno Lieber says the MTA will be stepping up fare evasion measures for buses. According to the Citizens Budget Commission, ...",positive,True
2026-06-09,Janno Lieber,OMNY,"Janno Lieber on Free Buses, the State of the MTA, & The ...",https://nyeditorialboard.substack.com/p/janno-lieber-on-free-buses-the-state,3.0,"Janno Lieber, Chair and CEO of the Metropolitan Transportation Authority (MTA), which runs the New York City subways and buses, ...",positive,False
2026-06-09,Janno Lieber,OMNY,Janno Lieber,https://www.mta.info/transparency/leadership/executive-leadership/janno-lieber,4.0,"Lieber has been serving as MTA Acting Chair and CEO since July 2021 and is the Authority's 15th Chairperson since it was founded in 1968. In this position, ...",positive,True
2026-06-09,Janno Lieber,OMNY,Reduced Fare OMNY | MTA Chair & CEO Janno Lieber ...,https://www.flickr.com/photos/mtaphotos/54202380213/,5.0,"MTA Chair & CEO Janno Lieber announces the release of Reduced Fare OMNY cards on Friday, Dec 13, 2024 at the Stone Street Customer Service ...",neutral,False
2026-06-09,Janno Lieber,OMNY,Janno Lieber - Chair & CEO at New York Metropolitan ...,https://www.linkedin.com/in/janno-lieber-32b487158,6.0,"Chair & CEO at New York Metropolitan Transportation Authority · An accomplished executive working at the intersection of government, real estate and law.",positive,True
2026-06-09,Janno Lieber,OMNY,What's your thoughts and opinions on MTA CEO Janno ...,https://www.reddit.com/r/nycrail/comments/1qninf7/whats_your_thoughts_and_opinions_on_mta_ceo_janno/,7.0,"41 votes, 82 comments. Two things are true: Janno is the most competent leader the MTA has had in generations.",neutral,False
2026-06-09,Janno Lieber,OMNY,Fare evasion: MTA boss Lieber defends 'European' model ...,https://www.amny.com/news/fare-evasion-lieber-defends-european-model-enforcement/,8.0,MTA Chair and CEO Janno Lieber on Wednesday defended the agency's embrace of a new “European-model” of enforcement to crack down on bus fare ...,neutral,False
2026-06-09,Janno Lieber,OMNY,MTA Chair And CEO Janno Lieber Discusses Transit Service ...,https://www.youtube.com/watch?v=e1ELBnGC3Xc,9.0,TRANSIT UPDATE ❄️: Metropolitan Transportation Authority Chair and CEO Janno Lieber joins FOX Weather to discuss changes to transit services amid,neutral,False
2026-06-09,Nora Leerhsen,The L,Nora Leerhsen,https://en.wikipedia.org/wiki/Nora_Leerhsen,1.0,"Nora Leerhsen is an American lawyer and executive who has served as the Acting President of the Chicago Transit Authority (CTA) since February 2025, replacing ...",neutral,False
2026-06-09,Nora Leerhsen,The L,Team | Chicago Transit Authority,https://www.ctabonds.com/chicago-transit-authority-il/about/our-team/i6552,2.0,"Nora Leerhsen is acting president of the Chicago Transit Authority (CTA), one of the nation's largest public transit agencies.",positive,True
2026-06-09,Nora Leerhsen,The L,"Nora Leerhsen - Acting President, Chicago Transit Authority",https://www.linkedin.com/in/nora-leerhsen-1ba38847,3.0,"Acting President, Chicago Transit Authority · Experience: Chicago Transit Authority · Education: University of Wisconsin Law School · Location: Greater ...",positive,True
2026-06-09,Nora Leerhsen,The L,CTA Governance/Administration,https://www.transitchicago.com/governance/,4.0,"Nora Leerhsen is the acting president of the Chicago Transit Authority (CTA), one of the nation's largest public transit agencies, providing approximately one ...",positive,True
2026-06-09,Nora Leerhsen,The L,How do we think interim CTA president Nora Leerhsen is ...,https://www.reddit.com/r/chicago/comments/1ldou75/how_do_we_think_interim_cta_president_nora/,5.0,"While I know she worked under Dorval Carter, I think she has been a breath of fresh air. She is way more visible and actually seems to want to understand ...",neutral,False
2026-06-09,Nora Leerhsen,The L,Opinion: Make Nora Leerhsen the permanent CTA president,https://www.chicagotribune.com/2026/05/21/opinion-nora-leerhsen-cta-president/,6.0,"Under Nora Leerhsen's leadership the CTA has shown improvements in service reliability, ridership recovery, public engagement and rider ...",neutral,False
2026-06-09,Nora Leerhsen,The L,A message from CTA Acting President Nora Leerhsen: On ...,https://www.facebook.com/thecta/posts/a-message-from-cta-acting-president-nora-leerhsenon-transit-employee-appreciatio/1351237193704962/,7.0,"Happy Transit Employee Appreciation Day! Today, CTA Acting President Nora Leerhsen visited our 95th/Dan Red Line terminal, Midway Orange Line ...",positive,True
2026-06-09,Nora Leerhsen,The L,"Nora Leerhsen, Acting President, Chicago Transit Authority",https://www.cityclub-chicago.org/event/2/5742/nora-leerhsen-acting-president-chicago-transit-authority,8.0,"Nora Leerhsen, Acting President, Chicago Transit Authority. Thursday, Jan 22, 2026. Doors Open at 11:30 am / Event Begins at 12:00 pm ...",positive,False
2026-06-09,Ryan Coholan,Massachusetts Bay Transportation Authority,Ryan Coholan - Chief Operating Officer at MBTA,https://www.linkedin.com/in/ryan-coholan-139014ab,1.0,Experienced Chief Operating Officer with a demonstrated history of working in the transportation/trucking/railroad industry.,positive,True
2026-06-09,Ryan Coholan,Massachusetts Bay Transportation Authority,Ryan Coholan - Massachusetts Bay Transportation Authority ...,https://cthrupayroll.mass.gov/?os=shmmfp&ref=app#!/year/2024/full_time_employees%2Cothers/pay1%2Cpay2%2Cpay3%2Cpay4/explore%2F0-0-0%2Ftrans_no%2F17915261%2F0%2Fdepartment_division,2.0,"Ryan Coholan - Massachusetts Bay Transportation Authority (MBT) - Chief Operating Officer. Total Pay $299,085 Annual Rate $303,850 Paid Thru December 14, 2024",positive,False
2026-06-09,Ryan Coholan,Massachusetts Bay Transportation Authority,Ryan Coholan - Chief Operating Officer at Massachusetts ...,https://www.zoominfo.com/p/Ryan-Coholan/11957181347,3.0,"Coholan is a Chief Operating Officer at Massachusetts Bay Transportation Authority. Coholan directs, plans, and supervises operations for a significant commuter ...",neutral,False
2026-06-09,Ryan Coholan,Massachusetts Bay Transportation Authority,LIVE WITH RYAN COHOLAN AT THE MASSACHUSETTS ...,https://www.facebook.com/xiarhosforrep/videos/live-with-ryan-coholan-at-the-massachusetts-bay-transportation-authority-train-s/4653890141563867/,4.0,"Well, I'm Ryan Caholan. I'm the chief operating officer for the MBTA and because I believe in public transportation and serving the public good, ...",positive,True
2026-06-09,Ryan Coholan,Massachusetts Bay Transportation Authority,Conversation with MBTA's COO Ryan Coholan,https://transitunplugged.com/transit-unplugged-podcast/ryan-coholan-mbta/,5.0,"Host Paul Comfort sits down with Ryan Coholan, the Chief Operating Officer of the Massachusetts Bay Transportation Authority (MBTA or The T) in Boston.",neutral,False
2026-06-09,Ryan Coholan,Massachusetts Bay Transportation Authority,MBTA COO Ryan Coholan talks South Coast Rail from ...,https://www.heraldnews.com/picture-gallery/news/2026/03/24/mbta-coo-ryan-coholan-talks-south-coast-rail-from-boston-to-fall-river/89294351007/,6.0,"MBTA Chief Operating Officer Ryan Coholan and a Keolis employee walk past a commuter rail train at South Station, Boston, on March 10, 2026.",neutral,False
2026-06-09,Ryan Coholan,Massachusetts Bay Transportation Authority,The MBTA Advisory Board,https://mbtaadvisoryboard.org/wp-content/uploads/2024/04/MinutesMBTAAB-12-05-23APPROVED.pdf,7.0,"Ryan Coholan, the Chief Operating Officer (COO) of the MBTA to address the Board. Coholan is responsible for the operation of all MBTA modes. He was appointed ...",neutral,False
2026-06-09,Ryan Coholan,Massachusetts Bay Transportation Authority,"Today, COO Ryan Coholan joined State Senator Barry ...",https://www.facebook.com/TheMBTA/videos/north-wilmington-official-ribbon-cutting-october-3-2025/834133079271535/,8.0,"Today, COO Ryan Coholan joined State Senator Barry Finegold, MBTA Commuter Rail, and Keolis. Massachusetts Bay Transportation Authority",positive,True
2026-06-09,Ryan Coholan,Massachusetts Bay Transportation Authority,Approval – Request for Rewrite of CAP related to Finding 3 ...,https://www.transit.dot.gov/sites/fta.dot.gov/files/2023-10/Approval-Request-for-Rewrite-of-CAP-related-to-Finding-3-of-Special-Directive-22-12-Operating-Conditions-and-Policies-Procedures-and-Training.pdf,9.0,"the Massachusetts Bay Transportation Authority (MBTA) to submit a revised corrective action ... Ryan Coholan, Chief Operating Officer, MBTA. Timothy Lesniak ...",positive,False
2026-06-09,Ryan Coholan,Massachusetts Bay Transportation Authority,CCMRRCAM praises MBTA's Ryan Coholan for innovative ...,https://www.facebook.com/ccmrrcam/posts/when-it-comes-to-making-a-meaningful-difference-about-how-the-mbta-serves-the-ci/1285749126448679/,10.0,"When it comes to making a meaningful difference about how the MBTA serves the citizens of the Commonwealth, the CCMRRCAM would like to point out that ...",positive,True
2026-06-09,Phillip Eng,The T,Phillip Eng,https://en.wikipedia.org/wiki/Phillip_Eng,1.0,Phillip Eng (born 1961 or 1962) is an American civil engineer and transit executive serving as interim secretary of Massachusetts Department of ...,neutral,False
2026-06-09,Phillip Eng,The T,Phillip Eng | People,https://www.mbta.com/people/phillip-eng,2.0,Phillip Eng is the General Manager and CEO of the Massachusetts Bay Transportation Authority (MBTA). A Civil Engineer with nearly 40 years of transportation ...,positive,True
2026-06-09,Phillip Eng,The T,Did Phillip Eng fix the MBTA? Reliability and passenger ...,https://www.cbsnews.com/boston/news/mbta-general-manager-phillip-eng/,3.0,"I'll take it!'"" Eng said. Phillip Eng MBTA General Manager Phillip Eng on the Orange Line. CBS Boston.",neutral,False
2026-06-09,Phillip Eng,The T,"Phillip Eng - Transportation Services, Operations ...",https://www.linkedin.com/in/phillip-eng-875928240,4.0,"Transportation Services, Operations, Engineering and Infrastructure · Experience: MassDOT and MBTA · Education: The Cooper Union for the Advancement of ...",positive,True
2026-06-09,Phillip Eng,The T,Phil Eng earns rave reviews for simultaneous MBTA ...,https://commonwealthbeacon.org/transportation/interim-or-indefinite-no-end-in-sight-to-phil-engs-double-duty/,5.0,The Healey administration seems content to have Phil Eng continue to work as both T general manager and interim transportation secretary for ...,neutral,False
2026-06-09,Phillip Eng,The T,The MBTA has made incredible strides. Did Phillip Eng fix ...,https://www.reddit.com/r/mbta/comments/1pokx9x/the_mbta_has_made_incredible_strides_did_phillip/,6.0,"165 votes, 33 comments. Eng is great. He's done tremendous things. I don't think his influence can be overstated.",neutral,False
