date,ceo,company,title,url,position,snippet,sentiment,controlled
2026-04-03,Ryan Coholan,MBTA,Conversation with MBTA's COO Ryan Coholan,https://transitunplugged.com/transit-unplugged-podcast/ryan-coholan-mbta/,4,"Host Paul Comfort sits down with Ryan Coholan, the Chief Operating Officer of the Massachusetts Bay Transportation Authority (MBTA or The T) in Boston.",neutral,False
2026-04-03,Ryan Coholan,MBTA,The MBTA Advisory Board,https://mbtaadvisoryboard.org/wp-content/uploads/2024/04/MinutesMBTAAB-12-05-23APPROVED.pdf,5,Coholan is responsible for the operation of all MBTA modes. He was appointed. COO by General Manager Philip Eng in September 2023. Mr. Coholan introduced his ...,positive,True
2026-04-03,Ryan Coholan,MBTA,"Today, COO Ryan Coholan joined State Senator ...",https://www.instagram.com/p/DPWzqsCEoZw/,6,"Today, COO Ryan Coholan joined State Senator @barryfinegoldma, State Representative Dave Robertson, Town of Wilmington officials, ...",positive,True
2026-04-03,Ryan Coholan,MBTA,Ryan Coholan Archives,https://www.globalrailwayreview.com/content_author/ryan-coholan/,7,"Ryan Coholan, Chief Railroad Officer at the Massachusetts Bay Transportation Authority (MBTA), discusses the benefits of introducing new technologies across the ...",neutral,False
2026-04-03,Ryan Coholan,MBTA,Cultivating Culture at the MBTA with COO Ryan Coholan,https://www.youtube.com/watch?v=TeJpfw-wfCA,8,"On this episode, Chief Operating Officer Ryan Coholan joins us to discuss his unique approach to leading Operations at the MBTA.",neutral,False
2026-04-03,Monica Tibbits-Nutt,The T,Monica Tibbits-Nutt,https://www.massport.com/our-business/leadership/monica-tibbits-nutt,1,"Monica G. Tibbits-Nutt, is the Secretary and CEO of the Massachusetts Department of Transportation (MassDOT).",positive,True
2026-04-03,Monica Tibbits-Nutt,The T,Transportation Sec. Monica Tibbits-Nutt Stepping Down ...,https://mass.streetsblog.org/2025/10/16/rearranging-the-cabinet-transportation-sec-monica-tibbits-nutt-stepping-down-replaced-by-mbta-gm-phillip-eng,2,Secretary of Transportation Monica Tibbits-Nutt is leaving the Healey administration. Governor Maura Healey announced this morning in a ...,neutral,False
2026-04-03,Monica Tibbits-Nutt,The T,Disgraced former Transportation Secretary Monica Tibbits ...,https://www.bostonherald.com/2026/01/07/disgraced-former-transportation-secretary-monica-tibbits-nutt-officially-off-state-payroll/,3,Former Transportation Secretary Monica Tibbits-Nutt is officially off the state employee payroll after resigning in disgrace in October and ...,negative,False
2026-04-03,Monica Tibbits-Nutt,The T,Tibbits-Nutt is out as transportation secretary. T chief Eng ...,https://www.wbur.org/news/2025/10/16/tibbits-nutt-transportation-secretary-massachusetts-eng,4,"... Monica Tibbits-Nutt overseeing the state's transit agency. In a press release, Healey said Tibbits-Nutt ""has made the decision to step down ...",neutral,False
2026-04-03,Monica Tibbits-Nutt,The T,MassFiscal Responds to Departure of Transportation ...,https://www.massfiscal.org/massfiscal-responds-departure-monica-tibbits-nutt,5,Tibbits-Nutt Exit is “Long Overdue”. The Massachusetts Fiscal Alliance today responded to news that Secretary of Transportation Monica ...,neutral,False
2026-04-03,Monica Tibbits-Nutt,The T,Monica Tibbits-Nutt parting ways with Massachusetts ...,https://www.wcvb.com/article/monica-tibbits-nutt-parting-ways-with-massachusetts-department-of-transportation/69054926,6,Maura Healey said Tibbits-Nutt made the decision to step down from her positions as secretary of the Department of Transportation and CEO of ...,neutral,False
2026-04-03,Monica Tibbits-Nutt,The T,"Tibbits-Nutt out, Eng elevated in abrupt shakeup at MassDOT",https://commonwealthbeacon.org/transportation/tibbits-nutt-out-eng-elevated-in-abrupt-shakeup-at-massdot/,7,"Transportation Secretary Monica Tibbits-Nutt suddenly resigned Thursday, prompting the governor to ask the head of the MBTA and the state's ...",negative,False
2026-04-03,Monica Tibbits-Nutt,The T,Massachusetts Transportation Sec. Monica Tibbits-Nutt ...,https://www.cbsnews.com/boston/news/monica-tibbits-nutt-phil-eng-massdot/,8,Transportation Sec. Monica Tibbits-Nutt is out and MBTA GM Phil Eng was promoted in a MassDOT shakeup.,neutral,False
2026-04-03,Monica Tibbits-Nutt,The T,Governor Healey Appoints Monica Tibbits-Nutt as ...,https://www.mass.gov/news/governor-healey-appoints-monica-tibbits-nutt-as-secretary-of-transportation,9,Governor Maura T. Healey today announced that she is appointing Monica Tibbits-Nutt as Secretary of the Massachusetts Department of Transportation (MassDOT) ...,neutral,False
2026-04-03,Janno Lieber,OMNY,MTA boss gets the price of a MetroCard wrong while ...,https://nypost.com/2025/11/19/us-news/mta-boss-gets-the-price-of-a-metrocard-wrong-while-flippantly-touting-tap-to-ride-switchover/,1,Lieber compared the OMNY switchover to the city ditching subway tokens in the early 1990s in favor of the MetroCard — saying doing away with the ...,negative,False
2026-04-03,Janno Lieber,OMNY,TRANSCRIPT: MTA Chair and CEO Lieber Appears on,https://www.mta.info/press-release/transcript-mta-chair-and-ceo-lieber-appears-point-marcia-kramer-0,2,"MTA Chair and CEO Janno Lieber: Hey, listen, I'm not a magician, but ... Let me tell you, the pre-tax benefit is now applicable on OMNY.",positive,True
2026-04-03,Janno Lieber,OMNY,"Janno Lieber on Free Buses, the State of the MTA, & The ...",https://nyeditorialboard.substack.com/p/janno-lieber-on-free-buses-the-state,3,"Janno Lieber, Chair and CEO of the Metropolitan Transportation Authority (MTA), which runs the New York City subways and buses, ...",positive,False
2026-04-03,Janno Lieber,OMNY,Fare evasion: MTA boss Lieber rules out all-door bus ...,https://www.amny.com/news/fare-evasion-bus-boarding-european-model-lieber/,4,MTA Chair and CEO Janno Lieber said the agency will not roll out all-door boarding until after it implements “European style” fare enforcement.,neutral,False
2026-04-03,Janno Lieber,OMNY,What's your thoughts and opinions on MTA CEO Janno ...,https://www.reddit.com/r/nycrail/comments/1qninf7/whats_your_thoughts_and_opinions_on_mta_ceo_janno/,5,"40 votes, 82 comments. Two things are true: Janno is the most competent leader the MTA has had in generations.",neutral,False
2026-04-03,Janno Lieber,OMNY,The Dream of All-Door Bus Boarding is Victim to MTA's ...,https://nyc.streetsblog.org/2025/01/30/omnys-fabulous-success-means-nothing-for-all-door-bus-boarding,6,MTA Chairman and CEO Janno Lieber said on Wednesday that he still has no interest in letting customers board his buses more efficiently by using all doors.,neutral,False
2026-04-03,Janno Lieber,OMNY,Reduced Fare OMNY | MTA Chair & CEO Janno Lieber ...,https://www.flickr.com/photos/mtaphotos/54202380238/,7,"MTA Chair & CEO Janno Lieber announces the release of Reduced Fare OMNY cards on Friday, Dec 13, 2024 at the Stone Street Customer Service ...",neutral,False
2026-04-03,Janno Lieber,OMNY,MTA chief vows fare evasion crackdown on NYC buses ...,https://gothamist.com/news/mta-chief-vows-fare-evasion-crackdown-on-nyc-buses-once-metrocard-retires,8,MTA Chair Janno Lieber said requiring all riders to pay with OMNY will make it easier to check who has actually paid.,neutral,False
