date,ceo,company,title,url,position,snippet,sentiment,controlled
2026-04-03,Ryan Coholan,The T,Conversation with MBTA's COO Ryan Coholan,https://transitunplugged.com/transit-unplugged-podcast/ryan-coholan-mbta/,4,"Host Paul Comfort sits down with Ryan Coholan, the Chief Operating Officer of the Massachusetts Bay Transportation Authority (MBTA or The T) in Boston.",neutral,False
2026-04-03,Ryan Coholan,The T,Cultivating Culture at the MBTA with COO Ryan Coholan,https://www.youtube.com/watch?v=TeJpfw-wfCA,5,"On this episode, Chief Operating Officer Ryan Coholan joins us to discuss his unique approach to leading Operations at the MBTA.",neutral,False
2026-04-03,Ryan Coholan,The T,"Ryan Coholan, Chief Operations Officer for the MBTA ...",https://www.facebook.com/FRCMedia/posts/ryan-coholan-chief-operations-officer-for-the-mbta-discusses-the-success-of-the-/1359057446262721/,6,"Ryan Coholan, Chief Operations Officer for the MBTA, discusses the success of the Fall River/New Bedford commuter rail service over its first ...",positive,True
2026-04-03,Ryan Coholan,The T,"Today, COO Ryan Coholan joined State Senator ...",https://www.instagram.com/p/DPWzqsCEoZw/,7,"Today, COO Ryan Coholan joined State Senator @barryfinegoldma, State Representative Dave Robertson, Town of Wilmington officials, ...",positive,True
2026-04-03,Ryan Coholan,The T,Ryan Coholan Archives,https://www.globalrailwayreview.com/content_author/ryan-coholan/,8,"Ryan Coholan, Chief Railroad Officer at the Massachusetts Bay Transportation Authority (MBTA) ... T: +44 (0)1959 563311. F: +44 (0)1959 563123. Company ...",neutral,False
2026-04-03,Phillip Eng,Massachusetts Bay Transportation Authority,Phillip Eng | People,https://www.mbta.com/people/phillip-eng,1,Phillip Eng is the General Manager and CEO of the Massachusetts Bay Transportation Authority (MBTA). A Civil Engineer with nearly 40 years of transportation ...,positive,True
2026-04-03,Phillip Eng,Massachusetts Bay Transportation Authority,Phillip Eng,https://en.wikipedia.org/wiki/Phillip_Eng,2,Phillip Eng (born 1961 or 1962) is an American civil engineer and transit executive serving as interim secretary of Massachusetts Department of ...,neutral,False
2026-04-03,Phillip Eng,Massachusetts Bay Transportation Authority,Governor Healey Appoints MBTA General Manager Phil ...,https://www.mass.gov/news/governor-healey-appoints-mbta-general-manager-phil-eng-as-interim-transportation-secretary,3,Highway Administrator Jonathan Gulliver promoted to Undersecretary of Transportation; Interim Secretary and GM Eng to hold media ...,neutral,False
2026-04-03,Phillip Eng,Massachusetts Bay Transportation Authority,"Phillip Eng - Transportation Services, Operations, ...",https://www.linkedin.com/in/phillip-eng-875928240,4,"Transportation Services, Operations, Engineering and Infrastructure · Experience: MassDOT and MBTA · Education: The Cooper Union for the Advancement of ...",positive,True
2026-04-03,Phillip Eng,Massachusetts Bay Transportation Authority,MBTA's Phillip Eng Named Interim MassDOT Secretary,https://aashtojournal.transportation.org/mbtas-phillip-eng-named-interim-massdot-secretary/,5,Massachusetts Governor Maura Healey (D) has appointed Phillip Eng (above at left) – general manager of the Massachusetts Bay Transportation ...,neutral,False
2026-04-03,Phillip Eng,Massachusetts Bay Transportation Authority,Did Phillip Eng fix the MBTA? Reliability and passenger ...,https://www.cbsnews.com/boston/news/mbta-general-manager-phillip-eng/,6,"I'll take it!'"" Eng said. Phillip Eng MBTA General Manager Phillip Eng on the Orange Line. CBS Boston.",neutral,False
2026-04-03,Phillip Eng,Massachusetts Bay Transportation Authority,Phillip Eng,https://www.massport.com/our-business/leadership/phillip-eng,7,Phillip Eng leads Massachusetts' transportation network as Interim Secretary of Transportation and General Manager of the MBTA.,positive,True
2026-04-03,Phillip Eng,Massachusetts Bay Transportation Authority,To a T: How Phillip Eng got Boston's subway system back ...,https://www.csmonitor.com/Business/2025/1115/boston-mbta-phillip-eng,8,Many now see America's oldest subway system as a model for repairing the country's crumbling transportation infrastructure – a huge ...,neutral,False
2026-04-03,Phillip Eng,Massachusetts Bay Transportation Authority,Phil Eng earns rave reviews for simultaneous MBTA ...,https://commonwealthbeacon.org/transportation/interim-or-indefinite-no-end-in-sight-to-phil-engs-double-duty/,9,The Healey administration seems content to have Phil Eng continue to work as both T general manager and interim transportation secretary for ...,neutral,False
2026-04-03,Monica Tibbits-Nutt,Boston T,Monica Tibbits-Nutt,https://www.massport.com/our-business/leadership/monica-tibbits-nutt,1,"Monica G. Tibbits-Nutt, is the Secretary and CEO of the Massachusetts Department of Transportation (MassDOT).",positive,True
2026-04-03,Monica Tibbits-Nutt,Boston T,Tibbits-Nutt is out as transportation secretary. T chief Eng ...,https://www.wbur.org/news/2025/10/16/tibbits-nutt-transportation-secretary-massachusetts-eng,2,"... Monica Tibbits-Nutt overseeing the state's transit agency. In a press release, Healey said Tibbits-Nutt ""has made the decision to step down ...",neutral,False
2026-04-03,Monica Tibbits-Nutt,Boston T,Disgraced former Transportation Secretary Monica Tibbits ...,https://www.bostonherald.com/2026/01/07/disgraced-former-transportation-secretary-monica-tibbits-nutt-officially-off-state-payroll/,3,Former Transportation Secretary Monica Tibbits-Nutt is officially off the state employee payroll after resigning in disgrace in October and ...,negative,False
2026-04-03,Monica Tibbits-Nutt,Boston T,Governor Healey Appoints MBTA General Manager Phil ...,https://www.mass.gov/news/governor-healey-appoints-mbta-general-manager-phil-eng-as-interim-transportation-secretary,4,... (MBTA) General Manager Phillip Eng as Interim Transportation Secretary. Monica Tibbits-Nutt has made the decision to step down from her ...,neutral,False
2026-04-03,Monica Tibbits-Nutt,Boston T,Transportation Sec. Monica Tibbits-Nutt Stepping Down ...,https://mass.streetsblog.org/2025/10/16/rearranging-the-cabinet-transportation-sec-monica-tibbits-nutt-stepping-down-replaced-by-mbta-gm-phillip-eng,5,Secretary of Transportation Monica Tibbits-Nutt is leaving the Healey administration. Governor Maura Healey announced this morning in a ...,neutral,False
2026-04-03,Monica Tibbits-Nutt,Boston T,Monica Tibbits-Nutt parting ways with Massachusetts ...,https://www.wcvb.com/article/monica-tibbits-nutt-parting-ways-with-massachusetts-department-of-transportation/69054926,6,Maura Healey said Tibbits-Nutt made the decision to step down from her positions as secretary of the Department of Transportation and CEO of ...,neutral,False
2026-04-03,Monica Tibbits-Nutt,Boston T,Massachusetts Transportation Sec. Monica Tibbits-Nutt ...,https://www.cbsnews.com/boston/news/monica-tibbits-nutt-phil-eng-massdot/,7,Transportation Sec. Monica Tibbits-Nutt is out and MBTA GM Phil Eng was promoted in a MassDOT shakeup.,neutral,False
2026-04-03,Monica Tibbits-Nutt,Boston T,MassFiscal Responds to Departure of Transportation ...,https://www.massfiscal.org/massfiscal-responds-departure-monica-tibbits-nutt,8,Tibbits-Nutt Exit is “Long Overdue”. The Massachusetts Fiscal Alliance today responded to news that Secretary of Transportation Monica ...,neutral,False
2026-04-03,Monica Tibbits-Nutt,Boston T,Tibbits-Nutt out at MassDOT; T's Eng takes over,https://www.axios.com/local/boston/2025/10/16/tibbits-nutt-out-at-massdot-ts-eng-takes-over,9,Monica Tibbits-Nutt's time as Gov. Maura Healey's MassDOT secretary is over and the governor is putting the MBTA's Phil Eng in charge of the ...,neutral,False
2026-04-03,Nora Leerhsen,Chicago Transit Authority,Nora Leerhsen - Chicago Transit Authority,https://www.linkedin.com/in/nora-leerhsen-1ba38847,1,Experience: Chicago Transit Authority · Education: University of Wisconsin Law School · Location: Greater Chicago Area · 500+ connections on LinkedIn.,positive,True
2026-04-03,Nora Leerhsen,Chicago Transit Authority,Nora Leerhsen,https://en.wikipedia.org/wiki/Nora_Leerhsen,2,"Nora Leerhsen is an American lawyer and executive who has served as the Acting President of the Chicago Transit Authority (CTA) since February 2025, replacing ...",neutral,False
2026-04-03,Nora Leerhsen,Chicago Transit Authority,Team | Chicago Transit Authority,https://www.ctabonds.com/chicago-transit-authority-il/about/our-team/i6552,3,"nleerhsen@transitchicago.com. Nora Leerhsen is acting president of the Chicago Transit Authority (CTA), one of the nation's largest public transit agencies ...",positive,True
2026-04-03,Nora Leerhsen,Chicago Transit Authority,CTA Governance/Administration,https://www.transitchicago.com/governance/,4,"Nora Leerhsen is the acting president of the Chicago Transit Authority (CTA), one of the nation's largest public transit agencies, providing approximately one ...",positive,True
2026-04-03,Nora Leerhsen,Chicago Transit Authority,Statement from CTA Acting President Nora Leerhsen,https://www.transitchicago.com/statement-from-cta-acting-president-nora-leerhsen/,5,"Early this morning, the Illinois State Legislature passed a bill that provides a transformational level of funding for the Chicago Transit ...",positive,True
2026-04-03,Nora Leerhsen,Chicago Transit Authority,Acting CTA chief lays out priorities after dodging fiscal cliff,https://www.chicagotribune.com/2026/02/02/acting-cta-chief-lays-out-priorities-after-dodging-fiscal-cliff/,6,"When she was named acting president of the Chicago Transit Authority, Nora Leerhsen made a call to the agency's first female train operator.",neutral,False
2026-04-03,Nora Leerhsen,Chicago Transit Authority,A Conversation with Nora Leerhsen,https://transitunplugged.com/transit-unplugged-podcast/the-unmatched-power-of-transit-a-conversation-with-nora-leerhsen/,7,"In this Super September episode of Transit Unplugged, host Paul Comfort heads to Chicago to sit down with Nora Leerhsen, Acting President of ...",neutral,False
2026-04-03,Nora Leerhsen,Chicago Transit Authority,"On Transit Employee Appreciation Day, I traveled ...",https://www.facebook.com/thecta/posts/a-message-from-cta-acting-president-nora-leerhsenon-transit-employee-appreciatio/1351237193704962/,8,"A message from CTA Acting President Nora Leerhsen: On Transit Employee Appreciation Day, I traveled throughout the system to visit the Harlem ...",positive,True
2026-04-03,Randy Clarke,Washington Metropolitan Area Transit Authority,Leadership,https://www.wmata.com/about/leadership/,1,Randy Clarke joined the Washington Metropolitan Area Transit Authority (WMATA) as General Manager and CEO in July 2022.,positive,True
2026-04-03,Randy Clarke,Washington Metropolitan Area Transit Authority,Randy Clarke,https://en.wikipedia.org/wiki/Randy_Clarke,2,Randy Clarke (born 1977) is a Canadian-American transit executive who has served as the general manager and CEO of Washington Metropolitan Area Transit ...,neutral,False
2026-04-03,Randy Clarke,Washington Metropolitan Area Transit Authority,Randy Clarke - Washington Metropolitan Area Transit ...,https://www.linkedin.com/in/randy-clarke-74bb8a69,3,Experience: Washington Metropolitan Area Transit Authority (WMATA) · Education: University of Southern Maine · Location: United States · 500+ connections on ...,positive,True
2026-04-03,Randy Clarke,Washington Metropolitan Area Transit Authority,Randy Clarke (@wmataGM) / Posts / X,https://x.com/wmataGM,4,"Randy Clarke (@wmataGM) - Posts - Proudly leading the @wmata team (America's Metro System) as General Manager & CEO. Also on IG, in.",positive,True
2026-04-03,Randy Clarke,Washington Metropolitan Area Transit Authority,Randy Clarke (@wmatagm),https://www.instagram.com/wmatagm/,5,Completed the 2nd Annual @metroforward MetroTransitPD Recruit General Manager run on the National Mall. These recruits graduate this month joining our great ...,positive,True
2026-04-03,Randy Clarke,Washington Metropolitan Area Transit Authority,Randy Clarke,https://www.govtech.com/top-25/randy-clarke,6,"In his nearly two years on the job as general manager and CEO for the Washington Metropolitan Area Transit Authority (WMATA), Randy Clarke has been almost ...",neutral,False
2026-04-03,Randy Clarke,Washington Metropolitan Area Transit Authority,Metro Forward,https://www.facebook.com/MetroForward/posts/under-the-leadership-of-metros-general-manager-and-ceo-randy-clarke-metro-leads-/1343291801176134/,7,Randy Clarke has been on the job for just over a year now as CEO of Washington Metropolitan Area Transit Authority (WMATA) in the nation's ...,positive,True
2026-04-03,Randy Clarke,Washington Metropolitan Area Transit Authority,Washington Metropolitan Area Transit Authority (Maryland entry),https://msa.maryland.gov/msa/mdmanual/38inters/html/23wta.html,8,"D., 2025; April Rai, 2026. Randy Clarke, General Manager & Chief Executive Officer. 300 7th St., SW, Washington, DC 20024 (202) 962-1234 (202) 637-7000 (Metro ...",positive,False
2026-04-03,Randy Clarke,Washington Metropolitan Area Transit Authority,Team | WMATA Bonds | BondLink,https://www.wmatabonds.com/wmata-bonds-dc/about/our-team/i2812,9,Randy Clarke joined the Washington Metropolitan Area Transit Authority (WMATA) as General Manager and CEO in July 2022. He's not just Metro's GM/CEO; ...,positive,True
2026-04-03,Ryan Coholan,Boston T,Ryan Coholan - MBTA,https://www.linkedin.com/in/ryan-coholan-139014ab,1,Experienced Chief Operating Officer with a demonstrated history of working in the… · Experience: MBTA · Education: Cornell University · Location: United ...,positive,True
2026-04-03,Ryan Coholan,Boston T,MBTA COO drives commuter rail train from Boston to Fall ...,https://www.heraldnews.com/picture-gallery/news/2026/03/24/mbta-coo-ryan-coholan-talks-south-coast-rail-from-boston-to-fall-river/89294351007/,2,"MBTA Chief Operating Officer Ryan Coholan operates a commuter rail train outside South Station, Boston, on March 10, 2026. Dan Medeiros.",neutral,False
2026-04-03,Ryan Coholan,Boston T,Conversation with MBTA's COO Ryan Coholan,https://transitunplugged.com/transit-unplugged-podcast/ryan-coholan-mbta/,3,"With nearly 30 years of transit experience, Ryan talks about running one of America's largest transit systems and shares stories of MBTA's ...",neutral,False
2026-04-03,Ryan Coholan,Boston T,Ryan Coholan - Massachusetts Bay Transportation Authority ...,https://cthrupayroll.mass.gov/?os=shmmfp&ref=app#!/year/2024/full_time_employees%2Cothers/pay1%2Cpay2%2Cpay3%2Cpay4/explore%2F0-0-0%2Ftrans_no%2F17915261%2F0%2Fdepartment_division,4,Ryan Coholan - Massachusetts Bay Transportation Authority (MBT) - Chief Operating Officer Massachusetts Bay Transportation Authority (MBT).,positive,False
2026-04-03,Ryan Coholan,Boston T,To put the blames on the Operators is not acceptable #GLX,https://www.reddit.com/r/mbta/comments/1fvz9p0/to_put_the_blames_on_the_operators_is_not/,5,"... Ryan Coholan, the MBTA's chief operating officer, said at a press conference. The MBTA never straight out said that the operator of the ...",negative,False
2026-04-03,Ryan Coholan,Boston T,MBTA has smooth test run of event trains ahead of the ...,https://www.wbur.org/news/2026/03/27/world-cup-transit-friendly-match-test-run,6,"Speaking to WBUR on Friday from a Boston-bound Acela train, T chief operating officer Ryan Coholan said he would place the agency's ...",neutral,False
2026-04-03,Ryan Coholan,Boston T,The MBTA Advisory Board,https://mbtaadvisoryboard.org/wp-content/uploads/2024/04/MinutesMBTAAB-12-05-23APPROVED.pdf,7,"C. MBTA Chief Operating Officer Ryan Coholan: The Chair introduced Ryan. Coholan, the Chief Operating Officer (COO) of the MBTA to address the Board.",neutral,False
2026-04-03,Janno Lieber,MTA,Janno Lieber,https://www.mta.info/transparency/leadership/executive-leadership/janno-lieber,1,John (“Janno”) Lieber was confirmed as Chair and CEO of the Metropolitan Transportation Authority (MTA) in January 2022.,positive,True
2026-04-03,Janno Lieber,MTA,Janno Lieber,https://en.wikipedia.org/wiki/Janno_Lieber,2,"John Nathan ""Janno"" Lieber (born September 19, 1961) is the head of the Metropolitan Transportation Authority (MTA) in New York.",neutral,False
2026-04-03,Janno Lieber,MTA,Janno Lieber - Chair & CEO at New York Metropolitan ...,https://www.linkedin.com/in/janno-lieber-32b487158,3,"Chair & CEO at New York Metropolitan Transportation Authority · An accomplished executive working at the intersection of government, real estate and law.",positive,True
2026-04-03,Janno Lieber,MTA,Statement from MTA Chair and CEO Janno Lieber on,https://www.mta.info/press-release/statement-mta-chair-and-ceo-janno-lieber-opinion-and-order-us-district-judge-lewis-j,4,"“We've said it all along, and Judge Liman's clear, detailed ruling leaves no doubt: congestion pricing is legal. It's here to stay. And it works ...",positive,True
2026-04-03,Janno Lieber,MTA,"Janno Lieber on Free Buses, the State of the MTA, & The ...",https://nyeditorialboard.substack.com/p/janno-lieber-on-free-buses-the-state,5,"Janno Lieber, Chair and CEO of the Metropolitan Transportation Authority (MTA), which runs the New York City subways and buses, ...",positive,False
2026-04-03,Janno Lieber,MTA,What's your thoughts and opinions on MTA CEO Janno ...,https://www.reddit.com/r/nycrail/comments/1qninf7/whats_your_thoughts_and_opinions_on_mta_ceo_janno/,6,Janno is the most competent leader the MTA has had in generations. He truly cares about the system and regularly rides it (which a surprising ...,neutral,False
2026-04-03,Janno Lieber,MTA,MTA Chair Janno Lieber Talks to Streetsblog to Mark Four ...,https://nyc.streetsblog.org/2026/01/21/interview-mta-chair-janno-lieber-talks-to-streetsblog-to-mark-four-years-at-the-top,7,"On Tuesday, Janno Lieber started his fifth year as the MTA's permanent Chairman and CEO — the longest stretch that a single person has held ...",neutral,False
2026-04-03,Janno Lieber,MTA,"Today, MTA Chair and CEO Janno Lieber, MTA New York ...",https://www.facebook.com/mta/posts/today-mta-chair-and-ceo-janno-lieber-mta-new-york-city-transit-president-demetri/1295307629300719/,8,"Today, MTA Chair and CEO Janno Lieber, MTA New York City Transit President Demetrius Crichlow, and MTA Construction & Development President ...",positive,True
2026-04-03,Ryan Coholan,Massachusetts Bay Transportation Authority,Ryan Coholan - MBTA,https://www.linkedin.com/in/ryan-coholan-139014ab,1,Experienced Chief Operating Officer with a demonstrated history of working in the… · Experience: MBTA · Education: Cornell University · Location: United ...,positive,True
2026-04-03,Ryan Coholan,Massachusetts Bay Transportation Authority,Ryan Coholan - Massachusetts Bay Transportation Authority ...,https://cthrupayroll.mass.gov/?os=shmmfp&ref=app#!/year/2024/full_time_employees%2Cothers/pay1%2Cpay2%2Cpay3%2Cpay4/explore%2F0-0-0%2Ftrans_no%2F17915261%2F0%2Fdepartment_division,2,"Pay Check · Coholan · Ryan · MBTA Exec Main Fund · $299,084.71 · $299,084.71 $299,084.71. « ‹ 1; ›; ». Payroll Details. Total Pay. $ 299,085. Base Pay. $299,085.",positive,False
2026-04-03,Ryan Coholan,Massachusetts Bay Transportation Authority,Did you know? Single track operations keeps riders moving ...,https://www.facebook.com/TheMBTA/videos/single-track-operations-with-coo-ryan-coholan/907055678496912/,3,Did you know? Single track operations keeps riders moving and work progressing. Watch COO Ryan Coholan explain how trains safely navigate ...,positive,True
2026-04-03,Ryan Coholan,Massachusetts Bay Transportation Authority,Conversation with MBTA's COO Ryan Coholan,https://transitunplugged.com/transit-unplugged-podcast/ryan-coholan-mbta/,4,"Host Paul Comfort sits down with Ryan Coholan, the Chief Operating Officer of the Massachusetts Bay Transportation Authority (MBTA or The T) in Boston.",neutral,False
2026-04-03,Ryan Coholan,Massachusetts Bay Transportation Authority,MBTA COO drives commuter rail train from Boston to Fall ...,https://www.heraldnews.com/picture-gallery/news/2026/03/24/mbta-coo-ryan-coholan-talks-south-coast-rail-from-boston-to-fall-river/89294351007/,5,"MBTA Chief Operating Officer Ryan Coholan and a Keolis employee walk past a commuter rail train at South Station, Boston, on March 10, 2026.",neutral,False
2026-04-03,Ryan Coholan,Massachusetts Bay Transportation Authority,Ryan Coholan - Chief Operating Officer at Massachusetts ...,https://www.zoominfo.com/p/Ryan-Coholan/11957181347,6,"Coholan is a Chief Operating Officer at Massachusetts Bay Transportation Authority. Coholan directs, plans, and supervises operations for a significant commuter ...",neutral,False
2026-04-03,Ryan Coholan,Massachusetts Bay Transportation Authority,"Ryan Coholan, Chief Operations Officer for the MBTA ...",https://www.facebook.com/FRCMedia/videos/ryan-coholan-chief-operations-officer-for-the-mbta-discusses-the-success-of-the-/1247964494185964/,7,"Ryan Coholan, Chief Operations Officer for the MBTA, discusses the success of the Fall River/New Bedford commuter rail service over its first ...",positive,True
2026-04-03,Ryan Coholan,Massachusetts Bay Transportation Authority,Ryan Coholan Archives,https://www.globalrailwayreview.com/content_author/ryan-coholan/,8,"Ryan Coholan, Chief Railroad Officer at the Massachusetts Bay Transportation Authority (MBTA), discusses the benefits of introducing new technologies across the ...",neutral,False
2026-04-03,Ryan Coholan,Massachusetts Bay Transportation Authority,"Today, COO Ryan Coholan joined State Senator ...",https://www.instagram.com/p/DPWzqsCEoZw/,9,"Service changes are taking place in April to support the MBTA's Columbia Junction Signal Modernization, Green Line improvements, ...",positive,True
2026-04-03,Ryan Coholan,Massachusetts Bay Transportation Authority,Cultivating Culture at the MBTA with COO Ryan Coholan,https://www.youtube.com/watch?v=TeJpfw-wfCA,10,"On this episode, Chief Operating Officer Ryan Coholan joins us to discuss his unique approach to leading Operations at the MBTA.",neutral,False
2026-04-03,Janno Lieber,NYC Subway,Janno Lieber,https://www.mta.info/transparency/leadership/executive-leadership/janno-lieber,1,"Lieber has been serving as MTA Acting Chair and CEO since July 2021 and is the Authority's 15th Chairperson since it was founded in 1968. In this position, ...",positive,True
2026-04-03,Janno Lieber,NYC Subway,Janno Lieber,https://en.wikipedia.org/wiki/Janno_Lieber,2,"John Nathan ""Janno"" Lieber (born September 19, 1961) is the head of the Metropolitan Transportation Authority (MTA) in New York.",neutral,False
2026-04-03,Janno Lieber,NYC Subway,Janno Lieber - Chair & CEO at New York Metropolitan ...,https://www.linkedin.com/in/janno-lieber-32b487158,3,"Chair & CEO at New York Metropolitan Transportation Authority · An accomplished executive working at the intersection of government, real estate and law.",positive,True
2026-04-03,Janno Lieber,NYC Subway,"Janno Lieber on Free Buses, the State of the MTA, & The ...",https://nyeditorialboard.substack.com/p/janno-lieber-on-free-buses-the-state,4,"Janno Lieber, Chair and CEO of the Metropolitan Transportation Authority (MTA), which runs the New York City subways and buses, ...",positive,False
2026-04-03,Janno Lieber,NYC Subway,What's your thoughts and opinions on MTA CEO Janno ...,https://www.reddit.com/r/nycrail/comments/1qninf7/whats_your_thoughts_and_opinions_on_mta_ceo_janno/,5,Janno is the most competent leader the MTA has had in generations. He truly cares about the system and regularly rides it (which a surprising ...,neutral,False
2026-04-03,Janno Lieber,NYC Subway,MTA Chair Janno Lieber Talks to Streetsblog to Mark Four ...,https://nyc.streetsblog.org/2026/01/21/interview-mta-chair-janno-lieber-talks-to-streetsblog-to-mark-four-years-at-the-top,6,"MTA chairman Janno Lieber sat down with Streetsblog for an in-depth interview about his tenure, congestion pricing, buses and more.",neutral,False
2026-04-03,Janno Lieber,NYC Subway,Statement from MTA Chair and CEO Janno Lieber on,https://www.mta.info/press-release/statement-mta-chair-and-ceo-janno-lieber-opinion-and-order-us-district-judge-lewis-j,7,"“We've said it all along, and Judge Liman's clear, detailed ruling leaves no doubt: congestion pricing is legal. It's here to stay.",positive,True
2026-04-03,Janno Lieber,NYC Subway,MTA head Janno Lieber has a wish list for 2026. Here's his ...,https://www.cbsnews.com/newyork/news/mta-janno-lieber-nyc-bus-fares-bus-lanes-fare-evasion/,8,MTA head Janno Lieber has a wish list for 2026. Here's his plan for NYC buses and subways. By. Marcia Kramer. Marcia Kramer.,positive,False
2026-04-03,Ryan Coholan,MBTA,Ryan Coholan - MBTA,https://www.linkedin.com/in/ryan-coholan-139014ab,1,Experienced Chief Operating Officer with a demonstrated history of working in the… · Experience: MBTA · Education: Cornell University · Location: United ...,positive,True
2026-04-03,Ryan Coholan,MBTA,Ryan Coholan - Massachusetts Bay Transportation Authority ...,https://cthrupayroll.mass.gov/?os=shmmfp&ref=app#!/year/2024/full_time_employees%2Cothers/pay1%2Cpay2%2Cpay3%2Cpay4/explore%2F0-0-0%2Ftrans_no%2F17915261%2F0%2Fdepartment_division,2,Ryan Coholan - Massachusetts Bay Transportation Authority (MBT) - Chief Operating Officer Massachusetts Bay Transportation Authority (MBT).,positive,False
2026-04-03,Ryan Coholan,MBTA,MBTA COO drives commuter rail train from Boston to Fall ...,https://www.heraldnews.com/picture-gallery/news/2026/03/24/mbta-coo-ryan-coholan-talks-south-coast-rail-from-boston-to-fall-river/89294351007/,3,"MBTA Chief Operating Officer Ryan Coholan and a Keolis employee walk past a commuter rail train at South Station, Boston, on March 10, 2026.",neutral,False
