date,company,title,url,position,snippet,sentiment,controlled
2026-05-13,CTA,Chicago Transit Authority - CTA Buses & Train Service - 1-888 ...,https://www.transitchicago.com/,1,"Information about CTA bus and train service in and around Chicago. Find maps, schedules, service alerts, plan a trip, jobs, news and more!",positive,True
2026-05-13,CTA,California Teachers Association,https://www.cta.org/,2,"CTA has led the labor movement for more than 150 years, fighting for educators' rights and the rights for every public school student to have access to quality ...",positive,True
2026-05-13,CTA,Select Route,https://www.ctabustracker.com/bustime/wireless/html/home.jsp,3,1 - Bronzeville/Union Station · 2 - Hyde Park Express · 3 - King Drive · 4 - Cottage Grove · X4 - Cottage Grove Express · N5 - South Shore Night Bus · 6 - ...,positive,True
2026-05-13,CTA,Chicago Transit Authority,https://en.wikipedia.org/wiki/Chicago_Transit_Authority,4,"The Chicago Transit Authority (CTA) is a public transit agency in Chicago, Illinois, United States. It operates the Chicago ""L"" rail system and CTA bus services ...",neutral,False
2026-05-13,Metrorail,Metrorail,https://www.miamidade.gov/global/transportation/metrorail.page,1,"The Metrorail system is a 25-mile dual track that provides service to Miami International Airport (MIA) and runs from Kendall through South Miami, Coral Gables ...",neutral,False
2026-05-13,Metrorail,Metrorail,https://www.wmata.com/service/rail/,2,"Metrorail provides safe, clean, reliable transit service for more than 600,000 customers a day throughout the Washington, DC area. The system is the second ...",positive,True
2026-05-13,Metrorail,"METRORail | Red Line | Purple Line | Houston, Texas - METRO",https://www.ridemetro.org/riding-metro/transit-services/metrorail,3,"METRORail is Houston's light rail network, offering convenient access to many popular destinations in and around downtown Houston. These include the Texas ...",neutral,False
2026-05-13,Metrorail,"Metro | Bus, Rail, Subway, Bike & Micro in Los Angeles",https://www.metro.net/,4,"Explore Los Angeles by public transit. Start with Metro schedules, maps, arrival times, parking info, trip planning, stations, and fares.",neutral,False
2026-05-13,Metrorail,"Navigating Washington, DC's Metro System",https://washington.org/navigating-dc-metro,5,"The Metrorail consists of six color-coded lines: Red, Blue, Orange, Yellow, Green and Silver. The lines are connected to each other via transfer stations and ...",neutral,False
2026-05-13,Metrorail,CapMetro Rail – Capital Metro – Austin Public Transit,https://www.capmetro.org/rail,6,"A train for commuters traveling between Leander and downtown. Whether you're traveling to work or Q2 Stadium, get there quickly and comfortably.",neutral,False
2026-05-13,Metrorail,Metrorail,https://www.miamiandbeaches.com/l/transportation/metrorail/3040,7,"Metrorail is Miami's quick and easy 25-mile elevated transportation system to get you to all parts of the urban core of Miami from 5:00am to midnight, seven ...",neutral,False
2026-05-13,Metrorail,Metrorail (Miami-Dade County),https://en.wikipedia.org/wiki/Metrorail_(Miami-Dade_County),8,"Metrorail is a rapid transit system in Miami and Miami-Dade County in the U.S. state of Florida. It is operated by Miami-Dade Transit (MDT), a departmental ...",neutral,False
2026-05-13,Metrorail,WMATA: Home,https://www.wmata.com/,9,"Free, real-time bus and rail info, chat, and more. Read more · NEXT BUS · NEXT TRAIN.",positive,True
2026-05-13,The L,"Chicago ""L""",https://en.wikipedia.org/wiki/Chicago_%22L%22,1,"The ""L"" provides 24-hour service on the Red and Blue Lines, making Chicago, New York City, London and Copenhagen the only four cities in the world to offer 24- ...",neutral,False
2026-05-13,The L,How-To Guide: Riding the 'L' (Trains),https://www.transitchicago.com/howto/riding-the-train/,2,"CTA's train system is known as the 'L' (a now-official name originally short for ""elevated""). Trains serve over 140 stations located ...",positive,True
2026-05-13,The L,the L - Apps on Google Play,https://play.google.com/store/apps/details?id=com.thel.global&hl=en_US,3,"The L (formely Rela) The world's most popular diverse female community, join us with 12 million girls.",positive,True
2026-05-13,The L,Maps,https://www.transitchicago.com/maps/,4,The CTA 'L' System map shows train routes only. Online version (PNG image); Downloadable version(Opens in a new window) (PDF version). Regional maps.,positive,True
2026-05-13,The L,the L Denver | Reinventing Classics from the Ground Up,https://www.theldenver.com/,5,"We are on Broadway. We make good cocktails without the pretense & aprons. If you don't like us, we still like you. Our Menu. Your Fun.",positive,True
2026-05-13,The L,The Chicago L,https://www.architecture.org/online-resources/buildings-of-chicago/the-chicago-l,6,The Chicago L began operating in 1892. This network of elevated trains and subways is how Chicagoans get around. But it's also an iconic symbol of the city.,positive,False
2026-05-13,The L,Chicago ''L''.org - The Chicago rapid transit internet resource,https://www.chicago-l.org/,7,"Comprehensive resource for information on the Chicago rapid transit system -- the 'L' -- including history, stations, rolling stock, maps, current news, ...",neutral,False
2026-05-13,The L,L Train (14 Street-Canarsie Local) Line Map,https://www.mta.info/maps/subway-line-maps/l-line,8,"L Train (14 Street-Canarsie Local) Line Map Updated Feb 18, 2025. This shows weekday service. Listed transfers are based on the weekday schedule and may vary.",positive,True
2026-05-13,OMNY,OMNY,https://omny.info/,1,One secure account to manage your travel · Reload your OMNY card · Track progress toward your 7-day fare cap · Manage your travel cards · Contact customer ...,positive,True
2026-05-13,OMNY,Fair Fares & OMNY,https://www.nyc.gov/site/fairfares/OMNY/omny.page,2,"Yes. OMNY is the new payment method and will replace MetroCard. You will need to use OMNY to ride on NYC Transit subways and local, limited and Select Bus ...",positive,False
2026-05-13,OMNY,OMNY,https://en.wikipedia.org/wiki/OMNY,3,"OMNY (/ˈɒmni/ OM-nee, short for One Metro New York) is a contactless fare-payment system that has been implemented for use on public transit in the New York ...",neutral,False
2026-05-13,OMNY,Reduced-Fare OMNY,https://www.mta.info/fares-tolls/subway-bus/reduced-fare/omny,4,"Reduced-Fare OMNY lets you tap for half-price fares on MTA buses, subways, Staten Island Railway, Roosevelt Island Tram, and Hudson Rail Link.",positive,True
2026-05-13,OMNY,How to use OMNY to pay for the NYC subway,https://www.youtube.com/shorts/llNiacAd_Go,5,The new payment system is Omni and there are a few ways to use it. My preferred method of using Omni is to set up my phone for Smart Pay or Tap to Pay.,negative,False
2026-05-13,Chicago Transit Authority,Chicago Transit Authority - CTA Buses & Train Service - 1-888 ...,https://www.transitchicago.com/,1,"Information about CTA bus and train service in and around Chicago. Find maps, schedules, service alerts, plan a trip, jobs, news and more!",positive,True
2026-05-13,Chicago Transit Authority,Chicago Transit Authority,https://en.wikipedia.org/wiki/Chicago_Transit_Authority,2,"The Chicago Transit Authority (CTA) is a public transit agency in Chicago, Illinois, United States. It operates the Chicago ""L"" rail system and CTA bus services ...",neutral,False
2026-05-13,Chicago Transit Authority,Chicago Transit Authority (CTA) - Travel Information,https://www.chicago.gov/city/en/depts/other/provdrs/cta.html,3,The CTA operates the nation's second largest public transportation system and covers the City of Chicago and 40 surrounding suburbs.,neutral,False
2026-05-13,Chicago Transit Authority,Chicago Transit Authority (@thecta),https://www.facebook.com/thecta/,4,Chicago Transit Authority. 84635 likes · 3589 talking about this. Welcome to the official CTA Facebook page. Serving Chicago & 35 surrounding suburbs....,positive,True
2026-05-13,Chicago Transit Authority,Chicago Transit Authority (@chicagocta),https://www.instagram.com/chicagocta/,5,Official account of the Chicago Transit Authority Past & Present pics ℹ️ Info on news & updates. Follow. Message. What powers a @chicagocta train?,positive,True
2026-05-13,MTA,MTA: Home - NYC,https://www.mta.info/,1,Quick links · Get real-time alerts · Book or manage a Paratransit trip · Check elevator and escalator status · Contact Lost and Found · Sign up for our ...,positive,True
2026-05-13,MTA,Maryland Transit Administration,https://www.mta.maryland.gov/,2,"Routes & Schedules, Real Time Information, Trip Planner, Service Alerts, Website Feedback Survey, MDOT MTA In the News",positive,True
2026-05-13,MTA,Metropolitan Transportation Authority,https://en.wikipedia.org/wiki/Metropolitan_Transportation_Authority,3,The Metropolitan Transportation Authority (MTA) is a public benefit corporation in New York State responsible for public transportation in the New York City ...,neutral,False
2026-05-13,MTA,MTA (@MTA) / Posts / X,https://x.com/MTA,4,"A reminder for 7 train riders! This weekend, 7 trains aren't running between 74 St-Broadway in Queens and 34 St-Hudson Yards in Manhattan.",positive,True
2026-05-13,MTA,Massachusetts Teachers Association | Massachusetts ...,https://www.massteacher.org/,5,"MTA provides high-quality professional development and union education for members and leaders. Through in-person and online training, tools, and resources, ...",neutral,False
2026-05-13,MTA,Metropolitan Transportation Authority Careers,https://careers.mta.org/,6,"The MTA family includes professionals in a variety of positions, from bus and train operators to engineers, accountants, and policy experts.",positive,True
2026-05-13,Boston T,MBTA - Massachusetts Bay Transportation Authority,https://www.mbta.com/,1,"Public transit in the Greater Boston region. Routes, schedules, trip planner, fares, service alerts, real-time updates, and general information.",positive,True
2026-05-13,Boston T,MBTA subway,https://en.wikipedia.org/wiki/MBTA_subway,2,"The Massachusetts Bay Transportation Authority (MBTA) operates rapid transit (heavy rail), light rail, and bus rapid transit services in the Boston ...",neutral,False
2026-05-13,Boston T,Boston T Subway Map & Routing - App Store - Apple,https://apps.apple.com/us/app/boston-t-subway-map-routing/id1195886256,3,Navigate the Boston T Subway with offline maps and live departures. Plan your trip today and travel easily. Boston T Subway Map is the navigation app that ...,positive,True
2026-05-13,Boston T,"Boston Subway - The ""T"" - Boston Public Transportation",https://www.boston-discovery-guide.com/boston-subway.html,4,"Boston's subway system - locally we call it the ""T"" - is the easiest and cheapest way to get around the city, aside from walking.",neutral,False
2026-05-13,Boston T,MBTA - Massachusetts Bay Transportation Authority,https://www.mbta.com/,1,"Public transit in the Greater Boston region. Routes, schedules, trip planner, fares, service alerts, real-time updates, and general information.",positive,True
2026-05-13,Boston T,MBTA subway,https://en.wikipedia.org/wiki/MBTA_subway,2,"The Massachusetts Bay Transportation Authority (MBTA) operates rapid transit (heavy rail), light rail, and bus rapid transit services in the Boston ...",neutral,False
2026-05-13,Boston T,Boston T Subway Map & Routing - App Store - Apple,https://apps.apple.com/us/app/boston-t-subway-map-routing/id1195886256,3,Navigate the Boston T Subway with offline maps and live departures. Plan your trip today and travel easily. Boston T Subway Map is the navigation app that ...,positive,True
2026-05-13,Boston T,"Boston Subway - The ""T"" - Boston Public Transportation",https://www.boston-discovery-guide.com/boston-subway.html,4,"Boston's subway system - locally we call it the ""T"" - is the easiest and cheapest way to get around the city, aside from walking.",neutral,False
2026-05-13,Boston T,MBTA - Massachusetts Bay Transportation Authority,https://www.mbta.com/,1,"Public transit in the Greater Boston region. Routes, schedules, trip planner, fares, service alerts, real-time updates, and general information.",positive,True
2026-05-13,Boston T,MBTA subway,https://en.wikipedia.org/wiki/MBTA_subway,2,"The Massachusetts Bay Transportation Authority (MBTA) operates rapid transit (heavy rail), light rail, and bus rapid transit services in the Boston ...",neutral,False
2026-05-13,Boston T,Boston T Subway Map & Routing - App Store - Apple,https://apps.apple.com/us/app/boston-t-subway-map-routing/id1195886256,3,Navigate the Boston T Subway with offline maps and live departures. Plan your trip today and travel easily. Boston T Subway Map is the navigation app that ...,positive,True
2026-05-13,Boston T,"Boston Subway - The ""T"" - Boston Public Transportation",https://www.boston-discovery-guide.com/boston-subway.html,4,"Boston's subway system - locally we call it the ""T"" - is the easiest and cheapest way to get around the city, aside from walking.",neutral,False
2026-05-13,NYC Subway,Maps,https://www.mta.info/maps,1,Geographic subway maps. Geographic subway map. The geographic New York City subway map. This map shows typical weekday ...,positive,True
2026-05-13,NYC Subway,New York City Subway,https://en.wikipedia.org/wiki/New_York_City_Subway,2,"The New York City Subway is a rapid transit system in New York City, serving four of the city's five boroughs: Manhattan, Brooklyn, Queens, and the Bronx.",neutral,False
2026-05-13,NYC Subway,MTA: Home,https://www.mta.info/,3,"Subway; Bus; Rail. Your favorite subway, bus and rail services will appear here ... Getting to NYC-area stadiums and arenas on transit · See All. More ...",positive,True
2026-05-13,NYC Subway,nycsubway.org,https://www.nycsubway.org/,4,"Location: West Farms Sq./East Tremont Ave./177th St. Car: R-22 (St. Louis, 1957-58) 7531",positive,True
2026-05-13,NYC Subway,New York Subway MTA Map NYC - App Store,https://apps.apple.com/us/app/new-york-subway-mta-map-nyc/id369691844,5,This NYC subway map is free to download and will help you navigate around New York using the subway system.,positive,True
2026-05-13,NYC Subway,How to Use the NYC Subway - CityRover Walks NY,https://cityroverwalks.com/how-to-use-nyc-subway-guide/,6,Using this detailed subway guide for beginners you will learn how to use the NYC subway like a local! Read on to learn how to buy a MetroCard or use the new ...,neutral,False
2026-05-13,NYC Subway,New York City Subway,https://sab.org/wp-content/uploads/2020/01/Subway_Map_2018.pdf,7,"New York City Subway with bus and railroad connections. Manhattan bound. N ... The subway operates 24 hours a day, but not all lines operate at all times ...",neutral,False
2026-05-13,MBTA,MBTA - Massachusetts Bay Transportation Authority,https://www.mbta.com/,1,"Public transit in the Greater Boston region. Routes, schedules, trip planner, fares, service alerts, real-time updates, and general information.",positive,True
2026-05-13,MBTA,MBTA (@MBTA) / Posts / X,https://x.com/MBTA?lang=en,2,MBTA (@MBTA) - Posts - The official Twitter feed of the Massachusetts Bay Transportation Authority (MBTA). Check out our pa... | X (formerly Twitter),positive,True
2026-05-13,MBTA,Massachusetts Bay Transportation Authority (MBTA),https://www.mass.gov/orgs/massachusetts-bay-transportation-authority,3,"The MBTA provides subway, bus, Commuter Rail, ferry, and paratransit service to eastern Massachusetts and parts of Rhode Island.",neutral,False
2026-05-13,MBTA,MBTA Go — Official - Apps on Google Play,https://play.google.com/store/apps/details?id=com.mbta.tid.mbta_app&hl=en_US,4,"Check live arrival times, get the latest estimates of when your bus or train will get to you, track your vehicle, check how many stops away your bus or train ...",positive,True
2026-05-13,MBTA,MBTA - Massachusetts Bay Transportation Authority,https://www.mbta.com/,1,"Public transit in the Greater Boston region. Routes, schedules, trip planner, fares, service alerts, real-time updates, and general information.",positive,True
2026-05-13,MBTA,MBTA (@MBTA) / Posts / X,https://x.com/MBTA?lang=en,2,MBTA (@MBTA) - Posts - The official Twitter feed of the Massachusetts Bay Transportation Authority (MBTA). Check out our pa... | X (formerly Twitter),positive,True
2026-05-13,MBTA,Massachusetts Bay Transportation Authority (MBTA),https://www.mass.gov/orgs/massachusetts-bay-transportation-authority,3,"The MBTA provides subway, bus, Commuter Rail, ferry, and paratransit service to eastern Massachusetts and parts of Rhode Island.",neutral,False
2026-05-13,MBTA,MBTA Go — Official - Apps on Google Play,https://play.google.com/store/apps/details?id=com.mbta.tid.mbta_app&hl=en_US,4,"Check live arrival times, get the latest estimates of when your bus or train will get to you, track your vehicle, check how many stops away your bus or train ...",positive,True
2026-05-13,MBTA,MBTA - Massachusetts Bay Transportation Authority,https://www.mbta.com/,1,"Public transit in the Greater Boston region. Routes, schedules, trip planner, fares, service alerts, real-time updates, and general information.",positive,True
2026-05-13,MBTA,MBTA (@MBTA) / Posts / X,https://x.com/MBTA?lang=en,2,MBTA (@MBTA) - Posts - The official Twitter feed of the Massachusetts Bay Transportation Authority (MBTA). Check out our pa... | X (formerly Twitter),positive,True
2026-05-13,MBTA,Massachusetts Bay Transportation Authority (MBTA),https://www.mass.gov/orgs/massachusetts-bay-transportation-authority,3,"The MBTA provides subway, bus, Commuter Rail, ferry, and paratransit service to eastern Massachusetts and parts of Rhode Island.",neutral,False
2026-05-13,MBTA,MBTA Go — Official - Apps on Google Play,https://play.google.com/store/apps/details?id=com.mbta.tid.mbta_app&hl=en_US,4,"Check live arrival times, get the latest estimates of when your bus or train will get to you, track your vehicle, check how many stops away your bus or train ...",positive,True
2026-05-13,Washington Metropolitan Area Transit Authority,Washington (state),https://en.wikipedia.org/wiki/Washington_(state),1,"Washington is the 18th-largest state, with an area of 71,362 sq mi (184,830 km 2), and the 13th-most populous state, with a population of over 8 million.",neutral,False
2026-05-13,Washington Metropolitan Area Transit Authority,The Washington Post - Breaking news and latest headlines ...,https://www.washingtonpost.com/,2,"Breaking news, live coverage, investigations, analysis, video, photos and opinions from The Washington Post. Subscribe for the latest on U.S. and ...",neutral,False
2026-05-13,Washington Metropolitan Area Transit Authority,Official Tourism Site of Washington DC | Washington DC,https://washington.org/,3,"Your trusted guide to Washington, DC. From restaurant roundups and neighborhood gems to itinerary inspiration and unforgettable events — discover why there's ...",neutral,False
2026-05-13,Washington Metropolitan Area Transit Authority,"Washington, D.C.","https://en.wikipedia.org/wiki/Washington,_D.C.",4,"Washington, DC, officially the District of Columbia and commonly known as simply Washington or DC, is the capital city and federal district",neutral,False
2026-05-13,Washington Metropolitan Area Transit Authority,"Washington | State Capital, Map, History, Geography ...",https://www.britannica.com/place/Washington-state,5,"Washington, constituent state of the United States of America. Lying at the northwestern corner of the 48 conterminous states.",neutral,False
2026-05-13,Washington Metropolitan Area Transit Authority,Washington State Tourism: Visit Washington State,https://stateofwatourism.com/,6,"The official travel and tourism website for the State of Washington. Find visitor guides, travel inspiration, and planning tools for your next vacation.",neutral,False
2026-05-13,Washington Metropolitan Area Transit Authority,Washington Policy Center,https://www.washingtonpolicy.org/,7,"WPC improves lives of all Washingtonians by promoting high-quality, non-partisan, evidence-based research to advance policy solutions for a better Washington ...",neutral,False
2026-05-13,Washington Metropolitan Area Transit Authority,| WA.gov,https://wa.gov/,8,"WA.gov is the official website of Washington State, with easy access to online state services, government agencies and helpful guides to get things done. Use ...",neutral,False
2026-05-13,Washington Metropolitan Area Transit Authority,Washington Pictures and Facts,https://kids.nationalgeographic.com/geography/states/article/washington,9,"Washington is named in honor of President George Washington. It's nicknamed the Evergreen State because of its many forests, which cover over half the state.",neutral,False
2026-05-13,The T,MBTA - Massachusetts Bay Transportation Authority,https://www.mbta.com/,1,"Public transit in the Greater Boston region. Routes, schedules, trip planner, fares, service alerts, real-time updates, and general information.",positive,True
2026-05-13,The T,Massachusetts Bay Transportation Authority,https://en.wikipedia.org/wiki/Massachusetts_Bay_Transportation_Authority,2,"The Massachusetts Bay Transportation Authority (abbreviated MBTA and known colloquially as ""the T"") is the public agency responsible for operating most public ...",neutral,False
2026-05-13,The T,How to Ride the Light Rail System,https://www.rideprt.org/inside-Pittsburgh-Regional-Transit/rider-info/how-to-ride/how-to-ride-the-light-rail-system/,3,How to Ride the Light Rail System · STEP 1. FIND INFORMATION · STEP 2. PLAN YOUR TRIP · STEP 3. FIND YOUR STOP · STEP 4: LOCATE THE CORRECT PLATFORM · STEP 5: ...,neutral,False
2026-05-13,The T,Alaska Thunderfuck - The T (feat. Adore Delano) [Official],https://www.youtube.com/watch?v=9Xw5VkCpxRg,4,"Poundcake, the full length sophomore album from Alaska Thunderfuck is now available on iTunes! https://itunes.apple.c.",positive,False
2026-05-13,The T,Massachusetts Bay Transportation Authority (MBTA),https://www.mass.gov/orgs/massachusetts-bay-transportation-authority,5,"The Massachusetts Bay Transportation Authority, more commonly known as the T, is one of the oldest public transit systems in the United States.",neutral,False
2026-05-13,The T,"Boston Subway - The ""T"" - Boston Public Transportation",https://www.boston-discovery-guide.com/boston-subway.html,6,"Boston's subway system - locally we call it the ""T"" - is the easiest and cheapest way to get around the city, aside from walking.",neutral,False
2026-05-13,The T,MBTA - Massachusetts Bay Transportation Authority,https://www.mbta.com/,1,"Public transit in the Greater Boston region. Routes, schedules, trip planner, fares, service alerts, real-time updates, and general information.",positive,True
2026-05-13,The T,Massachusetts Bay Transportation Authority,https://en.wikipedia.org/wiki/Massachusetts_Bay_Transportation_Authority,2,"The Massachusetts Bay Transportation Authority (abbreviated MBTA and known colloquially as ""the T"") is the public agency responsible for operating most public ...",neutral,False
2026-05-13,The T,How to Ride the Light Rail System,https://www.rideprt.org/inside-Pittsburgh-Regional-Transit/rider-info/how-to-ride/how-to-ride-the-light-rail-system/,3,How to Ride the Light Rail System · STEP 1. FIND INFORMATION · STEP 2. PLAN YOUR TRIP · STEP 3. FIND YOUR STOP · STEP 4: LOCATE THE CORRECT PLATFORM · STEP 5: ...,neutral,False
2026-05-13,The T,Alaska Thunderfuck - The T (feat. Adore Delano) [Official],https://www.youtube.com/watch?v=9Xw5VkCpxRg,4,"Poundcake, the full length sophomore album from Alaska Thunderfuck is now available on iTunes! https://itunes.apple.c.",positive,False
2026-05-13,The T,Massachusetts Bay Transportation Authority (MBTA),https://www.mass.gov/orgs/massachusetts-bay-transportation-authority,5,"The Massachusetts Bay Transportation Authority, more commonly known as the T, is one of the oldest public transit systems in the United States.",neutral,False
2026-05-13,The T,"Boston Subway - The ""T"" - Boston Public Transportation",https://www.boston-discovery-guide.com/boston-subway.html,6,"Boston's subway system - locally we call it the ""T"" - is the easiest and cheapest way to get around the city, aside from walking.",neutral,False
2026-05-13,The T,MBTA - Massachusetts Bay Transportation Authority,https://www.mbta.com/,1,"Public transit in the Greater Boston region. Routes, schedules, trip planner, fares, service alerts, real-time updates, and general information.",positive,True
2026-05-13,The T,Massachusetts Bay Transportation Authority,https://en.wikipedia.org/wiki/Massachusetts_Bay_Transportation_Authority,2,"The Massachusetts Bay Transportation Authority (abbreviated MBTA and known colloquially as ""the T"") is the public agency responsible for operating most public ...",neutral,False
2026-05-13,The T,How to Ride the Light Rail System,https://www.rideprt.org/inside-Pittsburgh-Regional-Transit/rider-info/how-to-ride/how-to-ride-the-light-rail-system/,3,How to Ride the Light Rail System · STEP 1. FIND INFORMATION · STEP 2. PLAN YOUR TRIP · STEP 3. FIND YOUR STOP · STEP 4: LOCATE THE CORRECT PLATFORM · STEP 5: ...,neutral,False
2026-05-13,The T,Alaska Thunderfuck - The T (feat. Adore Delano) [Official],https://www.youtube.com/watch?v=9Xw5VkCpxRg,4,"Poundcake, the full length sophomore album from Alaska Thunderfuck is now available on iTunes! https://itunes.apple.c.",positive,False
2026-05-13,The T,Massachusetts Bay Transportation Authority (MBTA),https://www.mass.gov/orgs/massachusetts-bay-transportation-authority,5,"The Massachusetts Bay Transportation Authority, more commonly known as the T, is one of the oldest public transit systems in the United States.",neutral,False
