date,ceo,company,title,url,position,snippet,sentiment,controlled
2026-07-07,Nora Leerhsen,The L,Nora Leerhsen,https://en.wikipedia.org/wiki/Nora_Leerhsen,1.0,"Nora Leerhsen is an American lawyer and executive who has served as the Acting President of the Chicago Transit Authority (CTA) since February 2025, replacing ...",neutral,False
2026-07-07,Nora Leerhsen,The L,Team | Chicago Transit Authority,https://www.ctabonds.com/chicago-transit-authority-il/about/our-team/i6552,2.0,"Nora Leerhsen is acting president of the Chicago Transit Authority (CTA), one of the nation's largest public transit agencies.",positive,True
2026-07-07,Nora Leerhsen,The L,"Nora Leerhsen - Acting President, Chicago Transit Authority",https://www.linkedin.com/in/nora-leerhsen-1ba38847,3.0,"Acting President, Chicago Transit Authority · Experience: Chicago Transit Authority · Education: University of Wisconsin Law School · Location: Greater ...",positive,True
2026-07-07,Nora Leerhsen,The L,CTA Governance/Administration,https://www.transitchicago.com/governance/,4.0,"Nora Leerhsen is the acting president of the Chicago Transit Authority (CTA), one of the nation's largest public transit agencies, providing approximately one ...",positive,True
2026-07-07,Nora Leerhsen,The L,"Union criticizes CTA for ""leadership vacuum"" due to lack of ...",https://chi.streetsblog.org/2026/06/10/union-criticizes-cta-for-leadership-vacuum-due-to-lack-of-a-permanent-president-acting-president-leerhsen-touts-public-safety-progress,5.0,"Leerhsen took the placeholder position in February 2025, so she has been on the job for almost 1.5 years. During the June 10 meeting of the CTA ...",negative,False
2026-07-07,Nora Leerhsen,The L,What would you say to the CTA President Nora Leerhsen?,https://www.reddit.com/r/cta/comments/1thoza8/what_would_you_say_to_the_cta_president_nora/,6.0,I work near the CTA headquarters and often run into CTA President Nora Leerhsen on the sidewalk or getting off the train. I usually say hello and yesterday ...,neutral,False
2026-07-07,Nora Leerhsen,The L,"Meet CTA's Acting President, Nora Leerhsen ...",https://www.facebook.com/thecta/posts/meet-ctas-acting-president-nora-leerhsen-acting-president-leerhsen-a-10-year-tra/1017363227092362/,7.0,"Meet CTA’s Acting President, Nora Leerhsen! Acting President Leerhsen, a 10-year transit veteran, is the first woman to lead the organization. ...",positive,True
2026-07-07,Nora Leerhsen,The L,Opinion: Make Nora Leerhsen the permanent CTA president,https://www.chicagotribune.com/2026/05/21/opinion-nora-leerhsen-cta-president/,8.0,"Under Nora Leerhsen's leadership the CTA has shown improvements in service reliability, ridership recovery, public engagement and rider ...",neutral,False
2026-07-07,Nora Leerhsen,The L,"Meet CTA's Acting President, Nora Leerhsen ...",https://www.instagram.com/p/DFn5eJFTiIU/,9.0,"Acting President Leerhsen, a 10-year transit veteran, is the first woman to lead the organization. This morning's commute brought her to the Green Line.",positive,True
2026-07-07,Ryan Coholan,The T,Ryan Coholan - Chief Operating Officer at MBTA,https://www.linkedin.com/in/ryan-coholan-139014ab,1.0,Experienced Chief Operating Officer with a demonstrated history of working in the transportation/trucking/railroad industry.,positive,True
2026-07-07,Ryan Coholan,The T,Ryan Coholan | CTHRU - Statewide Payroll - Mass.gov,https://cthrupayroll.mass.gov/?os=shmmfp&ref=app#!/year/2024/full_time_employees%2Cothers/pay1%2Cpay2%2Cpay3%2Cpay4/explore%2F0-0-0%2Ftrans_no%2F17915261%2F0%2Fdepartment_division,2.0,Ryan Coholan - Massachusetts Bay Transportation Authority (MBT) - Chief Operating Officer Massachusetts Bay Transportation Authority (MBT).,neutral,False
2026-07-07,Ryan Coholan,The T,MBTA COO Ryan Coholan talks South Coast Rail from ...,https://www.heraldnews.com/picture-gallery/news/2026/03/24/mbta-coo-ryan-coholan-talks-south-coast-rail-from-boston-to-fall-river/89294351007/,3.0,"MBTA Chief Operating Officer Ryan Coholan operates a commuter rail train at South Station, Boston, on March 10, 2026. Dan Medeiros.",neutral,False
2026-07-07,Ryan Coholan,The T,Ryan Coholan - Chief Operating Officer at Massachusetts ...,https://www.zoominfo.com/p/Ryan-Coholan/11957181347,4.0,"Coholan is a Chief Operating Officer at Massachusetts Bay Transportation Authority. Coholan directs, plans, and supervises operations for a significant commuter ...",neutral,False
2026-07-07,Ryan Coholan,The T,Conversation with MBTA's COO Ryan Coholan,https://transitunplugged.com/transit-unplugged-podcast/ryan-coholan-mbta/,5.0,"Host Paul Comfort sits down with Ryan Coholan, the Chief Operating Officer of the Massachusetts Bay Transportation Authority (MBTA or The T) in Boston.",neutral,False
2026-07-07,Ryan Coholan,The T,Cultivating Culture at the MBTA with COO Ryan Coholan,https://soundcloud.com/spilling-the-t-podcast/cultivating-culture-at-the-mbta-with-coo-ryan-coholan,6.0,"On this episode, Chief Operating Officer Ryan Coholan joins us to discuss his unique approach to leading Operations at the MBTA.",neutral,False
2026-07-07,Ryan Coholan,The T,The MBTA Advisory Board,https://mbtaadvisoryboard.org/wp-content/uploads/2024/04/MinutesMBTAAB-12-05-23APPROVED.pdf,7.0,Coholan is responsible for the operation of all MBTA modes. He was appointed. COO by General Manager Philip Eng in September 2023. Mr. Coholan introduced his ...,neutral,False
2026-07-07,Ryan Coholan,The T,Cultivating Culture at the MBTA with COO Ryan Coholan,https://www.youtube.com/watch?v=TeJpfw-wfCA,8.0,"On this episode, Chief Operating Officer Ryan Coholan joins us to discuss his unique approach to leading Operations at the MBTA.",neutral,False
2026-07-07,Janno Lieber,MTA,Janno Lieber,https://en.wikipedia.org/wiki/Janno_Lieber,1.0,"John Nathan ""Janno"" Lieber (born September 19, 1961) is the head of the Metropolitan Transportation Authority (MTA) in New York.",neutral,False
2026-07-07,Janno Lieber,MTA,Janno Lieber,https://www.mta.info/transparency/leadership/executive-leadership/janno-lieber,2.0,John (“Janno”) Lieber was confirmed as Chair and CEO of the Metropolitan Transportation Authority (MTA) in January 2022.,positive,True
2026-07-07,Janno Lieber,MTA,Janno Lieber - Chair & CEO at New York Metropolitan ...,https://www.linkedin.com/in/janno-lieber-32b487158,3.0,"Chair & CEO at New York Metropolitan Transportation Authority · An accomplished executive working at the intersection of government, real estate and law.",positive,True
2026-07-07,Janno Lieber,MTA,"Janno Lieber on Free Buses, the State of the MTA, & The ...",https://nyeditorialboard.substack.com/p/janno-lieber-on-free-buses-the-state,4.0,"Janno Lieber, Chair and CEO of the Metropolitan Transportation Authority (MTA), which runs the New York City subways and buses, ...",positive,False
2026-07-07,Janno Lieber,MTA,Opinions on MTA CEO Janno Lieber,https://www.reddit.com/r/nycrail/comments/1qninf7/whats_your_thoughts_and_opinions_on_mta_ceo_janno/,5.0,Janno is the most competent leader the MTA has had in generations. He truly cares about the system and regularly rides it (which a surprising ...,neutral,False
2026-07-07,Janno Lieber,MTA,"Janno Lieber, Chair & CEO of the Metropolitan ...",https://skyscraper.org/featured/2025/,6.0,"Lieber has tackled and delivered many of the city's most complex transit projects - from 2017 as head of MTA Construction & Development agency, and since 2021 ...",neutral,False
2026-07-07,Janno Lieber,MTA,INTERVIEW: MTA Chair Janno Lieber Talks to ...,https://nyc.streetsblog.org/2026/01/21/interview-mta-chair-janno-lieber-talks-to-streetsblog-to-mark-four-years-at-the-top,7.0,"The MTA chairman talked with Streetsblog about his tenure, congestion pricing, bus stops, Babe Ruth and more. Photo of Dave Colon.",neutral,False
2026-07-07,Janno Lieber,MTA,Conversation with the MTA Chair & CEO Janno Lieber,https://cbcny.org/media/conversation-mta-chair-ceo-janno-lieber,8.0,"Janno Lieber was confirmed as Chair and CEO of the Metropolitan Transportation Authority (MTA) in January 2022, following his nomination to that position by ...",neutral,False
2026-07-07,Ryan Coholan,MBTA,Ryan Coholan - Chief Operating Officer at MBTA,https://www.linkedin.com/in/ryan-coholan-139014ab,1.0,Experienced Chief Operating Officer with a demonstrated history of working in the transportation/trucking/railroad industry.,positive,True
2026-07-07,Ryan Coholan,MBTA,Ryan Coholan | CTHRU - Statewide Payroll - Mass.gov,https://cthrupayroll.mass.gov/?os=shmmfp&ref=app#!/year/2024/full_time_employees%2Cothers/pay1%2Cpay2%2Cpay3%2Cpay4/explore%2F0-0-0%2Ftrans_no%2F17915261%2F0%2Fdepartment_division,2.0,Ryan Coholan - Massachusetts Bay Transportation Authority (MBT) - Chief Operating Officer Massachusetts Bay Transportation Authority (MBT).,neutral,False
2026-07-07,Ryan Coholan,MBTA,MBTA COO Ryan Coholan talks South Coast Rail from ...,https://www.heraldnews.com/picture-gallery/news/2026/03/24/mbta-coo-ryan-coholan-talks-south-coast-rail-from-boston-to-fall-river/89294351007/,3.0,"MBTA Chief Operating Officer Ryan Coholan operates a commuter rail train at South Station, Boston, on March 10, 2026. Dan Medeiros.",neutral,False
2026-07-07,Ryan Coholan,MBTA,Conversation with MBTA's COO Ryan Coholan,https://transitunplugged.com/transit-unplugged-podcast/ryan-coholan-mbta/,4.0,"With nearly 30 years of transit experience, Ryan talks about running one of America's largest transit systems and shares stories of MBTA's ...",neutral,False
2026-07-07,Ryan Coholan,MBTA,"Today, COO Ryan Coholan joined State Senator ...",https://www.instagram.com/p/DPWzqsCEoZw/?hl=en,5.0,"Today, COO Ryan Coholan joined State Senator @barryfinegoldma, State Representative Dave Robertson, Town of Wilmington officials, @mbta_cr, ...",positive,True
2026-07-07,Ryan Coholan,MBTA,The MBTA Advisory Board,https://mbtaadvisoryboard.org/wp-content/uploads/2024/04/MinutesMBTAAB-12-05-23APPROVED.pdf,6.0,Coholan is responsible for the operation of all MBTA modes. He was appointed. COO by General Manager Philip Eng in September 2023. Mr. Coholan introduced his ...,positive,True
2026-07-07,Ryan Coholan,MBTA,Cultivating Culture at the MBTA with COO Ryan Coholan,https://soundcloud.com/spilling-the-t-podcast/cultivating-culture-at-the-mbta-with-coo-ryan-coholan,7.0,"On this episode, Chief Operating Officer Ryan Coholan joins us to discuss his unique approach to leading Operations at the MBTA.",neutral,False
2026-07-07,Ryan Coholan,MBTA,Ryan Coholan Email & Phone Number | Chief Operating ...,https://contactout.com/Ryan-Coholan-7317711,8.0,1 experience icon. Chief Operating Officer at MBTA in September 2023 to Present · 2 experience icon. Chief Railroad Officer at MBTA in May 2014 to September 2023.,positive,False
2026-07-07,Monica Tibbits-Nutt,Massachusetts Bay Transportation Authority,Monica Tibbits-Nutt,https://www.massport.com/our-business/leadership/monica-tibbits-nutt,1.0,"Monica G. Tibbits-Nutt, is the Secretary and CEO of the Massachusetts Department of Transportation (MassDOT).",positive,True
2026-07-07,Monica Tibbits-Nutt,Massachusetts Bay Transportation Authority,Transportation Sec. Monica Tibbits-Nutt Stepping Down ...,https://mass.streetsblog.org/2025/10/16/rearranging-the-cabinet-transportation-sec-monica-tibbits-nutt-stepping-down-replaced-by-mbta-gm-phillip-eng,2.0,Secretary of Transportation Monica Tibbits-Nutt is leaving the Healey administration. Governor Maura Healey announced this morning in a ...,neutral,False
2026-07-07,Monica Tibbits-Nutt,Massachusetts Bay Transportation Authority,Governor Healey Appoints MBTA General Manager Phil ...,https://www.mass.gov/news/governor-healey-appoints-mbta-general-manager-phil-eng-as-interim-transportation-secretary,3.0,Highway Administrator Jonathan Gulliver promoted to Undersecretary of Transportation; Interim Secretary and GM Eng to hold media ...,neutral,False
2026-07-07,Monica Tibbits-Nutt,Massachusetts Bay Transportation Authority,A Conversation with MassDOT Secretary Monica Tibbits ...,https://members.naiopma.org/event-calendar/Details/a-conversation-with-massdot-secretary-monica-tibbits-nutt-and-mbta-general-manager-phillip-eng-1055406?sourceTypeId=EmailInvitation,4.0,"From Boston to Springfield and beyond, investments made in transportation increase access to travel options and improve roadway safety for all users, regardless ...",neutral,False
2026-07-07,Monica Tibbits-Nutt,Massachusetts Bay Transportation Authority,"Monica Tibbits-Nutt, FAICP, LEED AP BD C",https://www.linkedin.com/in/monica-tibbits-nutt,5.0,"Transportation Executive | Growth & Sales Leader | Strategic Client Advisor | Rail, Transit & Infrastructure · Transportation executive and growth leader ...",positive,True
2026-07-07,Monica Tibbits-Nutt,Massachusetts Bay Transportation Authority,"MassDOT secretary Tibbits-Nutt steps down, MBTA chief ...",https://www.reddit.com/r/boston/comments/1o876bw/massdot_secretary_tibbitsnutt_steps_down_mbta/,6.0,She lost my respect after she admitted she was driven to work every day despite living near an MBTA commuter rail because an MBTA pass “was ...,neutral,False
2026-07-07,Monica Tibbits-Nutt,Massachusetts Bay Transportation Authority,MassFiscal Responds to Departure of Transportation ...,https://www.massfiscal.org/massfiscal-responds-departure-monica-tibbits-nutt,7.0,Tibbits-Nutt Exit is “Long Overdue”. The Massachusetts Fiscal Alliance today responded to news that Secretary of Transportation Monica ...,neutral,False
2026-07-07,Monica Tibbits-Nutt,Massachusetts Bay Transportation Authority,Massachusetts Governor Appoints Tibbits-Nutt as ...,https://acppubs.com/NEC/article/9F4D65EF-massachusetts-governor-appoints-tibbits-nutt-as-secretary-of-transportation,8.0,"BOSTON, MA — Governor Maura T. Healey announces that she is appointing Monica Tibbits-Nutt, AICP, LEED AP BD+C as Secretary of the Massachusetts Department ...",neutral,False
2026-07-07,Monica Tibbits-Nutt,Massachusetts Bay Transportation Authority,"Monica G. Tibbits-Nutt, AICP, LEED AP BD+C",https://youthengagementplanning.com/monica,9.0,"Monica works in transportation planning, urban design, and transit equity. She is the Secretary of Transportation for the State of Massachusetts.",neutral,False
2026-07-07,Randy Clarke,Metrorail,Leadership,https://www.wmata.com/about/leadership.html,1.0,Randy Clarke joined WMATA as General Manager and CEO in July 2022. He's not just Metro's GM/CEO; he's also a customer who uses the service every day.,positive,True
2026-07-07,Randy Clarke,Metrorail,Randy Clarke (@wmataGM) / Posts / X,https://x.com/wmataGM?lang=en,2.0,"Randy Clarke (@wmataGM) - Posts - Proudly leading the @wmata team (America's Metro System) as General Manager & CEO. Also on IG, in.",positive,True
2026-07-07,Randy Clarke,Metrorail,Randy Clarke,https://en.wikipedia.org/wiki/Randy_Clarke,3.0,Randy Clarke (born 1977) is a Canadian-American transit executive who has served as the general manager and CEO of Washington Metropolitan Area Transit ...,neutral,False
2026-07-07,Randy Clarke,Metrorail,A Conversation with WMATA General Manager and CEO ...,https://web.mcccmd.com/events/eventdetail.aspx?eventid=779,4.0,"Our special guest is Randy Clarke, General Manager and CEO of the Washington Metro Area Transit Authority (WMATA). WMATA is our region's transit service ...",neutral,False
2026-07-07,Randy Clarke,Metrorail,"Washington Metro's Fast-Moving, Hard-Charging Transit ...",https://www.governing.com/transportation/washington-metros-fast-moving-hard-charging-transit-chief,5.0,"Randy Clarke, 46, joined the Washington Metropolitan Area Transit Authority as general manager last summer, after four years leading the ...",neutral,False
2026-07-07,Randy Clarke,Metrorail,Randy Clarke (@wmatagm),https://www.instagram.com/wmatagm/?hl=en,6.0,3.3K+ followers · 11 following · 72 posts · @wmatagm: “Chief transit customer advocate @metroforward”,positive,True
2026-07-07,Randy Clarke,Metrorail,Exclusive: Metro CEO Randy Clarke's message to Trump,https://www.axios.com/local/washington-dc/2026/05/18/randy-clarke-metro-gold-line-rfk-stadium,7.0,"Randy Clarke sees Metro's future in the Gold Line: A zippy, dedicated bus route from Georgetown to the new Commanders stadium.",positive,False
2026-07-07,Nora Leerhsen,Chicago Transit Authority,CTA Governance/Administration,https://www.transitchicago.com/governance/,1.0,"Nora joined the CTA in 2014 and is an 11-year public transit veteran. She is the first woman to lead the CTA in the agency's history. Under Nora's leadership, ...",positive,True
2026-07-07,Nora Leerhsen,Chicago Transit Authority,Nora Leerhsen,https://en.wikipedia.org/wiki/Nora_Leerhsen,2.0,"Nora Leerhsen is an American lawyer and executive who has served as the Acting President of the Chicago Transit Authority (CTA) since February 2025, replacing ...",neutral,False
2026-07-07,Nora Leerhsen,Chicago Transit Authority,"Nora Leerhsen - Acting President, Chicago Transit Authority",https://www.linkedin.com/in/nora-leerhsen-1ba38847,3.0,"Acting President, Chicago Transit Authority · Experience: Chicago Transit Authority · Education: University of Wisconsin Law School · Location: Greater ...",positive,True
2026-07-07,Nora Leerhsen,Chicago Transit Authority,Team | Chicago Transit Authority,https://www.ctabonds.com/chicago-transit-authority-il/about/our-team/i6552,4.0,"nleerhsen@transitchicago.com. Nora Leerhsen is acting president of the Chicago Transit Authority (CTA), one of the nation's largest public transit agencies ...",positive,True
2026-07-07,Nora Leerhsen,Chicago Transit Authority,Acting CTA chief lays out priorities after dodging fiscal cliff,https://www.chicagotribune.com/2026/02/02/acting-cta-chief-lays-out-priorities-after-dodging-fiscal-cliff/,5.0,"When she was named acting president of the Chicago Transit Authority, Nora Leerhsen made a call to the agency's first female train operator.",neutral,False
2026-07-07,Nora Leerhsen,Chicago Transit Authority,"Nora Leerhsen, Acting President, Chicago Transit Authority",https://www.cityclub-chicago.org/event/2/5742/nora-leerhsen-acting-president-chicago-t,6.0,"Upcoming events. Two Generations Rising Together: The Proof and Promise of Hope Chicago. Thursday, Jul 16, 2026",positive,False
2026-07-07,Nora Leerhsen,Chicago Transit Authority,"Meet CTA's Acting President, Nora Leerhsen ...",https://www.instagram.com/p/DFn5eJFTiIU/,7.0,"CTA Acting President Nora Leerhsen joined our amazing shop crews last week to help prep the 9th annual CTA Pride Train, which is now in service ...",positive,True
2026-07-07,Nora Leerhsen,Chicago Transit Authority,"Union criticizes CTA for ""leadership vacuum"" due to lack of ...",https://chi.streetsblog.org/2026/06/10/union-criticizes-cta-for-leadership-vacuum-due-to-lack-of-a-permanent-president-acting-president-leerhsen-touts-public-safety-progress,8.0,"As the CTA receives new funding and Acting President Nora Leerhsen touted progress on crime reduction, the transit agency is being ...",negative,False
2026-07-07,Monica Tibbits-Nutt,Boston T,Monica Tibbits-Nutt,https://www.massport.com/our-business/leadership/monica-tibbits-nutt,1.0,"Monica G. Tibbits-Nutt, is the Secretary and CEO of the Massachusetts Department of Transportation (MassDOT).",positive,True
2026-07-07,Monica Tibbits-Nutt,Boston T,Disgraced former Transportation Secretary Monica Tibbits ...,https://www.bostonherald.com/2026/01/07/disgraced-former-transportation-secretary-monica-tibbits-nutt-officially-off-state-payroll/,2.0,Former Transportation Secretary Monica Tibbits-Nutt is officially off the state employee payroll after resigning in disgrace in October and ...,negative,False
2026-07-07,Monica Tibbits-Nutt,Boston T,Transportation Sec. Monica Tibbits-Nutt Stepping Down ...,https://mass.streetsblog.org/2025/10/16/rearranging-the-cabinet-transportation-sec-monica-tibbits-nutt-stepping-down-replaced-by-mbta-gm-phillip-eng,3.0,Secretary of Transportation Monica Tibbits-Nutt is leaving the Healey administration. Governor Maura Healey announced this morning in a ...,neutral,False
2026-07-07,Monica Tibbits-Nutt,Boston T,"Monica Tibbits-Nutt made history as the first Queer, Black ...",https://www.linkedin.com/posts/lauren-melendez-53690475_monica-tibbits-nutt-made-history-as-the-first-activity-7301335136107720704-9AIP,4.0,"About Black Heritage Month, We wanted to reintroduce you to a prominent figure heading up Mass dot Transportation Secretary Monica Tibbetts, nut ...",positive,True
2026-07-07,Monica Tibbits-Nutt,Boston T,"Monica Tibbits-Nutt, FAICP, LEED AP BD C",https://www.linkedin.com/in/monica-tibbits-nutt,5.0,"Transportation Executive | Growth & Sales Leader | Strategic Client Advisor | Rail, Transit & Infrastructure · Transportation executive and growth leader ...",positive,True
2026-07-07,Monica Tibbits-Nutt,Boston T,Governor Healey Appoints Monica Tibbits-Nutt as ...,https://www.mass.gov/news/governor-healey-appoints-monica-tibbits-nutt-as-secretary-of-transportation,6.0,Governor Maura T. Healey today announced that she is appointing Monica Tibbits-Nutt as Secretary of the Massachusetts Department of Transportation (MassDOT) ...,neutral,False
2026-07-07,Monica Tibbits-Nutt,Boston T,"MassDOT secretary Tibbits-Nutt steps down, MBTA chief ...",https://www.reddit.com/r/boston/comments/1o876bw/massdot_secretary_tibbitsnutt_steps_down_mbta/,7.0,She lost my respect after she admitted she was driven to work every day despite living near an MBTA commuter rail because an MBTA pass “was ...,neutral,False
2026-07-07,Monica Tibbits-Nutt,Boston T,A Conversation with MassDOT Secretary Monica Tibbits ...,https://members.naiopma.org/event-calendar/Details/a-conversation-with-massdot-secretary-monica-tibbits-nutt-and-mbta-general-manager-phillip-eng-1055406?sourceTypeId=EmailInvitation,8.0,"From Boston to Springfield and beyond, investments made in transportation increase access to travel options and improve roadway safety for all users, regardless ...",neutral,False
2026-07-07,Monica Tibbits-Nutt,Boston T,MassFiscal Responds to Departure of Transportation ...,https://www.massfiscal.org/massfiscal-responds-departure-monica-tibbits-nutt,9.0,Tibbits-Nutt Exit is “Long Overdue”. The Massachusetts Fiscal Alliance today responded to news that Secretary of Transportation Monica ...,neutral,False
2026-07-07,Ryan Coholan,Boston T,Ryan Coholan - Chief Operating Officer at MBTA,https://www.linkedin.com/in/ryan-coholan-139014ab,1.0,Experienced Chief Operating Officer with a demonstrated history of working in the transportation/trucking/railroad industry.,positive,True
2026-07-07,Ryan Coholan,Boston T,MBTA COO Ryan Coholan talks South Coast Rail from ...,https://www.heraldnews.com/picture-gallery/news/2026/03/24/mbta-coo-ryan-coholan-talks-south-coast-rail-from-boston-to-fall-river/89294351007/,2.0,"Ryan Coholan operates a commuter rail train outside South Station, headed from South Station, Boston, to Fall River on March 10, 2026.",neutral,False
2026-07-07,Ryan Coholan,Boston T,Ryan Coholan | CTHRU - Statewide Payroll - Mass.gov,https://cthrupayroll.mass.gov/?os=shmmfp&ref=app#!/year/2024/full_time_employees%2Cothers/pay1%2Cpay2%2Cpay3%2Cpay4/explore%2F0-0-0%2Ftrans_no%2F17915261%2F0%2Fdepartment_division,3.0,"Ryan Coholan - Massachusetts Bay Transportation Authority (MBT) - Chief Operating Officer. Total Pay $299,085 Annual Rate $303,850. Total Pay $ 299,085",neutral,False
2026-07-07,Ryan Coholan,Boston T,Conversation with MBTA's COO Ryan Coholan,https://transitunplugged.com/transit-unplugged-podcast/ryan-coholan-mbta/,4.0,"With nearly 30 years of transit experience, Ryan talks about running one of America's largest transit systems and shares stories of MBTA's ...",neutral,False
2026-07-07,Ryan Coholan,Boston T,Ryan Coholan - Chief Operating Officer at Massachusetts ...,https://www.zoominfo.com/p/Ryan-Coholan/11957181347,5.0,"Coholan is a Chief Operating Officer at Massachusetts Bay Transportation Authority. Coholan directs, plans, and supervises operations for a significant commuter ...",neutral,False
2026-07-07,Ryan Coholan,Boston T,The MBTA Advisory Board,https://mbtaadvisoryboard.org/wp-content/uploads/2024/04/MinutesMBTAAB-12-05-23APPROVED.pdf,6.0,"Ryan Coholan, the Chief Operating Officer (COO) of the MBTA to address the Board. holan is responsible for the operation of all MBTA modes. Eng in September ...",neutral,False
2026-07-07,Ryan Coholan,Boston T,Cultivating Culture at the MBTA with COO Ryan Coholan,https://soundcloud.com/spilling-the-t-podcast/cultivating-culture-at-the-mbta-with-coo-ryan-coholan,7.0,"On this episode, Chief Operating Officer Ryan Coholan joins us to discuss his unique approach to leading Operations at the MBTA.",neutral,False
2026-07-07,Ryan Coholan,Boston T,Inside the MBTA's secret underground emergency training ...,https://www.boston25news.com/news/local/inside-mbtas-secret-underground-emergency-training-center/6QHTBBUMZFFWNJOGVGQHHDUG4E/,8.0,"“I think your average commuter doesn't even know this facility exists,” said MBTA Chief Operating Officer Ryan Coholan. The facility is the ...",negative,False
2026-07-07,Randy Clarke,DC Metro,Randy Clarke,https://en.wikipedia.org/wiki/Randy_Clarke,1.0,Randy Clarke (born 1977) is a Canadian-American transit executive who has served as the general manager and CEO of Washington Metropolitan Area Transit ...,neutral,False
2026-07-07,Randy Clarke,DC Metro,Leadership,https://www.wmata.com/about/leadership.html,2.0,Randy Clarke joined WMATA as General Manager and CEO in July 2022. He's not just Metro's GM/CEO; he's also a customer who uses the service every day.,positive,True
2026-07-07,Randy Clarke,DC Metro,Randy Clarke (@wmataGM) / Posts / X,https://x.com/wmataGM?lang=en,3.0,"Randy Clarke (@wmataGM) - Posts - Proudly leading the @wmata team (America's Metro System) as General Manager & CEO. Also on IG, in.",positive,True
